{
  "author": {
    "id": "10K-Digital",
    "display_name": "10K Digital",
    "avatar_url": "https://avatars.githubusercontent.com/u/206855844?v=4"
  },
  "marketplaces": [
    {
      "name": "10k-digital",
      "version": null,
      "description": "Official Claude Code plugins from 10K Digital",
      "repo_full_name": "10K-Digital/lovable-claude-code",
      "repo_url": "https://github.com/10K-Digital/lovable-claude-code",
      "repo_description": "Ever wanted to use Claude Code to edit projects in Lovable? Wait no further. This repo has a plug-in with Claude Code that lets it edit projects on Lovable via Github sync and browser automation.",
      "signals": {
        "stars": 4,
        "forks": 0,
        "pushed_at": "2026-01-06T01:56:27Z"
      },
      "files": {
        ".claude-plugin/marketplace.json": "{\n  \"name\": \"10k-digital\",\n  \"owner\": {\n    \"name\": \"10K Digital\"\n  },\n  \"metadata\": {\n    \"description\": \"Official Claude Code plugins from 10K Digital\"\n  },\n  \"plugins\": [\n    {\n      \"name\": \"lovable\",\n      \"source\": \"plugins/lovable/\",\n      \"description\": \"Claude Code integration for Lovable.dev projects. Provides commands, skills, and context for working with Lovable projects via two-way GitHub sync, with integrations with Lovable Cloud's native Edge Functions, database migrations, and backend deployments. Now with Project Structure Map for faster navigation!\",\n      \"version\": \"1.7.0\",\n      \"author\": {\n        \"name\": \"Felipe Matos from 10K Digital\"\n      },\n      \"homepage\": \"https://github.com/10K-Digital/lovable-claude-code\",\n      \"repository\": \"https://github.com/10K-Digital/lovable-claude-code\",\n      \"license\": \"MIT\"\n    }\n  ]\n}\n",
        "README.md": "# üöÄ Lovable + Claude Code = Superpowers\n\n## **Edit Lovable Projects 10x Faster‚ÄîWithout Leaving Your IDE**\n\nStop copy-pasting between Lovable and Claude. Stop wrestling with two-way sync. Stop burning through API credits for simple changes.\n\n**The Lovable Claude Code plugin brings the power of your IDE directly to your Lovable projects.** Edit code with AI assistance, deploy automatically, and let Claude Code handle all the complexity of syncing with Lovable Cloud.\n\n### **What You Get:**\n\n‚ú® **Edit Lovable projects right in your IDE** with all of Claude Code's power\nüó∫Ô∏è **Project Structure Map** - Claude navigates your codebase faster (NEW in v1.7.0!)\n‚ö° **Auto-push to GitHub** - automatic commit and push after every task\nüöÄ **Auto-deploy to Lovable** - no manual commands needed\nü§ñ **Complete workflow automation** - from code changes to production\nüí∞ **Save credits** by using your Claude subscription for heavy lifting\nüîÑ **Zero friction syncing** - between your code, GitHub, and Lovable Cloud\nüõ°Ô∏è **Automatic secret detection** - never forget a required API key\n‚ö° **Instant setup** - generates project context automatically\n‚úÖ **Verification built-in** - tests run after every deployment\n\n---\n\n## **The Problem You're Solving**\n\nWorking with Lovable is amazing... until it's not:\n\n- üò§ **Context switching pain** - Lovable UI for backend, IDE for frontend, back and forth endlessly\n- üí∏ **Credit drain** - Lovable charges for what Claude Code can do cheaper (via your subscription)\n- ü§∑ **Sync confusion** - \"What syncs automatically? What needs manual deployment?\" Constantly unsure\n- ‚è±Ô∏è **Manual workflows** - Copy prompt ‚Üí Paste into Lovable ‚Üí Wait for response ‚Üí Repeat\n- üîë **Secret chaos** - Tracking which secrets each function needs, which ones you set up, which ones are missing\n- üêõ **Deploy blind** - No automated tests after deployment. Hope it works!\n\n**This plugin eliminates every single one of these friction points.**\n\n---\n\n## **How It Works (In 90 Seconds)**\n\n### **1Ô∏è‚É£ One-Time Setup**\n```bash\n/lovable:init\n```\nClaude Code scans your project, asks a few questions, and generates `CLAUDE.md` with all the context it needs.\n\n### **2Ô∏è‚É£ Make Your Changes**\nEdit code in your IDE like normal. Claude Code with AI handles the complex stuff.\n\n### **3Ô∏è‚É£ Automatic Everything**\n```bash\n/lovable:deploy-edge    # Deploy to Lovable\n/lovable:sync           # Keep secrets/config in sync\n```\n\nThat's it. No manual prompts. No context switching. No forgotten steps.\n\n---\n\n## **Real Workflows**\n\n### **üéØ Manual Mode (Full Control)**\n```\nYou: \"Add email notifications to the send-email function\"\n     ‚Üì\nClaude Code: Creates the code\n             ‚Üì\nShows you: \"Deploy with this prompt: 'Deploy the send-email edge function'\"\n           Plus: \"‚ö†Ô∏è Needs RESEND_API_KEY\"\n           ‚Üì\nYou: Copy-paste prompt to Lovable (takes 10 seconds)\nResult: ‚úÖ Function deployed, tests pass, you're informed\n```\n\n### **üöÄ Yolo Mode (Full Automation)**\n```\nYou: \"Add email notifications\"\n     ‚Üì\nClaude Code: Creates the code, detects needed secrets\n        ‚úÖ Automatically commits changes\n        ‚úÖ Pushes to GitHub\n             ‚Üì\nClaude: ü§ñ Detects backend changes automatically\n        ü§ñ Navigates to Lovable\n        ‚úÖ Submits deployment\n        ‚úÖ Runs verification tests\n        ‚úÖ Confirms success\n\nDone. Zero manual work. No git commands. No deploy commands!\n```\n\n**IMPROVED in v1.5.0:** Hook-based auto-push for 100% reliable automatic commits and pushes!\n**NEW in v1.3.0:** With auto-deploy enabled, Claude automatically deploys to Lovable after git push!\n\n---\n\n## **Key Features That Save You Hours**\n\n### ‚ö° **Auto-Sync & Auto-Push** (Hook-Based in v1.5.0!)\nUsing Claude Code hooks for seamless GitHub integration - always in sync, always up-to-date, 100% reliable!\n\n**Auto-Sync (Start Hook):**\n```\nClaude starts ‚Üí Hook pulls latest ‚Üí You work on current code ‚Üí No conflicts!\n```\nAutomatically pulls latest changes from GitHub when Claude starts working. Only runs on main branch with no uncommitted changes.\n\n**Auto-Push (Stop Hook):**\n```\nMake changes ‚Üí Task complete ‚Üí Hook triggers ‚Üí Auto-commit ‚Üí Auto-push ‚Üí Changes in GitHub!\n```\nAutomatically commits and pushes when Claude finishes any task. No manual git commands!\n\n**Why hooks?** Hooks guarantee execution every time, making sync operations more reliable than skill-based approaches. Auto-sync keeps you current, auto-push keeps GitHub current!\n\n### üöÄ **Auto-Deploy to Lovable** (v1.3.0)\nPush backend changes to main, and Claude automatically deploys to Lovable. No commands, no copy-paste, no context switching.\n\n```\nAuto-push to GitHub ‚Üí Claude detects changes ‚Üí Automatic deployment ‚Üí Tests pass ‚Üí Done!\n```\n\n**Complete automation:** With both features enabled, Claude handles everything from code changes to production deployment!\n\n### üîê **Smart Secret Detection**\nClaude Code automatically finds every secret your functions need‚Äîby scanning your code. No more \"why is this function failing??\"‚Äîwe tell you upfront: \"You need STRIPE_WEBHOOK_SECRET.\"\n\n### üîÑ **Automatic Sync Command**\nTeam member added a secret in Lovable Cloud? Run `/lovable:sync` and it updates your project config. No more getting out of sync.\n\n### ‚ö° **Auto-Run Tests**\nEnable tests to run automatically after every deployment. Catch issues in seconds, not after users report bugs.\n\n### üìä **Secret Status Dashboard**\nCLAUDE.md shows exactly which secrets are configured (‚úÖ) and which need setup (‚ö†Ô∏è). One glance tells you if you're ready to deploy.\n\n### üéØ **Context Everything**\nClaude Code knows your production URL, database tables, edge functions, secrets, and conventions. Ask it anything about your project‚Äîit already knows.\n\n---\n\n## **Installation (2 Minutes)**\n\n### **Option 1: Via Marketplace (Recommended)**\n\n```bash\n# In Claude Code, run:\n/plugin marketplace add 10K-Digital/lovable-claude-code\n\n# Install the plugin:\n/plugin install lovable@10k-digital\n```\n\nüí° **Tip:** Enable auto-updates in Claude Code settings so you always get the latest version automatically.\n\n### **Option 2: Local Installation**\n\nClone or download this repo, then:\n```bash\ncp -r lovable-plugin/.claude-plugin your-project/.claude-plugin\ncp -r lovable-plugin/commands your-project/.claude/commands\ncp -r lovable-plugin/skills your-project/.claude/skills\n```\n\n### **Option 3: Requirements Check** ‚úì\n\nBefore you start, make sure you have:\n- ‚úÖ Your Lovable project with GitHub sync enabled ([docs](https://docs.lovable.dev/integrations/github#about-github))\n- ‚úÖ Claude Code configured with your GitHub repo\n- ‚úÖ (Optional) [Claude in Chrome extension](https://chrome.google.com/webstore/detail/claude/pebppomjfocnoigkeepgbmcifnnlndla) for yolo mode\n\n---\n\n## **Your First 5 Minutes**\n\n```bash\n# 1. Initialize your project\n/lovable:init\n\n# 2. Answer the questions (1 minute)\n#    - What's your production URL?\n#    - Enable yolo mode? (recommended!)\n#    - etc.\n\n# 3. Start coding!\n# Claude Code now knows everything about your project\n\n# 4. Push your changes:\ngit push origin main\n# With yolo mode on: Auto-deploys backend changes!\n# No /deploy-edge command needed\n\n# 5. Keep in sync:\n/lovable:sync\n# Updates CLAUDE.md with latest secrets/config\n```\n\n---\n\n## **Commands at a Glance**\n\n| Command | What It Does | When To Use |\n|---------|-------------|-----------|\n| `/lovable:init` | Set up your project | First time setup |\n| `/lovable:map` | Generate Project Structure Map | Help Claude navigate faster (NEW!) |\n| `/lovable:sync` | Refresh config from Lovable Cloud | After team adds secrets/functions |\n| `/lovable:deploy-edge` | Deploy edge functions | After code changes (or auto with yolo) |\n| `/lovable:apply-migration` | Apply database migrations | After DB changes (or auto with yolo) |\n| `/lovable:yolo on/off` | Toggle automation + auto-deploy | Configure how you work |\n\n**Pro tip:** With yolo mode on, you don't need `/deploy-edge`‚Äîjust `git push` and it deploys automatically!\n\n---\n\n## **Before & After: Real Time Savings**\n\n### **Without This Plugin:**\n```\n1. Make changes in Claude Code (5 min)\n2. Copy prompt to clipboard (1 min)\n3. Switch to browser, open Lovable (1 min)\n4. Paste prompt in chat (1 min)\n5. Wait for response (2 min)\n6. Manually verify (2 min)\n7. Switch back to IDE (1 min)\nTotal: 13 minutes\n```\n\n### **With This Plugin (Manual Mode):**\n```\n1. Make changes in Claude Code (5 min)\n2. Copy one-line prompt (30 sec)\n3. Paste into Lovable (30 sec)\nTotal: 6 minutes\n= **54% time savings**\n```\n\n### **With This Plugin (Yolo Mode + Auto-Push + Auto-Deploy):**\n```\n1. Make changes in Claude Code (5 min)\n   ‚Üí Auto-commits changes\n   ‚Üí Auto-pushes to GitHub\n   ‚Üí Auto-detects backend changes\n   ‚Üí Auto-deploys to Lovable\n   ‚Üí Auto-runs tests\nTotal: 5 minutes\n= **62% time savings** + **ZERO manual commands needed**\n```\n\n---\n\n## **Advanced Features**\n\n### **Yolo Mode (Complete Automation)**\n```bash\n/lovable:yolo on                    # Enable everything: auto-push, auto-deploy, testing (recommended)\n/lovable:yolo on --no-auto-push     # Require manual git commands\n/lovable:yolo on --no-auto-deploy   # Require manual /deploy-edge commands\n/lovable:yolo on --no-testing       # Skip tests to go faster\n/lovable:yolo on --debug            # See automation logs\n/lovable:yolo off                   # Disable automation\n```\n\n**Auto-Push (Hook-Based in v1.5.0):**\nUsing a Claude Code hook, after completing each task the plugin automatically:\n- Checks for file changes\n- Commits with descriptive message\n- Pushes to main branch on GitHub\n- **More reliable:** Hooks guarantee execution vs. Claude remembering to check\n\n**Auto-Deploy (v1.3.0):**\nWith auto-deploy enabled, after git push Claude automatically:\n- Detects backend file changes (edge functions, migrations)\n- Navigates to your Lovable project\n- Submits deployment prompts\n- Runs verification tests (3 levels)\n- Reports success/failure instantly\n\n**Complete automation:** Enable both for a fully automated workflow from code changes to production!\n\nUse `--no-auto-push` or `--no-auto-deploy` if you prefer manual control.\n\n### **Sync Command (Stay In Sync)**\n```bash\n/lovable:sync                       # Interactive (show changes, ask)\n/lovable:sync --apply              # Auto-apply changes\n/lovable:sync --dry-run            # Preview changes\n/lovable:sync --manual             # Manual entry mode\n/lovable:sync --debug              # Show detailed logs\n```\n\nUse this when:\n- Team members add secrets in Lovable Cloud\n- New functions are created\n- You want to verify everything is aligned\n\n---\n\n## **The Math: Why This Plugin Pays for Itself**\n\n- **Time saved per deployment:** ~7 minutes\n- **Deployments per week (average project):** 5-10\n- **Hours saved per week:** 0.6-1.2 hours\n- **Hours saved per year:** 30-60 hours\n\nThat's **a full week of work back in your pocket every year.**\n\nPlus: No more mistakes from copy-paste errors. No more forgotten secrets. No more \"wait, did I deploy that?\"\n\n---\n\n## **Troubleshooting**\n\n**Plugin not updating?**\n- Make sure marketplace auto-updates are enabled in Claude Code\n- Or manually: `/plugin marketplace remove 10K-Digital/lovable-claude-code` then re-add\n\n**Automation timing out?**\n- Use manual mode: `/lovable:sync --manual`\n- Or try again later (might be network/browser issue)\n\n**Secrets not detected?**\n- Run `/lovable:sync` to force a rescan\n- Check that secrets use `Deno.env.get(\"SECRET_NAME\")` pattern\n\n---\n\n## **What Gets Synced Automatically**\n\n| What | Auto-Syncs | Next Step |\n|------|-----------|-----------|\n| React components | ‚úÖ Yes | Just push to GitHub |\n| Styling/CSS | ‚úÖ Yes | Just push to GitHub |\n| Edge Function code | ‚ö†Ô∏è Partially | Also run `/lovable:deploy-edge` |\n| Database migrations | ‚ö†Ô∏è Partially | Also run `/lovable:apply-migration` |\n| New tables | ‚ùå No | Use Lovable Cloud UI |\n| RLS policies | ‚ùå No | Use Lovable Cloud UI |\n| Secrets | ‚ùå No | Use Lovable Cloud UI |\n\n---\n\n## **Technical Details (For The Curious)**\n\n### **How It Works Under the Hood**\n\nThis plugin provides:\n\n**üéØ Commands** (`/lovable:*`)\n- Interactive setup that scans your codebase\n- Deployment helpers for Edge Functions and migrations\n- Sync utility to keep config in sync with Lovable Cloud\n\n**üß† Skills**\n- Lovable integration patterns (what syncs, what doesn't)\n- Secret detection algorithms (scans code for env vars)\n- Yolo mode automation (browser automation workflows)\n\n**üìã Config Generation**\n- Creates `CLAUDE.md` with project context\n- Tracks secrets and their status\n- Stores yolo mode preferences\n\n### **Architecture**\n\n```\nYour IDE (Claude Code)\n    ‚Üì\nlovable-claude-code plugin\n    ‚îú‚îÄ Scans your codebase\n    ‚îú‚îÄ Detects secrets & functions\n    ‚îú‚îÄ Generates exact Lovable prompts\n    ‚îî‚îÄ Optionally auto-executes via browser\n    ‚Üì\nGitHub (two-way sync)\n    ‚Üì\nLovable Cloud (deploys)\n```\n\n### **Security & Privacy**\n\n- ‚úÖ No credentials stored in the plugin\n- ‚úÖ All automation is transparent (you see what's happening)\n- ‚úÖ Manual fallback always available\n- ‚úÖ Open source ([github.com/10K-Digital/lovable-claude-code](https://github.com/10K-Digital/lovable-claude-code))\n\n### **Browser Automation Details**\n\nYolo mode uses the [Claude in Chrome extension](https://chrome.google.com/webstore/detail/claude/pebppomjfocnoigkeepgbmcifnnlndla) to:\n- Navigate to your Lovable project\n- Interact with the chat interface\n- Submit deployment prompts\n- Monitor for success\n\n**Note:** Always has manual fallback if anything goes wrong.\n\n---\n\n## **Files Generated**\n\nAfter running `/lovable:init`, your project gets:\n\n```\nyour-project/\n‚îú‚îÄ‚îÄ CLAUDE.md              # Project configuration (edit this!)\n‚îÇ   ‚îú‚îÄ‚îÄ Production URL\n‚îÇ   ‚îú‚îÄ‚îÄ Secrets table (with status)\n‚îÇ   ‚îú‚îÄ‚îÄ Edge Functions list\n‚îÇ   ‚îú‚îÄ‚îÄ Database tables\n‚îÇ   ‚îú‚îÄ‚îÄ Project conventions\n‚îÇ   ‚îî‚îÄ‚îÄ Yolo mode settings\n‚îî‚îÄ‚îÄ ... your regular code\n```\n\nEdit `CLAUDE.md` to customize anything‚ÄîClaude Code reads and respects your configuration.\n\n---\n\n## **Version History**\n\n**v1.7.0** (Latest) ‚≠ê\n- **Project Structure Map** - Claude navigates your codebase faster!\n  - New `/lovable:map` command for generating/updating maps\n  - Integrated into `/lovable:init` (optional question)\n  - Use `/lovable:sync --refresh-map` to update\n  - ~60 line map with directory tree, key files, patterns\n- **Multi-plugin architecture** - repository restructured for future plugins\n  - Plugin files now in `plugins/lovable/`\n  - Marketplace can host multiple plugins\n  - No changes needed for existing users\n\n**v1.4.1**\n- **Auto-push independence** - works separately from yolo mode!\n- Auto-push can be ON while yolo mode is OFF (manual deployment)\n- Yolo mode requires auto-push (enforced when enabling)\n- Clearer configuration and mental model\n\n**v1.4.0**\n- **Auto-push to GitHub** - automatic commit and push after task completion!\n- Complete workflow automation when combined with yolo mode\n- Smart commit messages following your project's style\n\n**v1.3.0**\n- **Auto-deploy after git push** - no manual commands needed!\n- New `--auto-deploy` / `--no-auto-deploy` flags\n- Improved graceful fallbacks\n- Order-aware deployment (migrations before functions)\n\n**v1.2.0**\n- Enhanced secret detection with browser automation\n- New `/lovable:sync` command\n- Auto-run tests support\n- Better init flow\n\n**v1.1.0**\n- Yolo mode (automated deployments)\n- Initial commands and skills\n\nSee [CHANGELOG.md](CHANGELOG.md) for full details.\n\n---\n\n## **License**\n\nMIT‚ÄîUse it however you want.\n\n## **Contributing**\n\nFound a bug? Have a feature request?\nüëâ [Open an issue](https://github.com/10K-Digital/lovable-claude-code/issues)\n\n---\n\n## **Made With ‚ù§Ô∏è by 10K Digital**\n\nQuestions? [GitHub Issues](https://github.com/10K-Digital/lovable-claude-code/issues)\n"
      },
      "plugins": [
        {
          "name": "lovable",
          "source": "plugins/lovable/",
          "description": "Claude Code integration for Lovable.dev projects. Provides commands, skills, and context for working with Lovable projects via two-way GitHub sync, with integrations with Lovable Cloud's native Edge Functions, database migrations, and backend deployments. Now with Project Structure Map for faster navigation!",
          "version": "1.7.0",
          "author": {
            "name": "Felipe Matos from 10K Digital"
          },
          "homepage": "https://github.com/10K-Digital/lovable-claude-code",
          "repository": "https://github.com/10K-Digital/lovable-claude-code",
          "license": "MIT",
          "categories": [],
          "install_commands": [
            "/plugin marketplace add 10K-Digital/lovable-claude-code",
            "/plugin install lovable@10k-digital"
          ]
        }
      ]
    }
  ]
}