{
  "author": {
    "id": "1broseidon",
    "display_name": "George Dikeakos",
    "avatar_url": "https://avatars.githubusercontent.com/u/20682970?u=88fdef1391e331a257726ff48bc47162825b64ad&v=4"
  },
  "marketplaces": [
    {
      "name": "marketplace",
      "version": null,
      "description": "Curated collection of Claude Code plugins for fullstack development teams",
      "repo_full_name": "1broseidon/marketplace",
      "repo_url": "https://github.com/1broseidon/marketplace",
      "repo_description": "Curated collection of Claude Code plugins for fullstack development teams",
      "signals": {
        "stars": 1,
        "forks": 0,
        "pushed_at": "2025-10-10T18:20:33Z"
      },
      "files": {
        ".claude-plugin/marketplace.json": "{\n  \"name\": \"marketplace\",\n  \"owner\": {\n    \"name\": \"George Dikeakos\",\n    \"email\": \"george@dikeakos.me\"\n  },\n  \"metadata\": {\n    \"description\": \"Curated collection of Claude Code plugins for fullstack development teams\",\n    \"version\": \"1.0.0\"\n  },\n  \"plugins\": [\n    {\n      \"name\": \"fullstack-dev-team\",\n      \"source\": \"./fullstack-dev-team\",\n      \"description\": \"Complete fullstack development team with specialized agents for frontend, backend, code review, QA, documentation, and UX design\",\n      \"version\": \"1.0.0\",\n      \"author\": {\n        \"name\": \"Development Team\"\n      },\n      \"license\": \"MIT\",\n      \"keywords\": [\n        \"fullstack\",\n        \"development\",\n        \"frontend\",\n        \"backend\",\n        \"qa\",\n        \"code-review\",\n        \"documentation\",\n        \"ux-design\"\n      ],\n      \"category\": \"development\"\n    }\n  ]\n}\n",
        "README.md": "# Claude Code Fullstack Dev Marketplace\n\nA curated collection of Claude Code plugins for fullstack development teams.\n\n## Overview\n\nThis marketplace provides a comprehensive suite of specialized agents and commands designed to support fullstack development workflows. The plugins are organized to support different team compositions, starting with a complete fullstack team.\n\n## Available Plugins\n\n### Fullstack Dev Team\n\nA complete development team with specialized agents covering the entire software development lifecycle.\n\n**Agents:**\n- **Frontend Engineer**: Modern frontend specialist for React/Next.js, Vue/Nuxt, and Svelte with Tailwind 4\n- **Backend Engineer**: Backend specialist with Go as primary, Node.js as secondary, and Python when specified\n- **Code Reviewer**: Code quality gatekeeper providing thorough reviews with specific feedback\n- **QA Agent**: Quality assurance and testing specialist for systematic testing\n- **Docs Maintainer**: Documentation and API specification maintainer with lazy documenter mindset\n- **UX Designer**: Framework-agnostic UX/UI design specialist making user-centered design decisions\n\n**Commands:**\n- **orchestrate**: Coordinate complex multi-agent workflows\n- **code-review**: Delegate comprehensive code review to the code-reviewer agent\n\n## Installation\n\nAdd the marketplace and install the fullstack dev team in one command:\n\n```bash\n/plugin marketplace add 1broseidon/marketplace\n/plugin install fullstack-dev-team\n```\n\nThat's it! All 6 agents and 2 commands are now available, along with Context7 MCP integration for automatic library documentation.\n\n## Roadmap\n\nFuture marketplace variations:\n\n- **Frontend-Only Marketplace**: Frontend engineer, UX designer, and frontend-focused QA\n- **Backend-Only Marketplace**: Backend engineer, API documentation, and backend testing\n- **DevOps Marketplace**: Infrastructure, deployment, and monitoring specialists\n- **Mobile Dev Marketplace**: iOS, Android, and cross-platform development teams\n\n## Project Structure\n\n```\n.claude-plugin/\n└── marketplace.json              # Marketplace manifest\n\nfullstack-dev-team/               # Plugin at root level\n├── .claude-plugin/\n│   └── plugin.json               # Plugin manifest\n├── agents/                       # Specialized agents\n│   ├── frontend-engineer.md\n│   ├── backend-engineer.md\n│   ├── code-reviewer.md\n│   ├── qa-agent.md\n│   ├── docs-maintainer.md\n│   └── ux-designer.md\n└── commands/                     # Workflow commands\n    ├── orchestrate.md\n    └── code-review.md\n```\n\n## Contributing\n\nTo add new plugins or improve existing ones:\n\n1. Create a new plugin directory at the repository root\n2. Add `.claude-plugin/plugin.json` manifest inside your plugin\n3. Add agent and command files\n4. Update the marketplace.json to include the new plugin\n5. Test locally before committing\n\n## License\n\nMIT\n"
      },
      "plugins": [
        {
          "name": "fullstack-dev-team",
          "source": "./fullstack-dev-team",
          "description": "Complete fullstack development team with specialized agents for frontend, backend, code review, QA, documentation, and UX design",
          "version": "1.0.0",
          "author": {
            "name": "Development Team"
          },
          "license": "MIT",
          "keywords": [
            "fullstack",
            "development",
            "frontend",
            "backend",
            "qa",
            "code-review",
            "documentation",
            "ux-design"
          ],
          "category": "development",
          "categories": [
            "backend",
            "code-review",
            "development",
            "documentation",
            "frontend",
            "fullstack",
            "qa",
            "ux-design"
          ],
          "install_commands": [
            "/plugin marketplace add 1broseidon/marketplace",
            "/plugin install fullstack-dev-team@marketplace"
          ]
        }
      ]
    }
  ]
}