{
  "author": {
    "id": "aaronmaturen",
    "display_name": "Aaron Maturen",
    "avatar_url": "https://avatars.githubusercontent.com/u/507070?u=08611b33a1c32041bbec074e5ed055d38ca776ec&v=4"
  },
  "marketplaces": [
    {
      "name": "aaronmaturen-plugins",
      "version": null,
      "description": "Professional development workflow plugins with JIRA integration and MCP servers",
      "repo_full_name": "aaronmaturen/claude-plugin",
      "repo_url": "https://github.com/aaronmaturen/claude-plugin",
      "repo_description": null,
      "signals": {
        "stars": 1,
        "forks": 0,
        "pushed_at": "2026-02-20T11:48:49Z"
      },
      "files": {
        ".claude-plugin/marketplace.json": "{\n  \"name\": \"aaronmaturen-plugins\",\n  \"owner\": {\n    \"name\": \"Aaron Maturen\",\n    \"email\": \"aaron@example.com\",\n    \"url\": \"https://github.com/aaronmaturen\"\n  },\n  \"metadata\": {\n    \"description\": \"Professional development workflow plugins with JIRA integration and MCP servers\",\n    \"version\": \"1.0.0\"\n  },\n  \"plugins\": [\n    {\n      \"name\": \"atm\",\n      \"description\": \"Professional development workflow plugin with JIRA integration, PR review tools, and comprehensive MCP server configuration\",\n      \"version\": \"1.0.0\",\n      \"author\": {\n        \"name\": \"Aaron Maturen\",\n        \"url\": \"https://github.com/aaronmaturen\"\n      },\n      \"source\": {\n        \"source\": \"github\",\n        \"repo\": \"aaronmaturen/claude-plugin\"\n      },\n      \"keywords\": [\n        \"workflow\",\n        \"jira\",\n        \"git\",\n        \"pr-review\",\n        \"commit-messages\",\n        \"scaffolding\",\n        \"mcp\",\n        \"context7\"\n      ]\n    }\n  ]\n}\n",
        ".claude-plugin/plugin.json": "{\n  \"name\": \"atm\",\n  \"version\": \"1.0.0\",\n  \"description\": \"Professional development workflow plugin with JIRA integration, PR review tools, and comprehensive MCP server configuration\",\n  \"author\": {\n    \"name\": \"Aaron Maturen\",\n    \"url\": \"https://github.com/aaronmaturen\"\n  },\n  \"homepage\": \"https://github.com/aaronmaturen/claude-plugin\",\n  \"repository\": \"https://github.com/aaronmaturen/claude-plugin\",\n  \"license\": \"MIT\",\n  \"keywords\": [\n    \"workflow\",\n    \"jira\",\n    \"git\",\n    \"pr-review\",\n    \"commit-messages\",\n    \"scaffolding\",\n    \"mcp\",\n    \"context7\"\n  ],\n  \"commands\": \"./commands/\",\n  \"mcpServers\": {\n    \"Context7\": {\n      \"command\": \"npx\",\n      \"args\": [\"-y\", \"@upstash/context7-mcp\"]\n    }\n  }\n}\n",
        "README.md": "# atm\n\n_A Claude Code plugin and synchronization system for professional development workflows_\n\n[![Claude Plugin](https://img.shields.io/badge/Claude-Plugin-blue)](PLUGIN.md)\n[![License: MIT](https://img.shields.io/badge/License-MIT-yellow.svg)](LICENSE)\n\n## What Is This?\n\nNow available as a **Claude Code Plugin**! Get instant access to professional development workflows, JIRA integration, PR review tools, and powerful MCP servers.\n\n`atm` is both:\n1. **A Claude Code Plugin** - Install via `/plugin install atm@github` for instant workflow commands\n2. **A Configuration Sync System** - Traditional shell integration for keeping settings synchronized across machines\n\nIn the beginning, there was chaos. Configuration files scattered across machines like socks in a cosmic dryer. Settings duplicated, aliases forgotten, and MCP servers living in blissful isolation. This was widely regarded as a bad move.\n\n## What It Actually Does\n\n### As a Plugin\n- **14 Workflow Commands**: `/commit-msg`, `/pr-review`, `/scaffold`, and more\n- **MCP Servers**: Pre-configured Context7 (documentation) and Serena (code analysis)\n- **JIRA Integration**: Ticket research and commit message generation\n- **PR Review Tools**: Comprehensive analysis with educational context\n- **Project Scaffolding**: Interactive setup for React, Next.js, Python, Go, Rust, and more\n\n### As a Sync System (Legacy)\n- **Alias Management**: Clever shortcuts to your PATH\n- **Configuration Sync**: Keep Claude config files synchronized across devices\n- **Security Hardening**: Distributed locking, atomic operations, rollback capabilities\n- **Dependency Management**: Automatic tool installation (homebrew, gh cli, jira-cli)\n\n## Prerequisites\n\n### For Plugin Installation\n- **Claude Code** - The Claude CLI tool\n- **Optional**: `gh` (GitHub CLI) for PR commands\n- **Optional**: `jira` (JIRA CLI) for JIRA integration\n- **Optional**: `uvx` for Serena MCP server\n\n### For Traditional Installation\n- **macOS or Linux** (Windows users, we feel your pain but haven't addressed it yet)\n- **Homebrew** (the install script will tell you how to get it)\n- **Git** (but you probably have this already)\n\n## Installation\n\n### As a Claude Code Plugin (Recommended)\n\nThe easiest way to use atm is as a Claude Code plugin:\n\n```bash\n# Add the marketplace\n/plugin marketplace add aaronmaturen/claude-plugin\n\n# Install the plugin\n/plugin install atm@aaronmaturen-plugins\n\n# Set up global rules (optional)\n/setup-rules\n```\n\n**Alternative: Install from local clone**\n\n```bash\n# Clone the repository\ngit clone https://github.com/aaronmaturen/claude-plugin.git\n\n# Install from local path\n/plugin install /path/to/claude-plugin\n```\n\nThis gives you instant access to all 15 workflow commands and pre-configured MCP servers.\n\nSee [PLUGIN.md](PLUGIN.md) for complete plugin documentation.\n\n### Traditional Installation (Legacy)\n\nFor shell integration and synchronization features:\n\n```bash\ngit clone https://github.com/aaronmaturen/claude-plugin.git\ncd claude-plugin\n./install.sh  # This script now exists and is, indeed, magnificent\n```\n\nThe installer will:\n- Check for required dependencies (and offer to install them)\n- Create backups of your existing configurations\n- Set up symlinks to keep everything synchronized\n- Add source lines to your shell configuration\n- Make you feel like a configuration wizard\n\n## Usage\n\n### Plugin Commands\n\nAll 14 workflow commands are available immediately after installation:\n\n```bash\n# Development Workflow\n/commit-msg              # Generate JIRA-linked commit messages\n/pr-review               # Comprehensive PR analysis\n/implement-pr-feedback   # Systematically implement PR feedback\n/self-review             # Self-code review before PR\n/jira                    # JIRA ticket research and planning\n\n# Code Analysis\n/arch-review             # Architecture review\n/simplify                # Code simplification\n/proof                   # Mathematical analysis\n/bug-investigation       # Systematic bug debugging\n/feature-investigation   # Feature requirement analysis\n/spike-investigation     # Technical spike research\n\n# Project Setup\n/scaffold                # Interactive project scaffolding\n\n# Session Management\n/clear                   # Session summary and context clearing\n/reflect                 # Conversation pattern analysis\n\n# Configuration\n/setup-rules             # Install global rules\n```\n\nSee [PLUGIN.md](PLUGIN.md) for detailed command documentation and examples.\n\n### Shell Commands (Legacy Installation)\n\n```bash\nclair-sync              # Pull latest configuration changes\nclair-sync --push -m \"message\"  # Push your changes to the repository\nclair-add-alias name 'command'  # Add a new alias\nclair-add-alias --edit  # Open aliases file in your editor\nclair-status            # Check synchronization status and health\n```\n\n## Project Structure\n\n```\nclaude-plugin/\n├── .claude-plugin/\n│   └── plugin.json     # Plugin manifest\n├── commands/           # Slash commands for plugin\n│   ├── *.md            # 14 workflow commands\n│   └── setup-rules.md  # Rules installation command\n├── claude/             # Legacy configuration directory\n│   ├── CLAUDE.md       # Main Claude instructions (references rule modules)\n│   ├── commands/       # Original commands (synced to /commands)\n│   ├── rules/          # Modular rule files\n│   │   ├── 01-general-instructions.md\n│   │   ├── 02-git-workflow.md\n│   │   ├── 03-available-tools.md\n│   │   ├── 04-project-specific.md\n│   │   └── 05-debugging-methodology.md\n│   ├── hooks/          # Post-tool-use hooks\n│   ├── mcp-servers.json # MCP server configuration\n│   └── settings.json   # Claude CLI settings\n├── bin/                # Utility scripts\n│   └── clair-mcp       # MCP server wrapper\n├── utilities           # Security and utility functions library\n├── clair-sync          # Synchronization command\n├── clair-add-alias     # Alias management command\n├── clair-status        # Status checking command\n├── install.sh          # Installation script with dependency checks\n├── PLUGIN.md           # Complete plugin documentation\n└── README.md           # This file\n```\n\n## Security Features\n\nBecause even configuration management deserves Fort Knox treatment:\n\n- **Distributed Locking**: Prevents concurrent operations from creating chaos\n- **Atomic File Operations**: Either it works completely or not at all\n- **Input Validation**: Sanitizes paths and validates alias names\n- **Rollback Capability**: Transaction logging for when things go sideways\n- **Backup Creation**: Unique timestamped backups before any changes\n\n## Customization\n\n### Adding New Rules\nCreate a new markdown file in `claude/rules/` and reference it in `claude/CLAUDE.md`.\n\n### Creating Custom Commands\nAdd a new `.md` file to `claude/commands/` following the existing patterns.\n\n### Modifying Hooks\nEdit the shell scripts in `claude/hooks/` to customize post-tool behavior.\n\n## The Philosophy\n\nWhy spend time manually copying configuration files when you could spend that time contemplating the nature of configuration itself? This tool frees you from the mundane task of synchronization, allowing you to focus on more important questions, like \"Why do we configure things at all?\" and \"Is my configuration truly mine, or merely a reflection of the universal configuration that binds us all?\"\n\n## Contributing\n\nIf you've found a bug, congratulations! You've discovered that perfection is a myth. Please file an issue so we can perpetuate the illusion of progress.\n\nIf you'd like to contribute code, remember: the best code is no code, but the second best code is someone else's code that works.\n\n## License\n\nThis software is provided \"as is\", which is to say it exists in a quantum superposition of working and not working until you actually run it.\n\n---\n\n_Remember: The answer to the ultimate question of configuration, synchronization, and everything is probably not 42, but we haven't ruled it out entirely._\n"
      },
      "plugins": [
        {
          "name": "atm",
          "description": "Professional development workflow plugin with JIRA integration, PR review tools, and comprehensive MCP server configuration",
          "version": "1.0.0",
          "author": {
            "name": "Aaron Maturen",
            "url": "https://github.com/aaronmaturen"
          },
          "source": {
            "source": "github",
            "repo": "aaronmaturen/claude-plugin"
          },
          "keywords": [
            "workflow",
            "jira",
            "git",
            "pr-review",
            "commit-messages",
            "scaffolding",
            "mcp",
            "context7"
          ],
          "categories": [
            "commit-messages",
            "context7",
            "git",
            "jira",
            "mcp",
            "pr-review",
            "scaffolding",
            "workflow"
          ],
          "install_commands": [
            "/plugin marketplace add aaronmaturen/claude-plugin",
            "/plugin install atm@aaronmaturen-plugins"
          ]
        }
      ]
    }
  ]
}