{
  "author": {
    "id": "alexanderop",
    "display_name": "Alexander Opalic",
    "avatar_url": "https://avatars.githubusercontent.com/u/33398393?u=4f196b8d1fe8a4b8f709cca24a55751f3ad07135&v=4"
  },
  "marketplaces": [
    {
      "name": "claude-code-builder",
      "version": null,
      "description": "Create skills, subagents, hooks, commands, and plugins for Claude Code",
      "repo_full_name": "alexanderop/claude-code-builder",
      "repo_url": "https://github.com/alexanderop/claude-code-builder",
      "repo_description": null,
      "signals": {
        "stars": 29,
        "forks": 3,
        "pushed_at": "2025-11-16T12:37:57Z"
      },
      "files": {
        ".claude-plugin/marketplace.json": "{\n  \"name\": \"claude-code-builder\",\n  \"owner\": {\n    \"name\": \"Alexander Opalic\"\n  },\n  \"plugins\": [\n    {\n      \"name\": \"claude-code-builder\",\n      \"source\": \"./\",\n      \"description\": \"Create skills, subagents, hooks, commands, and plugins for Claude Code\"\n    }\n  ]\n}\n",
        ".claude-plugin/plugin.json": "{\n  \"name\": \"claude-code-builder\",\n  \"version\": \"1.0.0\",\n  \"description\": \"Create skills, subagents, hooks, commands, and plugins for Claude Code\",\n  \"author\": {\n    \"name\": \"Alexander Opalic\",\n    \"url\": \"https://github.com/alexanderop/claude-code-builder\"\n  },\n  \"repository\": \"https://github.com/alexanderop/claude-code-builder\",\n  \"license\": \"MIT\"\n}\n",
        "README.md": "# Claude Code Builder\n\n> Build **skills**, **subagents**, **hooks**, **slash commands**, and **plugins** for Claude Code â€” fast, consistently, and with best practices baked in.\n\n[![License: MIT](https://img.shields.io/badge/License-MIT-informational.svg)](LICENSE)\n[![Status](https://img.shields.io/badge/status-stable-success.svg)](#)\n[![Works with](https://img.shields.io/badge/Claude%20Code-compatible-blue.svg)](#)\n\n---\n\n## Why this exists\n\nCreating high-quality Claude Code customizations involves repetitive scaffolding and convention wrangling. **Claude Code Builder** gives you guided commands that generate the right files, structure, and docs â€” so you can focus on logic, not boilerplate.\n\n---\n\n## Local Development & Release Flow\n\nFor local development, contributors open a PR against this repo.  \nWhen the PR is **merged into `main`**, the marketplace manifest already points to this repo, so **the plugin is live immediately** (no extra publish step). Reviews and approvals are handled by the maintainer.\n\n**Summary**\n\n1. Fork + branch  \n2. Implement changes  \n3. Open PR â†’ review  \n4. **Merge to `main` â†’ live in marketplace**\n\n---\n\n## Installation\n\n### Claude Code (via Plugin Marketplace)\n\n**1) Register the marketplace in Claude Code:**\n```bash\n/plugin marketplace add alexanderop/claude-code-builder\n````\n\n**2) Install the plugin from this marketplace:**\n\n```bash\n/plugin install claude-code-builder@claude-code-builder\n```\n\n### Verify Installation\n\n**Check that commands appear:**\n\n```bash\n/help\n# Should see:\n# /create-skill            - Create an auto-invoked Skill with best practices\n# /create-agent            - Create a subagent with focused role/tools\n# /create-command          - Generate a slash command (explicit invocation)\n# /create-hook             - Configure event-driven hooks (pre/post tool use, etc.)\n# /create-plugin           - Package a .claude/ setup into a plugin\n# /create-md               - Generate CLAUDE.md files (project awareness)\n# /create-output-style     - Create/activate custom Output Styles\n```\n\n> Tip: If commands donâ€™t appear, run `/help` again or restart Claude Code, then re-run the install command.\n\n---\n\n## What you can generate\n\n| Command                | Purpose (1-liner)                                                                 | Typical usage example                                                          |\n| ---------------------- | --------------------------------------------------------------------------------- | ------------------------------------------------------------------------------ |\n| `/create-skill`        | Scaffold a **model-invoked Skill** Claude auto-discovers from context.            | `/create-skill commit-helper \"Generate helpful git commit messages\"`           |\n| `/create-agent`        | Create a **subagent** with a focused role and optional tool/model settings.       | `/create-agent reviewer \"Expert code reviewer; use proactively after changes\"` |\n| `/create-command`      | Add a **slash command** for repeatable workflows you invoke explicitly.           | `/create-command analyze-deps \"Analyze dependencies for outdated packages\"`    |\n| `/create-hook`         | Configure **event hooks** (pre/post tool use, prompt submit, etc.) with JSON/CLI. | `/create-hook PreToolUse \"Bash\" \"jq -r '.tool_input.command' >> ~/.log\"`       |\n| `/create-plugin`       | Turn a `.claude/` setup into a **distributable plugin** with manifests.           | `/create-plugin`                                                               |\n| `/create-md`           | Generate root & nested **CLAUDE.md** files that teach Claude your project.        | `/create-md medium`                                                            |\n| `/create-output-style` | Create/activate **Output Styles** (stored system prompts) for different modes.    | `/create-output-style \"Teaching Assistant\" --project --description \"...\"`      |\n\n> Each command opens a guided flow and prints the exact files/paths it creates.\n\n---\n\n## Usage cheatsheet\n\n```bash\n# Skill (auto-invoked by Claude)\n#/create-skill [skill-name] \"[what it does and when to use it]\"\n/create-skill commit-helper \"Generate clear commit messages; use when committing or reviewing staged changes.\"\n\n# Subagent (focused role)\n#/create-agent [name] \"[when to invoke]\" [--tools ...] [--model ...]\n/create-agent reviewer \"Expert code reviewer; use proactively after code changes\" --tools \"Read,Grep,Glob\"\n\n# Slash command (explicit invocation)\n/create-command analyze-deps \"Analyze dependencies for outdated packages\"\n\n# Hook (automate on events)\n/create-hook PreToolUse \"Edit|Write\" \"python3 .scripts/block_sensitive_edits.py\"\n\n# Package your setup as a plugin\n/create-plugin\n\n# Project awareness docs for Claude\n/create-md very-thorough\n\n# Output style for non-default workflows\n/create-output-style \"Teaching Assistant\" --project --description \"Explains step by step with examples\"\n```\n\n---\n\n## Local development\n\n```bash\n# 1) Clone\ngit clone https://github.com/alexanderop/claude-code-builder.git\ncd claude-code-builder\n\n# 2) Start Claude Code\nclaude\n\n# 3) Add a local marketplace and install\n/plugin marketplace add .\n/plugin install claude-code-builder@claude-code-builder-dev\n```\n\nYou can iterate by editing files under `commands/` and re-installing. For multi-plugin testing, create a parent test marketplace (e.g., `dev-marketplace/`) and place this repo inside it â€” `/create-plugin` prints exact paths and next steps.\n\n---\n\n## Project structure\n\n```\nclaude-code-builder/\nâ”œâ”€â”€ .claude-plugin/\nâ”‚   â”œâ”€â”€ plugin.json              # Plugin manifest (name, version, repo, license)\nâ”‚   â””â”€â”€ marketplace.json         # Local marketplace for dev/testing\nâ”œâ”€â”€ commands/                    # All slash-command sources (Markdown with frontmatter)\nâ”‚   â”œâ”€â”€ create-skill.md\nâ”‚   â”œâ”€â”€ create-agent.md\nâ”‚   â”œâ”€â”€ create-command.md\nâ”‚   â”œâ”€â”€ create-hook.md\nâ”‚   â”œâ”€â”€ create-plugin.md\nâ”‚   â”œâ”€â”€ create-md.md\nâ”‚   â””â”€â”€ create-output-style.md\nâ”œâ”€â”€ README.md\nâ”œâ”€â”€ LICENSE\nâ””â”€â”€ .gitignore\n```\n\n---\n\n## Design principles\n\n* **Convention over configuration** â€” consistent file names, frontmatter, and paths.\n* **Safety rails** â€” hooks and commands promote least-privilege tools and reviewability.\n* **Explainability** â€” generated files include commented templates and examples.\n* **Distribution-ready** â€” manifests and marketplace layout support team sharing.\n\n---\n\n## Requirements\n\n* Claude Code installed (CLI + UI)\n* Shell environment with common tooling (`bash`, `jq`, `python3` for sample hooks)\n* Git (for marketplace installs)\n\n> The plugin itself is language-agnostic; your generated Skills/agents can target any stack.\n\n---\n\n## FAQs\n\n**Where do files get created?**\nUser-level content goes under `~/.claude/...`; project-level content under `.claude/...`. Commands print exact paths.\n\n**Can I block risky actions?**\nYes â€” use `PreToolUse` hooks that exit with code `2` to block operations (see `/create-hook` examples).\n\n**How do I share with my team?**\nUse `/create-plugin` to package your `.claude/` config and add it to a marketplace repo; teammates run the two install commands.\n\n---\n\n## Contributing\n\nIssues and PRs are welcome ðŸŽ‰\n\n1. Check existing issues and discussions\n2. Open a focused bug report or RFC\n3. Submit a PR with clear description and before/after notes\n\n---\n\n## Versioning\n\n* **1.0.0** â€“ Initial release of all creation commands *(2025-01-08)*\n\nSee the repository for releases and change notes.\n\n---\n\n## License\n\nMIT â€” see [LICENSE](LICENSE).\n\n---\n\n## Author\n\n**Alexander Opalic** Â· [https://github.com/alexanderop/claude-code-builder](https://github.com/alexanderop/claude-code-builder)\n\n"
      },
      "plugins": [
        {
          "name": "claude-code-builder",
          "source": "./",
          "description": "Create skills, subagents, hooks, commands, and plugins for Claude Code",
          "categories": [],
          "install_commands": [
            "/plugin marketplace add alexanderop/claude-code-builder",
            "/plugin install claude-code-builder@claude-code-builder"
          ]
        }
      ]
    },
    {
      "name": "vue-development-marketplace",
      "version": null,
      "description": "Vue 3 development skills and best practices for TypeScript-first modern Vue applications",
      "repo_full_name": "alexanderop/claude-skill-vue-development",
      "repo_url": "https://github.com/alexanderop/claude-skill-vue-development",
      "repo_description": "A Claude Code Agent Skill for Vue.js development with TypeScript, emphasizing testing-first development, functional patterns, and maintainable architecture.",
      "signals": {
        "stars": 8,
        "forks": 1,
        "pushed_at": "2025-11-08T12:04:07Z"
      },
      "files": {
        ".claude-plugin/marketplace.json": "{\n  \"name\": \"vue-development-marketplace\",\n  \"owner\": {\n    \"name\": \"Alexander Opalic\"\n  },\n  \"description\": \"Vue 3 development skills and best practices for TypeScript-first modern Vue applications\",\n  \"plugins\": [\n    {\n      \"name\": \"vue-development\",\n      \"source\": \"./\",\n      \"description\": \"Modern Vue 3 development with TypeScript, Composition API, and user-behavior testing\"\n    }\n  ]\n}\n",
        ".claude-plugin/plugin.json": "{\n  \"name\": \"vue-development\",\n  \"version\": \"0.1.0\",\n  \"description\": \"Modern Vue 3 development with TypeScript, Composition API, defineModel bindings, Testing Library for user-behavior tests, and MSW for API mocking\",\n  \"author\": {\n    \"name\": \"Alexander Opalic\"\n  },\n  \"keywords\": [\n    \"vue\",\n    \"vue3\",\n    \"typescript\",\n    \"composition-api\",\n    \"testing\",\n    \"defineModel\",\n    \"testing-library\",\n    \"msw\"\n  ],\n  \"repository\": \"https://github.com/alexanderop/claude-skill-vue-development\",\n  \"license\": \"MIT\"\n}\n",
        "README.md": "# Vue Development Plugin for Claude Code\n\nA comprehensive, test-driven Vue 3 development skill that enforces modern best practices with 100% compliance under pressure.\n\n**Now available as a Claude Code plugin!** See [PLUGIN-README.md](PLUGIN-README.md) for installation and usage instructions.\n\n## Overview\n\nThis skill teaches Claude agents to write production-quality Vue 3 code using:\n- **TypeScript-first** patterns (no runtime validation)\n- **Modern Composition API** (defineModel, not manual props)\n- **User-behavior testing** (Testing Library, not implementation details)\n- **Clean composables** (single responsibility, no UI logic)\n\n## Plugin Structure\n\n```\n.claude-plugin/\nâ”œâ”€â”€ plugin.json (Plugin manifest)\nâ”œâ”€â”€ marketplace.json (Marketplace configuration)\nâ””â”€â”€ skills/\n    â””â”€â”€ vue-development/\n        â”œâ”€â”€ SKILL.md (1,216 words)\n        â”‚   â”œâ”€â”€ Red flags (12 anti-patterns)\n        â”‚   â”œâ”€â”€ Quick rules (components, testing, routing, composables)\n        â”‚   â”œâ”€â”€ Essential patterns with examples\n        â”‚   â”œâ”€â”€ Rationalization table (11 excuses countered)\n        â”‚   â””â”€â”€ Quick checklists (4 domains)\n        â””â”€â”€ references/\n            â”œâ”€â”€ component-patterns.md (616 words)\n            â”œâ”€â”€ composable-patterns.md (1,848 words)\n            â”œâ”€â”€ routing-patterns.md (589 words)\n            â”œâ”€â”€ testing-composables.md (1,627 words)\n            â””â”€â”€ testing-patterns.md (785 words)\n\nTotal: 6,681 words (1,216 main + 5,465 references)\n```\n\n**Legacy Structure:** The original skill files remain in `.claude/skills/vue/` for backward compatibility during migration.\n\n## What It Covers\n\n### Components (`component-patterns.md`)\n- Props: `defineProps<{ }>()` with TypeScript, no `const` unless needed\n- Emits: `const emit = defineEmits<{ event: [args] }>()`\n- V-model: `defineModel<type>()` (NOT manual modelValue)\n- Templates: `:prop` shorthand, `#slot` shorthand, explicit `<template>` tags\n- Naming: PascalCase or kebab-case, general â†’ specific\n\n### Composables (`composable-patterns.md`)\n- Naming: `useFeatureName.ts` with PascalCase\n- Structure: Primary state â†’ Metadata â†’ Methods\n- Single responsibility principle\n- Error exposure (no console.error only)\n- NO UI logic (toasts/alerts belong in components)\n- Functional core, imperative shell pattern\n\n### Testing Components (`testing-patterns.md`)\n- PRIMARY: `@testing-library/vue` for user behavior\n- API mocking: MSW (`msw`)\n- NEVER: `setTimeout()` in tests, testing internal state\n- Async: `findBy*` queries or `waitFor()`\n- Query priority: accessibility > test IDs\n\n### Testing Composables (`testing-composables.md`)\n- **Independent composables**: Test directly (no lifecycle/inject)\n- **Dependent composables**: Use `withSetup` helper (lifecycle hooks)\n- **Inject composables**: Use `useInjectedSetup` helper (provide/inject)\n- Patterns for async, localStorage, document title, etc.\n\n### Routing (`routing-patterns.md`)\n- File-based routing with unplugin-vue-router\n- AVOID: `index.vue` â†’ use route groups `(name).vue`\n- Explicit params: `[userId]` not `[id]`\n- Navigation: Named routes with typed params\n- Route guards and meta fields\n\n## Effectiveness\n\n### Before Skill: 37.5% compliance\n- Props: 0/3 correct (used const unnecessarily, runtime validation)\n- Emits: 0/1 correct (array syntax, no types)\n- V-model: 0/1 correct (manual modelValue)\n- Testing: 3/4 correct (rejected setTimeout but missed Testing Library)\n\n### After Skill: 100% compliance\n- Props: âœ… TypeScript generics, no const when unused\n- Emits: âœ… Typed event signatures\n- V-model: âœ… defineModel() usage\n- Testing: âœ… Proper async, no setTimeout\n- Composables: âœ… Correct naming, structure, error handling\n\n**Improvement: 167% increase**\n\n## Key Features\n\n### Red Flags (Auto-Detection)\nAgents STOP when they catch themselves:\n- \"For speed\" / \"quick demo\" â†’ shortcuts\n- Manual modelValue â†’ use defineModel()\n- setTimeout() in tests â†’ proper async\n- UI logic in composables â†’ expose error state\n- Generic `[id]` params â†’ explicit names\n\n### Rationalization Table\nCounters 11 common excuses:\n- \"TypeScript is too verbose\" â†’ It's actually LESS code\n- \"We can clean it up later\" â†’ Write it right the first time\n- \"Composables can show toasts\" â†’ UI belongs in components\n- \"counter.ts is fine\" â†’ Must use 'use' prefix\n\n### Reference Architecture\nHeavy content loads on-demand:\n- Components â†’ 616 words\n- Composables â†’ 1,848 words\n- Routing â†’ 589 words\n- Testing (components) â†’ 785 words\n- Testing (composables) â†’ 1,627 words\n\nMain skill stays small (1,216 words) for fast initial load.\n\n## Installation\n\n### As a Plugin (Recommended)\n\nSee [PLUGIN-README.md](PLUGIN-README.md) for detailed installation instructions.\n\n**Quick Start:**\n\n```bash\n# Add the marketplace\n/plugin marketplace add alexanderop/claude-skill-vue-development\n\n# Install the plugin\n/plugin install vue-development@vue-development-marketplace\n```\n\n### Legacy Installation (Direct Skill)\n\n1. Place skill files in `.claude/skills/vue/`\n2. The skill auto-loads when:\n   - Creating Vue 3 components\n   - Implementing v-model\n   - Defining props/emits\n   - Setting up routes\n   - Writing Vue tests\n   - Creating composables\n\nOr invoke manually:\n```\nSkill: vue-development\n```\n\n## Testing Methodology\n\nCreated using **Test-Driven Development for Documentation**:\n\n1. **RED Phase**: Created 8 pressure scenarios, ran baseline tests without skill\n2. **GREEN Phase**: Wrote minimal skill addressing observed failures\n3. **REFACTOR Phase**: Closed loopholes, achieved 100% compliance\n\nAll rationalizations captured from real agent behavior under:\n- Time pressure (\"ASAP\", \"ship tonight\")\n- Authority pressure (\"just make it work\")\n- Exhaustion pressure (\"debugging for 2 hours\")\n- Confusion pressure (\"I think I need to...\")\n\n## Documentation\n\n- `SKILL-CREATION-SUMMARY.md` - TDD methodology and results\n- `OPTIMIZATION-SUMMARY.md` - Reference architecture details\n- `FINAL-STATUS.md` - Complete status and metrics\n- `test-scenarios/` - All baseline and with-skill test results\n\n## Usage Examples\n\n### Component Creation\n**Without skill:** Used runtime validation, `const props =` unnecessarily, no emits types\n**With skill:** TypeScript generics, correct const usage, fully typed emits\n\n### V-Model Implementation\n**Without skill:** Manual modelValue prop + update:modelValue emit\n**With skill:** `defineModel<string>()` for clean two-way binding\n\n### Testing\n**Without skill:** setTimeout(1000), testing internal state\n**With skill:** findBy* queries, user-visible behavior only\n\n### Composables\n**Without skill:** UI logic in composables, missing 'use' prefix, console.error only\n**With skill:** Proper naming, error exposure, no UI logic, single responsibility\n\n## Requirements\n\n- Vue 3.4+ (for defineModel)\n- TypeScript\n- Vitest (recommended for testing)\n- @testing-library/vue\n- msw (for API mocking)\n- unplugin-vue-router (for file-based routing)\n\n## Contributing\n\nThe skill enforces best practices from:\n- Official Vue 3 documentation\n- Vue Composition API RFC\n- Testing Library principles\n- Kent C. Dodds testing philosophy\n- Community best practices from alexop.dev\n\n## Status\n\nâœ… **PRODUCTION-READY**\n\n- 100% compliance rate in testing\n- 25% smaller main file (1,216 vs original 1,618 words)\n- 312% more comprehensive (6,681 total words)\n- Tested under multiple pressure scenarios\n- Zero new rationalizations after optimization\n\n## License\n\nCreated following Claude Code superpowers methodology.\n"
      },
      "plugins": [
        {
          "name": "vue-development",
          "source": "./",
          "description": "Modern Vue 3 development with TypeScript, Composition API, and user-behavior testing",
          "categories": [],
          "install_commands": [
            "/plugin marketplace add alexanderop/claude-skill-vue-development",
            "/plugin install vue-development@vue-development-marketplace"
          ]
        }
      ]
    }
  ]
}