{
  "author": {
    "id": "androidyue",
    "display_name": "androidyue",
    "avatar_url": "https://avatars.githubusercontent.com/u/834085?u=a3772a43ba6f36c6d679e540a76e8380bf5b235c&v=4"
  },
  "marketplaces": [
    {
      "name": "dev-essentials-marketplace",
      "version": "1.4.0",
      "description": "A curated collection of essential development tools and workflows for Claude Code",
      "repo_full_name": "androidyue/claude_code_plugin_example",
      "repo_url": "https://github.com/androidyue/claude_code_plugin_example",
      "repo_description": null,
      "signals": {
        "stars": 0,
        "forks": 0,
        "pushed_at": "2025-10-16T14:33:30Z"
      },
      "files": {
        ".claude-plugin/marketplace.json": "{\n  \"name\": \"dev-essentials-marketplace\",\n  \"description\": \"A curated collection of essential development tools and workflows for Claude Code\",\n  \"version\": \"1.4.0\",\n  \"owner\": {\n    \"name\": \"androidyue\",\n    \"email\": \"[email protected]\"\n  },\n  \"author\": {\n    \"name\": \"androidyue\",\n    \"url\": \"https://github.com/androidyue\"\n  },\n  \"plugins\": [\n    {\n      \"name\": \"dev-essentials\",\n      \"version\": \"1.4.0\",\n      \"description\": \"Essential development tools including code review, testing, debugging, and security audit capabilities\",\n      \"source\": \"./\",\n      \"author\": {\n        \"name\": \"androidyue\"\n      },\n      \"keywords\": [\n        \"code-review\",\n        \"testing\",\n        \"debugging\",\n        \"security\",\n        \"optimization\"\n      ]\n    }\n  ]\n}\n",
        ".claude-plugin/plugin.json": "{\n  \"name\": \"dev-essentials\",\n  \"version\": \"1.4.0\",\n  \"description\": \"Essential development tools including code review, testing, debugging, and security audit capabilities\",\n  \"author\": {\n    \"name\": \"androidyue\",\n    \"url\": \"https://github.com/androidyue\"\n  },\n  \"homepage\": \"https://github.com/androidyue/claude_code_plugin_example\",\n  \"repository\": \"https://github.com/androidyue/claude_code_plugin_example\",\n  \"license\": \"MIT\",\n  \"keywords\": [\n    \"code-review\",\n    \"testing\",\n    \"debugging\",\n    \"security\",\n    \"optimization\",\n    \"refactoring\",\n    \"documentation\"\n  ]\n}\n",
        "README.md": "# Dev Essentials - Claude Code Plugin\n\nA comprehensive collection of development tools for Claude Code, including code review, testing, debugging, security auditing, and optimization capabilities.\n\n## Features\n\n### Slash Commands\n\n- **`/review`** - Comprehensive code review covering quality, security, performance, testing, and documentation\n- **`/test-plan`** - Generate detailed test plans with unit, integration, and e2e test cases\n- **`/docs`** - Create comprehensive API documentation with examples and usage instructions\n- **`/optimize`** - Analyze code for performance optimization opportunities\n- **`/refactor`** - Refactor code to improve quality, maintainability, and apply design patterns\n- **`/commit`** - Generate well-structured commit messages following best practices\n\n### Specialized Agents\n\n- **debugging-agent** - Expert at analyzing errors, identifying root causes, and providing fixes\n- **test-writer** - Writes comprehensive test suites with high coverage\n- **refactoring-agent** - Improves code quality while maintaining functionality\n- **security-auditor** - Identifies vulnerabilities and enforces secure coding practices\n\n### Guidelines\n\nIncludes development best practices for:\n- Code quality and style\n- Testing requirements\n- Security standards\n- Performance optimization\n- Documentation\n- Version control\n\n### Utility Scripts\n\n- **context_monitor.py** - Monitor project size and context usage for AI assistants\n\n## Installation\n\n### From Local Directory\n\nIf testing locally:\n\n```bash\ncd /path/to/claude_plugin\nclaude /plugin marketplace add .\nclaude /plugin install dev-essentials\n```\n\n### From GitHub Repository\n\nOnce published to GitHub:\n\n```bash\nclaude /plugin marketplace add androidyue/claude_code_plugin_example\nclaude /plugin install dev-essentials\n```\n\n## Usage\n\n### Using Slash Commands\n\n```bash\n# Review current changes\n/review\n\n# Generate test plan for a feature\n/test-plan src/auth/login.ts\n\n# Create documentation\n/docs src/api/users.ts\n\n# Optimize code performance\n/optimize src/database/queries.ts\n\n# Refactor code for better quality\n/refactor src/legacy/user-service.js\n\n# Generate commit message for staged changes\n/commit\n```\n\n### Using Specialized Agents\n\nAgents can be invoked through the Task tool or when Claude Code automatically selects them based on your request:\n\n```bash\n# Claude will use the appropriate agent when you ask:\n\"Debug the authentication error I'm seeing\"\n\"Write tests for the user service\"\n\"Refactor this code to be more maintainable\"\n\"Audit the security of the payment processing code\"\n```\n\n## Plugin Structure\n\n```\nclaude-dev-essentials/\n├── .claude-plugin/\n│   ├── plugin.json           # Plugin manifest\n│   └── marketplace.json      # Marketplace configuration\n├── commands/                  # Slash commands\n│   ├── review.md\n│   ├── test-plan.md\n│   ├── docs.md\n│   ├── optimize.md\n│   ├── refactor.md\n│   └── commit.md\n├── agents/                    # Specialized agents\n│   ├── debugging-agent.json\n│   ├── test-writer.json\n│   ├── refactoring-agent.json\n│   └── security-auditor.json\n├── scripts/                   # Utility scripts\n│   ├── context_monitor.py\n│   └── README.md\n├── .claude/                   # Claude Code settings\n│   └── settings.json\n├── settings.json              # Plugin configuration\n├── CLAUDE.md                  # Development guidelines\n└── README.md\n```\n\n## Configuration\n\nThe plugin includes configuration files for easy customization:\n\n- **`settings.json`**: Plugin-wide settings and script configurations\n- **`.claude/settings.json`**: Project-specific settings and permissions\n\n## Customization\n\nYou can customize this plugin for your needs:\n\n1. **Edit slash commands**: Modify files in `commands/` to adjust prompts\n2. **Customize agents**: Edit JSON files in `agents/` to change agent behavior\n3. **Update guidelines**: Modify `CLAUDE.md` to match your team's standards\n4. **Add new commands**: Create new `.md` files in `commands/`\n5. **Add new agents**: Create new `.json` files in `agents/`\n6. **Configure scripts**: Edit `settings.json` to adjust script parameters\n\n## Sharing Your Plugin\n\n### Option 1: GitHub Repository\n\n1. Create a new GitHub repository\n2. Push your plugin files\n3. Others can install with:\n   ```bash\n   /plugin marketplace add androidyue/claude_code_plugin_example\n   /plugin install dev-essentials\n   ```\n\n### Option 2: Direct Distribution\n\nShare the plugin directory directly. Users can add it as a local marketplace:\n\n```bash\n/plugin marketplace add /path/to/plugin\n/plugin install dev-essentials\n```\n\n## Contributing\n\nFeel free to customize and extend this plugin. Some ideas:\n\n- Add more specialized agents (e.g., API design, database optimization)\n- Create domain-specific slash commands\n- Add hooks for automated workflows\n- Integrate MCP servers for tool connectivity\n\n## License\n\nMIT\n\n## Author\n\nandroidyue\n- GitHub: [@androidyue](https://github.com/androidyue)\n- Repository: [claude_code_plugin_example](https://github.com/androidyue/claude_code_plugin_example)\n\n## Version History\n\n- **1.4.0** - Added configuration system (settings.json, .claude/settings.json)\n- **1.3.0** - Added utility scripts (context_monitor.py)\n- **1.2.0** - Added /commit command for generating commit messages\n- **1.1.0** - Added /refactor command for code refactoring\n- **1.0.0** - Initial release with core commands and agents\n"
      },
      "plugins": [
        {
          "name": "dev-essentials",
          "version": "1.4.0",
          "description": "Essential development tools including code review, testing, debugging, and security audit capabilities",
          "source": "./",
          "author": {
            "name": "androidyue"
          },
          "keywords": [
            "code-review",
            "testing",
            "debugging",
            "security",
            "optimization"
          ],
          "categories": [
            "code-review",
            "debugging",
            "optimization",
            "security",
            "testing"
          ],
          "install_commands": [
            "/plugin marketplace add androidyue/claude_code_plugin_example",
            "/plugin install dev-essentials@dev-essentials-marketplace"
          ]
        }
      ]
    }
  ]
}