{
  "author": {
    "id": "AndVl1",
    "display_name": "Andrey Vladislavov",
    "avatar_url": "https://avatars.githubusercontent.com/u/45296686?v=4"
  },
  "marketplaces": [
    {
      "name": "andvl1-plugins",
      "version": null,
      "description": "Plugin marketplace by AndVl1 with multi-agent development tools for Claude Code",
      "repo_full_name": "AndVl1/claude-plugin",
      "repo_url": "https://github.com/AndVl1/claude-plugin",
      "repo_description": null,
      "signals": {
        "stars": 0,
        "forks": 0,
        "pushed_at": "2026-02-01T10:00:39Z"
      },
      "files": {
        ".claude-plugin/marketplace.json": "{\n  \"name\": \"andvl1-plugins\",\n  \"owner\": {\n    \"name\": \"AndVl1\"\n  },\n  \"metadata\": {\n    \"description\": \"Plugin marketplace by AndVl1 with multi-agent development tools for Claude Code\",\n    \"version\": \"1.0.0\"\n  },\n  \"plugins\": [\n    {\n      \"name\": \"fullstack-team\",\n      \"source\": \"./\",\n      \"description\": \"Fullstack development plugin with 12+ specialized agents for Kotlin/Spring, React, KMP Mobile, Telegram Bots, DevOps, and AI integration\",\n      \"version\": \"1.0.1\",\n      \"author\": {\n        \"name\": \"AndVl1\"\n      },\n      \"category\": \"development\",\n      \"tags\": [\"agents\", \"multi-agent\", \"team\", \"kotlin\", \"spring\", \"react\", \"kmp\"]\n    }\n  ]\n}\n",
        ".claude-plugin/plugin.json": "{\n  \"name\": \"fullstack-team\",\n  \"description\": \"Fullstack development plugin with 14 specialized agents for Kotlin/Spring, React, KMP Mobile, Telegram Bots, DevOps, Diagnostics, and AI integration\",\n  \"version\": \"1.2.1\",\n  \"author\": {\n    \"name\": \"AndVl1\"\n  },\n  \"homepage\": \"https://github.com/AndVl1/claude-plugin\",\n  \"repository\": \"https://github.com/AndVl1/claude-plugin\",\n  \"license\": \"MIT\",\n  \"keywords\": [\n    \"agents\",\n    \"multi-agent\",\n    \"team\",\n    \"kotlin\",\n    \"spring\",\n    \"react\",\n    \"kmp\",\n    \"devops\",\n    \"claude-code\",\n    \"plugin\"\n  ]\n}\n",
        "README.md": "# Dream Team Plugin for Claude Code\n\nA comprehensive fullstack development plugin with 12+ specialized agents for building modern applications: Kotlin/Spring Boot backends, React web frontends, KMP mobile apps, Telegram bots, DevOps pipelines, and AI integration.\n\n## Installation\n\n### Option 1: Install from Marketplace (Recommended)\n\n1. Add the marketplace:\n```\n/plugin marketplace add AndVl1/claude-plugin\n```\n\n2. Install the plugin:\n```\n/plugin install fullstack-team@andvl1-plugins\n```\n\n### Option 2: Install directly from GitHub\n\n```\n/plugin install github:AndVl1/claude-plugin\n```\n\n### Option 3: Local development\n\n```bash\nclaude --plugin-dir /path/to/claude-plugin\n```\n\n## Marketplace Setup\n\nIf you want to add this marketplace to your team's project, add to `.claude/settings.json`:\n\n```json\n{\n  \"extraKnownMarketplaces\": {\n    \"andvl1-plugins\": {\n      \"source\": {\n        \"source\": \"github\",\n        \"repo\": \"AndVl1/claude-plugin\"\n      }\n    }\n  },\n  \"enabledPlugins\": {\n    \"fullstack-team@andvl1-plugins\": true\n  }\n}\n```\n\n## Features\n\n### 12 Specialized Agents\n| Agent | Description |\n|-------|-------------|\n| `analyst` | Requirements analyst - clarifies requirements, researches patterns |\n| `architect` | Technical architect - designs APIs, data models, implementation plans |\n| `code-reviewer` | Code quality reviewer - security, patterns, best practices |\n| `developer` | Backend developer - Kotlin/Spring services |\n| `developer-mobile` | Mobile developer - KMP with Compose UI |\n| `devops` | DevOps engineer - Docker, K8s, Helm, CI/CD |\n| `discovery` | Repository discovery - analyzes codebases |\n| `frontend-developer` | Frontend developer - React/TypeScript |\n| `init-mobile` | Mobile project initializer - creates KMP projects |\n| `manual-qa` | Manual QA tester - UI testing via Chrome/Mobile MCP |\n| `qa` | QA engineer - writes tests, reviews code |\n| `security-tester` | Security specialist - vulnerability assessment |\n| `tech-researcher` | Research agent - documentation, best practices |\n\n### Commands (User-invokable Skills)\n| Command | Description |\n|---------|-------------|\n| `/fullstack-team:team` | 7-phase feature development with parallel agents |\n| `/fullstack-team:solo` | Incremental development workflow |\n| `/fullstack-team:interview` | Deep interview to clarify ideas before implementation |\n| `/fullstack-team:init-mobile` | Create KMP Compose Multiplatform project |\n| `/fullstack-team:update-readme` | Update project README |\n\n### 20+ Agent Skills\nDomain knowledge for: Kotlin, Spring Boot, React, KMP, Compose, Decompose, Ktor, JOOQ, OpenTelemetry, and more.\n\n### Safety Hooks\n- Protected branch enforcement (main/production)\n- State synchronization reminders\n- File change logging\n- MCP tools access control (manual-qa agent only)\n- Sensitive file protection (.env, credentials)\n\n## Plugin Structure\n\n```\nclaude-plugin/\n├── .claude-plugin/\n│   ├── plugin.json       # Plugin manifest\n│   └── marketplace.json  # Marketplace catalog\n├── agents/               # 12 agent definitions\n├── commands/             # User-invokable commands\n├── skills/               # Domain knowledge (20+ skills)\n├── hooks/\n│   └── hooks.json        # Safety hooks\n└── README.md\n```\n\n## Usage\n\n### Team Workflow\n```\n/fullstack-team:team implement user authentication feature\n```\n\n### Solo Workflow\n```\n/fullstack-team:solo add pagination to the API\n```\n\n### Interview\n```\n/fullstack-team:interview mobile app for recipe sharing\n```\n\n## State Management\n\nThe plugin uses `.claude/team-state.md` to track progress across agent sessions. Create this file in your project:\n\n```markdown\n# Team State\n\n## Current Task\n**Feature**: [Feature name]\n**Branch**: [branch-name]\n\n## Phases\n- [ ] Phase 1: Analysis\n- [ ] Phase 2: Architecture\n- [ ] Phase 3: Implementation\n- [ ] Phase 4: Testing\n- [ ] Phase 5: Code Review\n```\n\n## Requirements\n\n- Claude Code CLI v1.0.33+\n- Optional MCP servers: deepwiki, context7, claude-in-chrome, mobile\n\n## References\n\nThis plugin was inspired by and built upon:\n\n- [Anthropic's feature-dev plugin](https://github.com/anthropics/claude-code/blob/main/plugins/feature-dev/commands/feature-dev.md) - Official Claude Code plugin patterns\n- [Dream Team by ashchupliak](https://github.com/ashchupliak/dream-team) - Multi-agent development workflow\n\n## License\n\nMIT\n"
      },
      "plugins": [
        {
          "name": "fullstack-team",
          "source": "./",
          "description": "Fullstack development plugin with 12+ specialized agents for Kotlin/Spring, React, KMP Mobile, Telegram Bots, DevOps, and AI integration",
          "version": "1.0.1",
          "author": {
            "name": "AndVl1"
          },
          "category": "development",
          "tags": [
            "agents",
            "multi-agent",
            "team",
            "kotlin",
            "spring",
            "react",
            "kmp"
          ],
          "categories": [
            "agents",
            "development",
            "kmp",
            "kotlin",
            "multi-agent",
            "react",
            "spring",
            "team"
          ],
          "install_commands": [
            "/plugin marketplace add AndVl1/claude-plugin",
            "/plugin install fullstack-team@andvl1-plugins"
          ]
        }
      ]
    }
  ]
}