{
  "author": {
    "id": "anexpn",
    "display_name": "Jun",
    "avatar_url": "https://avatars.githubusercontent.com/u/23271612?u=cf9c1dc4198afa7fa5424e54f61caba33fa5d072&v=4"
  },
  "marketplaces": [
    {
      "name": "jun-workflows",
      "version": null,
      "description": "Jun's development workflow commands and skills for Claude Code",
      "repo_full_name": "anexpn/claude-plugins",
      "repo_url": "https://github.com/anexpn/claude-plugins",
      "repo_description": "Jun's development workflow commands and skills for Claude Code",
      "signals": {
        "stars": 1,
        "forks": 0,
        "pushed_at": "2025-12-01T10:17:48Z"
      },
      "files": {
        ".claude-plugin/marketplace.json": "{\n  \"name\": \"jun-workflows\",\n  \"owner\": {\n    \"name\": \"Jun\",\n    \"url\": \"https://github.com/anexpn\"\n  },\n  \"plugins\": [\n    {\n      \"name\": \"jun-dev-workflows\",\n      \"source\": \"./\",\n      \"description\": \"Jun's development workflow commands and skills for Claude Code\",\n      \"version\": \"1.0.0\",\n      \"author\": {\n        \"name\": \"Jun\"\n      },\n      \"keywords\": [\"workflow\", \"tdd\", \"git\", \"debugging\", \"development\"],\n      \"category\": \"development\"\n    }\n  ]\n}\n",
        ".claude-plugin/plugin.json": "{\n  \"name\": \"jun-dev-workflows\",\n  \"version\": \"1.0.0\",\n  \"description\": \"Jun's development workflow commands and skills for Claude Code\",\n  \"author\": {\n    \"name\": \"Jun\"\n  },\n  \"commands\": \"./commands/\",\n  \"skills\": \"./skills/\"\n}\n",
        "README.md": "# Jun's Claude Code Plugin\n\nDevelopment workflow commands and skills for Claude Code.\n\n## Contents\n\n### Commands\n- `/explore` - Explore the codebase systematically\n- `/refresh` - Refresh understanding of project structure\n- `/tour` - Guided tour of the codebase\n\n### Skills\n- `dev-workflow` - Complete development workflow from spec to implementation to review\n- `dev-spec` - Design and planning session for development work\n- `dev-impl` - Execute implementation of tasks from a development plan\n- `dev-review` - Review and validate implementation work\n- `git-workflow` - Version control workflow and best practices\n- `systematic-debugging` - Structured debugging methodology\n- `tdd` - Test-Driven Development workflow\n\n## Installation\n\n### From GitHub (Recommended)\n```\n/plugin install anexpn/claude-plugins\n```\n\n### From Marketplace\n```\n/plugin marketplace add anexpn/claude-plugins\n/plugin install jun-dev-workflows@jun-workflows\n```\n\n### From local directory\n```\n/plugin install file:///Users/jun/code/claude-plugins\n```\n"
      },
      "plugins": [
        {
          "name": "jun-dev-workflows",
          "source": "./",
          "description": "Jun's development workflow commands and skills for Claude Code",
          "version": "1.0.0",
          "author": {
            "name": "Jun"
          },
          "keywords": [
            "workflow",
            "tdd",
            "git",
            "debugging",
            "development"
          ],
          "category": "development",
          "categories": [
            "debugging",
            "development",
            "git",
            "tdd",
            "workflow"
          ],
          "install_commands": [
            "/plugin marketplace add anexpn/claude-plugins",
            "/plugin install jun-dev-workflows@jun-workflows"
          ]
        }
      ]
    }
  ]
}