{
  "author": {
    "id": "azusachino",
    "display_name": "haru",
    "avatar_url": "https://avatars.githubusercontent.com/u/18746830?u=e068187ce3ca39ed799f1bc91df51c60fb9f1bef&v=4"
  },
  "marketplaces": [
    {
      "name": "harus-skills",
      "version": null,
      "description": "Custom Claude Code skills for productivity and learning",
      "repo_full_name": "azusachino/harus-skills",
      "repo_url": "https://github.com/azusachino/harus-skills",
      "repo_description": "leap higher",
      "signals": {
        "stars": 0,
        "forks": 0,
        "pushed_at": "2026-02-03T09:03:28Z"
      },
      "files": {
        ".claude-plugin/marketplace.json": "{\n    \"name\": \"harus-skills\",\n    \"owner\": {\n        \"name\": \"haru\",\n        \"email\": \"azusachino@duck.com\"\n    },\n    \"metadata\": {\n        \"description\": \"Custom Claude Code skills for productivity and learning\",\n        \"version\": \"1.0.0\"\n    },\n    \"plugins\": [\n        {\n            \"name\": \"code-skills\",\n            \"description\": \"Collection of development and git workflow helpers\",\n            \"source\": \"./\",\n            \"strict\": false,\n            \"skills\": [\n                \"./skills/mkmr\"\n            ]\n        },\n        {\n            \"name\": \"language-skills\",\n            \"description\": \"Language learning and lesson generation tools\",\n            \"source\": \"./\",\n            \"strict\": false,\n            \"skills\": [\n                \"./skills/daily-language-lesson\"\n            ]\n        }\n    ]\n}",
        "README.md": "# harus-skills\n\nleap higher\n\nA collection of custom Claude Code skills for productivity and learning.\n\n## Plugins\n\nThis marketplace contains two plugin collections:\n\n### üõ†Ô∏è code-skills\n\nDevelopment and git workflow helpers.\n\n**Skills:**\n\n- `/mkmr` - Create merge requests from current branch to mainline with automated diff analysis and description generation\n\n### üìö language-skills\n\nLanguage learning and lesson generation tools.\n\n**Skills:**\n\n- `/daily-language-lesson` (aliases: `/dll`, `/lesson`) - Generate comprehensive daily language learning lessons\n  - **English**: Native level (advanced literature, idioms, sophisticated grammar)\n  - **Japanese**: Native level (advanced kanji, keigo, literary expressions)\n  - **Spanish**: Entry level (basic vocabulary, simple grammar)\n\nEach lesson includes reading passages, vocabulary, comprehension questions, and grammar practice. Lessons are saved as markdown files in dated folders.\n\n## Installation\n\n### Prerequisites\n\n- [Claude Code](https://claude.ai/code) CLI tool installed\n\n### Method 1: Install as Marketplace (Recommended)\n\nThis method allows you to install individual plugins as needed.\n\n1. **Add this repository as a marketplace:**\n\n   ```bash\n   /plugin marketplace add azusachino/harus-skills\n   ```\n\n2. **Install plugins:**\n\n   Option A - Via CLI:\n\n   ```bash\n   # Install both plugins\n   /plugin install code-skills@harus-skills\n   /plugin install language-skills@harus-skills\n\n   # Or install individually\n   /plugin install code-skills@harus-skills\n   /plugin install language-skills@harus-skills\n   ```\n\n   Option B - Via Browse Interface:\n   1. Run `/plugin marketplace browse`\n   2. Select `harus-skills`\n   3. Choose which plugin(s) to install (`code-skills` and/or `language-skills`)\n   4. Select `Install now`\n\n3. **Restart Claude Code** for changes to take effect\n\n### Method 2: Install via Skill Directory (Legacy)\n\nIf you prefer to make all skills available without the plugin system:\n\n1. Clone this repository:\n\n   ```bash\n   git clone <your-repo-url>\n   cd harus-skills\n   ```\n\n2. Add to Claude Code configuration:\n\n   Edit `~/.config/claude/config.json` (create if it doesn't exist):\n\n   ```json\n   {\n     \"skillDirectories\": [\n       \"/path/to/harus-skills/skills\"\n     ]\n   }\n   ```\n\n3. Restart Claude Code\n\n### Verify Installation\n\nIn Claude Code, check available skills:\n\n```bash\n/help\n```\n\nYour installed skills should appear in the skills section.\n\n## Usage\n\n### mkmr - Create Merge Request\n\n```bash\n/mkmr\n```\n\nThe skill will guide you through:\n\n1. Asking for permission to proceed\n2. Identifying mainline branch (main/develop)\n3. Checking for unstaged changes\n4. Analyzing diff and generating description\n5. Creating the merge request via gh/glab\n\n### daily-language-lesson - Generate Language Lessons\n\n```bash\n# Generate today's language lessons\n/lesson\n# or\n/daily-language-lesson\n# or\n/dll\n```\n\nLessons are saved to `lessons/YYYY-MM-DD/` with three files:\n\n- `english.md` - Native level\n- `japanese.md` - Native level\n- `spanish.md` - Entry level\n\n## Development\n\n### Setup\n\nThis repository uses [mise](https://mise.jdx.dev/) for tool management:\n\n```bash\n# Install mise (if not already installed)\ncurl https://mise.run | sh\n\n# Install all tools and setup dev environment\nmise install\nmise run dev\n```\n\n### Daily Commands\n\n```bash\nmise fmt              # Format all files (markdown, JSON, YAML, TOML)\nmise lint             # Lint markdown files\nmise check            # Run all checks before committing\nmise list-skills      # List all available skills\nmise clean            # Remove generated lessons\n```\n\n**Important:** Always run `mise fmt` after editing files. Git hooks will auto-format on commit if installed via `mise run dev`.\n\n### Available Tasks\n\nRun `mise tasks` to see all available commands, or check `mise.toml` for details.\n\n## Skill Structure\n\nEach skill follows the [Agent Skills Standard](http://agentskills.io) format:\n\n```s\nskills/\n  skill-name/\n    SKILL.md          # Skill definition with YAML frontmatter and instructions\n    README.md         # Optional: User documentation\n```\n\n### SKILL.md Format\n\n```yaml\n---\nname: skill-name\ndescription: Clear description of what the skill does and when to use it\nmetadata:\n  author: Your Name\n  version: \"1.0.0\"\n  aliases: [\"alias1\", \"alias2\"]  # Optional\nallowed-tools: git gh glab        # Optional: Restrict tool usage\n---\n\n# Skill Name\n\n[Instructions for Claude on how to execute the skill]\n```\n\n## Contributing\n\nFeel free to add your own skills to this collection:\n\n1. Create a new directory under `skills/`\n2. Add a `SKILL.md` file following the format above\n3. Optionally add a `README.md` for user documentation\n4. Update `.claude-plugin/marketplace.json` to register the skill in the appropriate plugin\n5. Test the skill in Claude Code\n6. Submit a pull request\n\n## Resources\n\n- [Anthropic Skills Repository](https://github.com/anthropics/skills) - Official skills and examples\n- [Agent Skills Standard](http://agentskills.io) - Specification and documentation\n- [Claude Code Documentation](https://support.claude.com/en/articles/12512180-using-skills-in-claude) - Using skills in Claude\n"
      },
      "plugins": [
        {
          "name": "code-skills",
          "description": "Collection of development and git workflow helpers",
          "source": "./",
          "strict": false,
          "skills": [
            "./skills/mkmr"
          ],
          "categories": [],
          "install_commands": [
            "/plugin marketplace add azusachino/harus-skills",
            "/plugin install code-skills@harus-skills"
          ]
        },
        {
          "name": "language-skills",
          "description": "Language learning and lesson generation tools",
          "source": "./",
          "strict": false,
          "skills": [
            "./skills/daily-language-lesson"
          ],
          "categories": [],
          "install_commands": [
            "/plugin marketplace add azusachino/harus-skills",
            "/plugin install language-skills@harus-skills"
          ]
        }
      ]
    }
  ]
}