{
  "author": {
    "id": "baeseokjae",
    "display_name": "Bae Seokjae",
    "avatar_url": "https://avatars.githubusercontent.com/u/67224427?u=8d7cc37aa862330d27d3f8e93b837da05b76f2da&v=4"
  },
  "marketplaces": [
    {
      "name": "gwts-cc",
      "version": null,
      "description": "Git Worktree Sync for Claude Code",
      "repo_full_name": "baeseokjae/gwts-cc",
      "repo_url": "https://github.com/baeseokjae/gwts-cc",
      "repo_description": "This tool creates a Git worktree and automatically synchronizes the untracked files required to run the service.",
      "signals": {
        "stars": 0,
        "forks": 0,
        "pushed_at": "2026-01-29T15:04:17Z"
      },
      "files": {
        ".claude-plugin/marketplace.json": "{\n  \"name\": \"gwts-cc\",\n  \"owner\": {\n    \"name\": \"BaeSeokJae\"\n  },\n  \"plugins\": [\n    {\n      \"name\": \"gwts-cc\",\n      \"source\": \"./\",\n      \"description\": \"Git Worktree Sync for Claude Code\",\n      \"version\": \"0.1.0\"\n    }\n  ]\n}\n",
        ".claude-plugin/plugin.json": "{\n  \"name\": \"gwts-cc\",\n  \"version\": \"0.1.0\",\n  \"description\": \"Create Git worktrees with automatic untracked file synchronization\",\n  \"author\": {\n    \"name\": \"BaeSeokJae\"\n  },\n  \"repository\": \"https://github.com/BaeSeokJae/gwts-cc\",\n  \"license\": \"MIT\",\n  \"keywords\": [\"git\", \"worktree\", \"sync\", \"claude-code\"]\n}\n",
        "README.md": "# gwts-cc\n\n> Git worktree + untracked file sync for Claude Code\n\n[English](README.md) | [í•œêµ­ì–´](docs/README.ko.md)\n\n## Why?\n\nGit worktrees are great for parallel development, but untracked files (migrations, .env, scripts) don't come along. This plugin syncs them automatically.\n\n## Installation\n\n```bash\n/plugin marketplace add BaeSeokJae/gwts-cc\n/plugin install gwts-cc@gwts-cc\n```\n\n## Usage\n\n```bash\n/worktree create feat/my-feature              # Create from main (default)\n/worktree create feat/my-feature from dev     # Create from dev branch\n/worktree create feat/my-feature from current # Create from current branch\n/worktree list                                # List worktrees\n/worktree sync                                # Sync files to current worktree\n/worktree clean <path>                        # Remove worktree\n```\n\n## Configuration\n\nCreate `.gwts` in your project root:\n\n```json\n{\n  \"includes\": [\"migrations/\", \".env.example\"],\n  \"mode\": \"symlink\",\n  \"hooks\": { \"postCreate\": \"pnpm install\" }\n}\n```\n\nThat's it. Personal overrides go in `.claude/gwts/worktree.json`.\n\n### Options\n\n| Option | Description | Default |\n|--------|-------------|---------|\n| `includes` | Files/dirs to sync | `[]` |\n| `excludes` | Files/dirs to skip | `[]` |\n| `mode` | `symlink` or `copy` | `symlink` |\n| `hooks.postCreate` | Command after create | - |\n| `defaultPath` | Worktree location | `../worktrees` |\n| `baseBranch` | Base for new branches | `main` |\n\n### Mode\n\n| Mode | Behavior | Use for |\n|------|----------|---------|\n| `symlink` | Links to original, changes sync instantly | migrations, shared configs |\n| `copy` | Independent copy, no sync | .env.local, credentials |\n\n### Base Branch\n\nControl where new branches are created from:\n\n```bash\n/worktree create feat/new              # From baseBranch (main)\n/worktree create feat/new from dev     # From dev\n/worktree create feat/new from current # From current branch\n```\n\nSet default in `.gwts`:\n```json\n{\n  \"baseBranch\": \"develop\"\n}\n```\n\n### Patterns\n\n```json\n{\n  \"includes\": [\n    \"migrations/\",          // directory\n    \".env.example\",         // file\n    \"apps/*/db/\"            // glob\n  ]\n}\n```\n\n## Examples\n\n**Node.js project:**\n```json\n{\n  \"includes\": [\"migrations/\", \".env.example\"],\n  \"hooks\": { \"postCreate\": \"npm install\" }\n}\n```\n\n**Monorepo:**\n```json\n{\n  \"includes\": [\"packages/*/migrations/\", \"apps/*/db/\"],\n  \"hooks\": { \"postCreate\": \"pnpm install\" }\n}\n```\n\n**Personal config** (`.claude/gwts/worktree.json`):\n```json\n{\n  \"includes\": [\".env.local\"],\n  \"mode\": \"copy\"\n}\n```\n\n## License\n\nMIT\n"
      },
      "plugins": [
        {
          "name": "gwts-cc",
          "source": "./",
          "description": "Git Worktree Sync for Claude Code",
          "version": "0.1.0",
          "categories": [],
          "install_commands": [
            "/plugin marketplace add baeseokjae/gwts-cc",
            "/plugin install gwts-cc@gwts-cc"
          ]
        }
      ]
    },
    {
      "name": "claude-code-cockpit",
      "version": null,
      "description": "Claude Code Cockpit - Next-generation statusline dashboard with 5 themes",
      "repo_full_name": "baeseokjae/claude-code-cockpit",
      "repo_url": "https://github.com/baeseokjae/claude-code-cockpit",
      "repo_description": "Next-generation real-time dashboard for Claude Code with themes, skill tracking, and detail mode",
      "signals": {
        "stars": 0,
        "forks": 0,
        "pushed_at": "2026-02-01T13:29:29Z"
      },
      "files": {
        ".claude-plugin/marketplace.json": "{\n  \"name\": \"claude-code-cockpit\",\n  \"owner\": {\n    \"name\": \"baeseokjae\",\n    \"email\": \"baeseokjae@gmail.com\"\n  },\n  \"metadata\": {\n    \"description\": \"Claude Code Cockpit - Next-generation statusline dashboard with 5 themes\",\n    \"version\": \"1.0.0\"\n  },\n  \"plugins\": [\n    {\n      \"name\": \"claude-code-cockpit\",\n      \"source\": \"./\",\n      \"description\": \"Real-time dashboard for Claude Code with themes (Aurora, Neon, Mono, Zen, Retro), skill tracking, smart alerts, and zero dependencies\",\n      \"version\": \"1.0.0\",\n      \"author\": {\n        \"name\": \"baeseokjae\",\n        \"url\": \"https://github.com/baeseokjae\"\n      },\n      \"homepage\": \"https://github.com/baeseokjae/claude-code-cockpit\",\n      \"repository\": \"https://github.com/baeseokjae/claude-code-cockpit\",\n      \"license\": \"MIT\",\n      \"keywords\": [\n        \"statusline\",\n        \"hud\",\n        \"dashboard\",\n        \"themes\",\n        \"monitoring\"\n      ],\n      \"category\": \"productivity\",\n      \"tags\": [\n        \"statusline\",\n        \"dashboard\",\n        \"themes\",\n        \"monitoring\"\n      ]\n    }\n  ]\n}\n",
        ".claude-plugin/plugin.json": "{\n  \"name\": \"claude-code-cockpit\",\n  \"version\": \"1.0.0\",\n  \"description\": \"Next-generation real-time dashboard for Claude Code with 5 themes, smart alerts, and zero dependencies\",\n  \"author\": {\n    \"name\": \"baeseokjae\",\n    \"email\": \"baeseokjae@gmail.com\",\n    \"url\": \"https://github.com/baeseokjae\"\n  },\n  \"homepage\": \"https://github.com/baeseokjae/claude-code-cockpit\",\n  \"repository\": \"https://github.com/baeseokjae/claude-code-cockpit\",\n  \"license\": \"MIT\",\n  \"keywords\": [\n    \"statusline\",\n    \"hud\",\n    \"dashboard\",\n    \"themes\",\n    \"monitoring\",\n    \"context\",\n    \"tools\",\n    \"agents\",\n    \"todos\",\n    \"skills\",\n    \"alerts\"\n  ],\n  \"commands\": \"./commands/\"\n}\n",
        "README.md": "# Claude Code Cockpit\n\n> Next-generation real-time dashboard for Claude Code\n\n[í•œêµ­ì–´](./README.ko.md)\n\nAdvanced HUD system for Claude Code featuring 5 themes, skill tracking, and detail mode.\n\n## âœ¨ Features\n\n- ğŸ¨ **5 Themes**: Aurora, Neon, Mono, Zen, Retro\n- ğŸ”§ **Tool Tracking**: Monitor Read, Edit, Bash, Grep, and all tool activity\n- ğŸ¤– **Agent Tracking**: Real-time Task subagent monitoring\n- âœ… **Todo Progress**: Track TodoWrite task status\n- âš¡ **Skill Tracking**: Monitor /commit, /review-pr and other skill invocations\n- ğŸ“Š **Git Status**: Branch name and dirty indicator\n- ğŸ’° **Cost Estimation**: Token-based cost calculation per model\n- ğŸš¨ **Smart Alerts**: Context/cost/session warnings\n- ğŸ“± **Responsive Layout**: Auto-adjusts to terminal width\n- ğŸš€ **Zero Dependencies**: Uses only Node.js built-in modules\n\n## ğŸš€ Installation\n\n### From Marketplace (Recommended)\n\nRun inside Claude Code:\n\n```bash\n# 1. Add marketplace source\n/plugin marketplace add baeseokjae/claude-code-cockpit\n\n# 2. Install plugin\n/plugin install claude-code-cockpit\n\n# 3. Configure statusline\n/claude-code-cockpit:setup\n```\n\n### Local Development\n\n```bash\n# Clone repository\ngit clone https://github.com/baeseokjae/claude-code-cockpit.git\ncd claude-code-cockpit\n\n# Install dependencies and build\npnpm install\npnpm build\n\n# Test locally\ncc --plugin-dir .\n```\n\n## ğŸ¨ Themes\n\n### Aurora (Default)\nInspired by Aurora Borealis. Polar night sky with green-teal-purple aurora gradients.\n\n### Neon\nCyberpunk neon sign aesthetic. High-contrast fluorescent green, cyan, and hot pink.\n\n### Mono\nPure black & white minimal. ASCII-compatible, accessibility-first design.\n\n### Zen\nUltra-minimal design. Calm tones inspired by traditional paper and ink.\n\n### Retro\n80s CRT phosphor monitor nostalgia. Green phosphor glow and vintage terminal vibes.\n\n## âš™ï¸ Configuration\n\nAfter installation, run `/claude-code-cockpit:configure` to set theme and display options, or use environment variables.\n\n### Environment Variables\n\n```bash\n# Select theme\nexport COCKPIT_THEME=aurora   # aurora, neon, mono, zen, retro\n\n# Enable detail mode\nexport COCKPIT_DETAIL=1\n\n# Path display depth\nexport COCKPIT_PATH_LEVELS=2\n```\n\n### Configuration File\n\n`~/.claude/plugins/claude-code-cockpit/config.json`:\n\n```json\n{\n  \"theme\": \"aurora\",\n  \"detailMode\": false,\n  \"display\": {\n    \"showGit\": true,\n    \"showTools\": true,\n    \"showAgents\": true,\n    \"showTodos\": true,\n    \"showSkills\": true,\n    \"showUsage\": false,\n    \"showCost\": true\n  }\n}\n```\n\n## ğŸš¨ Alerts\n\nAutomatic warnings when context usage is high or cost exceeds thresholds:\n\n- **Context Critical (90%+)**: Red bold `âš  CTX 95%!`\n- **Context Warning (75%+)**: Yellow `âš  CTX 80%`\n- **Cost Warning ($1+)**: Cost alert\n- **Session Long (30m+)**: Session duration info\n\n## ğŸ“¦ Development\n\n```bash\n# Build\npnpm build\n\n# Type check\npnpm lint\n\n# Test\npnpm test\n\n# Test stdin\necho '{\"model\":{\"display_name\":\"Opus\"},\"context_window\":{\"used_percentage\":45},\"cwd\":\"/test\"}' | node dist/index.js\n\n# Debug mode\necho '{\"model\":{\"display_name\":\"Opus\"}}' | DEBUG=* node dist/index.js\n```\n\n## ğŸ“ Project Structure\n\n```\nclaude-code-cockpit/\nâ”œâ”€â”€ .claude-plugin/\nâ”‚   â””â”€â”€ plugin.json      # Plugin manifest\nâ”œâ”€â”€ commands/\nâ”‚   â”œâ”€â”€ setup.md         # /claude-code-cockpit:setup\nâ”‚   â””â”€â”€ configure.md     # /claude-code-cockpit:configure\nâ”œâ”€â”€ src/\nâ”‚   â”œâ”€â”€ index.ts         # Main entry point\nâ”‚   â”œâ”€â”€ types/           # Type definitions\nâ”‚   â”œâ”€â”€ input/           # stdin, transcript parsing\nâ”‚   â”œâ”€â”€ data/            # Git, time, cost, alerts\nâ”‚   â”œâ”€â”€ config/          # Configuration loader\nâ”‚   â”œâ”€â”€ themes/          # Theme system\nâ”‚   â”œâ”€â”€ render/          # Rendering utilities\nâ”‚   â”œâ”€â”€ output/          # Output handling\nâ”‚   â””â”€â”€ utils/           # Debug, constants\nâ”œâ”€â”€ tests/               # Test files\nâ””â”€â”€ dist/                # Build output\n```\n\n## ğŸ’¡ Inspired By\n\nPlease check out these previous works that helped inspire the creation of claude-code-cockpit. ğŸ™\n\n- [jarrodwatts/claude-hud](https://github.com/jarrodwatts/claude-hud) â€“ A terminal-based HUD plugin for Claude Code.\n- Terminal powerline tools for status bar.\n\n## ğŸ“„ License\n\nMIT\n"
      },
      "plugins": [
        {
          "name": "claude-code-cockpit",
          "source": "./",
          "description": "Real-time dashboard for Claude Code with themes (Aurora, Neon, Mono, Zen, Retro), skill tracking, smart alerts, and zero dependencies",
          "version": "1.0.0",
          "author": {
            "name": "baeseokjae",
            "url": "https://github.com/baeseokjae"
          },
          "homepage": "https://github.com/baeseokjae/claude-code-cockpit",
          "repository": "https://github.com/baeseokjae/claude-code-cockpit",
          "license": "MIT",
          "keywords": [
            "statusline",
            "hud",
            "dashboard",
            "themes",
            "monitoring"
          ],
          "category": "productivity",
          "tags": [
            "statusline",
            "dashboard",
            "themes",
            "monitoring"
          ],
          "categories": [
            "dashboard",
            "hud",
            "monitoring",
            "productivity",
            "statusline",
            "themes"
          ],
          "install_commands": [
            "/plugin marketplace add baeseokjae/claude-code-cockpit",
            "/plugin install claude-code-cockpit@claude-code-cockpit"
          ]
        }
      ]
    }
  ]
}