{
  "author": {
    "id": "Bayonle",
    "display_name": "Bayonle",
    "avatar_url": "https://avatars.githubusercontent.com/u/15212861?v=4"
  },
  "marketplaces": [
    {
      "name": "agentic-engineering",
      "version": null,
      "description": "Autonomous multi-agent SDLC workflow system for Claude Code with quick task creation",
      "repo_full_name": "Bayonle/agentic-engineering",
      "repo_url": "https://github.com/Bayonle/agentic-engineering",
      "repo_description": null,
      "signals": {
        "stars": 0,
        "forks": 0,
        "pushed_at": "2026-02-06T13:48:31Z"
      },
      "files": {
        ".claude-plugin/marketplace.json": "{\n  \"name\": \"agentic-engineering\",\n  \"owner\": {\n    \"name\": \"Bayonle Amzat\",\n    \"email\": \"bayonleamzat@example.com\"\n  },\n  \"metadata\": {\n    \"description\": \"Autonomous multi-agent SDLC workflow system for Claude Code with quick task creation\",\n    \"version\": \"1.1.0\"\n  },\n  \"plugins\": [\n    {\n      \"name\": \"agentic-workflow\",\n      \"source\": \"./\",\n      \"description\": \"Autonomous multi-agent SDLC workflow system. PM writes PRDs, Architect designs solutions, Engineer implements code, QA tests features, DevOps deploys to production. Includes quick task creation with /task command.\",\n      \"version\": \"2.0.1\",\n      \"author\": {\n        \"name\": \"Bayonle Amzat\"\n      },\n      \"homepage\": \"https://github.com/Bayonle/agentic-engineering\",\n      \"repository\": \"https://github.com/Bayonle/agentic-engineering\",\n      \"license\": \"MIT\",\n      \"keywords\": [\n        \"workflow\",\n        \"agents\",\n        \"autonomous\",\n        \"sdlc\",\n        \"automation\",\n        \"pm\",\n        \"architect\",\n        \"engineer\",\n        \"qa\",\n        \"devops\"\n      ]\n    }\n  ]\n}\n",
        ".claude-plugin/plugin.json": "{\n  \"name\": \"agentic-workflow\",\n  \"version\": \"2.0.1\",\n  \"description\": \"Autonomous multi-agent SDLC workflow system with fresh context architecture. PM writes PRDs, Architect designs solutions, Engineer implements code, QA tests features, DevOps deploys to production. Each agent runs in isolated background context for scalability. Includes automatic git commits, documentation search via qmd, and complete task management.\",\n  \"author\": {\n    \"name\": \"Bayonle Amzat\",\n    \"email\": \"bayonleamzat@example.com\"\n  },\n  \"homepage\": \"https://github.com/Bayonle/agentic-engineering\",\n  \"repository\": \"https://github.com/Bayonle/agentic-engineering\",\n  \"license\": \"MIT\",\n  \"keywords\": [\n    \"workflow\",\n    \"agents\",\n    \"autonomous\",\n    \"sdlc\",\n    \"automation\",\n    \"pm\",\n    \"architect\",\n    \"engineer\",\n    \"qa\",\n    \"devops\",\n    \"git-commits\",\n    \"documentation\",\n    \"task-management\"\n  ]\n}\n",
        "README.md": "# Agentic Workflow - Autonomous SDLC System\n\n**Autonomous multi-agent workflow system for Claude Code**\n\nPM writes PRDs → Architect designs → Engineer implements → QA tests → DevOps deploys\n\nFull software development lifecycle automation with git commits, documentation search, and complete task management.\n\n---\n\n## Architecture\n\n**Fresh Context Design (v1.2.0)**: Each agent runs in isolated background context for scalability and accuracy.\n\n```\n/work orchestrator\n  ↓\n  Spawns PM (Task tool, fresh context) → PRD → Exit\n  ↓ (monitors completion)\n  Spawns Architect (fresh context) → Plan → Exit\n  ↓\n  Spawns Engineer (fresh context) → Code → Exit\n  ↓\n  Spawns QA (fresh context) → Tests → Exit\n  ↓\n  Spawns DevOps (fresh context) → Deploy → Exit\n  ↓\n  Complete!\n```\n\n**Why Fresh Context?**\n- ✅ **Scalable**: Handles 100+ step workflows without context bloat\n- ✅ **Accurate**: Fresh context prevents hallucinations in long tasks\n- ✅ **Resumable**: Pick up from any phase if interrupted\n- ✅ **Traceable**: Complete file-based audit trail\n- ✅ **Clean**: Agents communicate only via filesystem\n\n---\n\n## Features\n\n✅ **5 Autonomous Agents** - PM, Architect, Engineer, QA, DevOps\n✅ **Fresh Context Architecture** - Each agent in isolated background context\n✅ **Resume Capability** - Pick up from any phase\n✅ **Git Commits** - Each phase commits work automatically\n✅ **Documentation Search** - Integrated qmd CLI for research\n✅ **Task Management** - File-based task tracking\n✅ **Zero Setup** - Auto-initializes workspace on first use\n✅ **Works Anywhere** - No per-project configuration needed\n\n---\n\n## Installation\n\n### Install Plugin\n\n```bash\n# Add the marketplace\n/plugin marketplace add Bayonle/agentic-engineering\n\n# Install the plugin\n/plugin install agentic-workflow@agentic-engineering\n```\n\n**Alternative - Local installation:**\n```bash\n# Clone and install locally\ngit clone https://github.com/Bayonle/agentic-engineering.git\ncd agentic-engineering\nclaude plugin install .\n```\n\n### Verify Installation\n\n```bash\n# Check plugin is installed\nclaude plugin list\n\n# Test in any directory\ncd ~/my-project\n/pm --help\n```\n\n---\n\n## Quick Start\n\n### 1. Create a Task\n\n```bash\ncd ~/my-project\n\n# First use will auto-create workspace/\necho \"Add user authentication\" > workspace/tasks/inbox/task-001.md\n```\n\n### 2. Run Full Workflow\n\n```bash\n/work task-001\n```\n\nThat's it! The orchestrator will:\n- Spawn PM in background → writes PRD (you approve)\n- Resume: `/work task-001` → spawns Architect → designs solution (you approve)\n- Resume: `/work task-001` → spawns Engineer → implements code\n- Resume: `/work task-001` → spawns QA → tests feature (you approve deployment)\n- Resume: `/work task-001` → spawns DevOps → deploys to production\n\n**Each agent runs in fresh context for accuracy and scalability!**\n\n### 3. Or Run Individual Agents\n\n```bash\n/pm task-001        # PM only\n/architect task-001 # Architect only\n/engineer task-001  # Engineer only\n/qa task-001        # QA only\n/deploy task-001    # Deploy only\n```\n\n---\n\n## Available Commands\n\n| Command | Agent | Purpose |\n|---------|-------|---------|\n| `/work task-id` | All | Full workflow PM→Architect→Engineer→QA→DevOps |\n| `/task \"title\" [agent] [status]` | - | **Quick task creation** and assignment |\n| `/pm task-id` | PM | Research requirements, write PRD |\n| `/architect task-id` | Architect | Design solution, create technical plan |\n| `/engineer task-id` | Engineer | Implement code, create PR |\n| `/qa task-id` | QA | Test feature, verify quality |\n| `/deploy task-id` | DevOps | Deploy to production |\n\n### Quick Task Creation\n\n```bash\n# Create task in inbox\n/task \"Implement Swagger docs\"\n\n# Create and assign to engineer (skips PM/Architect)\n/task \"Add user auth\" engineer\n\n# Create with specific status\n/task \"Fix bug\" engineer in-progress\n```\n\n---\n\n## Workflow\n\n```\n┌─────────────────────────────────────────────────────────┐\n│  /work task-001                                         │\n└─────────────────────────────────────────────────────────┘\n                          │\n                          ↓\n┌─────────────────────────────────────────────────────────┐\n│  PM Agent                                               │\n│  - Researches requirements with qmd                     │\n│  - Writes comprehensive PRD                             │\n│  - Requests human approval                              │\n│  - Git commits PRD                                      │\n└─────────────────────────────────────────────────────────┘\n                          │ (auto-handoff)\n                          ↓\n┌─────────────────────────────────────────────────────────┐\n│  Architect Agent                                        │\n│  - Reads PRD                                            │\n│  - Researches patterns with qmd                         │\n│  - Designs technical solution                           │\n│  - Creates implementation plan                          │\n│  - Requests human approval                              │\n│  - Git commits plan                                     │\n└─────────────────────────────────────────────────────────┘\n                          │ (auto-handoff)\n                          ↓\n┌─────────────────────────────────────────────────────────┐\n│  Engineer Agent                                         │\n│  - Reads plan                                           │\n│  - Researches APIs with qmd                             │\n│  - Implements feature                                   │\n│  - Writes tests                                         │\n│  - Creates PR                                           │\n│  - Git commits code                                     │\n└─────────────────────────────────────────────────────────┘\n                          │ (auto-handoff)\n                          ↓\n┌─────────────────────────────────────────────────────────┐\n│  QA Agent                                               │\n│  - Runs tests                                           │\n│  - Verifies quality                                     │\n│  - Requests deployment approval                         │\n│  - Git commits test reports                             │\n└─────────────────────────────────────────────────────────┘\n                          │ (auto-handoff)\n                          ↓\n┌─────────────────────────────────────────────────────────┐\n│  DevOps Agent                                           │\n│  - Deploys to production                                │\n│  - Verifies health checks                               │\n│  - Marks task complete                                  │\n│  - Git commits deployment                               │\n└─────────────────────────────────────────────────────────┘\n                          │\n                          ↓\n                    ✅ Feature Live!\n```\n\n---\n\n## Workspace Structure\n\nOn first use, the plugin auto-creates this structure:\n\n```\nyour-project/\n└── workspace/\n    ├── agents/              # Agent memory\n    │   ├── pm/\n    │   │   ├── SOUL.md      # PM personality & knowledge\n    │   │   └── WORKING.md   # Current state\n    │   ├── architect/\n    │   ├── engineer/\n    │   ├── qa/\n    │   └── devops/\n    ├── tasks/               # Task management\n    │   ├── inbox/           # New tasks\n    │   ├── in-planning/     # Being planned\n    │   ├── ready-to-build/  # Ready to code\n    │   ├── ready-for-testing/ # Ready to test\n    │   ├── ready-to-deploy/ # Ready to ship\n    │   └── deployed/        # Complete\n    ├── docs/\n    │   ├── specs/           # PRDs\n    │   ├── plans/           # Technical plans\n    │   ├── qa-reports/      # Test reports\n    │   └── deployment-reports/ # Deployment logs\n    └── activity.log         # Agent activity\n```\n\n---\n\n## Git Commits\n\nEach agent automatically commits their work:\n\n```bash\n# After workflow completes:\n$ git log --oneline --author=\"Claude\"\n\nabc1234 [DevOps] Deploy user authentication to production\ndef5678 [QA] Test and approve user authentication\nghi9012 [Engineer] Implement user authentication\njkl3456 [Architect] Create technical plan for user authentication\nmno7890 [PM] Create PRD for user authentication\n```\n\n**Commit format:**\n```\n[AgentRole] Action for task\n\nDetails here\n\nCo-Authored-By: Claude Sonnet 4.5 <noreply@anthropic.com>\n```\n\n---\n\n## Documentation Search\n\nAgents use [qmd CLI](https://github.com/tobi/qmd) for fast documentation lookup:\n\n**PM researches:**\n```bash\nqmd \"JWT authentication best practices\"\nqmd \"ASP.NET Core security\"\n```\n\n**Architect researches:**\n```bash\nqmd \"ASP.NET Core middleware pipeline\"\nqmd \"PostgreSQL indexing strategies\"\n```\n\n**Engineer researches:**\n```bash\nqmd \"Entity Framework async queries\"\nqmd \"C# record types\"\n```\n\n**Install qmd (optional but recommended):**\n```bash\n# See: https://github.com/tobi/qmd\n```\n\n---\n\n## Configuration\n\nOptional `.agent-config.json` in your project:\n\n```json\n{\n  \"git_commits\": true,\n  \"qmd_enabled\": true,\n  \"auto_push\": true,\n  \"project_name\": \"my-project\"\n}\n```\n\n---\n\n## Examples\n\n### Example 1: Full Workflow\n\n```bash\ncd ~/my-saas-app\n\n# Create task\ncat > workspace/tasks/inbox/task-001.md << 'EOF'\nAdd user profile endpoint\n\nGET /api/users/{id}\nShould return user profile with email, name, created date\nEOF\n\n# Run full workflow\n/work task-001\n\n# Agents will:\n# 1. PM writes PRD (you approve)\n# 2. Architect designs API (you approve)\n# 3. Engineer implements endpoint\n# 4. QA tests it\n# 5. DevOps deploys (you approve)\n```\n\n### Example 2: Skip to Engineer\n\n```bash\n# You already have PRD and plan, just need code\n/engineer task-002\n```\n\n### Example 3: Deploy Only\n\n```bash\n# Code and tests done, just deploy\n/deploy task-003\n```\n\n---\n\n## Agent Personalities\n\nEach agent has a distinct personality and expertise:\n\n**PM Agent**\n- Strategic coordinator\n- User-focused\n- Decisive and pragmatic\n- Writes clear, actionable PRDs\n\n**Architect Agent**\n- Thoughtful technical leader\n- Pragmatic over clever\n- Explains trade-offs\n- Designs for maintainability\n\n**Engineer Agent**\n- Practical craftsperson\n- Quality-conscious\n- Pattern-aware\n- Ships working code\n\n**QA Agent**\n- Quality gatekeeper\n- Thorough tester\n- Clear communicator\n- Ensures reliability\n\n**DevOps Agent**\n- Deployment specialist\n- Cautious and methodical\n- Verifies health\n- Ensures uptime\n\n---\n\n## Approval Gates\n\nYou'll be asked to approve at these points:\n\n**After PM:**\n- Review PRD: `cat workspace/docs/specs/task-001-prd.md`\n- Approve: Tell Claude \"I approve the PRD for task-001\"\n\n**After Architect:**\n- Review plan: `cat workspace/docs/plans/task-001-plan.md`\n- Approve: Tell Claude \"I approve the plan for task-001\"\n\n**After QA:**\n- Review tests: Check test results in comments\n- Approve: Tell Claude \"I approve deployment for task-001\"\n\n---\n\n## Monitoring\n\nWatch agent activity in real-time:\n\n```bash\n# Tail activity log\ntail -f workspace/activity.log\n\n# Check task status\ncat workspace/tasks/in-progress/*.md\n\n# View git commits\ngit log --oneline --author=\"Claude\"\n```\n\n---\n\n## Advanced Usage\n\n### Custom SOUL Templates\n\nCustomize agent personalities:\n\n```bash\n# Edit PM personality\nvim workspace/agents/pm/SOUL.md\n\n# Changes apply to this project only\n```\n\n### Manual Task Assignment\n\n```bash\n# Skip phases manually\npython3 << 'EOF'\nimport sys\nsys.path.append('.claude/plugins/agentic-workflow/lib')\nfrom task_manager import get_task_manager\n\ntm = get_task_manager('workspace')\ntm.move_task('task-001', 'ready-to-build')\ntm.assign_task('task-001', 'engineer')\nEOF\n\n/engineer task-001\n```\n\n---\n\n## Troubleshooting\n\n### Workspace not created\n\n```bash\n# Manually trigger workspace creation\ncd ~/my-project\n/pm task-001\n# Will auto-create workspace/\n```\n\n### Git commits not working\n\n```bash\n# Initialize git in your project\ncd ~/my-project\ngit init\ngit remote add origin <your-repo-url>\n```\n\n### qmd not found\n\n```bash\n# Install qmd (optional)\n# See: https://github.com/tobi/qmd\n# Agents continue without qmd\n```\n\n---\n\n## Requirements\n\n- Claude Code CLI\n- Python 3.7+\n- Git (optional, for commits)\n- qmd CLI (optional, for docs)\n- LSP plugins (optional, for code intelligence)\n\n---\n\n## Recommended: Install LSP Plugins\n\nFor better code quality, install Language Server Protocol plugins so the Engineer agent can see type errors immediately:\n\n```bash\n# Python projects\n/plugin install pyright-lsp@claude-plugins-official\n\n# TypeScript/JavaScript\n/plugin install typescript-lsp@claude-plugins-official\n\n# Go\n/plugin install gopls-lsp@claude-plugins-official\n\n# Rust\n/plugin install rust-analyzer-lsp@claude-plugins-official\n\n# C#\n/plugin install csharp-lsp@claude-plugins-official\n\n# More at: https://code.claude.com/docs/en/discover-plugins\n```\n\n**What LSP provides:**\n- ✅ Automatic type error detection after every edit\n- ✅ Missing import warnings\n- ✅ Syntax error flagging\n- ✅ Code navigation (jump to definition, find references)\n- ✅ Engineer agent fixes issues immediately\n\n**Note:** LSP plugins require the language server binary installed (e.g., `pyright-langserver`, `typescript-language-server`).\n\n---\n\n## Recommended: Install agent-browser for UI Testing\n\nFor automated UI verification, install agent-browser so the QA agent can test visual changes:\n\n```bash\nnpm install -g @vercel/agent-browser\n```\n\n**What agent-browser provides:**\n- ✅ Automated screenshot capture\n- ✅ UI element verification\n- ✅ Visual regression testing\n- ✅ Interactive browser testing (click, fill, navigate)\n- ✅ Screenshots saved in test reports\n\n**Available commands:**\n```bash\nagent-browser screenshot [url]           # Capture page screenshot\nagent-browser click [ref] [url]          # Click UI elements\nagent-browser fill [ref] [value] [url]   # Fill form fields\nagent-browser extract [ref] [url]        # Extract text/data\nagent-browser navigate [url]             # Navigate to page\n```\n\n**How QA uses it:**\n1. QA agent runs your app (e.g., `http://localhost:5000`)\n2. Takes screenshots of the feature\n3. Verifies UI elements are present\n4. Saves screenshots to `workspace/docs/qa-reports/screenshots/`\n5. Includes screenshots in test report\n\n---\n\n## License\n\nMIT License - See LICENSE file\n\n---\n\n## Contributing\n\nContributions welcome! Please:\n\n1. Fork the repository\n2. Create feature branch\n3. Make changes\n4. Test with real workflows\n5. Submit pull request\n\n---\n\n## Support\n\n- GitHub Issues: https://github.com/bayonleamzat/agentic-workflow/issues\n- Documentation: See docs/ folder\n- Examples: See examples/ folder\n\n---\n\n## Roadmap\n\n- [ ] Support for more languages/frameworks\n- [ ] Integration with CI/CD platforms\n- [ ] Slack/Discord notifications\n- [ ] Custom agent roles\n- [ ] Team collaboration features\n- [ ] Metrics and analytics\n\n---\n\n**Made with ❤️ for autonomous development**\n\nStart shipping faster with AI agents that handle the full SDLC!\n"
      },
      "plugins": [
        {
          "name": "agentic-workflow",
          "source": "./",
          "description": "Autonomous multi-agent SDLC workflow system. PM writes PRDs, Architect designs solutions, Engineer implements code, QA tests features, DevOps deploys to production. Includes quick task creation with /task command.",
          "version": "2.0.1",
          "author": {
            "name": "Bayonle Amzat"
          },
          "homepage": "https://github.com/Bayonle/agentic-engineering",
          "repository": "https://github.com/Bayonle/agentic-engineering",
          "license": "MIT",
          "keywords": [
            "workflow",
            "agents",
            "autonomous",
            "sdlc",
            "automation",
            "pm",
            "architect",
            "engineer",
            "qa",
            "devops"
          ],
          "categories": [
            "agents",
            "architect",
            "automation",
            "autonomous",
            "devops",
            "engineer",
            "pm",
            "qa",
            "sdlc",
            "workflow"
          ],
          "install_commands": [
            "/plugin marketplace add Bayonle/agentic-engineering",
            "/plugin install agentic-workflow@agentic-engineering"
          ]
        }
      ]
    }
  ]
}