{
  "author": {
    "id": "benredmond",
    "display_name": "Ben Redmond",
    "avatar_url": "https://avatars.githubusercontent.com/u/31708703?u=42fb87fea47aa921d62600bfddf710d05c5d7794&v=4"
  },
  "marketplaces": [
    {
      "name": "apex",
      "version": null,
      "description": "APEX Intelligence Layer - Pattern discovery, task tracking, and continuous learning for AI coding assistants",
      "repo_full_name": "benredmond/apex",
      "repo_url": "https://github.com/benredmond/apex",
      "repo_description": null,
      "signals": {
        "stars": 0,
        "forks": 0,
        "pushed_at": "2026-01-30T17:49:33Z"
      },
      "files": {
        ".claude-plugin/marketplace.json": "{\n  \"name\": \"apex\",\n  \"owner\": {\n    \"name\": \"Ben\",\n    \"url\": \"https://github.com/benredmond\"\n  },\n  \"plugins\": [\n    {\n      \"name\": \"apex\",\n      \"source\": \"./\",\n      \"description\": \"APEX Intelligence Layer - Pattern discovery, task tracking, and continuous learning for AI coding assistants\"\n    }\n  ]\n}\n",
        ".claude-plugin/plugin.json": "{\n  \"name\": \"apex\",\n  \"version\": \"0.5.8\",\n  \"description\": \"Pattern discovery, task tracking, and continuous learning for AI coding assistants. Provides 13 MCP tools for intelligent memory, context-aware pattern lookup, trust-scored recommendations, and comprehensive pattern browsing.\",\n  \"author\": {\n    \"name\": \"Ben\",\n    \"url\": \"https://github.com/benredmond\"\n  },\n  \"homepage\": \"https://github.com/benredmond/apex\",\n  \"repository\": \"https://github.com/benredmond/apex\",\n  \"license\": \"MIT\",\n  \"keywords\": [\n    \"ai\",\n    \"patterns\",\n    \"mcp\",\n    \"intelligence\",\n    \"learning\",\n    \"workflow\",\n    \"automation\"\n  ],\n  \"mcpServers\": {\n    \"apex\": {\n      \"command\": \"npx\",\n      \"args\": [\n        \"@benredmond/apex\",\n        \"mcp\",\n        \"serve\"\n      ],\n      \"env\": {}\n    }\n  }\n}\n",
        "README.md": "# APEX - Stop Your AI From Making The Same Mistakes Twice\n\n> APEX gives AI assistants memory, learning, and pattern recognition for 40-55% faster development\n\n[![npm version](https://badge.fury.io/js/%40benredmond%2Fapex.svg)](https://badge.fury.io/js/%40benredmond%2Fapex)\n[![License: MIT](https://img.shields.io/badge/License-MIT-yellow.svg)](https://opensource.org/licenses/MIT)\n[![Node.js Version](https://img.shields.io/badge/node-%3E%3D14-brightgreen)](https://nodejs.org)\n[![Works Everywhere](https://img.shields.io/badge/works-everywhere-blue)](https://www.npmjs.com/package/@benredmond/apex)\n\n```bash\n# See APEX in action - no installation required!\nnpx @benredmond/apex start\n```\n\n## ğŸŒ Universal Compatibility\n\n**APEX now works everywhere** - no compilation, no native module errors, just intelligence:\n\n- âœ… **Works on Node.js 14+** - Supports all modern Node versions\n- ğŸ“¦ **93% smaller package** - Reduced from 66.8MB to ~5MB\n- ğŸš€ **Zero compilation required** - No build tools or Python needed\n- ğŸ¯ **Automatic optimization** - Uses the fastest available SQLite adapter\n- ğŸ›¡ï¸ **Always works** - Graceful fallback ensures compatibility\n\n## The Problem\n\nYour AI coding assistant is powerful, but it:\n- ğŸ”„ Repeats the same mistakes\n- ğŸ¤· Doesn't learn from your codebase\n- ğŸ“‹ Lacks memory between sessions\n- ğŸ¯ Misses patterns that could save hours\n\n## The Solution\n\nAPEX transforms your AI assistant into an intelligent development partner that learns and improves:\n\n```\nWithout APEX: AI suggests generic solution â†’ Often wrong â†’ You fix it â†’ AI forgets\nWith APEX:    AI recalls what worked â†’ Applies proven patterns â†’ Prevents past failures â†’ Gets smarter\n```\n\n## Why APEX?\n\n### ğŸ¯ Four Key Differentiators\n\n1. **Universal Compatibility** - Works on any Node.js 14+ without compilation\n2. **Zero-Runtime Intelligence** - No background processes, no performance impact\n3. **Pattern Evolution** - Discovers, validates, and promotes patterns automatically\n4. **Failure Prevention** - Learns from mistakes to prevent repetition\n\n### ğŸ’¬ Real Developer Experience\n\n> \"After 50 tasks, APEX prevented every single MongoDB async/await error that used to waste 30 minutes each time. The pattern system is like having a senior developer's knowledge built into my AI.\" - APEX User\n\n## Getting Started\n\n**No compilation required!** APEX works instantly on any system with Node.js 14+:\n\n### ğŸš€ Try It Now (Recommended)\n```bash\n# Run this in any project - works instantly, no build tools needed\nnpx @benredmond/apex start\n\n# That's it! APEX is now active in your AI assistant\n```\n\n### ğŸ“¦ Install Globally\n```bash\n# Install once, use everywhere\nnpm install -g @benredmond/apex\napex start\n```\n\n### ğŸ› ï¸ CLI Commands\n```bash\napex start              # Initialize APEX in your project\napex patterns list      # View available patterns\napex patterns search    # Find patterns by text\napex tasks list         # View tasks\napex tasks stats        # Task metrics\napex doctor             # System health check\napex mcp install        # Setup MCP integration\n```\n\n### ğŸš€ Workflow Commands (Claude Code Plugin)\n```bash\n/apex:research <task>     # Gather intelligence via parallel agents\n/apex:plan <task-id>      # Transform research into architecture\n/apex:implement <task-id> # Build and validate code\n/apex:ship <task-id>      # Review, commit, and reflect\n/apex:execute <task>      # Run full workflow (research â†’ plan â†’ implement â†’ ship)\n/apex:debug <task-id>     # Systematic debugging with pattern learning\n/apex:review-pr           # Adversarial code review\n```\n\n## Your First APEX Workflow\n\nLet's fix a bug using APEX intelligence:\n\n```bash\n# 1. In your project\nnpx @benredmond/apex start\n\n# 2. In Claude Code, run the full workflow\n/apex:execute \"Fix authentication test timeout error\"\n```\n\nOr step-by-step for more control:\n\n```bash\n/apex:research \"Fix authentication test timeout error\"  # Creates task, gathers intel\n/apex:plan T001                                         # Design the fix\n/apex:implement T001                                    # Build and test\n/apex:ship T001                                         # Review, commit, reflect\n```\n\n### What APEX Does Behind the Scenes\n\n```\nğŸ” RESEARCH... Spawning parallel agents for intelligence gathering\nğŸ“š PATTERNS... Found 3 relevant patterns from database\nğŸ—ï¸ PLAN... Designing architecture with 5 mandatory artifacts\nğŸ”¨ IMPLEMENT... Building with pattern-guided development\nâœ… VALIDATE... Running tests until green\nğŸ” REVIEW... Adversarial code review via specialized agents\nğŸ“ REFLECT... Updating pattern trust scores based on outcome\n```\n\n## Core Concepts\n\n### ğŸ§  APEX Intelligence Engine\n\nThink of APEX as your AI's long-term memory and pattern recognition system:\n\n```\nYour Code â†’ APEX Learns â†’ AI Remembers â†’ Better Suggestions â†’ Less Debugging\n```\n\n**Key Components:**\n- **Pattern Recognition**: Tracks what works with trust scores (â˜…â˜…â˜…â˜…â˜…)\n- **Failure Database**: Never repeat the same mistake\n- **Smart Context**: Loads only relevant patterns per task\n- **Complexity Routing**: Simple tasks stay fast, complex tasks get deep analysis\n\n### ğŸ“Š Pattern Lifecycle\n\nWatch patterns evolve from discovery to trusted solution:\n\n```\nNEW DISCOVERY          TESTING              VALIDATED            TRUSTED\n     â†“                    â†“                    â†“                   â†“\n[untracked] â”€â”€â†’ [â˜…â˜…â˜…â˜†â˜† 1 use] â”€â”€â†’ [â˜…â˜…â˜…â˜…â˜† 3 uses] â”€â”€â†’ [â˜…â˜…â˜…â˜…â˜… 47 uses]\n              CONVENTIONS.pending.md                    CONVENTIONS.md\n```\n\nReal example:\n```javascript\n[PAT:AUTH:JWT] â˜…â˜…â˜…â˜…â˜… (47 uses, 98% success)\n// Secure JWT implementation - discovered in T012, now prevents auth vulnerabilities\nconst token = jwt.sign(payload, process.env.JWT_SECRET, { expiresIn: '24h' });\n```\n\n### ğŸ”„ 4-Phase Workflow\n\nEvery task follows a proven methodology via skills and commands:\n\n```\n/apex:research â†’ /apex:plan â†’ /apex:implement â†’ /apex:ship\n       â†“              â†“              â†“              â†“\n    Gather       Architect        Build        Review &\n    Intel         Design         & Test        Reflect\n```\n\nEach phase is powered by specialized agents and MCP tools:\n- **RESEARCH**: Parallel agents gather patterns, git history, similar tasks\n- **PLAN**: 5 mandatory design artifacts (Chain of Thought, Tree of Thought, etc.)\n- **IMPLEMENT**: Pattern-guided development with continuous validation\n- **SHIP**: Adversarial review, commit, and reflection to update trust scores\n\n### ğŸ“‹ Task Hierarchy\n\nOrganize work the way you think:\n\n```\nğŸ“Œ Milestone: \"User Authentication System\"\n  â””â”€â”€ ğŸ“… Sprint: \"Core Auth Features\"\n        â”œâ”€â”€ ğŸ“‹ Task: \"Design auth schema\"     [2h]\n        â”œâ”€â”€ ğŸ“‹ Task: \"Build login API\"       [3h]\n        â””â”€â”€ ğŸ“‹ Task: \"Add JWT middleware\"    [2h]\n```\n\n## Workflows & Examples\n\n### ğŸ› Workflow 1: Fixing a Bug\n\n**Scenario**: Your test suite has a flaky test that fails intermittently.\n\n```bash\n# Run full workflow\n/apex:execute \"Fix flaky user creation test\"\n\n# Or step by step:\n/apex:research \"Fix flaky user creation test\"   # â†’ Creates T001\n/apex:plan T001\n/apex:implement T001\n/apex:ship T001\n```\n\n**APEX in Action:**\n```\nğŸ” RESEARCH PHASE:\n- Spawning: intelligence-gatherer, git-historian, failure-predictor\n- Found 5 similar flaky test fixes in history\n- Pattern match: [FIX:TEST:ASYNC_RACE] (â˜…â˜…â˜…â˜…â˜… 94% success)\n\nğŸ—ï¸ PLAN PHASE:\n- Chain of Thought: Race condition in async setup\n- Tree of Thought: 3 approaches evaluated\n- Selected: Add proper await + cleanup pattern\n\nğŸ”¨ IMPLEMENT PHASE:\n- Applied [FIX:TEST:ASYNC_RACE] pattern\n- Tests green after 2 iterations\n\nğŸš€ SHIP PHASE:\n- Adversarial review: No issues found\n- Committed: \"fix: resolve race condition in user test\"\n- Reflection submitted: Pattern trust 94% â†’ 95%\n```\n\n### ğŸš€ Workflow 2: Adding a Feature\n\n**Scenario**: Add email notifications to your application.\n\n```bash\n/apex:execute \"Add email notification system with SendGrid\"\n```\n\n**APEX Intelligence Throughout:**\n```\nğŸ” RESEARCH:\n- 7 agents spawned in parallel\n- Found 12 email implementation patterns\n- Similar tasks: T089 (email templates), T102 (SendGrid)\n\nğŸ—ï¸ PLAN:\n- 5 design artifacts created\n- Architecture: Template-based with provider abstraction\n- YAGNI check: Removed unnecessary multi-provider support\n\nğŸ”¨ IMPLEMENT:\n- Applied patterns: [PAT:EMAIL:TEMPLATE], [PAT:API:RETRY]\n- Tests passing after 3 iterations\n- Coverage: 87%\n\nğŸš€ SHIP:\n- Review agents found 1 medium issue (fixed)\n- New pattern discovered: SendGrid webhook validation\n- Reflection: 3 patterns updated, 1 new pattern added\n```\n\n### ğŸ”§ Workflow 3: Refactoring Legacy Code\n\n**Scenario**: Modernize callback-based code to async/await.\n\n```bash\n/apex:research \"Refactor payment.js from callbacks to async/await\"\n/apex:plan T001\n/apex:implement T001\n/apex:ship T001\n```\n\n**Pattern Discovery in Action:**\n```\nğŸ” RESEARCH:\n- systems-researcher: Mapped 147 callback chains\n- git-historian: Found similar refactor in commit abc123\n- Pattern: [PAT:REFACTOR:CALLBACK_TO_ASYNC] â˜…â˜…â˜…â˜…â˜…\n\nğŸ—ï¸ PLAN:\n- Progressive refactoring strategy\n- 12 files identified, priority ordered\n- Risk analysis: High-churn payment.js needs extra tests\n\nğŸ”¨ IMPLEMENT:\n- Refactored in 4 batches, tests green each batch\n- Applied [PAT:REFACTOR:PROGRESSIVE] pattern\n\nğŸš€ SHIP:\n- Review: Clean, no issues\n- New pattern discovered: Payment provider error mapping\n- Reflection submitted with evidence\n```\n\n## Command Reference\n\n### ğŸš€ Workflow Commands (Claude Code)\n\nThe primary workflow uses 4 phase-based commands:\n\n```bash\n/apex:research <task-description>    # Phase 1: Spawn agents, gather intelligence\n/apex:plan <task-id>                 # Phase 2: Design architecture with 5 artifacts\n/apex:implement <task-id>            # Phase 3: Build code, run tests, iterate\n/apex:ship <task-id>                 # Phase 4: Review, commit, reflect\n```\n\nResearch now produces a versioned `task-contract` (intent, scope, ACs, NFRs). Plan/Implement/Ship must validate against it, and any scope changes require an explicit amendment with rationale and a version bump.\n\nOr run all phases in sequence:\n```bash\n/apex:execute <task-description>     # Full workflow: research â†’ plan â†’ implement â†’ ship\n```\n\n### ğŸ› Debugging Command\n```bash\n/apex:debug <task-id|error>          # Systematic debugging with pattern learning\n```\n\n### âœ… Quality Commands\n```bash\n/apex:review-pr                      # Adversarial code review with specialized agents\n```\n\n### âš™ï¸ CLI Commands (Terminal)\n```bash\napex start                      # Initialize APEX in your project\napex patterns list              # View discovered patterns\napex patterns search <query>    # Search patterns\napex tasks list                 # View tasks\napex doctor                     # System health check\napex mcp install                # Setup MCP integration\n```\n\n## Advanced Usage\n\n### Pattern Management\n\nView and manage your pattern library:\n\n```bash\n# In terminal\nnpx @benredmond/apex patterns         # List all active patterns\nnpx @benredmond/apex patterns pending  # Show patterns being tested\nnpx @benredmond/apex patterns stats    # Pattern usage statistics\n```\n\nShare patterns with your team:\n```bash\n# Patterns are stored in version control\ngit add .apex/CONVENTIONS.md\ngit commit -m \"Share authentication patterns\"\n```\n\n### Gemini Integration\n\nFor complex tasks (complexity â‰¥7), APEX automatically engages Gemini for deeper analysis:\n\n```json\n// .apex/config.json\n{\n  \"apex\": {\n    \"geminiApiKey\": \"your-api-key\",\n    \"complexityThreshold\": 7,  // When to engage Gemini\n    \"geminiModel\": \"gemini-pro\"\n  }\n}\n```\n\n### Custom Configuration\n\nFine-tune APEX behavior:\n\n```json\n{\n  \"apex\": {\n    \"patternPromotionThreshold\": 3,    // Uses before promotion\n    \"trustScoreThreshold\": 0.8,        // Success rate for promotion\n    \"autoPatternDiscovery\": true,      // Find patterns automatically\n    \"contextTokenBudget\": 30000,       // Max context size\n    \"enableFailurePrevention\": true    // Warn about past failures\n  }\n}\n```\n\n## Project Structure\n\nAPEX uses a centralized database and plugin architecture:\n\n```\n~/.apex/                            # Global APEX data directory\nâ”œâ”€â”€ <repo-id>/                      # Per-repository intelligence\nâ”‚   â””â”€â”€ patterns.db                 # SQLite database (patterns, tasks, reflections)\nâ”‚\nyour-project/\nâ”œâ”€â”€ .apex/                          # Project-specific files (optional)\nâ”‚   â””â”€â”€ tasks/                      # Task files created by /research\nâ”‚       â””â”€â”€ T001.md                 # Task brief with research, plan, evidence\nâ”‚\n# Plugin components (in apex package)\nâ”œâ”€â”€ skills/                         # 7 workflow skills\nâ”‚   â”œâ”€â”€ research/SKILL.md           # Intelligence gathering\nâ”‚   â”œâ”€â”€ plan/SKILL.md               # Architecture design\nâ”‚   â”œâ”€â”€ implement/SKILL.md          # Build and validate\nâ”‚   â”œâ”€â”€ ship/SKILL.md               # Review and reflect\nâ”‚   â”œâ”€â”€ execute/SKILL.md            # Full workflow orchestrator\nâ”‚   â”œâ”€â”€ debug/SKILL.md              # Systematic debugging\nâ”‚   â””â”€â”€ using-apex-mcp/SKILL.md     # MCP tools reference\nâ”œâ”€â”€ agents/                         # 12 specialized agents\nâ”‚   â”œâ”€â”€ intelligence-gatherer.md    # Orchestrates research\nâ”‚   â”œâ”€â”€ git-historian.md            # Git history analysis\nâ”‚   â”œâ”€â”€ systems-researcher.md       # Codebase deep dives\nâ”‚   â””â”€â”€ ...                         # And 9 more\nâ””â”€â”€ commands/                       # Slash commands\n    â”œâ”€â”€ research.md                 # /apex:research\n    â”œâ”€â”€ plan.md                     # /apex:plan\n    â”œâ”€â”€ implement.md                # /apex:implement\n    â”œâ”€â”€ ship.md                     # /apex:ship\n    â””â”€â”€ execute.md                  # /apex:execute\n```\n\n## Troubleshooting\n\n### Common Issues\n\n**Skills/commands not appearing in Claude Code**\n- Verify plugin is installed: `/plugins` in Claude Code\n- Reinstall: `/plugins install apex`\n- Check MCP server: `apex mcp info`\n\n**Patterns not being applied**\n- Check pattern trust score - must be â˜…â˜…â˜…â˜†â˜† or higher\n- Verify pattern context matches your use case\n- Run `apex patterns list` to see available patterns\n\n**MCP tools not responding**\n- Run `apex doctor` to check system health\n- Verify database exists: `ls ~/.apex/`\n- Check MCP server: `apex mcp serve` (manual test)\n\n### FAQ\n\n**Q: How does APEX work with my AI assistant?**\nA: APEX provides markdown-based commands that guide your AI through proven workflows. It's like giving your AI a memory and a methodology.\n\n**Q: Is my code/data private?**\nA: Yes. APEX runs locally and stores all patterns/learnings in your project. Nothing is sent to external servers except optional Gemini API calls for complex tasks.\n\n**Q: Can I use APEX with [Cursor/GitHub Copilot/other AI]?**\nA: Yes! APEX works with any AI that can read markdown files and execute commands. The commands are universal.\n\n**Q: How long before I see productivity gains?**\nA: Immediately for workflow organization. Pattern benefits appear after 5-10 tasks. Full 40-55% gains typically seen after 50+ tasks as the pattern library grows.\n\n**Q: Can I share patterns with my team?**\nA: Yes! Patterns are stored in `.apex/CONVENTIONS.md` which can be committed to version control and shared.\n\n## Performance & Database Adapters\n\nAPEX automatically selects the best SQLite adapter for your environment:\n\n### Three-Tier Adapter System\n```\nâ”Œâ”€â”€â”€â”€â”€â”€â”€â”€â”€â”€â”€â”€â”€â”€â”€â”€â”€â”€â”€â”€â”€â”€â”€â”€â”€â”€â”€â”€â”€â”€â”€â”€â”€â”€â”€â”€â”€â”\nâ”‚     Automatic Adapter Selection     â”‚\nâ”œâ”€â”€â”€â”€â”€â”€â”€â”€â”€â”€â”€â”€â”€â”€â”€â”€â”€â”€â”€â”€â”€â”€â”€â”€â”€â”€â”€â”€â”€â”€â”€â”€â”€â”€â”€â”€â”€â”¤\nâ”‚ Node 22+ â†’ node:sqlite (built-in)  â”‚\nâ”‚ Node 14-21 â†’ better-sqlite3/sql.js â”‚\nâ”‚ Containers â†’ sql.js (universal)    â”‚\nâ””â”€â”€â”€â”€â”€â”€â”€â”€â”€â”€â”€â”€â”€â”€â”€â”€â”€â”€â”€â”€â”€â”€â”€â”€â”€â”€â”€â”€â”€â”€â”€â”€â”€â”€â”€â”€â”€â”˜\n```\n\n**Performance comparison:**\n| Operation | Native | WASM | Impact |\n|-----------|--------|------|--------|\n| Pattern lookup | 1ms | 2-3ms | âœ… Excellent |\n| Search | 5ms | 10-20ms | âœ… Good |\n| Batch import | 100ms | 300ms | âœ… Acceptable |\n\n### Force Specific Adapter (Optional)\n```bash\nexport APEX_FORCE_ADAPTER=wasm  # Always works\nexport APEX_FORCE_ADAPTER=better-sqlite3  # If available\nexport APEX_FORCE_ADAPTER=node-sqlite  # Node 22+ only\n```\n\n## Troubleshooting & Support\n\n### Quick Diagnostics\n```bash\napex doctor           # System health check\napex doctor --verbose # Detailed diagnostics\n```\n\n### Common Solutions\n\n**\"Cannot find module 'better-sqlite3'\"**\nâœ… Normal - APEX automatically uses WebAssembly fallback\n\n**Slow pattern lookups**\nâ†’ Check adapter: `apex doctor`\nâ†’ Upgrade to Node 22+ for native performance\n\n**\"Database locked\" error**\nâ†’ Kill other APEX processes: `pkill -f apex`\n\n### Debug Mode\n```bash\nexport APEX_DEBUG=1      # Basic debug output\nexport APEX_TRACE=1      # Verbose logging\nexport APEX_PERF_LOG=1   # Performance metrics\n```\n\n## Migration from Earlier Versions\n\n### v1.0.0 Universal Compatibility Update\n\n**What changed:**\n- 93% smaller package (66.8MB â†’ ~5MB)\n- No compilation required\n- Works on Node.js 14+\n- Automatic adapter selection\n\n**For existing users:**\n```bash\nnpm update -g @benredmond/apex\napex start  # Automatic migration\n```\n\nYour patterns and database work identically across all adapters.\n\n## Contributing\n\nWe welcome contributions! See [CONTRIBUTING.md](CONTRIBUTING.md) for guidelines.\n\nKey areas for contribution:\n- Domain-specific pattern libraries\n- AI assistant integrations\n- Workflow improvements\n- Documentation examples\n\n## License\n\nMIT License - see [LICENSE](LICENSE) for details\n\n## Changelog\n\n### v0.5.0 - Skill-Based Workflow\n- âœ¨ New 4-phase workflow: /research â†’ /plan â†’ /implement â†’ /ship\n- ğŸš€ 6 skills for modular, composable workflows\n- ğŸ¤– 12 specialized agents for parallel intelligence gathering\n- ğŸ“ Slash commands for direct skill invocation\n- ğŸ”§ Agent architecture refactored and streamlined\n\n### v0.4.4 - Universal Compatibility\n- Works on any Node.js 14+ without compilation\n- Three-tier SQLite adapter system\n- MCP integration improvements\n\nSee full [release history](https://github.com/benredmond/apex/releases)\n\n---\n\n**Ready to stop repeating mistakes?** Run `npx @benredmond/apex start` and watch your AI assistant get smarter with every task.\n\nBuilt with â¤ï¸ and Intelligence by the APEX Community\n"
      },
      "plugins": [
        {
          "name": "apex",
          "source": "./",
          "description": "APEX Intelligence Layer - Pattern discovery, task tracking, and continuous learning for AI coding assistants",
          "categories": [],
          "install_commands": [
            "/plugin marketplace add benredmond/apex",
            "/plugin install apex@apex"
          ]
        }
      ]
    }
  ]
}