{
  "author": {
    "id": "binee108",
    "display_name": "binee108",
    "avatar_url": "https://avatars.githubusercontent.com/u/25786330?v=4"
  },
  "marketplaces": [
    {
      "name": "lilylab-marketplace",
      "version": null,
      "description": "LilyLab's official Claude Code plugin marketplace for quantitative research and development workflows",
      "repo_full_name": "binee108/lilylab-marketplace",
      "repo_url": "https://github.com/binee108/lilylab-marketplace",
      "repo_description": "LilyLab's official Claude Code plugin marketplace for quantitative research and development workflows",
      "signals": {
        "stars": 0,
        "forks": 0,
        "pushed_at": "2025-11-13T04:08:33Z"
      },
      "files": {
        ".claude-plugin/marketplace.json": "{\n  \"name\": \"lilylab-marketplace\",\n  \"description\": \"LilyLab's official Claude Code plugin marketplace for quantitative research and development workflows\",\n  \"owner\": {\n    \"name\": \"LilyLab\",\n    \"email\": \"dev@lilylab.io\",\n    \"url\": \"https://github.com/binee108\"\n  },\n  \"homepage\": \"https://github.com/binee108/lilylab-marketplace\",\n  \"repository\": \"https://github.com/binee108/lilylab-marketplace\",\n  \"plugins\": [\n    {\n      \"name\": \"nine-step-workflow\",\n      \"source\": {\n        \"source\": \"github\",\n        \"repo\": \"binee108/nine-step-workflow-plugin\"\n      },\n      \"description\": \"Production-ready 9-step development workflow with 12 specialized agents, 18 reusable skills, and comprehensive quality gates for enterprise software development\",\n      \"version\": \"1.1.0\",\n      \"keywords\": [\n        \"workflow\",\n        \"agents\",\n        \"quality-gates\",\n        \"git-worktree\",\n        \"development\",\n        \"planning\",\n        \"code-review\",\n        \"testing\",\n        \"documentation\"\n      ],\n      \"featured\": true\n    }\n  ],\n  \"categories\": {\n    \"workflow\": {\n      \"name\": \"Workflow Management\",\n      \"description\": \"Tools for managing development workflows and processes\",\n      \"plugins\": [\"nine-step-workflow\"]\n    },\n    \"quality\": {\n      \"name\": \"Quality Assurance\",\n      \"description\": \"Plugins for code review, testing, and quality gates\",\n      \"plugins\": [\"nine-step-workflow\"]\n    },\n    \"productivity\": {\n      \"name\": \"Productivity Tools\",\n      \"description\": \"Tools to enhance development productivity\",\n      \"plugins\": [\"nine-step-workflow\"]\n    }\n  },\n  \"metadata\": {\n    \"version\": \"1.0.0\",\n    \"lastUpdated\": \"2025-11-13T00:00:00Z\",\n    \"pluginCount\": 1,\n    \"maintainers\": [\n      {\n        \"name\": \"binee108\",\n        \"email\": \"binee108@example.com\",\n        \"role\": \"Lead Maintainer\"\n      }\n    ]\n  }\n}\n",
        "README.md": "# LilyLab Marketplace\n\n> Official Claude Code plugin marketplace for LilyLab's quantitative research and development workflows\n\n[![Plugins](https://img.shields.io/badge/plugins-1-blue.svg)](https://github.com/binee108/lilylab-marketplace)\n[![License: MIT](https://img.shields.io/badge/License-MIT-yellow.svg)](https://opensource.org/licenses/MIT)\n[![Maintained](https://img.shields.io/badge/Maintained-Yes-green.svg)](https://github.com/binee108/lilylab-marketplace)\n\n## üéØ Overview\n\nLilyLab Marketplace is a curated collection of Claude Code plugins designed specifically for quantitative research teams and enterprise software development workflows. Our plugins enhance Claude Code with specialized agents, quality gates, and automated workflows.\n\n## üì¶ Available Plugins\n\n### Nine-Step Workflow Plugin (v1.1.0) ‚≠ê Featured\n\n**Production-ready development workflow with specialized agents and quality gates**\n\n- **12 Specialized Agents**: Planning, review, implementation, testing, documentation\n- **18 Reusable Skills**: Tag-based search, phase decomposition, risk assessment, and more\n- **4 Essential Commands**: `/workflow-exec`, `/workflow-resume`, `/workflow-rollback`, `/plugin-update`\n- **Quality Gates**: Multi-stage approval system for code, plans, docs, and tests\n- **Git Worktree Integration**: Isolate feature development without branch chaos\n- **Auto-Update System**: Keep plugin up-to-date with latest features\n\n[View Plugin Documentation ‚Üí](https://github.com/binee108/nine-step-workflow-plugin)\n\n**Categories**: Workflow Management, Quality Assurance, Productivity Tools\n\n**Keywords**: workflow, agents, quality-gates, git-worktree, code-review, testing\n\n## üöÄ Quick Start\n\n### For Individual Developers\n\n#### 1. Add the LilyLab Marketplace\n\n```bash\n# Start Claude Code\nclaude\n\n# Add LilyLab marketplace\n/plugin marketplace add binee108/lilylab-marketplace\n```\n\n#### 2. Install Plugins\n\n```bash\n# Browse available plugins\n/plugin\n\n# Install Nine-Step Workflow\n/plugin install nine-step-workflow@lilylab-marketplace\n```\n\n#### 3. Verify Installation\n\n```bash\n# Check installed plugins\n/plugin\n\n# View available commands\n/help\n```\n\n### For Teams\n\nSet up automatic plugin installation for your entire team:\n\n#### 1. Create Team Configuration\n\nAdd this to your repository's `.claude/settings.json`:\n\n```json\n{\n  \"plugins\": {\n    \"marketplaces\": [\n      {\n        \"name\": \"lilylab-marketplace\",\n        \"source\": \"binee108/lilylab-marketplace\",\n        \"enabled\": true\n      }\n    ],\n    \"installed\": [\n      {\n        \"name\": \"nine-step-workflow\",\n        \"marketplace\": \"lilylab-marketplace\",\n        \"version\": \"1.1.0\",\n        \"enabled\": true\n      }\n    ]\n  }\n}\n```\n\n#### 2. Team Members Trust Repository\n\nWhen team members open the repository in Claude Code and trust the folder:\n1. LilyLab marketplace is automatically added\n2. Nine-Step Workflow plugin is automatically installed\n3. All features are ready to use immediately\n\n#### 3. Keep Plugins Updated\n\n```bash\n# Check for updates\n/plugin-update\n\n# Update to latest version\n/plugin-update\n```\n\n## üìö Plugin Categories\n\n### üîÑ Workflow Management\nTools for managing development workflows and processes:\n- **Nine-Step Workflow**: Complete 9-step development lifecycle\n\n### ‚úÖ Quality Assurance\nPlugins for code review, testing, and quality gates:\n- **Nine-Step Workflow**: Multi-stage quality gates and review system\n\n### ‚ö° Productivity Tools\nTools to enhance development productivity:\n- **Nine-Step Workflow**: Automated workflows and specialized agents\n\n## üéì Usage Examples\n\n### Example 1: Start a New Feature\n\n```\nUser: I need to add user authentication to my app\n\nClaude will:\n1. Invoke project-planner agent to analyze requirements\n2. Create detailed implementation plan with phases\n3. Submit plan to plan-reviewer for validation\n4. Request your approval before implementation\n5. Execute complete 9-step workflow automatically\n```\n\n### Example 2: Fix a Bug\n\n```\n/workflow-exec \"Fix race condition in order processing\"\n\nClaude will:\n1. Investigate using tag-based-search skill\n2. Plan fix approach with risk assessment\n3. Get plan approval\n4. Implement fix in git worktree\n5. Run code review, documentation, and tests\n6. Commit and merge after all quality gates pass\n```\n\n### Example 3: Resume Interrupted Work\n\n```\n/workflow-resume\n\nClaude will:\n1. Analyze .plan/ directory for active plans\n2. Determine last completed step\n3. Resume from next step automatically\n4. Continue through remaining workflow stages\n```\n\n## üõ†Ô∏è Marketplace Management\n\n### Add LilyLab Marketplace\n\n```bash\n# From GitHub repository\n/plugin marketplace add binee108/lilylab-marketplace\n\n# From local directory (for development)\n/plugin marketplace add /path/to/lilylab-marketplace\n```\n\n### Update Marketplace\n\n```bash\n# Refresh plugin list\n/plugin marketplace update lilylab-marketplace\n```\n\n### Remove Marketplace\n\n```bash\n# Remove marketplace (plugins remain installed)\n/plugin marketplace remove lilylab-marketplace\n```\n\n## üîß Configuration Options\n\n### Marketplace Configuration\n\nThe marketplace can be configured in `.claude/settings.json`:\n\n```json\n{\n  \"plugins\": {\n    \"marketplaces\": [\n      {\n        \"name\": \"lilylab-marketplace\",\n        \"source\": \"binee108/lilylab-marketplace\",\n        \"enabled\": true,\n        \"autoUpdate\": true,\n        \"checkInterval\": \"7d\"\n      }\n    ]\n  }\n}\n```\n\n### Plugin Configuration\n\nIndividual plugins can be configured:\n\n```json\n{\n  \"plugins\": {\n    \"installed\": [\n      {\n        \"name\": \"nine-step-workflow\",\n        \"marketplace\": \"lilylab-marketplace\",\n        \"version\": \"1.1.0\",\n        \"enabled\": true,\n        \"autoUpdate\": true\n      }\n    ]\n  }\n}\n```\n\n## üìä Marketplace Statistics\n\n- **Total Plugins**: 1\n- **Active Installations**: Growing\n- **Average Rating**: ‚≠ê‚≠ê‚≠ê‚≠ê‚≠ê\n- **Last Updated**: 2025-11-13\n- **Maintenance Status**: Active\n\n## ü§ù Contributing\n\nWe welcome contributions to the LilyLab Marketplace! Here's how you can contribute:\n\n### Adding Your Plugin\n\n1. **Create Your Plugin**: Follow [Claude Code plugin guidelines](https://docs.claude.com/ko/plugins)\n2. **Test Locally**: Ensure your plugin works correctly\n3. **Submit Plugin**: Create a pull request with:\n   - Plugin source code or GitHub repository\n   - Complete documentation\n   - Version information\n   - Keywords and categories\n\n### Plugin Requirements\n\nTo be included in LilyLab Marketplace, plugins must:\n\n- ‚úÖ Follow Claude Code plugin standards\n- ‚úÖ Include comprehensive documentation\n- ‚úÖ Use semantic versioning\n- ‚úÖ Have clear README with examples\n- ‚úÖ Pass quality review\n- ‚úÖ Be maintained actively\n\n### Submission Process\n\n1. Fork the marketplace repository\n2. Add your plugin to `marketplace.json`\n3. Include plugin documentation in `plugins/` directory\n4. Submit pull request with description\n5. Wait for review and approval\n\n## üêõ Troubleshooting\n\n### Marketplace Not Found\n\n```bash\n# Verify marketplace URL\n/plugin marketplace list\n\n# Try re-adding\n/plugin marketplace remove lilylab-marketplace\n/plugin marketplace add binee108/lilylab-marketplace\n```\n\n### Plugin Installation Fails\n\n```bash\n# Check marketplace is added\n/plugin marketplace list\n\n# Verify plugin name\n/plugin\n\n# Try specific version\n/plugin install nine-step-workflow@lilylab-marketplace --version 1.1.0\n```\n\n### Plugin Not Loading\n\n```bash\n# Restart Claude Code\nexit\nclaude\n\n# Check plugin status\n/plugin\n\n# Enable if disabled\n/plugin enable nine-step-workflow@lilylab-marketplace\n```\n\n### Update Issues\n\n```bash\n# Manual update\ncd ~/.claude/plugins/nine-step-workflow\ngit pull origin main\n\n# Or reinstall\n/plugin uninstall nine-step-workflow@lilylab-marketplace\n/plugin install nine-step-workflow@lilylab-marketplace\n```\n\n## üìû Support\n\n### Documentation\n- [LilyLab Marketplace](https://github.com/binee108/lilylab-marketplace)\n- [Nine-Step Workflow Plugin](https://github.com/binee108/nine-step-workflow-plugin)\n- [Claude Code Plugins](https://docs.claude.com/ko/plugins)\n\n### Issues & Feedback\n- [Report Marketplace Issues](https://github.com/binee108/lilylab-marketplace/issues)\n- [Report Plugin Issues](https://github.com/binee108/nine-step-workflow-plugin/issues)\n\n### Community\n- Email: dev@lilylab.io\n- GitHub: [@binee108](https://github.com/binee108)\n\n## üìÑ License\n\nThis marketplace and all LilyLab plugins are licensed under the MIT License - see individual plugin LICENSE files for details.\n\n## üó∫Ô∏è Roadmap\n\n### v1.1.0 (Coming Soon)\n- [ ] Additional workflow automation plugins\n- [ ] Quantitative research tools\n- [ ] Data analysis agents\n- [ ] Backtesting framework integration\n\n### v1.2.0\n- [ ] Machine learning workflow plugins\n- [ ] API integration tools\n- [ ] Performance monitoring agents\n- [ ] Risk management tools\n\n### v2.0.0\n- [ ] Advanced quantitative research suite\n- [ ] Team collaboration features\n- [ ] Custom agent marketplace\n- [ ] Enterprise SSO integration\n\n## üåü Featured Plugins\n\n### Nine-Step Workflow Plugin ‚≠ê\n\nThe cornerstone of LilyLab's development methodology. This plugin transforms Claude Code into a complete development team with systematic planning, implementation, review, testing, and deployment.\n\n**Perfect for:**\n- Enterprise software development\n- Team-based projects\n- Quality-critical applications\n- Large feature implementations\n- Production deployments\n\n[Get Started ‚Üí](https://github.com/binee108/nine-step-workflow-plugin)\n\n## üôè Acknowledgments\n\n- Built on Claude Code's powerful plugin system\n- Inspired by production workflows at leading tech companies\n- Community feedback shapes our development\n\n---\n\n**Made with ‚ù§Ô∏è by LilyLab Team**\n\n[Get Started](#quick-start) | [View Plugins](#available-plugins) | [Contributing](#contributing) | [Support](#support)\n"
      },
      "plugins": [
        {
          "name": "nine-step-workflow",
          "source": {
            "source": "github",
            "repo": "binee108/nine-step-workflow-plugin"
          },
          "description": "Production-ready 9-step development workflow with 12 specialized agents, 18 reusable skills, and comprehensive quality gates for enterprise software development",
          "version": "1.1.0",
          "keywords": [
            "workflow",
            "agents",
            "quality-gates",
            "git-worktree",
            "development",
            "planning",
            "code-review",
            "testing",
            "documentation"
          ],
          "featured": true,
          "categories": [
            "agents",
            "code-review",
            "development",
            "documentation",
            "git-worktree",
            "planning",
            "quality-gates",
            "testing",
            "workflow"
          ],
          "install_commands": [
            "/plugin marketplace add binee108/lilylab-marketplace",
            "/plugin install nine-step-workflow@lilylab-marketplace"
          ]
        }
      ]
    }
  ]
}