{
  "author": {
    "id": "bradwindy",
    "display_name": "Bradley Windybank",
    "avatar_url": "https://avatars.githubusercontent.com/u/38803010?u=e3aa5ca4bdf44b17732770599cc87bcef0c90dba&v=4"
  },
  "marketplaces": [
    {
      "name": "writing-xcuitests-marketplace",
      "version": null,
      "description": "Claude Code plugin for writing XCUITests",
      "repo_full_name": "bradwindy/writing-xcuitests",
      "repo_url": "https://github.com/bradwindy/writing-xcuitests",
      "repo_description": "Claude Code skill for writing robust, maintainable XCUITests for iOS and macOS applications",
      "signals": {
        "stars": 1,
        "forks": 0,
        "pushed_at": "2025-12-21T19:54:55Z"
      },
      "files": {
        ".claude-plugin/marketplace.json": "{\n  \"name\": \"writing-xcuitests-marketplace\",\n  \"owner\": {\n    \"name\": \"bradwindy\"\n  },\n  \"metadata\": {\n    \"description\": \"Claude Code plugin for writing XCUITests\",\n    \"version\": \"1.0.0\"\n  },\n  \"plugins\": [\n    {\n      \"name\": \"writing-xcuitests\",\n      \"source\": \"./\",\n      \"description\": \"Write robust, maintainable XCUITests for iOS and macOS applications.\",\n      \"version\": \"1.0.0\",\n      \"author\": {\n        \"name\": \"bradwindy\"\n      },\n      \"license\": \"MIT\",\n      \"keywords\": [\n        \"xcuitest\",\n        \"ios\",\n        \"macos\",\n        \"swift\",\n        \"ui-testing\",\n        \"xcode\",\n        \"accessibility\",\n        \"page-object\"\n      ]\n    }\n  ]\n}\n",
        ".claude-plugin/plugin.json": "{\n  \"name\": \"writing-xcuitests\",\n  \"description\": \"Write robust, maintainable XCUITests for iOS and macOS applications.\",\n  \"version\": \"1.0.0\",\n  \"author\": {\n    \"name\": \"bradwindy\"\n  },\n  \"repository\": \"https://github.com/bradwindy/writing-xcuitests\",\n  \"license\": \"MIT\",\n  \"keywords\": [\n    \"xcuitest\",\n    \"ios\",\n    \"macos\",\n    \"swift\",\n    \"ui-testing\",\n    \"xcode\",\n    \"accessibility\",\n    \"page-object\"\n  ]\n}\n",
        "README.md": "# writing-xcuitests\n\nA Claude Code skill for writing robust, maintainable XCUITests for iOS and macOS applications.\n\n## What It Enables\n\nThis skill helps Claude assist with:\n\n- Writing reliable XCUITests using best practices\n- Querying UI elements with accessibility identifiers\n- Implementing the Page Object pattern for maintainable tests\n- Handling waiting and synchronization correctly\n- Debugging and fixing flaky tests\n- Using advanced gestures (swipe, pinch, rotate, long press)\n- Structuring test suites for scalability\n\n## Installation\n\n**Direct Repository Method:**\n```\n/plugin install --git https://github.com/bradwindy/writing-xcuitests\n```\n\n**Marketplace Approach:**\n```\n/plugin marketplace add bradwindy/writing-xcuitests\n/plugin install writing-xcuitests@writing-xcuitests-marketplace\n```\n\n**Local Setup:**\n```\ngit clone https://github.com/bradwindy/writing-xcuitests.git\n/plugin marketplace add ./writing-xcuitests\n/plugin install writing-xcuitests@writing-xcuitests-marketplace\n```\n\n## Requirements\n\n- macOS with Xcode installed\n- Claude Code CLI\n\n## When It Activates\n\nThe skill automatically engages when you discuss:\n\n- Writing XCUITests or UI tests for iOS/macOS\n- Querying XCUIElements or accessibility identifiers\n- Implementing Page Object pattern\n- Fixing flaky or unreliable tests\n- Test waiting and synchronization strategies\n- Advanced gestures in UI tests\n\n## License\n\nMIT\n"
      },
      "plugins": [
        {
          "name": "writing-xcuitests",
          "source": "./",
          "description": "Write robust, maintainable XCUITests for iOS and macOS applications.",
          "version": "1.0.0",
          "author": {
            "name": "bradwindy"
          },
          "license": "MIT",
          "keywords": [
            "xcuitest",
            "ios",
            "macos",
            "swift",
            "ui-testing",
            "xcode",
            "accessibility",
            "page-object"
          ],
          "categories": [
            "accessibility",
            "ios",
            "macos",
            "page-object",
            "swift",
            "ui-testing",
            "xcode",
            "xcuitest"
          ],
          "install_commands": [
            "/plugin marketplace add bradwindy/writing-xcuitests",
            "/plugin install writing-xcuitests@writing-xcuitests-marketplace"
          ]
        }
      ]
    }
  ]
}