{
  "author": {
    "id": "Brite-Nites",
    "display_name": "Brite Nites",
    "avatar_url": "https://avatars.githubusercontent.com/u/215019096?v=4"
  },
  "marketplaces": [
    {
      "name": "britenites-claude-plugins",
      "version": null,
      "description": "Claude Code plugins for the Britenites organization",
      "repo_full_name": "Brite-Nites/britenites-claude-plugins",
      "repo_url": "https://github.com/Brite-Nites/britenites-claude-plugins",
      "repo_description": null,
      "signals": {
        "stars": 0,
        "forks": 0,
        "pushed_at": "2026-01-30T18:02:48Z"
      },
      "files": {
        ".claude-plugin/marketplace.json": "{\n  \"name\": \"britenites-claude-plugins\",\n  \"owner\": {\n    \"name\": \"Britenites\"\n  },\n  \"metadata\": {\n    \"description\": \"Claude Code plugins for the Britenites organization\",\n    \"pluginRoot\": \"./plugins\"\n  },\n  \"plugins\": [\n    {\n      \"name\": \"britenites\",\n      \"source\": \"./plugins/britenites\",\n      \"description\": \"Baseline tools for Britenites org\"\n    }\n  ]\n}\n",
        "README.md": "# Britenites Claude Plugins\n\nClaude Code plugin bundle for the Britenites organization. Provides custom commands, skills, and integrations that extend Claude Code's functionality.\n\n## Installation\n\nAdd this plugin bundle to your Claude Code configuration:\n\n```bash\nclaude plugins add https://github.com/Brite-Nites/britenites-claude-plugins\n```\n\nOr manually add to your `.claude/settings.json`:\n\n```json\n{\n  \"plugins\": [\n    {\n      \"source\": \"https://github.com/Brite-Nites/britenites-claude-plugins\",\n      \"plugins\": [\"britenites\"]\n    }\n  ]\n}\n```\n\n## Available Commands\n\n| Command | Description |\n|---------|-------------|\n| `/britenites:project-start` | Start a new project with a guided interview for non-technical users |\n\n## Available Skills\n\n| Skill | Description |\n|-------|-------------|\n| `vercel-react-best-practices` | React and Next.js performance optimization (45 rules) |\n\n### React Best Practices Skill\n\nThis skill provides 45 performance optimization rules for React and Next.js, sourced from [Vercel Engineering](https://github.com/vercel-labs/agent-skills) (MIT license).\n\n**Automatic usage:** Claude automatically applies these rules when you're working on React/Next.js code—writing components, reviewing code, refactoring, or optimizing performance. No action required.\n\n**Manual invocation:** You can also explicitly load the rules into context:\n\n```\n/britenites:vercel-react-best-practices\n```\n\n**Rule categories (by priority):**\n\n| Priority | Category | Impact |\n|----------|----------|--------|\n| 1 | Eliminating Waterfalls | CRITICAL |\n| 2 | Bundle Size Optimization | CRITICAL |\n| 3 | Server-Side Performance | HIGH |\n| 4 | Client-Side Data Fetching | MEDIUM-HIGH |\n| 5 | Re-render Optimization | MEDIUM |\n| 6 | Rendering Performance | MEDIUM |\n| 7 | JavaScript Performance | LOW-MEDIUM |\n| 8 | Advanced Patterns | LOW |\n\nTo add custom rules, edit `plugins/britenites/skills/react-best-practices/AGENTS.md` directly.\n\n## Usage\n\nAfter installation, invoke commands using the slash menu or by typing the command directly:\n\n```\n/britenites:project-start\n```\n\n---\n\n## Plugin Development Guide\n\n### Repository Structure\n\n```\n.claude-plugin/\n  marketplace.json          # Plugin registry (required for bundles)\nplugins/\n  britenites/\n    .claude-plugin/\n      plugin.json           # Plugin metadata\n    commands/               # Slash commands\n    skills/                 # Model-invoked skills\n    agents/                 # Specialized subagents\n    hooks/                  # Event handlers\n    styles/                 # Output style overrides\n    .mcp.json               # MCP server configurations\n    .lsp.json               # Language server configurations\n```\n\n### Plugin Manifest (plugin.json)\n\nEach plugin requires `.claude-plugin/plugin.json`:\n\n```json\n{\n  \"name\": \"britenites\",\n  \"description\": \"Baseline tools for Britenites org\",\n  \"version\": \"1.0.0\",\n  \"author\": {\n    \"name\": \"Britenites\"\n  },\n  \"commands\": \"./commands/\",\n  \"skills\": \"./skills/\",\n  \"agents\": \"./agents/\",\n  \"hooks\": \"./hooks/hooks.json\",\n  \"mcpServers\": \"./.mcp.json\"\n}\n```\n\n---\n\n## Adding Commands\n\nCommands are slash commands that users invoke directly. Create a markdown file in `commands/`.\n\n### File Structure\n\n```\ncommands/\n  my-command.md      # Becomes /britenites:my-command\n```\n\n### Command Format\n\n```markdown\n---\ndescription: Brief description shown in slash menu\n---\n\nInstructions for Claude on how to handle this command.\n\nUse $ARGUMENTS for the full user input after the command.\nUse $1, $2, etc. for positional arguments.\n```\n\n### Example: Deploy Command\n\n`commands/deploy.md`:\n\n```markdown\n---\ndescription: Deploy the current project to production\n---\n\nYou are deploying the user's project. Follow these steps:\n\n1. Run all tests to ensure the build is stable\n2. Build the production bundle\n3. Deploy using the configured deployment method\n\nThe user specified: $ARGUMENTS\n```\n\n---\n\n## Adding Skills\n\nSkills are model-invoked capabilities that Claude uses automatically based on context. Unlike commands, users don't invoke skills directly—Claude decides when to use them.\n\n### File Structure\n\n```\nskills/\n  code-review/\n    SKILL.md           # Required: Skill definition\n    templates/         # Optional: Supporting files\n  security-scan/\n    SKILL.md\n```\n\n### SKILL.md Format\n\n```markdown\n---\nname: code-review\ndescription: When to use this skill - Claude reads this to decide\nallowed-tools: Read, Grep, Glob\nuser-invocable: true\n---\n\n# Code Review Skill\n\nDetailed instructions for how Claude should perform this skill.\n\n## When to Activate\n- User asks for code review\n- PR review is requested\n- Code quality assessment needed\n\n## Process\n1. First step...\n2. Second step...\n```\n\n### Frontmatter Options\n\n| Field | Description |\n|-------|-------------|\n| `name` | Skill identifier (required) |\n| `description` | When/why Claude should use this skill (required) |\n| `allowed-tools` | Tools Claude can use without asking permission |\n| `model` | Specific model to use (e.g., `haiku`, `sonnet`) |\n| `context: fork` | Run in isolated sub-agent |\n| `agent` | Agent type when using `context: fork` |\n| `user-invocable` | Show in slash menu (default: `true`) |\n\n### Example: PDF Processor Skill\n\n`skills/pdf-processor/SKILL.md`:\n\n```markdown\n---\nname: pdf-processor\ndescription: Process and extract information from PDF documents\nallowed-tools: Read, Write, Bash\nuser-invocable: false\n---\n\n# PDF Processing\n\nWhen the user needs to work with PDF files, use this skill to:\n\n1. Extract text content from PDFs\n2. Parse structured data from PDF tables\n3. Convert PDFs to other formats\n\n## Tools\n- Use `pdftotext` for text extraction\n- Use `pdfimages` for image extraction\n```\n\n---\n\n## Adding MCP Server Configurations\n\nMCP (Model Context Protocol) servers connect Claude to external tools, APIs, and databases.\n\n### File Location\n\nCreate `.mcp.json` at the plugin root:\n\n```\nplugins/\n  britenites/\n    .mcp.json           # MCP configuration\n```\n\n### Configuration Format\n\n```json\n{\n  \"mcpServers\": {\n    \"database\": {\n      \"command\": \"npx\",\n      \"args\": [\"@britenites/mcp-database\"],\n      \"env\": {\n        \"DB_PATH\": \"${CLAUDE_PLUGIN_ROOT}/data\"\n      }\n    },\n    \"api-client\": {\n      \"command\": \"${CLAUDE_PLUGIN_ROOT}/servers/api-server.js\",\n      \"args\": [\"--config\", \"${CLAUDE_PLUGIN_ROOT}/config.json\"]\n    }\n  }\n}\n```\n\n### Path Variables\n\n| Variable | Description |\n|----------|-------------|\n| `${CLAUDE_PLUGIN_ROOT}` | Absolute path to the plugin directory |\n\n### Transport Types\n\n**stdio (default)**:\n```json\n{\n  \"mcpServers\": {\n    \"local-server\": {\n      \"command\": \"./server.js\",\n      \"args\": []\n    }\n  }\n}\n```\n\n**HTTP/SSE**:\n```json\n{\n  \"mcpServers\": {\n    \"remote-server\": {\n      \"url\": \"https://api.example.com/mcp\",\n      \"transport\": \"sse\"\n    }\n  }\n}\n```\n\n---\n\n## Adding Hooks\n\nHooks respond to Claude Code events automatically (formatting, validation, notifications).\n\n### File Location\n\nCreate `hooks/hooks.json` or define inline in `plugin.json`:\n\n```\nplugins/\n  britenites/\n    hooks/\n      hooks.json\n```\n\n### Hook Events\n\n| Event | When it fires |\n|-------|---------------|\n| `PreToolUse` | Before Claude uses any tool |\n| `PostToolUse` | After tool execution |\n| `PostToolUseFailure` | After a tool fails |\n| `UserPromptSubmit` | When user submits a prompt |\n| `Stop` | When Claude attempts to stop |\n| `SessionStart` | When a session begins |\n| `SessionEnd` | When a session ends |\n\n### Configuration Format\n\n```json\n{\n  \"hooks\": {\n    \"PostToolUse\": [\n      {\n        \"matcher\": \"Write|Edit\",\n        \"hooks\": [\n          {\n            \"type\": \"command\",\n            \"command\": \"${CLAUDE_PLUGIN_ROOT}/scripts/format.sh $CLAUDE_FILE_PATH\"\n          }\n        ]\n      }\n    ],\n    \"PreToolUse\": [\n      {\n        \"matcher\": \"Bash\",\n        \"hooks\": [\n          {\n            \"type\": \"prompt\",\n            \"prompt\": \"Verify this command is safe to run\"\n          }\n        ]\n      }\n    ]\n  }\n}\n```\n\n### Hook Types\n\n| Type | Description |\n|------|-------------|\n| `command` | Execute a shell command/script |\n| `prompt` | LLM-based evaluation (uses Haiku) |\n| `agent` | Full agent with tool access |\n\n---\n\n## Adding Agents\n\nAgents are specialized subagents that Claude can delegate tasks to.\n\n### File Structure\n\n```\nagents/\n  security-reviewer.md\n  performance-tester.md\n```\n\n### Agent Format\n\n```markdown\n---\ndescription: What this agent specializes in\ncapabilities:\n  - security analysis\n  - vulnerability detection\n  - compliance checking\nskills: security-scan, code-review\n---\n\n# Security Reviewer Agent\n\nYou are a security specialist. When delegated tasks:\n\n1. Review code for security vulnerabilities\n2. Check for OWASP Top 10 issues\n3. Validate input sanitization\n4. Report findings with severity levels\n```\n\n---\n\n## Adding Output Styles\n\nOutput styles customize Claude's response format and behavior.\n\n### File Structure\n\n```\nstyles/\n  concise.md\n  verbose.md\n```\n\n### Style Format\n\n```markdown\n---\nname: Concise Mode\ndescription: Short, direct responses\nkeep-coding-instructions: true\n---\n\nRespond concisely. Use bullet points. Avoid lengthy explanations.\nMaximum 3 sentences per response unless more detail is explicitly requested.\n```\n\n---\n\n## Complete Plugin Example\n\nHere's a fully-featured plugin structure:\n\n```\nplugins/\n  britenites/\n    .claude-plugin/\n      plugin.json\n    commands/\n      project-start.md\n      deploy.md\n      status.md\n    skills/\n      code-review/\n        SKILL.md\n      security-scan/\n        SKILL.md\n    agents/\n      security-reviewer.md\n    hooks/\n      hooks.json\n    styles/\n      concise.md\n    scripts/\n      format.sh\n      validate.js\n    .mcp.json\n```\n\nWith `plugin.json`:\n\n```json\n{\n  \"name\": \"britenites\",\n  \"description\": \"Baseline tools for Britenites org\",\n  \"version\": \"1.0.0\",\n  \"author\": {\n    \"name\": \"Britenites\"\n  },\n  \"commands\": \"./commands/\",\n  \"skills\": \"./skills/\",\n  \"agents\": \"./agents/\",\n  \"hooks\": \"./hooks/hooks.json\",\n  \"mcpServers\": \"./.mcp.json\",\n  \"outputStyles\": \"./styles/\"\n}\n```\n\n---\n\n## Marketplace Configuration\n\nThe root `marketplace.json` registers plugins for distribution:\n\n```json\n{\n  \"name\": \"britenites-claude-plugins\",\n  \"owner\": {\n    \"name\": \"Britenites\"\n  },\n  \"metadata\": {\n    \"description\": \"Claude Code plugins for the Britenites organization\",\n    \"pluginRoot\": \"./plugins\"\n  },\n  \"plugins\": [\n    {\n      \"name\": \"britenites\",\n      \"source\": \"./plugins/britenites\",\n      \"description\": \"Baseline tools for Britenites org\"\n    }\n  ]\n}\n```\n\nTo add a new plugin to the bundle, create the plugin directory and add it to the `plugins` array.\n\n---\n\n## Contributing\n\n1. Create a new branch for your changes\n2. Add or modify plugin components\n3. Test locally by pointing Claude Code to your local directory\n4. Submit a pull request\n\n## License\n\nMIT\n"
      },
      "plugins": [
        {
          "name": "britenites",
          "source": "./plugins/britenites",
          "description": "Baseline tools for Britenites org",
          "categories": [],
          "install_commands": [
            "/plugin marketplace add Brite-Nites/britenites-claude-plugins",
            "/plugin install britenites@britenites-claude-plugins"
          ]
        }
      ]
    }
  ]
}