{
  "author": {
    "id": "bug-ops",
    "display_name": "Andrei G",
    "avatar_url": "https://avatars.githubusercontent.com/u/12019904?u=02a5ad520c45d8057638a9d5aada811438f95933&v=4"
  },
  "marketplaces": [
    {
      "name": "claude-rust-agents",
      "version": null,
      "description": "Professional Rust development agents with LSP integration, lifecycle orchestration, and comprehensive tooling support",
      "repo_full_name": "bug-ops/claude-plugins",
      "repo_url": "https://github.com/bug-ops/claude-plugins",
      "repo_description": "ðŸ¤– Specialized plugins for Claude Code CLI with expert AI agents. ðŸ¦€ Rust plugin included: 7 agents for architecture, development, testing, performance, security, code review,   and CI/CD. Extensible for any development domain.",
      "signals": {
        "stars": 3,
        "forks": 0,
        "pushed_at": "2026-01-27T18:44:49Z"
      },
      "files": {
        ".claude-plugin/marketplace.json": "{\n  \"name\": \"claude-rust-agents\",\n  \"owner\": {\n    \"name\": \"Andrei G\",\n    \"email\": \"andrei.g@my.com\"\n  },\n  \"metadata\": {\n    \"description\": \"Professional Rust development agents with LSP integration, lifecycle orchestration, and comprehensive tooling support\",\n    \"version\": \"1.9.4\"\n  },\n  \"plugins\": [\n    {\n      \"name\": \"rust-agents\",\n      \"source\": \"./rust-code\",\n      \"description\": \"Comprehensive collection of specialized Rust development agents with Claude Code best practices. rust-analyzer LSP integration for real-time code intelligence. Full development lifecycle orchestration via rust-lifecycle skill. Handoff protocol via rust-agent-handoff skill for context sharing. Professional README generation with readme-generator. Async combinator patterns for elegant concurrent code. Updated for Rust Edition 2024 and modern tooling.\",\n      \"version\": \"1.9.4\",\n      \"author\": {\n        \"name\": \"Andrei G\",\n        \"email\": \"andrei.g@my.com\"\n      },\n      \"homepage\": \"https://github.com/bug-ops/claude-plugins\",\n      \"repository\": \"https://github.com/bug-ops/claude-plugins\",\n      \"license\": \"MIT\",\n      \"keywords\": [\n        \"rust\",\n        \"agents\",\n        \"development\",\n        \"architecture\",\n        \"testing\",\n        \"performance\",\n        \"security\",\n        \"ci-cd\",\n        \"code-review\",\n        \"debugging\",\n        \"lsp\",\n        \"rust-analyzer\",\n        \"async\",\n        \"edition-2024\"\n      ],\n      \"category\": \"development\",\n      \"tags\": [\n        \"rust\",\n        \"development\",\n        \"architecture\",\n        \"testing\",\n        \"performance\",\n        \"lsp\"\n      ]\n    }\n  ]\n}\n",
        "README.md": "# Claude Plugins Collection\n\nA curated collection of specialized plugins for Claude Code CLI, designed to enhance development workflows with domain-specific expertise.\n\n## Overview\n\nThis repository contains plugins that extend Claude Code's capabilities with specialized agents, tools, and workflows for various development domains. Each plugin provides a set of expert agents tailored to specific aspects of software development.\n\n## Available plugins\n\n### Rust Agents Plugin (`rust-code`)\n\n[![Version](https://img.shields.io/badge/version-1.9.4-blue)](./rust-code)\n[![License](https://img.shields.io/badge/license-MIT-green)](./rust-code/LICENSE)\n\nA comprehensive collection of eight specialized Rust development agents covering the entire Rust development lifecycle.\n\n**Location**: [`./rust-code`](./rust-code)\n\n**Key features**:\n- 8 specialized agents with opus model for high-quality responses\n- 3 productivity skills:\n  - **rust-lifecycle** â€” Full development workflow orchestration\n  - **rust-agent-handoff** â€” Inter-agent context sharing\n  - **readme-generator** â€” Professional README generation\n- rust-analyzer LSP integration for real-time code intelligence\n- Async combinator patterns for elegant concurrent code\n- Proactive triggers for automatic agent selection\n- Rust Edition 2024 support\n\n**Agents included**:\n| Agent | Specialization |\n|-------|---------------|\n| rust-architect | Workspace design, type-driven architecture, strategic decisions |\n| rust-developer | Idiomatic code, ownership patterns, feature implementation |\n| rust-testing-engineer | Test coverage with nextest and criterion |\n| rust-performance-engineer | Performance optimization, profiling, build speed |\n| rust-security-maintenance | Security scanning, vulnerability assessment, dependency management |\n| rust-code-reviewer | Quality assurance, standards compliance, code review |\n| rust-cicd-devops | GitHub Actions, cross-platform testing, workflows |\n| rust-debugger | Error diagnosis, runtime debugging, panic analysis |\n\n**Best for**: Rust projects requiring expert guidance in architecture, performance, security, testing, or DevOps.\n\n[â†’ Read full documentation](./rust-code/README.md)\n\n## Installation\n\n### Quick start: Install from marketplace\n\nThe easiest way to install plugins is via the marketplace:\n\n```bash\n# Add the marketplace\nclaude plugin marketplace add bug-ops/claude-plugins\n\n# Install the Rust agents plugin\nclaude plugin install rust-agents@claude-rust-agents\n```\n\nThis method provides automatic updates and centralized plugin management.\n\n### Alternative: Install from local directory\n\nFor development or testing, install directly from a local path:\n\n```bash\n# Install from local directory\ncd claude-plugins\nclaude plugin install ./rust-code\n\n# Or specify full path\nclaude plugin install /path/to/claude-plugins/rust-code\n```\n\n### Prerequisites\n\n- [Claude Code CLI](https://docs.claude.com/claude-code) installed and configured\n- Appropriate toolchain for the plugin you're using\n  - Rust agents: Rust 1.85+ and rust-analyzer for LSP support\n\n## Usage\n\nOnce installed, agents from the plugins become available in Claude Code:\n\n```bash\n# Start Claude Code\nclaude\n\n# View available agents\n/agents\n\n# Agents will be automatically suggested based on your task\n```\n\n### Example workflow\n\n```\nUser: \"I want to create a new Rust web service with database integration\"\nClaude: â†’ rust-architect designs the structure\n        â†’ rust-developer implements features\n        â†’ rust-testing-engineer sets up tests\n        â†’ rust-cicd-devops configures CI/CD\n```\n\n> [!TIP]\n> Agents can delegate work to other agents using the handoff protocol, preserving context between transitions.\n\n## Repository structure\n\n```\nclaude-plugins/\nâ”œâ”€â”€ README.md                   # This file\nâ”œâ”€â”€ .gitignore\nâ”œâ”€â”€ .claude-plugin/\nâ”‚   â””â”€â”€ marketplace.json        # Marketplace catalog\nâ”œâ”€â”€ .local/                     # Working documents and reports (gitignored)\nâ”œâ”€â”€ rust-code/                  # Rust Agents Plugin\nâ”‚   â”œâ”€â”€ README.md\nâ”‚   â”œâ”€â”€ .claude-plugin/\nâ”‚   â”‚   â””â”€â”€ plugin.json\nâ”‚   â”œâ”€â”€ .lsp.json              # rust-analyzer LSP configuration\nâ”‚   â”œâ”€â”€ .devcontainer/\nâ”‚   â”œâ”€â”€ agents/\nâ”‚   â””â”€â”€ skills/\nâ””â”€â”€ [future-plugins]/           # Additional plugins\n```\n\n## Marketplace\n\nThis repository provides a Claude Code plugin marketplace at `.claude-plugin/marketplace.json`.\n\n### Using the marketplace\n\n```bash\n# Add marketplace from GitHub\nclaude plugin marketplace add bug-ops/claude-plugins\n\n# List available plugins\nclaude plugin list\n\n# Install a plugin\nclaude plugin install rust-agents@claude-rust-agents\n\n# Update marketplace and plugins\nclaude plugin marketplace update claude-rust-agents\n```\n\n### Adding to project settings\n\nFor team use, add the marketplace to `.claude/settings.json`:\n\n```json\n{\n  \"extraKnownMarketplaces\": {\n    \"claude-rust-agents\": {\n      \"source\": {\n        \"source\": \"github\",\n        \"repo\": \"bug-ops/claude-plugins\"\n      }\n    }\n  },\n  \"enabledPlugins\": {\n    \"rust-agents@claude-rust-agents\": true\n  }\n}\n```\n\nThis ensures team members are prompted to install the marketplace and plugins when they trust the project.\n\n## Development environment\n\n### Using DevContainer\n\nEach plugin may include DevContainer configurations for isolated development. See individual plugin documentation for details.\n\n## Plugin development guidelines\n\nWhen creating new plugins for this repository:\n\n1. **Structure**:\n   - Each plugin in its own directory\n   - Include `.claude-plugin/` configuration\n   - Provide comprehensive README.md\n   - Use `.devcontainer/` for development environment (optional but recommended)\n\n2. **Documentation**:\n   - All documentation in English\n   - Clear usage examples\n   - Installation instructions\n   - Requirements and dependencies\n\n3. **Agents**:\n   - Focused, single-responsibility agents\n   - Clear specialization boundaries\n   - Appropriate model selection\n   - Distinct color coding for easy identification\n   - Include handoff protocol for multi-agent workflows\n\n4. **Best practices**:\n   - Follow [Microsoft Rust Guidelines](https://microsoft.github.io/rust-guidelines/agents/all.txt) for Rust-related plugins\n   - Use `.local/` directory for working documents\n   - Include version information\n   - Add comprehensive examples\n\n## Contributing\n\nContributions are welcome! To add a new plugin or improve existing ones:\n\n1. Create a new directory for your plugin\n2. Include `.claude-plugin/` configuration\n3. Write comprehensive documentation\n4. Test thoroughly with Claude Code\n5. Submit a pull request\n\n## Roadmap\n\nFuture plugin ideas:\n- Python development agents\n- Web development (React, Vue, Svelte)\n- Database management and optimization\n- Cloud infrastructure (AWS, Azure, GCP)\n- DevOps and platform engineering\n- Documentation and technical writing\n\n## License\n\nMIT\n",
        "rust-code/README.md": "# Rust Agents Plugin\n\n[![Version](https://img.shields.io/badge/version-1.9.4-blue)](https://github.com/bug-ops/claude-plugins)\n[![License](https://img.shields.io/badge/license-MIT-green)](LICENSE)\n[![Rust Edition](https://img.shields.io/badge/rust-Edition%202024-orange)](https://doc.rust-lang.org/edition-guide/rust-2024/)\n\nA comprehensive collection of specialized Rust development agents for Claude Code. This plugin provides expert assistance across all aspects of Rust development, from architecture design to deployment.\n\n## Features\n\n- **8 specialized agents** covering the entire Rust development lifecycle\n- **3 productivity skills** for enhanced workflows:\n  - **rust-lifecycle** â€” Full development workflow orchestration\n  - **rust-agent-handoff** â€” Inter-agent context sharing\n  - **readme-generator** â€” Professional README generation\n- **rust-analyzer LSP integration** for real-time code intelligence with Claude\n- **Proactive triggers** â€” agents are suggested automatically based on your task\n- **Rust Edition 2024** support with modern tooling\n- **Async combinator patterns** for elegant concurrent code\n\n## Agents\n\n### rust-architect\n**Model**: opus | **Specialization**: Workspace design, type-driven architecture, strategic decisions\n\nExpert in designing scalable, maintainable Rust applications with focus on:\n- Type-driven design with GATs, sealed traits, phantom types, typestate patterns\n- Multi-crate workspace design with optimal module boundaries\n- Dependency management and selection\n- Error handling architecture (thiserror vs anyhow)\n- MSRV policy and Rust Edition 2024\n- Architecture Decision Records (ADR)\n\n**Use when**: Starting new projects, restructuring existing codebases, making architectural decisions.\n\n### rust-developer\n**Model**: opus | **Specialization**: Idiomatic code, ownership patterns, feature implementation\n\nFocuses on:\n- Writing idiomatic Rust code\n- Ownership and borrowing patterns\n- Error handling implementation\n- Module organization\n- Feature development\n\n**Use when**: Implementing features, writing business logic, refactoring code.\n\n### rust-testing-engineer\n**Model**: opus | **Specialization**: Comprehensive test coverage with nextest and criterion\n\nExpert in:\n- Unit and integration testing\n- Test infrastructure with cargo-nextest\n- Performance benchmarking with criterion\n- Test-driven development (TDD)\n- Mock and fixture patterns\n\n**Use when**: Writing tests, setting up test infrastructure, benchmarking performance.\n\n### rust-performance-engineer\n**Model**: opus | **Specialization**: Performance optimization, profiling, build speed improvements\n\nFocuses on:\n- Runtime performance optimization\n- Build speed improvements with sccache\n- Memory optimization\n- Profiling with flamegraph\n- Async performance tuning\n\n**Use when**: Optimizing performance, reducing build times, profiling bottlenecks.\n\n### rust-security-maintenance\n**Model**: opus | **Specialization**: Security scanning, dependency management, vulnerability assessment\n\nExpert in:\n- cargo-audit and cargo-deny for vulnerability scanning\n- Dependency security and updates\n- Secure coding practices\n- Supply chain security\n- Security-focused code review\n\n**Use when**: Security audits, dependency updates, addressing vulnerabilities.\n\n### rust-code-reviewer\n**Model**: opus | **Specialization**: Quality assurance, standards compliance, constructive feedback\n\nFocuses on:\n- Code quality review\n- Adherence to Rust idioms\n- Performance considerations\n- Security review\n- Best practices enforcement\n\n**Use when**: Reviewing code changes, ensuring quality standards, pre-commit review.\n\n### rust-cicd-devops\n**Model**: opus | **Specialization**: GitHub Actions, cross-platform testing, efficient workflows\n\nExpert in:\n- GitHub Actions workflows\n- Cross-platform CI/CD\n- Code coverage integration\n- Caching strategies\n- Release automation\n\n**Use when**: Setting up CI/CD, optimizing workflows, automating releases.\n\n### rust-debugger\n**Model**: opus | **Specialization**: Systematic error diagnosis, runtime debugging, panic analysis\n\nExpert in:\n- Borrow checker and lifetime error interpretation\n- LLDB/GDB debugging on macOS/Linux\n- Panic and backtrace analysis\n- Async runtime debugging (Tokio, tokio-console)\n- Memory leak detection and investigation\n- Production incident response\n\n**Use when**: Encountering compilation errors, runtime panics, unexpected behavior, performance anomalies, or production issues.\n\n## Handoff Protocol\n\nAgents use the `rust-agent-handoff` skill for context sharing through YAML files in `.local/handoff/` directory.\n\nFile naming format: `{YYYY-MM-DDTHH-MM-SS}-{agent}.yaml`\n\n> [!TIP]\n> Timestamp-first naming allows chronological sorting with `ls` to easily find the latest handoff files.\n\n```yaml\n# Example: .local/handoff/2025-01-09T14-30-45-architect.yaml\nid: 2025-01-09T14-30-45-architect\nagent: architect\nstatus: completed\n\ncontext:\n  task: \"Design user management system\"\n\noutput:\n  summary: \"Designed type-driven user management\"\n  files_created:\n    - Cargo.toml\n    - crates/core/src/lib.rs\n\nnext:\n  agent: rust-developer\n  task: \"Implement Email and User types\"\n```\n\nHandoff files preserve context when one agent delegates work to another, ensuring no information is lost between agent transitions.\n\n## Skills\n\nThis plugin includes productivity skills that enhance your workflow:\n\n### rust-lifecycle\n\nComplete development workflow orchestrator for managing multi-phase Rust projects.\n\n**Triggers**: 'rust-lifecycle', 'start feature', 'full development workflow', 'orchestrate development'\n\n**Workflow phases**:\n1. **Planning** (rust-architect) â€” Architecture design and technical decisions\n2. **Implementation** (rust-developer) â€” Feature development\n3. **Parallel validation** â€” Performance analysis, security audit, test coverage\n4. **Code review** (rust-code-reviewer) â€” Quality assurance\n5. **Fix issues** (rust-developer) â€” Address ALL review feedback (mandatory)\n6. **Re-review** â€” Final approval check\n7. **Commit + PR** â€” Automated git operations\n\n**Key features**:\n- Multi-phase workflow with handoff protocol\n- Parallel validation for faster feedback\n- Mandatory issue resolution before commits\n- Automatic PR creation and updates\n- Git branch management\n- Progress tracking with task lists\n\n> [!IMPORTANT]\n> The lifecycle enforces quality by requiring ALL code review issues to be fixed before committing. No shortcuts.\n\n**Use when**: Starting complex features, implementing multi-file changes, managing full development cycles.\n\n### rust-agent-handoff\n\nHandoff protocol for multi-agent Rust development. Enables structured communication between agents through YAML files in `.local/handoff/` directory.\n\n**Triggers**: Automatically loaded by Rust agents when context sharing is needed.\n\n**Key features**:\n- Timestamp-based file naming for chronological sorting\n- Parent chain tracking for full context history\n- Agent-specific output schemas\n- Status tracking (completed, blocked, needs_discussion)\n\nSee [Handoff Protocol](#handoff-protocol) section above for details.\n\n### readme-generator\n\nProfessional README generator with ecosystem-specific best practices.\n\n**Triggers**: 'create readme', 'generate readme', 'write readme', 'improve readme', 'update readme', 'fix readme'\n\n**Supported project types**:\n- Rust libraries (crates.io badge, docs.rs, MSRV, feature flags)\n- Rust CLI tools (multi-platform install: cargo, brew, apt)\n- TypeScript/JavaScript (npm/yarn/pnpm/bun, bundle size)\n- Python (pip/poetry/conda, Python versions)\n\n**Features**:\n- Auto-detects project type from manifest files\n- Applies ecosystem-specific conventions\n- GitHub callouts for warnings and tips\n- Badge generation (crates.io, docs.rs, npm, PyPI)\n- Quality checklist enforcement\n\n> [!TIP]\n> Use `/readme-generator` when setting up new projects or improving existing documentation.\n\n## Installation\n\nInstall this plugin using Claude Code:\n\n```bash\nclaude plugin install rust-agents\n```\n\nOr install from a local directory:\n\n```bash\nclaude plugin install /path/to/rust-code\n```\n\n## Usage\n\nAgents are automatically available in Claude Code after installation.\n\n```bash\n# Start Claude Code\nclaude\n\n# View available agents\n/agents\n\n# Agents will be automatically suggested based on your task\n```\n\n### Example workflows\n\n**Starting a new project**:\n```\n\"I want to create a new Rust web service with database integration\"\nâ†’ rust-architect designs the structure\nâ†’ rust-developer implements features\nâ†’ rust-testing-engineer sets up tests\nâ†’ rust-cicd-devops configures CI/CD\n```\n\n**Optimizing existing code**:\n```\n\"My Rust application is running slowly\"\nâ†’ rust-performance-engineer profiles and optimizes\nâ†’ rust-code-reviewer ensures changes maintain quality\n```\n\n**Debugging an issue**:\n```\n\"I'm getting a borrow checker error I don't understand\"\nâ†’ rust-debugger analyzes and explains the error\nâ†’ rust-developer implements the fix\n```\n\n## Requirements\n\n- Claude Code CLI\n- Rust toolchain (1.85+ for Edition 2024)\n- rust-analyzer (for LSP features, see [LSP Support](#lsp-support))\n\n## LSP Support\n\nThis plugin includes rust-analyzer LSP server configuration, providing Claude with real-time code intelligence:\n\n- **Instant diagnostics** â€” Claude sees errors and warnings immediately after each edit\n- **Code navigation** â€” Go to definition, find references, hover information\n- **Type information** â€” Full type awareness for code symbols\n- **Clippy integration** â€” Automatic linting with clippy on save\n\n### Installing rust-analyzer\n\n**Via rustup (recommended)**:\n```bash\nrustup component add rust-analyzer\n```\n\n**Standalone installation**:\n```bash\n# macOS (Homebrew)\nbrew install rust-analyzer\n\n# Linux (Arch)\npacman -S rust-analyzer\n\n# Manual installation\ncurl -L https://github.com/rust-lang/rust-analyzer/releases/latest/download/rust-analyzer-x86_64-unknown-linux-gnu.gz | gunzip -c - > ~/.local/bin/rust-analyzer\nchmod +x ~/.local/bin/rust-analyzer\n```\n\nVerify installation:\n```bash\nrust-analyzer --version\n```\n\n> [!NOTE]\n> After installing rust-analyzer, restart Claude Code to activate LSP features. The plugin automatically configures rust-analyzer with:\n> - Clippy checks on save\n> - All cargo features enabled\n> - Inlay hints for types, parameters, and chaining\n> - Proc macro support\n\n## Development environment\n\n### Using DevContainer (recommended)\n\nThis plugin includes a complete DevContainer configuration for isolated development with all tools pre-installed:\n\n- Rust toolchain (latest stable)\n- Claude Code CLI (automatically installed)\n- Plugin auto-installed and ready to use\n- All Rust development tools (cargo-nextest, cargo-audit, sccache, etc.)\n- VS Code extensions for Rust and Markdown\n\n**Quick start:**\n1. Install [Docker Desktop](https://www.docker.com/products/docker-desktop) and [VS Code](https://code.visualstudio.com/)\n2. Install the [Dev Containers extension](https://marketplace.visualstudio.com/items?itemName=ms-vscode-remote.remote-containers)\n3. Open this project in VS Code\n4. Press `F1` â†’ Select \"Dev Containers: Reopen in Container\"\n5. Wait for the container to build (first time: ~10 minutes)\n6. Start using Claude Code: `claude`\n\n### Manual setup\n\nIf not using DevContainer:\n1. Install Rust: `curl --proto '=https' --tlsv1.2 -sSf https://sh.rustup.rs | sh`\n2. Install Claude Code: `npm install -g @anthropic-ai/claude-code`\n3. Install the plugin: `claude plugin install /path/to/rust-code`\n\n## Best practices\n\n1. **Start with architecture** â€” Use rust-architect when starting new projects\n2. **Debug systematically** â€” Use rust-debugger for compilation and runtime errors\n3. **Maintain quality** â€” Regularly use rust-code-reviewer before commits\n4. **Security first** â€” Run rust-security-maintenance on dependency updates\n5. **Performance monitoring** â€” Use rust-performance-engineer for optimization tasks\n6. **Test coverage** â€” Engage rust-testing-engineer for comprehensive testing\n7. **Automation** â€” Set up CI/CD early with rust-cicd-devops\n\n## License\n\nMIT\n"
      },
      "plugins": [
        {
          "name": "rust-agents",
          "source": "./rust-code",
          "description": "Comprehensive collection of specialized Rust development agents with Claude Code best practices. rust-analyzer LSP integration for real-time code intelligence. Full development lifecycle orchestration via rust-lifecycle skill. Handoff protocol via rust-agent-handoff skill for context sharing. Professional README generation with readme-generator. Async combinator patterns for elegant concurrent code. Updated for Rust Edition 2024 and modern tooling.",
          "version": "1.9.4",
          "author": {
            "name": "Andrei G",
            "email": "andrei.g@my.com"
          },
          "homepage": "https://github.com/bug-ops/claude-plugins",
          "repository": "https://github.com/bug-ops/claude-plugins",
          "license": "MIT",
          "keywords": [
            "rust",
            "agents",
            "development",
            "architecture",
            "testing",
            "performance",
            "security",
            "ci-cd",
            "code-review",
            "debugging",
            "lsp",
            "rust-analyzer",
            "async",
            "edition-2024"
          ],
          "category": "development",
          "tags": [
            "rust",
            "development",
            "architecture",
            "testing",
            "performance",
            "lsp"
          ],
          "categories": [
            "agents",
            "architecture",
            "async",
            "ci-cd",
            "code-review",
            "debugging",
            "development",
            "edition-2024",
            "lsp",
            "performance",
            "rust",
            "rust-analyzer",
            "security",
            "testing"
          ],
          "install_commands": [
            "/plugin marketplace add bug-ops/claude-plugins",
            "/plugin install rust-agents@claude-rust-agents"
          ]
        }
      ]
    }
  ]
}