{
  "author": {
    "id": "cardmagic",
    "display_name": "Lucas Carlson",
    "avatar_url": "https://avatars.githubusercontent.com/u/1264?v=4"
  },
  "marketplaces": [
    {
      "name": "cardmagic",
      "version": null,
      "description": "Search and browse Apple Notes with fuzzy matching",
      "repo_full_name": "cardmagic/notes",
      "repo_url": "https://github.com/cardmagic/notes",
      "repo_description": "CLI and MCP server to search and browse Apple Notes",
      "signals": {
        "stars": 1,
        "forks": 1,
        "pushed_at": "2026-02-01T04:38:14Z"
      },
      "files": {
        ".claude-plugin/marketplace.json": "{\n  \"name\": \"cardmagic\",\n  \"plugins\": [\n    {\n      \"name\": \"notes\",\n      \"source\": \"./\",\n      \"description\": \"Search and browse Apple Notes with fuzzy matching\",\n      \"version\": \"1.0.0\"\n    }\n  ]\n}\n",
        ".claude-plugin/plugin.json": "{\n  \"name\": \"notes\",\n  \"description\": \"Search and browse Apple Notes from the command line\",\n  \"version\": \"1.0.0\",\n  \"author\": {\n    \"name\": \"Lucas Carlson\"\n  },\n  \"repository\": \"https://github.com/cardmagic/notes\",\n  \"keywords\": [\"macos\", \"apple\", \"notes\", \"search\", \"mcp\"]\n}\n",
        "README.md": "# @cardmagic/notes\n\nCLI and MCP server to search and browse Apple Notes with fuzzy matching.\n\n## Features\n\n- **Fuzzy search** - Find notes even with typos using MiniSearch\n- **Full-text search** - Searches note titles, snippets, and body content\n- **Create & delete notes** - Manage notes via AppleScript automation\n- **PDF text extraction** - Automatically extracts and indexes text from PDF attachments\n- **Folder browsing** - List and filter notes by folder\n- **Fast indexing** - SQLite FTS5 + MiniSearch for quick searches across thousands of notes\n- **Dual mode** - Use as CLI tool or MCP server for Claude Code integration\n\n## Installation\n\n### Homebrew\n\n```bash\nbrew install cardmagic/tap/notes\n```\n\n### npm\n\n```bash\nnpm install -g @cardmagic/notes\n```\n\n### Claude Code Plugin (recommended)\n\nInstall as a plugin to get skills (auto-invoked) and slash commands:\n\n```bash\n# Add the marketplace\nclaude plugin marketplace add cardmagic/ai-marketplace\n\n# Install the plugin\nclaude plugin install notes@cardmagic\n```\n\nThis gives you:\n- **Skill**: Claude automatically searches notes when you ask about notes\n- **Slash commands**: `/notes:search`, `/notes:recent`, `/notes:folders`, and more\n\n### MCP Server\n\nFor direct MCP tool access without the plugin:\n\n```bash\nclaude mcp add --transport stdio notes -- npx -y @cardmagic/notes --mcp\n```\n\nOr install globally first:\n\n```bash\nnpm install -g @cardmagic/notes\nclaude mcp add --transport stdio notes -- notes --mcp\n```\n\n### From source\n\n```bash\ngit clone https://github.com/cardmagic/notes.git\ncd notes\nmake install\n\n# Then add as plugin OR MCP server:\nclaude plugin marketplace add cardmagic/ai-marketplace\nclaude plugin install notes@cardmagic\n# OR\nclaude mcp add --transport stdio notes -- notes --mcp\n```\n\n## Requirements\n\n- **macOS** - Reads from Apple Notes database\n- **Full Disk Access** - Terminal/IDE needs access to `~/Library/Group Containers/`\n- **pdftotext** (optional) - For PDF text extraction\n\n```bash\n# Install pdftotext for PDF support\nbrew install poppler\n```\n\n## Granting Full Disk Access\n\nThe tool needs to read your Notes database at `~/Library/Group Containers/group.com.apple.notes/`:\n\n1. Open **System Settings** > **Privacy & Security** > **Full Disk Access**\n2. Click **+** and add your terminal app (Terminal.app, iTerm, Warp, etc.)\n3. Restart your terminal\n\n## CLI Usage\n\n### Search notes\n\n```bash\n# Fuzzy search\nnotes search \"recipe chocolate\"\n\n# Filter by folder\nnotes search \"taxes\" --folder \"2024\"\n\n# Limit results\nnotes search \"meeting\" --limit 5\n\n# Filter by date\nnotes search \"project\" --after 2024-01-01\n```\n\n### Browse notes\n\n```bash\n# Recent notes\nnotes recent\nnotes recent --limit 10\n\n# List all folders\nnotes folders\n\n# Notes in a specific folder\nnotes folder \"Recipes\"\nnotes folder \"Work\" --limit 20\n```\n\n### Read a note\n\n```bash\n# Get note ID from search results, then read full content\nnotes read 12345\n```\n\n### Create a note\n\n```bash\n# Create a new note in the default \"Notes\" folder\nnotes create \"Meeting Notes\" --body \"Agenda items for today...\"\n\n# Create in a specific folder\nnotes create \"Shopping List\" --body \"Milk, eggs, bread\" --folder \"Personal\"\n```\n\n### Delete a note\n\n```bash\n# Delete a note by title\nnotes delete \"Old Meeting Notes\"\n\n# Delete from a specific folder (useful if multiple notes have the same title)\nnotes delete \"Draft\" --folder \"Work\"\n```\n\n### Manage index\n\n```bash\n# Show index statistics\nnotes stats\n\n# Update index (incremental - only processes changed notes)\nnotes index\n\n# Force full rebuild\nnotes index --force\n```\n\nThe index uses **incremental updates** by default:\n- Tracks modification timestamps to detect changed notes\n- Only reprocesses notes modified since last index\n- Detects and removes deleted notes\n- Much faster than full rebuild for small changes\n\n## Claude Code Plugin\n\nWhen installed as a plugin, you get:\n\n**Skill** (auto-invoked): Claude automatically searches notes when you ask things like:\n- \"What's in my notes about recipes?\"\n- \"Find my notes about the project\"\n- \"Create a note about the meeting\"\n- \"Delete my draft notes\"\n\n**Slash Commands**:\n\n| Command | Description |\n|---------|-------------|\n| `/notes:search <query>` | Fuzzy search with optional filters |\n| `/notes:recent` | Show recently modified notes |\n| `/notes:folders` | List all folders with note counts |\n| `/notes:folder \"Name\"` | List notes in a specific folder |\n| `/notes:read <id>` | Read full note content by ID |\n| `/notes:create <title>` | Create a new note |\n| `/notes:delete <title>` | Delete a note by title |\n\n## MCP Server\n\nRun as an MCP server for Claude Code integration:\n\n```bash\nnotes --mcp\n```\n\n### Available Tools\n\n| Tool | Description |\n|------|-------------|\n| `search_notes` | Fuzzy search through notes |\n| `recent_notes` | Get recently modified notes |\n| `read_note` | Read full note content by ID |\n| `list_folders` | List all folders with note counts |\n| `notes_in_folder` | List notes in a specific folder |\n| `get_note_stats` | Get index statistics |\n| `create_note` | Create a new note |\n| `delete_note` | Delete a note by title |\n\n### Manual MCP Configuration\n\nFor Claude Desktop or VS Code, add to your MCP configuration:\n\n```json\n{\n  \"mcpServers\": {\n    \"notes\": {\n      \"command\": \"npx\",\n      \"args\": [\"-y\", \"@cardmagic/notes\", \"--mcp\"]\n    }\n  }\n}\n```\n\n## PDF Text Extraction\n\nPDF attachments in Notes are automatically extracted and indexed when:\n\n1. **pdftotext is installed** - `brew install poppler`\n2. **PDF has been viewed** - Notes caches PDFs locally when opened\n\nThe extracted text is appended to the note body, making PDF content fully searchable.\n\n### How it works\n\n- PDFs are cached at `~/Library/Group Containers/group.com.apple.notes/Library/Caches/Paper/`\n- Each PDF bundle contains the file in `Assets.bundle/`\n- Text is extracted using `pdftotext` and indexed with the parent note\n\n### Limitations\n\n- PDFs stored only in iCloud (never opened locally) won't be indexed\n- Password-protected PDFs cannot be extracted\n- Scanned PDFs without OCR won't have searchable text\n\n## Data Locations\n\n| Data | Path |\n|------|------|\n| Notes database | `~/Library/Group Containers/group.com.apple.notes/NoteStore.sqlite` |\n| PDF cache | `~/Library/Group Containers/group.com.apple.notes/Library/Caches/Paper/` |\n| Search index | `~/.notes/index.db` |\n| Fuzzy index | `~/.notes/fuzzy.json` |\n| Stats | `~/.notes/stats.json` |\n\n## Development\n\n```bash\n# Clone and install\ngit clone https://github.com/cardmagic/notes\ncd notes\npnpm install\n\n# Build\npnpm build\n\n# Watch mode\npnpm dev\n\n# Link globally for testing\npnpm link --global\n\n# Type check\npnpm typecheck\n\n# Lint\npnpm lint\n```\n\n### Project Structure\n\n```\nsrc/\n├── index.ts        # Entry point - routes to CLI or MCP\n├── cli.ts          # Commander-based CLI\n├── mcp.ts          # MCP server implementation\n├── applescript.ts  # AppleScript automation for create/delete\n├── indexer.ts      # Builds search indexes from Notes database\n├── searcher.ts     # Query engine with fuzzy matching\n├── attachments.ts  # PDF text extraction\n├── formatter.ts    # Terminal output formatting\n└── types.ts        # TypeScript types and utilities\n```\n\n## Privacy\n\nThis tool accesses your local Notes database for reading and uses AppleScript to create/delete notes. No data is sent externally. The search index is stored locally in `~/.notes/`.\n\n## License\n\nMIT\n\n## Author\n\nLucas Carlson\n"
      },
      "plugins": [
        {
          "name": "notes",
          "source": "./",
          "description": "Search and browse Apple Notes with fuzzy matching",
          "version": "1.0.0",
          "categories": [],
          "install_commands": [
            "/plugin marketplace add cardmagic/notes",
            "/plugin install notes@cardmagic"
          ]
        }
      ]
    },
    {
      "name": "cardmagic",
      "version": null,
      "description": "Fuzzy search and browse Apple Reminders",
      "repo_full_name": "cardmagic/reminders",
      "repo_url": "https://github.com/cardmagic/reminders",
      "repo_description": "Fuzzy search and browse Apple Reminders from CLI or MCP server",
      "signals": {
        "stars": 0,
        "forks": 1,
        "pushed_at": "2026-02-01T04:38:35Z"
      },
      "files": {
        ".claude-plugin/marketplace.json": "{\n  \"name\": \"cardmagic\",\n  \"owner\": {\n    \"name\": \"Lucas Carlson\",\n    \"email\": \"lucas@carlson.net\"\n  },\n  \"plugins\": [\n    {\n      \"name\": \"reminders\",\n      \"source\": \"./\",\n      \"description\": \"Fuzzy search and browse Apple Reminders\",\n      \"version\": \"1.0.0\"\n    }\n  ]\n}\n",
        ".claude-plugin/plugin.json": "{\n  \"name\": \"reminders\",\n  \"description\": \"Fuzzy search and browse Apple Reminders\",\n  \"version\": \"1.0.0\",\n  \"author\": {\n    \"name\": \"Lucas Carlson\",\n    \"url\": \"https://github.com/cardmagic\"\n  },\n  \"repository\": \"https://github.com/cardmagic/reminders\",\n  \"license\": \"MIT\",\n  \"keywords\": [\"macos\", \"reminders\", \"apple\", \"search\", \"tasks\"]\n}\n",
        "README.md": "# reminders\n\nFuzzy search and browse Apple Reminders from the command line or as an MCP server.\n\n## Features\n\n- **Fuzzy search** with typo tolerance across all your reminders\n- **Create reminders** - add new reminders via CLI or MCP\n- **Browse by list** - view reminders organized by list\n- **Filter by status** - pending, completed, flagged, or due soon\n- **Auto-indexing** - index automatically rebuilds when reminders change\n- **Multiple interfaces** - CLI, MCP server, or Claude Code plugin\n\n## Requirements\n\n- macOS (reads from Apple Reminders database)\n- Node.js 22+\n- Full Disk Access permission for your terminal\n\n## Installation\n\n### Homebrew\n\n```bash\nbrew install cardmagic/tap/reminders\n```\n\n### npm\n\n```bash\nnpm install -g @cardmagic/reminders\n```\n\n### Claude Code Plugin (recommended)\n\nInstall as a plugin to get skills (auto-invoked) and slash commands:\n\n```bash\n# Add the marketplace\nclaude plugin marketplace add cardmagic/ai-marketplace\n\n# Install the plugin\nclaude plugin install reminders@cardmagic\n```\n\nThis gives you:\n- **Skill**: Claude automatically searches reminders when you ask about tasks/todos\n- **Slash commands**: `/reminders:search`, `/reminders:pending`, `/reminders:lists`, and more\n\n### MCP Server\n\nFor direct MCP tool access without the plugin:\n\n```bash\nclaude mcp add --transport stdio reminders -- npx -y @cardmagic/reminders --mcp\n```\n\nOr install globally first:\n\n```bash\nnpm install -g @cardmagic/reminders\nclaude mcp add --transport stdio reminders -- reminders --mcp\n```\n\n### From source\n\n```bash\ngit clone https://github.com/cardmagic/reminders.git\ncd reminders\npnpm install\npnpm build\npnpm link --global\n\n# Then add as plugin OR MCP server:\nclaude plugin marketplace add cardmagic/ai-marketplace\nclaude plugin install reminders@cardmagic\n# OR\nclaude mcp add --transport stdio reminders -- reminders --mcp\n```\n\n## Granting Full Disk Access\n\nThe tool needs to read your Reminders database:\n\n1. Open **System Settings** > **Privacy & Security** > **Full Disk Access**\n2. Click **+** and add your terminal app (Terminal.app, iTerm, Warp, etc.)\n3. Restart your terminal\n\n## Usage\n\n### CLI\n\n```bash\n# Show pending reminders (default action)\nreminders\n\n# Show all reminder lists with counts\nreminders lists\n\n# Show reminders in a specific list\nreminders list \"Groceries\"\nreminders list \"Groceries\" --all  # include completed\n\n# Show pending/completed/flagged\nreminders pending\nreminders completed\nreminders flagged\n\n# Show reminders due within N days\nreminders due --days 7\n\n# Fuzzy search\nreminders search \"milk\"\nreminders search \"meeting\" --list \"Work\"\nreminders search \"groceries\" --pending\n\n# Show recently created reminders\nreminders recent\n\n# Show index statistics\nreminders stats\n\n# Force rebuild the index\nreminders index\n\n# Create a new reminder (auto-detects list from content)\nreminders add \"Buy milk\"                    # → Groceries list\nreminders add \"Call mom\" --list \"Family\" --due tomorrow\nreminders add \"Meeting prep\" --due 2024-01-15 --time 09:00 --priority high\nreminders add \"Important task\" --flagged --notes \"Don't forget!\"\n\n# Mark a reminder as completed\nreminders done \"Buy milk\"                   # Searches all lists\nreminders done \"meeting\" --list \"Work\"      # Search in specific list\n```\n\n### CLI Options\n\n| Option | Description |\n|--------|-------------|\n| `-l, --list <name>` | Filter by list name |\n| `--completed` | Show only completed |\n| `--pending` | Show only pending |\n| `--flagged` | Show only flagged |\n| `-n, --limit <n>` | Max results (default varies by command) |\n| `-a, --all` | Include completed (for `list` command) |\n| `-d, --days <n>` | Days to look ahead (for `due` command) |\n\n### Claude Code Plugin\n\nWhen installed as a plugin, you get:\n\n**Skill** (auto-invoked): Claude automatically manages reminders when you ask things like:\n- \"What's on my grocery list?\"\n- \"Show my pending tasks\"\n- \"What reminders are due this week?\"\n- \"Add milk to my grocery list\"\n- \"Mark the milk reminder as done\"\n\n**Slash Commands**:\n\n| Command | Description |\n|---------|-------------|\n| `/reminders:search <query>` | Fuzzy search with optional filters |\n| `/reminders:pending` | Show pending reminders |\n| `/reminders:completed` | Show recently completed |\n| `/reminders:flagged` | Show flagged reminders |\n| `/reminders:due` | Show reminders due soon |\n| `/reminders:lists` | List all reminder lists |\n| `/reminders:list \"Name\"` | Show reminders in a specific list |\n| `/reminders:create \"Title\"` | Create a new reminder (auto-detects list) |\n| `/reminders:done \"Title\"` | Mark a reminder as completed |\n\n### MCP Server\n\nWhen installed as an MCP server, these tools are available:\n\n| Tool | Description |\n|------|-------------|\n| `search_reminders` | Fuzzy search with optional filters |\n| `get_pending_reminders` | Get incomplete reminders |\n| `get_completed_reminders` | Get recently completed |\n| `get_flagged_reminders` | Get flagged reminders |\n| `get_due_reminders` | Get reminders due within N days |\n| `list_reminder_lists` | List all lists with counts |\n| `get_list_reminders` | Get reminders in a specific list |\n| `get_reminder_stats` | Get index statistics |\n| `create_reminder` | Create a new reminder (auto-detects list) |\n| `complete_reminder` | Mark a reminder as completed |\n\n#### Manual MCP Configuration\n\nFor Claude Desktop or VS Code, add to your MCP configuration:\n\n```json\n{\n  \"mcpServers\": {\n    \"reminders\": {\n      \"command\": \"npx\",\n      \"args\": [\"-y\", \"@cardmagic/reminders\", \"--mcp\"]\n    }\n  }\n}\n```\n\n## How It Works\n\n1. **Auto-Indexing**: On first run (or when reminders change), the tool:\n   - Reads Apple Reminders SQLite databases\n   - Builds a SQLite FTS5 full-text search index\n   - Creates a MiniSearch fuzzy search index\n\n2. **Searching**: Queries both indexes for best results with typo tolerance\n\n3. **Storage**: Index files are stored in `~/.reminders/`:\n   - `index.db` - SQLite FTS5 database\n   - `fuzzy.json` - MiniSearch index\n   - `stats.json` - Index statistics\n\n## License\n\nMIT\n"
      },
      "plugins": [
        {
          "name": "reminders",
          "source": "./",
          "description": "Fuzzy search and browse Apple Reminders",
          "version": "1.0.0",
          "categories": [],
          "install_commands": [
            "/plugin marketplace add cardmagic/reminders",
            "/plugin install reminders@cardmagic"
          ]
        }
      ]
    }
  ]
}