{
  "author": {
    "id": "chkim-su",
    "display_name": "Chanho KIM",
    "avatar_url": "https://avatars.githubusercontent.com/u/193336612?v=4"
  },
  "marketplaces": [
    {
      "name": "obsidian-writer-marketplace",
      "version": null,
      "description": null,
      "repo_full_name": "chkim-su/obsidian-writer",
      "repo_url": "https://github.com/chkim-su/obsidian-writer",
      "repo_description": null,
      "signals": {
        "stars": 0,
        "forks": 0,
        "pushed_at": "2026-01-02T05:41:58Z"
      },
      "files": {
        ".claude-plugin/marketplace.json": "{\n  \"name\": \"obsidian-writer-marketplace\",\n  \"owner\": {\n    \"name\": \"chkim-su\"\n  },\n  \"plugins\": [\n    {\n      \"name\": \"obsidian-writer\",\n      \"source\": {\n        \"source\": \"github\",\n        \"repo\": \"chkim-su/obsidian-writer\"\n      },\n      \"skills\": [\n        \".claude/plugins/obsidian-writer/skills/paper-workflow/SKILL.md\",\n        \".claude/plugins/obsidian-writer/skills/paper-analyze/SKILL.md\",\n        \".claude/plugins/obsidian-writer/skills/pdf-annotation-guide.md\",\n        \".claude/plugins/obsidian-writer/skills/background-document/SKILL.md\",\n        \".claude/plugins/obsidian-writer/skills/paper-review.md\",\n        \".claude/plugins/obsidian-writer/skills/pdf-figure-extract.md\",\n        \".claude/plugins/obsidian-writer/skills/obsidian-research.md\"\n      ]\n    }\n  ]\n}\n",
        ".claude-plugin/plugin.json": "{\n  \"name\": \"obsidian-writer\",\n  \"version\": \"3.1.0\",\n  \"description\": \"Obsidian 기반 학술 논문 작성 프레임워크. 5단계 워크플로우로 체계적인 논문 리뷰 작성.\",\n  \"author\": \"chkim-su\",\n  \"license\": \"MIT\",\n  \"repository\": \"https://github.com/chkim-su/obsidian-writer\"\n}\n",
        "README.md": "# Obsidian Writer\n\nObsidian 기반 학술 논문 작성 프레임워크. 5단계 워크플로우로 체계적인 논문 리뷰 작성.\n\n## 설치\n\n```bash\nclaude marketplace add chkim-su/obsidian-writer\n```\n\n## 워크플로우\n\n```\nSTEP 1: /paper-analyze   → 초벌 분석 (기여물 선언, 완전 블록)\n    ↓\nSTEP 2: /pdf-annotation  → PDF 주석 (Annotator, PDF++)\n    ↓\nSTEP 3: (수동/선택)       → 인용 추가, /background (수식 전개)\n    ↓\nSTEP 4: /paper-review    → 비판적 검증 (5가지 공격 질문)\n    ↓\nCOMPLETE\n```\n\n## 스킬 목록\n\n| 스킬 | 명령 | 설명 |\n|------|------|------|\n| paper-workflow | `/paper-workflow` | 전체 워크플로우 가이드 |\n| paper-analyze | `/paper-analyze` | 논문 초벌 분석 |\n| pdf-annotation | `/pdf-annotation` | PDF 하이라이트 및 인용 |\n| background-document | `/background` | 수식 전개, 하위문서 생성 |\n| paper-review | `/paper-review` | 비판적 검증 |\n| pdf-figure-extract | `/pdf-figure` | PDF Figure 좌표 추출 |\n| obsidian-research | `/obsidian-research` | 연구 자료 정리 |\n\n## 핵심 원칙\n\n- **서술식 줄글**: 개조식 최소화, 논리적 흐름 강조\n- **완전 블록**: 수식·지표·프로토콜에 7항목 전개\n- **기여물 중심**: 논문 타입이 아닌 산출물(artifact)로 평가\n- **질문 기반 리뷰**: 가정/정의/검증/재현성/확장 공격\n- **순서 강제**: Hook을 통한 워크플로우 순서 검증\n\n## 필수 Obsidian 플러그인\n\n- [Obsidian Annotator](https://github.com/elias-sundqvist/obsidian-annotator) - PDF 하이라이트\n- [PDF++](https://github.com/RyotaUshio/obsidian-pdf-plus) - PDF 영역 임베드\n- [Dataview](https://github.com/blacksmithgu/obsidian-dataview) - 메타데이터 쿼리\n\n## 라이선스\n\nMIT\n"
      },
      "plugins": [
        {
          "name": "obsidian-writer",
          "source": {
            "source": "github",
            "repo": "chkim-su/obsidian-writer"
          },
          "skills": [
            ".claude/plugins/obsidian-writer/skills/paper-workflow/SKILL.md",
            ".claude/plugins/obsidian-writer/skills/paper-analyze/SKILL.md",
            ".claude/plugins/obsidian-writer/skills/pdf-annotation-guide.md",
            ".claude/plugins/obsidian-writer/skills/background-document/SKILL.md",
            ".claude/plugins/obsidian-writer/skills/paper-review.md",
            ".claude/plugins/obsidian-writer/skills/pdf-figure-extract.md",
            ".claude/plugins/obsidian-writer/skills/obsidian-research.md"
          ],
          "description": null,
          "categories": [],
          "install_commands": [
            "/plugin marketplace add chkim-su/obsidian-writer",
            "/plugin install obsidian-writer@obsidian-writer-marketplace"
          ]
        }
      ]
    },
    {
      "name": "orchestrator",
      "version": null,
      "description": "Oracle-powered autonomous development pipelines with Gemini-Claude orchestration",
      "repo_full_name": "chkim-su/orchestrator",
      "repo_url": "https://github.com/chkim-su/orchestrator",
      "repo_description": null,
      "signals": {
        "stars": 0,
        "forks": 0,
        "pushed_at": "2025-12-10T05:41:00Z"
      },
      "files": {
        ".claude-plugin/marketplace.json": "{\n  \"name\": \"orchestrator\",\n  \"owner\": {\n    \"name\": \"Chanho Kim\",\n    \"url\": \"https://github.com/chkim-su\"\n  },\n  \"plugins\": [\n    {\n      \"name\": \"fullauto\",\n      \"source\": \".\",\n      \"description\": \"Oracle-powered autonomous development pipelines with Gemini-Claude orchestration\",\n      \"version\": \"1.0.0\",\n      \"author\": {\n        \"name\": \"Chanho Kim\"\n      }\n    }\n  ]\n}\n",
        ".claude-plugin/plugin.json": "{\n  \"name\": \"fullauto\",\n  \"version\": \"1.0.0\",\n  \"description\": \"Oracle-powered autonomous development pipelines with Gemini-Claude orchestration\",\n  \"author\": {\n    \"name\": \"Chanho Kim\",\n    \"url\": \"https://github.com/chkim-su\"\n  },\n  \"repository\": \"https://github.com/chkim-su/orchestrator\",\n  \"license\": \"MIT\",\n  \"keywords\": [\"oracle\", \"gemini\", \"automation\", \"pipeline\", \"orchestration\"]\n}\n",
        "README.md": "# Fullauto - Oracle-Powered Development Pipelines\n\nA Claude Code plugin providing autonomous development pipelines powered by Oracle CLI (Gemini-Claude orchestration).\n\n## Features\n\n| Command | Description |\n|---------|-------------|\n| `/fullauto:auto` | Fully autonomous pipeline - Claude orchestrates with dynamic state-based decisions |\n| `/fullauto:edit` | Code modification pipeline with Oracle's Gemini-Claude orchestration |\n| `/fullauto:explore` | Web information gathering pipeline - search and fetch external resources |\n| `/fullauto:plan` | Implementation planning pipeline - design architecture before coding |\n| `/fullauto:research` | Deep reflection pipeline - strategic analysis and decision making |\n| `/fullauto:review` | Codebase analysis pipeline - read-only exploration and understanding |\n\n## Prerequisites\n\n- [Claude Code](https://claude.ai/code) CLI\n- [Oracle CLI](https://github.com/chkim-su/claude-oracle) (Gemini integration)\n- Python 3.12+ with conda (recommended)\n\n## Installation\n\n### 1. Add Marketplace\n\n```bash\n/plugin marketplace add chkim-su/orchestrator\n```\n\n### 2. Install Plugin\n\n```bash\n/plugin install fullauto@orchestrator\n```\n\n### 3. Setup Oracle CLI\n\nRun the setup script:\n\n```bash\n~/.claude/plugins/cache/orchestrator/fullauto/*/scripts/setup-oracle.sh\n```\n\nOr manually:\n\n```bash\n# Clone Oracle repository\ngit clone https://github.com/chkim-su/claude-oracle.git ~/projects/personal_project/claude-oracle\n\n# Create conda environment\nconda create -n oracle python=3.12 -y\nconda activate oracle\npip install -r ~/projects/personal_project/claude-oracle/requirements.txt\n\n# Set environment variable\nexport ORACLE_HOME=\"$HOME/projects/personal_project/claude-oracle\"\n```\n\n## Usage\n\n### Auto Mode (Recommended for complex tasks)\n\n```\n/fullauto:auto implement user authentication with OAuth\n```\n\nClaude will autonomously:\n1. Analyze requirements\n2. Research best practices\n3. Create implementation plan\n4. Execute code changes\n5. Review and iterate\n\n### Individual Pipelines\n\n```bash\n# Analyze codebase\n/fullauto:review how does authentication work\n\n# Research external information\n/fullauto:explore OAuth best practices 2025\n\n# Deep analysis and decision making\n/fullauto:research JWT vs Session authentication\n\n# Create implementation plan\n/fullauto:plan implement OAuth authentication\n\n# Execute code changes\n/fullauto:edit add login endpoint\n```\n\n## Architecture\n\n```\n┌─────────────────────────────────────────────────────────────────┐\n│                      Claude Code                                 │\n│                (Orchestrator / Executor)                         │\n├─────────────────────────────────────────────────────────────────┤\n│                                                                  │\n│  /fullauto:auto ──┬── /fullauto:review  (codebase analysis)     │\n│                   ├── /fullauto:explore (web research)          │\n│                   ├── /fullauto:research (deep thinking)        │\n│                   ├── /fullauto:plan    (architecture)          │\n│                   └── /fullauto:edit    (code modification)     │\n│                                                                  │\n└─────────────────────────────────────────────────────────────────┘\n                              ↑↓\n┌─────────────────────────────────────────────────────────────────┐\n│                       Oracle CLI                                 │\n│              (Gemini Integration Layer)                          │\n├─────────────────────────────────────────────────────────────────┤\n│  - oracle run      : Start coding session                        │\n│  - oracle review   : Code analysis via Gemini                    │\n│  - oracle explore  : Web research via Gemini                     │\n│  - oracle research : Deep reflection via Codex                   │\n│  - oracle rag      : Semantic code search (RAG)                  │\n└─────────────────────────────────────────────────────────────────┘\n```\n\n## Configuration\n\n### Environment Variables\n\n| Variable | Default | Description |\n|----------|---------|-------------|\n| `ORACLE_HOME` | `~/projects/personal_project/claude-oracle` | Oracle CLI installation path |\n\n### Project Settings\n\nAdd to your project's `.claude/settings.json` for auto-installation:\n\n```json\n{\n  \"extraKnownMarketplaces\": {\n    \"orchestrator\": {\n      \"source\": {\n        \"source\": \"github\",\n        \"repo\": \"chkim-su/orchestrator\"\n      }\n    }\n  },\n  \"enabledPlugins\": {\n    \"fullauto@orchestrator\": true\n  }\n}\n```\n\n## License\n\nMIT\n\n## Author\n\nChanho Kim ([@chkim-su](https://github.com/chkim-su))\n"
      },
      "plugins": [
        {
          "name": "fullauto",
          "source": ".",
          "description": "Oracle-powered autonomous development pipelines with Gemini-Claude orchestration",
          "version": "1.0.0",
          "author": {
            "name": "Chanho Kim"
          },
          "categories": [],
          "install_commands": [
            "/plugin marketplace add chkim-su/orchestrator",
            "/plugin install fullauto@orchestrator"
          ]
        }
      ]
    }
  ]
}