{
  "author": {
    "id": "clearfunction",
    "display_name": "Clear Function",
    "avatar_url": "https://avatars.githubusercontent.com/u/12205845?v=4"
  },
  "marketplaces": [
    {
      "name": "cf-devtools",
      "version": null,
      "description": "Production-ready Claude Code skills for presentations, secrets management, and developer workflows",
      "repo_full_name": "clearfunction/cf-devtools",
      "repo_url": "https://github.com/clearfunction/cf-devtools",
      "repo_description": "Claude Code skills plugin featuring Slidev presentations and developer productivity tools",
      "signals": {
        "stars": 3,
        "forks": 1,
        "pushed_at": "2026-01-06T04:47:48Z"
      },
      "files": {
        ".claude-plugin/marketplace.json": "{\n  \"name\": \"cf-devtools\",\n  \"owner\": {\n    \"name\": \"Clear Function\",\n    \"url\": \"https://clearfunction.com\"\n  },\n  \"plugins\": [\n    {\n      \"name\": \"cf-devtools\",\n      \"source\": \"./\",\n      \"version\": \"0.1.0\",\n      \"description\": \"Production-ready Claude Code skills for presentations, secrets management, and developer workflows\"\n    }\n  ]\n}\n",
        ".claude-plugin/plugin.json": "{\n  \"name\": \"cf-devtools\",\n  \"version\": \"0.1.0\",\n  \"description\": \"Production-ready Claude Code skills for presentations, secrets management, and developer workflows. Built by Clear Function.\",\n  \"author\": {\n    \"name\": \"Clear Function\",\n    \"url\": \"https://clearfunction.com\"\n  },\n  \"homepage\": \"https://github.com/clearfunction/cf-devtools\",\n  \"repository\": \"https://github.com/clearfunction/cf-devtools\",\n  \"license\": \"Apache-2.0\",\n  \"keywords\": [\n    \"presentations\",\n    \"slidev\",\n    \"secrets\",\n    \"1password\",\n    \"developer-tools\",\n    \"documentation\",\n    \"enterprise\",\n    \"fintech\",\n    \"healthcare\"\n  ]\n}\n",
        "README.md": "# CF DevTools\n\n> Production-ready Claude Code skills by [Clear Function](https://clearfunction.com) - 10 years building secure, compliant software for fintech and healthcare.\n\n**200+ solutions delivered | SOC 2 Certified | 5/5 Clutch Rating**\n\nDeveloper workflows for presentations, secrets management, and documentation - battle-tested in enterprise.\n\n## Installation\n\n### Claude Code (CLI)\n\n```bash\n# Add the marketplace\n/plugin marketplace add clearfunction/cf-devtools\n\n# Install the plugin\n/plugin install cf-devtools@cf-devtools\n```\n\n### Manual Installation\n\n```bash\n# Clone the repository\ngit clone https://github.com/clearfunction/cf-devtools.git\n\n# Add as local plugin\n/plugin add /path/to/cf-devtools\n```\n\n## Available Skills\n\n### slidev-presentations\n\nGenerate browser-based presentations using [Slidev](https://sli.dev/) - the presentation framework for developers.\n\n**Features:**\n\n- Markdown-based slide generation\n- Vue component support\n- Code syntax highlighting with live execution\n- Presenter mode with notes\n- Export to PDF/PNG\n\n**Usage:** Claude automatically activates this skill when you request presentation creation.\n\n```text\nCreate a technical presentation about Kubernetes architecture for a DevOps team\n```\n\n### 1password-direnv-secrets\n\nConfigure 1Password CLI with direnv for fast, secure secret loading in development environments.\n\n**Features:**\n\n- Single `op run` pattern (5x faster than multiple `op read` calls)\n- Secure `.env.op` files (safe to commit - contains only `op://` references)\n- Automatic secret resolution on directory entry\n- Works with any 1Password vault\n\n**Usage:** Claude automatically activates when you need 1Password + direnv setup.\n\n```text\nSet up 1Password with direnv for my project's environment variables\n```\n\n## Recommended Workflow\n\nFollow the **plan-first approach** for quality presentations:\n\n```text\nContext -> Plan -> Review -> Slides\n```\n\n| Scenario                     | Commands                              | Output        |\n| ---------------------------- | ------------------------------------- | ------------- |\n| Topic-based presentation     | `/slidev:plan` -> `/slidev:from-plan` | Plan + Slides |\n| Codebase presentation        | `/slidev:from-codebase`               | Plan + Slides |\n| Quick slides (skip planning) | `/slidev:new`                         | Slides only   |\n\n## Slash Commands\n\n### `/slidev:plan [topic]`\n\nCreate a detailed presentation plan before generating slides. Asks questions about audience, duration, format, and content focus.\n\n```text\n/slidev:plan React hooks deep dive\n/slidev:plan our Q4 engineering roadmap\n```\n\n**Output:** `{topic}-presentation-plan.md` with:\n\n- Time allocation table\n- Section outlines with talking points\n- Diagrams and code examples to include\n- Demo plan with backup options\n- Q&A preparation\n\n### `/slidev:from-plan [plan-file]`\n\nGenerate slides from an approved presentation plan.\n\n```text\n/slidev:from-plan react-hooks-presentation-plan.md\n```\n\n### `/slidev:from-codebase [path]`\n\n**Full workflow** - Analyzes your codebase, asks targeted questions, creates a plan, then generates slides.\n\n```text\n/slidev:from-codebase\n/slidev:from-codebase ./packages/api\n```\n\nQuestions asked:\n\n- Duration (lightning to deep dive)\n- Audience (peers, leadership, external, onboarding)\n- Format (lecture, demo-heavy, workshop)\n- Focus areas (architecture, features, API, testing, DevOps)\n- Core message and call to action\n\n### `/slidev:new [topic]`\n\nQuick-start a presentation without planning phase (for simple presentations).\n\n```text\n/slidev:new React hooks for beginners\n/slidev:new our new authentication system\n```\n\n### `/slidev:export [format]`\n\nExport presentation to PDF, PNG, or PPTX.\n\n```text\n/slidev:export           # PDF (default)\n/slidev:export pptx      # PowerPoint\n/slidev:export png       # Images\n```\n\n### `/slidev:add [layout]`\n\nAdd a specific slide type to an existing presentation.\n\n```text\n/slidev:add two-cols\n/slidev:add architecture\n/slidev:add code-comparison\n```\n\n### `/secrets:init [account]`\n\nSet up 1Password + direnv for secure secret management in your project.\n\n```text\n/secrets:init\n/secrets:init mycompany.1password.com\n```\n\n**Creates:**\n\n- `.env.op` - Secret references (safe to commit)\n- `.envrc` - direnv loader (gitignored)\n- Updates `.gitignore` with direnv entries\n\n### `/secrets:migrate [env-file]`\n\nConvert an existing `.env` file to `.env.op` format with 1Password references.\n\n```text\n/secrets:migrate\n/secrets:migrate .env.local\n```\n\n**Features:**\n\n- Automatically classifies secrets vs. static config\n- Preserves comments and structure\n- Generates CLI command to create 1Password item\n- Provides security checklist\n\n## Project Structure\n\n```text\ncf-devtools/\n├── .claude-plugin/\n│   ├── plugin.json        # Plugin manifest\n│   └── marketplace.json   # Marketplace metadata\n├── skills/\n│   ├── slidev-presentations/\n│   │   ├── SKILL.md       # Skill definition\n│   │   ├── references/    # Syntax documentation\n│   │   └── assets/        # Example presentations\n│   └── 1password-direnv-secrets/\n│       └── SKILL.md       # Skill definition\n├── commands/\n│   ├── slidev/            # Slidev slash commands\n│   │   ├── plan.md        # /slidev:plan\n│   │   ├── from-plan.md   # /slidev:from-plan\n│   │   ├── from-codebase.md  # /slidev:from-codebase\n│   │   ├── new.md         # /slidev:new\n│   │   ├── export.md      # /slidev:export\n│   │   └── add.md         # /slidev:add\n│   └── secrets/           # Secrets management commands\n│       ├── init.md        # /secrets:init\n│       └── migrate.md     # /secrets:migrate\n├── agents/                # Custom agents (future)\n└── docs/                  # Documentation\n```\n\n## Skill Development\n\nEach skill follows the [Anthropic Skills specification](https://github.com/anthropics/skills):\n\n1. Create a directory under `skills/`\n2. Add a `SKILL.md` with YAML frontmatter\n3. Include any reference materials in `references/`\n4. Test thoroughly before committing\n\nSee [docs/contributing.md](docs/contributing.md) for detailed guidelines.\n\n## Roadmap\n\n- [x] slidev-presentations - Browser-based presentations\n- [x] 1password-direnv-secrets - Fast secret loading\n- [ ] mermaid-diagrams - Architecture and flow diagrams\n- [ ] adr-generator - Architecture Decision Records\n- [ ] changelog-writer - Conventional changelog generation\n- [ ] api-docs - OpenAPI documentation generation\n\n## License\n\nApache 2.0 - See [LICENSE](LICENSE) for details.\n\n## Contributing\n\nContributions welcome! Please read [docs/contributing.md](docs/contributing.md) first.\n\n---\n\nBuilt by [Clear Function](https://clearfunction.com) | [AI Strategy & Implementation](https://clearfunction.com) | Memphis, TN\n"
      },
      "plugins": [
        {
          "name": "cf-devtools",
          "source": "./",
          "version": "0.1.0",
          "description": "Production-ready Claude Code skills for presentations, secrets management, and developer workflows",
          "categories": [],
          "install_commands": [
            "/plugin marketplace add clearfunction/cf-devtools",
            "/plugin install cf-devtools@cf-devtools"
          ]
        }
      ]
    }
  ]
}