{
  "author": {
    "id": "critesjosh",
    "display_name": "josh crites",
    "avatar_url": "https://avatars.githubusercontent.com/u/18372439?u=e9861adf85ae05a1ff3fbc6173054e11f95a296a&v=4"
  },
  "marketplaces": [
    {
      "name": "noir-plugins",
      "version": null,
      "description": "Claude Code plugin for Noir zero-knowledge circuit development",
      "repo_full_name": "critesjosh/noir-claude-plugin",
      "repo_url": "https://github.com/critesjosh/noir-claude-plugin",
      "repo_description": "Claude Code plugin for Noir zero-knowledge circuit development",
      "signals": {
        "stars": 0,
        "forks": 0,
        "pushed_at": "2026-02-10T15:04:18Z"
      },
      "files": {
        ".claude-plugin/marketplace.json": "{\n  \"$schema\": \"https://anthropic.com/claude-code/marketplace.schema.json\",\n  \"name\": \"noir-plugins\",\n  \"owner\": {\n    \"name\": \"critesjosh\"\n  },\n  \"plugins\": [\n    {\n      \"name\": \"noir\",\n      \"source\": {\n        \"source\": \"github\",\n        \"repo\": \"critesjosh/noir-claude-plugin\"\n      },\n      \"description\": \"Claude Code plugin for Noir zero-knowledge circuit development\",\n      \"version\": \"1.1.0\"\n    }\n  ]\n}\n",
        ".claude-plugin/plugin.json": "{\n  \"name\": \"noir\",\n  \"version\": \"1.2.0\",\n  \"description\": \"Claude Code plugin for Noir zero-knowledge circuit development. Provides skills and commands for writing, testing, proving, and verifying Noir circuits.\",\n  \"author\": {\n    \"name\": \"critesjosh\"\n  },\n  \"keywords\": [\n    \"noir\",\n    \"zero-knowledge\",\n    \"zk-proofs\",\n    \"circuits\",\n    \"barretenberg\",\n    \"cryptography\"\n  ],\n  \"license\": \"MIT\",\n  \"repository\": \"https://github.com/critesjosh/noir-claude-plugin\",\n  \"mcpServers\": {\n    \"noir\": {\n      \"command\": \"npx\",\n      \"args\": [\"-y\", \"noir-mcp-server\"],\n      \"env\": {}\n    }\n  }\n}\n",
        "README.md": "# Noir Plugin for Claude Code\n\nA Claude Code plugin for Noir zero-knowledge circuit development. Provides skills and commands for writing, testing, proving, and verifying Noir circuits.\n\n## Installation\n\n### Option 1: Install from Marketplace (Recommended)\n\n```\n/plugin marketplace add critesjosh/noir-claude-plugin\n/plugin install noir@noir-plugins\n```\n\n### Option 2: Load from Directory (Development)\n\nClone the repository and load directly:\n\n```bash\ngit clone https://github.com/critesjosh/noir-claude-plugin\nclaude --plugin-dir /path/to/noir-plugin\n```\n\n## Updating\n\n### Marketplace installs\n\n```\n/plugin marketplace update\n```\n\n### Local installs\n\n```bash\ncd /path/to/noir-plugin\ngit pull\n```\n\nChanges take effect on the next Claude Code session.\n\n## Noir MCP Server\n\nThis plugin includes the [noir-mcp-server](https://www.npmjs.com/package/noir-mcp-server) which provides local access to Noir documentation, examples, standard library, and source code.\n\n### Features\n\n- **Repository Cloning** — Clones noir compiler, standard library, and examples locally\n- **Code Search** — Regex-based search across Noir source files\n- **Documentation Search** — Search Noir docs by section\n- **Standard Library Search** — Search stdlib functions and types\n- **Example Discovery** — List and read example circuits\n\n### Switching Versions\n\nThe MCP server defaults to the latest stable Noir version. To switch:\n\n**Option 1: Use the `/noir-version` command**\n\n```\n/noir-version                    # Autodetect from project's Nargo.toml\n/noir-version v1.0.0-beta.18     # Use specific version\n```\n\n**Option 2: Call `noir_sync_repos` directly**\n\n```\nnoir_sync_repos({ version: \"v1.0.0-beta.18\", force: true })\n```\n\n**Check current version:**\n\n```\nnoir_status()\n```\n\n## Skills\n\n### Circuit Development\n\n**Noir Developer** (`noir-developer`)\n\n- Circuit structure, data types, generics, traits\n- Standard library: cryptographic primitives, collections, field operations\n- Workspace setup: project initialization, Nargo.toml, dependencies\n- MCP tool reference for all 9 server tools\n\n### Testing\n\n**Noir Testing** (`noir-testing`)\n\n- Test attributes: `#[test]`, `should_fail`, `should_fail_with`\n- Constrained vs unconstrained tests\n- Assertion patterns and debugging with `println`\n- Test organization and best practices\n\n### JavaScript Integration\n\n**Noir JS** (`noir-js`)\n\n- Full pipeline: compile, load artifact, generate witness, prove, verify\n- `@noir-lang/noir_js` for witness generation and oracle callbacks\n- `@aztec/bb.js` for proof generation\n- Input encoding, artifact loading, version compatibility\n\n### Web Integration\n\n**Noir Web** (`noir-web`)\n\n- React integration with `useProof()` hook pattern\n- Web Worker proving (never block the main thread)\n- WASM setup with Cross-Origin-Isolation headers\n- Bundler configs: Vite, Webpack, Next.js\n- UX patterns: progress indicators, error design, mobile considerations\n\n### Circuit Review\n\n**Review Circuit** (`review-circuit`)\n\n- Correctness: pub annotations, assertions, edge cases\n- Constraint efficiency: Field preference, hash choice, loop bounds\n- Unconstrained safety: verify all hints with constraints\n- Proof soundness: both-branch execution, under-constrained witnesses\n- Structured output with severity levels (Critical/High/Medium/Low)\n\n### Noir Idioms (upstream)\n\n**Noir Idioms** (`noir-idioms`)\n\n- Hint-and-verify patterns for efficient circuits\n- ACIR vs Brillig optimization strategies\n- Type system leverage and conditional best practices\n- Sourced from the [Noir repo](https://github.com/noir-lang/noir) (Apache-2.0)\n\n### ACIR Optimization (upstream)\n\n**ACIR Optimization** (`noir-optimize-acir`)\n\n- Measuring gate count with `nargo compile && bb gates`\n- Optimization loop methodology for reducing circuit size\n- Sourced from the [Noir repo](https://github.com/noir-lang/noir) (Apache-2.0)\n\n## Slash Commands\n\n| Command | Description |\n|---------|-------------|\n| `/noir:noir-developer` | Circuit development patterns and stdlib reference |\n| `/noir:noir-testing` | Test framework usage and patterns |\n| `/noir:noir-js` | JavaScript proving pipeline |\n| `/noir:noir-web` | Browser integration with Web Workers |\n| `/noir:review-circuit [path]` | Review a circuit for correctness and efficiency |\n| `/noir-version [version]` | Switch Noir version for MCP server |\n\n## Noir LSP Integration\n\nThe plugin includes LSP (Language Server Protocol) configuration for Noir, providing:\n\n- Real-time diagnostics and error checking\n- Code intelligence for `.nr` files\n- Integration with the Nargo toolchain\n\n**Requirement:** Nargo must be installed. Install via [noirup](https://noir-lang.org/docs/getting_started/installation/).\n\n## Upstream Skill Sync\n\nThe `noir-idioms` and `noir-optimize-acir` skills are sourced from the [Noir repo](https://github.com/noir-lang/noir) (Apache-2.0 licensed). To update them:\n\n```bash\nbash scripts/sync-upstream-skills.sh              # fetch from master\nbash scripts/sync-upstream-skills.sh --ref v1.0.0  # fetch from a specific tag\n```\n\nSync metadata is tracked in `skills/.upstream-sync.json`.\n\n## What's Included\n\n```\nnoir-plugin/\n├── .claude-plugin/\n│   ├── plugin.json            # Plugin manifest + MCP server config\n│   └── marketplace.json       # Marketplace registry\n├── .lsp.json                  # Noir LSP configuration\n├── .mcp.json                  # Local MCP server config\n├── commands/\n│   └── noir-version.md        # Version switching command\n├── scripts/\n│   └── sync-upstream-skills.sh # Fetch skills from upstream Noir repo\n├── skills/\n│   ├── .upstream-sync.json     # Sync metadata (source, ref, SHA, timestamp)\n│   ├── noir-developer/        # Circuit development (hub skill)\n│   │   ├── SKILL.md\n│   │   ├── circuit-dev/       # Structure, types, generics, traits, oracles\n│   │   ├── stdlib/            # Crypto primitives, collections, field ops\n│   │   └── workspace/         # Project setup, Nargo.toml, dependencies\n│   ├── noir-testing/          # Test framework\n│   │   ├── SKILL.md\n│   │   ├── test-attributes.md\n│   │   ├── assertion-patterns.md\n│   │   └── test-organization.md\n│   ├── noir-js/               # JavaScript proving\n│   │   ├── SKILL.md\n│   │   ├── compilation.md\n│   │   ├── witness-generation.md\n│   │   ├── proving-and-verifying.md\n│   │   └── artifact-loading.md\n│   ├── noir-web/              # Web integration\n│   │   ├── SKILL.md\n│   │   ├── react-integration.md\n│   │   ├── web-worker-proving.md\n│   │   ├── wasm-setup.md\n│   │   └── ux-patterns.md\n│   ├── noir-idioms/           # Idiomatic patterns (upstream)\n│   │   └── SKILL.md\n│   ├── noir-optimize-acir/    # ACIR optimization (upstream)\n│   │   └── SKILL.md\n│   └── review-circuit/        # Circuit review\n│       └── SKILL.md\n├── CLAUDE.md                  # Development guidelines (always loaded)\n└── README.md                  # This file\n```\n\n## Resources\n\n- [Noir Documentation](https://noir-lang.org/docs)\n- [Noir GitHub](https://github.com/noir-lang/noir)\n- [Noir Standard Library](https://noir-lang.org/docs/standard_library)\n- [Barretenberg](https://github.com/AztecProtocol/barretenberg)\n- [noir_js on npm](https://www.npmjs.com/package/@noir-lang/noir_js)\n\n## License\n\nMIT\n"
      },
      "plugins": [
        {
          "name": "noir",
          "source": {
            "source": "github",
            "repo": "critesjosh/noir-claude-plugin"
          },
          "description": "Claude Code plugin for Noir zero-knowledge circuit development",
          "version": "1.1.0",
          "categories": [],
          "install_commands": [
            "/plugin marketplace add critesjosh/noir-claude-plugin",
            "/plugin install noir@noir-plugins"
          ]
        }
      ]
    }
  ]
}