{
  "author": {
    "id": "CyranoB",
    "display_name": "Eddie Pick",
    "avatar_url": "https://avatars.githubusercontent.com/u/1990396?u=96791fb4673713f13d5ddaa8aed773fb745cc2e6&v=4"
  },
  "marketplaces": [
    {
      "name": "startup-ideas-marketplace",
      "version": null,
      "description": "Startup ideation skills for Claude Code",
      "repo_full_name": "CyranoB/startup-ideas-skill",
      "repo_url": "https://github.com/CyranoB/startup-ideas-skill",
      "repo_description": null,
      "signals": {
        "stars": 1,
        "forks": 0,
        "pushed_at": "2026-02-14T20:45:44Z"
      },
      "files": {
        ".claude-plugin/marketplace.json": "{\n  \"name\": \"startup-ideas-marketplace\",\n  \"owner\": {\n    \"name\": \"CyranoB\"\n  },\n  \"metadata\": {\n    \"description\": \"Startup ideation skills for Claude Code\"\n  },\n  \"plugins\": [\n    {\n      \"name\": \"startup-ideas\",\n      \"source\": \"./\",\n      \"description\": \"Interactive startup ideation and planning pipeline — 8 stages from idea generation to landing page outline\",\n      \"version\": \"1.0.0\",\n      \"keywords\": [\"startup\", \"ideation\", \"business\", \"planning\"]\n    }\n  ]\n}\n",
        ".claude-plugin/plugin.json": "{\n  \"name\": \"startup-ideas\",\n  \"version\": \"1.0.0\",\n  \"description\": \"Interactive startup ideation and planning pipeline — 8 stages from idea generation to landing page outline\",\n  \"author\": {\n    \"name\": \"CyranoB\"\n  },\n  \"repository\": \"https://github.com/CyranoB/startup-ideas-skill\",\n  \"license\": \"MIT\",\n  \"keywords\": [\"startup\", \"ideation\", \"business\", \"planning\"]\n}\n",
        "README.md": "# Startup Ideas Skill\n\nAn interactive startup ideation and planning skill for Claude Code, adapted from the [Startup Factory](../startup-factory/) web app.\n\n## What It Does\n\nWalks you through an 8-stage startup planning pipeline:\n\n1. **Generate Ideas** — 4 business concepts tailored to your domain/constraints\n2. **Personas** — 2 structured target audience profiles\n3. **Pitch** — Elevator pitch, problem statement, target audience, USP\n4. **Avatar** — Detailed problem-aware customer avatar (A–H framework)\n5. **Diary** — First-person diary entry from the avatar's perspective\n6. **Features** — Avatar-aligned feature list\n7. **Pricing** — Single-model pricing strategy (max 3 tiers)\n8. **Landing Page Outline** — CRO-focused, section-by-section outline\n\nEach stage pauses for your input — continue, regenerate, or adjust before moving on. You can also jump to any stage if you already have context (e.g., \"I have an idea, help me with pricing\").\n\n## Install\n\n### From Claude Code (recommended)\n\nAdd the marketplace and install the plugin:\n\n```\n/plugin marketplace add CyranoB/startup-ideas-skill\n/plugin install startup-ideas@startup-ideas-marketplace\n```\n\n### Manual install\n\nClone the repo and copy the skill into your Claude skills directory:\n\n```bash\ngit clone https://github.com/CyranoB/startup-ideas-skill.git\nmkdir -p ~/.claude/skills/startup-ideas\ncp -r startup-ideas-skill/skills/startup-ideas/* ~/.claude/skills/startup-ideas/\n```\n\n## Usage\n\nAsk Claude anything related to startup planning:\n\n- \"Help me brainstorm startup ideas\"\n- \"I have a SaaS idea, help me plan it out\"\n- \"Generate personas for my app\"\n- \"Help me with pricing for my product\"\n\n## Structure\n\n```\n.claude-plugin/\n├── plugin.json               # Plugin metadata and configuration\n└── marketplace.json          # Marketplace manifest for distribution\nskills/\n└── startup-ideas/\n    ├── SKILL.md              # Workflow and interaction protocol\n    └── references/\n        └── prompts.md        # Output formats for all 8 stages\n```\n"
      },
      "plugins": [
        {
          "name": "startup-ideas",
          "source": "./",
          "description": "Interactive startup ideation and planning pipeline — 8 stages from idea generation to landing page outline",
          "version": "1.0.0",
          "keywords": [
            "startup",
            "ideation",
            "business",
            "planning"
          ],
          "categories": [
            "business",
            "ideation",
            "planning",
            "startup"
          ],
          "install_commands": [
            "/plugin marketplace add CyranoB/startup-ideas-skill",
            "/plugin install startup-ideas@startup-ideas-marketplace"
          ]
        }
      ]
    },
    {
      "name": "frontpage-builder-skill",
      "version": null,
      "description": "Landing page builder and deployer for Claude Code",
      "repo_full_name": "CyranoB/frontpage-builder-skill",
      "repo_url": "https://github.com/CyranoB/frontpage-builder-skill",
      "repo_description": null,
      "signals": {
        "stars": 1,
        "forks": 1,
        "pushed_at": "2026-02-21T02:31:30Z"
      },
      "files": {
        ".claude-plugin/marketplace.json": "{\n  \"name\": \"frontpage-builder-skill\",\n  \"owner\": {\n    \"name\": \"CyranoB\"\n  },\n  \"metadata\": {\n    \"description\": \"Landing page builder and deployer for Claude Code\"\n  },\n  \"plugins\": [\n    {\n      \"name\": \"landing-page-builder\",\n      \"source\": \"./\",\n      \"description\": \"Build and deploy polished landing pages to Vercel from a text description\",\n      \"version\": \"1.0.0\",\n      \"keywords\": [\"landing-page\", \"frontend\", \"vercel\", \"deploy\"],\n      \"category\": \"development\"\n    }\n  ]\n}\n",
        ".claude-plugin/plugin.json": "{\n  \"name\": \"landing-page-builder\",\n  \"description\": \"Build and deploy polished landing pages to Vercel from a text description. Generates a single static HTML file with distinctive design and deploys it instantly — no authentication required.\",\n  \"version\": \"1.0.0\"\n}\n",
        "README.md": "# Landing Page Builder\n\nA [Claude Code skill](https://docs.anthropic.com/en/docs/claude-code/skills) that generates polished, distinctive landing pages from a text description and deploys them live to Vercel — no authentication required.\n\n## What it does\n\n1. Takes a natural-language description of a product, service, or idea\n2. Generates a self-contained `index.html` with inline CSS/JS\n3. Deploys it instantly to Vercel and returns a live preview URL\n\n## Example prompts\n\n- \"Build me a landing page for a dog walking app called PawPals\"\n- \"Create a website for my SaaS product that does invoice automation\"\n- \"Deploy a landing page for a coffee subscription service, dark luxury aesthetic\"\n\n## Design philosophy\n\nEvery generated page follows an opinionated design approach:\n\n- **No AI slop** — no purple-gradient-on-white, no generic card grids, no cookie-cutter hero sections\n- **Bold aesthetics** — each page commits to a specific direction (brutalist, editorial, retro-futuristic, luxury, etc.)\n- **Distinctive typography** — characterful Google Fonts pairings, never Inter/Roboto/Arial\n- **Production quality** — responsive, accessible, semantic HTML, `prefers-reduced-motion` support\n\nDesign guidelines are adapted from [Anthropic's frontend-design skill](https://github.com/anthropics/skills/tree/main/skills/frontend-design) and [Vercel's Web Interface Guidelines](https://github.com/vercel-labs/web-interface-guidelines).\n\n## Plugin structure\n\n```\n.claude-plugin/\n├── plugin.json                                  # Plugin manifest\n└── marketplace.json                             # Marketplace catalog\nskills/\n└── landing-page-builder/\n    ├── SKILL.md                                 # Workflow and design instructions\n    ├── scripts/deploy.sh                        # Vercel deployment (claimable, no auth)\n    └── references/web-design-guidelines.md      # Accessibility and UX compliance rules\n```\n\n## Installation\n\n### Claude Code\n\nAdd the marketplace and install the plugin from within Claude Code:\n\n```\n/plugin marketplace add CyranoB/frontpage-builder-skill\n/plugin install landing-page-builder@frontpage-builder-skill\n```\n\n### OpenCode\n\n[OpenCode](https://github.com/sst/opencode) natively reads `SKILL.md` files from `.claude/skills/` directories. Clone the repo and copy the skill files into your project:\n\n```bash\ngit clone https://github.com/CyranoB/frontpage-builder-skill.git /tmp/frontpage-builder-skill\nmkdir -p .claude/skills/landing-page-builder\ncp -r /tmp/frontpage-builder-skill/skills/landing-page-builder/* .claude/skills/landing-page-builder/\n```\n\nFor a global install (available in all projects):\n\n```bash\nmkdir -p ~/.claude/skills/landing-page-builder\ncp -r /tmp/frontpage-builder-skill/skills/landing-page-builder/* ~/.claude/skills/landing-page-builder/\n```\n\n## Credits\n\nBuilt on top of:\n- [frontend-design](https://github.com/anthropics/skills/tree/main/skills/frontend-design) by Anthropic — aesthetic direction and anti-slop principles\n- [web-design-guidelines](https://github.com/vercel-labs/agent-skills/tree/main/skills/web-design-guidelines) by Vercel — accessibility and UX compliance rules\n- [vercel-deploy-claimable](https://github.com/vercel-labs/agent-skills/tree/main/skills/claude.ai/vercel-deploy-claimable) by Vercel — zero-auth deployment script\n\n## License\n\nMIT\n"
      },
      "plugins": [
        {
          "name": "landing-page-builder",
          "source": "./",
          "description": "Build and deploy polished landing pages to Vercel from a text description",
          "version": "1.0.0",
          "keywords": [
            "landing-page",
            "frontend",
            "vercel",
            "deploy"
          ],
          "category": "development",
          "categories": [
            "deploy",
            "development",
            "frontend",
            "landing-page",
            "vercel"
          ],
          "install_commands": [
            "/plugin marketplace add CyranoB/frontpage-builder-skill",
            "/plugin install landing-page-builder@frontpage-builder-skill"
          ]
        }
      ]
    }
  ]
}