{
  "author": {
    "id": "dafang",
    "display_name": "Wyatt Fang",
    "avatar_url": "https://avatars.githubusercontent.com/u/207689?u=55802577c6b62b4340d29c845b931478f9870c63&v=4"
  },
  "marketplaces": [
    {
      "name": "taro-weapp-plugin",
      "version": null,
      "description": "React to Taro 转换工具和微信小程序开发指南",
      "repo_full_name": "dafang/taro-weapp-plugin",
      "repo_url": "https://github.com/dafang/taro-weapp-plugin",
      "repo_description": null,
      "signals": {
        "stars": 2,
        "forks": 0,
        "pushed_at": "2026-01-08T00:47:32Z"
      },
      "files": {
        ".claude-plugin/marketplace.json": "{\n  \"name\": \"taro-weapp-plugin\",\n  \"owner\": {\n    \"name\": \"dafang\"\n  },\n  \"metadata\": {\n    \"description\": \"React to Taro 转换工具和微信小程序开发指南\"\n  },\n  \"plugins\": [\n    {\n      \"name\": \"taro-weapp-plugin\",\n      \"source\": \"./\",\n      \"description\": \"React to Taro 转换工具和微信小程序聊天工具开发指南\",\n      \"version\": \"1.0.0\",\n      \"author\": {\n        \"name\": \"dafang\"\n      },\n      \"keywords\": [\"taro\", \"react\", \"wechat\", \"miniprogram\", \"weapp\", \"chat-tool\"]\n    }\n  ]\n}\n",
        ".claude-plugin/plugin.json": "{\n  \"name\": \"taro-weapp-plugin\",\n  \"version\": \"1.0.0\",\n  \"description\": \"React to Taro 转换工具和微信小程序聊天工具开发指南\",\n  \"author\": {\n    \"name\": \"dafang\"\n  },\n  \"homepage\": \"https://github.com/dafang/taro-weapp-plugin\",\n  \"repository\": \"https://github.com/dafang/taro-weapp-plugin\",\n  \"license\": \"MIT\",\n  \"keywords\": [\"taro\", \"react\", \"wechat\", \"miniprogram\", \"weapp\", \"chat-tool\"]\n}\n",
        "README.md": "# Taro WeApp Plugin\n\nClaude Code 插件，提供 React to Taro 转换工具和微信小程序开发指南。\n\n## 包含的 Skills\n\n### 1. react-to-taro\n\n将 React Web 应用转换为 Taro 4.x 小程序代码，包括：\n\n- JSX 元素映射 (div→View, span→Text 等)\n- 事件处理器转换 (onChange→onInput, e.target.value→e.detail.value)\n- 路由/导航转换 (react-router-dom → Taro API)\n- API 适配层 (axios→Taro.request, localStorage→Taro.setStorageSync)\n- weapp-tailwindcss 配置指南\n\n### 2. wechat-chat-tool\n\n微信小程序聊天工具开发指南，包括：\n\n- 聊天工具分包配置\n- chatTools 配置\n- 发送消息到群聊\n- 动态消息\n- 获取群成员信息\n\n### 3. weapp-share-timeline\n\n微信小程序分享到朋友圈开发指南，包括：\n\n- onShareTimeline 配置\n- 单页模式适配（场景值 1154）\n- 单页模式禁用能力列表\n- navigationBarFit 布局调整\n- 云开发未登录访问配置\n\n## 安装\n\n### 方式 1：通过 Marketplace 安装\n\n```shell\n/plugin marketplace add dafang/taro-weapp-plugin\n/plugin install taro-weapp-plugin@taro-weapp-plugin\n```\n\n### 方式 2：本地测试\n\n```bash\nclaude --plugin-dir ./taro-weapp-plugin\n```\n\n## 使用\n\n安装后，Skills 会自动在相关场景下激活：\n\n- 当你需要将 React 代码转换为 Taro 时，使用 `/react-to-taro`\n- 当你开发微信小程序聊天工具时，使用 `/wechat-chat-tool`\n- 当你开发分享到朋友圈功能时，使用 `/weapp-share-timeline`\n\n## License\n\nMIT\n"
      },
      "plugins": [
        {
          "name": "taro-weapp-plugin",
          "source": "./",
          "description": "React to Taro 转换工具和微信小程序聊天工具开发指南",
          "version": "1.0.0",
          "author": {
            "name": "dafang"
          },
          "keywords": [
            "taro",
            "react",
            "wechat",
            "miniprogram",
            "weapp",
            "chat-tool"
          ],
          "categories": [
            "chat-tool",
            "miniprogram",
            "react",
            "taro",
            "weapp",
            "wechat"
          ],
          "install_commands": [
            "/plugin marketplace add dafang/taro-weapp-plugin",
            "/plugin install taro-weapp-plugin@taro-weapp-plugin"
          ]
        }
      ]
    }
  ]
}