{
  "author": {
    "id": "DeemosTech",
    "display_name": "Deemos",
    "avatar_url": "https://avatars.githubusercontent.com/u/105910186?v=4"
  },
  "marketplaces": [
    {
      "name": "rodin3d-skills",
      "version": null,
      "description": "Claude Code plugins for generating 3D models using Hyper3D Rodin Gen-2 API",
      "repo_full_name": "DeemosTech/rodin3d-skills",
      "repo_url": "https://github.com/DeemosTech/rodin3d-skills",
      "repo_description": "Official skills from Hyper3d for Rodin  3D generation. These skills provide prompting guidelines and API integration patterns.",
      "signals": {
        "stars": 8,
        "forks": 0,
        "pushed_at": "2026-02-01T16:04:40Z"
      },
      "files": {
        ".claude-plugin/marketplace.json": "{\n  \"name\": \"rodin3d-skills\",\n  \"owner\": {\n    \"name\": \"HyperHuman\",\n    \"email\": \"support@hyper3d.ai\"\n  },\n  \"metadata\": {\n    \"description\": \"Claude Code plugins for generating 3D models using Hyper3D Rodin Gen-2 API\",\n    \"version\": \"1.0.0\"\n  },\n  \"plugins\": [\n    {\n      \"name\": \"rodin3d-skill\",\n      \"source\": \"./skills/rodin3d-skill\",\n      \"strict\": false,\n      \"skills\": [\"./\"],\n      \"description\": \"Converts input images or prompt to 3D models using Hyper3D Rodin Gen-2 API. Use this skill when users want to generate 3D models from images or text, such as product designs, architectural elements, or object reconstructions.\",\n      \"version\": \"1.0.0\",\n      \"author\": {\n        \"name\": \"Deemos Hyper3D\"\n      },\n      \"homepage\": \"https://hyper3d.ai\",\n      \"repository\": \"https://github.com/DeemosTech/rodin3d-skills\",\n      \"license\": \"MIT\",\n      \"keywords\": [\n        \"3d\",\n        \"3d-model\",\n        \"image-to-3d\",\n        \"text-to-3d\",\n        \"hyper3d\",\n        \"rodin\",\n        \"api\",\n        \"generation\"\n      ],\n      \"category\": \"3d-generation\",\n      \"tags\": [\n        \"3D Asset\",\n        \"Hyper3D\",\n        \"Rodin Gen-2\",\n        \"3D Model\",\n        \"Image-to-3D\",\n        \"Text-to-3D\"\n      ]\n    }\n  ]\n}\n",
        "README.md": "# Rodin3D Skills\n\nA Skill for generating 3D models from image/multiview images or text prompts using the Hyper3D Rodin Gen-2 API.\n\n## Overview\n\nThis skill enables AI to generate high-quality 3D models through the Hyper3D Rodin Gen-2 API. It supports both image-to-3D and text-to-3D generation, with multiple output formats and quality tiers.\n\n## Features\n\n- Generate 3D models from single or multiple images (up to 5 images)\n- Generate 3D models from text descriptions\n- Support for multiple output formats: GLB, USDZ, FBX, OBJ, STL\n- Five generation tiers: Gen-2, Detail, Smooth, Regular, Sketch\n- Automatic task status polling and result retrieval\n- Advanced parameters for material, mesh mode, seed values, and more\n\n## Installation\n\n### Prerequisites\n\n- [Claude Code CLI](https://code.claude.com) installed\n- Hyper3D API Key (obtain from [https://hyper3d.ai/api-dashboard](https://hyper3d.ai/api-dashboard))\n- Python 3.7+ (for backend scripts)\n\n### Method 1: Install from Marketplace (Recommended)\n\nThe easiest way to install this skill is through the Claude Code plugin marketplace:\n\n1. **Add the marketplace** (one-time setup):\n   ```bash\n   /plugin marketplace add DeemosTech/rodin3d-skills\n   ```\n\n2. **Install the plugin**:\n   ```bash\n   /plugin install rodin3d-skill@rodin3d-skills\n   ```\n\n3. **Install Python dependencies**:\n   ```bash\n   pip install requests pillow\n   ```\n\n4. **Set your API key**:\n   ```bash\n   export HYPER3D_API_KEY=your_api_key_here\n   ```\n\n   Or create a `.env` file in your project:\n   ```bash\n   echo 'HYPER3D_API_KEY=your_api_key_here' > .env\n   echo '.env' >> .gitignore\n   ```\n\nThat's it! The skill is now available as `/rodin3d-skill` in Claude Code.\n\n### Method 2: Manual Installation\n\nIf you prefer to install manually or want to develop locally:\n\n1. **Clone this repository**:\n   ```bash\n   git clone https://github.com/DeemosTech/rodin3d-skills.git\n   cd rodin3d-skills\n   ```\n\n2. **Install Python dependencies**:\n   ```bash\n   cd skills/rodin3d-skill\n   pip install -r requirements.txt\n   ```\n\n3. **Add the local marketplace**:\n   ```bash\n   /plugin marketplace add /path/to/rodin3d-skills\n   /plugin install rodin3d-skill@rodin3d-skills\n   ```\n\n4. **Set your API key** (same as Method 1, step 4)\n\n### Verify Installation\n\nAfter installation, verify the skill is available:\n\n```bash\n/plugin list\n```\n\nYou should see `rodin3d-skill` in the list of enabled plugins.\n\n### Updating the Plugin\n\nTo update to the latest version:\n\n```bash\n/plugin marketplace update rodin3d-skills\n/plugin update rodin3d-skill@rodin3d-skills\n```\n\n## Usage\n\n### Using the Skill\n\nOnce installed, you can interact with this skill through:\n\n**Generate from image:**\n```\nPlease generate a 3D model from this image: [provide image path]\n```\n\n**Generate from text:**\n```\nPlease generate a 3D model of a medieval castle with high quality\n```\n\n**Generate from multiple images:**\n```\nPlease generate a 3D model from these images: [provide multiple images]\n```\n\n### Direct Script Usage\n\nYou can also use the Python scripts directly:\n\n```bash\npython scripts/generate_3d_model.py \\\n  --image path/to/image.jpg \\\n  --geometry-file-format glb \\\n  --quality medium \\\n  --output ./output\n```\n\n```bash\npython scripts/generate_3d_model.py \\\n  --prompt \"A detailed 3D model of a medieval castle\" \\\n  --geometry-file-format glb \\\n  --quality high \\\n  --output ./output\n```\n\n## Configuration\n\n### Generation Tiers\n\n| Tier | Description | Use Case | Speed |\n|------|-------------|----------|-------|\n| Gen-2 | Highest quality, most advanced | Final production models | Slow |\n| Detail | High detail, high resolution | Models requiring fine details | Medium |\n| Smooth | Clear edges, smooth surface | Simple geometries, stylized models | Medium |\n| Regular | Balanced quality and speed | General purpose | Medium |\n| Sketch | Quick generation, low resolution | Concept validation, quick iteration | Fast |\n\n### Output Formats\n\n- GLB: Recommended for web and most 3D software\n- USDZ: For Apple platforms\n- FBX: For game engines and 3D modeling software\n- OBJ: Universal 3D format\n- STL: For 3D printing\n\n### Quality Levels\n\n- High: Best quality, longer processing time\n- Medium: Balanced quality and speed\n- Low: Faster processing, lower quality\n- Extra-low: Fastest processing, minimal quality\n\n## Parameters\n\n### Basic Parameters\n\n| Parameter | Description | Options | Default |\n|-----------|-------------|---------|---------|\n| `--image` | Input image path(s) (max 5) | File paths | - |\n| `--prompt` | Text prompt for generation | Text | - |\n| `--tier` | Generation tier | Gen-2, Detail, Smooth, Regular, Sketch | Gen-2 |\n| `--geometry-file-format` | Output format | glb, usdz, fbx, obj, stl | glb |\n| `--quality` | Quality level | high, medium, low, extra-low | medium |\n| `--output` | Output directory | Directory path | - |\n\n### Advanced Parameters\n\n| Parameter | Description | Options | Default |\n|-----------|-------------|---------|---------|\n| `--material` | Material type | PBR, Shaded, All | PBR |\n| `--mesh-mode` | Mesh topology | Raw, Quad | Quad |\n| `--use-original-alpha` | Use original alpha channel | - | False |\n| `--seed` | Random seed value | 0-65535 | - |\n| `--quality-override` | Custom polygon count | Integer | - |\n| `--tapose` | Generate T/A pose | - | False |\n| `--bbox-condition` | Bounding box [W, H, L] | Three integers | - |\n| `--addons` | Additional features | HighPack | - |\n| `--preview-render` | Generate preview render | - | False |\n| `--poll-interval` | Status check interval (seconds) | Integer | 10 |\n| `--max-retries` | Maximum retry attempts | Integer | 60 |\n\n## Best Practices\n\n### Image Input\n\n- Use high-resolution images (at least 512 x 512 pixels)\n- Ensure good lighting and clear details\n- Avoid cluttered backgrounds\n- Use multiple angles for better results\n- Supported formats: JPEG, PNG, WEBP\n- File size limit: 16MB\n- Resolution range: 512x512 to 4096x4096\n\n### Text Prompts\n\n- Be specific and detailed in your descriptions\n- Mention materials and textures\n- Include lighting information\n- Specify the style (realistic, cartoon, futuristic, etc.)\n- Provide context for the object\n\n### Important Notes\n\n**Download links expire in 10 minutes**: API result URLs are temporary. Download 3D models immediately after generation completes. Do not store or cache the URLs themselves.\n\n## API Endpoints\n\n| Endpoint | Purpose |\n|----------|---------|\n| `https://api.hyper3d.com/api/v2/rodin` | Submit 3D model generation task |\n| `https://api.hyper3d.com/api/v2/status` | Check task status |\n| `https://api.hyper3d.com/api/v2/download` | Get download links for completed tasks |\n\n## Example Prompts\n\nHere are some example text prompts for 3D generation:\n\n1. \"A detailed 3D model of a medieval castle\"\n2. \"A futuristic cityscape with flying cars\"\n3. \"A realistic 3D model of a cat sitting on a couch\"\n4. \"An abstract sculpture made of glass and metal\"\n5. \"A 3D model of a cozy cottage in the woods\"\n\n## Troubleshooting\n\n### API Key Issues\n\nIf you encounter authentication errors:\n1. Verify your API key is set correctly\n2. Check that the key is valid and active\n3. Ensure you have sufficient API credits\n\n### Generation Failures\n\nIf generation fails:\n1. Check image format and size requirements\n2. Verify prompt is not empty or too short\n3. Ensure API service is available\n4. Review error messages for specific issues\n\n## Documentation\n\nFor detailed documentation, see:\n- [SKILL.md](skills/rodin3d-skill/SKILL.md) - Complete skill documentation\n- [assets/examples/README.md](skills/rodin3d-skill/assets/examples/README.md) - Example usage\n\n## Links\n\n- [Hyper3D Website](https://hyper3d.ai)\n- [API Dashboard](https://hyper3d.ai/api-dashboard)\n- [Hyper3D API Documentation](https://developer.hyper3d.ai/)\n\n## License\n\nMIT License - See LICENSE file for details\n\n## Support\n\nFor issues or questions:\n- Submit a GitHub Issue\n- Refer to [SKILL.md](skills/rodin3d-skill/SKILL.md) for detailed documentation\n- Visit Hyper3D official documentation\n\n---\n\nAuthor: HyperHuman  \nVersion: 1.0.0  \nTags: 3D Asset, Hyper3D, Rodin Gen-2, API, 3D Model, Image-to-3D, Text-to-3D"
      },
      "plugins": [
        {
          "name": "rodin3d-skill",
          "source": "./skills/rodin3d-skill",
          "strict": false,
          "skills": [
            "./"
          ],
          "description": "Converts input images or prompt to 3D models using Hyper3D Rodin Gen-2 API. Use this skill when users want to generate 3D models from images or text, such as product designs, architectural elements, or object reconstructions.",
          "version": "1.0.0",
          "author": {
            "name": "Deemos Hyper3D"
          },
          "homepage": "https://hyper3d.ai",
          "repository": "https://github.com/DeemosTech/rodin3d-skills",
          "license": "MIT",
          "keywords": [
            "3d",
            "3d-model",
            "image-to-3d",
            "text-to-3d",
            "hyper3d",
            "rodin",
            "api",
            "generation"
          ],
          "category": "3d-generation",
          "tags": [
            "3D Asset",
            "Hyper3D",
            "Rodin Gen-2",
            "3D Model",
            "Image-to-3D",
            "Text-to-3D"
          ],
          "categories": [
            "3d",
            "3d-asset",
            "3d-generation",
            "3d-model",
            "api",
            "generation",
            "hyper3d",
            "image-to-3d",
            "rodin",
            "rodin-gen-2",
            "text-to-3d"
          ],
          "install_commands": [
            "/plugin marketplace add DeemosTech/rodin3d-skills",
            "/plugin install rodin3d-skill@rodin3d-skills"
          ]
        }
      ]
    }
  ]
}