{
  "author": {
    "id": "deemkeen",
    "display_name": "deemkeen",
    "avatar_url": "https://avatars.githubusercontent.com/u/2945835?u=db774411be1173b322b6287cbe88cb3336de5464&v=4"
  },
  "marketplaces": [
    {
      "name": "claude-session-management",
      "version": null,
      "description": "Session snapshot management tools for Claude Code",
      "repo_full_name": "deemkeen/claude-session-management",
      "repo_url": "https://github.com/deemkeen/claude-session-management",
      "repo_description": "A Claude Code plugin for managing session snapshots with git versioning",
      "signals": {
        "stars": 2,
        "forks": 0,
        "pushed_at": "2025-11-12T11:49:31Z"
      },
      "files": {
        ".claude-plugin/marketplace.json": "{\n  \"name\": \"claude-session-management\",\n  \"owner\": {\n    \"name\": \"deemkeen\",\n    \"email\": \"dimgur@gmail.com\"\n  },\n  \"metadata\": {\n    \"description\": \"Session snapshot management tools for Claude Code\",\n    \"version\": \"1.0.0\"\n  },\n  \"plugins\": [\n    {\n      \"name\": \"claude-session-management\",\n      \"source\": \"./\",\n      \"description\": \"Save, load, and manage Claude Code session snapshots with git versioning\",\n      \"version\": \"1.0.0\",\n      \"author\": {\n        \"name\": \"deemkeen\",\n        \"email\": \"dimgur@gmail.com\"\n      },\n      \"homepage\": \"https://github.com/deemkeen/claude-session-management\",\n      \"repository\": \"https://github.com/deemkeen/claude-session-management\",\n      \"license\": \"MIT\",\n      \"keywords\": [\"session\", \"snapshot\", \"management\", \"git\", \"versioning\", \"export\", \"backup\"],\n      \"category\": \"productivity\",\n      \"tags\": [\"session-management\", \"backup\", \"git\", \"workflow\"]\n    }\n  ]\n}\n",
        ".claude-plugin/plugin.json": "{\n  \"name\": \"claude-session-management\",\n  \"version\": \"1.0.0\",\n  \"description\": \"Save, load, and manage Claude Code session snapshots with git versioning\",\n  \"author\": {\n    \"name\": \"deemkeen\",\n    \"email\": \"dimgur@gmail.com\"\n  },\n  \"license\": \"MIT\",\n  \"keywords\": [\"session\", \"snapshot\", \"management\", \"git\", \"versioning\"]\n}\n",
        "README.md": "# Claude Session Management Plugin\n\nA Claude Code plugin for managing session snapshots with git versioning.\n\n## Features\n\n- **Interactive dialog**: Simple command with guided prompts for all operations\n- **Save sessions**: Export current session with timestamp and sanitize local details\n- **Load sessions**: Browse and load previous sessions with date-sorted list\n- **Delete sessions**: Remove unwanted sessions with git tracking\n- **Auto-commit**: All operations automatically commit to git\n- **Privacy**: Removes local paths, usernames, and machine details from exports\n\n## Installation\n\n### Option 1: Install from Marketplace (Recommended)\n\n1. Add the plugin marketplace to Claude Code:\n```\n/plugin marketplace add deemkeen/claude-session-management\n```\n\n2. Install the plugin:\n```\n/plugin install claude-session-management\n```\n\n3. Start using the `/session-snapshot` command!\n\n### Option 2: Manual Installation\n\n1. Clone this repository:\n```bash\ngit clone https://github.com/deemkeen/claude-session-management.git\n```\n\n2. Add the local plugin to Claude Code:\n```\n/plugin add /path/to/claude-session-management\n```\n\n3. Use `/session-snapshot` command\n\n## Usage\n\nSimply run the command:\n```\n/session-snapshot\n```\n\nClaude will present an interactive dialog to choose your action.\n\n### Interactive Workflow\n\n**Step 1: Choose Action**\n\nClaude asks what you want to do:\n- Save current session\n- Load a previous session\n- Delete a saved session\n\n**Step 2: Perform Operation**\n\n- **Save**: Claude exports, sanitizes, and commits the current session automatically\n- **Load**: Select from a date-sorted list of sessions, then Claude clears context and loads it\n- **Delete**: Select from a date-sorted list of sessions, then Claude deletes and commits\n\n### Examples\n\n#### Save a session\n1. Run `/session-snapshot`\n2. Choose \"Save current session\"\n3. Claude exports the conversation, sanitizes it, and commits to git\n\n#### Load a session\n1. Run `/session-snapshot`\n2. Choose \"Load a previous session\"\n3. Select the snapshot from the list (sorted by date, newest first)\n4. Claude clears context and loads the selected session\n\n#### Delete a session\n1. Run `/session-snapshot`\n2. Choose \"Delete a saved session\"\n3. Select the snapshot to delete from the list\n4. Claude deletes the file and commits the change\n\n## Directory Structure\n\n```\nclaude-session-management/\n├── .claude-plugin/\n│   └── plugin.json          # Plugin manifest\n├── commands/\n│   └── session-snapshot.md  # Main command definition\n├── scripts/\n│   └── sanitize-session.sh  # Session sanitization helper\n├── saved-sessions/          # Stored session snapshots (gitignored during dev)\n└── README.md\n```\n\n## Session Storage\n\nSessions are saved in the `./saved-sessions/` directory with the format:\n```\nYYYYMMDD-HHMMSS-session-snapshot.txt\n```\n\nExample: `20250112-143022-session-snapshot.txt`\n\n## Privacy & Sanitization\n\nThe plugin automatically sanitizes session exports by removing:\n- Home directory paths (`/home/username` → `/home/user`)\n- Current working directories\n- System usernames\n- Hostnames\n- Other identifying information\n\n## Requirements\n\n- Claude Code with plugin support\n- Git (for versioning)\n- Bash (for sanitization script)\n\n## License\n\nMIT\n\n## Author\n\ndeemkeen (dimgur@gmail.com)\n"
      },
      "plugins": [
        {
          "name": "claude-session-management",
          "source": "./",
          "description": "Save, load, and manage Claude Code session snapshots with git versioning",
          "version": "1.0.0",
          "author": {
            "name": "deemkeen",
            "email": "dimgur@gmail.com"
          },
          "homepage": "https://github.com/deemkeen/claude-session-management",
          "repository": "https://github.com/deemkeen/claude-session-management",
          "license": "MIT",
          "keywords": [
            "session",
            "snapshot",
            "management",
            "git",
            "versioning",
            "export",
            "backup"
          ],
          "category": "productivity",
          "tags": [
            "session-management",
            "backup",
            "git",
            "workflow"
          ],
          "categories": [
            "backup",
            "export",
            "git",
            "management",
            "productivity",
            "session",
            "session-management",
            "snapshot",
            "versioning",
            "workflow"
          ],
          "install_commands": [
            "/plugin marketplace add deemkeen/claude-session-management",
            "/plugin install claude-session-management@claude-session-management"
          ]
        }
      ]
    }
  ]
}