{
  "author": {
    "id": "Diatonic-AI",
    "display_name": "Diatonic AI",
    "avatar_url": "https://avatars.githubusercontent.com/u/196868267?v=4"
  },
  "marketplaces": [
    {
      "name": "diatonic-ai-plugins",
      "version": null,
      "description": "Official Diatonic AI plugin marketplace for Claude Code - DevOps automation tools for modern data pipelines",
      "repo_full_name": "Diatonic-AI/opengov-garden",
      "repo_url": "https://github.com/Diatonic-AI/opengov-garden",
      "repo_description": "Universal DevOps automation toolkit for Supabase+Airflow+SQLite+Playwright stacks. Claude Code plugin marketplace providing service orchestration, schema sync, wiring validation, and gap analysis.",
      "signals": {
        "stars": 0,
        "forks": 0,
        "pushed_at": "2026-01-26T07:52:46Z"
      },
      "files": {
        ".claude-plugin/marketplace.json": "{\n  \"name\": \"diatonic-ai-plugins\",\n  \"displayName\": \"Diatonic AI Plugins\",\n  \"description\": \"Official Diatonic AI plugin marketplace for Claude Code - DevOps automation tools for modern data pipelines\",\n  \"owner\": {\n    \"name\": \"Diatonic AI\",\n    \"email\": \"ai@diatonic.ai\",\n    \"url\": \"https://github.com/Diatonic-AI\"\n  },\n  \"plugins\": [\n    {\n      \"name\": \"opengov-garden\",\n      \"description\": \"Multi-agent DevOps automation platform with 8 specialized agents, 68 CLI commands, Supabase MCP integration, comprehensive testing framework, and intelligent code review for Supabase+Airflow+SQLite+Playwright stacks.\",\n      \"version\": \"0.2.0\",\n      \"author\": {\n        \"name\": \"Diatonic AI\",\n        \"email\": \"ai@diatonic.ai\"\n      },\n      \"source\": \"./\",\n      \"keywords\": [\n        \"devops\",\n        \"multi-agent\",\n        \"supabase\",\n        \"mcp\",\n        \"airflow\",\n        \"sqlite\",\n        \"playwright\",\n        \"automation\",\n        \"orchestration\",\n        \"etl\",\n        \"schema-sync\",\n        \"testing\",\n        \"code-review\",\n        \"database-migration\",\n        \"ops\"\n      ]\n    }\n  ]\n}\n",
        ".claude-plugin/plugin.json": "{\n  \"name\": \"opengov-garden\",\n  \"version\": \"0.2.0\",\n  \"description\": \"Multi-agent DevOps automation platform with 8 specialized agents, 68 CLI commands, Supabase MCP integration, comprehensive testing framework, and intelligent code review for Supabase+Airflow+SQLite+Playwright stacks.\",\n  \"author\": {\n    \"name\": \"Diatonic AI\",\n    \"email\": \"ai@diatonic.ai\"\n  },\n  \"keywords\": [\n    \"devops\",\n    \"multi-agent\",\n    \"supabase\",\n    \"mcp\",\n    \"airflow\",\n    \"sqlite\",\n    \"playwright\",\n    \"automation\",\n    \"orchestration\",\n    \"etl\",\n    \"schema-sync\",\n    \"testing\",\n    \"code-review\",\n    \"database-migration\",\n    \"ops\"\n  ],\n  \"license\": \"MIT\",\n  \"repository\": \"https://github.com/Diatonic-AI/opengov-garden\",\n  \"homepage\": \"https://github.com/Diatonic-AI/opengov-garden#readme\"\n}\n",
        "README.md": "# ğŸŒ± OpenGov Garden\n\n> **Universal DevOps automation toolkit for Supabase + Airflow + SQLite + Playwright stacks**\n\n[![Version](https://img.shields.io/badge/version-0.2.0-blue.svg)](https://github.com/Diatonic-AI/opengov-garden/releases)\n[![License](https://img.shields.io/badge/license-MIT-green.svg)](LICENSE)\n[![Claude Code](https://img.shields.io/badge/Claude_Code-Plugin-purple.svg)](https://github.com/anthropics/claude-code)\n\nA comprehensive Claude Code plugin that provides multi-agent orchestration, database schema synchronization, service wiring validation, automated testing, and intelligent code review for modern data pipeline development.\n\n---\n\n## ğŸ¯ What is Garden?\n\nGarden is a **multi-agent DevOps automation system** that helps you:\n\n- **ğŸ”„ Synchronize** SQLite and Supabase schemas automatically\n- **ğŸ” Audit** database integrity and security compliance\n- **ğŸ§ª Test** your code with comprehensive test orchestration\n- **ğŸ”Œ Validate** service integrations and connectivity\n- **ğŸ“Š Generate** resources following project conventions\n- **â¬†ï¸ Upgrade** systems safely with automated migrations\n- **ğŸ› Debug** issues with intelligent log analysis\n- **âœ… Review** code for quality and security\n\n### Key Features\n\nâœ¨ **8 Specialized Agents**:\n- **Audit Agent**: System auditing and compliance checking\n- **Schema Agent**: Database schema synchronization\n- **Debug Agent**: Troubleshooting and error resolution\n- **Review Agent**: Code and configuration review\n- **Scaffold Agent**: Resource generation with conventions\n- **Wire Agent**: Service integration validation\n- **Test Agent**: Automated testing orchestration\n- **Upgrade Agent**: System version upgrades\n\nğŸ¯ **68 CLI Commands** organized into 12 categories\n\nğŸ”Œ **Supabase MCP Integration** for local and remote instances\n\nğŸ“ **Config-Driven Architecture** using YAML\n\nğŸ—ï¸ **Scaffold Templates** with automatic naming convention enforcement\n\nğŸ§ª **Comprehensive Testing** framework (unit, integration, smoke, E2E)\n\n---\n\n## ğŸš€ Quick Start\n\n### Installation\n\nInstall from the Diatonic AI marketplace:\n\n```bash\n# Add Diatonic AI marketplace to Claude Code\n# In .claude/settings.json:\n{\n  \"extraKnownMarketplaces\": {\n    \"diatonic-ai-plugins\": {\n      \"source\": {\n        \"source\": \"github\",\n        \"owner\": \"Diatonic-AI\",\n        \"repo\": \"opengov-garden\"\n      }\n    }\n  },\n  \"enabledPlugins\": {\n    \"opengov-garden@diatonic-ai-plugins\": true\n  }\n}\n```\n\n### First Commands\n\n```bash\n# Test service connectivity\ngarden wire test all\n\n# Check database schemas\ngarden db diff\n\n# Run system audit\ngarden db audit\n\n# Check for plugin updates\ngarden upgrade check\n```\n\n---\n\n## ğŸ› ï¸ Common Workflows\n\n### Database Operations\n\n```bash\n# Compare local and remote schemas\ngarden db diff --detailed\n\n# Synchronize schemas (SQLite â†’ Postgres)\ngarden db sync\n\n# Synchronize in reverse (Postgres â†’ SQLite)\ngarden db sync --direction postgres_to_sqlite\n\n# Audit database integrity\ngarden db audit\n\n# Deep audit with comprehensive checks\ngarden db audit --deep\n\n# Validate schema best practices\ngarden db schema validate\n\n# Generate migration from changes\ngarden db migration generate add_versioning --type schema\n\n# Apply specific migration\ngarden db migration apply --migration 20260125_add_versioning\n\n# List all migrations\ngarden db migration list --status pending\n```\n\n### Service Connectivity\n\n```bash\n# Test all services\ngarden wire test all\n\n# Test specific service\ngarden wire test supabase-mcp\ngarden wire test database --verbose\ngarden wire test airflow\ngarden wire test auth\n\n# Map service dependencies\ngarden wire map\n\n# Generate architecture diagram\ngarden wire map --format svg --output docs/architecture.svg\n```\n\n### Testing\n\n```bash\n# Run unit tests\ngarden test unit\n\n# Run unit tests with coverage\ngarden test unit --coverage\n\n# Run integration tests\ngarden test integration\n\n# Run smoke tests (critical paths)\ngarden test smoke\n\n# Run E2E tests\ngarden test e2e\n\n# Generate coverage report\ngarden test coverage --min-coverage 90\n```\n\n### Debugging\n\n```bash\n# Analyze logs\ngarden debug logs --service api --filter error\n\n# Trace specific error\ngarden debug trace err_20260125_143052\n\n# Ping service\ngarden debug ping database\n\n# Inspect system state\ngarden debug inspect --component database\n```\n\n### Security & Compliance\n\n```bash\n# Scan for vulnerabilities\ngarden security scan --severity critical\n\n# Check Supabase advisors\ngarden security advisors --type security\n\n# Check compliance\ngarden compliance check\n```\n\n### Resource Generation\n\n```bash\n# Generate database table\ngarden scaffold table opengov_vendors\n\n# Generate Airflow DAG\ngarden scaffold dag opengov_extraction_prod\n\n# Generate skill definition\ngarden scaffold skill analytics/vendors:report\n\n# Generate test suite\ngarden scaffold test integration/test_vendor_sync\n```\n\n### System Upgrades\n\n```bash\n# Check for updates\ngarden upgrade check\n\n# Plan upgrade\ngarden upgrade plan --to 0.3.0\n\n# Execute upgrade\ngarden upgrade apply --to 0.3.0\n\n# Verify upgrade\ngarden upgrade verify\n```\n\n---\n\n## ğŸ”§ Configuration\n\n### Environment Variables\n\nCreate `.env` file in plugin root:\n\n```bash\n# Supabase Configuration\nSUPABASE_URL=http://localhost:54321\nSUPABASE_ANON_KEY=your-anon-key\nSUPABASE_SERVICE_ROLE_KEY=your-service-role-key\nSUPABASE_PROJECT_ID=your-project-id\n\n# Airflow Configuration (Optional)\nAIRFLOW_HOME=${PWD}/airflow\nAIRFLOW_API_URL=http://localhost:8080\nAIRFLOW_USERNAME=admin\nAIRFLOW_PASSWORD=admin\n\n# Logging\nLOG_LEVEL=INFO\n```\n\n### Garden Configuration\n\nEdit `config/garden.yml` for advanced configuration:\n\n```yaml\nversion: \"0.2.0\"\n\nproject:\n  name: \"your-project\"\n  root: \"/path/to/project\"\n\ndatabases:\n  sqlite:\n    - name: \"main\"\n      path: \"data/main.db\"\n      schema: \"main\"\n      wal_mode: true\n\n  supabase:\n    project_id: \"${SUPABASE_PROJECT_ID}\"\n    schemas: [\"public\", \"custom\"]\n\nmcp_servers:\n  supabase_local:\n    enabled: true\n    command: npx\n    args: [\"@modelcontextprotocol/server-supabase\"]\n\n  supabase_remote:\n    enabled: true\n    use_claude_mcp: true\n\nagents:\n  enabled:\n    - audit-agent\n    - schema-agent\n    - debug-agent\n    - review-agent\n    - scaffold-agent\n    - wire-agent\n    - test-agent\n    - upgrade-agent\n```\n\n---\n\n## ğŸ¤– Agent Details\n\n### Audit Agent\n**Purpose**: Proactive system health monitoring\n\n**Capabilities**:\n- Database integrity checks (PRAGMA integrity_check)\n- Orphaned index detection\n- Security vulnerability scanning\n- Performance bottleneck identification\n- Compliance validation\n\n**Schedule**: Every 6 hours + on-demand\n\n### Schema Agent\n**Purpose**: Database schema consistency\n\n**Capabilities**:\n- Schema diffing (SQLite â†” Supabase)\n- Migration generation\n- Safe migration application\n- Foreign key verification\n\n**MCP Integration**: list_tables, apply_migration, list_migrations\n\n### Debug Agent\n**Purpose**: Fast issue resolution\n\n**Capabilities**:\n- Log pattern analysis\n- Stack trace interpretation\n- Connectivity testing\n- Root cause identification\n\n**MCP Integration**: get_logs for all Supabase services\n\n### Wire Agent\n**Purpose**: Service integration confidence\n\n**Capabilities**:\n- Connectivity testing\n- Health check execution\n- Dependency mapping\n- Architecture diagram generation\n\n**Triggers**: On startup, before deploy, on-demand\n\n### Test Agent\n**Purpose**: Comprehensive quality validation\n\n**Test Types**:\n- Unit: Fast, isolated, mocked\n- Integration: Multi-component, real connections\n- Smoke: Critical paths, quick validation\n- E2E: Full workflows, browser automation\n\n**Coverage Threshold**: 80%\n\n### Scaffold Agent\n**Purpose**: Consistent resource generation\n\n**Templates**:\n- Database tables\n- Airflow DAGs\n- Skill definitions\n- Agent prompts\n- Test suites\n- Migrations\n\n### Review Agent\n**Purpose**: Code quality assurance\n\n**Capabilities**:\n- Skill validation\n- Migration safety review\n- DAG validation\n- Code linting\n\n### Upgrade Agent\n**Purpose**: Safe system evolution\n\n**Features**:\n- Automatic backups\n- Migration automation\n- Rollback on failure\n- Verification checks\n\n---\n\n## ğŸ“š Documentation\n\n- **[ARCHITECTURE.md](ARCHITECTURE.md)**: Detailed multi-agent architecture\n- **[prompts/](prompts/)**: Agent system prompts\n- **[prompts/examples/](prompts/examples/)**: Practical usage examples\n- **[config/](config/)**: Configuration references\n- **[scaffolds/](scaffolds/)**: Template documentation\n\n---\n\n## ğŸ“Š Architecture\n\n```\nâ”Œâ”€â”€â”€â”€â”€â”€â”€â”€â”€â”€â”€â”€â”€â”€â”€â”€â”€â”€â”€â”€â”€â”€â”€â”€â”€â”€â”€â”€â”€â”€â”€â”€â”€â”€â”€â”€â”€â”€â”€â”€â”€â”€â”€â”€â”€â”€â”€â”€â”€â”€â”€â”€â”€â”€â”€â”€â”€â”€â”€â”€â”€â”\nâ”‚                     CLI Interface Layer                      â”‚\nâ”‚  garden [command] [subcommand] [options]                    â”‚\nâ””â”€â”€â”€â”€â”€â”€â”€â”€â”€â”€â”€â”€â”€â”€â”€â”€â”€â”€â”€â”€â”€â”€â”€â”€â”€â”€â”€â”€â”€â”€â”€â”€â”€â”€â”€â”€â”€â”€â”€â”€â”€â”€â”€â”€â”€â”€â”€â”€â”€â”€â”€â”€â”€â”€â”€â”€â”€â”€â”€â”€â”€â”˜\n                              â”‚\nâ”Œâ”€â”€â”€â”€â”€â”€â”€â”€â”€â”€â”€â”€â”€â”€â”€â”€â”€â”€â”€â”€â”€â”€â”€â”€â”€â”€â”€â”€â”€â”€â”€â”€â”€â”€â”€â”€â”€â”€â”€â”€â”€â”€â”€â”€â”€â”€â”€â”€â”€â”€â”€â”€â”€â”€â”€â”€â”€â”€â”€â”€â”€â”\nâ”‚                   Agent Orchestration Layer                  â”‚\nâ”‚  â”Œâ”€â”€â”€â”€â”€â”€â”€â”€â”€â”  â”Œâ”€â”€â”€â”€â”€â”€â”€â”€â”€â”  â”Œâ”€â”€â”€â”€â”€â”€â”€â”€â”€â”  â”Œâ”€â”€â”€â”€â”€â”€â”€â”€â”€â”       â”‚\nâ”‚  â”‚  Audit  â”‚  â”‚ Schema  â”‚  â”‚  Debug  â”‚  â”‚ Review  â”‚       â”‚\nâ”‚  â”‚  Agent  â”‚  â”‚  Agent  â”‚  â”‚  Agent  â”‚  â”‚  Agent  â”‚       â”‚\nâ”‚  â””â”€â”€â”€â”€â”€â”€â”€â”€â”€â”˜  â””â”€â”€â”€â”€â”€â”€â”€â”€â”€â”˜  â””â”€â”€â”€â”€â”€â”€â”€â”€â”€â”˜  â””â”€â”€â”€â”€â”€â”€â”€â”€â”€â”˜       â”‚\nâ”‚  â”Œâ”€â”€â”€â”€â”€â”€â”€â”€â”€â”  â”Œâ”€â”€â”€â”€â”€â”€â”€â”€â”€â”  â”Œâ”€â”€â”€â”€â”€â”€â”€â”€â”€â”  â”Œâ”€â”€â”€â”€â”€â”€â”€â”€â”€â”       â”‚\nâ”‚  â”‚Scaffold â”‚  â”‚ Upgrade â”‚  â”‚  Wire   â”‚  â”‚  Test   â”‚       â”‚\nâ”‚  â”‚  Agent  â”‚  â”‚  Agent  â”‚  â”‚  Agent  â”‚  â”‚  Agent  â”‚       â”‚\nâ”‚  â””â”€â”€â”€â”€â”€â”€â”€â”€â”€â”˜  â””â”€â”€â”€â”€â”€â”€â”€â”€â”€â”˜  â””â”€â”€â”€â”€â”€â”€â”€â”€â”€â”˜  â””â”€â”€â”€â”€â”€â”€â”€â”€â”€â”˜       â”‚\nâ””â”€â”€â”€â”€â”€â”€â”€â”€â”€â”€â”€â”€â”€â”€â”€â”€â”€â”€â”€â”€â”€â”€â”€â”€â”€â”€â”€â”€â”€â”€â”€â”€â”€â”€â”€â”€â”€â”€â”€â”€â”€â”€â”€â”€â”€â”€â”€â”€â”€â”€â”€â”€â”€â”€â”€â”€â”€â”€â”€â”€â”€â”˜\n                              â”‚\nâ”Œâ”€â”€â”€â”€â”€â”€â”€â”€â”€â”€â”€â”€â”€â”€â”€â”€â”€â”€â”€â”€â”€â”€â”€â”€â”€â”€â”€â”€â”€â”€â”€â”€â”€â”€â”€â”€â”€â”€â”€â”€â”€â”€â”€â”€â”€â”€â”€â”€â”€â”€â”€â”€â”€â”€â”€â”€â”€â”€â”€â”€â”€â”\nâ”‚                    Integration Layer                         â”‚\nâ”‚  â”Œâ”€â”€â”€â”€â”€â”€â”€â”€â”€â”€â”€â”€â”€â”€â”  â”Œâ”€â”€â”€â”€â”€â”€â”€â”€â”€â”€â”€â”€â”€â”€â”  â”Œâ”€â”€â”€â”€â”€â”€â”€â”€â”€â”€â”€â”€â”€â”€â”      â”‚\nâ”‚  â”‚   Supabase   â”‚  â”‚   Airflow    â”‚  â”‚   SQLite     â”‚      â”‚\nâ”‚  â”‚  MCP Local   â”‚  â”‚     API      â”‚  â”‚   Direct     â”‚      â”‚\nâ”‚  â””â”€â”€â”€â”€â”€â”€â”€â”€â”€â”€â”€â”€â”€â”€â”˜  â””â”€â”€â”€â”€â”€â”€â”€â”€â”€â”€â”€â”€â”€â”€â”˜  â””â”€â”€â”€â”€â”€â”€â”€â”€â”€â”€â”€â”€â”€â”€â”˜      â”‚\nâ””â”€â”€â”€â”€â”€â”€â”€â”€â”€â”€â”€â”€â”€â”€â”€â”€â”€â”€â”€â”€â”€â”€â”€â”€â”€â”€â”€â”€â”€â”€â”€â”€â”€â”€â”€â”€â”€â”€â”€â”€â”€â”€â”€â”€â”€â”€â”€â”€â”€â”€â”€â”€â”€â”€â”€â”€â”€â”€â”€â”€â”€â”˜\n```\n\nSee [ARCHITECTURE.md](ARCHITECTURE.md) for detailed architecture documentation.\n\n---\n\n## ğŸ“ Use Cases\n\n### Development Workflow\n\n```bash\n# 1. Start services\ngarden wire test all\n\n# 2. Make schema changes\n# ... edit schema ...\n\n# 3. Compare with remote\ngarden db diff\n\n# 4. Generate migration\ngarden db migration generate sync_local_changes\n\n# 5. Apply migration\ngarden db migration apply\n\n# 6. Run tests\ngarden test unit\ngarden test integration\n\n# 7. Pre-commit checks\ngarden compliance check\n```\n\n### Production Deployment\n\n```bash\n# 1. Connectivity validation\ngarden wire test all\n\n# 2. Security audit\ngarden security scan --severity critical\n\n# 3. Database audit\ngarden db audit --deep\n\n# 4. Smoke tests\ngarden test smoke --environment production\n\n# 5. Deploy\n# ... deployment ...\n\n# 6. Verification\ngarden upgrade verify\n```\n\n---\n\n## ğŸ” Troubleshooting\n\n### MCP Server Not Connected\n\n```bash\n# Test MCP connectivity\ngarden wire test supabase-mcp\n\n# If failed, check Supabase:\nsupabase status\n\n# Start if needed:\nsupabase start\n```\n\n### Database Locked Errors\n\n```bash\n# Inspect database\ngarden debug inspect --component database\n\n# Enable WAL mode in connections\n```\n\n### Agent Execution Failures\n\n```bash\n# Check logs\ngarden debug logs --filter \"agent\"\n\n# Verify configuration\ngarden compliance check\n```\n\n---\n\n## ğŸ¤ Contributing\n\nWe welcome contributions!\n\n1. Fork the repository\n2. Create a feature branch\n3. Follow naming conventions\n4. Add tests\n5. Update documentation\n6. Submit a pull request\n\n---\n\n## ğŸ“„ License\n\nMIT License - see [LICENSE](LICENSE) file\n\n---\n\n## ğŸ™ Acknowledgments\n\nBuilt with:\n- [Claude Code](https://claude.com/claude-code)\n- [Supabase](https://supabase.com)\n- [Apache Airflow](https://airflow.apache.org)\n- [Playwright](https://playwright.dev)\n- [SQLite](https://sqlite.org)\n\n---\n\n## ğŸ“ Support\n\n- **Issues**: https://github.com/Diatonic-AI/opengov-garden/issues\n- **Discussions**: https://github.com/Diatonic-AI/opengov-garden/discussions\n- **Email**: ai@diatonic.ai\n\n---\n\n**Version**: 0.2.0\n**Last Updated**: 2026-01-26\n**Maintained By**: Diatonic AI\n"
      },
      "plugins": [
        {
          "name": "opengov-garden",
          "description": "Multi-agent DevOps automation platform with 8 specialized agents, 68 CLI commands, Supabase MCP integration, comprehensive testing framework, and intelligent code review for Supabase+Airflow+SQLite+Playwright stacks.",
          "version": "0.2.0",
          "author": {
            "name": "Diatonic AI",
            "email": "ai@diatonic.ai"
          },
          "source": "./",
          "keywords": [
            "devops",
            "multi-agent",
            "supabase",
            "mcp",
            "airflow",
            "sqlite",
            "playwright",
            "automation",
            "orchestration",
            "etl",
            "schema-sync",
            "testing",
            "code-review",
            "database-migration",
            "ops"
          ],
          "categories": [
            "airflow",
            "automation",
            "code-review",
            "database-migration",
            "devops",
            "etl",
            "mcp",
            "multi-agent",
            "ops",
            "orchestration",
            "playwright",
            "schema-sync",
            "sqlite",
            "supabase",
            "testing"
          ],
          "install_commands": [
            "/plugin marketplace add Diatonic-AI/opengov-garden",
            "/plugin install opengov-garden@diatonic-ai-plugins"
          ]
        }
      ]
    }
  ]
}