{
  "author": {
    "id": "DojoCodingLabs",
    "display_name": "Dojo Coding",
    "avatar_url": "https://avatars.githubusercontent.com/u/187146327?v=4"
  },
  "marketplaces": [
    {
      "name": "juan-workflow",
      "version": "2.1.0",
      "description": "The non-engineer's development guardrails. A full dev lifecycle workflow â€” from spike to PR to review â€” built by a Head of Product who got tired of asking engineers for permission to ship.",
      "repo_full_name": "DojoCodingLabs/juan-workflow",
      "repo_url": "https://github.com/DojoCodingLabs/juan-workflow",
      "repo_description": "The non-engineer's development guardrails. A Claude Code plugin for the full dev lifecycle â€” spike, code, PR, Greptile review, handoff. By Dojo Coding Labs.",
      "signals": {
        "stars": 1,
        "forks": 1,
        "pushed_at": "2026-02-08T23:21:07Z"
      },
      "files": {
        ".claude-plugin/marketplace.json": "{\n  \"$schema\": \"https://anthropic.com/claude-code/marketplace.schema.json\",\n  \"name\": \"juan-workflow\",\n  \"version\": \"2.1.0\",\n  \"description\": \"The non-engineer's development guardrails. A full dev lifecycle workflow â€” from spike to PR to review â€” built by a Head of Product who got tired of asking engineers for permission to ship.\",\n  \"owner\": {\n    \"name\": \"Dojo Coding Labs\",\n    \"email\": \"team@dojocoding.io\"\n  },\n  \"plugins\": [\n    {\n      \"name\": \"juan-workflow\",\n      \"description\": \"Full dev lifecycle orchestrator: spike planning in Linear, duplicate detection, implementation tracking, Greptile-gated PRs, and round-robin reviewer assignment. One command â€” /juan-is-working â€” handles the ceremony so you focus on the creative work.\",\n      \"version\": \"2.1.0\",\n      \"author\": {\n        \"name\": \"Dojo Coding Labs\",\n        \"email\": \"team@dojocoding.io\"\n      },\n      \"source\": \"./\",\n      \"homepage\": \"https://github.com/DojoCodingLabs/juan-workflow\",\n      \"category\": \"workflow\",\n      \"keywords\": [\n        \"claude-code\",\n        \"claude-code-plugin\",\n        \"workflow\",\n        \"linear\",\n        \"github\",\n        \"greptile\",\n        \"code-review\",\n        \"project-management\",\n        \"developer-workflow\",\n        \"spike\",\n        \"planning\",\n        \"dojo-coding\"\n      ]\n    }\n  ]\n}\n",
        ".claude-plugin/plugin.json": "{\n  \"name\": \"juan-workflow\",\n  \"version\": \"2.1.0\",\n  \"description\": \"The non-engineer's development guardrails. A full dev lifecycle workflow â€” from spike to PR to review â€” built by a Head of Product who got tired of asking engineers for permission to ship. By Dojo Coding Labs.\",\n  \"author\": {\n    \"name\": \"Dojo Coding Labs\",\n    \"url\": \"https://dojocoding.io\"\n  },\n  \"homepage\": \"https://github.com/DojoCodingLabs/juan-workflow\",\n  \"repository\": \"https://github.com/DojoCodingLabs/juan-workflow\",\n  \"license\": \"MIT\",\n  \"keywords\": [\n    \"claude-code\",\n    \"claude-code-plugin\",\n    \"claude\",\n    \"anthropic\",\n    \"workflow\",\n    \"linear\",\n    \"github\",\n    \"greptile\",\n    \"code-review\",\n    \"project-management\",\n    \"developer-workflow\",\n    \"spike\",\n    \"planning\",\n    \"dojo-coding\"\n  ]\n}\n",
        "README.md": "# ğŸ—ï¸ juan-workflow â€” Claude Code Plugin\n\n[![Claude Code Plugin](https://img.shields.io/badge/Claude_Code-Plugin-blue?logo=anthropic&logoColor=white)](https://github.com/DojoCodingLabs/juan-workflow)\n[![License: MIT](https://img.shields.io/badge/License-MIT-green.svg)](https://opensource.org/licenses/MIT)\n[![Category: Workflow](https://img.shields.io/badge/Category-Workflow-purple)](https://github.com/topics/claude-code-plugin)\n[![Free & Open Source](https://img.shields.io/badge/Free-Open_Source-brightgreen)](https://github.com/DojoCodingLabs/juan-workflow)\n\n### The non-engineer's development guardrails â€” by [Dojo Coding Labs](https://dojocoding.io)\n\n---\n\n## The Origin Story\n\nJuan is Head of Product & Growth at [Dojo Coding Labs](https://dojocoding.io). He's not an engineer. He's a product guy who lives in Linear, thinks in user stories, and has strong opinions about button colors.\n\nOne day Juan decided he was tired of writing PRDs and waiting. He wanted to *contribute to the codebase*. The engineers were... concerned.\n\n> \"What if he pushes to main?\"\n> \"What if he duplicates work someone's already doing?\"\n> \"What if he skips the spike and just starts coding?\"\n> \"What if Greptile roasts him and he doesn't fix it?\"\n\nSo Juan did what any self-respecting Head of Product would do: **he built guardrails for himself.**\n\nThe result is **juan-workflow** â€” a Claude Code plugin that enforces the full development lifecycle every single time Juan sits down to code. Spike first. Check for duplicates. Get Greptile approval. Assign a human reviewer. No shortcuts.\n\n**The engineers love it.** Juan ships code now. Nothing breaks. And the workflow is so good the whole team uses it.\n\nOpen-sourced because if Juan can do it, anyone can. ğŸ¤·\n\n---\n\n## What It Does\n\nOne command â€” `/juan-workflow:juan-is-working` â€” orchestrates your entire dev session:\n\n```\nPhase 0  ğŸ”  Setup         Learn your team's patterns (first run only)\nPhase 1  ğŸ¯  Discovery     What are we building? Assess scope.\nPhase 2  ğŸ”  Duplicates    Check Linear + GitHub for existing work\nPhase 3  ğŸ“Œ  Spike         Create spike in Linear, brainstorm, document\nPhase 4  ğŸ—ï¸  Build         Create task, branch, implement, lint, test\nPhase 5  ğŸš€  PR + Review   Push PR, wait for Greptile, address feedback\nPhase 6  ğŸ‘‹  Handoff       Assign reviewer (round-robin), update Linear\n```\n\nEvery phase confirms before advancing. Everything is cross-linked (Linear â†” GitHub). Nothing falls through the cracks.\n\n---\n\n## Installation\n\n```bash\n# In Claude Code:\n/plugin marketplace add DojoCodingLabs/juan-workflow\n/plugin install juan-workflow@juan-workflow\n```\n\nThat's it. Type `/juan-workflow:juan-is-working` and you're off.\n\n### Updating\n\n```bash\n# Update the marketplace catalog first:\n/plugin marketplace update DojoCodingLabs/juan-workflow\n\n# Then update the plugin:\n/plugin update juan-workflow@juan-workflow\n```\n\nRestart your Claude Code session after updating.\n\n> **Requires:**\n> - [Claude Code](https://code.claude.com) with plugin support\n> - [GitHub CLI](https://cli.github.com) (`gh`) â€” authenticated\n> - [Linear MCP](https://www.npmjs.com/package/@linear/mcp-server) â€” connected to Claude Code\n> - [jq](https://jqlang.github.io/jq/) â€” `brew install jq` (macOS) or `apt install jq` (Linux)\n> - [Greptile](https://greptile.com) GitHub App â€” recommended but optional\n\n### Local Development\n\n```bash\ngit clone https://github.com/DojoCodingLabs/juan-workflow.git\ncd juan-workflow\n\n# In Claude Code:\n/plugin marketplace add .\n/plugin install juan-workflow\n```\n\n---\n\n## Usage\n\n### Every time you sit down to work:\n\n```\n/juan-workflow:juan-is-working\n```\n\nOr with a task description:\n\n```\n/juan-workflow:juan-is-working add a search bar to the movie list page\n```\n\n### The workflow walks you through:\n\n1. **\"What do you want to work on?\"** â€” Explain your task\n2. **Duplicate check** â€” Makes sure nobody's already doing this\n3. **Spike** â€” Brainstorm back and forth, document decisions in Linear\n4. **Implementation** â€” Create branch, code, lint, test\n5. **PR** â€” Push and wait for Greptile review\n6. **Handoff** â€” Assign a human reviewer, update Linear\n\n### Works with /feature-dev\n\nFor large tasks, the workflow will suggest using `/feature-dev` for the implementation phase. It handles everything before (spike, planning) and after (PR, review, handoff) â€” `/feature-dev` handles the actual coding.\n\n---\n\n## What's Inside\n\n```\njuan-workflow/\nâ”œâ”€â”€ .claude-plugin/\nâ”‚   â”œâ”€â”€ plugin.json          # Plugin metadata\nâ”‚   â””â”€â”€ marketplace.json     # Marketplace catalog\nâ”œâ”€â”€ commands/\nâ”‚   â””â”€â”€ juan-is-working.md   # ğŸ§  The main orchestrator (all 7 phases)\nâ”œâ”€â”€ agents/\nâ”‚   â”œâ”€â”€ pattern-learner.md   # ğŸ” Discovers org patterns (Phase 0)\nâ”‚   â””â”€â”€ duplicate-checker.md # ğŸ” Finds overlapping work (Phase 2)\nâ”œâ”€â”€ scripts/\nâ”‚   â”œâ”€â”€ wait-greptile.sh     # â³ Polls for Greptile review (Phase 5)\nâ”‚   â””â”€â”€ assign-reviewer.sh   # ğŸ¯ Round-robin reviewer pick (Phase 6)\nâ”œâ”€â”€ LICENSE\nâ””â”€â”€ README.md\n```\n\n### Pattern Learning (Phase 0)\n\nOn first run, the **pattern-learner** agent analyzes your repo and Linear workspace:\n\n- **Branch naming conventions** â€” analyzes 20+ recent branches to detect the pattern\n- **PR title format** â€” learns from 10 recent PRs\n- **Team members** â€” builds the reviewer pool from GitHub collaborators\n- **Linear workflow states** â€” maps all states and their IDs\n- **Labels** â€” finds the Spike label (and others)\n- **Greptile bot** â€” detects if Greptile is configured and its username\n\nEverything is saved to `.claude/juan-workflow-learned.local.json` (gitignored). Re-learned automatically if the config is older than 7 days.\n\n### Greptile Gating (Phase 5)\n\nAfter creating a PR, the workflow waits for Greptile:\n\n- **6 minute** initial wait\n- **2 minute** retry intervals\n- **15 minute** max wait\n- If Greptile has feedback â†’ address it, push, re-wait\n- If 3 rounds without clean review â†’ offer escape to human review\n- If Greptile isn't configured â†’ skip gracefully\n\n### Round-Robin Reviews (Phase 6)\n\nReviewers are assigned from the learned team pool in round-robin order. The index persists in the config file so it rotates fairly across sessions.\n\n---\n\n## Error Handling\n\n| Situation | What happens |\n|-----------|-------------|\n| Linear MCP unavailable | Warns, continues GitHub-only |\n| `gh` not authenticated | Shows error, asks to run `gh auth login` |\n| Greptile timeout (>15 min) | Asks: wait more / proceed / check manually |\n| Config missing mid-workflow | Re-triggers Phase 0 |\n| Branch name collision | Appends numeric suffix |\n| Greptile loop >3 rounds | Warns, offers escape to human review |\n| Juan says \"stop\" | Graceful exit, shows what was created |\n\n---\n\n## Requirements\n\n| Tool | Required | Notes |\n|------|----------|-------|\n| Claude Code | âœ… | With plugin support |\n| GitHub CLI (`gh`) | âœ… | Must be authenticated (`gh auth login`) |\n| Linear MCP | âœ… | Connected to Claude Code |\n| `jq` | âœ… | For scripts (`brew install jq`) |\n| Greptile | ğŸ“‹ Recommended | If not present, review gating is skipped |\n| `/feature-dev` | ğŸ“‹ Optional | For large feature implementation |\n\n---\n\n## Future (v2+)\n\n- ğŸ”” Slack notifications on PR ready\n- ğŸ“Š Cycle time analytics\n- ğŸ”„ Auto-resume interrupted workflows\n- ğŸ‘¥ Team mode (not just Juan)\n- ğŸ¤– Greptile MCP integration (when available)\n- ğŸ“¦ Multi-task batching\n- ğŸ“ Review follow-up monitoring\n\n---\n\n## Contributing\n\nThis started as a joke plugin for one non-engineer. Now the whole team uses it. If you want to make it better:\n\n- **ğŸ› Bug fixes** â€” Found an issue? Open a PR\n- **ğŸ”§ New phases** â€” Got an idea for a workflow step? Let's talk\n- **ğŸŒ Translations** â€” Help us add more bilingual touches\n- **ğŸ“ Better docs** â€” Always welcome\n\n---\n\n## Built by Dojo Coding Labs\n\n[Dojo Coding Labs](https://dojocoding.io) is a LATAM-first tech education and product studio. We build tools for developers and teach people to code.\n\n**juan-workflow** is free forever. Open source. MIT licensed. If a Head of Product can ship code safely, so can you.\n\n### More from Dojo Coding\n\n- **[CodeSensei](https://github.com/DojoCodingLabs/code-sensei)** â€” Learn to code while you vibecode\n- **[VibeCoding Bootcamp](https://dojocoding.io/bootcamp)** â€” Structured curriculum with live mentors\n- **[DojoOS](https://dojocoding.io/dojoos)** â€” Full developer environment and community\n\n---\n\n## License\n\nMIT License â€” free to use, modify, and distribute.\n\n---\n\n<p align=\"center\">\n  <strong>ğŸ—ï¸ From product guy to shipping code â€” one /juan-is-working at a time.</strong><br>\n  <em>Free. Open source. By <a href=\"https://dojocoding.io\">Dojo Coding Labs</a>.</em>\n</p>\n"
      },
      "plugins": [
        {
          "name": "juan-workflow",
          "description": "Full dev lifecycle orchestrator: spike planning in Linear, duplicate detection, implementation tracking, Greptile-gated PRs, and round-robin reviewer assignment. One command â€” /juan-is-working â€” handles the ceremony so you focus on the creative work.",
          "version": "2.1.0",
          "author": {
            "name": "Dojo Coding Labs",
            "email": "team@dojocoding.io"
          },
          "source": "./",
          "homepage": "https://github.com/DojoCodingLabs/juan-workflow",
          "category": "workflow",
          "keywords": [
            "claude-code",
            "claude-code-plugin",
            "workflow",
            "linear",
            "github",
            "greptile",
            "code-review",
            "project-management",
            "developer-workflow",
            "spike",
            "planning",
            "dojo-coding"
          ],
          "categories": [
            "claude-code",
            "claude-code-plugin",
            "code-review",
            "developer-workflow",
            "dojo-coding",
            "github",
            "greptile",
            "linear",
            "planning",
            "project-management",
            "spike",
            "workflow"
          ],
          "install_commands": [
            "/plugin marketplace add DojoCodingLabs/juan-workflow",
            "/plugin install juan-workflow@juan-workflow"
          ]
        }
      ]
    }
  ]
}