{
  "author": {
    "id": "dwmkerr",
    "display_name": "Dave Kerr",
    "avatar_url": "https://avatars.githubusercontent.com/u/1926984?u=50c038aec4c63eb1eb22b674d510b07053680a61&v=4"
  },
  "marketplaces": [
    {
      "name": "ai26",
      "version": null,
      "description": "PDF conversion and document processing tools",
      "repo_full_name": "dwmkerr/ai26",
      "repo_url": "https://github.com/dwmkerr/ai26",
      "repo_description": "Prediction and speculation for AI in 2026",
      "signals": {
        "stars": 0,
        "forks": 0,
        "pushed_at": "2026-01-19T01:45:33Z"
      },
      "files": {
        ".claude-plugin/marketplace.json": "{\n  \"name\": \"ai26\",\n  \"owner\": {\n    \"name\": \"dwmkerr\"\n  },\n  \"plugins\": [\n    {\n      \"name\": \"ai26\",\n      \"source\": \"./plugins/ai26\",\n      \"description\": \"PDF conversion and document processing tools\",\n      \"version\": \"0.1.0\"\n    }\n  ]\n}\n",
        "README.md": "# AI 2026\n\nPrediction and speculation for AI in 2026.\n\n<!-- vim-markdown-toc GFM -->\n\n- [The Anthropic Skill Supply Chain Attack](#the-anthropic-skill-supply-chain-attack)\n- [AI26 Plugin](#ai26-plugin)\n    - [Quickstart](#quickstart)\n    - [Developer Guide](#developer-guide)\n\n<!-- vim-markdown-toc -->\n\n## The Anthropic Skill Supply Chain Attack\n\nCode for my article [AI26 - The Anthropic Skill Supply Chain Attack](http://dwmkerr.com/anthropic-skill-supply-chain-attack/)\n\n> [!WARNING]\n> **Security Research Code - Use At Your Own Risk**\n>\n> This folder contains code that demonstrates supply chain attacks capable of exfiltrating sensitive data (API keys, credentials) from your environment.\n>\n> **For educational and authorized security research purposes only.**\n>\n> By accessing or executing this code, you acknowledge:\n> - You understand the risks involved\n> - You accept full responsibility for any consequences\n> - You will only use this in environments you own or have explicit authorization to test\n> - The author provides this code \"AS IS\" without warranty of any kind\n> - The author is not liable for any damages, data loss, or credential exposure\n>\n> **Do not run this code in production environments or with real credentials.**\n\nContent in:\n\n[./supply-chain](./supply-chain)\n\n## AI26 Plugin\n\nPDF conversion and document processing tools for Claude Code.\n\n### Quickstart\n\n```\n/plugin marketplace add dwmkerr/ai26\n/plugin install ai26@ai26\n```\n\n### Developer Guide\n\nFor local development:\n\n```bash\ngit clone https://github.com/dwmkerr/ai26.git\ncd ai26\nclaude plugin marketplace add ./plugins/ai26\nclaude plugin install ai26@ai26\n```\n\nUninstall:\n\n```bash\nclaude plugin marketplace remove ai26\n```\n\n"
      },
      "plugins": [
        {
          "name": "ai26",
          "source": "./plugins/ai26",
          "description": "PDF conversion and document processing tools",
          "version": "0.1.0",
          "categories": [],
          "install_commands": [
            "/plugin marketplace add dwmkerr/ai26",
            "/plugin install ai26@ai26"
          ]
        }
      ]
    }
  ]
}