{
  "author": {
    "id": "easydev-ai",
    "display_name": "easydev-ai",
    "avatar_url": "https://avatars.githubusercontent.com/u/249792437?v=4"
  },
  "marketplaces": [
    {
      "name": "easydev-ai",
      "version": null,
      "description": "Developer productivity toolkit for tech leads: research, design-sync, docs, and workflow automation",
      "repo_full_name": "easydev-ai/easydev",
      "repo_url": "https://github.com/easydev-ai/easydev",
      "repo_description": "Tech Lead Toolkit - Design-doc-driven development commands for Claude Code",
      "signals": {
        "stars": 1,
        "forks": 0,
        "pushed_at": "2025-12-20T20:52:45Z"
      },
      "files": {
        ".claude-plugin/marketplace.json": "{\n  \"name\": \"easydev-ai\",\n  \"owner\": {\n    \"name\": \"EasyDev AI\",\n    \"url\": \"https://github.com/easydev-ai\"\n  },\n  \"plugins\": [\n    {\n      \"name\": \"easydev\",\n      \"source\": \"./\",\n      \"description\": \"Developer productivity toolkit for tech leads: research, design-sync, docs, and workflow automation\",\n      \"version\": \"2.0.0\",\n      \"category\": \"productivity\",\n      \"keywords\": [\n        \"productivity\",\n        \"tech-lead\",\n        \"documentation\",\n        \"research\",\n        \"design-sync\",\n        \"workflow\"\n      ]\n    }\n  ]\n}\n",
        ".claude-plugin/plugin.json": "{\n  \"name\": \"easydev\",\n  \"version\": \"2.1.1\",\n  \"description\": \"Developer productivity toolkit for tech leads: research, design-sync, docs, and workflow automation\",\n  \"author\": {\n    \"name\": \"EasyDev AI\",\n    \"url\": \"https://github.com/easydev-ai\"\n  },\n  \"homepage\": \"https://github.com/easydev-ai/easydev\",\n  \"repository\": \"https://github.com/easydev-ai/easydev\",\n  \"license\": \"MIT\",\n  \"keywords\": [\n    \"productivity\",\n    \"tech-lead\",\n    \"documentation\",\n    \"research\",\n    \"design-sync\",\n    \"workflow\"\n  ]\n}\n",
        "README.md": "# easydev\n\n> Developer productivity toolkit for Claude Code â€” research, design-sync, documentation, and workflow automation.\n\nA focused plugin with 7 essential commands that complement (not duplicate) official Anthropic plugins.\n\n## Philosophy\n\n- **Complement, don't compete** â€” Use official plugins for code review, feature development, commits. This plugin fills the gaps.\n- **Smart auto-detection** â€” Commands detect MkDocs, i18n, and project structure automatically.\n- **Code is truth** â€” Every command treats code as the source of truth, not assumptions.\n- **Parallel by default** â€” Research and auditing spawn multiple sub-agents for speed.\n\n## Installation\n\n### From Marketplace\n\n```bash\n# Add the easydev-ai marketplace\n/plugin marketplace add easydev-ai/easydev\n\n# Install the plugin\n/plugin install easydev@easydev-ai\n```\n\n### Manual Installation\n\n```bash\n# Clone to your plugins directory\ngit clone https://github.com/easydev-ai/easydev ~/.claude/plugins/easydev\n```\n\nRestart Claude Code after installation.\n\n## Commands\n\n| Command | Description | Use When |\n|---------|-------------|----------|\n| `/easydev:research` | Deep research + codebase investigation with parallel sub-agents | \"Is X applicable to us?\" \"Why is Y breaking?\" |\n| `/easydev:design-sync` | Bidirectional code â†” design doc alignment | Code and spec have drifted apart |\n| `/easydev:docs-audit` | Audit docs for duplicates, orphans, broken links (auto-detects MkDocs) | Documentation cleanup needed |\n| `/easydev:docs-refresh` | Batch-update docs to match current code state | Code changed, docs are stale |\n| `/easydev:synthesize` | Distill conversation into structured documentation | Long discussion needs to become permanent docs |\n| `/easydev:standup` | Generate standup notes from git activity | Daily standup prep |\n| `/easydev:onboard` | Generate comprehensive onboarding documentation | New team member joining |\n\n## Command Details\n\n### `/easydev:research <question> [code-paths...]`\n\nYour most powerful research tool. Spawns parallel sub-agents to investigate:\n\n```bash\n# Research a technology\n/easydev:research Is API Gateway HTTP API applicable to our lambda/processor?\n\n# Investigate a bug\n/easydev:research Why are transcriptions failing for large files? src/services/audio/ --mode investigate\n\n# Compare options\n/easydev:research Should we switch from REST to GraphQL?\n```\n\n**Modes:**\n- `research` â€” External research, technology evaluation\n- `investigate` â€” Deep codebase analysis, dependency mapping\n- `auto` (default) â€” Intelligently combines both\n\n**Features:**\n- Parallel sub-agent execution (4+ agents at once)\n- Blast radius analysis for code changes\n- Evidence-based recommendations with sources\n\n---\n\n### `/easydev:design-sync <design-doc-path> [code-path]`\n\nIdentifies mismatches between design documents and code, then asks YOU which direction to fix:\n\n```bash\n/easydev:design-sync docs/specs/auth.md src/auth/\n```\n\n**Output:**\n```markdown\n| # | Design Doc Says | Code Does | Which is Correct? |\n|---|-----------------|-----------|-------------------|\n| 1 | Password reset required | Not implemented | ? |\n| 2 | localStorage tokens | httpOnly cookies | ? |\n\nRespond: \"1: doc, 2: code\" to specify fix direction\n```\n\n**Why this is unique:** Most tools assume the spec is always right. This command recognizes that sometimes code evolved past the spec.\n\n---\n\n### `/easydev:docs-audit [target-path]`\n\nSmart documentation auditing that auto-detects your documentation system:\n\n```bash\n# Audit all docs\n/easydev:docs-audit docs/\n\n# Focus on specific issues\n/easydev:docs-audit --focus duplicates\n/easydev:docs-audit --focus translations --lang zh\n```\n\n**Auto-detects:**\n- MkDocs (checks for `mkdocs.yml`) â†’ i18n-aware, nav validation\n- Generic â†’ File-based auditing, duplicate detection\n\n**Finds:**\n- Duplicate content (exact and semantic)\n- Orphan files (not linked anywhere)\n- Broken internal links\n- Translation gaps (MkDocs mode)\n- Nav mismatches (MkDocs mode)\n\n---\n\n### `/easydev:docs-refresh [docs-path] [code-path]`\n\nBatch-update documentation to match the current code state:\n\n```bash\n# Scan and update all docs\n/easydev:docs-refresh\n\n# Focus on specific areas\n/easydev:docs-refresh docs/api src/routes --scope critical\n\n# Scan only (no changes)\n/easydev:docs-refresh --mode scan\n```\n\n**Modes:**\n- `scan` â€” Report staleness only, don't propose changes\n- `update` â€” Propose and apply changes with approval\n- `auto` (default) â€” Scan first, then offer to update\n\n**Scopes:**\n- `all` â€” Check every doc against code\n- `stale` (default) â€” Only docs that appear outdated\n- `critical` â€” Only docs with breaking inaccuracies\n\n**How it works:**\n1. Maps documentation structure (auto-detects MkDocs)\n2. Maps code exports, routes, configs, env vars\n3. Spawns parallel agents to compare docs vs code\n4. Reports staleness with severity (ðŸ”´ Critical, ðŸŸ¡ Stale, ðŸŸ¢ Fresh)\n5. Proposes surgical updates (preserves human context)\n6. Applies changes only with your approval\n\n**Key principle:** Code is truth. When docs and code conflict, code wins (unless it's a bug).\n\n---\n\n### `/easydev:synthesize`\n\nDistills a conversation into permanent, structured documentation:\n\n```bash\n# After a long discussion\n/easydev:synthesize\n\n# With specific options\n/easydev:synthesize --category decision --title \"Authentication Strategy\"\n```\n\n**Key feature:** Prioritizes later conclusions over earlier exploration. If you discussed Redis, then MySQL, then decided PostgreSQL â€” the doc reflects PostgreSQL as the decision.\n\n**Auto-detects:**\n- MkDocs â†’ ADR numbering, i18n folders, nav suggestions\n- Generic â†’ Standard markdown output\n\n---\n\n### `/easydev:standup [days]`\n\nGenerates standup notes from git activity:\n\n```bash\n/easydev:standup      # Yesterday's activity\n/easydev:standup 3    # Last 3 days\n```\n\n**Output:**\n```markdown\n*Standup 2025-12-15*\n\nâœ… *Done:* Merged OAuth PR #123, fixed token refresh bug\nðŸ”„ *Today:* Password reset flow, integration tests\nðŸš§ *Blocked:* PR #126 awaiting review (2d)\n```\n\n---\n\n### `/easydev:onboard [--focus setup|architecture|workflows]`\n\nGenerates comprehensive onboarding documentation by analyzing your codebase:\n\n```bash\n/easydev:onboard\n/easydev:onboard --focus backend\n```\n\n**Generates:**\n- Tech stack overview\n- Prerequisites and setup instructions\n- Project structure guide\n- Available commands\n- Development workflow\n- Troubleshooting guide\n\n## Agents\n\nThese agents are invoked by commands or can be used directly:\n\n| Agent | Expertise | Invoked By |\n|-------|-----------|------------|\n| `code-reviewer` | Clean code, patterns, testability | Review workflows |\n| `security-auditor` | OWASP, auth, secrets, injection | Security checks |\n| `design-compliance` | Requirements tracing, spec coverage | `/easydev:design-sync` |\n\n## Using with Official Plugins\n\nThis plugin is designed to work alongside official Anthropic plugins:\n\n| Task | Use Official Plugin | Use easydev |\n|------|---------------------|-------------|\n| Code review | `/code-review:code-review` | â€” |\n| Feature development | `/feature-dev:feature-dev` | â€” |\n| Commits & PRs | `/commit-commands:*` | â€” |\n| **Research & evaluation** | â€” | `/easydev:research` |\n| **Design-code sync** | â€” | `/easydev:design-sync` |\n| **Documentation audit** | â€” | `/easydev:docs-audit` |\n| **Docs â† code sync** | â€” | `/easydev:docs-refresh` |\n| **Conversation â†’ docs** | â€” | `/easydev:synthesize` |\n| **Standup notes** | â€” | `/easydev:standup` |\n| **Onboarding docs** | â€” | `/easydev:onboard` |\n\n### LSP Prerequisites (Recommended)\n\nLSP (Language Server Protocol) gives Claude Code semantic code understanding â€” go-to-definition, find references, and accurate refactoring. Install the language server binaries first:\n\n```bash\n# TypeScript/JavaScript (vtsls)\nnpm install -g @vtsls/language-server typescript\n\n# Python (Pyright)\npip install pyright\n\n# Vue (optional)\nnpm install -g @vue/language-server\n```\n\nThen enable the LSP tool in your shell profile (`~/.zshrc` or `~/.bashrc`):\n\n```bash\nexport ENABLE_LSP_TOOL=1\n```\n\n> **Why separate installs?** Plugins are just configuration files that tell Claude Code *how* to connect to language servers. The actual language server binaries must be installed on your machine. See [anthropics/claude-plugins-official](https://github.com/anthropics/claude-plugins-official) for details.\n\n### Recommended Plugin Setup\n\n```bash\n# Official LSP plugins (code intelligence)\nclaude plugin install typescript-lsp@claude-plugins-official\nclaude plugin install pyright-lsp@claude-plugins-official\n\n# Official workflow plugins\nclaude plugin install feature-dev@claude-code-plugins\nclaude plugin install code-review@claude-code-plugins\nclaude plugin install commit-commands@claude-code-plugins\n\n# This plugin\nclaude plugin install easydev@easydev-ai\n```\n\nRestart Claude Code after installing plugins.\n\n## Contributing\n\nSee [CONTRIBUTING.md](CONTRIBUTING.md) for how to add or modify commands.\n\n## License\n\nMIT License - see [LICENSE](LICENSE)\n\n---\n\nBuilt by [EasyDev AI](https://github.com/easydev-ai)\n"
      },
      "plugins": [
        {
          "name": "easydev",
          "source": "./",
          "description": "Developer productivity toolkit for tech leads: research, design-sync, docs, and workflow automation",
          "version": "2.0.0",
          "category": "productivity",
          "keywords": [
            "productivity",
            "tech-lead",
            "documentation",
            "research",
            "design-sync",
            "workflow"
          ],
          "categories": [
            "design-sync",
            "documentation",
            "productivity",
            "research",
            "tech-lead",
            "workflow"
          ],
          "install_commands": [
            "/plugin marketplace add easydev-ai/easydev",
            "/plugin install easydev@easydev-ai"
          ]
        }
      ]
    }
  ]
}