{
  "author": {
    "id": "echoleesong",
    "display_name": "Li Shuang",
    "avatar_url": "https://avatars.githubusercontent.com/u/137158688?u=fb891275175844920f1380f7596694e040306f61&v=4"
  },
  "marketplaces": [
    {
      "name": "claude-skills-plugin-marketplace",
      "version": null,
      "description": "A comprehensive and extensible Claude Code skills repository. Currently includes 7 n8n workflow development skills and 1 skill-creator meta skill, with plans to expand to other development domains",
      "repo_full_name": "echoleesong/claude-skills-plugin",
      "repo_url": "https://github.com/echoleesong/claude-skills-plugin",
      "repo_description": null,
      "signals": {
        "stars": 0,
        "forks": 0,
        "pushed_at": "2026-01-30T03:34:04Z"
      },
      "files": {
        ".claude-plugin/marketplace.json": "{\n  \"name\": \"claude-skills-plugin-marketplace\",\n  \"owner\": {\n    \"name\": \"Li Song\",\n    \"email\": \"echoleesong@example.com\"\n  },\n  \"plugins\": [\n    {\n      \"name\": \"claude-skills-plugin\",\n      \"source\": \"./\",\n      \"description\": \"A comprehensive and extensible Claude Code skills repository. Currently includes 7 n8n workflow development skills and 1 skill-creator meta skill, with plans to expand to other development domains\",\n      \"version\": \"1.0.0\"\n    }\n  ]\n}\n",
        ".claude-plugin/plugin.json": "{\n  \"name\": \"claude-skills-plugin\",\n  \"version\": \"1.0.0\",\n  \"description\": \"A comprehensive and extensible Claude Code skills repository. Currently includes 7 n8n workflow development skills and 1 skill-creator meta skill, with plans to expand to other development domains\",\n  \"author\": {\n    \"name\": \"Li Song\",\n    \"email\": \"echoleesong@example.com\",\n    \"url\": \"https://github.com/echoleesong\"\n  },\n  \"homepage\": \"https://github.com/echoleesong/claude-skills-plugin\",\n  \"repository\": \"https://github.com/echoleesong/claude-skills-plugin\",\n  \"license\": \"MIT\",\n  \"keywords\": [\n    \"claude-code\",\n    \"skills\",\n    \"n8n\",\n    \"workflow\",\n    \"automation\",\n    \"javascript\",\n    \"python\",\n    \"mcp-tools\",\n    \"skill-creator\",\n    \"extensible\",\n    \"community\"\n  ]\n}\n",
        "README.md": "# Claude Skills Plugin\n\n[English](README.md) | [ç®€ä½“ä¸­æ–‡](README_CN.md) | [Quick Start](QUICKSTART.md)\n\nA comprehensive and extensible Claude Code plugin providing expert-level skills for various development tasks and workflows. Currently focused on n8n workflow development, automation, and integration, with plans to expand to other domains.\n\n> **ğŸš€ Quick Install (Recommended)**: Clone skills directly to `~/.claude/skills/` for **highest priority**\n\n## ğŸ“¦ What's Included\n\nThis plugin currently contains **14 specialized skills**, covering n8n workflow development and **Skill lifecycle management**:\n\n### Skill Lifecycle Management (3 skills) - **NEW**\n\n11. **skill-factory** - Automated Skill Factory\n    - Convert any GitHub repository into a standardized Skill with one command\n    - Automatically fetch repository metadata (commit hash, README)\n    - Generate compliant directory structure with extended metadata\n\n12. **skill-manager** - Skill Lifecycle Manager\n    - Concurrently check update status for all Skills\n    - Support batch scan, update, and delete operations\n    - Generate status reports (outdated/current/unmanaged)\n\n13. **skill-evolution** - Skill Evolution Manager\n    - Persist lessons learned from conversations to `evolution.json`\n    - Smart stitching: automatically write experience to SKILL.md\n    - Cross-version preservation: experience survives Skill updates\n\n### n8n Development Skills (7 skills)\n\n1. **n8n-workflow-patterns** - Proven architectural patterns for building n8n workflows\n   - 5 core patterns: Webhook Processing, HTTP API Integration, Database Operations, AI Agent Workflows, Scheduled Tasks\n   - Pattern selection guide and workflow creation checklist\n   - Real-world examples and best practices\n\n2. **n8n-code-javascript** - Expert guidance for JavaScript Code nodes\n   - Data access patterns ($input.all(), $input.first(), $input.item)\n   - Built-in functions ($helpers, DateTime, $jmespath)\n   - Common patterns and error prevention\n\n3. **n8n-code-python** - Python Code node development\n   - Python-specific patterns and best practices\n   - Data manipulation and transformation\n   - Integration with Python libraries\n\n4. **n8n-expression-syntax** - Master n8n's expression language\n   - Expression syntax and data referencing\n   - Built-in functions and methods\n   - Common patterns and troubleshooting\n\n5. **n8n-node-configuration** - Configure nodes correctly\n   - Node-specific configuration patterns\n   - Operation dependencies and requirements\n   - Authentication and credentials setup\n\n6. **n8n-validation-expert** - Validate workflows before deployment\n   - Workflow structure validation\n   - Node configuration validation\n   - Error detection and auto-fix suggestions\n\n7. **n8n-mcp-tools-expert** - Use n8n MCP tools effectively\n   - Search nodes and templates\n   - Create and update workflows via API\n   - Validate node operations\n\n### General Development Skills (4 skills)\n\n8. **skill-creator** - Guide for creating effective Claude Code skills\n   - Skill design principles and best practices\n   - Progressive disclosure patterns\n   - Bundled resources (scripts, references, assets)\n\n9. **md-to-pptx** - Convert Markdown to PowerPoint presentations\n   - Convert existing Markdown files to PPTX\n   - Generate presentations from scratch with AI assistance\n   - Multiple themes (business, tech_dark, education, neumorphism)\n   - Custom template support\n\n10. **skill-lookup** - Skill discovery and installation tool\n    - Search and discover available Skills\n    - Install and manage Skills\n\n14. **More skills coming soon** - This plugin is designed to be extensible\n   - Future skills may cover: API development, testing, DevOps, data processing, etc.\n   - Community contributions welcome\n\n## ğŸ¯ Plugin Philosophy\n\nThis plugin is designed as a **general-purpose skills repository** that can accommodate skills from any domain:\n\n- **Currently**: Primarily n8n workflow development skills (7 skills)\n- **Future**: Will expand to include skills for other development areas\n- **Extensible**: Easy to add new skills following the skill-creator guidelines\n- **Community-driven**: Open to contributions from the community\n\n## ğŸš€ Installation\n\n### Understanding Skills Priority\n\nClaude Code Skills are loaded with different priorities (highest to lowest):\n\n| Priority | Level | Location | Scope |\n|:--------:|:------|:---------|:------|\n| **1** (Highest) | Enterprise | Managed settings | Organization-wide |\n| **2** | Personal | `~/.claude/skills/` | All your projects |\n| **3** | Project | `.claude/skills/` | Current project |\n| **4** (Lowest) | Plugin | Plugin `skills/` directory | Plugin users |\n\n**We recommend Method 1** for the best experience, as it gives your Skills the highest non-enterprise priority.\n\n---\n\n### â­ Method 1: Personal Skills Directory (Recommended)\n\nInstall directly to your personal skills folder for **highest priority**:\n\n#### macOS / Linux\n\n```bash\n# Clone to personal skills repository directory\ngit clone https://github.com/echoleesong/claude-skills-plugin.git ~/.claude/skills-repo\n\n# Run automatic install script (creates symlinks)\ncd ~/.claude/skills-repo && ./install.sh\n```\n\n#### Windows (PowerShell, requires Administrator)\n\n```powershell\n# Clone to personal skills repository directory\ngit clone https://github.com/echoleesong/claude-skills-plugin.git \"$env:USERPROFILE\\.claude\\skills-repo\"\n\n# Run automatic install script (requires Administrator for symlinks)\ncd \"$env:USERPROFILE\\.claude\\skills-repo\"\n.\\install.ps1\n```\n\n#### Update Skills\n\n```bash\n# macOS / Linux\ncd ~/.claude/skills-repo && git pull && ./install.sh\n\n# Windows (PowerShell)\ncd \"$env:USERPROFILE\\.claude\\skills-repo\"; git pull; .\\install.ps1\n```\n\n#### ğŸ”„ Setup Auto-Sync (Optional)\n\nAutomatically sync new skills after `git pull`:\n\n```bash\n# macOS / Linux\ncd ~/.claude/skills-repo && ./setup-hooks.sh\n\n# After setup, git pull will automatically run install.sh\n```\n\nâœ… **Advantages**: Highest priority (Personal level), takes precedence over all plugins, easy to update with `git pull`, supports auto-sync.\n\n<details>\n<summary>ğŸ“Œ Manual Installation (without scripts)</summary>\n\nIf you prefer not to use the install scripts, you can manually create symlinks:\n\n**macOS / Linux:**\n```bash\nmkdir -p ~/.claude/skills && \\\nln -sf ~/.claude/skills-repo/skills/* ~/.claude/skills/\n```\n\n**Windows (PowerShell):**\n```powershell\nNew-Item -ItemType Directory -Force -Path \"$env:USERPROFILE\\.claude\\skills\"\nGet-ChildItem \"$env:USERPROFILE\\.claude\\skills-repo\\skills\" -Directory | ForEach-Object {\n    New-Item -ItemType SymbolicLink -Force -Path \"$env:USERPROFILE\\.claude\\skills\\$($_.Name)\" -Target $_.FullName\n}\n```\n\n</details>\n\n---\n\n### Method 2: Plugin Marketplace (Standard)\n\nInstall as a plugin via Claude Code marketplace:\n\n```bash\n# Add the marketplace\n/plugin marketplace add echoleesong/claude-skills-plugin\n\n# Install the plugin\n/plugin install claude-skills-plugin@echoleesong-claude-skills-plugin\n```\n\nâš ï¸ **Note**: Plugin Skills have the **lowest priority**. If you need higher priority, use Method 1 or upgrade after installation:\n\n<details>\n<summary>ğŸ“Œ Upgrade Plugin to Personal Priority</summary>\n\n```bash\n# macOS / Linux: Link plugin skills to personal directory\nmkdir -p ~/.claude/skills && \\\nln -sf ~/.claude/plugins/cache/claude-skills-plugin-marketplace/claude-skills-plugin/*/skills/* ~/.claude/skills/\n```\n\n```powershell\n# Windows (PowerShell)\nNew-Item -ItemType Directory -Force -Path \"$env:USERPROFILE\\.claude\\skills\"\n$pluginPath = Get-ChildItem \"$env:USERPROFILE\\.claude\\plugins\\cache\\claude-skills-plugin-marketplace\\claude-skills-plugin\\*\\skills\" | Select-Object -First 1\nGet-ChildItem $pluginPath -Directory | ForEach-Object {\n    New-Item -ItemType SymbolicLink -Force -Path \"$env:USERPROFILE\\.claude\\skills\\$($_.Name)\" -Target $_.FullName\n}\n```\n\n</details>\n\n---\n\n### Method 3: Project-Level Installation\n\nInstall for a specific project only:\n\n```bash\n# In your project directory\ngit clone https://github.com/echoleesong/claude-skills-plugin.git .claude/skills-repo\n\n# Link skills to project directory\nmkdir -p .claude/skills && \\\nln -sf .claude/skills-repo/skills/* .claude/skills/\n```\n\nâœ… **Use case**: When you only need these skills for a specific project.\n\n---\n\n### Verify Installation\n\nRestart Claude Code and ask: \"What Skills are available?\"\n\nYou should see this plugin's Skills listed. If you used Method 1, they will have Personal-level priority.\n\n## ğŸ“– Usage\n\nOnce installed, the skills will automatically activate when relevant tasks are detected.\n\n### Current Skills Activation\n\n**Skill Lifecycle Management:**\n- **Create Skill from GitHub**: `/skill-factory <url>` or \"Package this repo into a skill\"\n- **Check updates**: `/skill-manager check` or \"Check my Skills for updates\"\n- **List Skills**: `/skill-manager list` or \"List my Skills\"\n- **Record experience**: `/skill-evolution` or \"Review the conversation and save lessons\"\n\n**n8n Development:**\n- **Building workflows**: `n8n-workflow-patterns` activates\n- **Writing JavaScript code**: `n8n-code-javascript` activates\n- **Writing Python code**: `n8n-code-python` activates\n- **Using expressions**: `n8n-expression-syntax` activates\n- **Configuring nodes**: `n8n-node-configuration` activates\n- **Validating workflows**: `n8n-validation-expert` activates\n- **Using MCP tools**: `n8n-mcp-tools-expert` activates\n\n**General Development:**\n- **Creating skills**: `skill-creator` activates\n- **Creating presentations**: `md-to-pptx` activates\n\n### Example Prompts\n\n**Skill Lifecycle Management:**\n```\n\"Package https://github.com/yt-dlp/yt-dlp into a Skill\"\nâ†’ Activates: skill-factory\n\n\"Check my Skills for updates\"\nâ†’ Activates: skill-manager\n\n\"Save the lessons from this conversation\"\nâ†’ Activates: skill-evolution\n```\n\n**n8n Development:**\n```\n\"Help me build a webhook workflow that processes form submissions\"\nâ†’ Activates: n8n-workflow-patterns, n8n-node-configuration\n\n\"Write JavaScript code to aggregate data from multiple API responses\"\nâ†’ Activates: n8n-code-javascript\n\n\"Validate my workflow before deployment\"\nâ†’ Activates: n8n-validation-expert\n```\n\n**General Development:**\n```\n\"Create a new skill for PDF processing\"\nâ†’ Activates: skill-creator\n\n\"Help me design a skill for API testing\"\nâ†’ Activates: skill-creator\n\n\"Help me create a presentation about machine learning\"\nâ†’ Activates: md-to-pptx\n\n\"Convert this markdown file to PowerPoint\"\nâ†’ Activates: md-to-pptx\n```\n\n## ğŸ¯ Skill Descriptions\n\n### Skill Lifecycle Management Skills\n\n#### skill-factory\nAutomated factory for converting GitHub repositories into standardized AI skills. Use when user provides a GitHub URL and wants to \"package\", \"wrap\", or \"create a skill\" from it. Automatically fetches repository metadata, generates standard directory structure, and injects extended metadata for lifecycle management.\n\n#### skill-manager\nSkill lifecycle manager for batch scanning Skills directory, checking GitHub updates, performing version upgrades, and managing Skills inventory. Supports `/skill-manager check`, `/skill-manager list`, `/skill-manager delete` commands.\n\n#### skill-evolution\nSkill experience evolution manager. Analyzes user feedback at the end of conversations, extracts best practices and solutions, persists to `evolution.json` and stitches to SKILL.md. Use when user says \"review\", \"record experience\", \"save this tip\".\n\n### n8n Development Skills\n\n#### n8n-workflow-patterns\nProven workflow architectural patterns from real n8n workflows. Use when building new workflows, designing workflow structure, choosing workflow patterns, planning workflow architecture, or asking about webhook processing, HTTP API integration, database operations, AI agent workflows, or scheduled tasks.\n\n### n8n-code-javascript\nWrite JavaScript code in n8n Code nodes. Use when writing JavaScript in n8n, using $input/$json/$node syntax, making HTTP requests with $helpers, working with dates using DateTime, troubleshooting Code node errors, or choosing between Code node modes.\n\n### n8n-code-python\nWrite Python code in n8n Code nodes. Use when writing Python in n8n, using item access patterns, working with pandas/numpy, making HTTP requests, handling data transformations, or troubleshooting Python Code node errors.\n\n### n8n-expression-syntax\nMaster n8n's expression language for data transformation and manipulation. Use when writing expressions in n8n nodes, accessing data from previous nodes, using built-in functions, formatting dates/strings, or troubleshooting expression errors.\n\n### n8n-node-configuration\nConfigure n8n nodes correctly with proper operations and parameters. Use when configuring specific node operations, understanding node requirements, setting up authentication, or troubleshooting node configuration errors.\n\n### n8n-validation-expert\nValidate n8n workflows and node configurations before deployment. Use when validating workflow structure, checking node configurations, detecting errors, or getting auto-fix suggestions for common issues.\n\n### n8n-mcp-tools-expert\nExpert guidance for using n8n MCP (Model Context Protocol) tools. Use when searching for nodes, getting node documentation, creating workflows via API, validating operations, or working with n8n programmatically.\n\n### General Development Skills\n\n#### skill-creator\nGuide for creating effective Claude Code skills. Use when creating new skills, updating existing skills, designing skill structure, writing skill documentation, or learning skill best practices.\n\n#### md-to-pptx\nConvert Markdown documents to PowerPoint presentations or generate presentations from scratch using AI. Use when users want to create PPT/PPTX files, convert MD to slides, generate presentations, make slideshows, or ask for help with PowerPoint creation. Supports custom templates, multiple themes (business, tech_dark, education, neumorphism), and intelligent content layout.\n\n## ğŸ“ Plugin Structure\n\n```\nclaude-skills-plugin/\nâ”œâ”€â”€ .claude-plugin/\nâ”‚   â”œâ”€â”€ plugin.json          # Plugin metadata\nâ”‚   â””â”€â”€ marketplace.json     # Marketplace configuration\nâ”œâ”€â”€ skills/\nâ”‚   â”œâ”€â”€ skill-factory/       # Skill Factory (NEW)\nâ”‚   â”œâ”€â”€ skill-manager/       # Skill Manager (NEW)\nâ”‚   â”œâ”€â”€ skill-evolution/     # Skill Evolution (NEW)\nâ”‚   â”œâ”€â”€ n8n-workflow-patterns/\nâ”‚   â”œâ”€â”€ n8n-code-javascript/\nâ”‚   â”œâ”€â”€ n8n-code-python/\nâ”‚   â”œâ”€â”€ n8n-expression-syntax/\nâ”‚   â”œâ”€â”€ n8n-node-configuration/\nâ”‚   â”œâ”€â”€ n8n-validation-expert/\nâ”‚   â”œâ”€â”€ n8n-mcp-tools-expert/\nâ”‚   â”œâ”€â”€ skill-creator/\nâ”‚   â”œâ”€â”€ skill-lookup/\nâ”‚   â””â”€â”€ md-to-pptx/\nâ”œâ”€â”€ scripts/                 # Standalone executable scripts (NEW)\nâ”‚   â”œâ”€â”€ check_updates.py     # Batch check updates\nâ”‚   â”œâ”€â”€ batch_evolve.py      # Batch align evolution\nâ”‚   â””â”€â”€ validate_all.py      # Batch validate metadata\nâ”œâ”€â”€ docs/                    # Documentation\nâ”‚   â”œâ”€â”€ skill-lifecycle-development-plan.md\nâ”‚   â””â”€â”€ references/\nâ”‚       â””â”€â”€ metadata-spec.md # Metadata specification\nâ”œâ”€â”€ LICENSE\nâ”œâ”€â”€ README.md\nâ””â”€â”€ CHANGELOG.md\n```\n\n## ğŸ”§ Command Line Tools\n\nThis plugin provides standalone Python scripts for CI/CD and batch operations:\n\n```bash\n# Check update status for all Skills\npython scripts/check_updates.py --summary\n\n# Batch validate Skills metadata\npython scripts/validate_all.py --strict\n\n# Batch align evolution.json\npython scripts/batch_evolve.py --dry-run\n```\n\n## ğŸ¤ Contributing\n\nContributions are welcome! This plugin is designed to be a community-driven skills repository.\n\n### How to Contribute\n\n1. **Add new skills**: Use the `skill-creator` skill to design and implement new skills\n2. **Improve existing skills**: Submit PRs to enhance current skills\n3. **Report issues**: Help us identify bugs or areas for improvement\n4. **Suggest new skill domains**: Propose new areas where skills would be valuable\n\n### Skill Domains We're Interested In\n\n- API development and testing\n- DevOps and CI/CD\n- Data processing and analysis\n- Frontend/Backend frameworks\n- Testing frameworks\n- Documentation generation\n- And more!\n\nPlease feel free to submit issues or pull requests.\n\n## ğŸ“„ License\n\nMIT License - see LICENSE file for details\n\n## ğŸ”— Links\n\n- **Repository**: https://github.com/echoleesong/claude-skills-plugin\n- **Issues**: https://github.com/echoleesong/claude-skills-plugin/issues\n- **n8n Documentation**: https://docs.n8n.io\n\n## ğŸ“ Changelog\n\nSee [CHANGELOG.md](CHANGELOG.md) for version history and updates.\n\n## ğŸ™ Acknowledgments\n\n- n8n skills are built based on real-world workflow development experience and best practices from the n8n community\n- skill-creator is inspired by Claude Code's official skill development guidelines\n- Thanks to all contributors and the Claude Code community\n\n---\n\n**Made with â¤ï¸ for the Claude Code community**\n"
      },
      "plugins": [
        {
          "name": "claude-skills-plugin",
          "source": "./",
          "description": "A comprehensive and extensible Claude Code skills repository. Currently includes 7 n8n workflow development skills and 1 skill-creator meta skill, with plans to expand to other development domains",
          "version": "1.0.0",
          "categories": [],
          "install_commands": [
            "/plugin marketplace add echoleesong/claude-skills-plugin",
            "/plugin install claude-skills-plugin@claude-skills-plugin-marketplace"
          ]
        }
      ]
    }
  ]
}