{
  "author": {
    "id": "EgoHackZero",
    "display_name": "Yehor Nepokrytyi",
    "avatar_url": "https://avatars.githubusercontent.com/u/109929572?u=9f7f475a634af24f31e6a5bb6004c5ed908a0e5e&v=4"
  },
  "marketplaces": [
    {
      "name": "egohackzero-usefull-tools",
      "version": null,
      "description": "EgoHackZero's comprehensive collection of specialized AI agents and developer tools for Claude Code",
      "repo_full_name": "EgoHackZero/usefull-tools",
      "repo_url": "https://github.com/EgoHackZero/usefull-tools",
      "repo_description": null,
      "signals": {
        "stars": 0,
        "forks": 0,
        "pushed_at": "2025-11-09T00:34:40Z"
      },
      "files": {
        ".claude-plugin/marketplace.json": "{\n  \"name\": \"egohackzero-usefull-tools\",\n  \"owner\": {\n    \"name\": \"EgoHackZero\",\n    \"contact\": \"github.com/egohackzero\"\n  },\n  \"description\": \"EgoHackZero's comprehensive collection of specialized AI agents and developer tools for Claude Code\",\n  \"plugins\": [\n    {\n      \"name\": \"egohackzero-usefull-tools\",\n      \"source\": \"./\",\n      \"description\": \"A comprehensive collection of specialized AI agents and developer tools for Claude Code, featuring 5 expert agents for research, learning, refactoring, architecture, and documentation, plus conda environment management\",\n      \"version\": \"1.0.0\",\n      \"author\": {\n        \"name\": \"egohackzero\",\n        \"email\": \"\"\n      },\n      \"tags\": [\"ai-agents\", \"research\", \"refactoring\", \"architecture\", \"documentation\", \"learning\", \"conda\", \"python\", \"code-quality\"]\n    }\n  ]\n}\n",
        ".claude-plugin/plugin.json": "{\n  \"name\": \"egohackzero-usefull-tools\",\n  \"version\": \"1.0.0\",\n  \"description\": \"A comprehensive collection of specialized AI agents and developer tools for Claude Code, featuring 5 expert agents for research, learning, refactoring, architecture, and documentation, plus conda environment management\",\n  \"author\": {\n    \"name\": \"Yehor\"\n  },\n  \"license\": \"MIT\",\n  \"keywords\": [\n    \"ai-agents\",\n    \"research\",\n    \"refactoring\",\n    \"architecture\",\n    \"documentation\",\n    \"learning\",\n    \"conda\",\n    \"python\",\n    \"code-quality\"\n  ]\n}\n",
        "README.md": "# EgoHackZero's Useful Tools for Claude Code\n\nA comprehensive collection of specialized AI agents and developer tools for Claude Code that dramatically enhance productivity through intelligent automation and expert guidance.\n\n## Overview\n\nThis extension provides 5 specialized AI agents and practical commands to supercharge your development workflow:\n\n- **AI Agents**: Expert systems for research, learning, refactoring, architecture, and documentation\n- **Commands**: Practical tools like conda environment management\n\n## Installation\n\n### Quick Install (Recommended)\n\n1. **Add the marketplace:**\n   ```\n   /plugin marketplace add egohackzero/usefull-tools\n   ```\n\n2. **Install the plugin:**\n   ```\n   /plugin install egohackzero-usefull-tools\n   ```\n\n3. **Start using the agents and commands immediately!**\n\n### Alternative: Local Development Installation\n\nIf you want to use a local copy or contribute to development:\n\n```bash\n# Clone the repository\ngit clone https://github.com/egohackzero/usefull-tools.git\n\n# Add as local marketplace\n/plugin marketplace add /path/to/usefull-tools\n\n# Install the plugin\n/plugin install egohackzero-usefull-tools\n```\n\n### Managing the Plugin\n\n- **Enable:** `/plugin enable egohackzero-usefull-tools`\n- **Disable:** `/plugin disable egohackzero-usefull-tools`\n- **Uninstall:** `/plugin uninstall egohackzero-usefull-tools`\n- **View all plugins:** `/plugin`\n\n### Requirements\n\n- Claude Code CLI version 2.0.0 or higher\n- For `/conda-run` command: Conda/Miniconda installed with initialization script at `~/miniconda3/etc/profile.d/conda.sh`\n\n## AI Agents\n\n### üîç Deep Research Agent\n**Category:** Analysis\n**Trigger:** Complex investigation and research needs\n\nComprehensive research specialist with adaptive strategies and intelligent exploration.\n\n**Capabilities:**\n- Multi-hop reasoning with up to 5 levels of depth\n- Adaptive planning strategies (simple, ambiguous, or complex queries)\n- Self-reflective progress assessment and quality monitoring\n- Evidence-based analysis with proper citations\n- Parallel search optimization and tool orchestration\n\n**Best For:**\n- Current events and technical research\n- Complex information synthesis\n- Academic research contexts\n- Evidence-based analysis and investigation\n\n### üìö Learning Guide\n**Category:** Communication\n**Trigger:** Code explanation and programming education\n\nExpert programming educator focused on understanding through progressive learning and practical examples.\n\n**Capabilities:**\n- Concept breakdown with multiple explanation approaches\n- Progressive skill building with prerequisite mapping\n- Working code demonstrations with variations\n- Educational exercises that build confidence\n- Knowledge assessment and understanding verification\n\n**Best For:**\n- Teaching programming concepts\n- Creating tutorials and learning paths\n- Algorithm breakdowns and explanations\n- Educational content design\n\n### ‚ôªÔ∏è Refactoring Expert\n**Category:** Quality\n**Trigger:** Code quality improvement and technical debt reduction\n\nSystematic code quality improvement through proven refactoring patterns and clean code principles.\n\n**Capabilities:**\n- Complexity metric analysis (cyclomatic, maintainability index)\n- SOLID principles and design pattern application\n- Duplication elimination and anti-pattern removal\n- Safe, incremental transformations with testing\n- Before/after quality metrics and improvement tracking\n\n**Best For:**\n- Reducing code complexity and technical debt\n- Applying SOLID principles and design patterns\n- Improving maintainability and readability\n- Safe code transformation\n\n### üèóÔ∏è System Architect\n**Category:** Engineering\n**Trigger:** System architecture design and scalability planning\n\nHolistic system design with focus on scalability, maintainability, and long-term technical strategy.\n\n**Capabilities:**\n- Component boundary definition and dependency mapping\n- Scalability architecture for 10x growth scenarios\n- Architectural pattern evaluation (microservices, CQRS, event sourcing)\n- Technology selection with long-term impact analysis\n- Migration strategies and technical debt planning\n\n**Best For:**\n- Designing scalable system architectures\n- Evaluating architectural patterns\n- Technology selection and migration planning\n- Creating comprehensive design documentation\n\n### üìù Technical Writer\n**Category:** Communication\n**Trigger:** Documentation creation and improvement\n\nClear, comprehensive technical documentation tailored to specific audiences with focus on usability.\n\n**Capabilities:**\n- Audience analysis and skill level assessment\n- Information architecture and logical content structure\n- Clear instructions with working examples\n- WCAG accessibility compliance\n- API documentation, user guides, and troubleshooting\n\n**Best For:**\n- API documentation and technical specifications\n- User guides and tutorials\n- Troubleshooting and installation guides\n- Accessibility-compliant documentation\n\n## Commands\n\n### üêç `/conda-run [env_name]`\n**Category:** Run\n\nSeamlessly manage and run Python code with conda environments directly from Claude Code.\n\n**Features:**\n- Automatic environment detection and creation\n- Smart environment selection with interactive prompts\n- Support for multiple Python versions (3.10, 3.11, 3.12)\n- Integrated package installation (pip/conda)\n- Persistent environment activation\n\n**Usage:**\n```bash\n# Run with specific environment\n/conda-run ml-project\n\n# Interactive selection\n/conda-run\n```\n\n## Agent Categories\n\n- **Analysis**: `deep-research-agent`\n- **Communication**: `learning-guide`, `technical-writer`\n- **Quality**: `refactoring-expert`\n- **Engineering**: `system-architect`\n\n## Use Cases\n\n### Research & Learning\n- Investigate complex technical topics with Deep Research Agent\n- Learn new programming concepts with Learning Guide\n- Create comprehensive documentation with Technical Writer\n\n### Code Quality\n- Refactor legacy code with Refactoring Expert\n- Design new systems with System Architect\n- Reduce technical debt systematically\n\n### Development Workflow\n- Manage Python environments with `/conda-run`\n- Generate API documentation with Technical Writer\n- Plan architectural changes with System Architect\n\n## Contributing\n\nContributions are welcome! To add new agents or commands:\n\n1. Fork the repository\n2. Create your agent in `.claude/agents/` or command in `.claude/commands/`\n3. Update `.claude-plugin/plugin.json` with the new agent/command metadata\n4. Submit a pull request\n\n### Agent Structure\n```markdown\n---\nname: agent-name\ndescription: Brief description\ncategory: analysis|communication|quality|engineering\n---\n# Agent content\n```\n\n## License\n\nMIT License - See LICENSE file for details\n\n## Author\n\n**egohackzero**\n\n## Changelog\n\n### v1.0.0 (Initial Release)\n- 5 specialized AI agents: Deep Research, Learning Guide, Refactoring Expert, System Architect, Technical Writer\n- `/conda-run` command for conda environment management\n- Comprehensive documentation and examples\n- Full agent categorization system\n"
      },
      "plugins": [
        {
          "name": "egohackzero-usefull-tools",
          "source": "./",
          "description": "A comprehensive collection of specialized AI agents and developer tools for Claude Code, featuring 5 expert agents for research, learning, refactoring, architecture, and documentation, plus conda environment management",
          "version": "1.0.0",
          "author": {
            "name": "egohackzero",
            "email": ""
          },
          "tags": [
            "ai-agents",
            "research",
            "refactoring",
            "architecture",
            "documentation",
            "learning",
            "conda",
            "python",
            "code-quality"
          ],
          "categories": [
            "ai-agents",
            "architecture",
            "code-quality",
            "conda",
            "documentation",
            "learning",
            "python",
            "refactoring",
            "research"
          ],
          "install_commands": [
            "/plugin marketplace add EgoHackZero/usefull-tools",
            "/plugin install egohackzero-usefull-tools@egohackzero-usefull-tools"
          ]
        }
      ]
    }
  ]
}