{
  "author": {
    "id": "flashingcursor",
    "display_name": "Gil Rutkowski",
    "avatar_url": "https://avatars.githubusercontent.com/u/857740?v=4"
  },
  "marketplaces": [
    {
      "name": "skill-weaver-marketplace",
      "version": null,
      "description": "Claude Code marketplace for Skill Weaver plugins - tools for creating and managing custom Claude Skills",
      "repo_full_name": "flashingcursor/skill-weaver-marketplace",
      "repo_url": "https://github.com/flashingcursor/skill-weaver-marketplace",
      "repo_description": "Claude Code marketplace for Skill Weaver plugins - tools for creating custom Skills",
      "signals": {
        "stars": 0,
        "forks": 0,
        "pushed_at": "2025-11-11T20:30:29Z"
      },
      "files": {
        ".claude-plugin/marketplace.json": "{\n  \"name\": \"skill-weaver-marketplace\",\n  \"owner\": {\n    \"name\": \"flashingcursor\",\n    \"email\": \"contact@example.com\",\n    \"url\": \"https://github.com/flashingcursor\"\n  },\n  \"description\": \"Claude Code marketplace for Skill Weaver plugins - tools for creating and managing custom Claude Skills\",\n  \"homepage\": \"https://github.com/flashingcursor/skill-weaver\",\n  \"plugins\": [\n    {\n      \"name\": \"weaver\",\n      \"source\": {\n        \"source\": \"github\",\n        \"repo\": \"flashingcursor/skill-creator-plugin\"\n      },\n      \"description\": \"Weaves custom Skills for Claude following official best practices including proper structure, metadata, progressive disclosure, and security guidelines\",\n      \"version\": \"0.2.1\",\n      \"author\": \"flashingcursor\",\n      \"category\": \"productivity\",\n      \"keywords\": [\n        \"skills\",\n        \"weaver\",\n        \"authoring\",\n        \"templates\",\n        \"development\",\n        \"productivity\",\n        \"crafting\"\n      ],\n      \"homepage\": \"https://github.com/flashingcursor/skill-weaver\"\n    }\n  ]\n}\n",
        "README.md": "# Skill Weaver Marketplace\n\nClaude Code marketplace for Skill Weaver plugins - tools for creating and managing custom Claude Skills.\n\n## Latest Update\n\n**2025-11-07**: weaver v0.2.1 - Directory renamed to fully avoid conflicts! ðŸŽ‰\n\nThe directory has been renamed from \"skill-creator\" to \"weaver-create\" to fully avoid conflicts with Anthropic's default skills (\"skill-builder\" and \"skill-creator\"). See [CHANGELOG.md](CHANGELOG.md) for details.\n\n## Installation\n\nAdd this marketplace to your Claude Code:\n\n```bash\n/plugin marketplace add flashingcursor/skill-weaver-marketplace\n```\n\n## Available Plugins\n\n### weaver v0.2.1\n\nWeaves custom Skills for Claude following official best practices.\n\n> **Note**: Directory renamed from \"skill-creator\" to \"weaver-create\" to avoid conflicts with Anthropic's default skills (\"skill-builder\" and \"skill-creator\").\n\n**Install**:\n```bash\n/plugin install weaver@skill-weaver-marketplace\n```\n\n**Features**:\n- Adaptive workflow modes (Quick Create, Guided Create, Default)\n- Autonomous skill creation with progress indicators\n- Engagement detection and response adaptation\n- Comprehensive skill creation guide\n- Ready-to-use templates (basic and advanced)\n- Script examples (Python and JavaScript)\n- Automated validation and best practices\n- Security guidelines\n- Progressive disclosure patterns\n\n**Usage**:\n```\n\"Create a new skill for code reviews\"\n\"Help me build a skill for data analysis\"\n\"Just quickly create a skill for API testing\"\n\"Walk me through creating a data analysis skill\"\n```\n\n**Documentation**:\n- [Installation Guide](https://github.com/flashingcursor/skill-weaver/blob/master/INSTALLATION.md)\n- [Sharing Guide](https://github.com/flashingcursor/skill-weaver/blob/master/SHARING.md)\n- [Main Repository](https://github.com/flashingcursor/skill-weaver)\n\n## What You Can Build\n\nWith the skill-creator plugin, create:\n\n- **Knowledge Skills**: Embed guidelines, documentation, or best practices\n- **Workflow Skills**: Automate multi-step processes\n- **Analysis Skills**: Data processing and reporting workflows\n- **Integration Skills**: Connect Claude to your tools\n- **Template Skills**: Reusable templates for common tasks\n\n## Quick Start\n\n```bash\n# Add marketplace\n/plugin marketplace add flashingcursor/skill-weaver-marketplace\n\n# Install skill-creator\n/plugin install skill-creator@skill-weaver-marketplace\n\n# Try it out\n```\n\nThen ask Claude:\n```\n\"Create a skill for reviewing pull requests\"\n```\n\n## Marketplace Structure\n\nThis marketplace provides plugins for:\n- Creating custom Skills\n- Managing Skill workflows\n- Sharing Skills with teams\n- Validating Skill structure\n\n## For Teams\n\nWant your team to automatically have access to these plugins?\n\nAdd to your project's `.claude/settings.json`:\n\n```json\n{\n  \"extraKnownMarketplaces\": {\n    \"skill-weaver\": {\n      \"source\": {\n        \"source\": \"github\",\n        \"repo\": \"flashingcursor/skill-weaver-marketplace\"\n      }\n    }\n  }\n}\n```\n\nTeam members will get the marketplace when they trust the folder.\n\n## Plugin Repositories\n\n- **skill-creator**: https://github.com/flashingcursor/skill-creator-plugin\n\n## Support\n\n- **Issues**: [GitHub Issues](https://github.com/flashingcursor/skill-weaver/issues)\n- **Discussions**: [GitHub Discussions](https://github.com/flashingcursor/skill-weaver/discussions)\n- **Documentation**: [Main Repository](https://github.com/flashingcursor/skill-weaver)\n\n## Contributing\n\nWant to add your plugin to this marketplace?\n\n1. Create a Claude Code plugin following the [plugin structure](https://docs.claude.com/claude-code/plugins)\n2. Open an issue or PR in the [main repository](https://github.com/flashingcursor/skill-weaver)\n3. We'll review and add it to the marketplace\n\n**Criteria for inclusion**:\n- Helps with skill creation or management\n- Follows Claude Code plugin best practices\n- Well-documented with examples\n- Active maintenance\n\n## About Skill Weaver\n\nSkill Weaver is a project dedicated to helping developers create high-quality custom Skills for Claude.\n\n- **Main Repository**: https://github.com/flashingcursor/skill-weaver\n- **Plugin**: https://github.com/flashingcursor/skill-creator-plugin\n- **Marketplace**: https://github.com/flashingcursor/skill-weaver-marketplace\n\n## License\n\nMIT License - see individual plugin repositories for details.\n\n---\n\n**Made with** the skill-creator skill itself! ðŸŽ¨\n"
      },
      "plugins": [
        {
          "name": "weaver",
          "source": {
            "source": "github",
            "repo": "flashingcursor/skill-creator-plugin"
          },
          "description": "Weaves custom Skills for Claude following official best practices including proper structure, metadata, progressive disclosure, and security guidelines",
          "version": "0.2.1",
          "author": "flashingcursor",
          "category": "productivity",
          "keywords": [
            "skills",
            "weaver",
            "authoring",
            "templates",
            "development",
            "productivity",
            "crafting"
          ],
          "homepage": "https://github.com/flashingcursor/skill-weaver",
          "categories": [
            "authoring",
            "crafting",
            "development",
            "productivity",
            "skills",
            "templates",
            "weaver"
          ],
          "install_commands": [
            "/plugin marketplace add flashingcursor/skill-weaver-marketplace",
            "/plugin install weaver@skill-weaver-marketplace"
          ]
        }
      ]
    }
  ]
}