{
  "author": {
    "id": "flemx",
    "display_name": "Damien",
    "avatar_url": "https://avatars.githubusercontent.com/u/10288045?u=5810c4abe93ccbf2ee4cf62c05a1290c0171ca09&v=4"
  },
  "marketplaces": [
    {
      "name": "agentforce-playground",
      "version": null,
      "description": "AgentForce plugin",
      "repo_full_name": "flemx/agentforce-playground-claude-plugins",
      "repo_url": "https://github.com/flemx/agentforce-playground-claude-plugins",
      "repo_description": null,
      "signals": {
        "stars": 1,
        "forks": 0,
        "pushed_at": "2025-12-04T13:44:44Z"
      },
      "files": {
        ".claude-plugin/marketplace.json": "{\n\"name\": \"agentforce-playground\",\n\"owner\": {\n\"name\": \"Damien Fleminks\"\n},\n\"plugins\": [\n{\n  \"name\": \"agentforce\",\n  \"source\": \"./agentforce\",\n  \"description\": \"AgentForce plugin\"\n}\n]\n}\n",
        "README.md": "# Salesforce AgentForce Plugin Marketplace\n\n> **Experimental playground for Salesforce AgentForce integrations with Claude Code**\n\nA curated collection of plugins, skills, and tools designed to supercharge Salesforce Solution Engineers and developers working with AgentForce AI agents. This marketplace provides ready-to-use integrations, automation tools, and demo capabilities for Claude Code.\n\n---\n\n## üéØ What is This?\n\nThis is a **Plugin Marketplace** for [Claude Code](https://code.claude.com) ‚Äî a specialized collection of Salesforce and AgentForce-related plugins that extend Claude Code's capabilities for working with Salesforce ecosystems.\n\n### Why a Marketplace?\n\nPlugin marketplaces allow you to share reusable plugins with your team or organization. Instead of manually installing plugins on each machine, you can:\n\n- üì¶ **Share once, use everywhere** ‚Äî Publish plugins to a central repository\n- üîÑ **Auto-sync** ‚Äî Team members automatically get access to all marketplace plugins\n- üöÄ **Rapid deployment** ‚Äî Solution Engineers can quickly set up demos and proof-of-concepts\n- üß™ **Experiment safely** ‚Äî Test experimental features in a controlled environment\n\nLearn more about plugin marketplaces in the [official documentation](https://code.claude.com/docs/en/plugin-marketplaces).\n\n---\n\n## ‚ö° Quick Start\n\n**Want to jump right in?**\n\n1. Open Claude Code in VSCode\n2. Run: `/plugin marketplace add https://github.com/flemx/agentforce-playground-claude-plugins.git`\n3. Run: `/plugin` ‚Üí Browse and install plugins ‚Üí Select **\"agentforce\"**\n4. Say: `Create an AgentForce portal`\n\nThat's it! Claude Code will set up everything automatically. üéâ\n\n[See detailed installation instructions below](#-getting-started)\n\n---\n\n## üé™ What's Inside\n\n### Current Plugins\n\n#### 1. **AgentForce Plugin** (`agentforce`)\n\nA comprehensive plugin for Salesforce AgentForce development and demonstrations.\n\n**What it includes:**\n\n- **Skills:**\n  - `agentforce-portal` ‚Äî Automated setup and deployment of a customizable Next.js portal for showcasing AgentForce AI agents\n\n- **MCP Servers:**\n  - **Heroku MCP** ‚Äî Deploy apps to Heroku directly from Claude Code\n  - **Salesforce DX MCP** ‚Äî Interact with Salesforce orgs, metadata, data, users, and run Apex tests\n\n**Perfect for:**\n- Solution Engineers building customer demos\n- Developers prototyping AgentForce integrations\n- Teams exploring AgentForce capabilities\n\n---\n\n## üöÄ Getting Started\n\n### Prerequisites\n\n- [Claude Code](https://code.claude.com) installed (VSCode extension)\n- [Salesforce CLI](https://developer.salesforce.com/tools/salesforcecli) (for Salesforce DX MCP)\n- [Heroku CLI](https://devcenter.heroku.com/articles/heroku-cli) (for Heroku deployments)\n\n### Installation\n\nFollow these three simple steps to get started:\n\n```\n1Ô∏è‚É£ Add Marketplace  ‚Üí  2Ô∏è‚É£ Install Plugin  ‚Üí  3Ô∏è‚É£ Use Skills\n```\n\n#### Step 1: Add the Marketplace\n\nOpen Claude Code in VSCode and add this marketplace:\n\n```\n/plugin marketplace add https://github.com/flemx/agentforce-playground-claude-plugins.git\n```\n\nThis connects Claude Code to this plugin marketplace, making all plugins available for installation.\n\n#### Step 2: Install the AgentForce Plugin\n\nBrowse and install the plugin:\n\n```\n/plugin\n```\n\nThen:\n1. Select **\"Browse and install plugins\"**\n2. Find **\"agentforce\"** in the list\n3. Click to install\n\n#### Step 3: Start Using It!\n\nOnce installed, you can immediately start using the skills:\n\n```\nCreate an AgentForce portal\n```\n\nOr invoke the skill directly:\n\n```\nUse the agentforce-portal skill to set up my demo\n```\n\nClaude Code will automatically handle the setup, from checking dependencies to launching your portal! üöÄ\n\n### What Gets Installed\n\nWhen you install the AgentForce plugin, you get:\n\n‚úÖ **Skills:**\n- `agentforce-portal` ‚Äî Automated portal setup\n\n‚úÖ **MCP Servers:**\n- Heroku MCP ‚Äî Deploy to Heroku\n- Salesforce DX MCP ‚Äî Salesforce development tools\n\n‚úÖ **Ready to Use:**\n- No additional configuration needed\n- Skills are immediately available\n- MCP servers auto-configured\n\n---\n\n## üìö Plugin Documentation\n\n### AgentForce Portal Setup (`agentforce-portal` skill)\n\nThe `agentforce-portal` skill automates the entire process of setting up a personalized demo portal for showcasing Salesforce AgentForce AI agents.\n\n**What it does:**\n\n1. ‚úÖ Checks and installs prerequisites (Node.js, Git)\n2. ‚úÖ Clones and sets up the Next.js portal application\n3. ‚úÖ Configures Salesforce integration automatically\n4. ‚úÖ Customizes the landing page based on your requirements\n5. ‚úÖ Starts the development server\n\n**Usage:**\n\nIn Claude Code, simply ask:\n\n```\nCreate an AgentForce portal\n```\n\nOr be more specific:\n\n```\nUse the agentforce-portal skill to set up my demo\n```\n\n```\nI need to set up a customer demo portal for AgentForce\n```\n\n**Features:**\n- ü§ñ **Fully automated** ‚Äî Minimal user intervention required\n- üé® **Customizable** ‚Äî Personalize landing pages, logos, and branding\n- üîó **Salesforce integrated** ‚Äî Connects directly to your Salesforce org and agents\n- üöÄ **Deploy ready** ‚Äî Includes Heroku deployment support\n\n**What you'll need:**\n- Salesforce org with AgentForce agents configured\n- Domain URL from your Salesforce org\n- Connected App credentials (Client ID & Secret)\n\nFor detailed documentation, see [`agentforce/skills/agentforce-portal/SKILL.md`](agentforce/skills/agentforce-portal/SKILL.md)\n\n---\n\n## üîß MCP Servers Included\n\n### Heroku MCP\n\nDeploy and manage Heroku applications directly from Claude Code.\n\n**Available commands:**\n- Create new Heroku apps\n- Deploy applications\n- Manage environment variables\n- View logs and status\n\n### Salesforce DX MCP\n\nComprehensive Salesforce development toolkit.\n\n**Available toolsets:**\n- **Orgs** ‚Äî Manage Salesforce orgs and authentication\n- **Metadata** ‚Äî Deploy and retrieve metadata\n- **Data** ‚Äî Import/export data\n- **Users** ‚Äî Manage users and permissions\n\n\n---\n\n## üéØ Use Cases\n\n### For Solution Engineers\n\n- **Quick Demos** ‚Äî Set up a branded AgentForce portal in minutes\n- **Customer Workshops** ‚Äî Create personalized demo environments\n- **Proof of Concepts** ‚Äî Rapidly prototype AgentForce solutions\n\n### For Developers\n\n- **Local Development** ‚Äî Full Salesforce DX integration\n- **Deployment Automation** ‚Äî One-command Heroku deployments\n\n### For Teams\n\n- **Shared Playground** ‚Äî Experiment with new AgentForce features\n- **Knowledge Sharing** ‚Äî Standardized setup processes\n- **Best Practices** ‚Äî Curated tools and workflows\n\n---\n\n## üõ†Ô∏è Plugin Structure\n\n```\nagentforce-playground/\n‚îú‚îÄ‚îÄ README.md                          # This file\n‚îú‚îÄ‚îÄ agentforce/                        # Main AgentForce plugin\n‚îÇ   ‚îú‚îÄ‚îÄ .claude-plugin/\n‚îÇ   ‚îÇ   ‚îî‚îÄ‚îÄ plugin.json               # Plugin metadata\n‚îÇ   ‚îú‚îÄ‚îÄ .mcp.json                     # MCP server configurations\n‚îÇ   ‚îî‚îÄ‚îÄ skills/\n‚îÇ       ‚îî‚îÄ‚îÄ agentforce-portal/\n‚îÇ           ‚îî‚îÄ‚îÄ SKILL.md              # Portal setup skill\n‚îî‚îÄ‚îÄ [future-plugins]/                 # Additional plugins coming soon\n```\n\n---\n\n## üß™ Experimental & Demo Features\n\n> ‚ö†Ô∏è **Note:** This is an experimental playground. Plugins and features may change as we explore new AgentForce capabilities.\n\n**Current experiments:**\n- Automated portal setup with intelligent customization\n- Streamlined Salesforce authentication flows\n- One-click Heroku deployments\n\n**Coming soon:**\n- AgentForce API testing utilities\n- Conversation flow builders\n- Multi-agent orchestration tools\n- Custom agent templates\n\n---\n\n## üìñ Learn More\n\n### Claude Code Resources\n\n- [Plugin Marketplaces Documentation](https://code.claude.com/docs/en/plugin-marketplaces)\n- [Creating Custom Skills](https://code.claude.com/docs/en/skills)\n- [MCP Server Integration](https://code.claude.com/docs/en/mcp)\n\n### Salesforce Resources\n\n- [AgentForce Documentation](https://help.salesforce.com/s/articleView?id=sf.einstein_agentforce_overview.htm)\n- [Salesforce DX Developer Guide](https://developer.salesforce.com/docs/atlas.en-us.sfdx_dev.meta/sfdx_dev/)\n- [AgentForce API Guide](https://developer.salesforce.com/docs/einstein/genai/guide/agent-api.html)\n\n---\n\n## ü§ù Contributing\n\nThis is an experimental playground! Contributions, ideas, and feedback are welcome.\n\n### Adding a New Plugin\n\n1. Create a new directory for your plugin\n2. Add `.claude-plugin/plugin.json` with metadata\n3. Include any skills, MCP servers, or tools\n4. Document usage in a README or SKILL.md file\n\n### Improving Existing Plugins\n\n1. Fork this repository\n2. Make your improvements\n3. Test thoroughly in Claude Code\n4. Submit a pull request with documentation\n\n---\n\n## üìù License\n\n[Your License Here]\n\n---\n\n## üë§ Author\n\n**Damien Fleminks**\n\n\n---\n\n## üêõ Issues & Support\n\nFound a bug or have a feature request?\n\n- Open an issue in this repository\n- Contact the plugin maintainer\n- Check the [Claude Code documentation](https://code.claude.com/docs)\n\n---\n\n\n**Happy building with AgentForce! üöÄ**\n"
      },
      "plugins": [
        {
          "name": "agentforce",
          "source": "./agentforce",
          "description": "AgentForce plugin",
          "categories": [],
          "install_commands": [
            "/plugin marketplace add flemx/agentforce-playground-claude-plugins",
            "/plugin install agentforce@agentforce-playground"
          ]
        }
      ]
    }
  ]
}