{
  "author": {
    "id": "FrancisVarga",
    "display_name": "Francis Varga",
    "avatar_url": "https://avatars.githubusercontent.com/u/142090?u=a5732ea21fb700ba6b8e92532b3451715629abda&v=4"
  },
  "marketplaces": [
    {
      "name": "coconut-claude-code-plugins",
      "version": null,
      "description": "Coconut collection of Claude Code plugins for intelligent git workflows, rules management, and workflow automation",
      "repo_full_name": "FrancisVarga/coconut-claude-code-plugins",
      "repo_url": "https://github.com/FrancisVarga/coconut-claude-code-plugins",
      "repo_description": null,
      "signals": {
        "stars": 0,
        "forks": 0,
        "pushed_at": "2025-12-10T11:18:13Z"
      },
      "files": {
        ".claude-plugin/marketplace.json": "{\n  \"name\": \"coconut-claude-code-plugins\",\n  \"owner\": {\n    \"name\": \"Francis Varga\",\n    \"email\": \"francis@phili-tech.org\"\n  },\n  \"metadata\": {\n    \"description\": \"Coconut collection of Claude Code plugins for intelligent git workflows, rules management, and workflow automation\",\n    \"version\": \"0.1.0\"\n  },\n  \"plugins\": [\n    {\n      \"name\": \"coconut-commit-work\",\n      \"source\": \"./coconut-commit-work\",\n      \"description\": \"Intelligent git commits with semantic grouping, conventional commit messages, emoji prefixes, user stories, and parallel sub-agent execution\",\n      \"version\": \"0.2.0\",\n      \"author\": {\n        \"name\": \"Francis Varga\"\n      },\n      \"keywords\": [\"git\", \"commit\", \"conventional-commits\", \"automation\", \"workflow\"]\n    },\n    {\n      \"name\": \"coconut-workflow\",\n      \"source\": \"./coconut-workflow\",\n      \"description\": \"Interactive workflow creation assistant that helps teams create Claude Code slash commands through conversational requirements gathering\",\n      \"version\": \"0.1.0\",\n      \"author\": {\n        \"name\": \"Francis Varga\"\n      },\n      \"keywords\": [\"workflow\", \"commands\", \"automation\", \"team-standards\"]\n    },\n    {\n      \"name\": \"coconut-rules\",\n      \"source\": \"./coconut-rules\",\n      \"description\": \"Manage Claude Code rules with context-based loading, retrospective analysis, and knowledge graph integration\",\n      \"version\": \"3.0.0\",\n      \"author\": {\n        \"name\": \"Francis Varga\"\n      },\n      \"keywords\": [\"rules\", \"claude-md\", \"organization\", \"configuration\"]\n    }\n  ]\n}\n",
        "README.md": "# Coconut Claude Code Plugins\n\nA collection of Claude Code plugins for intelligent git workflows, rules management, and workflow automation.\n\n## Table of Contents\n\n- [Overview](#overview)\n- [Plugins](#plugins)\n- [Installation](#installation)\n- [Quick Start](#quick-start)\n- [Plugin Details](#plugin-details)\n- [Architecture](#architecture)\n- [Flow Diagrams](#flow-diagrams)\n- [Development](#development)\n- [Contributing](#contributing)\n- [License](#license)\n\n## Overview\n\nCoconut is a curated collection of Claude Code plugins designed to enhance developer productivity through:\n\n- **Intelligent Git Commits**: Semantic grouping with conventional commits and user stories\n- **Rules Management**: Context-based loading for efficient token usage\n- **Workflow Automation**: Conversational workflow creation for teams\n\n### Collection Stats\n\n| Metric | Value |\n|--------|-------|\n| Plugins | 3 |\n| Total Commands | 6 |\n| Total Agents | 7 |\n| Total Skills | 4 |\n\n## Plugins\n\n| Plugin | Version | Description |\n|--------|---------|-------------|\n| [coconut-commit-work](#coconut-commit-work) | 0.2.0 | Intelligent git commits with semantic grouping and parallel execution |\n| [coconut-rules](#coconut-rules) | 3.0.0 | Context-based rules management with retrospective analysis |\n| [coconut-workflow](#coconut-workflow) | 0.1.0 | Interactive workflow creation through conversational requirements |\n\n## Installation\n\n### Option 1: Clone and Symlink (Recommended for Development)\n\n```bash\n# Clone the repository\ngit clone https://github.com/FrancisVarga/coconut-claude-code-plugins.git\n\n# Symlink to Claude Code plugins directory\nln -s $(pwd)/coconut-claude-code-plugins ~/.claude/plugins/coconut\n```\n\n### Option 2: Copy Individual Plugins\n\n```bash\n# Copy specific plugin to global plugins\ncp -r coconut-commit-work ~/.claude/plugins/\n\n# Or copy to project-specific plugins\ncp -r coconut-rules /path/to/project/.claude-plugin/\n```\n\n### Option 3: Use as Marketplace Collection\n\nThe `marketplace.json` file defines this as a plugin collection:\n\n```json\n{\n  \"name\": \"coconut-claude-code-plugins\",\n  \"plugins\": [\n    { \"name\": \"coconut-commit-work\", \"source\": \"./coconut-commit-work\" },\n    { \"name\": \"coconut-workflow\", \"source\": \"./coconut-workflow\" },\n    { \"name\": \"coconut-rules\", \"source\": \"./coconut-rules\" }\n  ]\n}\n```\n\n## Quick Start\n\n### Commit Your Changes Intelligently\n\n```bash\n# Analyze, group, commit, and push all changes\n/coconut-commit-work:commit-work\n\n# Preview without executing\n/coconut-commit-work:commit-work --dry-run\n```\n\n### Add a New Rule\n\n```bash\n# Add rule with automatic placement\n/coconut-rules:add-rule Always validate API inputs with Pydantic\n\n# Run retrospective to extract session learnings\n/coconut-rules:retrospective\n```\n\n### Create a Workflow\n\n```bash\n# Start interactive workflow creation\n/coconut-workflow:create\n\n# Start with description\n/coconut-workflow:create \"deploy to staging with approval\"\n```\n\n## Plugin Details\n\n### coconut-commit-work\n\n**Intelligent git commits with semantic grouping, conventional commit messages, emoji prefixes, user stories, and parallel sub-agent execution.**\n\n#### Commands\n\n| Command | Description |\n|---------|-------------|\n| `/coconut-commit-work:commit-work` | Analyze and commit changes with semantic grouping |\n| `/coconut-commit-work:commit-work --dry-run` | Preview commits without executing |\n| `/coconut-commit-work:commit-work --no-push` | Commit without pushing to remote |\n\n#### Agents\n\n| Agent | Purpose | Model |\n|-------|---------|-------|\n| `commit-analyzer` | Semantic analysis and grouping | Inherited |\n| `commit-executor` | Execute single atomic commit | Haiku (fast) |\n\n#### Features\n\n- **Semantic Grouping**: Groups changes by feature, layer, or concern\n- **Conventional Commits**: Emoji prefixes with proper format\n- **User Stories**: Scrum-like user story in each commit\n- **Parallel Analysis**: Fast multi-agent analysis\n- **Sequential Execution**: Safe atomic commits\n\n#### Commit Format\n\n```\nâœ¨ feat(auth): add password reset functionality\n\n## Why (User Story)\nAs a user who forgot my password, I want to reset it via email so that I can regain access.\n\n## What Changed\n- Added resetPassword function in src/auth/reset.ts\n- Created email template in templates/reset-email.html\n\n## Acceptance Criteria\n- [ ] User receives reset email within 1 minute\n- [ ] Reset link expires after 24 hours\n```\n\n[Full Documentation](./coconut-commit-work/README.md)\n\n---\n\n### coconut-rules\n\n**Manage Claude Code rules with context-based loading, retrospective analysis, and knowledge graph integration.**\n\n#### Commands\n\n| Command | Description |\n|---------|-------------|\n| `/coconut-rules:add-rule [desc]` | Add rule with automatic placement |\n| `/coconut-rules:list-rules` | Show current structure and status |\n| `/coconut-rules:organize` | Restructure rules for context-based loading |\n| `/coconut-rules:retrospective` | Analyze session for learnings |\n\n#### Agents\n\n| Agent | Purpose |\n|-------|---------|\n| `session-analyzer` | Extract learnings from sessions |\n| `rule-reviewer` | Review and propose rule updates |\n| `rules-organizer` | Organize and structure rules |\n| `knowledge-updater` | Propose knowledge graph entries |\n\n#### Skills\n\n| Skill | Purpose |\n|-------|---------|\n| `retrospective-process` | Session analysis framework |\n| `concise-rule-writing` | Writing precise rules (<50 words) |\n| `rules-management` | CLAUDE.md organization |\n\n#### The Problem It Solves\n\nWith `@rules/` references, ALL rules load on every interaction:\n```markdown\n@rules/frontend/react.md      # Loaded even for Python work\n@rules/backend/python.md      # Loaded even for React work\n```\n\n#### The Solution\n\nContext-based loading: Critical rules inline, domain rules on-demand.\n\n```\n.claude/\nâ”œâ”€â”€ CLAUDE.md                    # Critical rules + context table\nâ””â”€â”€ rules/                       # Domain-specific (on-demand)\n    â”œâ”€â”€ python.md\n    â”œâ”€â”€ typescript.md\n    â””â”€â”€ docker.md\n```\n\n[Full Documentation](./coconut-rules/README.md)\n\n---\n\n### coconut-workflow\n\n**Interactive workflow creation assistant that helps teams create Claude Code slash commands through conversational requirements gathering.**\n\n#### Commands\n\n| Command | Description |\n|---------|-------------|\n| `/coconut-workflow:create` | Start interactive workflow creation |\n| `/coconut-workflow:create [desc]` | Start with initial description |\n\n#### Agents\n\n| Agent | Purpose |\n|-------|---------|\n| `workflow-validator` | Validates created workflows |\n\n#### Skills\n\n| Skill | Purpose |\n|-------|---------|\n| `workflow-creation` | Decision criteria and best practices |\n\n#### Workflow vs Plugin Decision\n\n| Choose **Workflow** when: | Choose **Plugin** when: |\n|---------------------------|------------------------|\n| Single-purpose task | Multiple related commands |\n| No persistent state | Needs hooks, agents, or skills |\n| One-shot execution | External service integration |\n| Project-specific | Reusable across projects |\n\n[Full Documentation](./coconut-workflow/README.md)\n\n---\n\n## Architecture\n\n### Directory Structure\n\n```\ncoconut-claude-code-plugins/\nâ”œâ”€â”€ .claude-plugin/\nâ”‚   â””â”€â”€ marketplace.json         # Collection manifest\nâ”œâ”€â”€ .github/\nâ”‚   â””â”€â”€ COMMIT_TEMPLATE          # Conventional commit template\nâ”‚\nâ”œâ”€â”€ coconut-commit-work/         # Git commit plugin\nâ”‚   â”œâ”€â”€ .claude-plugin/\nâ”‚   â”‚   â””â”€â”€ plugin.json\nâ”‚   â”œâ”€â”€ agents/\nâ”‚   â”‚   â”œâ”€â”€ commit-analyzer.md\nâ”‚   â”‚   â””â”€â”€ commit-executor.md\nâ”‚   â”œâ”€â”€ commands/\nâ”‚   â”‚   â””â”€â”€ commit-work.md\nâ”‚   â””â”€â”€ README.md\nâ”‚\nâ”œâ”€â”€ coconut-rules/               # Rules management plugin\nâ”‚   â”œâ”€â”€ .claude-plugin/\nâ”‚   â”‚   â””â”€â”€ plugin.json\nâ”‚   â”œâ”€â”€ agents/\nâ”‚   â”‚   â”œâ”€â”€ rule-reviewer.md\nâ”‚   â”‚   â”œâ”€â”€ rules-organizer.md\nâ”‚   â”‚   â”œâ”€â”€ session-analyzer.md\nâ”‚   â”‚   â””â”€â”€ knowledge-updater.md\nâ”‚   â”œâ”€â”€ commands/\nâ”‚   â”‚   â”œâ”€â”€ add-rule.md\nâ”‚   â”‚   â”œâ”€â”€ list-rules.md\nâ”‚   â”‚   â”œâ”€â”€ organize.md\nâ”‚   â”‚   â””â”€â”€ retrospective.md\nâ”‚   â”œâ”€â”€ skills/\nâ”‚   â”‚   â”œâ”€â”€ concise-rule-writing/\nâ”‚   â”‚   â”œâ”€â”€ retrospective-process/\nâ”‚   â”‚   â””â”€â”€ rules-management/\nâ”‚   â””â”€â”€ README.md\nâ”‚\nâ”œâ”€â”€ coconut-workflow/            # Workflow creation plugin\nâ”‚   â”œâ”€â”€ .claude-plugin/\nâ”‚   â”‚   â””â”€â”€ plugin.json\nâ”‚   â”œâ”€â”€ agents/\nâ”‚   â”‚   â””â”€â”€ workflow-validator.md\nâ”‚   â”œâ”€â”€ commands/\nâ”‚   â”‚   â””â”€â”€ create.md\nâ”‚   â”œâ”€â”€ skills/\nâ”‚   â”‚   â””â”€â”€ workflow-creation/\nâ”‚   â””â”€â”€ README.md\nâ”‚\nâ””â”€â”€ README.md                    # This file\n```\n\n### Component Types\n\n| Type | Location | Purpose | Context Load |\n|------|----------|---------|--------------|\n| **Commands** | `commands/*.md` | User-invoked workflows | On invocation |\n| **Agents** | `agents/*.md` | Autonomous sub-tasks | When spawned |\n| **Skills** | `skills/*/SKILL.md` | Guidance/conventions | On-demand via Skill tool |\n| **Hooks** | `hooks/*.md` | Event-triggered actions | On matching events |\n\n### Execution Models\n\n#### Parallel Analysis â†’ Sequential Execution (coconut-commit-work)\n\n```\nâ”Œâ”€â”€â”€â”€â”€â”€â”€â”€â”€â”€â”€â”€â”€â”€â”€â”€â”€â”€â”€â”€â”€â”€â”€â”€â”€â”€â”€â”€â”€â”€â”€â”€â”€â”€â”€â”€â”€â”€â”€â”€â”€â”€â”€â”€â”€â”\nâ”‚  PHASE 1: PARALLEL ANALYSIS (Fast)          â”‚\nâ”‚  â”Œâ”€â”€â”€â”€â”€â”€â”€â”€â”€â”€â” â”Œâ”€â”€â”€â”€â”€â”€â”€â”€â”€â”€â” â”Œâ”€â”€â”€â”€â”€â”€â”€â”€â”€â”€â”    â”‚\nâ”‚  â”‚analyzer 1â”‚ â”‚analyzer 2â”‚ â”‚analyzer 3â”‚    â”‚\nâ”‚  â””â”€â”€â”€â”€â”¬â”€â”€â”€â”€â”€â”˜ â””â”€â”€â”€â”€â”¬â”€â”€â”€â”€â”€â”˜ â””â”€â”€â”€â”€â”¬â”€â”€â”€â”€â”€â”˜    â”‚\nâ”‚       â””â”€â”€â”€â”€â”€â”€â”€â”€â”€â”€â”€â”€â”¼â”€â”€â”€â”€â”€â”€â”€â”€â”€â”€â”€â”€â”˜           â”‚\nâ”‚                    â–¼                        â”‚\nâ”‚           [Messages ready]                  â”‚\nâ”‚                                             â”‚\nâ”‚  PHASE 2: SEQUENTIAL EXECUTION (Safe)       â”‚\nâ”‚       executor 1 â†’ executor 2 â†’ executor 3  â”‚\nâ”‚                    â–¼                        â”‚\nâ”‚                git push                     â”‚\nâ””â”€â”€â”€â”€â”€â”€â”€â”€â”€â”€â”€â”€â”€â”€â”€â”€â”€â”€â”€â”€â”€â”€â”€â”€â”€â”€â”€â”€â”€â”€â”€â”€â”€â”€â”€â”€â”€â”€â”€â”€â”€â”€â”€â”€â”€â”˜\n```\n\n#### Parallel Agent Analysis (coconut-rules retrospective)\n\n```\nSession â†’ Retrospective\n              â†“\n    â”Œâ”€â”€â”€â”€â”€â”€â”€â”€â”€â”¼â”€â”€â”€â”€â”€â”€â”€â”€â”€â”\n    â–¼         â–¼         â–¼\n[session-  [rule-    [knowledge-\n analyzer]  reviewer]  updater]\n    â””â”€â”€â”€â”€â”€â”€â”€â”€â”€â”¼â”€â”€â”€â”€â”€â”€â”€â”€â”€â”˜\n              â–¼\n       Batch Review\n              â–¼\n       Apply Changes\n```\n\n## Flow Diagrams\n\nDetailed Mermaid diagrams are available in [`docs/architecture.md`](./docs/architecture.md):\n\n| Diagram | Description |\n|---------|-------------|\n| Collection Overview | All plugins and their components |\n| coconut-commit-work Flow | Complete commit workflow from input to push |\n| commit-analyzer Agent | Semantic grouping decision tree |\n| commit-executor Agent | Single commit execution steps |\n| coconut-rules Flow | All 4 commands and their workflows |\n| Context-Based Loading | Before/after token efficiency comparison |\n| coconut-workflow Flow | Workflow creation with decision points |\n| Workflow vs Plugin Decision | When to use which approach |\n| Plugin Component Hierarchy | Commands, agents, skills, hooks relationships |\n| Execution Model Comparison | Sequential vs parallel vs hybrid |\n| Data Flow | Sources, processing, and outputs |\n\n### Quick Preview: Execution Model\n\n```mermaid\nflowchart LR\n    subgraph Hybrid[\"coconut-commit-work: Hybrid Execution\"]\n        H1[Analyze 1] --> H5[Merge]\n        H2[Analyze 2] --> H5\n        H3[Analyze 3] --> H5\n        H5 --> H6[Execute 1]\n        H6 --> H7[Execute 2]\n        H7 --> H8[Execute 3]\n    end\n```\n\n**Why hybrid?** Git's staging area is shared, so commits must be sequential. But analysis is read-only, so it can be parallel.\n\n## Development\n\n### Local Development Setup\n\n```bash\n# Clone repository\ngit clone https://github.com/FrancisVarga/coconut-claude-code-plugins.git\ncd coconut-claude-code-plugins\n\n# Link for testing\nln -s $(pwd) ~/.claude/plugins/coconut-dev\n\n# Test a command\n/coconut-commit-work:commit-work --dry-run\n```\n\n### Creating a New Plugin\n\n1. Create plugin directory structure:\n   ```bash\n   mkdir -p my-plugin/.claude-plugin\n   mkdir -p my-plugin/{commands,agents,skills}\n   ```\n\n2. Create `plugin.json`:\n   ```json\n   {\n     \"name\": \"coconut-my-plugin\",\n     \"version\": \"0.1.0\",\n     \"description\": \"My awesome plugin\"\n   }\n   ```\n\n3. Add to `marketplace.json`:\n   ```json\n   {\n     \"plugins\": [\n       { \"name\": \"coconut-my-plugin\", \"source\": \"./my-plugin\" }\n     ]\n   }\n   ```\n\n### Testing\n\n```bash\n# Test specific command\n/coconut-commit-work:commit-work --help\n\n# Dry run to preview\n/coconut-commit-work:commit-work --dry-run\n\n# Test workflow creation\n/coconut-workflow:create \"test workflow\"\n```\n\n### Best Practices\n\n1. **Commands**: Clear help text, argument hints, step-by-step workflows\n2. **Agents**: Focused system prompts, specific examples, appropriate model selection\n3. **Skills**: Progressive disclosure, on-demand loading, clear guidance\n4. **Documentation**: Comprehensive README in each plugin directory\n\n## Command Reference\n\n### All Available Commands\n\n| Plugin | Command | Description |\n|--------|---------|-------------|\n| commit-work | `/coconut-commit-work:commit-work` | Intelligent git commits |\n| commit-work | `/coconut-commit-work:commit-work --dry-run` | Preview commits |\n| commit-work | `/coconut-commit-work:commit-work --no-push` | Commit without push |\n| rules | `/coconut-rules:add-rule [desc]` | Add rule |\n| rules | `/coconut-rules:list-rules` | List rules |\n| rules | `/coconut-rules:organize` | Organize rules |\n| rules | `/coconut-rules:retrospective` | Session analysis |\n| workflow | `/coconut-workflow:create` | Create workflow |\n\n## Contributing\n\n1. Fork the repository\n2. Create a feature branch: `git checkout -b feature/my-feature`\n3. Make your changes\n4. Test thoroughly with dry-run modes\n5. Commit with conventional commits\n6. Submit a pull request\n\n### Contribution Guidelines\n\n- Follow existing plugin structure\n- Include comprehensive README for new plugins\n- Add to marketplace.json for new plugins\n- Test all commands before submitting\n- Use conventional commit messages\n\n## Author\n\n**Francis Varga**\n- Email: francis@phili-tech.org\n- GitHub: [@FrancisVarga](https://github.com/FrancisVarga)\n\n## License\n\nMIT\n\n---\n\n**Coconut**: Making Claude Code workflows smarter, one plugin at a time.\n",
        "coconut-commit-work/README.md": "# coconut-commit-work\n\nIntelligent git commits with semantic grouping, conventional commit messages, emoji prefixes, user stories, and **parallel analysis with sequential execution**.\n\n## Table of Contents\n\n- [Features](#features)\n- [Installation](#installation)\n- [Quick Start](#quick-start)\n- [Usage](#usage)\n- [Commit Message Format](#commit-message-format)\n- [Emoji Mapping](#emoji-mapping)\n- [Grouping Strategy](#grouping-strategy)\n- [Architecture](#architecture)\n- [Execution Model](#execution-model)\n- [Configuration](#configuration)\n- [Troubleshooting](#troubleshooting)\n- [Contributing](#contributing)\n- [License](#license)\n\n## Features\n\n| Feature | Description |\n|---------|-------------|\n| **Semantic Grouping** | Analyzes changes and groups them into smallest logical commits |\n| **Conventional Commits** | Follows conventional commit format with emoji prefixes |\n| **User Stories** | Each commit includes a scrum-like user story section |\n| **Acceptance Criteria** | Auto-generated testable criteria for each commit |\n| **Commit Template** | Creates/follows `.github/COMMIT_TEMPLATE` |\n| **Parallel Analysis** | Uses sub-agents to analyze and generate commit messages concurrently |\n| **Sequential Execution** | Commits execute one at a time to avoid git staging race conditions |\n| **Auto-Push** | Automatically pushes to remote after successful commits |\n| **Dry Run Mode** | Preview commits without executing |\n\n## Installation\n\n### Option 1: Copy to Project\n\n```bash\n# Copy plugin to your project's .claude-plugin directory\ncp -r coconut-commit-work /path/to/your/project/.claude-plugin/\n```\n\n### Option 2: Add to Claude Code Plugins Directory\n\n```bash\n# Copy to global plugins directory\ncp -r coconut-commit-work ~/.claude/plugins/\n```\n\n### Option 3: Symlink for Development\n\n```bash\n# Create symlink for easy updates\nln -s /path/to/coconut-commit-work ~/.claude/plugins/coconut-commit-work\n```\n\n## Quick Start\n\n```bash\n# 1. Make your code changes\nvim src/feature.ts\n\n# 2. Run the intelligent commit workflow\n/coconut-commit-work:commit-work\n\n# That's it! Changes are analyzed, grouped, committed, and pushed.\n```\n\n## Usage\n\n### Basic Commands\n\n```bash\n# Commit all changes with intelligent grouping and auto-push (default)\n/coconut-commit-work:commit-work\n\n# Preview commits without executing (dry run)\n/coconut-commit-work:commit-work --dry-run\n\n# Commit without pushing to remote\n/coconut-commit-work:commit-work --no-push\n\n# Show help\n/coconut-commit-work:commit-work --help\n```\n\n### Command Options\n\n| Option | Description | Default |\n|--------|-------------|---------|\n| `--dry-run` | Preview commits without executing | Off |\n| `--no-push` | Skip auto-push after commits | Off (push enabled) |\n| `--help` | Show help message | - |\n\n### Typical Workflow\n\n1. **Make changes** across multiple files\n2. **Run `/coconut-commit-work:commit-work`**\n3. **Review** the semantic groupings (or use `--dry-run` first)\n4. **Commits are created** with proper messages and user stories\n5. **Changes are pushed** to remote automatically\n\n## Commit Message Format\n\nEvery commit follows this structured format:\n\n```\n[emoji] [type](scope): Subject line (max 50 chars)\n\n## Why (User Story)\nAs a [specific role], I want [specific goal] so that [measurable benefit].\n\n## What Changed\n- Specific change 1 with file reference\n- Specific change 2 with context\n\n## Acceptance Criteria\n- [ ] Testable criterion 1\n- [ ] Testable criterion 2\n\n## Notes\nTechnical context, dependencies, or implementation details.\n```\n\n### Example Commit\n\n```\nâœ¨ feat(auth): add password reset functionality\n\n## Why (User Story)\nAs a user who forgot my password, I want to reset it via email so that I can regain access to my account.\n\n## What Changed\n- Added `resetPassword` function in src/auth/reset.ts\n- Created email template in templates/reset-email.html\n- Added reset endpoint in src/api/auth.ts\n\n## Acceptance Criteria\n- [ ] User receives reset email within 1 minute\n- [ ] Reset link expires after 24 hours\n- [ ] Password must meet complexity requirements\n\n## Notes\nUses SendGrid for email delivery. Rate limited to 3 attempts per hour.\n```\n\n## Emoji Mapping\n\n| Type | Emoji | When to Use |\n|------|-------|-------------|\n| `feat` | âœ¨ | New feature or capability |\n| `fix` | ğŸ› | Bug fix |\n| `docs` | ğŸ“ | Documentation only |\n| `style` | ğŸ’„ | Formatting, whitespace (no logic change) |\n| `refactor` | â™»ï¸ | Code restructure without behavior change |\n| `test` | âœ… | Adding or updating tests |\n| `chore` | ğŸ”§ | Maintenance, deps, tooling |\n| `perf` | âš¡ | Performance improvement |\n| `ci` | ğŸ‘· | CI/CD configuration |\n| `build` | ğŸ“¦ | Build system, packaging |\n\n## Grouping Strategy\n\nChanges are analyzed and grouped using these strategies (in priority order):\n\n### 1. Feature Cohesion\nRelated functionality goes together:\n- Implementation + its types/interfaces\n- Component + its styles + its tests\n- API endpoint + its handler + its validation\n\n### 2. Layer Separation\nArchitectural layers stay separate:\n- Frontend changes separate from backend\n- Database migrations separate from application code\n- Infrastructure/config separate from business logic\n\n### 3. Test Pairing\nTests with their implementations:\n- New feature + its unit tests = one commit\n- Bug fix + its regression test = one commit\n\n### 4. Config Isolation\nConfiguration changes standalone:\n- `package.json` changes alone\n- Environment config alone\n- Build configuration alone\n\n### 5. Documentation\nDocs usually separate:\n- README updates standalone\n- API docs can go with API changes\n- Comments-only changes standalone\n\n## Architecture\n\n### Components\n\n```\ncoconut-commit-work/\nâ”œâ”€â”€ .claude-plugin/\nâ”‚   â””â”€â”€ plugin.json          # Plugin manifest\nâ”œâ”€â”€ commands/\nâ”‚   â””â”€â”€ commit-work.md       # Main workflow entry point\nâ”œâ”€â”€ agents/\nâ”‚   â”œâ”€â”€ commit-analyzer.md   # Semantic analysis and grouping engine\nâ”‚   â””â”€â”€ commit-executor.md   # Individual commit execution\nâ””â”€â”€ README.md                # This file\n```\n\n### Component Descriptions\n\n| Component | Purpose | Model |\n|-----------|---------|-------|\n| `commit-work` | Main workflow orchestrator | Parent context |\n| `commit-analyzer` | Semantic analysis, file grouping, message generation | Inherited |\n| `commit-executor` | Execute single atomic commit | Haiku (fast) |\n\n## Execution Model\n\n### Parallel Analysis â†’ Sequential Commits\n\n```\nâ”Œâ”€â”€â”€â”€â”€â”€â”€â”€â”€â”€â”€â”€â”€â”€â”€â”€â”€â”€â”€â”€â”€â”€â”€â”€â”€â”€â”€â”€â”€â”€â”€â”€â”€â”€â”€â”€â”€â”€â”€â”€â”€â”€â”€â”€â”€â”€â”€â”€â”€â”€â”€â”€â”€â”€â”€â”€â”€â”\nâ”‚                    commit-work                          â”‚\nâ”‚                                                         â”‚\nâ”‚  PHASE 1: PARALLEL ANALYSIS (Fast)                     â”‚\nâ”‚  â”Œâ”€â”€â”€â”€â”€â”€â”€â”€â”€â”€â”€â”€â” â”Œâ”€â”€â”€â”€â”€â”€â”€â”€â”€â”€â”€â”€â” â”Œâ”€â”€â”€â”€â”€â”€â”€â”€â”€â”€â”€â”€â”         â”‚\nâ”‚  â”‚ analyzer 1 â”‚ â”‚ analyzer 2 â”‚ â”‚ analyzer 3 â”‚         â”‚\nâ”‚  â”‚ (files 1-5)â”‚ â”‚ (files 6-10â”‚ â”‚ (files 11+)â”‚         â”‚\nâ”‚  â””â”€â”€â”€â”€â”€â”¬â”€â”€â”€â”€â”€â”€â”˜ â””â”€â”€â”€â”€â”€â”¬â”€â”€â”€â”€â”€â”€â”˜ â””â”€â”€â”€â”€â”€â”¬â”€â”€â”€â”€â”€â”€â”˜         â”‚\nâ”‚        â”‚              â”‚              â”‚                 â”‚\nâ”‚        â””â”€â”€â”€â”€â”€â”€â”€â”€â”€â”€â”€â”€â”€â”€â”¼â”€â”€â”€â”€â”€â”€â”€â”€â”€â”€â”€â”€â”€â”€â”˜                 â”‚\nâ”‚                       â–¼                                â”‚\nâ”‚              [Commit messages ready]                   â”‚\nâ”‚                                                         â”‚\nâ”‚  PHASE 2: SEQUENTIAL EXECUTION (Safe)                  â”‚\nâ”‚        â”Œâ”€â”€â”€â”€â”€â”€â”€â”€â”€â”€â”€â”€â”                                  â”‚\nâ”‚        â”‚ executor 1 â”‚ â†’ commit 1 âœ“                     â”‚\nâ”‚        â””â”€â”€â”€â”€â”€â”¬â”€â”€â”€â”€â”€â”€â”˜                                  â”‚\nâ”‚              â–¼                                         â”‚\nâ”‚        â”Œâ”€â”€â”€â”€â”€â”€â”€â”€â”€â”€â”€â”€â”                                  â”‚\nâ”‚        â”‚ executor 2 â”‚ â†’ commit 2 âœ“                     â”‚\nâ”‚        â””â”€â”€â”€â”€â”€â”¬â”€â”€â”€â”€â”€â”€â”˜                                  â”‚\nâ”‚              â–¼                                         â”‚\nâ”‚        â”Œâ”€â”€â”€â”€â”€â”€â”€â”€â”€â”€â”€â”€â”                                  â”‚\nâ”‚        â”‚ executor 3 â”‚ â†’ commit 3 âœ“                     â”‚\nâ”‚        â””â”€â”€â”€â”€â”€â”¬â”€â”€â”€â”€â”€â”€â”˜                                  â”‚\nâ”‚              â–¼                                         â”‚\nâ”‚          git push                                      â”‚\nâ””â”€â”€â”€â”€â”€â”€â”€â”€â”€â”€â”€â”€â”€â”€â”€â”€â”€â”€â”€â”€â”€â”€â”€â”€â”€â”€â”€â”€â”€â”€â”€â”€â”€â”€â”€â”€â”€â”€â”€â”€â”€â”€â”€â”€â”€â”€â”€â”€â”€â”€â”€â”€â”€â”€â”€â”€â”€â”˜\n```\n\n### Why This Approach?\n\n**The Problem with Parallel Commits:**\nGit's staging area (`.git/index`) is a shared resource. When multiple agents run `git add` and `git commit` in parallel, they create race conditions where one commit may accidentally include files intended for another.\n\n**The Solution:**\n- **Parallel Analysis**: Multiple `commit-analyzer` agents can safely analyze files and generate commit messages concurrently (no git state modification)\n- **Sequential Execution**: `commit-executor` agents run one at a time, ensuring each commit only includes its intended files\n\n### Performance Characteristics\n\n| Phase | Execution | Why |\n|-------|-----------|-----|\n| Analysis | Parallel | Reading files doesn't modify git state |\n| Message Generation | Parallel | Pure computation, no git interaction |\n| Staging (`git add`) | Sequential | Modifies shared `.git/index` |\n| Committing | Sequential | Reads from shared staging area |\n\n### Execution Order\n\nCommits are executed in dependency order for clean `git bisect`:\n1. Infrastructure/config changes first\n2. Database migrations\n3. Backend/API changes\n4. Frontend changes\n5. Tests\n6. Documentation last\n\n## Configuration\n\n### Commit Template\n\nOn first run, creates `.github/COMMIT_TEMPLATE` if missing:\n\n```\n# [emoji] [type](scope): Subject (max 50 chars)\n\n## Why (User Story)\nAs a [role], I want [goal] so that [benefit].\n\n## What Changed\n-\n\n## Acceptance Criteria\n- [ ]\n\n## Notes\n\n# ---\n# Author: [GIT_USER_NAME] <[GIT_USER_EMAIL]>\n#\n# Emoji Reference:\n# âœ¨ feat     = New feature\n# ğŸ› fix      = Bug fix\n# ğŸ“ docs     = Documentation\n# ğŸ’„ style    = Formatting (no code change)\n# â™»ï¸ refactor = Code restructure\n# âœ… test     = Tests\n# ğŸ”§ chore    = Maintenance\n# âš¡ perf     = Performance\n# ğŸ‘· ci       = CI/CD\n# ğŸ“¦ build    = Build system\n```\n\n### Git Configuration\n\nThe plugin uses your existing git configuration:\n- `git config user.name` - For commit authorship\n- `git config user.email` - For commit authorship\n- `git remote` - For push operations\n\n## Troubleshooting\n\n### Common Issues\n\n#### \"No changes to commit\"\n```\nProblem: Git status shows no changes\nSolution: Ensure you have unstaged or staged changes before running\nCheck: git status\n```\n\n#### \"Push failed - no upstream\"\n```\nProblem: Branch doesn't have an upstream tracking branch\nSolution: Plugin will automatically run `git push -u origin <branch>`\nManual: git push -u origin $(git branch --show-current)\n```\n\n#### \"Pre-commit hook modified files\"\n```\nProblem: Pre-commit hooks (linting, formatting) modified staged files\nSolution: Plugin will detect and report modifications\nAction: Review modifications and re-run if needed\n```\n\n#### \"Staging race condition detected\"\n```\nProblem: Parallel execution attempted (should not happen)\nSolution: Plugin enforces sequential execution for staging\nCheck: Ensure you're using the latest plugin version\n```\n\n### Debug Mode\n\nFor debugging, use dry-run to preview without executing:\n\n```bash\n/coconut-commit-work:commit-work --dry-run\n```\n\nThis shows:\n- Proposed commit groups\n- Files in each group\n- Generated commit messages\n- Execution order\n\n### Manual Recovery\n\nIf commits are partially created:\n\n```bash\n# View recent commits\ngit log --oneline -10\n\n# Reset to before commits (keep changes)\ngit reset --soft HEAD~N  # N = number of commits to undo\n\n# Or reset to specific commit\ngit reset --soft <commit-hash>\n```\n\n## Best Practices\n\n### When to Use This Plugin\n\n| Scenario | Recommendation |\n|----------|----------------|\n| Multiple related changes | Use `commit-work` |\n| Single file change | Manual commit may be faster |\n| Large refactoring | Use with `--dry-run` first |\n| Merge conflicts | Resolve first, then use `commit-work` |\n\n### Commit Quality Tips\n\n1. **Make atomic changes** - Each logical change should be complete\n2. **Review dry-run output** - Use `--dry-run` for large changesets\n3. **Check groupings** - Verify semantic groupings make sense\n4. **Test before commit** - Ensure code works before committing\n\n## Advanced Usage\n\n### Integration with CI/CD\n\nThe structured commit format enables:\n- Automated changelog generation\n- Semantic versioning automation\n- User story tracking\n- Acceptance criteria validation\n\n### Customizing Behavior\n\nTo customize commit message format or grouping strategy, modify:\n- `agents/commit-analyzer.md` - Grouping logic\n- `commands/commit-work.md` - Workflow steps\n\n## Contributing\n\n1. Fork the repository\n2. Create a feature branch\n3. Make your changes\n4. Run tests (if available)\n5. Submit a pull request\n\n### Development Setup\n\n```bash\n# Clone repository\ngit clone <repo-url>\ncd coconut-commit-work\n\n# Link for testing\nln -s $(pwd) ~/.claude/plugins/coconut-commit-work-dev\n\n# Make changes and test\n/coconut-commit-work-dev:commit-work --dry-run\n```\n\n## Version History\n\n| Version | Changes |\n|---------|---------|\n| 0.2.0 | Added parallel analysis, sequential execution, auto-push |\n| 0.1.0 | Initial release with semantic grouping |\n\n## License\n\nMIT\n\n---\n\n**Made with semantic understanding for cleaner git history.**\n",
        "coconut-workflow/README.md": "# coconut-workflow\n\nInteractive workflow creation assistant that helps teams create Claude Code slash commands through conversational requirements gathering.\n\n## Features\n\n- **Conversational Creation**: Natural dialogue to understand workflow requirements\n- **Smart Routing**: Automatically determines if request needs a simple workflow (slash command) or full plugin\n- **Auto-Validation**: Validates created workflows against best practices\n- **Team Standards**: Ensures consistent workflow quality across the team\n\n## Usage\n\n```bash\n# Start interactive workflow creation\n/coconut-workflow:create\n\n# Start with initial description\n/coconut-workflow:create \"git commit workflow with conventional commits\"\n```\n\n## How It Works\n\n1. **Requirements Gathering**: Claude asks questions to understand what you need\n2. **Scope Decision**: Determines if this is a workflow (slash command) or needs a full plugin\n3. **Creation**: Generates the workflow file in `.claude/commands/`\n4. **Validation**: Automatically validates the created workflow\n5. **Explanation**: Explains how to use the new workflow\n\n## Components\n\n- **Command**: `/coconut-workflow:create` - Main entry point\n- **Skill**: `workflow-creation` - Decision criteria and best practices\n- **Agent**: `workflow-validator` - Validates created workflows\n\n## Workflow vs Plugin Decision\n\n| Choose **Workflow** when: | Choose **Plugin** when: |\n|---------------------------|------------------------|\n| Single-purpose task | Multiple related commands |\n| No persistent state | Needs hooks, agents, or skills |\n| One-shot execution | External service integration |\n| Project-specific | Reusable across projects |\n\n## Installation\n\nThis plugin is part of the `my-claude-code-plugins` collection. Ensure the plugin directory is loaded in Claude Code.\n",
        "coconut-rules/README.md": "# coconut-rules\n\nManage Claude Code rules with **context-based loading** - load only what's relevant per task.\n\n## The Problem\n\nWith `@rules/` references, ALL rules load on every interaction:\n```markdown\n@rules/frontend/react.md      # Loaded even for Python work\n@rules/backend/python.md      # Loaded even for React work\n@rules/devops/docker.md       # Loaded even for simple edits\n```\n\n## The Solution\n\n**Context-based loading**: Critical rules inline, domain rules on-demand.\n\n```markdown\n## Critical Rules (Always Loaded)\n- Never commit secrets\n- Feature branches only\n\n## Rules\n\n| Context | Rule File |\n|---------|-----------|\n| Python backend | `.claude/rules/python.md` |\n| React frontend | `.claude/rules/typescript.md` |\n```\n\nClaude reads context files only when working in that domain.\n\n## Structure\n\n```\n.claude/\nâ”œâ”€â”€ CLAUDE.md                    # Critical rules + context table\nâ””â”€â”€ rules/                       # Domain-specific (on-demand)\n    â”œâ”€â”€ python.md\n    â”œâ”€â”€ typescript.md\n    â”œâ”€â”€ docker.md\n    â””â”€â”€ taskmaster/              # Taskmaster integration rules\n        â”œâ”€â”€ prd-parsing.md\n        â””â”€â”€ task-expansion.md\n```\n\n### Project Rules (in this repo)\n\n```\n.claude/rules/\nâ”œâ”€â”€ plugin-development/          # Plugin development standards\nâ”œâ”€â”€ marketplace/                 # Marketplace organization\nâ”œâ”€â”€ general/                     # General coding standards\nâ””â”€â”€ taskmaster/                  # Taskmaster integration rules\n```\n\n## Commands\n\n| Command | Purpose |\n|---------|---------|\n| `/coconut-rules:add-rule [desc]` | Add rule with auto-placement |\n| `/coconut-rules:list-rules` | Show structure and status |\n| `/coconut-rules:organize` | Organize rules into coconut structure |\n| `/coconut-rules:retrospective [--depth] [--dry-run]` | Analyze session for learnings, update rules & KG |\n\n## Quick Start\n\n### Adding a Rule\n\n```\n/coconut-rules:add-rule Always use Pydantic models for API validation\n```\n\nClaude automatically places it:\n- **Critical** (security/universal) â†’ CLAUDE.md inline\n- **Context** (domain-specific) â†’ `.claude/rules/python.md`\n\n### Organizing Rules\n\n```\n/coconut-rules:organize\n```\n\nStructures rules into `.claude/rules/` for context-based loading.\n\n### Checking Status\n\n```\n/coconut-rules:list-rules\n```\n\nShows current structure and any issues.\n\n## What Goes Where?\n\n### Critical Rules (CLAUDE.md)\n- Security: secrets, auth bypass, input sanitization\n- Git: branching, commits\n- Universal conventions (80%+ of tasks)\n- Keep under 20 lines\n\n### Context Files (.claude/rules/)\n- Language patterns: Python, TypeScript, Go\n- Framework conventions: React, FastAPI, Next.js\n- Tool configs: Docker, Terraform\n- Include examples, can be longer\n\n## Example CLAUDE.md\n\n```markdown\n# My Project\n\n## Critical Rules\n\n### Security\n- Never commit secrets, API keys, or credentials\n- Sanitize all user input before database operations\n\n### Git\n- Feature branches only, never commit to main\n- Run tests before committing\n\n## Rules\n\nContext rules are loaded on-demand from `.claude/rules/`:\n\n| Context | Rule File |\n|---------|-----------|\n| Python/FastAPI backend | `.claude/rules/python.md` |\n| React/TypeScript frontend | `.claude/rules/typescript.md` |\n| Docker/containers | `.claude/rules/docker.md` |\n```\n\n## Taskmaster Integration\n\nWhen taskmaster is available, these rules enhance task management:\n\n### PRD Parsing Rules (`.claude/rules/taskmaster/prd-parsing.md`)\n\nAfter parsing a PRD:\n1. Check tasklist with `get-tasks`\n2. Add tags to each task based on domain:\n   - `frontend`, `backend`, `infra`, `testing`, `docs`, `security`, `data`, `integration`\n3. Limit to 1-2 tags per task for clarity\n\n### Task Expansion Rules (`.claude/rules/taskmaster/task-expansion.md`)\n\nWhen expanding tasks:\n1. **Inherit parent tags** to subtasks\n2. **Add specific tags** for refined categorization\n3. **Run parallel expansions** for independent tasks\n\n```\n# Parallel expansion (fast)\n[expand-task --id 1] & [expand-task --id 2] & [expand-task --id 3]\n```\n\n### Parallelization Benefits\n\n| Approach | 5 Tasks Ã— 2min |\n|----------|----------------|\n| Sequential | 10 min |\n| Parallel (3 batches) | 6 min |\n| **Time saved** | **40%** |\n\n## Benefits\n\n- **Faster loading**: Only load rules relevant to current task\n- **Better organization**: Clear separation of critical vs domain rules\n- **Easier maintenance**: One file per domain, easy to update\n- **Scalability**: Add domains without bloating every interaction\n- **Taskmaster efficiency**: Parallel task expansion with tag-based grouping\n\n## Retrospective Analysis\n\nExtract learnings from development sessions and automatically update rules and knowledge graph.\n\n### Running a Retrospective\n\n```bash\n# Full analysis (default: ultrathink depth)\n/coconut-rules:retrospective\n\n# Quick analysis for short sessions\n/coconut-rules:retrospective --depth quick\n\n# Preview changes without applying\n/coconut-rules:retrospective --dry-run\n```\n\n### Analysis Categories\n\n| Code | Category | Focus |\n|------|----------|-------|\n| M | Mistakes | Root cause analysis |\n| G | Good Decisions | Why it worked |\n| P | Patterns | Recurring elements |\n| D | Debugging | Investigation techniques |\n| A | Architecture | Design decisions |\n\n### What Gets Updated\n\n1. **Rules** - New rules added to CLAUDE.md or `.claude/rules/`\n2. **Knowledge Graph** - Decisions, patterns, conventions via `coconut-knowledge-graph`\n3. **History** - Saved to `.claude/retrospectives/YYYY-MM-DD.md`\n\n### Workflow\n\n```\nSession â†’ Retrospective â†’ Parallel Analysis â†’ Batch Review â†’ Apply Changes\n                              â†“\n                    [session-analyzer]\n                    [rule-reviewer]\n                    [knowledge-updater]\n```\n\n## Skills\n\n| Skill | Purpose |\n|-------|---------|\n| `retrospective-process` | Session analysis and learning extraction |\n| `concise-rule-writing` | Writing precise, short rules (<50 words) |\n| `rules-management` | CLAUDE.md organization and structure |\n\n## Agents\n\n| Agent | Purpose |\n|-------|---------|\n| `rules-organizer` | Organize and structure rules |\n| `session-analyzer` | Extract learnings from sessions |\n| `rule-reviewer` | Review and propose rule updates |\n| `knowledge-updater` | Propose knowledge graph entries |\n\n## Knowledge Graph Integration\n\nRetrospective integrates with `coconut-knowledge-graph` plugin:\n\n```bash\n# Session decisions become KG entries\n/coconut-knowledge-graph:add \"decision-name\" --type decision --content \"[rationale]\"\n\n# Patterns are preserved\n/coconut-knowledge-graph:add \"pattern-name\" --type pattern --content \"[description]\"\n```\n\nRetrospectives are also synced to KG for cross-session learning.\n"
      },
      "plugins": [
        {
          "name": "coconut-commit-work",
          "source": "./coconut-commit-work",
          "description": "Intelligent git commits with semantic grouping, conventional commit messages, emoji prefixes, user stories, and parallel sub-agent execution",
          "version": "0.2.0",
          "author": {
            "name": "Francis Varga"
          },
          "keywords": [
            "git",
            "commit",
            "conventional-commits",
            "automation",
            "workflow"
          ],
          "categories": [
            "automation",
            "commit",
            "conventional-commits",
            "git",
            "workflow"
          ],
          "install_commands": [
            "/plugin marketplace add FrancisVarga/coconut-claude-code-plugins",
            "/plugin install coconut-commit-work@coconut-claude-code-plugins"
          ]
        },
        {
          "name": "coconut-workflow",
          "source": "./coconut-workflow",
          "description": "Interactive workflow creation assistant that helps teams create Claude Code slash commands through conversational requirements gathering",
          "version": "0.1.0",
          "author": {
            "name": "Francis Varga"
          },
          "keywords": [
            "workflow",
            "commands",
            "automation",
            "team-standards"
          ],
          "categories": [
            "automation",
            "commands",
            "team-standards",
            "workflow"
          ],
          "install_commands": [
            "/plugin marketplace add FrancisVarga/coconut-claude-code-plugins",
            "/plugin install coconut-workflow@coconut-claude-code-plugins"
          ]
        },
        {
          "name": "coconut-rules",
          "source": "./coconut-rules",
          "description": "Manage Claude Code rules with context-based loading, retrospective analysis, and knowledge graph integration",
          "version": "3.0.0",
          "author": {
            "name": "Francis Varga"
          },
          "keywords": [
            "rules",
            "claude-md",
            "organization",
            "configuration"
          ],
          "categories": [
            "claude-md",
            "configuration",
            "organization",
            "rules"
          ],
          "install_commands": [
            "/plugin marketplace add FrancisVarga/coconut-claude-code-plugins",
            "/plugin install coconut-rules@coconut-claude-code-plugins"
          ]
        }
      ]
    }
  ]
}