{
  "author": {
    "id": "freedom07",
    "display_name": "Yun Jegal",
    "avatar_url": "https://avatars.githubusercontent.com/u/29652381?u=9cdc09a46a7f2d65a2bf729f58c2f752e666a8b6&v=4"
  },
  "marketplaces": [
    {
      "name": "ai-studio-cc-plugin",
      "version": null,
      "description": "AI Studio Claude Code plugin",
      "repo_full_name": "freedom07/ai-studio-cc-plugin",
      "repo_url": "https://github.com/freedom07/ai-studio-cc-plugin",
      "repo_description": "AI Studio Claude Code plugin",
      "signals": {
        "stars": 0,
        "forks": 0,
        "pushed_at": "2026-01-19T09:53:43Z"
      },
      "files": {
        ".claude-plugin/marketplace.json": "{\n  \"name\": \"ai-studio-cc-plugin\",\n  \"owner\": {\n    \"name\": \"freedom07\",\n    \"email\": \"freedom07@github.com\",\n    \"url\": \"https://github.com/freedom07\"\n  },\n  \"description\": \"AI Studio Claude Code plugin\",\n  \"plugins\": [\n    {\n      \"name\": \"ai-studio\",\n      \"source\": \"./plugins/ai-studio\",\n      \"description\": \"AI Studio tools and workflows\",\n      \"version\": \"1.0.0\"\n    }\n  ]\n}\n",
        "README.md": "# AI Studio Claude Code Plugin\n\nAI Studio tools and workflows for Claude Code.\n\n## Structure\n\n```\nai-studio-cc-plugin/\n├── .claude-plugin/\n│   └── marketplace.json      # Plugin marketplace metadata\n├── plugins/\n│   └── ai-studio/\n│       ├── .claude-plugin/\n│       │   └── plugin.json   # Plugin manifest\n│       ├── .mcp.json         # MCP server configuration\n│       ├── .lsp.json         # LSP configuration\n│       ├── commands/         # Command definitions\n│       └── skills/           # Skill definitions\n├── LICENSE\n└── README.md\n```\n\n## For Users: Installation\n\n### From GitHub (Recommended)\n\n```bash\n/plugin marketplace add freedom07/ai-studio-cc-plugin\n/plugin install ai-studio@ai-studio-cc-plugin\n```\n\n### From Local Directory\n\n```bash\ngit clone https://github.com/freedom07/ai-studio-cc-plugin.git\n/plugin marketplace add ./ai-studio-cc-plugin\n/plugin install ai-studio@ai-studio-cc-plugin\n```\n\n### Update Marketplace\n\nTo get the latest plugins:\n\n```bash\n/plugin marketplace update ai-studio-cc-plugin\n```\n\n## For Developers: Deployment\n\n### Deploy to GitHub (Recommended)\n\n1. **Create GitHub Repository**\n   ```bash\n   git init\n   git add .\n   git commit -m \"Initial commit: ai-studio plugin\"\n   git remote add origin https://github.com/freedom07/ai-studio-cc-plugin.git\n   git push -u origin main\n   ```\n\n2. **Users can add via**\n   ```bash\n   /plugin marketplace add freedom07/ai-studio-cc-plugin\n   ```\n\n### Deploy to Other Git Services\n\nGitLab, Bitbucket, or self-hosted Git servers also work:\n\n```bash\n# Push to GitLab\ngit remote add origin https://gitlab.com/freedom07/ai-studio-cc-plugin.git\ngit push -u origin main\n\n# Users add via full URL\n/plugin marketplace add https://gitlab.com/freedom07/ai-studio-cc-plugin.git\n```\n\n### Test Locally Before Deployment\n\n```bash\n# Validate marketplace structure\n/plugin validate .\n\n# Test locally\n/plugin marketplace add ./ai-studio-cc-plugin\n/plugin install ai-studio@ai-studio-cc-plugin\n```\n\n## Updating Deployed Marketplace\n\n### Push Updates\n\n1. **Make changes** to plugins (commands, skills, etc.)\n\n2. **Update version** in `plugins/ai-studio/.claude-plugin/plugin.json`:\n   ```json\n   {\n     \"name\": \"ai-studio\",\n     \"version\": \"1.1.0\",\n     \"description\": \"AI Studio tools and workflows\"\n   }\n   ```\n\n3. **Commit and push**\n   ```bash\n   git add .\n   git commit -m \"Update: add new feature\"\n   git push\n   ```\n\n4. **Users update via**\n   ```bash\n   /plugin marketplace update ai-studio-cc-plugin\n   ```\n\n## Team Configuration\n\nTo auto-install for team members, add to `.claude/settings.json` in your project:\n\n```json\n{\n  \"extraKnownMarketplaces\": {\n    \"ai-studio-cc-plugin\": {\n      \"source\": {\n        \"source\": \"github\",\n        \"repo\": \"freedom07/ai-studio-cc-plugin\"\n      }\n    }\n  },\n  \"enabledPlugins\": {\n    \"ai-studio@ai-studio-cc-plugin\": true\n  }\n}\n```\n\n## Adding New Plugins\n\nTo add another plugin to this marketplace:\n\n1. **Create plugin directory**\n   ```bash\n   mkdir -p plugins/new-plugin/.claude-plugin\n   mkdir -p plugins/new-plugin/commands\n   mkdir -p plugins/new-plugin/skills\n   ```\n\n2. **Create plugin manifest** (`plugins/new-plugin/.claude-plugin/plugin.json`)\n   ```json\n   {\n     \"name\": \"new-plugin\",\n     \"version\": \"1.0.0\",\n     \"description\": \"Description of new plugin\"\n   }\n   ```\n\n3. **Update marketplace.json** (`.claude-plugin/marketplace.json`)\n   ```json\n   {\n     \"plugins\": [\n       {\n         \"name\": \"ai-studio\",\n         \"source\": \"./plugins/ai-studio\",\n         \"description\": \"AI Studio tools and workflows\",\n         \"version\": \"1.0.0\"\n       },\n       {\n         \"name\": \"new-plugin\",\n         \"source\": \"./plugins/new-plugin\",\n         \"description\": \"Description of new plugin\",\n         \"version\": \"1.0.0\"\n       }\n     ]\n   }\n   ```\n\n## Usage\n\nAfter installation, AI Studio tools will be available in your Claude Code session.\n\n### Commands\n\nCommands are defined in `plugins/ai-studio/commands/` directory as Markdown files.\n\n### Skills\n\nSkills are defined in `plugins/ai-studio/skills/` directory.\n\n## License\n\nMIT License - see [LICENSE](LICENSE) for details.\n"
      },
      "plugins": [
        {
          "name": "ai-studio",
          "source": "./plugins/ai-studio",
          "description": "AI Studio tools and workflows",
          "version": "1.0.0",
          "categories": [],
          "install_commands": [
            "/plugin marketplace add freedom07/ai-studio-cc-plugin",
            "/plugin install ai-studio@ai-studio-cc-plugin"
          ]
        }
      ]
    }
  ]
}