{
  "author": {
    "id": "g-shudy",
    "display_name": "Gerald",
    "avatar_url": "https://avatars.githubusercontent.com/u/34307444?v=4"
  },
  "marketplaces": [
    {
      "name": "g-shudy-plugins",
      "version": null,
      "description": "Personal Claude Code plugins for workflow automation, file intelligence, and productivity",
      "repo_full_name": "g-shudy/claude-plugins",
      "repo_url": "https://github.com/g-shudy/claude-plugins",
      "repo_description": null,
      "signals": {
        "stars": 1,
        "forks": 0,
        "pushed_at": "2026-01-21T15:27:03Z"
      },
      "files": {
        ".claude-plugin/marketplace.json": "{\n  \"name\": \"g-shudy-plugins\",\n  \"description\": \"Personal Claude Code plugins for workflow automation, file intelligence, and productivity\",\n  \"owner\": {\n    \"name\": \"g-shudy\",\n    \"url\": \"https://ghsj.me\"\n  },\n  \"repository\": \"https://github.com/g-shudy/claude-plugins\",\n  \"plugins\": [\n    {\n      \"name\": \"hello-world\",\n      \"source\": \"./plugins/hello-world\",\n      \"description\": \"Example plugin demonstrating basic structure\",\n      \"version\": \"1.0.0\",\n      \"category\": \"example\",\n      \"keywords\": [\"example\", \"template\", \"hello-world\"],\n      \"author\": {\n        \"name\": \"g-shudy\",\n        \"url\": \"https://ghsj.me\"\n      }\n    },\n    {\n      \"name\": \"macos-apple-apps\",\n      \"source\": \"./plugins/macos-apple-apps\",\n      \"description\": \"Claude Code integration with macOS Apple productivity apps (Calendar, Contacts, Mail, Messages, Reminders, Health, Fitness, Shortcuts)\",\n      \"version\": \"0.1.0\",\n      \"category\": \"productivity\",\n      \"keywords\": [\"macos\", \"apple\", \"productivity\", \"calendar\", \"contacts\", \"mail\", \"messages\", \"reminders\", \"health\", \"fitness\", \"shortcuts\", \"applescript\", \"automation\"],\n      \"author\": {\n        \"name\": \"g-shudy\",\n        \"url\": \"https://ghsj.me\"\n      }\n    }\n  ]\n}\n",
        "README.md": "# g-shudy Claude Plugins\n\nPersonal Claude Code plugin marketplace for workflow automation, file intelligence, and productivity tools.\n\nğŸŒ **Website**: [plugins.ghsj.me](https://plugins.ghsj.me)\nğŸ“¦ **GitHub**: [g-shudy/claude-plugins](https://github.com/g-shudy/claude-plugins)\nğŸ‘¤ **Author**: [ghsj.me](https://ghsj.me)\n\n## Installation\n\n### Add this marketplace to Claude Code\n\n```bash\n/plugin marketplace add g-shudy/claude-plugins\n```\n\n### Install plugins\n\n```bash\n# List available plugins\n/plugin list g-shudy-plugins\n\n# Install a specific plugin\n/plugin install <plugin-name>@g-shudy-plugins\n```\n\n## Available Plugins\n\n*Coming soon! Plugins will be added as they're developed.*\n\n## Plugin Development\n\nThis marketplace follows the [Claude Code plugin specification](https://docs.claude.com/en/docs/claude-code/plugins).\n\n### Structure\n\n```\nclaude-plugins/\nâ”œâ”€â”€ .claude-plugin/\nâ”‚   â””â”€â”€ marketplace.json       # Marketplace catalog\nâ”œâ”€â”€ plugins/\nâ”‚   â””â”€â”€ <plugin-name>/        # Individual plugins\nâ”‚       â”œâ”€â”€ .claude-plugin/\nâ”‚       â”‚   â””â”€â”€ plugin.json   # Plugin metadata\nâ”‚       â”œâ”€â”€ commands/         # Slash commands\nâ”‚       â”œâ”€â”€ agents/           # AI agents\nâ”‚       â”œâ”€â”€ skills/           # Agent skills\nâ”‚       â””â”€â”€ README.md         # Plugin documentation\nâ”œâ”€â”€ docs/                     # GitHub Pages site\nâ””â”€â”€ README.md\n```\n\n### Adding a New Plugin\n\n1. Create plugin directory structure\n2. Add plugin metadata to `marketplace.json`\n3. Document in plugin's `README.md`\n4. Test locally\n5. Submit PR or push directly\n\n## About\n\nPersonal plugin collection by [g-shudy](https://github.com/g-shudy) focused on:\n\n- **File Intelligence**: Tools for media file management, deduplication, and provenance tracking\n- **Workflow Automation**: Personal productivity and GTD workflows\n- **Obsidian Integration**: Knowledge management and note-taking automation\n- **Developer Tools**: Custom utilities for software development\n\n## License\n\nIndividual plugins may have their own licenses. Check each plugin's directory for details.\n\n## Resources\n\n- **Claude Code Documentation**: https://docs.claude.com/en/docs/claude-code/\n- **Plugin Guide**: https://docs.claude.com/en/docs/claude-code/plugins\n- **Main Website**: https://ghsj.me\n\n---\n\n*Built with Claude Code â€¢ Hosted on GitHub Pages*\n",
        "plugins/hello-world/README.md": "# Hello World Plugin\n\nExample plugin demonstrating the basic structure of a Claude Code plugin.\n\n## Installation\n\n```bash\n/plugin install hello-world@g-shudy-plugins\n```\n\n## Commands\n\n### `/hello`\n\nDisplays a friendly greeting and information about the g-shudy plugin marketplace.\n\n**Usage:**\n```\n/hello\n```\n\n## Purpose\n\nThis plugin serves as:\n- A template for creating new plugins\n- A test to verify marketplace installation works correctly\n- An example of the basic plugin structure\n\n## Plugin Structure\n\n```\nhello-world/\nâ”œâ”€â”€ .claude-plugin/\nâ”‚   â””â”€â”€ plugin.json       # Plugin metadata\nâ”œâ”€â”€ commands/\nâ”‚   â””â”€â”€ hello.md          # Command definition\nâ””â”€â”€ README.md             # This file\n```\n\n## Creating Your Own Plugin\n\nUse this as a template:\n\n1. Copy this directory structure\n2. Update `plugin.json` with your plugin details\n3. Add your commands/agents/skills\n4. Update the README\n5. Add to `marketplace.json`\n\n## License\n\nMIT\n",
        "plugins/macos-apple-apps/README.md": "# macOS Apple Apps Plugin\n\nClaude Code integration with macOS native productivity apps for workflow automation and personal productivity.\n\n## Features\n\nThis plugin gives Claude Code read and (with confirmation) write access to:\n\n- **ğŸ“… Calendar** - Events, recurring events, alerts, multi-calendar support\n- **ğŸ‘¤ Contacts** - Names, phones, emails, birthdays, addresses, company info\n- **ğŸ“§ Mail** - Unread messages, search, send (with confirmation)\n- **ğŸ’¬ Messages** - Recent iMessages via SQLite (send with confirmation)\n- **âœ… Reminders** - Tasks, due dates, priorities, location-based alerts\n- **ğŸ™ï¸ Voice Memos** - Transcription with speaker diarization via AssemblyAI\n- **ğŸ Health** - Health data queries (read-only)\n- **ğŸƒ Fitness** - Activity and workout data (read-only)\n- **âš¡ Shortcuts** - Run user-defined macOS Shortcuts\n\n## Installation\n\n### Prerequisites\n\n- macOS (tested on macOS Sonoma/Sequoia)\n- Claude Code\n- Helper scripts installed in `~/bin/` (provided in this plugin)\n\n### Install Plugin\n\n```bash\n/plugin install macos-apple-apps@g-shudy-plugins\n```\n\n### Install Helper Scripts\n\nThe plugin includes helper scripts for accessing Apple apps. Install them to `~/bin/`:\n\n```bash\n# From the plugin directory\ncp scripts/* ~/bin/\nchmod +x ~/bin/{mail-unread,imessage-recent,calendar-*,contacts-search,reminders-list,voice-memos}\n```\n\nOr use the provided install script:\n\n```bash\n./install-scripts.sh\n```\n\n## Skills\n\n### `apple-productivity`\n\n**Description**: Access macOS Apple productivity apps (Calendar, Contacts, Mail, Messages, Reminders) to read events, contacts, messages, and tasks.\n\n**When Claude should use it**: When user needs to check calendar events, look up contact information, read recent messages or emails, or query reminders/tasks.\n\n**Allowed tools**: `Bash`, `Read`, `Write` (for output only), `AskUserQuestion`\n\n**Examples**:\n- \"What's on my calendar today?\"\n- \"What's Brandon's phone number?\"\n- \"Any unread emails from Marie?\"\n- \"Show my overdue reminders\"\n- \"When is Eileen's birthday?\"\n\n### `apple-health-fitness`\n\n**Description**: Query Health and Fitness data from Apple Health app including activity, workouts, heart rate, sleep, and other health metrics.\n\n**When Claude should use it**: When user asks about health stats, fitness activity, workouts, sleep data, heart rate, steps, or other health metrics.\n\n**Allowed tools**: `Bash`, `Read`, `Write` (for output only)\n\n**Examples**:\n- \"How many steps did I take this week?\"\n- \"Show my recent workouts\"\n- \"What was my average heart rate yesterday?\"\n- \"Sleep data for last 7 days\"\n\n### `apple-shortcuts`\n\n**Description**: Run user-defined macOS Shortcuts for custom automation workflows.\n\n**When Claude should use it**: When user wants to trigger a Shortcut by name or needs to execute a custom automation workflow.\n\n**Allowed tools**: `Bash`, `AskUserQuestion`\n\n**Examples**:\n- \"Run my morning routine shortcut\"\n- \"Execute the 'Export Photos' shortcut\"\n- \"Trigger backup shortcut\"\n\n## Helper Scripts Reference\n\nThe plugin relies on helper scripts that encapsulate AppleScript/SQLite access:\n\n### Calendar\n\n- **`calendar-list`** - List all available calendars\n- **`calendar-events [options]`** - Query events by date/range/calendar\n- **`calendar-add -t \"Title\" -s START -e END`** - Add new event (ISO-8601 format)\n\n### Contacts\n\n- **`contacts-search <query>`** - Search contacts by name/email/phone/company\n- **`contacts-search -a`** - List all contacts\n- **`contacts-search -v <query>`** - Verbose output with all details\n\n### Mail\n\n- **`mail-unread [hours]`** - Get unread mail from last N hours (default: 24)\n- **`mail-unread -d <days>`** - Get unread mail from last N days\n- **`mail-unread -l <N>`** - Limit to N messages\n\n### Messages\n\n- **`imessage-recent [hours]`** - Get recent iMessages (default: 24 hours)\n- **`imessage-recent -d <days>`** - Messages from last N days\n- **`imessage-recent -n`** - Check for notation patterns\n- **`imessage-recent -p \"keyword\"`** - Filter by pattern\n\n### Reminders\n\n- **`reminders-list`** - List incomplete reminders (default)\n- **`reminders-list -a`** - All reminders\n- **`reminders-list -c`** - Only completed\n- **`reminders-list -d`** - Due today\n- **`reminders-list -o`** - Overdue\n- **`reminders-list -l \"List Name\"`** - Filter by list\n\n### Voice Memos\n\n- **`voice-memos list`** - Show unprocessed voice memos\n- **`voice-memos list --all`** - Show all memos (including processed)\n- **`voice-memos process`** - Auto-transcribe (prioritizes recent memos)\n- **`voice-memos process --dry-run`** - Preview what would be processed\n- **`voice-memos transcribe <file>`** - Transcribe specific memo\n- **`voice-memos stats`** - Show usage/cost statistics\n\n## Access Patterns\n\n### AppleScript-based (most apps)\n\nMail, Calendar, Contacts, Reminders use AppleScript via the helper scripts:\n\n```bash\n# Calendar events\ncalendar-events --today\n\n# Contact lookup\ncontacts-search \"Marie\"\n\n# Unread mail\nmail-unread 6  # Last 6 hours\n```\n\n### SQLite Direct Access (Messages)\n\niMessages are accessed via direct SQLite queries to `~/Library/Messages/chat.db`:\n\n```bash\n# Recent messages\nimessage-recent 24  # Last 24 hours\n\n# Search for pattern\nimessage-recent -p \"lunch\"\n\n# Check for notation patterns\nimessage-recent -n\n```\n\n### SQLite + AssemblyAI (Voice Memos)\n\nVoice Memos are read from Apple's synced database and transcribed via AssemblyAI:\n\n```bash\n# List unprocessed memos\nvoice-memos list\n\n# Auto-transcribe all pending\nvoice-memos process\n\n# Check cost/usage\nvoice-memos stats\n```\n\n**Databases**:\n- Apple source: `~/Library/Group Containers/group.com.apple.VoiceMemos.shared/Recordings/CloudRecordings.db`\n- Tracking: `~/.voice-memos.db` (processed, usage, skipped)\n\n**Output**: Transcripts saved to `~/Vault/Voice-Transcripts/` with speaker diarization\n\n**Requirements**: `ASSEMBLYAI_API_KEY` env var, `pip install assemblyai`\n\n### Health/Fitness (healthexport)\n\nHealth and Fitness data require exporting from Health app using `healthexport` command-line tool:\n\n```bash\n# Export health data\nhealthexport ~/health-export/\n\n# Query specific metrics\n# (Implementation in progress)\n```\n\n### Shortcuts (shortcuts CLI)\n\nRun Shortcuts via macOS `shortcuts` command:\n\n```bash\n# List available shortcuts\nshortcuts list\n\n# Run a shortcut\nshortcuts run \"Shortcut Name\"\n```\n\n## Security & Privacy\n\n### Confirmation Required\n\nThe following operations **ALWAYS** require explicit user confirmation:\n\n- âŒ Sending emails\n- âŒ Sending iMessages\n- âŒ Creating/modifying calendar events\n- âŒ Creating/modifying contacts\n- âŒ Creating/modifying reminders\n- âŒ Running shortcuts\n- âŒ Accessing health data\n- âŒ Transcribing voice memos (incurs AssemblyAI costs ~$0.0025/min)\n\n### Safe Operations (Read-Only)\n\n- âœ… Reading calendar events\n- âœ… Looking up contact info\n- âœ… Checking unread mail (counts and subjects only)\n- âœ… Reading recent iMessages\n- âœ… Querying reminder status\n- âœ… Viewing health/fitness stats\n- âœ… Listing voice memos (`voice-memos list`)\n- âœ… Checking voice-memos stats (`voice-memos stats`)\n\n### Privacy Notes\n\n- Mail/Messages content is only shown when explicitly requested\n- Contact information is treated as personal data\n- Health data is highly sensitive - read-only access only\n- All helper scripts have built-in permission checks\n- AppleScript operations respect macOS security prompts\n\n## Known Limitations\n\n### App-Specific Limitations\n\n**Messages**:\n- Send-only via AppleScript (reading blocked for privacy)\n- Reading works via SQLite direct access\n- Requires Messages.app database permissions\n\n**Photos**:\n- Limited AppleScript support\n- Cannot access face information\n- Very slow performance\n- **Recommendation**: Use FindMedia plugin instead\n\n**Reminders**:\n- Can lock up during large queries\n- May need pagination for large lists\n- Test with small queries first\n\n**Mail**:\n- Mail.app must be running for queries\n- Large time windows may be slow\n- Attachment access is limited\n\n### Performance Considerations\n\n- Calendar queries: Timeout after 10s for large date ranges\n- Contacts: ~700 contacts can be slow to enumerate\n- iMessages: Direct SQLite access is fast but may hit database locks\n- Health data: Export can take several minutes for large datasets\n\n## Use Cases\n\n### Productivity Workflows\n\n1. **Morning Context** - Check calendar, unread mail, and pending reminders\n2. **Contact Lookup** - Quick access to phone/email when composing messages\n3. **Birthday Tracking** - Extract birthdays from Contacts to Calendar/Journal\n4. **Task Management** - Sync overdue tasks between systems\n5. **Message Search** - Find specific conversations or patterns\n\n### GTD Integration\n\n- Query overdue reminders and create alerts\n- Time-box calendar events from task estimates\n- Location-based reminders for errands\n- Email-to-task workflows\n\n### Health & Fitness\n\n- Weekly activity summaries\n- Workout tracking and analysis\n- Sleep pattern analysis\n- Heart rate trend monitoring\n\n## Architecture\n\n### Helper Scripts (~/bin/)\n\nSmall, focused shell scripts that:\n- Encapsulate AppleScript/SQLite queries\n- Provide consistent CLI interface\n- Handle errors gracefully\n- Support JSON output for automation\n- Follow Unix philosophy (do one thing well)\n\n### Skills (Claude Code)\n\nSkills invoke helper scripts via Bash tool:\n- `apple-productivity` - Calendar, Contacts, Mail, Messages, Reminders\n- `apple-health-fitness` - Health and Fitness data\n- `apple-shortcuts` - Shortcut automation\n\n### Plugin Structure\n\n```\nmacos-apple-apps/\nâ”œâ”€â”€ .claude-plugin/\nâ”‚   â””â”€â”€ plugin.json           # Plugin metadata\nâ”œâ”€â”€ skills/\nâ”‚   â”œâ”€â”€ apple-productivity/\nâ”‚   â”‚   â””â”€â”€ SKILL.md         # Productivity apps skill\nâ”‚   â”œâ”€â”€ apple-health-fitness/\nâ”‚   â”‚   â””â”€â”€ SKILL.md         # Health/Fitness skill\nâ”‚   â””â”€â”€ apple-shortcuts/\nâ”‚       â””â”€â”€ SKILL.md         # Shortcuts skill\nâ”œâ”€â”€ scripts/\nâ”‚   â”œâ”€â”€ mail-unread          # Mail helper\nâ”‚   â”œâ”€â”€ imessage-recent      # Messages helper\nâ”‚   â”œâ”€â”€ calendar-list        # Calendar helper\nâ”‚   â”œâ”€â”€ calendar-events      # Calendar queries\nâ”‚   â”œâ”€â”€ calendar-add         # Calendar creation\nâ”‚   â”œâ”€â”€ contacts-search      # Contacts helper\nâ”‚   â””â”€â”€ reminders-list       # Reminders helper\nâ”œâ”€â”€ docs/\nâ”‚   â”œâ”€â”€ CAPABILITIES.md      # Detailed app capabilities\nâ”‚   â”œâ”€â”€ INTEGRATION.md       # Integration workflows\nâ”‚   â””â”€â”€ SECURITY.md          # Security guidelines\nâ”œâ”€â”€ install-scripts.sh       # Script installer\nâ””â”€â”€ README.md               # This file\n```\n\n## Development\n\n### Adding New Apps\n\n1. Research AppleScript capabilities (see docs/CAPABILITIES.md)\n2. Create helper script in `scripts/`\n3. Test thoroughly with security in mind\n4. Document in README and CAPABILITIES.md\n5. Add to appropriate skill or create new skill\n\n### Testing\n\n```bash\n# Test individual helper scripts\nmail-unread --help\ncalendar-events --help\ncontacts-search --help\n\n# Test with Claude Code\n/skill apple-productivity\n# Then: \"What's on my calendar today?\"\n```\n\n### Security Review Checklist\n\n- [ ] Input validation on all user-provided data\n- [ ] No command injection vulnerabilities\n- [ ] Proper error handling and exit codes\n- [ ] Confirmation required for write operations\n- [ ] Sensitive data not exposed in logs\n- [ ] Timeout handling for slow operations\n\n## Resources\n\n### Documentation\n\n- [AppleScript Capabilities](docs/CAPABILITIES.md) - Detailed app-by-app reference\n- [Integration Workflows](docs/INTEGRATION.md) - Common use cases and patterns\n- [Security Guidelines](docs/SECURITY.md) - Privacy and security best practices\n\n### External Resources\n\n- [Mac Automation Scripting Guide](https://developer.apple.com/library/archive/documentation/LanguagesUtilities/Conceptual/MacAutomationScriptingGuide/)\n- [AppleScript Language Guide](https://developer.apple.com/library/archive/documentation/AppleScript/Conceptual/AppleScriptLangGuide/)\n- [Claude Code Plugin Documentation](https://docs.claude.com/en/docs/claude-code/plugins)\n\n### Related Projects\n\n- [FindMedia Plugin](../findmedia/) - File intelligence and media management\n- [Obsidian Integration](../obsidian/) - Knowledge management workflows\n\n## Roadmap\n\n### Phase 1: Core Productivity (Current)\n\n- [x] Calendar integration (read/write)\n- [x] Contacts lookup (read)\n- [x] Mail queries (read)\n- [x] Messages queries (read via SQLite)\n- [x] Reminders queries (read)\n- [ ] Send message/email workflows\n- [ ] Create/update reminders\n\n### Phase 2: Health & Fitness\n\n- [ ] Health data export and queries\n- [ ] Workout tracking\n- [ ] Activity summaries\n- [ ] Sleep analysis\n- [ ] Heart rate trends\n\n### Phase 3: Advanced Features\n\n- [ ] Shortcuts integration\n- [ ] Photos queries (limited, may defer to FindMedia)\n- [ ] Music/Podcast control\n- [ ] Safari tab management\n- [ ] Finder automation (with extreme caution)\n\n### Phase 4: Automation Workflows\n\n- [ ] Morning context aggregation\n- [ ] GTD task sync\n- [ ] Birthday/anniversary notifications\n- [ ] Location-based reminders\n- [ ] Email-to-task conversion\n\n## Contributing\n\nThis is a personal plugin, but feel free to fork and adapt for your own use.\n\n## License\n\nMIT\n\n## Support\n\n- **Issues**: https://github.com/g-shudy/claude-plugins/issues\n- **Website**: https://ghsj.me\n- **Plugins**: https://plugins.ghsj.me\n\n---\n\n*Part of the g-shudy Claude Code plugin collection*\n"
      },
      "plugins": [
        {
          "name": "hello-world",
          "source": "./plugins/hello-world",
          "description": "Example plugin demonstrating basic structure",
          "version": "1.0.0",
          "category": "example",
          "keywords": [
            "example",
            "template",
            "hello-world"
          ],
          "author": {
            "name": "g-shudy",
            "url": "https://ghsj.me"
          },
          "categories": [
            "example",
            "hello-world",
            "template"
          ],
          "install_commands": [
            "/plugin marketplace add g-shudy/claude-plugins",
            "/plugin install hello-world@g-shudy-plugins"
          ]
        },
        {
          "name": "macos-apple-apps",
          "source": "./plugins/macos-apple-apps",
          "description": "Claude Code integration with macOS Apple productivity apps (Calendar, Contacts, Mail, Messages, Reminders, Health, Fitness, Shortcuts)",
          "version": "0.1.0",
          "category": "productivity",
          "keywords": [
            "macos",
            "apple",
            "productivity",
            "calendar",
            "contacts",
            "mail",
            "messages",
            "reminders",
            "health",
            "fitness",
            "shortcuts",
            "applescript",
            "automation"
          ],
          "author": {
            "name": "g-shudy",
            "url": "https://ghsj.me"
          },
          "categories": [
            "apple",
            "applescript",
            "automation",
            "calendar",
            "contacts",
            "fitness",
            "health",
            "macos",
            "mail",
            "messages",
            "productivity",
            "reminders",
            "shortcuts"
          ],
          "install_commands": [
            "/plugin marketplace add g-shudy/claude-plugins",
            "/plugin install macos-apple-apps@g-shudy-plugins"
          ]
        }
      ]
    }
  ]
}