{
  "author": {
    "id": "getty104",
    "display_name": "Toshifumi Kiyono",
    "avatar_url": "https://avatars.githubusercontent.com/u/20335778?u=049673e843caedfa2b125f768fe17ac175585b7f&v=4"
  },
  "marketplaces": [
    {
      "name": "getty104",
      "version": null,
      "description": "getty104's marketplace",
      "repo_full_name": "getty104/claude-code-marketplace",
      "repo_url": "https://github.com/getty104/claude-code-marketplace",
      "repo_description": null,
      "signals": {
        "stars": 9,
        "forks": 0,
        "pushed_at": "2026-01-30T13:31:15Z"
      },
      "files": {
        ".claude-plugin/marketplace.json": "{\n  \"name\": \"getty104\",\n  \"metadata\": {\n    \"description\": \"getty104's marketplace\",\n    \"version\": \"0.0.1\"\n  },\n  \"owner\": {\n    \"name\": \"getty104\"\n  },\n  \"plugins\": [\n    {\n      \"name\": \"base-tools\",\n      \"source\": \"./base-tools\",\n      \"description\": \"This is a getty104's base tool set\"\n    }\n  ]\n}\n",
        "README.md": "# claude-code-marketplace\n\ngetty104's Claude Code Plugin Marketplace\n\n## Overview\n\nThis repository is a plugin marketplace for Claude Code that automates TDD (Test-Driven Development) based development workflows. It provides specialized agents, custom commands, and skills to streamline the entire development process, from GitHub Issue implementation to code review responses.\n\nThe **marketplace format** enables centralized management of multiple plugins and easy sharing with teams and communities.\n\n## Features\n\n- **TDD Automation**: Automatically executes the test creation → implementation → quality check cycle\n- **GitHub Integration**: Automates Issue implementation and review comment responses\n- **git worktree Utilization**: Safe working environment isolated from the main branch\n- **Layered Architecture Compliance**: Maintains consistent code structure\n- **Quality Assurance**: Automatically runs lint, tests, and type checks\n- **Library Documentation Access**: Integrated MCP servers for Next.js, shadcn, and other libraries\n\n## Installation\n\n### Prerequisites\n\n- [Claude Code CLI](https://docs.claude.com/en/docs/claude-code/installation) installed\n- Node.js (if used in your project)\n- Docker (if used in your project)\n- [GitHub CLI (`gh`)](https://cli.github.com/)\n\n### Adding the Marketplace\n\nAdd to your Claude Code settings file (`~/.config/claude/settings.json`):\n\n```json\n{\n  \"plugin_marketplaces\": [\n    \"https://github.com/getty104/claude-code-marketplace\"\n  ]\n}\n```\n\nOr add directly via Claude Code command:\n\n```bash\nclaude marketplace add https://github.com/getty104/claude-code-marketplace\n```\n\n### Installing Plugins\n\nAfter adding the marketplace, included plugins will be automatically available:\n\n```bash\nclaude plugin install base-tools\n```\n\n### MCP Configuration\n\nThe `.mcp.json` included in the plugin automatically configures the following MCP servers:\n- **chrome-devtools**: Browser automation and DevTools integration\n- **context7**: Library documentation retrieval (HTTP-based, no API key required)\n- **next-devtools**: Next.js development tools and documentation\n- **shadcn**: shadcn/ui component library integration\n\n## Marketplace Composition\n\nThis marketplace includes the following plugins:\n\n### base-tools Plugin\n\nAn integrated plugin for automating TDD development workflows. Composed of five component types:\n\n1. **Agents** (`agents/`) - Specialized sub-agents\n2. **Commands** (`commands/`) - Custom slash commands\n3. **Skills** (`skills/`) - Reusable skill prompts\n4. **Hooks** (`hooks/hooks.json`) - Event handlers\n5. **MCP Servers** (`.mcp.json`) - External tool integration\n\n## Key Features\n\n### Agents\n\n#### github-issue-implementer\nSpecialized agent for implementing GitHub Issues and creating PRs\n\n**Features**:\n- Analysis of Issue content and implementation planning\n- Implementation following TDD cycle\n- Code quality checks (lint, tests)\n- Automatic PR creation\n\n**Usage Example**:\n```\nImplement this Issue #123 and create a PR\n```\n\n#### review-comment-implementer\nAgent specialized in implementing review comments\n\n**Features**:\n- Retrieval of unresolved review comments\n- TDD approach for fixes\n- Resolving review comments\n- Automation of re-review requests\n\n**Usage Example**:\n```\nCheck PR review comments and fix the pointed out issues\n```\n\n#### pr-review-planner\nAgent specialized in analyzing PR review comments and creating fix plans\n\n**Features**:\n- Retrieval and analysis of unresolved review comments\n- Classification by severity (Critical/Important/Suggestion/Question)\n- Structured fix plan creation with priorities\n- Impact assessment for each fix\n\n**Usage Example**:\n```\nAnalyze PR review comments and create a fix plan\n```\n\n#### task-requirement-analyzer\nAgent specialized in analyzing task requirements and creating implementation plans\n\n**Features**:\n- Deep analysis of task requirements (explicit and implicit)\n- TDD-based phased implementation planning\n- Risk and concern identification\n\n**Usage Example**:\n```\nAnalyze the requirements for adding password reset functionality\n```\n\n#### general-purpose-assistant\nGeneral-purpose agent for diverse tasks requiring broad problem-solving capabilities\n\n**Features**:\n- Comprehensive problem analysis and solution\n- Adherence to project conventions (TDD, no comments, layered architecture)\n- Integration with Context7 MCP\n- Flexible task execution across multiple domains\n\n**Usage Example**:\n```\nExplain the overall project structure\nProvide advice on improving development efficiency\n```\n\n### Slash Commands\n\n#### `/exec-issue <issue number>`\nReads GitHub Issue and automates from implementation to PR creation\n\n**Execution Steps**:\n1. Create git worktree\n2. Analyze Issue content\n3. TDD implementation\n4. PR creation\n\n#### `/create-worktree <branch name>`\nCreates and sets up a git worktree for task execution\n\n**Execution Steps**:\n1. Create git worktree with specified branch name\n2. Copy environment files (.env)\n3. Install dependencies\n\n#### `/create-plan <task description>`\nCreates an implementation plan and GitHub Issue using task-requirement-analyzer\n\n**Execution Steps**:\n1. Move to default branch and pull latest changes\n2. Analyze task requirements using task-requirement-analyzer agent\n3. Create GitHub Issue with implementation plan\n\n#### `/fix-review-point <branch name>`\nAddress unresolved review comments on specified branch\n\n**Execution Steps**:\n1. Prepare git worktree\n2. Retrieve review comments\n3. TDD fixes\n4. Resolve comments\n5. Re-review request\n\n#### `/fix-review-point-loop <branch name>`\nRepeatedly address review comments until none remain (checks every 5 minutes)\n\n#### `/general-task <task description>`\nExecute general tasks using the general-purpose-assistant agent\n\n**Execution Steps**:\n1. Analyze task requirements\n2. Select appropriate approach and tools\n3. Execute task with Context7 MCP as needed\n4. Validate results against project standards\n\n### Skills\n\nSkills are reusable prompts that can be invoked to perform specific tasks. Each skill can be invoked using the `/skill-name` syntax (e.g., `/check-library`).\n\n#### `/check-library`\nRetrieves library documentation using appropriate MCP servers\n\n**Features**:\n- Next.js: Uses next-devtools MCP\n- shadcn/ui: Uses shadcn MCP\n- Other libraries: Uses context7 MCP\n\n**Usage Example**:\n```\n/check-library React Query\n```\n\n#### `/create-git-worktree`\nAutomates git worktree creation and environment setup\n\n**Features**:\n- Creates worktree in `.git-worktrees/` directory\n- Automatically converts `/` to `-` in branch names\n- Copies .env files\n- Installs dependencies (npm install)\n- Reuses existing worktrees\n\n**Usage Example**:\n```\n/create-git-worktree feature/new-feature\n```\n\n#### `/high-quality-commit`\nGuides appropriate git commit strategies for code changes\n\n**Features**:\n- Squash strategy (default): Amend to existing commits\n- New commit: For independent changes\n- Interactive rebase: For reorganizing commit history\n- Commit message guidelines (type, subject, body, footer)\n\n**Usage Example**:\n```\n/high-quality-commit\n```\n\n#### `/read-github-issue`\nRetrieves GitHub Issue content via gh command\n\n**Features**:\n- Fetches Issue title, body, comments, labels, and assignments\n- Downloads images from Issues using gh-asset\n\n**Usage Example**:\n```\n/read-github-issue\n```\n\n#### `/create-pr`\nCreates GitHub Pull Request with proper template\n\n**Features**:\n- Uses `.github/PULL_REQUEST_TEMPLATE.md` for description\n- Removes commented sections from template\n- Includes `Closes #<issue number>` in description\n\n**Usage Example**:\n```\n/create-pr\n```\n\n#### `/read-unresolved-pr-comments`\nRetrieves unresolved PR comments via GitHub GraphQL API\n\n**Features**:\n- Fetches unresolved Review threads (code-specific comments, resolvable)\n- Fetches Issue comments with code blocks (conversation tab, not resolvable)\n- Returns PR metadata (number, title, URL, state, author, reviewers)\n- JSON output format\n\n**Usage Example**:\n```\n/read-unresolved-pr-comments\n```\n\n#### `/resolve-pr-comments`\nBatch resolves PR Review threads via GitHub GraphQL API\n\n**Features**:\n- Automatically resolves all unresolved Review threads\n- Uses resolveReviewThread mutation\n- Displays resolve results for each thread\n- Note: Issue comments (conversation tab) are not resolvable\n\n**Usage Example**:\n```\n/resolve-pr-comments\n```\n\n## Development Guidelines\n\n### TDD (Test-Driven Development)\n\n1. Create tests (in same directory as test target file)\n2. Run tests (confirm failure)\n3. Implementation\n4. Run tests (confirm success)\n5. Refactoring\n\n### Code Quality Standards\n\n- All tests must pass\n- Zero errors from `npm run lint`\n- TypeScript type safety ensured\n- No comments (code should be self-explanatory)\n- Minimal file changes\n\n### Layered Architecture\n\n- **Model Layer**: Business logic\n- **Infrastructure Layer**: Database, external APIs\n- **Application Layer**: Use cases\n- **Presentation Layer**: UI/API responses\n\n## Directory Structure\n\n```\nclaude-code-marketplace/\n├── .claude-plugin/\n│   └── marketplace.json                    # Marketplace manifest\n│\n├── base-tools/                             # base-tools plugin\n│   ├── .claude-plugin/\n│   │   └── plugin.json                     # Plugin manifest (auto-generated)\n│   ├── .mcp.json                           # MCP server configuration\n│   ├── agents/                             # Agent definitions\n│   │   ├── github-issue-implementer.md     # Issue implementation agent\n│   │   ├── review-comment-implementer.md   # Review response agent\n│   │   ├── pr-review-planner.md            # PR review analysis agent\n│   │   ├── task-requirement-analyzer.md    # Task analysis agent\n│   │   └── general-purpose-assistant.md    # General-purpose agent\n│   ├── commands/                           # Command definitions\n│   │   ├── exec-issue.md                   # Issue implementation command\n│   │   ├── create-plan.md                  # Implementation plan command\n│   │   ├── fix-review-point.md             # Review response command\n│   │   ├── fix-review-point-loop.md        # Full review response command\n│   │   └── general-task.md                 # General task execution command\n│   ├── skills/                             # Skill definitions\n│   │   ├── check-library/                  # Library documentation skill\n│   │   │   ├── SKILL.md\n│   │   │   └── examples.md\n│   │   ├── create-git-worktree/            # Worktree creation skill\n│   │   │   ├── SKILL.md\n│   │   │   └── scripts/\n│   │   │       └── create-worktree.sh\n│   │   ├── high-quality-commit/            # Commit strategy skill\n│   │   │   ├── SKILL.md\n│   │   │   ├── examples.md\n│   │   │   └── reference.md\n│   │   ├── read-github-issue/              # GitHub Issue retrieval skill\n│   │   │   └── SKILL.md\n│   │   ├── create-pr/                      # PR creation skill\n│   │   │   └── SKILL.md\n│   │   ├── read-unresolved-pr-comments/    # PR comment retrieval skill\n│   │   │   ├── SKILL.md\n│   │   │   └── scripts/\n│   │   │       └── read-unresolved-pr-comments.sh\n│   │   └── resolve-pr-comments/            # PR comment resolution skill\n│   │       ├── SKILL.md\n│   │       └── scripts/\n│   │           └── resolve-pr-comments.sh\n│   ├── scripts/                            # Utility scripts\n│   │   └── remove-merged-worktrees.sh      # Cleanup merged worktrees\n│   └── hooks/                              # Hook definitions\n│       └── hooks.json                      # Event handlers\n│\n├── CLAUDE.md                               # Claude Code guide\n└── README.md                               # This file\n```\n\n### Marketplace Manifest\n\n`.claude-plugin/marketplace.json` defines marketplace metadata:\n\n```json\n{\n  \"name\": \"getty104\",\n  \"metadata\": {\n    \"description\": \"getty104's marketplace\",\n    \"version\": \"0.0.1\"\n  },\n  \"owner\": {\n    \"name\": \"getty104\"\n  },\n  \"plugins\": [\n    {\n      \"name\": \"base-tools\",\n      \"source\": \"./base-tools\",\n      \"description\": \"This is a getty104's base tool set\"\n    }\n  ]\n}\n```\n\n## Development and Customization\n\n### Adding Agents\n\nCreate `.md` files in `base-tools/agents/`. Define `name`, `description`, `model`, and `color` in frontmatter:\n\n```markdown\n---\nname: custom-agent\ndescription: Description of when this agent should be used (Claude Code uses for auto-judgment)\nmodel: sonnet\ncolor: cyan\n---\n\nWrite agent prompt content here.\nThis prompt will be passed to the sub-agent.\n```\n\n**Best Practices**:\n- Make `description` clear and specific (Claude Code automatically invokes at appropriate times)\n- Create agents with specialized roles\n- Specify communication requirements (e.g., Japanese language)\n\n### Adding Commands\n\nCreate `.md` files in `base-tools/commands/` and describe the processing content:\n\n```markdown\n---\nallowed-tools: Bash(git *), Context7(*)\ndescription: Description of the command\n---\n\nDescribe task description and execution steps in Markdown format.\n\n## Step 1\nProcessing content...\n\n## Step 2\nProcessing content...\n```\n\nCommands are executed as `/command-name arguments`, and can reference arguments via the `$ARGUMENTS` variable.\n\n### Adding Skills\n\nCreate a directory in `base-tools/skills/` with a `SKILL.md` file:\n\n```markdown\n---\nname: skill-name\ndescription: Description of what this skill does and when to use it\n---\n\n# Skill Title\n\n## Instructions\n\nDetailed instructions for executing the skill...\n```\n\nSkills can include the following structure:\n```\nskills/\n└── my-skill/\n    ├── SKILL.md              # Main skill definition (required)\n    ├── scripts/              # Shell scripts for automation (optional)\n    │   └── my-script.sh\n    ├── examples.md           # Usage examples (optional)\n    └── reference.md          # Additional reference material (optional)\n```\n\n**Best Practices**:\n- Make `description` clear and specific for auto-invocation by Claude Code\n- Include `## Instructions` section with step-by-step guidance\n- Place shell scripts in `scripts/` subdirectory for organization\n- Reference scripts using relative paths: `bash scripts/my-script.sh`\n\n### Configuring Hooks\n\nConfigure event handlers in `base-tools/hooks/hooks.json`:\n\n```json\n{\n  \"hooks\": {\n    \"Stop\": [\n      {\n        \"matcher\": \"\",\n        \"hooks\": [\n          {\n            \"type\": \"command\",\n            \"command\": \"your-command-here\"\n          }\n        ]\n      }\n    ]\n  }\n}\n```\n\nAvailable events: `PreToolUse`, `PostToolUse`, `Stop`, etc.\n\n### Adding MCP Servers\n\nAdd new MCP servers to `.mcp.json`:\n\n```json\n{\n  \"mcpServers\": {\n    \"server-name\": {\n      \"command\": \"command\",\n      \"args\": [\"arg1\", \"arg2\"]\n    }\n  }\n}\n```\n\nFor HTTP-based MCP servers:\n\n```json\n{\n  \"mcpServers\": {\n    \"server-name\": {\n      \"type\": \"http\",\n      \"url\": \"https://example.com/mcp\"\n    }\n  }\n}\n```\n\nFor Python-based MCP servers (using uv):\n\n```json\n{\n  \"mcpServers\": {\n    \"server-name\": {\n      \"command\": \"uvx\",\n      \"args\": [\"--from\", \"git+https://github.com/org/repo\", \"package\", \"start-mcp-server\"]\n    }\n  }\n}\n```\n\n## Plugin Validation\n\nAlways validate plugins before distribution:\n\n```bash\nclaude plugin validate base-tools/\n```\n\nRun local tests:\n\n```bash\nclaude plugin install ./base-tools\n```\n\n## Sharing the Marketplace\n\nTo share this marketplace with teams or communities:\n\n### Public Sharing\n\nPublish repository on GitHub and share the URL:\n\n```bash\nhttps://github.com/getty104/claude-code-marketplace\n```\n\n### Private Sharing\n\nGrant team members access to the repository, then use the same URL.\n\n### Fork and Customize\n\nFork this marketplace to add your own plugins:\n\n1. Fork the repository\n2. Update `owner` in `.claude-plugin/marketplace.json`\n3. Add new plugins or modify existing ones\n4. Validate and commit\n\n## Troubleshooting\n\n### Plugin Not Recognized\n\nCheck with:\n\n```bash\nclaude plugin list\n```\n\nVerify that the marketplace has been added correctly.\n\n### MCP Server Won't Start\n\nEnsure the required tools are installed:\n- `npx` for Node.js-based servers\n- `uvx` for Python-based servers (requires uv)\n\n### Command Won't Execute\n\nVerify that command file names are correct. File names become command names as-is.\n\n## Resources\n\n- [Claude Code Official Documentation](https://docs.claude.com/en/docs/claude-code)\n- [Plugin Marketplace Guide](https://anthropic.mintlify.app/en/docs/claude-code/plugin-marketplaces)\n- [Plugin Reference](https://anthropic.mintlify.app/en/docs/claude-code/plugins-reference)\n\n## Contributing\n\nPull requests are welcome. For major changes, please open an issue first to discuss the proposed changes.\n\n## License\n\nMIT\n\n## Author\n\ngetty104\n\n## Support\n\nFor questions or issues, please report them in [GitHub Issues](https://github.com/getty104/claude-code-marketplace/issues).\n"
      },
      "plugins": [
        {
          "name": "base-tools",
          "source": "./base-tools",
          "description": "This is a getty104's base tool set",
          "categories": [],
          "install_commands": [
            "/plugin marketplace add getty104/claude-code-marketplace",
            "/plugin install base-tools@getty104"
          ]
        }
      ]
    }
  ]
}