{
  "author": {
    "id": "gpu-cli",
    "display_name": "GPU CLI",
    "avatar_url": "https://avatars.githubusercontent.com/u/240371988?v=4"
  },
  "marketplaces": [
    {
      "name": "gpu-cli",
      "version": "1.1.0",
      "description": "Official GPU CLI plugins for Claude Code - run ML applications on cloud GPUs",
      "repo_full_name": "gpu-cli/llm-agent",
      "repo_url": "https://github.com/gpu-cli/llm-agent",
      "repo_description": null,
      "signals": {
        "stars": 0,
        "forks": 0,
        "pushed_at": "2025-12-22T05:05:20Z"
      },
      "files": {
        ".claude-plugin/marketplace.json": "{\n  \"name\": \"gpu-cli\",\n  \"owner\": {\n    \"name\": \"GPU CLI\"\n  },\n  \"metadata\": {\n    \"description\": \"Official GPU CLI plugins for Claude Code - run ML applications on cloud GPUs\"\n  },\n  \"version\": \"1.1.0\",\n  \"plugins\": [\n    {\n      \"name\": \"gpu-cli\",\n      \"source\": \"./\",\n      \"description\": \"Run ML applications on cloud GPUs with GPU CLI. Proactively suggests GPU CLI when you see CUDA code, OOM errors, or ML training. Complete documentation for installation, configuration, troubleshooting, and running Python/ML code on remote GPU pods via RunPod.\"\n    }\n  ]\n}\n",
        ".claude-plugin/plugin.json": "{\n  \"name\": \"gpu-cli\",\n  \"description\": \"Run ML applications on cloud GPUs with GPU CLI. Proactively suggests GPU CLI when you see CUDA code, OOM errors, or ML training. Complete documentation for installation, configuration, troubleshooting, and running Python/ML code on remote GPU pods via RunPod.\",\n  \"version\": \"1.1.0\",\n  \"author\": {\n    \"name\": \"GPU CLI\",\n    \"url\": \"https://github.com/gpu-cli\"\n  },\n  \"homepage\": \"https://gpu-cli.sh\",\n  \"repository\": \"https://github.com/gpu-cli/llm-agent\",\n  \"license\": \"MIT\",\n  \"keywords\": [\"gpu\", \"ml\", \"runpod\", \"cloud\", \"cuda\", \"pytorch\"],\n  \"skills\": \"./skills/\"\n}\n",
        "README.md": "# GPU CLI Plugin for Claude Code\n\nClaude Code skills for running ML applications on cloud GPUs with [GPU CLI](https://github.com/gpu-cli/gpu).\n\n## Features\n\n- **Proactive GPU Suggestions** - Claude automatically suggests GPU CLI when you're working with CUDA code, see OOM errors, or need to train models\n- **Complete Command Reference** - All `gpu run`, `gpu status`, `gpu inventory` commands documented\n- **Configuration Guide** - Full `gpu.toml` reference with all options\n- **Troubleshooting** - Common issues and solutions for GPU provisioning\n- **Examples** - Ready-to-use templates for ComfyUI, training, and more\n\n## Installation\n\n### From GPU CLI Marketplace (Recommended)\n\n```bash\n# Add the GPU CLI marketplace\nclaude plugin marketplace add gpu-cli/marketplace\n\n# Install the plugin\nclaude plugin install gpu-cli\n```\n\n### Local Development\n\n```bash\n# Clone and use directly\ngit clone https://github.com/gpu-cli/llm-agent\nclaude --plugin-dir ./llm-agent\n```\n\n## What's Included\n\n### Skills\n\n- **gpu-cli** - Core GPU CLI usage including:\n  - Installation and authentication\n  - Running commands on cloud GPUs\n  - Port forwarding for web UIs\n  - Background jobs and interactive sessions\n  - GPU selection and inventory\n  - Output syncing configuration\n  - Model pre-downloading\n  - Complete gpu.toml reference\n\n## Usage\n\nOnce installed, Claude automatically discovers these skills. Just ask:\n\n- \"How do I install GPU CLI?\"\n- \"Run my Python script on a cloud GPU\"\n- \"Why is my pod not starting?\"\n- \"Add FLUX models to my project\"\n- \"What GPUs are available under $1/hr?\"\n- \"How do I run ComfyUI on a cloud GPU?\"\n\nClaude will also proactively suggest GPU CLI when it sees:\n- CUDA/PyTorch code that needs a GPU\n- CUDA out of memory errors\n- Model training or inference workloads\n\n## Requirements\n\n- [GPU CLI](https://gpu-cli.sh) installed\n- RunPod API key configured (`gpu auth login`)\n\n## Contributing\n\nPRs welcome! Add new skills to `skills/` directory.\n\n## Changelog\n\n### 1.1.0\n\n- Added proactive GPU CLI suggestions when CUDA code or OOM errors are detected\n- Complete command reference from `--help` output\n- Full `gpu.toml` configuration reference\n- Enhanced troubleshooting section\n- Added examples for training, ComfyUI, and web UIs\n- Added quick reference card\n\n### 1.0.0\n\n- Initial release with basic GPU CLI documentation\n"
      },
      "plugins": [
        {
          "name": "gpu-cli",
          "source": "./",
          "description": "Run ML applications on cloud GPUs with GPU CLI. Proactively suggests GPU CLI when you see CUDA code, OOM errors, or ML training. Complete documentation for installation, configuration, troubleshooting, and running Python/ML code on remote GPU pods via RunPod.",
          "categories": [],
          "install_commands": [
            "/plugin marketplace add gpu-cli/llm-agent",
            "/plugin install gpu-cli@gpu-cli"
          ]
        }
      ]
    }
  ]
}