{
  "author": {
    "id": "HelloWorldSungin",
    "display_name": "HelloWorldSungin",
    "avatar_url": "https://avatars.githubusercontent.com/u/38519039?u=8cc8aedcb20c45d42f5cf7473e3d6287dcbff69b&v=4"
  },
  "marketplaces": [
    {
      "name": "ark-ai-mcp",
      "version": null,
      "description": "MCP wrapper skills for GitHub, Linear, Context7, DeepWiki, Playwright via mcporter CLI",
      "repo_full_name": "HelloWorldSungin/ark-ai-mcp",
      "repo_url": "https://github.com/HelloWorldSungin/ark-ai-mcp",
      "repo_description": null,
      "signals": {
        "stars": 0,
        "forks": 0,
        "pushed_at": "2026-02-10T04:04:38Z"
      },
      "files": {
        ".claude-plugin/marketplace.json": "{\n  \"name\": \"ark-ai-mcp\",\n  \"owner\": {\n    \"name\": \"SunginKim\",\n    \"email\": \"sungin@arknode.com\"\n  },\n  \"metadata\": {\n    \"description\": \"MCP wrapper skills for GitHub, Linear, Context7, DeepWiki, Playwright via mcporter CLI\",\n    \"version\": \"1.3.0\"\n  },\n  \"plugins\": [\n    {\n      \"name\": \"ark-ai-mcp\",\n      \"source\": \"./\",\n      \"description\": \"On-demand MCP skills that call mcporter via Bash — saves ~50 tool definitions from context window\",\n      \"version\": \"1.3.0\",\n      \"strict\": true\n    }\n  ]\n}\n",
        ".claude-plugin/plugin.json": "{\n  \"name\": \"ark-ai-mcp\",\n  \"description\": \"MCP wrapper skills for calling GitHub, Linear, Context7, DeepWiki, and Playwright via mcporter CLI — zero context window overhead\",\n  \"version\": \"1.3.0\",\n  \"author\": { \"name\": \"SunginKim\", \"email\": \"sungin@arknode.com\" },\n  \"homepage\": \"https://github.com/HelloWorldSungin/ark-ai-mcp\",\n  \"repository\": \"git@github.com:HelloWorldSungin/ark-ai-mcp.git\",\n  \"license\": \"MIT\",\n  \"keywords\": [\"mcp\", \"mcporter\", \"linear\", \"github\", \"context7\", \"deepwiki\", \"playwright\", \"browser\", \"skills\"]\n}\n",
        "README.md": "# ark-ai-mcp\n\nClaude Code plugin providing MCP wrapper skills via [mcporter](https://github.com/steipete/mcporter) CLI. Each skill replaces dozens of MCP tool definitions with a single on-demand invocation, keeping your context window lean.\n\n## Skills\n\n| Skill | Description |\n|-------|-------------|\n| `/mcp-github` | 40 tools for PRs, issues, repos, code search, releases (complements `gh` CLI) |\n| `/mcp-linear` | Linear issues, projects, teams, comments, documents, cycles, milestones, attachments |\n| `/mcp-context7` | Library/framework documentation lookup via Context7 |\n| `/mcp-deepwiki` | Public GitHub repo documentation and architecture queries |\n| `/mcp-playwright` | Headless browser automation — navigate, interact, screenshot, scrape |\n\n## Prerequisites\n\n1. **mcporter** installed globally:\n   ```bash\n   brew install steipete/tap/mcporter\n   ```\n\n2. **~/.mcporter/mcporter.json** configured with MCP server definitions for `linear`, `github`, `context7`, `deepwiki`, `playwright`\n\n3. **Auth setup** per server:\n   - **Linear**: OAuth via `mcporter auth linear`\n   - **GitHub**: `GITHUB_TOKEN` env var\n   - **Context7**: No auth required\n   - **DeepWiki**: No auth required\n   - **Playwright**: No auth required (runs locally via npx)\n\n## Installation\n\n```bash\n# From GitHub\nclaude /plugin marketplace add HelloWorldSungin/ark-ai-mcp\nclaude /plugin install ark-ai-mcp@ark-ai-mcp\n\n# From local submodule\nclaude /plugin marketplace add ./external/ark-ai-mcp\nclaude /plugin install ark-ai-mcp@ark-ai-mcp\n```\n\nThen enable in `~/.claude/settings.json`:\n```json\n{\n  \"enabledPlugins\": {\n    \"ark-ai-mcp@ark-ai-mcp\": true\n  }\n}\n```\n\n## Usage\n\nIn any Claude Code session, invoke skills by name:\n\n```\n/mcp-linear          # Then ask about Linear issues, create/update issues\n/mcp-github          # Then search code, get file contents\n/mcp-context7        # Then look up library docs\n/mcp-deepwiki        # Then query public repo documentation\n/mcp-playwright      # Then navigate pages, fill forms, take screenshots\n```\n\nEach skill provides the mcporter call syntax and common examples. Use `--output json` for machine-readable results.\n\n## Adding a New MCP Skill\n\nA template is available at `skills/_template/SKILL.md.template` — copy it as your starting point.\n\n### Step 1: Register the MCP server in mcporter\n\nAdd an entry to `~/.mcporter/mcporter.json` under `mcpServers`:\n\n```json\n{\n  \"mcpServers\": {\n    \"my-server\": {\n      \"description\": \"What this server does.\",\n      \"baseUrl\": \"https://mcp.example.com/mcp\"\n    }\n  }\n}\n```\n\n**Common auth patterns:**\n\n```json\n// No auth (Context7, DeepWiki)\n{ \"baseUrl\": \"https://mcp.example.com/mcp\" }\n\n// Bearer token from env var (GitHub)\n{ \"baseUrl\": \"https://api.example.com/mcp/\", \"bearerTokenEnv\": \"MY_TOKEN\" }\n\n// OAuth flow (Linear)\n{ \"baseUrl\": \"https://mcp.example.com/mcp\", \"auth\": \"oauth\" }\n```\n\nFor OAuth servers, run `mcporter auth <server-name>` after adding the entry.\n\n### Step 2: Discover available tools\n\n```bash\nmcporter list my-server --all-parameters\n```\n\nSave the output — you'll use it to build the tool catalog and understand parameters.\n\n### Step 3: Create the skill file\n\n```bash\ncp skills/_template/SKILL.md.template skills/mcp-myserver/SKILL.md\n```\n\nEdit the file following the structure below.\n\n### Step 4: Write the skill content\n\nA good skill has four parts, in order of importance:\n\n#### 1. Objective with decision framework\nDon't just say what the skill does — explain **when to use it vs alternatives**. Claude needs to decide between `gh` CLI, this skill, Claude-in-Chrome, etc. A comparison table or bullet list works well.\n\n#### 2. Tool catalog as compact tables\nOrganize tools into logical categories (3-8 categories). Each tool gets one row:\n\n```markdown\n| Tool | Key Parameters | Description |\n|------|---------------|-------------|\n| `tool_name` | `param1`, `param2` | One-line description |\n```\n\nFor tools with a `method` parameter (like GitHub's `pull_request_read`), list all method values in the description — this is the most common source of missed capabilities.\n\n#### 3. Multi-step workflows with bash examples\nInclude 2-4 workflows showing how to **chain tools for real tasks** — not just isolated calls. These are the most valuable part of the skill because they teach Claude what a complete task looks like.\n\nBad: `mcporter call github.get_file_contents ...` (isolated call, no context)\nGood: \"Review a PR\" workflow showing get overview → get diff → check status → submit review\n\n#### 4. Tips section\nFocus on:\n- Critical parameters that change behavior (method enums, ref formats, query syntax)\n- Pagination patterns (`page` + `perPage` and their limits)\n- Auth requirements and how to verify they're configured\n- Performance gotchas (cold start, token cost, rate limits)\n\n### Step 5: Test the skill\n\n```bash\n# Verify mcporter can reach the server\nmcporter call my-server.some_tool --output json\n\n# Invoke in Claude Code to verify skill loads\n# (start a new session after syncing)\n/mcp-myserver\n```\n\n### Step 6: Version bump and sync\n\n1. Bump `version` in `.claude-plugin/plugin.json` and `.claude-plugin/marketplace.json`\n2. Copy to installed location:\n   ```bash\n   cp -r skills/ ~/.claude/plugins/marketplaces/ark-ai-mcp/skills/\n   cp .claude-plugin/*.json ~/.claude/plugins/marketplaces/ark-ai-mcp/.claude-plugin/\n   ```\n3. Commit and push\n\n### Quality checklist\n\nBefore merging a new skill, verify:\n\n- [ ] **Decision framework**: Objective explains when to use this vs alternatives\n- [ ] **Complete tool catalog**: All tools from `mcporter list` are documented\n- [ ] **Workflows**: At least 2 multi-step workflows with bash examples\n- [ ] **Method enums**: Any `method` parameter has all values listed\n- [ ] **Pagination**: List/search tools document `page`/`perPage` params and limits\n- [ ] **Auth documented**: How to set up and verify authentication\n- [ ] **Tested**: At least one mcporter call succeeds end-to-end\n- [ ] **Synced**: Source and installed plugin locations match\n\n## License\n\nMIT\n"
      },
      "plugins": [
        {
          "name": "ark-ai-mcp",
          "source": "./",
          "description": "On-demand MCP skills that call mcporter via Bash — saves ~50 tool definitions from context window",
          "version": "1.3.0",
          "strict": true,
          "categories": [],
          "install_commands": [
            "/plugin marketplace add HelloWorldSungin/ark-ai-mcp",
            "/plugin install ark-ai-mcp@ark-ai-mcp"
          ]
        }
      ]
    }
  ]
}