{
  "author": {
    "id": "hgeldenhuys",
    "display_name": "hgeldenhuys",
    "avatar_url": "https://avatars.githubusercontent.com/u/179999?u=989a39fc64e9eb433a91c144702942251a989d7f&v=4"
  },
  "marketplaces": [
    {
      "name": "claude-skills-marketplace",
      "version": "1.0.0",
      "description": "Official marketplace for Claude Code agent lifecycle, knowledge management, and SDLC orchestration plugins",
      "repo_full_name": "hgeldenhuys/claude-agent-lifecycle",
      "repo_url": "https://github.com/hgeldenhuys/claude-agent-lifecycle",
      "repo_description": null,
      "signals": {
        "stars": 0,
        "forks": 0,
        "pushed_at": "2025-12-06T19:43:12Z"
      },
      "files": {
        ".claude-plugin/marketplace.json": "{\n  \"name\": \"claude-skills-marketplace\",\n  \"description\": \"Official marketplace for Claude Code agent lifecycle, knowledge management, and SDLC orchestration plugins\",\n  \"version\": \"1.0.0\",\n  \"owner\": {\n    \"name\": \"Hendrik Geldenhuys\",\n    \"url\": \"https://github.com/hgeldenhuys\"\n  },\n  \"plugins\": [\n    {\n      \"name\": \"claude-agent-lifecycle\",\n      \"description\": \"Persistent agent lifecycle management with 6 lifespans (ephemeral, turn, context, session, workflow, project)\",\n      \"version\": \"1.0.0\",\n      \"source\": \"./\",\n      \"keywords\": [\"agent-lifecycle\", \"persistent-agents\", \"workflow\", \"hooks\"]\n    },\n    {\n      \"name\": \"claude-weave\",\n      \"description\": \"11-dimensional knowledge framework with Shadow Advisor, Librarian, and Bayesian fact tracking\",\n      \"version\": \"2.1.0\",\n      \"source\": {\n        \"source\": \"github\",\n        \"repo\": \"hgeldenhuys/claude-weave\"\n      },\n      \"keywords\": [\"knowledge-management\", \"institutional-memory\", \"shadow-advisor\"]\n    },\n    {\n      \"name\": \"claude-loom\",\n      \"description\": \"Autonomous SDLC orchestration with workflow-scoped story execution agents\",\n      \"version\": \"2.0.0\",\n      \"source\": {\n        \"source\": \"github\",\n        \"repo\": \"hgeldenhuys/claude-loom\"\n      },\n      \"keywords\": [\"sdlc\", \"orchestration\", \"workflow\", \"story-execution\"]\n    }\n  ]\n}\n",
        ".claude-plugin/plugin.json": "{\n  \"name\": \"claude-agent-lifecycle\",\n  \"description\": \"Persistent agent lifecycle management for Claude Code. Provides 6 agent lifespans (ephemeral, turn, context, session, workflow, project) with automatic disposal via hooks.\",\n  \"version\": \"1.0.0\",\n  \"author\": {\n    \"name\": \"Hendrik Geldenhuys\",\n    \"url\": \"https://github.com/hgeldenhuys\"\n  },\n  \"repository\": {\n    \"type\": \"git\",\n    \"url\": \"https://github.com/hgeldenhuys/claude-agent-lifecycle\"\n  },\n  \"license\": \"MIT\",\n  \"keywords\": [\n    \"agent-lifecycle\",\n    \"persistent-agents\",\n    \"workflow\",\n    \"session-management\",\n    \"hooks\"\n  ],\n  \"hooks\": {\n    \"Stop\": \"hooks/lifecycle-manager.ts\",\n    \"SessionEnd\": \"hooks/lifecycle-manager.ts\"\n  },\n  \"skills\": \".claude/skills/\"\n}\n",
        "README.md": "# Claude Agent Lifecycle\n\nPersistent agent lifecycle management for Claude Code. Create, resume, and dispose agents with automatic lifecycle management based on scope boundaries.\n\n## Features\n\n- **Six Agent Lifespans**: ephemeral, turn, context, session, workflow, project\n- **Automatic Disposal**: Hooks dispose agents at appropriate lifecycle events\n- **Persistent Storage**: File-based storage for session/workflow/project agents\n- **Memory Storage**: In-memory storage for ephemeral/turn/context agents\n- **Debug Mode**: Opt-in JSON logging for debugging and monitoring\n- **Hook Integration**: Uses `claude-hooks-sdk` for lifecycle event handling\n- **Claude Code Plugin**: Install via plugin marketplace with automatic hook wiring\n\n## Installation\n\n### As Claude Code Plugin (Recommended)\n\n```bash\n# Add the marketplace\n/plugin marketplace add hgeldenhuys/claude-agent-lifecycle\n\n# Install the plugin (hooks auto-wired)\n/plugin install claude-agent-lifecycle\n```\n\n### As npm Package\n\n```bash\n# Install the package\nbun add claude-agent-lifecycle\n\n# Run the installer to set up hooks\nbun scripts/install.ts\n```\n\n### Related Plugins\n\nThis plugin is the base for:\n- **[claude-weave](https://github.com/hgeldenhuys/claude-weave)** - 11D knowledge framework with Shadow Advisor\n- **[claude-loom](https://github.com/hgeldenhuys/claude-loom)** - SDLC orchestration with workflow agents\n\nInstall the full stack:\n```bash\n/plugin install claude-loom  # Installs all dependencies\n```\n\n## Quick Start\n\n```typescript\nimport { AgentRegistry } from '@anthropic/claude-agent-lifecycle';\n\nconst registry = new AgentRegistry();\n\n// Create a session-scoped agent\nconst { agent, isNew } = await registry.create({\n  lifespan: 'session',\n  name: 'shadow-advisor',\n  model: 'haiku',\n});\n\n// Resume later in the session\nconst shadow = await registry.resume('shadow-advisor');\n\n// Start a workflow-scoped agent\nconst executor = await registry.startWorkflow({\n  lifespan: 'workflow',\n  workflowId: 'FEAT-001',\n  name: 'story-executor',\n  model: 'sonnet',\n});\n\n// Complete workflow (disposes all workflow agents)\nawait registry.completeWorkflow('FEAT-001');\n```\n\n## Agent Lifespans\n\n| Lifespan | Scope | Auto-Disposal | Storage |\n|----------|-------|---------------|---------|\n| `ephemeral` | Single use | Immediately | Memory |\n| `turn` | Response cycle | Stop event | Memory |\n| `context` | Until compaction | Context reset | Memory |\n| `session` | Claude session | SessionEnd event | File |\n| `workflow` | Bounded work unit | Manual/complete | File |\n| `project` | Indefinite | Manual only | File |\n\n### Lifespan Details\n\n**ephemeral**: Fire-and-forget agents. Created, used once, and discarded.\n\n**turn**: Lives for one request-response cycle. Disposed when the assistant's response completes (Stop event).\n\n**context**: Lives until context window compaction. Useful for agents that should survive multiple turns but reset when context is cleared.\n\n**session**: Lives for the entire Claude Code session. Disposed when the session ends (SessionEnd event).\n\n**workflow**: Lives for a bounded unit of work (story, feature, task). Explicitly completed when work is done. Generic pattern - Loom uses this for stories.\n\n**project**: Lives indefinitely in the project. Must be manually disposed. Useful for singleton agents like Shadow Advisor.\n\n## API Reference\n\n### AgentRegistry\n\n```typescript\nconst registry = new AgentRegistry(options?: RegistryOptions);\n\ninterface RegistryOptions {\n  storagePath?: string;  // Default: '.agent/agents'\n  debug?: boolean;       // Enable debug logging\n}\n```\n\n#### Methods\n\n**create(config)**: Create or resume an agent\n```typescript\nconst { agent, isNew } = await registry.create({\n  lifespan: 'session',\n  name: 'my-agent',\n  sessionId: 'optional-session-id',\n  model: 'haiku', // optional\n  metadata: {},   // optional\n});\n```\n\n**resume(name, scope?)**: Resume an existing agent by name\n```typescript\nconst agent = await registry.resume('my-agent');\n```\n\n**dispose(agentId)**: Dispose a specific agent\n```typescript\nawait registry.dispose(agent.agentId);\n```\n\n**disposeByLifespan(lifespan)**: Dispose all agents of a lifespan type\n```typescript\nconst count = await registry.disposeByLifespan('turn');\n```\n\n**disposeByScope(scope)**: Dispose all agents in a scope\n```typescript\nconst count = await registry.disposeByScope('session-123');\n```\n\n**list(filter?)**: List agents matching a filter\n```typescript\nconst agents = await registry.list({ lifespan: 'session' });\n```\n\n### Workflow Methods\n\n**startWorkflow(config)**: Start a workflow-scoped agent\n```typescript\nconst agent = await registry.startWorkflow({\n  lifespan: 'workflow',\n  workflowId: 'FEAT-001',\n  name: 'executor',\n  workflowType: 'loom-story', // optional\n});\n```\n\n**completeWorkflow(workflowId)**: Complete a workflow and dispose its agents\n```typescript\nconst disposed = await registry.completeWorkflow('FEAT-001');\n```\n\n**getWorkflowAgents(workflowId)**: Get all agents for a workflow\n```typescript\nconst agents = await registry.getWorkflowAgents('FEAT-001');\n```\n\n## Hook Configuration\n\nHooks are automatically installed by the installer. They can also be manually configured:\n\n### Default Mode (Silent)\n\n```json\n{\n  \"hooks\": {\n    \"Stop\": [{\n      \"matcher\": \"*\",\n      \"hooks\": [{\n        \"type\": \"command\",\n        \"command\": \"bun \\\"$CLAUDE_PROJECT_DIR\\\"/.agent/hooks/lifecycle-manager.ts\"\n      }]\n    }],\n    \"SessionEnd\": [{\n      \"matcher\": \"*\",\n      \"hooks\": [{\n        \"type\": \"command\",\n        \"command\": \"bun \\\"$CLAUDE_PROJECT_DIR\\\"/.agent/hooks/lifecycle-manager.ts\"\n      }]\n    }]\n  }\n}\n```\n\n### Debug Mode\n\nEnable debug logging for troubleshooting:\n\n**Option 1: Environment Variable**\n```bash\nexport AGENT_LIFECYCLE_DEBUG=true\n```\n\n**Option 2: Command Flag**\n```json\n{\n  \"hooks\": {\n    \"Stop\": [{\n      \"matcher\": \"*\",\n      \"hooks\": [{\n        \"type\": \"command\",\n        \"command\": \"bun \\\"$CLAUDE_PROJECT_DIR\\\"/.agent/hooks/lifecycle-manager.ts --debug\"\n      }]\n    }]\n  }\n}\n```\n\n**Option 3: Per-Session**\n```bash\nAGENT_LIFECYCLE_DEBUG=true claude\n```\n\n### Debug Log Output\n\nWhen debug mode is enabled:\n\n**Console Output:**\n```\n[agent-lifecycle] SessionStart: abc-123 (source: new)\n[agent-lifecycle] Active agents: shadow-advisor(session), helper(turn)\n[agent-lifecycle] Stop: Disposed 1 turn-scoped agents\n[agent-lifecycle] SessionEnd: Disposed 2 agents for session abc-123\n```\n\n**File Output (JSON Lines):**\n```json\n{\"event\":\"agent:created\",\"timestamp\":\"2025-01-01T00:00:00Z\",\"agentId\":\"uuid\",\"agentName\":\"shadow\",\"lifespan\":\"session\",\"scope\":\"abc-123\"}\n{\"event\":\"agent:disposed\",\"timestamp\":\"2025-01-01T00:05:00Z\",\"agentId\":\"uuid\",\"agentName\":\"shadow\",\"lifespan\":\"session\",\"scope\":\"abc-123\"}\n```\n\nLog file location: `.agent/agents/lifecycle.log`\n\n## Storage Structure\n\n```\n.agent/\n├── agents/\n│   ├── lifecycle.log      # Debug logs (when enabled)\n│   ├── session/\n│   │   └── {session-id}/\n│   │       └── {agent-name}.json\n│   ├── workflow/\n│   │   └── {workflow-id}/\n│   │       └── {agent-name}.json\n│   └── project/\n│       └── {agent-name}.json\n└── hooks/\n    └── lifecycle-manager.ts\n```\n\n## Integration Examples\n\n### Shadow Advisor Pattern\n\n```typescript\nimport { AgentRegistry } from '@anthropic/claude-agent-lifecycle';\n\nconst registry = new AgentRegistry();\n\n// Create or resume shadow advisor for the session\nconst { agent: shadow, isNew } = await registry.create({\n  lifespan: 'session',\n  name: 'shadow-advisor',\n  model: 'haiku',\n  metadata: {\n    role: 'knowledge-retrieval',\n    preloadedKnowledge: ['weave', 'librarian'],\n  },\n});\n\nif (isNew) {\n  console.log('Created new shadow advisor');\n} else {\n  console.log(`Resumed shadow advisor (turn ${shadow.turnCount})`);\n}\n```\n\n### Loom Workflow Integration\n\n```typescript\nimport { AgentRegistry } from '@anthropic/claude-agent-lifecycle';\n\nconst registry = new AgentRegistry();\n\n// Start story execution\nconst executor = await registry.startWorkflow({\n  lifespan: 'workflow',\n  workflowId: 'ACCT-001',\n  name: 'story-executor',\n  workflowType: 'loom-story',\n  model: 'sonnet',\n});\n\n// Additional helpers for the workflow\nawait registry.startWorkflow({\n  lifespan: 'workflow',\n  workflowId: 'ACCT-001',\n  name: 'backend-dev',\n  model: 'sonnet',\n});\n\n// When story is complete\nawait registry.completeWorkflow('ACCT-001');\n// All workflow agents disposed\n```\n\n### Custom Cleanup\n\n```typescript\nimport { AgentRegistry } from '@anthropic/claude-agent-lifecycle';\n\nconst registry = new AgentRegistry();\n\n// Dispose all agents for a custom scope\nawait registry.disposeByScope('my-custom-scope');\n\n// Dispose specific lifespan\nawait registry.disposeByLifespan('context');\n```\n\n## Development\n\n```bash\n# Install dependencies\nbun install\n\n# Run tests\nbun test\n\n# Run unit tests only\nbun test tests/unit/\n\n# Run integration tests only\nbun test tests/integration/\n```\n\n## License\n\nMIT\n"
      },
      "plugins": [
        {
          "name": "claude-agent-lifecycle",
          "description": "Persistent agent lifecycle management with 6 lifespans (ephemeral, turn, context, session, workflow, project)",
          "version": "1.0.0",
          "source": "./",
          "keywords": [
            "agent-lifecycle",
            "persistent-agents",
            "workflow",
            "hooks"
          ],
          "categories": [
            "agent-lifecycle",
            "hooks",
            "persistent-agents",
            "workflow"
          ],
          "install_commands": [
            "/plugin marketplace add hgeldenhuys/claude-agent-lifecycle",
            "/plugin install claude-agent-lifecycle@claude-skills-marketplace"
          ]
        },
        {
          "name": "claude-weave",
          "description": "11-dimensional knowledge framework with Shadow Advisor, Librarian, and Bayesian fact tracking",
          "version": "2.1.0",
          "source": {
            "source": "github",
            "repo": "hgeldenhuys/claude-weave"
          },
          "keywords": [
            "knowledge-management",
            "institutional-memory",
            "shadow-advisor"
          ],
          "categories": [
            "institutional-memory",
            "knowledge-management",
            "shadow-advisor"
          ],
          "install_commands": [
            "/plugin marketplace add hgeldenhuys/claude-agent-lifecycle",
            "/plugin install claude-weave@claude-skills-marketplace"
          ]
        },
        {
          "name": "claude-loom",
          "description": "Autonomous SDLC orchestration with workflow-scoped story execution agents",
          "version": "2.0.0",
          "source": {
            "source": "github",
            "repo": "hgeldenhuys/claude-loom"
          },
          "keywords": [
            "sdlc",
            "orchestration",
            "workflow",
            "story-execution"
          ],
          "categories": [
            "orchestration",
            "sdlc",
            "story-execution",
            "workflow"
          ],
          "install_commands": [
            "/plugin marketplace add hgeldenhuys/claude-agent-lifecycle",
            "/plugin install claude-loom@claude-skills-marketplace"
          ]
        }
      ]
    },
    {
      "name": "ink-panels",
      "version": null,
      "description": "Terminal UI toolkit for Claude Code — explore data with interactive panels, inject runtime artifacts onto a canvas viewer.",
      "repo_full_name": "hgeldenhuys/ink-artefacts",
      "repo_url": "https://github.com/hgeldenhuys/ink-artefacts",
      "repo_description": null,
      "signals": {
        "stars": 0,
        "forks": 0,
        "pushed_at": "2026-02-19T09:46:54Z"
      },
      "files": {
        ".claude-plugin/marketplace.json": "{\n  \"name\": \"ink-panels\",\n  \"owner\": {\n    \"name\": \"Herman Geldenhuys\"\n  },\n  \"metadata\": {\n    \"description\": \"Terminal UI toolkit for Claude Code — explore data with interactive panels, inject runtime artifacts onto a canvas viewer.\",\n    \"version\": \"0.1.0\"\n  },\n  \"plugins\": [\n    {\n      \"name\": \"ink-panels\",\n      \"description\": \"Stack-based TUI framework with two modes: 'explore' (interactive panel apps) and 'canvas' (runtime artifact injection). Includes skills, library source, and example apps.\",\n      \"source\": \"./\",\n      \"version\": \"0.1.0\",\n      \"keywords\": [\n        \"tui\",\n        \"terminal\",\n        \"ink\",\n        \"react\",\n        \"panels\",\n        \"claude-code\",\n        \"artifacts\",\n        \"dashboard\",\n        \"explorer\",\n        \"canvas\"\n      ],\n      \"category\": \"developer-tools\"\n    }\n  ]\n}\n",
        ".claude-plugin/plugin.json": "{\n  \"name\": \"ink-panels\",\n  \"version\": \"0.1.0\",\n  \"description\": \"Stack-based terminal UI framework for Claude Code with two modes: 'explore' for interactive panel apps and 'canvas' for runtime artifact injection. Built on Ink (React for terminals).\",\n  \"author\": {\n    \"name\": \"Herman Geldenhuys\"\n  },\n  \"repository\": \"https://github.com/hgeldenhuys/ink-artefacts\",\n  \"license\": \"MIT\",\n  \"keywords\": [\n    \"tui\",\n    \"terminal\",\n    \"ink\",\n    \"react\",\n    \"panels\",\n    \"claude-code\",\n    \"artifacts\",\n    \"dashboard\",\n    \"explorer\",\n    \"canvas\"\n  ]\n}\n",
        "README.md": "# ink-panels\n\nStack-based terminal UI framework for Claude Code. Two modes: **explore** data with interactive drill-down panels, or **canvas** runtime artifacts onto a live viewer.\n\nBuilt on [Ink](https://github.com/vadimdemedes/ink) (React for terminals) with React 19, vim-style navigation, and automatic Claude Code state integration.\n\n```\n┌──────────────────────────────────────────────────────────┐\n│  Epics                                                   │\n│  ─────────────────────────────────────────────────────── │\n│  > [P0] Authentication System                            │\n│    [P1] Dashboard Redesign                               │\n│    [P1] API Rate Limiting                                │\n│    [P2] Dark Mode                                        │\n│                                                          │\n│  1/4                              j/k:move  Enter:select │\n├──────────────────────────────────────────────────────────┤\n│  Home › Epics                                    q:quit  │\n└──────────────────────────────────────────────────────────┘\n```\n\n## Features\n\n- **One panel at a time** — full terminal space, no split screens\n- **Stack navigation** — push/pop/replace with breadcrumb trail\n- **Forward/back history** — `[` and `]` like a browser, `Escape` clears forward\n- **Built-in panels** — ListPanel, TablePanel, DetailPanel (with search, badges, hotkeys)\n- **Custom panels** — any React component that accepts `PanelProps`\n- **Input lock** — modal editing without Escape conflicts (`useInputLock`)\n- **Claude state file** — writes `~/.claude/tui-state.json` on every interaction\n- **Canvas mode** — drop JSON files to `~/.claude/artifacts/` for live artifact tabs\n- **Requires TMUX** — Claude Code launches panels in a split pane; TMUX is how it gets a second terminal\n\n## Prerequisites\n\n- **TMUX** — Required. Claude Code runs in one pane and launches the TUI in an adjacent pane via `tmux split-window`. Without TMUX there's no way for Claude to programmatically open a side-by-side terminal. Install with `brew install tmux` (macOS) or `apt install tmux` (Linux).\n- **Node.js** — Required for running apps (Ink has stdin issues under Bun).\n- **Bun** — Recommended for package management (`bun install`, `bun add`).\n\nRecommended TMUX settings (in `~/.tmux.conf`):\n\n```\nset -sg escape-time 10          # prevent input lag\nset -g default-terminal \"tmux-256color\"  # proper color support\n```\n\n## Installation\n\n### As a Claude Code Plugin (Recommended)\n\n```bash\n/plugin marketplace add hgeldenhuys/ink-artefacts\n/plugin install ink-panels@ink-artefacts\n```\n\nThis gives Claude access to both skills:\n- **`building-tui-panels`** — triggered by \"explore my X\", \"build a TUI\", \"terminal dashboard\"\n- **`injecting-tui-artifacts`** — triggered by \"canvas X\", \"show me\", \"visualize this\"\n\n### Manual Setup\n\n```bash\ngit clone https://github.com/hgeldenhuys/ink-artefacts.git\ncd ink-artefacts\nbun install\n```\n\nCopy skills to your Claude config:\n\n```bash\ncp -r skills/building-tui-panels ~/.claude/skills/\ncp -r skills/injecting-tui-artifacts ~/.claude/skills/\n```\n\n## Quick Start\n\n### Explore Mode\n\nRun any of the example apps:\n\n```bash\n# Filesystem browser\nnode --import tsx examples/file-browser/index.tsx\n\n# 5-level scrum board (Epics → Features → Stories → Tasks → Detail)\nnode --import tsx examples/scrum-board/index.tsx\n\n# Database browser with FK resolution\nnode --import tsx examples/db-browser/index.tsx\n\n# Schema-driven YAML config editor\nnode --import tsx examples/yaml-editor/index.tsx\n\n# Edit any YAML file against a schema\nnode --import tsx examples/yaml-editor/index.tsx path/to/config.yaml path/to/schema.json\n\n# SWARM project explorer (recursive-ai integration)\nnode --import tsx examples/swarm-explorer/index.tsx [path-to-.swarm-dir]\n\n# Real-time system monitor\nnode --import tsx examples/system-monitor/index.tsx\n\n# Doc reader (markdown rendering + syntax highlighting)\nnode --import tsx examples/doc-reader/index.tsx [directory]\n\n# Git repository dashboard\nnode --import tsx examples/git-dashboard/index.tsx [repo-path]\n\n# Project overview dashboard\nnode --import tsx examples/project-dashboard/index.tsx [project-path]\n```\n\nOr use the npm scripts:\n\n```bash\nbun run explore:files\nbun run explore:scrum\nbun run explore:db\nbun run explore:yaml\nbun run explore:clock\nbun run explore:swarm\nbun run explore:sysmon\nbun run explore:docs\nbun run explore:git\nbun run explore:project\n```\n\n### Canvas Mode\n\nLaunch the artifact viewer, then drop JSON files into `~/.claude/artifacts/`:\n\n```bash\n# Start the viewer\nbun run canvas\n\n# In another terminal, inject an artifact\necho '{\"id\":\"demo\",\"title\":\"Demo\",\"type\":\"key-value\",\"data\":{\"Status\":\"OK\",\"Version\":\"1.0\"}}' > ~/.claude/artifacts/demo.json\n```\n\nThe viewer picks up new files instantly via `fs.watch()`. Use `[` and `]` to cycle tabs.\n\n## Examples\n\n### File Browser\nNavigate your filesystem with directory listings, file details, and syntax-highlighted previews. Demonstrates `ListPanel` → `DetailPanel` navigation.\n\n### Scrum Board\nFive levels deep: Epics → Features → Stories → Tasks → Task Detail. Shows factory function patterns and rich state annotations for Claude.\n\n### Database Browser\nMock database explorer with table schemas, data grids with `/` search, row detail views, and foreign key resolution. Demonstrates `TablePanel` with all column options.\n\n### YAML Editor\nSchema-driven config editor. Reads a YAML file and JSON schema, renders fields as an interactive form. Booleans toggle, enums cycle, strings/numbers edit inline. Demonstrates custom panels with `useInputLock` for modal input.\n\n### Clock & Timer\nBig ASCII-art digital clock with a built-in countdown timer. Press `t` to set a timer with hours/minutes/seconds, `Space` to start/pause. When the timer reaches zero the screen flashes red three times. Demonstrates real-time `setInterval` rendering and `useInputLock` for modal field editing.\n\n### SWARM Explorer\nInteractive browser for [recursive-ai](https://github.com/hgeldenhuys/recursive-ai) SWARM projects. Dashboard with story status bars, task/AC metrics, and knowledge dimension counts. Drill into stories to see acceptance criteria (with evidence), tasks (with agent assignments and dependency chains), knowledge items (filtered by E/Q/P dimension), and retrospectives with full metrics. Pass a `.swarm/` directory path as argument, or use the bundled sample data.\n\n### System Monitor\nReal-time system dashboard showing CPU usage with sparkline history, memory with progress bars, disk usage, and top processes sorted by CPU. Auto-refreshes every 1.5 seconds. Uses Unicode block characters for bars and braille-style sparklines. Color-coded thresholds: green (<40%), cyan (<70%), yellow (<90%), red (>90%).\n\n### Doc Reader\nBrowse and read documentation with rich rendering. Markdown files are rendered with full terminal styling (headers, bold, code blocks, lists) via `marked` + `marked-terminal`. Source code files get syntax highlighting via `ink-syntax-highlight` with language auto-detection. Supports scrolling with vim keys, line number toggle, and filtered file lists (only docs and source files shown). Pass a directory path as argument.\n\n### Git Dashboard\nInteractive repository overview with a giant gradient repo name header (`ink-big-text` + `ink-gradient`), loading spinner (`ink-spinner`), and tabbed sections for commits, branches, changes, and stats. Drill into commit details with `git show --stat`, browse branches with ahead/behind indicators, view staged/unstaged changes, and see contributor bar charts. All data from real `git` commands. Pass a repo path as argument.\n\n### Project Dashboard\nBeautiful Node.js project overview combining multiple Ink ecosystem libraries. Giant gradient project name, health checks (README, tests, CI, TypeScript, linter, CLAUDE.md), file type distribution with Unicode bar charts, dependency browser, script viewer with syntax-highlighted commands, directory size breakdown, and TODO/FIXME counter. Scans the actual project directory recursively. Pass a project path as argument.\n\n### Artifact Viewer (Canvas)\nWatches `~/.claude/artifacts/` for JSON descriptor files. Supports json-tree, disk-usage, table, key-value, file-list, diff-list, and log renderers. Each artifact gets its own tab with independent navigation.\n\n### Live Dashboard (Hooks)\nA Claude Code hooks integration that provides a real-time dashboard while Claude works. Uses `PostToolUse` and `Stop` hooks to write session-scoped artifacts that the canvas viewer picks up automatically.\n\n**Panels:**\n- **Tasks** — Live task progress extracted from the transcript. Shows in-progress, pending, and completed tasks with strikethrough styling.\n- **Files** — Recently edited files with drill-down diff view. Select a file and press Enter to see each edit's removed (red) and added (green) lines.\n\nInstall and launch:\n\n```bash\n# Install hooks into your project\nbun run dashboard:install\n\n# Launch the dashboard in a TMUX pane\ntmux split-window -h -p 50 -c /path/to/ink-panels \"NODE_ENV=production node --import tsx examples/artifact-viewer/index.tsx\"\n```\n\nOr configure hooks manually in your project's `.claude/settings.json`:\n\n```json\n{\n  \"hooks\": {\n    \"PostToolUse\": [\n      {\n        \"matcher\": \".*\",\n        \"hooks\": [{ \"type\": \"command\", \"command\": \"bun \\\"$CLAUDE_PROJECT_DIR\\\"/ink-panels/hooks/dashboard-hook.ts\" }]\n      }\n    ],\n    \"Stop\": [\n      {\n        \"matcher\": \"\",\n        \"hooks\": [{ \"type\": \"command\", \"command\": \"bun \\\"$CLAUDE_PROJECT_DIR\\\"/ink-panels/hooks/dashboard-hook.ts\" }]\n      }\n    ]\n  }\n}\n```\n\n**How it works:**\n- `PostToolUse` fires after every tool call (Read, Write, Edit, Bash, etc.), updating files and re-parsing the transcript for task state.\n- `Stop` fires when Claude finishes responding, catching TaskCreate/TaskUpdate which don't trigger PostToolUse.\n- Artifacts are session-scoped (`session-{id}-01-tasks.json`) so they don't interfere with other artifacts.\n- The canvas viewer detects file changes via `fs.watch()` and live-updates the panels.\n\n## Architecture\n\n```\nink-panels/\n├── src/                          # Library source\n│   ├── components/\n│   │   ├── PanelStack.tsx        # Root component (manages stack, keys, state)\n│   │   ├── Breadcrumb.tsx        # Bottom bar with forward/back trail\n│   │   ├── TablePanel.tsx        # Data table with search\n│   │   ├── DetailPanel.tsx       # Key-value view with actions\n│   │   └── ListPanel.tsx         # Scrollable list with badges\n│   ├── hooks/\n│   │   ├── usePanelNavigation.ts # Stack + forward/back history\n│   │   ├── useStateFile.ts       # Debounced Claude state writer\n│   │   └── useInputLock.ts       # Modal input lock for PanelStack\n│   ├── types.ts                  # All TypeScript interfaces\n│   └── index.ts                  # Public exports\n├── examples/\n│   ├── file-browser/             # Filesystem explorer\n│   ├── scrum-board/              # Multi-level project board\n│   ├── db-browser/               # Database browser\n│   ├── yaml-editor/              # Schema-driven YAML editor\n│   ├── clock/                    # Digital clock & countdown timer\n│   ├── swarm-explorer/           # recursive-ai SWARM project browser\n│   ├── system-monitor/           # Real-time CPU/mem/disk/process dashboard\n│   ├── doc-reader/               # Markdown + syntax-highlighted code viewer\n│   ├── git-dashboard/            # Git repo overview with gradient header\n│   ├── project-dashboard/        # Node.js project health & stats\n│   └── artifact-viewer/          # Canvas mode viewer\n│       └── renderers/\n│           ├── json-tree.tsx      # JSON tree viewer\n│           ├── disk-usage.tsx     # Disk usage bars\n│           ├── table-view.tsx     # Table renderer\n│           ├── log-view.tsx       # Scrollable log\n│           └── diff-view.tsx      # Inline diff viewer (red/green)\n├── hooks/                        # Claude Code hooks\n│   ├── dashboard-hook.ts         # PostToolUse/Stop hook for live dashboard\n│   └── install-hooks.ts          # Installs hooks into project settings\n├── skills/                       # Claude Code skills\n│   ├── building-tui-panels/      # \"explore\" skill\n│   └── injecting-tui-artifacts/  # \"canvas\" skill\n└── .claude-plugin/               # Plugin marketplace metadata\n    ├── plugin.json\n    └── marketplace.json\n```\n\n## Key Concepts\n\n### Panel Navigation\n\nEvery panel receives `push`, `pop`, and `replace` functions:\n\n```tsx\n// Push a new panel onto the stack\nprops.push({ id: 'detail', title: 'Item', component: DetailPanel, data: {...} });\n\n// Go back one level\nprops.pop();\n\n// Replace current panel (no new breadcrumb entry)\nprops.replace(updatedPanel);\n```\n\nGlobal navigation keys handled by PanelStack:\n\n| Key | Action |\n|-----|--------|\n| `Escape` | Go back (clears forward history) |\n| `[` | Go back (preserves forward history) |\n| `]` | Go forward |\n| `q` | Quit (at root only) |\n\n### Claude State Integration\n\nPanelStack automatically writes `~/.claude/tui-state.json` on every navigation and state update:\n\n```json\n{\n  \"app\": \"my-app\",\n  \"timestamp\": \"2026-02-19T10:30:00Z\",\n  \"breadcrumb\": [\"Home\", \"Users\", \"Alice\"],\n  \"activePanel\": {\n    \"id\": \"user-detail\",\n    \"title\": \"Alice\",\n    \"state\": { \"type\": \"user-detail\", \"userId\": 42 }\n  }\n}\n```\n\nThis lets Claude Code know exactly what you're looking at in the TUI.\n\n### Input Lock\n\nCustom panels with modal input (text editing, search) should use `useInputLock()` to prevent PanelStack from intercepting Escape and other keys:\n\n```tsx\nconst inputLock = useInputLock();\n// inputLock.lock()   — claim keyboard (PanelStack ignores all keys)\n// inputLock.unlock() — release keyboard\n```\n\n## Runtime\n\n- **Always run with Node.js**: `node --import tsx app.tsx`\n- **Never run with Bun**: Ink's `useInput` has stdin issues under Bun\n- **Use Bun for package management**: `bun install`, `bun add`\n- **TMUX is required**: Claude Code launches panels via `tmux split-window -h -p 60 \"node --import tsx app.tsx\"` — without TMUX, you'd need to manually open a second terminal\n\n## License\n\nMIT\n"
      },
      "plugins": [
        {
          "name": "ink-panels",
          "description": "Stack-based TUI framework with two modes: 'explore' (interactive panel apps) and 'canvas' (runtime artifact injection). Includes skills, library source, and example apps.",
          "source": "./",
          "version": "0.1.0",
          "keywords": [
            "tui",
            "terminal",
            "ink",
            "react",
            "panels",
            "claude-code",
            "artifacts",
            "dashboard",
            "explorer",
            "canvas"
          ],
          "category": "developer-tools",
          "categories": [
            "artifacts",
            "canvas",
            "claude-code",
            "dashboard",
            "developer-tools",
            "explorer",
            "ink",
            "panels",
            "react",
            "terminal",
            "tui"
          ],
          "install_commands": [
            "/plugin marketplace add hgeldenhuys/ink-artefacts",
            "/plugin install ink-panels@ink-panels"
          ]
        }
      ]
    }
  ]
}