{
  "author": {
    "id": "hjertefolger",
    "display_name": "hjertefolger",
    "avatar_url": "https://avatars.githubusercontent.com/u/54318006?v=4"
  },
  "marketplaces": [
    {
      "name": "cortex",
      "version": null,
      "description": "Persistent local memory for Claude Code. Cross-session recall with vector search, automatic archiving, zero cloud dependencies.",
      "repo_full_name": "hjertefolger/cortex",
      "repo_url": "https://github.com/hjertefolger/cortex",
      "repo_description": "Persistent local memory for Claude Code. Longer sessions. Cross-session recall. Zero cloud.",
      "signals": {
        "stars": 133,
        "forks": 13,
        "pushed_at": "2026-01-29T21:44:57Z"
      },
      "files": {
        ".claude-plugin/marketplace.json": "{\n  \"name\": \"cortex\",\n  \"owner\": {\n    \"name\": \"Tomas Krajcik\",\n    \"email\": \"support@rootdeveloper.dev\"\n  },\n  \"metadata\": {\n    \"description\": \"Persistent local memory for Claude Code. Cross-session recall with vector search, automatic archiving, zero cloud dependencies.\",\n    \"version\": \"2.0.2\"\n  },\n  \"plugins\": [\n    {\n      \"name\": \"cortex\",\n      \"source\": \"./\",\n      \"description\": \"Persistent local memory for Claude Code. Longer sessions, cross-session recall, zero cloud.\",\n      \"category\": \"memory\",\n      \"tags\": [\n        \"memory\",\n        \"context\",\n        \"vector-search\",\n        \"embeddings\",\n        \"local-first\",\n        \"cross-session\"\n      ]\n    }\n  ]\n}",
        ".claude-plugin/plugin.json": "{\n  \"name\": \"cortex\",\n  \"version\": \"2.1.2\",\n  \"description\": \"Persistent local memory for Claude Code. Cross-session recall with vector search, automatic archiving, zero cloud dependencies.\",\n  \"author\": {\n    \"name\": \"Tomas Krajcik\",\n    \"email\": \"support@rootdeveloper.dev\",\n    \"url\": \"https://rootdeveloper.dev\"\n  },\n  \"homepage\": \"https://rootdeveloper.dev\",\n  \"repository\": \"https://github.com/hjertefolger/cortex\",\n  \"license\": \"MIT\",\n  \"keywords\": [\n    \"claude-code\",\n    \"memory\",\n    \"context\",\n    \"vector-search\",\n    \"embeddings\",\n    \"local-first\",\n    \"cross-session\"\n  ]\n}",
        "README.md": "# Cortex\n\n[![Version](https://img.shields.io/badge/version-2.1.2-blue.svg)](package.json)\n[![License](https://img.shields.io/badge/license-MIT-green.svg)](LICENSE)\n[![Node](https://img.shields.io/badge/node-%3E%3D18-brightgreen.svg)](package.json)\n[![Tests](https://img.shields.io/badge/tests-231%20passing-success.svg)](#testing)\n[![TypeScript](https://img.shields.io/badge/typescript-strict-blue.svg)](tsconfig.json)\n\n**Persistent local memory for Claude Code.** Longer sessions. Cross-session recall. Zero cloud.\n\n```\nÎ¨ 47 â—â—â—‹â—‹â—‹ 45% âœ“ 5m\n```\n\n## Why Cortex?\n\n| Problem | Cortex Solution |\n|---------|-----------------|\n| Session limits hit mid-task | Auto-save on context step (5%) & session end |\n| `/clear` wipes everything | SQLite persistence survives clears |\n| Re-explaining context every session | Hybrid search recalls relevant memories |\n| Cloud memory privacy concerns | 100% local â€” `~/.cortex/memory.db` |\n\n## Requirements\n\n- **Node.js**: 18.0.0 or higher\n- **Disk Space**: ~500MB (Includes 150MB embedding model cache + database growth)\n- **OS**: macOS or Linux (Windows supported via WSL2)\n\n## Install\n\nInside a Claude Code instance:\n\n**Step 1: Add the marketplace**\n```\n/plugin marketplace add hjertefolger/cortex\n```\n\n**Step 2: Install the plugin**\n\n<details>\n<summary><strong>âš ï¸ Linux users: Click here first</strong></summary>\n\nOn Linux, `/tmp` is often a separate filesystem (tmpfs), which causes plugin installation to fail with:\n```\nEXDEV: cross-device link not permitted\n```\n\n**Fix**: Set TMPDIR before installing:\n```bash\nmkdir -p ~/.cache/tmp && TMPDIR=~/.cache/tmp claude\n```\n\nThen run the install command below in that session.\n\n</details>\n\n```\n/plugin install cortex\n```\n\n**Step 3: Run the setup wizard**\n\nAsk Claude to run the setup skill:\n```\nPlease setup Cortex (or run /cortex-setup manually)\n```\n\nThe wizard will initialize the database, download the embedding model, and configure the statusline.\n\n**Step 4: Customize settings**\n\nAsk Claude to configure your preferences:\n```\nPlease configure Cortex (or run /cortex-configure manually)\n```\n\nDone! Restart Claude Code to activate the statusline.\n\n## ğŸ”„ Updating\n\nTo update Cortex to the latest version:\n\n**Step 1: Update the marketplace**\n```\n/plugin marketplace update cortex\n```\n\n**Step 2: Update the plugin**\n```\n/plugin update cortex\n```\n\n**Step 3: Run the setup wizard**\n\nAsk Claude to run the setup skill:\n```\nPlease setup Cortex (or run /cortex-setup manually)\n```\n\nThe wizard will install dependencies and download the embedding model for the new version. Your memories and configuration in `~/.cortex/` are preserved.\n\n**Step 4: Restart Claude Code** to load the new version.\n\n> **Note:** Due to a [known Claude Code issue](https://github.com/anthropics/claude-code/issues/14061),\n> always update the marketplace first. After restart, you can ask Claude to verify\n> the update by checking if the cached plugin matches the latest release.\n\n## Statusline\n\nThe statusline is configured automatically by `/cortex-setup`. Restart Claude Code after setup to see it.\n\n```\nÎ¨ 47 â—â—â—‹â—‹â—‹ 45% âœ“ 5m\n```\n\n- `Î¨` â€” Cortex identifier\n- `47` â€” Memory fragment count (compact: 1.1K, 10.2M, etc.)\n- `â—â—â—‹â—‹â—‹` â€” Context usage (filled/empty circles, color-coded)\n- `45%` â€” Context percentage\n- `â ‹ Saving` â€” Animated spinner during background save\n- `âœ“ Autosaved` â€” Success indicator (shows for ~5s after save)\n- `âœ“ 5m` â€” Time since last save\n\n## Architecture\n\n```\n                           â”Œâ”€â”€â”€â”€â”€â”€â”€â”€â”€â”€â”€â”€â”€â”€â”€â”€â”€â”€â”€â”€â”€â”€â”€â”€â”€â”€â”€â”€â”€â”€â”€â”€â”€â”€â”€â”€â”€â”€â”\n                           â”‚           Claude Code                â”‚\n                           â””â”€â”€â”€â”€â”€â”€â”€â”€â”€â”€â”€â”€â”€â”€â”¬â”€â”€â”€â”€â”€â”€â”€â”€â”€â”€â”€â”€â”€â”€â”€â”€â”€â”€â”€â”€â”€â”€â”€â”˜\n                                          â”‚ stdin (JSON)\n                           â”Œâ”€â”€â”€â”€â”€â”€â”€â”€â”€â”€â”€â”€â”€â”€â–¼â”€â”€â”€â”€â”€â”€â”€â”€â”€â”€â”€â”€â”€â”€â”€â”€â”€â”€â”€â”€â”€â”€â”€â”\n                           â”‚         Command Router               â”‚\n                           â”‚         (src/index.ts)               â”‚\n                           â””â”€â”€â”€â”€â”€â”€â”€â”€â”€â”€â”€â”€â”€â”€â”¬â”€â”€â”€â”€â”€â”€â”€â”€â”€â”€â”€â”€â”€â”€â”€â”€â”€â”€â”€â”€â”€â”€â”€â”˜\n                                          â”‚\n              â”Œâ”€â”€â”€â”€â”€â”€â”€â”€â”€â”€â”€â”€â”€â”€â”€â”€â”€â”€â”€â”€â”€â”€â”€â”€â”€â”€â”€â”¼â”€â”€â”€â”€â”€â”€â”€â”€â”€â”€â”€â”€â”€â”€â”€â”€â”€â”€â”€â”€â”€â”€â”€â”€â”€â”€â”€â”\n              â”‚                           â”‚                           â”‚\n   â”Œâ”€â”€â”€â”€â”€â”€â”€â”€â”€â”€â–¼â”€â”€â”€â”€â”€â”€â”€â”€â”€â”€â”    â”Œâ”€â”€â”€â”€â”€â”€â”€â”€â”€â”€â–¼â”€â”€â”€â”€â”€â”€â”€â”€â”€â”€â”    â”Œâ”€â”€â”€â”€â”€â”€â”€â”€â”€â”€â–¼â”€â”€â”€â”€â”€â”€â”€â”€â”€â”€â”\n   â”‚     Database        â”‚    â”‚     Embeddings      â”‚    â”‚      Search         â”‚\n   â”‚   (sql.js/WASM)     â”‚    â”‚  (Nomic Embed v1.5) â”‚    â”‚  (Vector + FTS5)    â”‚\n   â”‚   + FTS5 + Backup   â”‚    â”‚     768 dims        â”‚    â”‚    + RRF Fusion     â”‚\n   â””â”€â”€â”€â”€â”€â”€â”€â”€â”€â”€â”¬â”€â”€â”€â”€â”€â”€â”€â”€â”€â”€â”˜    â””â”€â”€â”€â”€â”€â”€â”€â”€â”€â”€â”¬â”€â”€â”€â”€â”€â”€â”€â”€â”€â”€â”˜    â””â”€â”€â”€â”€â”€â”€â”€â”€â”€â”€â”¬â”€â”€â”€â”€â”€â”€â”€â”€â”€â”€â”˜\n              â”‚                           â”‚                           â”‚\n              â””â”€â”€â”€â”€â”€â”€â”€â”€â”€â”€â”€â”€â”€â”€â”€â”€â”€â”€â”€â”€â”€â”€â”€â”€â”€â”€â”€â”¼â”€â”€â”€â”€â”€â”€â”€â”€â”€â”€â”€â”€â”€â”€â”€â”€â”€â”€â”€â”€â”€â”€â”€â”€â”€â”€â”€â”˜\n                                          â”‚\n                           â”Œâ”€â”€â”€â”€â”€â”€â”€â”€â”€â”€â”€â”€â”€â”€â–¼â”€â”€â”€â”€â”€â”€â”€â”€â”€â”€â”€â”€â”€â”€â”€â”€â”€â”€â”€â”€â”€â”€â”€â”\n                           â”‚      ~/.cortex/memory.db             â”‚\n                           â”‚      (SQLite + Embeddings)           â”‚\n                           â””â”€â”€â”€â”€â”€â”€â”€â”€â”€â”€â”€â”€â”€â”€â”€â”€â”€â”€â”€â”€â”€â”€â”€â”€â”€â”€â”€â”€â”€â”€â”€â”€â”€â”€â”€â”€â”€â”€â”˜\n```\n\n### Module Overview\n\n| Module | Lines | Responsibility |\n|--------|-------|----------------|\n| `index.ts` | 836 | Command router, hooks, statusline |\n| `mcp-server.ts` | 850 | MCP protocol, 11 tools exposed |\n| `database.ts` | 1143 | SQLite, FTS5, backups, recovery |\n| `archive.ts` | 873 | Transcript parsing, chunking |\n| `embeddings.ts` | 337 | Nomic Embed v1.5, quantization |\n| `search.ts` | 308 | Hybrid search, RRF fusion |\n| `config.ts` | 563 | Zod validation, presets |\n| `analytics.ts` | 288 | Session tracking, insights |\n\n**Total: ~5,700 lines TypeScript**\n\n## Search Algorithm\n\nCortex uses a hybrid search combining three signals:\n\n```\nâ”Œâ”€â”€â”€â”€â”€â”€â”€â”€â”€â”€â”€â”€â”€â”€â”€â”€â”€â”€â”€â”€â”€â”€â”€â”€â”€â”€â”€â”€â”€â”€â”€â”€â”€â”€â”€â”€â”€â”€â”€â”€â”€â”€â”€â”€â”€â”€â”€â”€â”€â”€â”€â”€â”€â”€â”€â”€â”€â”€â”€â”€â”€â”€â”€â”€â”€â”\nâ”‚                        Query: \"auth flow\"                       â”‚\nâ””â”€â”€â”€â”€â”€â”€â”€â”€â”€â”€â”€â”€â”€â”€â”€â”€â”€â”€â”€â”€â”€â”€â”€â”€â”€â”¬â”€â”€â”€â”€â”€â”€â”€â”€â”€â”€â”€â”€â”€â”€â”€â”€â”€â”€â”€â”€â”€â”€â”€â”€â”€â”€â”€â”€â”€â”€â”€â”€â”€â”€â”€â”€â”€â”€â”€â”˜\n                          â”‚\n         â”Œâ”€â”€â”€â”€â”€â”€â”€â”€â”€â”€â”€â”€â”€â”€â”€â”€â”¼â”€â”€â”€â”€â”€â”€â”€â”€â”€â”€â”€â”€â”€â”€â”€â”€â”\n         â–¼                â–¼                â–¼\n   â”Œâ”€â”€â”€â”€â”€â”€â”€â”€â”€â”€â”    â”Œâ”€â”€â”€â”€â”€â”€â”€â”€â”€â”€â”    â”Œâ”€â”€â”€â”€â”€â”€â”€â”€â”€â”€â”\n   â”‚  Vector  â”‚    â”‚  FTS5    â”‚    â”‚ Recency  â”‚\n   â”‚  Search  â”‚    â”‚ Keyword  â”‚    â”‚  Decay   â”‚\n   â”‚  (60%)   â”‚    â”‚  (40%)   â”‚    â”‚ (7-day)  â”‚\n   â””â”€â”€â”€â”€â”¬â”€â”€â”€â”€â”€â”˜    â””â”€â”€â”€â”€â”¬â”€â”€â”€â”€â”€â”˜    â””â”€â”€â”€â”€â”¬â”€â”€â”€â”€â”€â”˜\n        â”‚               â”‚               â”‚\n        â””â”€â”€â”€â”€â”€â”€â”€â”€â”€â”€â”€â”€â”€â”€â”€â”¼â”€â”€â”€â”€â”€â”€â”€â”€â”€â”€â”€â”€â”€â”€â”€â”˜\n                        â–¼\n              â”Œâ”€â”€â”€â”€â”€â”€â”€â”€â”€â”€â”€â”€â”€â”€â”€â”€â”€â”€â”\n              â”‚   RRF Fusion     â”‚\n              â”‚    (k=60)        â”‚\n              â””â”€â”€â”€â”€â”€â”€â”€â”€â”¬â”€â”€â”€â”€â”€â”€â”€â”€â”€â”˜\n                       â–¼\n              â”Œâ”€â”€â”€â”€â”€â”€â”€â”€â”€â”€â”€â”€â”€â”€â”€â”€â”€â”€â”\n              â”‚  Ranked Results  â”‚\n              â””â”€â”€â”€â”€â”€â”€â”€â”€â”€â”€â”€â”€â”€â”€â”€â”€â”€â”€â”˜\n```\n\n- **Vector similarity**: Cosine distance on 768-dim embeddings\n- **FTS5 keyword**: BM25 ranking with sqlite full-text search\n- **RRF fusion**: `1/(k + rank)` aggregation across both lists\n- **Recency decay**: 7-day half-life weights recent memories higher\n\n## Commands\n\n### User-Invocable Skills\n\nSkills are for multi-step workflows. Atomic operations use MCP tools directly.\n\n| Command | Purpose |\n|---------|---------|\n| `/cortex-setup` | First-time initialization wizard |\n| `/cortex-configure <preset>` | Apply configuration preset |\n| `/cortex-manage` | Delete or manage memories |\n\n### MCP Tools (Claude-invocable)\n\n| Tool | Purpose | Side Effects |\n|------|---------|--------------|\n| `cortex_recall` | Search memory | Read-only |\n| `cortex_remember` | Save specific insight | Creates memory |\n| `cortex_save` | Archive full session | Creates memories |\n| `cortex_stats` | Get statistics + list projects | Read-only |\n| `cortex_restore` | Get restoration context | Read-only |\n| `cortex_analytics` | Usage insights | Read-only |\n| `cortex_update` | Update memory content/project | Modifies memory |\n| `cortex_rename_project` | Bulk rename project | Modifies memories |\n| `cortex_delete` | Delete memory | **Destructive** |\n| `cortex_forget_project` | Delete project memories | **Destructive** |\n\n#### `cortex_remember` vs `cortex_save`\n\n```\ncortex_remember(\"JWT refresh tokens must use httpOnly cookies\")\n  â†’ Creates ONE memory fragment from the string\n\ncortex_save()\n  â†’ Parses transcript, extracts HIGH-VALUE content, creates MULTIPLE fragments\n```\n\n## Hooks\n\n| Hook | Trigger | Behavior |\n|------|---------|----------|\n| `SessionStart` | New session | Shows memory count, injects awareness + restoration context |\n| `PostToolUse` | After any tool | Monitors context %, triggers auto-save |\n| `PreCompact` | Before `/clear` | Archives session, prepares restoration |\n\n## Configuration\n\n**Location:** `~/.cortex/config.json`\n\n```json\n{\n  \"statusline\": {\n    \"enabled\": true,\n    \"showFragments\": true,\n    \"showLastArchive\": true,\n    \"showContext\": true\n  },\n  \"archive\": {\n    \"projectScope\": true,\n    \"minContentLength\": 50\n  },\n  \"autosave\": {\n    \"onSessionEnd\": true,\n    \"onPreCompact\": true,\n    \"contextStep\": {\n       \"enabled\": true,\n       \"step\": 5\n    }\n  },\n  \"restoration\": {\n    \"tokenBudget\": 2000,\n    \"messageCount\": 5,\n    \"turnCount\": 3\n  },\n  \"awareness\": {\n    \"enabled\": false,\n    \"userName\": null,\n    \"timezone\": null\n  }\n}\n```\n\n### Presets\n\n```bash\n/cortex-configure full       # All features (statusline, auto-archive, warnings)\n/cortex-configure essential  # Statusline + auto-archive only\n/cortex-configure minimal    # Commands only, no automation\n```\n\n### Key Settings\n\n| Setting | Default | Description |\n|---------|---------|-------------|\n| `autosave.contextStep.step` | 5 | % context increase to trigger auto-save |\n| `autosave.onPreCompact` | true | Archive session before `/compact` or `/clear` |\n| `autosave.onSessionEnd` | true | Archive session on exit (`Ctrl+C` x2) |\n| `restoration.tokenBudget` | 2000 | Max tokens for key decision restoration |\n| `restoration.turnCount` | 3 | Number of raw conversation turns to restore |\n| `awareness.enabled` | false | Inject user/date/time at session start and after clear |\n| `awareness.userName` | null | User name shown in awareness context |\n| `awareness.timezone` | null | IANA timezone (null = auto-detect, `\"off\"` = omit date/time) |\n\n## Database Schema\n\n```sql\nCREATE TABLE memories (\n  id INTEGER PRIMARY KEY AUTOINCREMENT,\n  content TEXT NOT NULL,\n  content_hash TEXT UNIQUE,        -- SHA256 for deduplication\n  embedding BLOB NOT NULL,         -- 768 Ã— float32 = 3KB\n  project_id TEXT,                 -- NULL for global scope\n  source_session TEXT,\n  timestamp DATETIME DEFAULT CURRENT_TIMESTAMP\n);\n\nCREATE INDEX idx_memories_project_id ON memories(project_id);\nCREATE INDEX idx_memories_timestamp ON memories(timestamp);\nCREATE INDEX idx_memories_content_hash ON memories(content_hash);\n\n-- Optional FTS5 (graceful fallback to LIKE if unavailable)\nCREATE VIRTUAL TABLE memories_fts USING fts5(content);\n```\n\n### Backup Strategy\n\n- **Auto-backup**: Created on database open\n- **Rotation**: Keeps 5 most recent backups\n- **Recovery**: Tests each backup until one validates\n- **Atomic writes**: temp file + rename pattern\n\n## Data Storage\n\n```\n~/.cortex/\nâ”œâ”€â”€ memory.db              # SQLite database (~2-3MB per 1000 memories)\nâ”œâ”€â”€ memory.db.backup.*     # Rotated backups (max 5)\nâ”œâ”€â”€ config.json            # User configuration\nâ”œâ”€â”€ analytics.json         # Session tracking\nâ””â”€â”€ autoSaveState.json     # Transient state\n```\n\n## Testing\n\n```bash\nnpm test\n```\n\n> **Note**: `npm test` runs with **synthetic/fake data** for speed and isolation.\n\n### Running with Real Data (E2E)\n\nTo test against a real production transcript (35MB+):\n\n1. **Locate a real transcript**:\n   Find a large `.jsonl` file in your `~/.claude/` directory.\n\n2. **Place it in tests**:\n   Copy it to `tests/sample_transcript.jsonl`.\n   ```bash\n   cp ~/.claude/your-session-id.jsonl tests/sample_transcript.jsonl\n   ```\n\n3. **Run the E2E test**:\n   ```bash\n   node --test tests/e2e_transcript.test.js\n   ```\n\n**200+ tests** covering:\n- Database CRUD, deduplication, recovery\n- Vector and keyword search (Hybrid RRF)\n- Archive parsing, chunking, and value extraction\n- MCP tool handlers and stdin processing\n- Configuration presets and validation\n- Real-world E2E transcript replay\n\n```\nâœ” Analytics Module (14 tests)\nâœ” Archive Module (35 tests)\nâœ” Config Module (5 tests)\nâœ” Database Module (38 tests)\nâœ” Embeddings Module (8 tests)\nâœ” Search Module (31 tests)\nâœ” Integration Tests (21 tests)\nâœ” MCP Tool Handlers (5 tests)\nâœ” Auto-Save Logic (10 tests)\nâœ” E2E Transcript Replay (2 tests)\n\nâ„¹ tests 231\nâ„¹ suites 54\nâ„¹ pass 231\nâ„¹ fail 0\n```\n\n## Development\n\n```bash\nnpm install            # Install dependencies\nnpm run build          # Build index.js + mcp-server.js + copy WASM\nnpm run build:index    # Build main entry only\nnpm run build:mcp      # Build MCP server only\nnpm run typecheck      # TypeScript strict check\nnpm test               # Run test suite\n```\n\n### Build Output\n\n```\ndist/\nâ”œâ”€â”€ index.js           # 302KB - Main entry point\nâ”œâ”€â”€ mcp-server.js      # 277KB - MCP server\nâ””â”€â”€ sql-wasm.wasm      # 660KB - SQLite WebAssembly\n```\n\n### Testing Commands Manually\n\n```bash\n# Test stats command\necho '{\"cwd\":\"/tmp/test\"}' | node dist/index.js stats\n\n# Test recall\necho '{\"cwd\":\"/tmp/test\"}' | node dist/index.js recall \"authentication\"\n\n# Test MCP server\necho '{\"jsonrpc\":\"2.0\",\"method\":\"tools/list\",\"id\":1}' | node dist/mcp-server.js\n```\n\n## Performance\n\n| Operation | Typical Latency |\n|-----------|-----------------|\n| Embedding generation | ~100ms |\n| Vector search (1000 memories) | ~50ms |\n| FTS5 keyword search | ~10ms |\n| Hybrid search (combined) | ~100ms |\n| Database insert | ~5ms + embedding |\n\n**Memory footprint**: ~50MB base (includes Nomic Embed model)\n\n## Requirements\n\n- **Node.js**: â‰¥18.0.0\n- **Claude Code**: â‰¥2.0.12\n- **Disk**: ~50MB for model + database\n\n## Error Handling\n\nCortex implements defensive error handling:\n\n- **Database corruption**: Auto-recovery from rotated backups\n- **FTS5 unavailable**: Graceful fallback to LIKE queries\n- **Embedding failures**: Logged, operation continues\n- **Stdin parse errors**: Discriminated union with context\n- **Missing config**: Auto-created with defaults\n\n## Security\n\n- **Zero cloud**: All data local to `~/.cortex/`\n- **No telemetry**: No external network calls\n- **Plaintext storage**: Acceptable for local-only use\n- **Deduplication**: SHA256 hash prevents duplicates\n\n## Troubleshooting\n\n### Database integrity check\n```\n/cortex-manage\n```\n\n### Reset to defaults\n```bash\nrm -rf ~/.cortex\n/cortex-setup\n```\n\n### View raw database\n```bash\nsqlite3 ~/.cortex/memory.db \"SELECT id, substr(content, 1, 50), timestamp FROM memories ORDER BY timestamp DESC LIMIT 10;\"\n```\n\n### Check embedding model\n```bash\nls -la ~/.cache/huggingface/hub/models--nomic-ai--nomic-embed-text-v1.5/\n```\n\n## Contributors\n\nThanks to everyone who has contributed to Cortex!\n\n- [@mikelane](https://github.com/mikelane) â€” Statusline chaining ([#1](https://github.com/hjertefolger/cortex/pull/1))\n- [@djayatillake](https://github.com/djayatillake) â€” Setup command fix ([#4](https://github.com/hjertefolger/cortex/pull/4))\n\n## License\n\nMIT\n\n## Author\n\n**Tomas Krajcik**\n- Website: [rootdeveloper.dev](https://rootdeveloper.dev)\n- Email: support@rootdeveloper.dev\n\n---\n\n<p align=\"center\">\n  <i>Built for developers who value their context.</i>\n</p>\n"
      },
      "plugins": [
        {
          "name": "cortex",
          "source": "./",
          "description": "Persistent local memory for Claude Code. Longer sessions, cross-session recall, zero cloud.",
          "category": "memory",
          "tags": [
            "memory",
            "context",
            "vector-search",
            "embeddings",
            "local-first",
            "cross-session"
          ],
          "categories": [
            "context",
            "cross-session",
            "embeddings",
            "local-first",
            "memory",
            "vector-search"
          ],
          "install_commands": [
            "/plugin marketplace add hjertefolger/cortex",
            "/plugin install cortex@cortex"
          ]
        }
      ]
    }
  ]
}