{
  "author": {
    "id": "huangdijia",
    "display_name": "Deeka Wong",
    "avatar_url": "https://avatars.githubusercontent.com/u/8337659?u=9f99a277843bead3af3b492e7e148eff2b458dcc&v=4"
  },
  "marketplaces": [
    {
      "name": "oh-my-claude-code-plugins",
      "version": "1.0.0",
      "description": "A comprehensive marketplace collection of Claude Code plugins featuring AI agents, Git workflow automation, MCP integrations, and specialized development tools to enhance your productivity.",
      "repo_full_name": "huangdijia/oh-my-claude-code-plugins",
      "repo_url": "https://github.com/huangdijia/oh-my-claude-code-plugins",
      "repo_description": "Claude Plugin Marketplace",
      "signals": {
        "stars": 7,
        "forks": 0,
        "pushed_at": "2025-12-13T10:32:05Z"
      },
      "files": {
        ".claude-plugin/marketplace.json": "{\n  \"$schema\": \"https://anthropic.com/claude-code/marketplace.schema.json\",\n  \"name\": \"oh-my-claude-code-plugins\",\n  \"version\": \"1.0.0\",\n  \"description\": \"A comprehensive marketplace collection of Claude Code plugins featuring AI agents, Git workflow automation, MCP integrations, and specialized development tools to enhance your productivity.\",\n  \"owner\": {\n    \"name\": \"Deeka Wong\",\n    \"email\": \"huangdijia@gmail.com\"\n  },\n  \"metadata\": {\n    \"description\": \"A curated marketplace offering a comprehensive collection of Claude Code plugins including AI agents for specialized tasks, Git workflow automation, MCP server integrations, and development tools designed to enhance productivity and streamline development workflows.\"\n  },\n  \"plugins\": [\n    {\n      \"name\": \"subagents\",\n      \"description\": \"Boost your development workflow with AI-powered agents for code review, debugging, and strategic planning.\",\n      \"source\": \"./plugins/subagents\",\n      \"category\": \"development\"\n    },\n    {\n      \"name\": \"git\",\n      \"description\": \"Enhance your Git experience with Claude's Git plugin for seamless version control.\",\n      \"source\": \"./plugins/git\",\n      \"category\": \"development\"\n    },\n    {\n      \"name\": \"git-flow\",\n      \"description\": \"Automate Git workflows with ease using GitFlow plugin for Claude.\",\n      \"source\": \"./plugins/git-flow\",\n      \"category\": \"development\"\n    },\n    {\n      \"name\": \"mcp\",\n      \"description\": \"MCP (Model Context Protocol) for Claude Code, enabling advanced mcp interactions.\",\n      \"source\": \"./plugins/mcp\",\n      \"category\": \"development\"\n    },\n    {\n      \"name\": \"skills\",\n      \"description\": \"Specialized development skills for feature development and code review workflows.\",\n      \"source\": \"./plugins/skills\",\n      \"category\": \"development\"\n    }\n  ]\n}",
        "README.md": "# Claude Code Plugins\n\nA curated collection of custom agents and slash commands to enhance [Claude Code](https://claude.ai/code) with powerful development workflows. [ä¸­æ–‡ç‰ˆ](README_CN.md)\n\n## ğŸŒŸ Features\n\n### ğŸ¤– Specialized AI Agents (subagents plugin)\n\n**Development Workflow Agents:**\n\n- **strategic-planner** - Expert software architect for feature planning and technical design\n- **task-executor** - Precision engineer for atomic task implementation\n- **code-reviewer** - Automated code quality and security review specialist\n\n**Supporting Agents:**\n\n- **steering-architect** - Project analysis and documentation architect\n- **data-scientist** - SQL queries, BigQuery operations, and data analysis\n- **debugger** - Error troubleshooting and root cause analysis\n- **prd-writer** - Product requirements document generation\n\n### âš¡ Git Workflow Commands\n\n**Git Flow Branch Management (git plugin):**\n\n- `/git:feature <name>` - Create a new feature branch from develop\n- `/git:hotfix <name>` - Create a new hotfix branch from main\n- `/git-flow:status` - Display comprehensive Git Flow status\n\n**GitHub (git-flow plugin):**\n\n- `/git-flow:pr:create` - Create Pull Requests with automated branch management\n- `/git-flow:pr:review` - Comprehensive PR code review with structured analysis\n\n**GitLab (git-flow plugin):**\n\n- `/git-flow:mr:create` - Create Merge Requests\n- `/git-flow:mr:review` - MR review with customizable scope (performance, security, style)\n\n**Git Commit (git-flow plugin):**\n\n- `/git-flow:commit:create` - Generate semantic commits from staged changes\n\n### ğŸ”Œ MCP Servers (mcp plugin)\n\nPre-configured MCP servers for enhanced capabilities:\n\n- **context7** - Up-to-date documentation retrieval for any library\n- **sequential-thinking** - Structured problem-solving through chain of thought\n- **memory** - Persistent knowledge graph for conversation context\n- **tavily-mcp** - Powerful web search and content extraction\n- **chrome-devtools** - Browser automation and debugging\n\n### ğŸ› ï¸ Development Skills (skills plugin)\n\nSpecialized skills for specific development workflows:\n\n- **feature-dev** - Guided feature development with codebase understanding and architecture focus\n- **code-review** - Advanced code review capabilities for quality, security, and maintainability\n\n### ğŸª Git Hooks (git-flow plugin)\n\nAutomated workflows triggered by events:\n\n- **php-cs-fixer** - Auto-format PHP files on write/edit\n- **auto-git-add** - Automatically stage modified files\n- **smart-commit** - Intelligent commit message generation\n\n## ğŸ“¦ Installation\n\n### Install from GitHub\n\n1. Run the following command in Claude Code:\n\n```bash\nclaude plugin marketplace add huangdijia/oh-my-claude-code-plugins\n```\n\n2. Install the plugins:\n\n```bash\nclaude plugin install subagents@oh-my-claude-code-plugins\nclaude plugin install git@oh-my-claude-code-plugins\nclaude plugin install git-flow@oh-my-claude-code-plugins\nclaude plugin install mcp@oh-my-claude-code-plugins\nclaude plugin install skills@oh-my-claude-code-plugins\n```\n\n## ğŸš€ Quick Start\n\n### Spec-Driven Development Workflow\n\nThis plugin implements a three-phase development workflow:\n\n#### 1. Planning Phase\n\nUse the strategic planner to design your feature:\n\n```markdown\nUse the strategic-planner agent to help me plan a user authentication feature\n```\n\nThis creates structured specs in `specs/<feature-name>/`:\n\n- `requirements.md` - User stories with acceptance criteria\n- `design.md` - Technical blueprint with diagrams\n- `tasks.md` - Granular task checklist\n\n#### 2. Execution Phase\n\nExecute tasks one-by-one with surgical precision:\n\n```markdown\nUse the task-executor agent to implement the next task from specs/user-auth/tasks.md\n```\n\nThe agent will:\n\n- Execute exactly one task at a time\n- Update task checkboxes `[ ]` â†’ `[x]`\n- Run tests before marking complete\n- Support autonomous mode for unattended execution\n\n#### 3. Review Phase\n\nAutomated quality assurance:\n\n```bash\nUse the code-reviewer agent to review my recent changes\n```\n\n### Using Development Skills\n\n**Feature Development:**\n\n```markdown\nUse the feature-dev skill to help me implement a user authentication system\n```\n\n**Code Review:**\n\n```markdown\nUse the code-review skill to review my recent changes\n```\n\n### Using Slash Commands\n\n**Create a commit:**\n\n```bash\n/git-flow:commit:create\n```\n\n**Create and review PRs:**\n\n```bash\n/git-flow:pr:create\n/git-flow:pr:review 123\n```\n\n**Review with specific scope:**\n\n```bash\n/git-flow:mr:review 456 performance\n/git-flow:mr:review 789 security\n```\n\n## ğŸ“š Documentation\n\n### Agent Workflow Pattern\n\nThe plugin implements a sophisticated multi-agent system:\n\n```bash\nâ”Œâ”€â”€â”€â”€â”€â”€â”€â”€â”€â”€â”€â”€â”€â”€â”€â”€â”€â”€â”€â”€â”€â”€â”€â”€â”€â”€â”€â”€â”€â”€â”€â”€â”€â”€â”€â”€â”€â”€â”€â”€â”€â”€â”€â”€â”€â”€â”€â”€â”€â”€â”€â”€â”€â”€â”€â”€â”€â”\nâ”‚  Phase 1: Strategic Planning                            â”‚\nâ”‚  â†’ Analyze requirements                                 â”‚\nâ”‚  â†’ Create technical designs                             â”‚\nâ”‚  â†’ Generate task checklists                             â”‚\nâ””â”€â”€â”€â”€â”€â”€â”€â”€â”€â”€â”€â”€â”€â”€â”€â”€â”¬â”€â”€â”€â”€â”€â”€â”€â”€â”€â”€â”€â”€â”€â”€â”€â”€â”€â”€â”€â”€â”€â”€â”€â”€â”€â”€â”€â”€â”€â”€â”€â”€â”€â”€â”€â”€â”€â”€â”€â”€â”˜\n                 â”‚\nâ”Œâ”€â”€â”€â”€â”€â”€â”€â”€â”€â”€â”€â”€â”€â”€â”€â”€â–¼â”€â”€â”€â”€â”€â”€â”€â”€â”€â”€â”€â”€â”€â”€â”€â”€â”€â”€â”€â”€â”€â”€â”€â”€â”€â”€â”€â”€â”€â”€â”€â”€â”€â”€â”€â”€â”€â”€â”€â”€â”\nâ”‚  Phase 2: Task Execution                                â”‚\nâ”‚  â†’ Execute one atomic task                              â”‚\nâ”‚  â†’ Run tests and validation                             â”‚\nâ”‚  â†’ Mark task complete                                   â”‚\nâ”‚  â†’ Repeat for next task                                 â”‚\nâ””â”€â”€â”€â”€â”€â”€â”€â”€â”€â”€â”€â”€â”€â”€â”€â”€â”¬â”€â”€â”€â”€â”€â”€â”€â”€â”€â”€â”€â”€â”€â”€â”€â”€â”€â”€â”€â”€â”€â”€â”€â”€â”€â”€â”€â”€â”€â”€â”€â”€â”€â”€â”€â”€â”€â”€â”€â”€â”˜\n                 â”‚\nâ”Œâ”€â”€â”€â”€â”€â”€â”€â”€â”€â”€â”€â”€â”€â”€â”€â”€â–¼â”€â”€â”€â”€â”€â”€â”€â”€â”€â”€â”€â”€â”€â”€â”€â”€â”€â”€â”€â”€â”€â”€â”€â”€â”€â”€â”€â”€â”€â”€â”€â”€â”€â”€â”€â”€â”€â”€â”€â”€â”\nâ”‚  Phase 3: Quality Assurance                             â”‚\nâ”‚  â†’ Review code quality                                  â”‚\nâ”‚  â†’ Check security issues                                â”‚\nâ”‚  â†’ Verify maintainability                               â”‚\nâ””â”€â”€â”€â”€â”€â”€â”€â”€â”€â”€â”€â”€â”€â”€â”€â”€â”€â”€â”€â”€â”€â”€â”€â”€â”€â”€â”€â”€â”€â”€â”€â”€â”€â”€â”€â”€â”€â”€â”€â”€â”€â”€â”€â”€â”€â”€â”€â”€â”€â”€â”€â”€â”€â”€â”€â”€â”€â”˜\n```\n\n### Project Initialization\n\nUse the steering-architect agent to set up project governance:\n\n```markdown\nUse the steering-architect agent to analyze this project\n```\n\nThis creates `.ai-rules/` files:\n\n- `product.md` - Product vision and goals\n- `tech.md` - Technology stack and commands\n- `structure.md` - File organization conventions\n\n### Tool Restrictions\n\nEach agent has specific tool access for security:\n\n| Agent | Tools | Code Execution |\n|-------|-------|----------------|\n| strategic-planner | file_edit, file_search, web_search | âŒ No |\n| task-executor | file_edit, bash, file_search | âœ… Yes |\n| code-reviewer | file_search, bash, file_edit | âœ… Yes |\n| steering-architect | file_edit, file_search, bash | âœ… Yes |\n| data-scientist | bash, file_search, file_edit | âœ… Yes |\n| debugger | file_search, file_edit, bash | âœ… Yes |\n| prd-writer | file_edit, web_search, file_search | âŒ No |\n\n## ğŸ—ï¸ Project Structure\n\n```bash\noh-my-claude-code-plugins/\nâ”œâ”€â”€ .claude-plugin/\nâ”‚   â””â”€â”€ marketplace.json          # Plugin registry\nâ””â”€â”€ plugins/\n    â”œâ”€â”€ subagents/                # AI agents plugin\n    â”‚   â””â”€â”€ agents/               # AI agent definitions\n    â”‚       â”œâ”€â”€ code-reviewer.md\n    â”‚       â”œâ”€â”€ data-scientist.md\n    â”‚       â”œâ”€â”€ debugger.md\n    â”‚       â”œâ”€â”€ prd-writer.md\n    â”‚       â”œâ”€â”€ steering-architect.md\n    â”‚       â”œâ”€â”€ strategic-planner.md\n    â”‚       â””â”€â”€ task-executor.md\n    â”œâ”€â”€ git/                      # Git commands plugin\n    â”‚   â””â”€â”€ commands/             # Slash commands\n    â”‚       â”œâ”€â”€ feature.md\n    â”‚       â””â”€â”€ hotfix.md\n    â”œâ”€â”€ git-flow/                 # Git Flow automation plugin\n    â”‚   â”œâ”€â”€ commands/             # Slash commands\n    â”‚   â”‚   â”œâ”€â”€ commit/\n    â”‚   â”‚   â”‚   â””â”€â”€ create.md\n    â”‚   â”‚   â”œâ”€â”€ mr/\n    â”‚   â”‚   â”‚   â”œâ”€â”€ create.md\n    â”‚   â”‚   â”‚   â””â”€â”€ review.md\n    â”‚   â”‚   â”œâ”€â”€ pr/\n    â”‚   â”‚   â”‚   â”œâ”€â”€ create.md\n    â”‚   â”‚   â”‚   â””â”€â”€ review.md\n    â”‚   â”‚   â””â”€â”€ status.md\n    â”‚   â””â”€â”€ hooks/                # Event hooks\n    â”‚       â”œâ”€â”€ auto-git-add.json\n    â”‚       â”œâ”€â”€ php-cs-fixer.json\n    â”‚       â””â”€â”€ smart-commit.json\n    â”œâ”€â”€ mcp/                      # MCP servers plugin\n    â”‚   â””â”€â”€ .mcp.json\n    â””â”€â”€ skills/                   # Development skills plugin\n        â”œâ”€â”€ code-review/\n        â”‚   â””â”€â”€ SKILL.md\n        â””â”€â”€ feature-dev/\n            â””â”€â”€ SKILL.md\n```\n\n## ğŸ¯ Use Cases\n\n### Feature Development\n\n```text\n1. Plan: Use strategic-planner to design feature\n2. Build: Use task-executor to implement tasks\n3. Review: Use code-reviewer to validate quality\n```\n\n### Code Review Automation\n\n```bash\n# Automated PR review with security focus\n/git-flow:pr:review 123 security\n```\n\n### Project Setup\n\n```markdown\n# Initialize project documentation\nUse the steering-architect agent to set up project standards\n```\n\n### Data Analysis\n\n```markdown\n# SQL and data analysis\nUse the data-scientist agent to analyze user metrics from the database\n```\n\n## ğŸŒ Language Support\n\nSeveral components output in Chinese for the target user base:\n\n- Code review feedback\n- PR/MR review analysis\n- Agent instructions (bilingual)\n\n**Note:** The debugger agent filename is `debugger.md` (with 'g') - the previous typo has been fixed.\n\n## ğŸ“– Advanced Usage\n\n### Autonomous Task Execution\n\nEnable autonomous mode for unattended task execution:\n\n```markdown\nUse the task-executor agent in autonomous mode to complete all remaining tasks\n```\n\nThe agent will:\n\n- Execute tasks sequentially without stopping\n- Mark tasks complete automatically\n- Only pause on errors or completion\n\n### Custom Scope Reviews\n\nFocus code reviews on specific aspects:\n\n```bash\n/git-flow:pr:review 123 performance    # Focus on performance issues\n/git-flow:pr:review 456 security       # Focus on security vulnerabilities\n/git-flow:pr:review 789 style          # Focus on code style and conventions\n```\n\n### Spec Management\n\nOrganize features with spec directories:\n\n```bash\nspecs/\nâ”œâ”€â”€ user-authentication/\nâ”‚   â”œâ”€â”€ requirements.md\nâ”‚   â”œâ”€â”€ design.md\nâ”‚   â””â”€â”€ tasks.md\nâ”œâ”€â”€ payment-integration/\nâ”‚   â”œâ”€â”€ requirements.md\nâ”‚   â”œâ”€â”€ design.md\nâ”‚   â””â”€â”€ tasks.md\n```\n\n## âš™ï¸ Configuration\n\nThe plugin is registered in `.claude-plugin/marketplace.json`:\n\n```json\n{\n  \"name\": \"oh-my-claude-code-plugins\",\n  \"owner\": {\n    \"name\": \"Deeka Wong\",\n    \"email\": \"huangdijia@gmail.com\"\n  },\n  \"plugins\": [\n    {\n      \"name\": \"subagents\",\n      \"source\": \"./plugins/subagents\",\n      \"description\": \"Boost your development workflow with AI-powered agents for code review, debugging, and strategic planning.\",\n      \"category\": \"development\"\n    },\n    {\n      \"name\": \"git\",\n      \"source\": \"./plugins/git\",\n      \"description\": \"Enhance your Git experience with Claude's Git plugin for seamless version control.\",\n      \"category\": \"development\"\n    },\n    {\n      \"name\": \"git-flow\",\n      \"source\": \"./plugins/git-flow\",\n      \"description\": \"Automate Git workflows with ease using GitFlow plugin for Claude.\",\n      \"category\": \"development\"\n    },\n    {\n      \"name\": \"mcp\",\n      \"source\": \"./plugins/mcp\",\n      \"description\": \"MCP (Model Context Protocol) for Claude Code, enabling advanced mcp interactions.\",\n      \"category\": \"development\"\n    },\n    {\n      \"name\": \"skills\",\n      \"source\": \"./plugins/skills\",\n      \"description\": \"Specialized development skills for feature development and code review workflows.\",\n      \"category\": \"development\"\n    }\n  ]\n}\n```\n\n## ğŸ¤ Contributing\n\nContributions are welcome! This repository is designed to be a marketplace for Claude Code plugins.\n\n### Adding New Agents\n\n1. Create a new `.md` file in `plugins/subagents/agents/`\n2. Add YAML frontmatter with name, description, and tools\n3. Define agent instructions in markdown\n\n### Adding New Commands\n\n1. Create a new `.md` file in appropriate plugin directory:\n   - `plugins/git/commands/` for git commands\n   - `plugins/git-flow/commands/` for git-flow commands\n2. Add YAML frontmatter with allowed-tools and description\n3. Define command prompt with dynamic context\n\n### Adding New Hooks\n\n1. Create a new `.json` file in `plugins/git-flow/hooks/`\n2. Configure the hook event and command to execute\n\n## ğŸ“„ License\n\nMIT License - See LICENSE file for details\n\n## ğŸ”— Links\n\n- [Claude Code Documentation](https://docs.claude.com/en/docs/claude-code)\n- [Plugin Development Guide](https://docs.claude.com/en/docs/claude-code/plugins)\n\n## âœ¨ Credits\n\nDeveloped by [@huangdijia](https://github.com/huangdijia)\n\n---\n\n**Note:** This plugin requires [Claude Code](https://claude.ai/code) to function. Make sure you have Claude Code installed and configured.\n"
      },
      "plugins": [
        {
          "name": "subagents",
          "description": "Boost your development workflow with AI-powered agents for code review, debugging, and strategic planning.",
          "source": "./plugins/subagents",
          "category": "development",
          "categories": [
            "development"
          ],
          "install_commands": [
            "/plugin marketplace add huangdijia/oh-my-claude-code-plugins",
            "/plugin install subagents@oh-my-claude-code-plugins"
          ]
        },
        {
          "name": "git",
          "description": "Enhance your Git experience with Claude's Git plugin for seamless version control.",
          "source": "./plugins/git",
          "category": "development",
          "categories": [
            "development"
          ],
          "install_commands": [
            "/plugin marketplace add huangdijia/oh-my-claude-code-plugins",
            "/plugin install git@oh-my-claude-code-plugins"
          ]
        },
        {
          "name": "git-flow",
          "description": "Automate Git workflows with ease using GitFlow plugin for Claude.",
          "source": "./plugins/git-flow",
          "category": "development",
          "categories": [
            "development"
          ],
          "install_commands": [
            "/plugin marketplace add huangdijia/oh-my-claude-code-plugins",
            "/plugin install git-flow@oh-my-claude-code-plugins"
          ]
        },
        {
          "name": "mcp",
          "description": "MCP (Model Context Protocol) for Claude Code, enabling advanced mcp interactions.",
          "source": "./plugins/mcp",
          "category": "development",
          "categories": [
            "development"
          ],
          "install_commands": [
            "/plugin marketplace add huangdijia/oh-my-claude-code-plugins",
            "/plugin install mcp@oh-my-claude-code-plugins"
          ]
        },
        {
          "name": "skills",
          "description": "Specialized development skills for feature development and code review workflows.",
          "source": "./plugins/skills",
          "category": "development",
          "categories": [
            "development"
          ],
          "install_commands": [
            "/plugin marketplace add huangdijia/oh-my-claude-code-plugins",
            "/plugin install skills@oh-my-claude-code-plugins"
          ]
        }
      ]
    }
  ]
}