{
  "author": {
    "id": "husniadil",
    "display_name": "Husni Adil Makmur",
    "avatar_url": "https://avatars.githubusercontent.com/u/10581130?u=819b8b810c85f061dca9b7bb166229b65b99ccf3&v=4"
  },
  "marketplaces": [
    {
      "name": "cc-hooks-plugin",
      "version": null,
      "description": "Official marketplace for cc-hooks - Audio feedback and TTS announcements for Claude Code",
      "repo_full_name": "husniadil/cc-hooks",
      "repo_url": "https://github.com/husniadil/cc-hooks",
      "repo_description": "Audio feedback plugin for Claude Code with TTS announcements, sound effects, and contextual AI messages. Supports multiple providers and languages.",
      "signals": {
        "stars": 11,
        "forks": 2,
        "pushed_at": "2025-12-26T11:34:00Z"
      },
      "files": {
        ".claude-plugin/marketplace.json": "{\n  \"name\": \"cc-hooks-plugin\",\n  \"owner\": {\n    \"name\": \"Husni Adil Makmur\",\n    \"email\": \"husniadil@gmail.com\"\n  },\n  \"metadata\": {\n    \"description\": \"Official marketplace for cc-hooks - Audio feedback and TTS announcements for Claude Code\",\n    \"version\": \"1.0.12\"\n  },\n  \"plugins\": [\n    {\n      \"name\": \"cc-hooks-plugin\",\n      \"source\": \"./\",\n      \"description\": \"Audio feedback system with multilingual TTS announcements, AI-powered contextual messages, and sound effects for Claude Code. Features include: prerecorded sounds (offline), Google TTS (free), ElevenLabs (premium), contextual AI completion messages via OpenRouter, multi-language support, granular silent modes, and multi-instance support for concurrent sessions.\",\n      \"version\": \"1.0.12\",\n      \"author\": {\n        \"name\": \"Husni Adil Makmur\",\n        \"email\": \"husniadil@gmail.com\"\n      },\n      \"homepage\": \"https://github.com/husniadil/cc-hooks#readme\",\n      \"repository\": \"https://github.com/husniadil/cc-hooks\",\n      \"license\": \"MIT\",\n      \"keywords\": [\n        \"audio\",\n        \"tts\",\n        \"text-to-speech\",\n        \"hooks\",\n        \"productivity\",\n        \"ai-translation\",\n        \"multilingual\",\n        \"elevenlabs\",\n        \"gtts\",\n        \"openrouter\",\n        \"sound-effects\",\n        \"voice-feedback\",\n        \"automation\"\n      ],\n      \"category\": \"productivity\",\n      \"tags\": [\"audio\", \"tts\", \"productivity\", \"ai\", \"multilingual\"]\n    }\n  ]\n}\n",
        ".claude-plugin/plugin.json": "{\n  \"name\": \"cc-hooks-plugin\",\n  \"version\": \"1.0.12\",\n  \"description\": \"Audio feedback system with multilingual TTS announcements, AI-powered contextual messages, and sound effects for Claude Code. Transform your coding experience with intelligent voice feedback that keeps you informed without breaking your flow.\",\n  \"author\": {\n    \"name\": \"Husni Adil Makmur\",\n    \"email\": \"husniadil@gmail.com\",\n    \"url\": \"https://github.com/husniadil\"\n  },\n  \"homepage\": \"https://github.com/husniadil/cc-hooks#readme\",\n  \"repository\": \"https://github.com/husniadil/cc-hooks\",\n  \"license\": \"MIT\",\n  \"keywords\": [\n    \"audio\",\n    \"tts\",\n    \"text-to-speech\",\n    \"hooks\",\n    \"productivity\",\n    \"ai-translation\",\n    \"multilingual\",\n    \"elevenlabs\",\n    \"gtts\",\n    \"openrouter\",\n    \"sound-effects\",\n    \"voice-feedback\",\n    \"automation\",\n    \"development-tools\"\n  ]\n}\n",
        "README.md": "# cc-hooks\n\n![cc-hooks Banner](public/banner.png)\n\n[![License: MIT](https://img.shields.io/badge/License-MIT-yellow.svg)](https://opensource.org/licenses/MIT)\n[![DeepWiki](https://img.shields.io/badge/DeepWiki-cc--hooks-blue)](https://deepwiki.com/husniadil/cc-hooks)\n[![Claude Code](https://img.shields.io/badge/Claude%20Code-Enhanced-orange)](https://www.anthropic.com/claude-code)\n[![Audio](https://img.shields.io/badge/Audio-TTS%20%2B%20Sound%20Effects-purple)]()\n\n**Give Claude Code a voice!** Transform your coding experience with intelligent audio feedback,\nmultilingual TTS announcements, and AI-powered contextual messages.\n\n## Why cc-hooks?\n\nWorking with Claude Code is powerful, but it can feel silent and disconnected. **cc-hooks** brings\nyour coding sessions to life:\n\n- ðŸŽ¯ **Stay in the flow** - Audio cues keep you informed without breaking focus\n- ðŸ”Š **Instant feedback** - Know when tools start, complete, or when Claude needs your attention\n- ðŸ—£ï¸ **Smart announcements** - Context-aware messages that understand what you're working on\n- ðŸŒ **Your language** - TTS support for multiple languages (English, Indonesian, Spanish, and more)\n- âš¡ **Zero config** - Works out of the box, customize when you need it\n- ðŸŽ›ï¸ **Flexible control** - From complete silence to premium AI voices, you choose\n\n## Quick Demo\n\n[![ElevenLabs TTS Demo](public/thumbnail.png)](https://www.youtube.com/watch?v=VXkKhgeZ-xU)\n\n_Watch cc-hooks in action with premium ElevenLabs text-to-speech_\n\n## Features\n\n### ðŸŽµ Audio Feedback System\n\n- **Sound effects** for different events (tool execution, notifications, completions)\n- **Voice announcements** for session lifecycle and task completions\n- **Multiple TTS providers**: Prerecorded sounds (offline), Google TTS (free), ElevenLabs (premium)\n- **Smart fallback chain** - automatically tries next provider if one fails\n\n### ðŸ¤– AI-Powered Intelligence (Optional)\n\n- **Contextual completion messages** - \"I've successfully implemented the authentication system you\n  requested\"\n- **Smart tool announcements** - Understands what Claude is doing and why\n- **Automatic translation** - AI messages in your preferred language\n- **Cost optimized** - Disabled by default, enable per session when needed\n\n### âš™ï¸ Advanced Capabilities\n\n- **Multi-instance support** - Run multiple Claude sessions with different audio configs\n- **Granular silent modes** - Disable just announcements or just sound effects\n- **Per-session configuration** - Change settings without editing config files\n- **Auto-cleanup** - Smart session management prevents resource leaks\n- **Status line integration** - See current session info in Claude Code UI\n\n## Installation\n\n### Choose Your Installation Mode\n\n| Feature               | Plugin Mode â­ Recommended | Standalone Mode               |\n| --------------------- | -------------------------- | ----------------------------- |\n| **Setup Complexity**  | âœ… Simple (3 commands)     | âš ï¸ Manual hooks configuration |\n| **Updates**           | âœ… One command             | âš ï¸ Git pull + restart         |\n| **Slash Commands**    | âœ… Built-in                | âŒ Not available              |\n| **Hooks Config**      | âœ… Automatic               | âš ï¸ Manual (settings.json)     |\n| **Installation Path** | Fixed location             | âœ… User-defined               |\n| **For Contributors**  | âš ï¸ Limited                 | âœ… Full source access         |\n| **Recommended for**   | **Most users**             | Developers, testers           |\n\n[**â†’ Continue with Plugin Installation**](#plugin-installation-recommended) |\n[**â†’ Standalone Installation**](STANDALONE_README.md)\n\n---\n\n### Plugin Installation (Recommended)\n\n#### Prerequisites\n\n- **Python 3.12+** (recommended: 3.12.7)\n- **[uv](https://docs.astral.sh/uv/)** package manager\n- **Claude Code** CLI installed\n\n#### Quick Install\n\n**Option 1: CLI (Recommended - No REPL needed)**\n\n```bash\n# Add marketplace\nclaude plugin marketplace add https://github.com/husniadil/cc-hooks.git\n\n# Install plugin\nclaude plugin install cc-hooks-plugin@cc-hooks-plugin\n\n# Done! Start Claude to use\nclaude\n```\n\n**Option 2: Inside Claude REPL**\n\n```bash\n# Start Claude first\nclaude\n\n# Then in the REPL:\n/plugin marketplace add https://github.com/husniadil/cc-hooks.git\n/plugin install cc-hooks-plugin@cc-hooks-plugin\n\n# Restart Claude Code\n```\n\n**Start using!** Audio feedback works immediately with default prerecorded sounds. ðŸŽ‰\n\n#### Post-Installation Setup (Recommended)\n\nAfter installation, use the interactive setup wizard:\n\n```bash\n# Inside Claude REPL\n/cc-hooks-plugin:setup\n```\n\nThis wizard helps you:\n\n- âœ… Check system requirements (uv installation)\n- âœ… Set up convenient shell aliases (`cld` command)\n- âœ… Configure status line\n- âœ… Set up API keys for premium features\n- âœ… Choose preset configurations\n- âœ… Test your installation\n\n**Quick setup modes:**\n\n```bash\n/cc-hooks-plugin:setup check    # Check requirements and config only\n/cc-hooks-plugin:setup apikeys  # Focus on API key setup\n/cc-hooks-plugin:setup test     # Run installation tests\n```\n\n#### Status Line Setup (Optional)\n\nThe plugin includes a status line feature that shows session info in Claude Code UI. **This is not\nconfigured automatically** and requires manual setup in `~/.claude/settings.json`:\n\n```jsonc\n{\n  \"$schema\": \"https://json.schemastore.org/claude-code-settings.json\",\n  // ...\n  \"statusLine\": {\n    \"type\": \"command\",\n    \"command\": \"uv run ~/.claude/plugins/marketplaces/cc-hooks-plugin/status-lines/status_line.py\"\n  }\n}\n```\n\n**Benefits:**\n\n- Shows current TTS provider, language, and AI mode\n- Displays session info at a glance\n- Real-time status updates\n\n## Usage\n\n### Quick Start\n\n**Automated Setup (Easiest):**\n\n```bash\n# Inside Claude REPL\n/cc-hooks-plugin:setup\n```\n\n**Manual Setup:**\n\nAdd shell alias to your `.bashrc` or `.zshrc`:\n\n```bash\nalias cld='~/.claude/plugins/marketplaces/cc-hooks-plugin/claude.sh'\n```\n\nThen reload: `source ~/.bashrc` or `source ~/.zshrc`\n\n### Usage Examples\n\n```bash\n# Default: prerecorded sounds (offline, no config needed)\ncld\n\n# Google TTS in Indonesian\ncld --audio=gtts --language=id\n\n# Premium ElevenLabs voice\ncld --audio=elevenlabs\n\n# With AI-powered contextual messages\ncld --audio=gtts --ai=full --language=id\n\n# Silent mode for meetings\ncld --silent\n```\n\n## Configuration\n\n### CLI Flags Reference\n\n#### Audio Providers\n\n```bash\ncld --audio=prerecorded  # Offline sounds (default, no API key)\ncld --audio=gtts         # Google TTS (free, requires internet)\ncld --audio=elevenlabs   # Premium quality (requires API key)\n```\n\n| Provider        | Quality | Cost | Requires Internet | API Key |\n| --------------- | ------- | ---- | ----------------- | ------- |\n| **prerecorded** | Good    | Free | âŒ No             | âŒ No   |\n| **gtts**        | Great   | Free | âœ… Yes            | âŒ No   |\n| **elevenlabs**  | Premium | Paid | âœ… Yes            | âœ… Yes  |\n\n#### Language\n\n```bash\ncld --audio=gtts --language=id  # Indonesian\ncld --audio=gtts --language=es  # Spanish\ncld --audio=gtts --language=fr  # French\n```\n\nSupports any Google TTS or ElevenLabs language: `en`, `id`, `es`, `fr`, `de`, `ja`, and many more!\n\n#### AI Features\n\n```bash\ncld --ai=basic  # Contextual completion messages only\ncld --ai=full   # Completion + intelligent tool announcements\n```\n\n**Requires**: OpenRouter API key (`export OPENROUTER_API_KEY=your_key`)\n\n**What you get:**\n\n- \"I've successfully implemented the authentication system you requested\"\n- \"Running tests to validate the changes we just made\"\n- Messages automatically translated to your language\n\n**Cost**: Very affordable (~$0.15 per 1M tokens)\n\n#### Silent Modes\n\n```bash\ncld --silent                    # Complete silence\ncld --silent=announcements      # No TTS, keep sound effects\ncld --silent=sound-effects      # No sound effects, keep TTS\n```\n\n#### Advanced Flags\n\n```bash\n--elevenlabs-voice-id=ID        # Custom ElevenLabs voice\n--elevenlabs-model=MODEL        # ElevenLabs model (default: eleven_flash_v2_5)\n--openrouter-model=MODEL        # AI model (default: openai/gpt-4o-mini)\n--no-cache                      # Disable TTS caching (for testing)\n```\n\n### API Keys Setup\n\nFor ElevenLabs or AI features, set API keys as environment variables:\n\n```bash\n# Add to your .bashrc or .zshrc\nexport ELEVENLABS_API_KEY=your_key_here\nexport OPENROUTER_API_KEY=your_key_here\n```\n\n**Get your keys:**\n\n- **ElevenLabs**:\n  [elevenlabs.io/app/developers/api-keys](https://elevenlabs.io/app/developers/api-keys)\n- **OpenRouter**: [openrouter.ai/keys](https://openrouter.ai/keys) (free credits available)\n\n### Configuration File (Recommended)\n\n**Set your defaults once** - no need to use CLI flags every time!\n\n**Location**: `~/.claude/.cc-hooks/config.yaml`\n\n**Why use it?**\n\n- âœ… **For Zed/Editors**: Only way to customize (editors can't pass CLI flags)\n- âœ… **For Terminal**: Set once, run `claude` or `cld` - your preferences auto-apply\n- âœ… **Still flexible**: CLI flags override config when needed\n\n**Create config file:**\n\n```bash\n# Inside Claude REPL\n/cc-hooks-plugin:setup\n\n# Or manually create with defaults\nuv run ~/.claude/plugins/marketplaces/cc-hooks-plugin/utils/config_loader.py --create-example\n\n# Edit to your preferences\nnano ~/.claude/.cc-hooks/config.yaml\n```\n\n**Example config** (Indonesian with Google TTS):\n\n```yaml\naudio:\n  providers: gtts,prerecorded\n  language: id\n  cache_enabled: true\n\nopenrouter:\n  enabled: false\n```\n\n**Example config** (Premium with AI):\n\n```yaml\naudio:\n  providers: elevenlabs,gtts,prerecorded\n  language: en\n  cache_enabled: true\n\nelevenlabs:\n  voice_id: 21m00Tcm4TlvDq8ikWAM\n  model_id: eleven_flash_v2_5\n\nopenrouter:\n  enabled: true\n  model: openai/gpt-4o-mini\n  contextual_stop: true\n```\n\n**Priority**: CLI flags > Environment variables > Config file > Defaults\n\n**This means:**\n\n- Config file provides defaults for all sessions\n- Run `cld --language=es` to override for one session\n- Perfect for both Zed and terminal users!\n\n### Example Configurations\n\n```bash\n# Work setup: Indonesian TTS with Google\ncld --audio=gtts --language=id\n\n# Premium experience: ElevenLabs + AI features\ncld --audio=elevenlabs --ai=full\n\n# Meeting mode: Sound effects only\ncld --silent=announcements\n\n# Testing: Premium voice without cache\ncld --audio=elevenlabs --no-cache\n\n# Multi-session workflow\n# Terminal 1: Work project\ncd ~/work-project\ncld --audio=gtts --language=id\n\n# Terminal 2: Side project with premium\ncd ~/side-project\ncld --audio=elevenlabs --ai=full\n\n# Terminal 3: Silent for meetings\ncd ~/meeting-notes\ncld --silent\n```\n\n## Audio Event Mapping\n\n| Event            | Sound Effect | TTS Announcement               |\n| ---------------- | ------------ | ------------------------------ |\n| SessionStart     | -            | âœ… Always                      |\n| SessionEnd       | -            | âœ… Always                      |\n| PreToolUse       | tek.mp3      | âœ… With AI=full                |\n| PostToolUse      | cetek.mp3    | -                              |\n| UserPromptSubmit | klek.mp3     | -                              |\n| Notification     | tung.mp3     | -                              |\n| Stop             | -            | âœ… Always (contextual with AI) |\n| SubagentStop     | cetek.mp3    | -                              |\n| PreCompact       | -            | âœ… Always                      |\n\n**Notes:**\n\n- Sound effects play regardless of `--audio` flag (unless `--silent` or `--silent=sound-effects`)\n- TTS announcements use the configured provider (`--audio=prerecorded|gtts|elevenlabs`)\n- PreToolUse only announces with `--ai=full` (contextual tool messages)\n- Stop always announces, but uses AI contextual messages when `--ai=basic` or `--ai=full` is enabled\n\n## Updating cc-hooks\n\n### Check for Updates\n\nInside Claude REPL:\n\n```bash\n/cc-hooks-plugin:update\n```\n\nOr via CLI:\n\n```bash\nclaude plugin marketplace update cc-hooks-plugin\n```\n\n**The update command will:**\n\n- Detect your installation mode automatically\n- Check for available updates\n- Show current vs latest version\n- Install updates with your confirmation\n- Remind you to restart Claude Code\n\n**Alternative methods:**\n\n```bash\n# CLI (outside Claude REPL)\nclaude plugin marketplace update cc-hooks-plugin\n\n# Inside Claude REPL\n/plugin update cc-hooks-plugin@cc-hooks-plugin\n```\n\n**Important**: Restart Claude Code session after updating.\n\n## Troubleshooting\n\n### Quick Diagnostics\n\nRun `/cc-hooks-plugin:setup check` to verify your configuration.\n\n### Plugin Hook Metadata Error?\n\n**Error message:**\n\n```\nâŽ¿  SessionStart:startup says: Plugin hook error: Reading inline script metadata from `~/.claude/plugins/marketplaces/cc-hooks-plugin//hooks.py`\n   Installed 28 packages in 115ms\n```\n\n**Cause:** This typically occurs when Claude CLI is being auto-updated by Anthropic in the\nbackground.\n\n**Solution:** Simply restart your Claude session. The error should disappear after the update\ncompletes.\n\n### cc-hooks not starting with `--dangerously-skip-permissions` in new folders?\n\n**Symptom:** When running Claude Code with `--dangerously-skip-permissions` flag in a new/untrusted\nfolder, cc-hooks server doesn't start and hooks don't execute.\n\n**Cause:** Claude Code shows a trust prompt for new folders that requires explicit user approval:\n\n```\n Do you trust the files in this folder?\n /path/to/your/folder\n â¯ 1. Yes, proceed\n   2. No, exit\n```\n\nWhen using `--dangerously-skip-permissions`, this prompt doesn't appear but hooks also fail to\nexecute. This appears to be a limitation in how Claude Code handles the trust flow with this flag.\n\n**Solution:** Run Claude Code **without** the flag first to accept the trust prompt:\n\n```bash\n# First run: accept trust prompt (without skip-permissions flag)\ncld  # or: claude\n\n# Select \"Yes, proceed\" when prompted\n\n# Exit Claude Code\n\n# Subsequent runs: flag works normally\ncld --dangerously-skip-permissions  # Now hooks will work\n```\n\n**Why this works:** Once the folder is trusted, the approval is cached. Future sessions (even with\n`--dangerously-skip-permissions`) will execute hooks normally.\n\n**Note:** It's unclear whether this is a Claude Code bug or expected behavior. The flag is meant to\nskip permission prompts, but doesn't seem to handle the initial folder trust flow.\n\n### No audio at all?\n\n1. Check system audio is working\n2. Verify plugin is installed: `/plugin`\n3. Run setup wizard: `/cc-hooks-plugin:setup test`\n4. Check logs: `tail -f ~/.claude/.cc-hooks/logs/*.log`\n5. Test manually: `uv run ~/.claude/plugins/marketplaces/cc-hooks-plugin/utils/sound_player.py`\n\n### Google TTS not working?\n\n1. Check internet connection\n2. Test:\n   `uv run ~/.claude/plugins/marketplaces/cc-hooks-plugin/utils/tts_announcer.py --provider gtts SessionStart`\n\n### ElevenLabs not working?\n\n1. Verify API key: `printenv ELEVENLABS_API_KEY`\n2. Check quota at [elevenlabs.io](https://elevenlabs.io)\n3. Test:\n   `uv run ~/.claude/plugins/marketplaces/cc-hooks-plugin/utils/tts_announcer.py --provider elevenlabs SessionStart`\n\n### AI contextual messages not working?\n\n1. Verify API key: `printenv OPENROUTER_API_KEY`\n2. Use `--ai=basic` or `--ai=full` flag when starting\n3. Check OpenRouter API quota at [openrouter.ai](https://openrouter.ai)\n\n### Database Issues\n\nCheck database exists:\n\n```bash\nls -la ~/.claude/.cc-hooks/events.db\n```\n\nView recent events:\n\n```bash\nsqlite3 ~/.claude/.cc-hooks/events.db \"SELECT id, hook_event_name, status FROM events ORDER BY created_at DESC LIMIT 10;\"\n```\n\n## Data Storage\n\nThe plugin uses a shared data directory for persistence:\n\n```\n~/.claude/.cc-hooks/\nâ”œâ”€â”€ events.db          # Event queue database\nâ”œâ”€â”€ logs/              # Per-session logs\nâ”‚   â””â”€â”€ {pid}.log\nâ””â”€â”€ .tts_cache/        # Cached TTS audio (if enabled)\n```\n\n**Why shared?** This directory persists across plugin updates, allowing seamless upgrades without\nlosing data.\n\n## FAQ\n\n**Q: Do I need API keys to use cc-hooks?**\n\nNo! Default mode uses prerecorded sounds and works completely offline with no API keys required.\n\n**Q: Which TTS provider should I use?**\n\n- **Prerecorded**: Fastest, offline, no costs (great for starting)\n- **Google TTS**: Free, good quality, requires internet\n- **ElevenLabs**: Premium quality, costs money, best voices\n\n**Q: Can I use my own voice with ElevenLabs?**\n\nYes! Upload your voice at [elevenlabs.io/app/voice-lab](https://elevenlabs.io/app/voice-lab), then\nuse `--elevenlabs-voice-id=your_voice_id`\n\n**Q: How much do AI features cost?**\n\nOpenRouter has free credits to start. After that, costs vary by model. Use `--ai=basic` for minimal\ncosts (only completion messages). The default model is very cheap (~$0.15 per 1M tokens).\n\n**Q: Can I run multiple Claude sessions with different audio settings?**\n\nYes! Each session is independent. Run `cld --audio=gtts` in one terminal and `cld --silent` in\nanother.\n\n**Q: Does cc-hooks slow down Claude Code?**\n\nNo! cc-hooks uses a \"fire-and-forget\" pattern - hooks return immediately. Audio processing happens\nin the background without blocking Claude.\n\n**Q: What languages are supported?**\n\nAny language supported by Google TTS or ElevenLabs. Common ones: English (en), Indonesian (id),\nSpanish (es), French (fr), German (de), Japanese (ja), etc.\n\n**Q: Can I disable just the voice but keep sound effects?**\n\nYes! Use `--silent=announcements` to disable TTS while keeping sound effects.\n\n**Q: How do I migrate from standalone mode?**\n\nSee [MIGRATION.md](MIGRATION.md) for a comprehensive step-by-step guide.\n\n**Q: Can I use cc-hooks in CI/CD?**\n\nYes, use `--silent` mode to disable all audio in automated environments.\n\n**Q: Where are audio files cached?**\n\nTTS cache is in `~/.claude/.cc-hooks/.tts_cache/` directory. Delete it with\n`rm -rf ~/.claude/.cc-hooks/.tts_cache` to regenerate all audio.\n\n**Q: How do I contribute?**\n\nPull requests welcome! For development, use [Standalone Mode](STANDALONE_README.md). See\n[CLAUDE.md](CLAUDE.md) for development guide.\n\n## Advanced Usage\n\n### Custom ElevenLabs Voice\n\n1. Upload voice at [elevenlabs.io/app/voice-lab](https://elevenlabs.io/app/voice-lab)\n2. Get voice ID\n3. Use with flag:\n   ```bash\n   cld --audio=elevenlabs --elevenlabs-voice-id=your_voice_id\n   ```\n\n### Custom AI Model\n\nUse different AI models for contextual messages:\n\n```bash\ncld --ai=full --openrouter-model=google/gemini-2.5-flash-lite  # Faster, cheaper\ncld --ai=full --openrouter-model=anthropic/claude-3-haiku      # Better quality\n```\n\n### Multi-Instance Support\n\nRun multiple Claude sessions with different configurations simultaneously:\n\n```bash\n# Terminal 1: Work project with Indonesian TTS\ncld --audio=gtts --language=id\n\n# Terminal 2: Side project with premium voice + AI\ncld --audio=elevenlabs --ai=full\n\n# Terminal 3: Meeting mode (silent)\ncld --silent\n\n# Terminal 4: Testing with prerecorded only\ncld --audio=prerecorded\n```\n\nEach session runs independently with its own server and configuration!\n\n## Slash Commands Reference\n\ncc-hooks provides convenient slash commands for management:\n\n### Setup Command\n\nConfigure and test your installation:\n\n```bash\n/cc-hooks-plugin:setup           # Interactive setup wizard\n/cc-hooks-plugin:setup check     # Check system requirements\n/cc-hooks-plugin:setup apikeys   # Configure API keys\n/cc-hooks-plugin:setup test      # Test installation\n```\n\n### Update Command\n\nKeep cc-hooks up to date:\n\n```bash\n/cc-hooks-plugin:update          # Check and install updates\n```\n\n## Migrating from Standalone\n\nIf you previously used standalone installation, see [MIGRATION.md](MIGRATION.md) for a comprehensive\nmigration guide.\n\n**Quick summary:**\n\n1. Remove hooks from `~/.claude/settings.json`\n2. Install plugin via `claude plugin install cc-hooks-plugin@cc-hooks-plugin`\n3. Update shell alias to point to plugin path\n4. Export API keys to shell environment (if using)\n5. Test with `/cc-hooks-plugin:setup check`\n\nYour data in `~/.claude/.cc-hooks/` is automatically preserved!\n\n## Support\n\n- **Issues**: [GitHub Issues](https://github.com/husniadil/cc-hooks/issues)\n- **Documentation**: [Main README](README.md) (this file) | [Standalone](STANDALONE_README.md) |\n  [Migration](MIGRATION.md)\n- **Development**: [CLAUDE.md](CLAUDE.md) for technical details\n- **Updates**: Use `/cc-hooks-plugin:update` inside Claude REPL\n\n## Credits\n\n- **Sound effects**: Generated using [ElevenLabs](https://elevenlabs.io) voice synthesis\n- **TTS**: [Google TTS](https://github.com/pndurette/gTTS), [ElevenLabs](https://elevenlabs.io)\n- **AI**: [OpenRouter](https://openrouter.ai)\n\n## License\n\nMIT - see [LICENSE](LICENSE) for details.\n\n---\n\n**Made with â¤ï¸ for the Claude Code community**\n\nEnjoy your enhanced coding experience! ðŸŽ‰\n"
      },
      "plugins": [
        {
          "name": "cc-hooks-plugin",
          "source": "./",
          "description": "Audio feedback system with multilingual TTS announcements, AI-powered contextual messages, and sound effects for Claude Code. Features include: prerecorded sounds (offline), Google TTS (free), ElevenLabs (premium), contextual AI completion messages via OpenRouter, multi-language support, granular silent modes, and multi-instance support for concurrent sessions.",
          "version": "1.0.12",
          "author": {
            "name": "Husni Adil Makmur",
            "email": "husniadil@gmail.com"
          },
          "homepage": "https://github.com/husniadil/cc-hooks#readme",
          "repository": "https://github.com/husniadil/cc-hooks",
          "license": "MIT",
          "keywords": [
            "audio",
            "tts",
            "text-to-speech",
            "hooks",
            "productivity",
            "ai-translation",
            "multilingual",
            "elevenlabs",
            "gtts",
            "openrouter",
            "sound-effects",
            "voice-feedback",
            "automation"
          ],
          "category": "productivity",
          "tags": [
            "audio",
            "tts",
            "productivity",
            "ai",
            "multilingual"
          ],
          "categories": [
            "ai",
            "ai-translation",
            "audio",
            "automation",
            "elevenlabs",
            "gtts",
            "hooks",
            "multilingual",
            "openrouter",
            "productivity",
            "sound-effects",
            "text-to-speech",
            "tts",
            "voice-feedback"
          ],
          "install_commands": [
            "/plugin marketplace add husniadil/cc-hooks",
            "/plugin install cc-hooks-plugin@cc-hooks-plugin"
          ]
        }
      ]
    },
    {
      "name": "fastmcp-builder-skill",
      "version": null,
      "description": "FastMCP Builder - Production-ready MCP server development skill",
      "repo_full_name": "husniadil/fastmcp-builder",
      "repo_url": "https://github.com/husniadil/fastmcp-builder",
      "repo_description": "A comprehensive Claude Code skill for building production-ready MCP servers using FastMCP. Includes reference guides, runnable examples, and a complete implementation with OAuth, testing, and best practices.",
      "signals": {
        "stars": 4,
        "forks": 4,
        "pushed_at": "2025-10-26T17:20:13Z"
      },
      "files": {
        ".claude-plugin/marketplace.json": "{\n  \"name\": \"fastmcp-builder-skill\",\n  \"owner\": {\n    \"name\": \"Husni Adil Makmur\",\n    \"email\": \"husni.adil@gmail.com\"\n  },\n  \"metadata\": {\n    \"description\": \"FastMCP Builder - Production-ready MCP server development skill\",\n    \"version\": \"1.0.0\"\n  },\n  \"plugins\": [\n    {\n      \"name\": \"fastmcp-builder\",\n      \"description\": \"Build production-ready MCP servers using FastMCP framework with proven patterns for tools, resources, prompts, OAuth authentication, and comprehensive testing. Use this when creating FastMCP-based MCP servers with features like Google OAuth, multiple resource types, testing with FastMCP Client, or complex tool implementations.\",\n      \"source\": \"./\",\n      \"strict\": false,\n      \"skills\": [\"./\"]\n    }\n  ]\n}\n",
        "README.md": "# FastMCP Builder - Claude Code Skill\n\nA comprehensive Claude Code skill for building production-ready MCP (Model Context Protocol) servers using the FastMCP Python framework. This skill provides complete reference implementations, working examples, and proven patterns for creating robust MCP servers with tools, resources, prompts, OAuth authentication, and comprehensive testing.\n\n## What is FastMCP?\n\n**FastMCP** is the official high-level Python framework for building MCP servers. It's simpler, faster to develop with, and more maintainable than the low-level MCP SDK. This skill focuses exclusively on FastMCP-based development.\n\n## What's Included\n\nThis skill contains everything you need to build production-ready FastMCP servers:\n\n### 1. Reference Documentation (`reference/`)\n\nSix comprehensive guides covering all aspects of FastMCP development:\n\n- **[fastmcp_overview.md](./reference/fastmcp_overview.md)** - Introduction, when to use FastMCP, key features\n- **[project_structure.md](./reference/project_structure.md)** - Recommended structure, file organization, DRY patterns\n- **[tool_patterns.md](./reference/tool_patterns.md)** - 6 tool patterns with complete examples\n- **[resource_patterns.md](./reference/resource_patterns.md)** - 4 resource types (static, dynamic, template, wildcard)\n- **[oauth_integration.md](./reference/oauth_integration.md)** - Complete Google OAuth setup guide\n- **[testing_guide.md](./reference/testing_guide.md)** - FastMCP Client testing, patterns, best practices\n\n### 2. Code Examples (`examples/`)\n\nRunnable examples from minimal to complete servers:\n\n- **[minimal_server.py](./examples/minimal_server.py)** - Absolute simplest FastMCP server (28 lines)\n- **[complete_server_structure.py](./examples/complete_server_structure.py)** - Full-featured single-file example with all patterns\n- **[test_examples.py](./examples/test_examples.py)** - Comprehensive testing examples\n\n### 3. Complete Reference Project (`reference-project/`)\n\nA full production implementation demonstrating best practices:\n\n- **6 production-ready tools** - Various patterns (sync, async, stateful, with context)\n- **7 resource instances** - 4 types (static, dynamic, template, wildcard)\n- **1 universal prompt** - Reusable prompt template\n- **145 passing tests** - Comprehensive test coverage\n- **OAuth integration** - Complete Google OAuth setup\n- **Dual-mode architecture** - `main.py` (with OAuth) + `main_noauth.py` (local testing)\n- **DRY principle** - Uses `common.py` for component registration\n\n## When to Use This Skill\n\nUse this skill when you need to:\n\n- Build MCP servers with FastMCP (Python-based development)\n- Add OAuth authentication (especially Google OAuth for remote access)\n- Implement production patterns (tools, resources, prompts with best practices)\n- Set up comprehensive testing (using FastMCP Client for fast, in-memory tests)\n- Structure larger projects (proper organization and separation of concerns)\n- Deploy to production (with authentication, error handling, monitoring)\n\n**Don't use this skill for:**\n\n- TypeScript/Node.js MCP servers (use mcp-builder skill instead)\n- Low-level MCP protocol work (use MCP SDK directly)\n- Non-FastMCP Python servers (this is FastMCP-specific)\n\n## Installation\n\n### Option 1: Install via Plugin Marketplace (Recommended)\n\n1. **Register this marketplace** in Claude Code:\n\n   ```\n   /plugin marketplace add husniadil/fastmcp-builder\n   ```\n\n2. **Browse and install:**\n   - Select \"Browse and install plugins\"\n   - Choose \"fastmcp-builder-skill\"\n   - Select \"fastmcp-builder\"\n   - Click \"Install now\"\n\n3. **Or install directly:**\n   ```\n   /plugin install fastmcp-builder@fastmcp-builder-skill\n   ```\n\n### Option 2: Manual Installation\n\nClone or download this repository to your Claude Code skills directory:\n\n```bash\ncd ~/.claude/skills\ngit clone https://github.com/husniadil/fastmcp-builder.git\n```\n\n### Using the Skill\n\nOnce installed, simply reference the skill in your request:\n\n```\nUse the fastmcp-builder skill to create a new MCP server with OAuth authentication\n```\n\n## Quick Start\n\n### Simple Example\n\nCreate a minimal FastMCP server:\n\n```python\nfrom fastmcp import FastMCP\n\nmcp = FastMCP(\"my-server\")\n\n@mcp.tool()\ndef greet(name: str) -> str:\n    \"\"\"Greet someone by name\"\"\"\n    return f\"Hello, {name}!\"\n\nif __name__ == \"__main__\":\n    mcp.run()\n```\n\n### Try the Included Examples\n\nNavigate to the skill directory and run the examples:\n\n```bash\n# Navigate to skill directory\ncd ~/.claude/plugins/marketplaces/fastmcp-builder-skill\n\n# Try the minimal server\npython examples/minimal_server.py\n\n# Try the complete server structure\npython examples/complete_server_structure.py\n\n# Run with HTTP mode\npython examples/complete_server_structure.py --http\n```\n\n## Building Your First Server\n\n### Phase 1: Planning & Setup\n\n1. **Review FastMCP Overview** - Load `reference/fastmcp_overview.md`\n2. **Understand Requirements** - What tools, resources, prompts do you need?\n3. **Review Project Structure** - Load `reference/project_structure.md`\n4. **Set Up Project** - Create directory structure and install dependencies\n\n```bash\nmkdir my-mcp-server && cd my-mcp-server\nmkdir -p app/tools app/resources app/prompts tests\nuv add fastmcp==2.13.0.1 python-dotenv==1.2.1\nuv add --optional test pytest==8.4.2 pytest-asyncio==1.2.0 pytest-mock==3.15.1 httpx==0.28.1\n```\n\n### Phase 2: Core Implementation\n\n1. **Implement Configuration** (`app/config.py`) - Environment variables, settings\n2. **Implement Tools** (`app/tools/`) - Follow patterns from `reference/tool_patterns.md`\n3. **Implement Resources** (`app/resources/`) - Follow patterns from `reference/resource_patterns.md`\n4. **Implement Prompts** (`app/prompts/`) - Reusable prompt templates\n5. **Create Common Registration** (`app/common.py`) - DRY principle for registering components\n6. **Create Server Entry Points** - `main_noauth.py` (local) + `main.py` (OAuth)\n\n### Phase 3: OAuth Integration (Optional)\n\nFollow `reference/oauth_integration.md` for:\n\n1. Setting up Google OAuth credentials\n2. Implementing GoogleProvider\n3. Testing with ngrok\n4. Configuring Claude Desktop\n\n### Phase 4: Testing\n\nFollow `reference/testing_guide.md` for:\n\n1. Setting up test structure (`tests/conftest.py`)\n2. Writing tool tests\n3. Writing resource tests\n4. Writing integration tests\n5. Running tests: `uv run pytest tests/ -v`\n\n### Phase 5: Documentation & Deployment\n\n1. Write comprehensive README\n2. Create .env.example template\n3. Test OAuth flow\n4. Deploy to production (Railway, Fly.io, VPS)\n\n## Project Structure\n\nRecommended structure for FastMCP projects:\n\n```\nmy-mcp-server/\nâ”œâ”€â”€ app/\nâ”‚   â”œâ”€â”€ __init__.py\nâ”‚   â”œâ”€â”€ config.py           # Configuration & environment variables\nâ”‚   â”œâ”€â”€ common.py           # Shared component registration (DRY)\nâ”‚   â”œâ”€â”€ main.py             # Server with OAuth\nâ”‚   â”œâ”€â”€ main_noauth.py      # Server without OAuth (local testing)\nâ”‚   â”œâ”€â”€ tools/              # Tool implementations\nâ”‚   â”‚   â”œâ”€â”€ __init__.py\nâ”‚   â”‚   â”œâ”€â”€ my_tool.py\nâ”‚   â”‚   â””â”€â”€ ...\nâ”‚   â”œâ”€â”€ resources/          # Resource implementations\nâ”‚   â”‚   â”œâ”€â”€ __init__.py\nâ”‚   â”‚   â”œâ”€â”€ static.py\nâ”‚   â”‚   â””â”€â”€ ...\nâ”‚   â””â”€â”€ prompts/            # Prompt templates\nâ”‚       â”œâ”€â”€ __init__.py\nâ”‚       â””â”€â”€ explain.py\nâ”œâ”€â”€ tests/\nâ”‚   â”œâ”€â”€ __init__.py\nâ”‚   â”œâ”€â”€ conftest.py         # Test fixtures\nâ”‚   â”œâ”€â”€ test_tools.py\nâ”‚   â”œâ”€â”€ test_resources.py\nâ”‚   â””â”€â”€ test_integration.py\nâ”œâ”€â”€ pyproject.toml          # Project dependencies\nâ”œâ”€â”€ .env.example            # Environment variable template\nâ”œâ”€â”€ .env                    # Actual environment variables (gitignored)\nâ””â”€â”€ README.md\n```\n\n## Tool Patterns\n\nThis skill includes 6 proven tool patterns:\n\n1. **Basic Sync Tools** - Simple synchronous functions (health checks, queries)\n2. **Data Processing Tools** - Text analysis, transformations\n3. **Tools with Context** - Logging, progress tracking, better UX\n4. **Stateful Tools** - Counters, session management\n5. **API Integration Tools** - External service calls\n6. **Advanced Async Tools** - Complex workflows, parallel processing\n\nSee `reference/tool_patterns.md` for complete examples.\n\n## Resource Patterns\n\nThis skill includes 4 resource types:\n\n1. **Static Resources** - Fixed content (status, features, documentation)\n2. **Dynamic Resources** - Generated content (current time, computed data)\n3. **Template Resources** - Path parameters (`user://{user_id}`)\n4. **Wildcard Resources** - Multi-segment paths (`docs://{path*}`)\n\nSee `reference/resource_patterns.md` for complete examples.\n\n## OAuth Integration\n\nComplete guide for adding Google OAuth authentication:\n\n- Setting up Google Cloud Console\n- Implementing GoogleProvider\n- Testing with ngrok\n- Configuring Claude Desktop Connectors\n- Production deployment considerations\n\nSee `reference/oauth_integration.md` for the complete guide.\n\n## Testing\n\nComprehensive testing guide using FastMCP Client:\n\n- Fast, in-memory testing (no server startup required)\n- Tool testing patterns\n- Resource testing patterns\n- Integration testing patterns\n- Achieving >80% test coverage\n\nSee `reference/testing_guide.md` for complete examples.\n\n## Best Practices\n\n1. **Use FastMCP** - Simpler than MCP SDK for most use cases\n2. **Follow project structure** - Use `common.py` pattern (DRY principle)\n3. **Dual-mode servers** - `main.py` (OAuth) + `main_noauth.py` (local)\n4. **Comprehensive testing** - Use FastMCP Client, aim for >80% coverage\n5. **Clear documentation** - Docstrings, README, usage examples\n6. **Error handling** - Graceful failures, informative error messages\n7. **Context usage** - Logging, progress for better UX\n8. **Security** - Environment variables, never commit secrets\n\n## Common Workflows\n\n### Creating a New Tool\n\n1. Create `app/tools/my_tool.py`\n2. Implement tool function\n3. Add to `app/common.py` registration\n4. Write tests in `tests/test_tools.py`\n5. Run tests: `uv run pytest tests/test_tools.py -v`\n\n### Adding OAuth\n\n1. Review `reference/oauth_integration.md`\n2. Set up Google OAuth credentials\n3. Update `app/config.py` with OAuth settings\n4. Modify `app/main.py` to use GoogleProvider\n5. Test with ngrok\n6. Configure Claude Desktop Connectors\n\n### Debugging\n\n1. Use `main_noauth.py` for faster local testing\n2. Add logging with Context: `await ctx.debug(...)`\n3. Write tests to isolate issues\n4. Check tool/resource registration in `common.py`\n5. Verify environment variables loaded\n\n## Reference Project Details\n\nThe `reference-project/` directory contains a complete production implementation:\n\n- **Name:** `mcp-auth-demo`\n- **Version:** 1.0.0\n- **Tools:** 6 (ping, counter, process_text, analyze_text, get_forecast, request_info)\n- **Resources:** 7 instances across 4 types\n- **Prompts:** 1 universal prompt template\n- **Tests:** 145 passing tests with comprehensive coverage\n- **Features:** OAuth, dual-mode architecture, DRY principle, comprehensive error handling\n\nUse this as a reference when building your own servers.\n\n## Additional Resources\n\n- **FastMCP Documentation:** https://gofastmcp.com/\n- **FastMCP GitHub:** https://github.com/jlowin/fastmcp\n- **MCP Specification:** https://modelcontextprotocol.io/\n- **Google OAuth Guide:** https://developers.google.com/identity/protocols/oauth2\n- **Claude Code Skills:** https://docs.claude.com/en/docs/claude-code/skills.md\n\n## Requirements\n\n- Python 3.11+\n- FastMCP 2.13.0.1\n- python-dotenv 1.2.1\n\nFor testing:\n\n- pytest 8.4.2\n- pytest-asyncio 1.2.0\n- pytest-mock 3.15.1\n- httpx 0.28.1\n\n## Contributing\n\nThis is a Claude Code skill. To contribute:\n\n1. Test changes with the reference project\n2. Ensure all examples run successfully\n3. Update documentation as needed\n4. Add tests for new patterns\n\n## License\n\nMIT License - Copyright 2025 Husni Adil Makmur\n\nThis skill is provided as-is for use with Claude Code. See [LICENSE](./LICENSE) file for details.\n\nThe FastMCP framework itself is licensed separately - see the [FastMCP repository](https://github.com/jlowin/fastmcp) for details.\n\n## Notes\n\n- This skill focuses on **FastMCP**, not the low-level MCP SDK\n- All examples use **Python 3.11+**\n- OAuth examples use **Google OAuth** (other providers possible)\n- Testing uses **FastMCP Client** (in-memory, fast)\n- Deployment examples are production-ready\n\nHappy building!\n"
      },
      "plugins": [
        {
          "name": "fastmcp-builder",
          "description": "Build production-ready MCP servers using FastMCP framework with proven patterns for tools, resources, prompts, OAuth authentication, and comprehensive testing. Use this when creating FastMCP-based MCP servers with features like Google OAuth, multiple resource types, testing with FastMCP Client, or complex tool implementations.",
          "source": "./",
          "strict": false,
          "skills": [
            "./"
          ],
          "categories": [],
          "install_commands": [
            "/plugin marketplace add husniadil/fastmcp-builder",
            "/plugin install fastmcp-builder@fastmcp-builder-skill"
          ]
        }
      ]
    }
  ]
}