{
  "author": {
    "id": "inngest",
    "display_name": "Inngest",
    "avatar_url": "https://avatars.githubusercontent.com/u/78935958?v=4"
  },
  "marketplaces": [
    {
      "name": "inngest-agent-skills",
      "version": null,
      "description": "Inngest Agent Skills for building with Inngest's durable execution platform",
      "repo_full_name": "inngest/inngest-skills",
      "repo_url": "https://github.com/inngest/inngest-skills",
      "repo_description": "Agent Skills for building with Inngest",
      "signals": {
        "stars": 5,
        "forks": 0,
        "pushed_at": "2026-02-20T02:58:04Z"
      },
      "files": {
        ".claude-plugin/marketplace.json": "{\n  \"_\": \"See reference: https://code.claude.com/docs/en/plugin-marketplaces#marketplace-schema\",\n  \"name\": \"inngest-agent-skills\",\n  \"metadata\": {\n    \"description\": \"Inngest Agent Skills for building with Inngest's durable execution platform\"\n  },\n  \"owner\": {\n    \"name\": \"Inngest, Inc.\",\n    \"email\": \"hello@inngest.com\"\n  },\n  \"plugins\": [\n    {\n      \"name\": \"inngest-skills\",\n      \"description\": \"Agent skills for building with Inngest's durable execution platform. Covers SDK setup, events, durable functions, steps, flow control, and middleware.\",\n      \"category\": \"development\",\n      \"source\": \"./\",\n      \"skills\": [\n        \"./skills/inngest-setup\",\n        \"./skills/inngest-durable-functions\",\n        \"./skills/inngest-steps\",\n        \"./skills/inngest-events\",\n        \"./skills/inngest-flow-control\",\n        \"./skills/inngest-middleware\"\n      ],\n      \"repository\": \"https://github.com/inngest/inngest-skills\",\n      \"homepage\": \"https://www.inngest.com/docs/ai-dev-tools/agent-skills\"\n    }\n  ]\n}\n",
        "README.md": "# Inngest Agent Skills\n\nAgent Skills for building with Inngest's durable execution platform. These skills provide AI agents with comprehensive guidance on creating reliable, fault-tolerant applications using Inngest.\n\nLearn more about [Agent Skills](https://agentskills.io) and [Inngest](https://inngest.com).\n\n## Available Skills\n\n| Skill                                                            | Description                                                  | What It Covers                                                                 |\n| ---------------------------------------------------------------- | ------------------------------------------------------------ | ------------------------------------------------------------------------------ |\n| [inngest-setup](./skills/inngest-setup/)                         | Set up Inngest in a TypeScript project                       | SDK installation, client config, environment variables, dev server             |\n| [inngest-events](./skills/inngest-events/)                       | Design and send Inngest events                               | Event schema, naming conventions, idempotency, fan-out patterns, system events |\n| [inngest-durable-functions](./skills/inngest-durable-functions/) | Create and configure Inngest durable functions               | Triggers, step execution, memoization, cancellation, error handling, retries   |\n| [inngest-steps](./skills/inngest-steps/)                         | Use Inngest step methods to build durable workflows          | step.run, step.sleep, step.waitForEvent, loops, parallel execution             |\n| [inngest-flow-control](./skills/inngest-flow-control/)           | Configure Inngest flow control for functions                 | Concurrency limits, throttling, rate limiting, debounce, priority, batching    |\n| [inngest-middleware](./skills/inngest-middleware/)               | Create and use Inngest middleware for cross-cutting concerns | Middleware lifecycle, dependency injection, built-in middleware                |\n\n## Language Support\n\n**These skills are focused on TypeScript.** Core concepts like events, steps, and flow control apply across all Inngest SDKs, but code examples and setup instructions are TypeScript-specific.\n\nFor **Python** or **Go**, refer to the [Inngest documentation](https://www.inngest.com/llms.txt) for language-specific guidance.\n\n## Installation\n\n### Claude Code\n\n```bash\n/plugin marketplace add inngest/inngest-skills\n/plugin install inngest-skills@inngest-agent-skills\n```\n\n### Skills.sh\n\n```bash\nnpx skills add inngest/inngest-skills\n```\n\n### Cursor\n\nAdd to your `.cursorrules` file:\n\n```\nLoad the Inngest skills from https://github.com/inngest/inngest-skills for building with Inngest's durable execution platform.\n```\n\n### Other Agents\n\nReference this repository directly or clone it to your agent's skills directory. Each skill is self-contained with full documentation in its `SKILL.md` file.\n\n## Contributing\n\nSee [AGENTS.md](./AGENTS.md) for guidelines on editing and maintaining these skills.\n\n## License\n\nLicensed under the Apache License 2.0. See [LICENSE](./LICENSE) for details.\n"
      },
      "plugins": [
        {
          "name": "inngest-skills",
          "description": "Agent skills for building with Inngest's durable execution platform. Covers SDK setup, events, durable functions, steps, flow control, and middleware.",
          "category": "development",
          "source": "./",
          "skills": [
            "./skills/inngest-setup",
            "./skills/inngest-durable-functions",
            "./skills/inngest-steps",
            "./skills/inngest-events",
            "./skills/inngest-flow-control",
            "./skills/inngest-middleware"
          ],
          "repository": "https://github.com/inngest/inngest-skills",
          "homepage": "https://www.inngest.com/docs/ai-dev-tools/agent-skills",
          "categories": [
            "development"
          ],
          "install_commands": [
            "/plugin marketplace add inngest/inngest-skills",
            "/plugin install inngest-skills@inngest-agent-skills"
          ]
        }
      ]
    }
  ]
}