{
  "author": {
    "id": "ItamarZand88",
    "display_name": "‚Ä™Itamar Zand‚Ä¨‚Äè",
    "avatar_url": "https://avatars.githubusercontent.com/u/133867530?u=7d5c4d6e137592b3b5e1bbf2620e545181c75fad&v=4"
  },
  "marketplaces": [
    {
      "name": "itamar-plugins",
      "version": null,
      "description": "Professional Claude Code plugins for agentic engineering workflows and TypeScript Agent SDK development",
      "repo_full_name": "ItamarZand88/claude-code-agentic-engineering",
      "repo_url": "https://github.com/ItamarZand88/claude-code-agentic-engineering",
      "repo_description": "Advanced Claude Code slash commands and subagents for agentic engineering workflows - complete task-to-implementation pipeline with intelligent delegation",
      "signals": {
        "stars": 3,
        "forks": 0,
        "pushed_at": "2026-02-19T15:43:09Z"
      },
      "files": {
        ".claude-plugin/marketplace.json": "{\n  \"$schema\": \"https://anthropic.com/claude-code/marketplace.schema.json\",\n  \"name\": \"itamar-plugins\",\n  \"description\": \"Professional Claude Code plugins for agentic engineering workflows and TypeScript Agent SDK development\",\n  \"owner\": {\n    \"name\": \"Itamar Zand\",\n    \"url\": \"https://github.com/ItamarZand88\"\n  },\n  \"plugins\": [\n    {\n      \"name\": \"workflow\",\n      \"source\": \"./plugins/workflow\",\n      \"description\": \"Advanced agentic engineering workflow with specialized agents for ticket creation, planning, implementation, and code review.\",\n      \"category\": \"development\"\n    },\n    {\n      \"name\": \"agent-sdk-pro\",\n      \"source\": \"./plugins/agent-sdk-pro\",\n      \"description\": \"Professional TypeScript Claude Agent SDK development toolkit ‚Äî patterns, hooks, control, and architecture.\",\n      \"category\": \"development\"\n    }\n  ]\n}\n",
        "README.md": "# AGI - Agentic Engineering Plugin for Claude Code\n\nA Claude Code plugin that provides a structured 4-step workflow for software development: **Ticket ‚Üí Plan ‚Üí Implement ‚Üí Review**.\n\n[![License: MIT](https://img.shields.io/badge/License-MIT-yellow.svg)](https://opensource.org/licenses/MIT)\n[![Claude Code Plugin](https://img.shields.io/badge/Claude%20Code-Plugin-blue)](https://claude.ai/code)\n\n## Install\n\n```bash\n# Inside Claude Code\n/plugin marketplace add ItamarZand88/claude-code-agentic-engineering\n/plugin install agi@claude-code-agentic-engineering\n```\n\n## Usage\n\n### Quick Start\n```bash\n# Run the complete workflow in one command\n/agi:all \"Add OAuth integration with Google\"\n```\n\n### Step-by-Step (Recommended)\n```bash\n# 1. Create task ticket with codebase analysis\n/agi:1_ticket \"Add OAuth integration with Google\"\n\n# 2. Generate implementation plan\n/agi:2_plan .claude/tasks/add-oauth-integration\n\n# 3. Execute the plan\n/agi:3_implement .claude/tasks/add-oauth-integration\n\n# 4. Code review\n/agi:4_review .claude/tasks/add-oauth-integration\n```\n\nReview artifacts in `.claude/tasks/{task-name}/` between steps for best results.\n\n### Auto-Continue\n```bash\n# Chain commands with --continue flag\n/agi:1_ticket \"Add feature\" --continue=plan      # ticket + plan\n/agi:1_ticket \"Add feature\" --continue=implement # ticket + plan + implement\n/agi:1_ticket \"Add feature\" --continue=all       # full workflow\n```\n\n## Commands\n\n| Command | Description |\n|---------|-------------|\n| `/agi:1_ticket <description>` | Create task ticket with codebase analysis |\n| `/agi:2_plan <task_folder>` | Generate implementation plan |\n| `/agi:3_implement <task_folder>` | Execute the plan |\n| `/agi:4_review <task_folder>` | Code review and QA |\n| `/agi:all <description>` | Run complete workflow |\n| `/agi:checks` | Run linting/type checks |\n| `/agi:best-practices` | Generate coding standards from PRs |\n| `/agi:fix-pr-comments <pr>` | Fix PR review comments |\n\n## Agents\n\nThe plugin uses 3 specialized agents:\n\n- **code-explorer** - Analyzes codebase structure and patterns (used in ticket creation)\n- **code-architect** - Designs architecture and implementation plans (used in planning)\n- **code-reviewer** - Reviews code quality and compliance (used in review)\n\n## Task Artifacts\n\nAll artifacts are organized in `.claude/tasks/`:\n```\n.claude/tasks/{task-name}/\n‚îú‚îÄ‚îÄ ticket.md   # Requirements\n‚îú‚îÄ‚îÄ plan.md     # Implementation plan\n‚îî‚îÄ‚îÄ review.md   # Code review\n```\n\n## Requirements\n\n- Claude Code v1.0.33+\n- GitHub CLI (`gh`) for best-practices and fix-pr-comments commands\n\n## Links\n\n- [Issues](https://github.com/ItamarZand88/claude-code-agentic-engineering/issues)\n- [CLAUDE.md](CLAUDE.md) - Full documentation\n",
        "plugins/workflow/README.md": "# AGI - Agentic Engineering Plugin for Claude Code\n\nAdvanced agentic engineering workflow with specialized agents for ticket creation, planning, implementation, and code review.\n\n## Installation\n\n### Option 1: From Git Repository (Recommended)\n\n```bash\nclaude /plugin install https://github.com/ItamarZand88/claude-code-agentic-engineering\n```\n\n### Option 2: Local Development\n\n```bash\nclaude --plugin-dir /path/to/claude-code-agentic-engineering/plugin\n```\n\n## Commands\n\nAfter installation, use commands with the `agi:` prefix:\n\n| Command | Description |\n|---------|-------------|\n| `/agi:1_ticket <description>` | Create task ticket with codebase analysis |\n| `/agi:2_plan <task-folder>` | Research-driven implementation planning |\n| `/agi:3_implement <task-folder>` | Execute the implementation plan |\n| `/agi:4_review <task-folder>` | Quality assurance and code review |\n| `/agi:all <description>` | Run full workflow (ticket ‚Üí plan ‚Üí implement ‚Üí review) |\n| `/agi:best-practices` | Generate project best practices |\n| `/agi:checks` | Run quality checks |\n| `/agi:fix-pr-comments` | Fix PR review comments |\n\n## Workflow\n\n### 4-Step Workflow\n\n```bash\n# 1. Create ticket\n/agi:1_ticket \"Add OAuth authentication\"\n\n# 2. Plan implementation\n/agi:2_plan .claude/tasks/oauth-authentication\n\n# 3. Implement\n/agi:3_implement .claude/tasks/oauth-authentication\n\n# 4. Review\n/agi:4_review .claude/tasks/oauth-authentication\n```\n\n### Quick Start (Full Workflow)\n\n```bash\n/agi:all \"Add OAuth authentication\"\n```\n\n### Command Chaining\n\nUse `--continue` flag to auto-continue through steps:\n\n```bash\n# Create ticket and auto-continue to planning\n/agi:1_ticket \"Add feature\" --continue=plan\n\n# Create ticket and run full workflow\n/agi:1_ticket \"Add feature\" --continue=all\n```\n\n## Agents\n\nThe plugin includes 9 specialized agents:\n\n- **architecture-explorer**: Project structure discovery\n- **codebase-analyst**: Pattern discovery and conventions\n- **code-reviewer**: Comprehensive code review\n- **dependency-mapper**: Dependency mapping\n- **feature-finder**: Similar implementation discovery\n- **implementation-strategist**: Architectural decision-making\n- **best-practices-generator**: Generate coding standards\n- **best-practices-compliance-agent**: Validate code compliance\n- **quality-assurance-agent**: QA checks\n\n## Skills\n\nThe plugin includes 3 skills:\n\n- **best-practices-extractor**: Extract best practices from PR comments\n- **code-compliance**: Validate code against best practices\n- **code-standards**: Legacy skill (deprecated, use the above two)\n\n## Task Folder Structure\n\nEach task creates an organized workspace:\n\n```\n.claude/tasks/{task-name}/\n‚îú‚îÄ‚îÄ ticket.md  - Task requirements and acceptance criteria\n‚îú‚îÄ‚îÄ plan.md    - Implementation plan with research\n‚îî‚îÄ‚îÄ review.md  - Code review and quality assessment\n```\n\n## Requirements\n\n- Claude Code v1.0.33 or later\n- GitHub CLI (`gh`) for best practices extraction\n\n## License\n\nMIT\n",
        "plugins/agent-sdk-pro/README.md": "# Agent SDK Pro\n\nA professional TypeScript Claude Agent SDK development toolkit. Covers patterns, hooks, agent control, and architecture for building production-grade Agent SDK platforms.\n\n**TypeScript only.** This plugin assumes `@anthropic-ai/claude-agent-sdk` with TypeScript.\n\n---\n\n## Features\n\n### Skills (auto-activate)\n\n| Skill | Triggers on |\n|-------|------------|\n| `sdk-typescript-patterns` | `query()` usage, SDK imports, streaming, message types |\n| `sdk-hooks-development` | `HookCallback`, `HookJSONOutput`, PreToolUse/PostToolUse patterns |\n| `sdk-agent-control` | `allowedTools`, `maxTurns`, system prompt design, file pre-creation |\n\n### Commands (user-invoked)\n\n| Command | Purpose |\n|---------|---------|\n| `/agent-sdk-pro:scaffold-agent [name]` | Scaffold a complete TypeScript SDK runner with hooks |\n| `/agent-sdk-pro:add-hook [type]` | Add a new PreToolUse or PostToolUse hook to a project |\n| `/agent-sdk-pro:debug [issue]` | Diagnose issues with an Agent SDK project |\n| `/agent-sdk-pro:sync-docs [focus]` | Fetch latest SDK docs, find gaps in plugin content, apply updates |\n\n### Agents (autonomous)\n\n| Agent | Triggers on |\n|-------|------------|\n| `sdk-architecture-advisor` | \"review my agent architecture\", \"how should I structure my SDK platform\" |\n| `sdk-hook-strategist` | \"design my hook strategy\", \"what hooks do I need\", \"help me implement hooks\" |\n\n### Plugin Hooks\n\n| Hook | Behavior |\n|------|----------|\n| `SessionStart` | Detects if current project uses the SDK and logs context |\n| `PostToolUse` (opt-in) | Reviews edited `.ts` files for SDK pattern issues |\n\n---\n\n## Quick Start\n\n### Scaffold a new agent\n```\n/agent-sdk-pro:scaffold-agent test-generator\n```\n\n### Add a hook\n```\n/agent-sdk-pro:add-hook PreToolUse\n```\n\n### Get architecture advice\n```\n\"Review my Agent SDK architecture\"\n```\n\n### Get a hook strategy\n```\n\"Design a complete hook strategy for my code generation agent\"\n```\n\n---\n\n## TypeScript SDK Hook Quick Reference\n\n```typescript\n// The core types\ntype HookCallback = (\n  input: HookInput,\n  toolUseId: string,\n  context: { signal: AbortSignal }\n) => Promise<HookJSONOutput>;\n\n// PreToolUse: deny a tool call\nreturn {\n  hookSpecificOutput: {\n    hookEventName: \"PreToolUse\",\n    permissionDecision: \"deny\",\n    permissionDecisionReason: \"Only test files can be modified\",\n  },\n};\n\n// PostToolUse: inject feedback into tool result\nreturn {\n  hookSpecificOutput: {\n    hookEventName: input.hook_event_name,\n    additionalContext: \"TypeCheck errors found:\\n...\",\n  },\n};\n\n// No-op (allow / skip)\nreturn {};\n```\n\n---\n\n## Enable Real-Time SDK Feedback\n\nThe PostToolUse hook is opt-in. To enable real-time feedback when editing SDK TypeScript files:\n\n```bash\n# Enable (in your project directory)\ntouch .enable-sdk-feedback\n\n# Disable\nrm .enable-sdk-feedback\n```\n\n**Note**: Requires restarting Claude Code after creating/removing the flag file.\n\n---\n\n## Skills Reference\n\n| File | Contents |\n|------|----------|\n| `skills/sdk-typescript-patterns/SKILL.md` | `query()`, message iteration, AbortSignal, metadata |\n| `skills/sdk-typescript-patterns/references/query-options.md` | Full options object: `canUseTool`, `disallowedTools`, `permissionMode`, `settingSources` |\n| `skills/sdk-typescript-patterns/references/message-types.md` | SDKMessage variants, all error subtypes, `permission_denials`, logging |\n| `skills/sdk-typescript-patterns/examples/basic-runner.ts` | Minimal working runner |\n| `skills/sdk-hooks-development/SKILL.md` | HookCallback, factory patterns, type guards |\n| `skills/sdk-hooks-development/references/pretooluse-patterns.md` | 4 PreToolUse patterns |\n| `skills/sdk-hooks-development/references/posttooluse-patterns.md` | 4 PostToolUse patterns |\n| `skills/sdk-hooks-development/references/hook-events-reference.md` | PreToolUse and PostToolUse deep dive, execution model, tool name reference |\n| `skills/sdk-hooks-development/references/smart-dispatch-pattern.md` | Dispatcher pattern: route by file type and tool, merge strategies, testing |\n| `skills/sdk-hooks-development/references/testing-hooks.md` | Unit testing with vitest, mock helpers, mocking execSync |\n| `skills/sdk-hooks-development/examples/env-protection-hook.ts` | `.env` file read blocker |\n| `skills/sdk-hooks-development/examples/file-restriction-hook.ts` | Single-file write restriction factory |\n| `skills/sdk-hooks-development/examples/security-blocker-hook.ts` | Comprehensive security: dangerous commands + protected files + out-of-project writes |\n| `skills/sdk-hooks-development/examples/smart-dispatch-hook.ts` | Single dispatcher routing by file type and tool name |\n| `skills/sdk-hooks-development/examples/auto-format-hook.ts` | Silent Prettier formatting after edits (no additionalContext) |\n| `skills/sdk-hooks-development/examples/input-redirect-hook.ts` | `updatedInput` patterns: sandbox redirect, strip dangerous flags, inject env vars |\n| `skills/sdk-agent-control/SKILL.md` | allowedTools, maxTurns, system prompts, pre-creation |\n| `skills/sdk-agent-control/references/hook-strategy.md` | Hook strategy matrix, anti-patterns |\n| `skills/sdk-agent-control/references/velocity-control.md` | Velocity governor, output validator, budget guard, checkpoint |\n| `skills/sdk-agent-control/examples/complete-runner.ts` | Production-ready runner with all patterns |\n\n---\n\n## Architecture Principles\n\n1. **Single point of contact** ‚Äî all SDK imports through one `types.ts` file\n2. **TypeScript hooks** ‚Äî `HookCallback` functions, not JSON config\n3. **Always `signal.aborted` first** ‚Äî in every hook callback\n4. **Return `{}`** for no-op ‚Äî not `null` or `undefined`\n5. **Factory functions** for parameterized hooks (e.g., `createFileRestrictionHook(targetFile)`)\n6. **Graceful disable** ‚Äî factory hooks return `null` if prerequisites missing\n7. **Minimal `allowedTools`** ‚Äî give agents only what they need\n8. **Safety rails always** ‚Äî `maxTurns` and `maxBudgetUsd` on every run\n9. **File pre-creation** ‚Äî scaffold ‚Üí agent edits ‚Üí read back\n10. **Velocity + budget guards** ‚Äî rate-limit tool calls and deny when budget nearly exhausted\n"
      },
      "plugins": [
        {
          "name": "workflow",
          "source": "./plugins/workflow",
          "description": "Advanced agentic engineering workflow with specialized agents for ticket creation, planning, implementation, and code review.",
          "category": "development",
          "categories": [
            "development"
          ],
          "install_commands": [
            "/plugin marketplace add ItamarZand88/claude-code-agentic-engineering",
            "/plugin install workflow@itamar-plugins"
          ]
        },
        {
          "name": "agent-sdk-pro",
          "source": "./plugins/agent-sdk-pro",
          "description": "Professional TypeScript Claude Agent SDK development toolkit ‚Äî patterns, hooks, control, and architecture.",
          "category": "development",
          "categories": [
            "development"
          ],
          "install_commands": [
            "/plugin marketplace add ItamarZand88/claude-code-agentic-engineering",
            "/plugin install agent-sdk-pro@itamar-plugins"
          ]
        }
      ]
    },
    {
      "name": "claude-code-canvas-windows",
      "version": "1.0.0",
      "description": "Cross-platform canvas toolkit for Claude Code - Windows Terminal split panes, interactive TUI components, and plan mode viewer",
      "repo_full_name": "ItamarZand88/claude-code-canvas-windows",
      "repo_url": "https://github.com/ItamarZand88/claude-code-canvas-windows",
      "repo_description": null,
      "signals": {
        "stars": 0,
        "forks": 0,
        "pushed_at": "2026-01-29T23:30:47Z"
      },
      "files": {
        ".claude-plugin/marketplace.json": "{\n  \"$schema\": \"https://cdn.anthropic.com/schemas/claude-code/marketplace.schema.json\",\n  \"name\": \"claude-code-canvas-windows\",\n  \"version\": \"1.0.0\",\n  \"description\": \"Cross-platform canvas toolkit for Claude Code - Windows Terminal split panes, interactive TUI components, and plan mode viewer\",\n  \"owner\": {\n    \"name\": \"ItamarZand88\",\n    \"email\": \"zanditamar@gmail.com\"\n  },\n  \"plugins\": [\n    {\n      \"name\": \"canvas\",\n      \"description\": \"Spawn interactive terminal displays (calendars, documents, flights) in split panes with real-time IPC updates. Includes automatic plan mode viewer.\",\n      \"version\": \"1.0.0\",\n      \"author\": {\n        \"name\": \"ItamarZand88\",\n        \"email\": \"zanditamar@gmail.com\"\n      },\n      \"source\": \"./canvas\",\n      \"category\": \"productivity\"\n    }\n  ]\n}\n",
        "README.md": "# Claude Canvas for Windows\n\nA cross-platform TUI toolkit that gives Claude Code its own display. Spawn interactive terminal interfaces for emails, calendars, flight bookings, and more on Windows Terminal, ConEmu, PowerShell, tmux, and other terminals.\n\n![Windows Terminal Support](https://img.shields.io/badge/Windows%20Terminal-Supported-brightgreen)\n![ConEmu Support](https://img.shields.io/badge/ConEmu-Supported-brightgreen)\n![PowerShell Support](https://img.shields.io/badge/PowerShell-Supported-yellow)\n![tmux Support](https://img.shields.io/badge/tmux-Supported-brightgreen)\n\n**Note:** This is a Windows-compatible fork of the original [dvdsgl/claude-canvas](https://github.com/dvdsgl/claude-canvas) with full cross-platform support.\n\n## Features\n\n- ‚úÖ **Windows Terminal** - Primary target, uses split panes\n- ‚úÖ **ConEmu** - Full support with GuiMacro splits\n- ‚úÖ **PowerShell** - Fallback with new window spawning\n- ‚úÖ **tmux** - Original Unix/Linux/macOS support maintained\n- üé® **Interactive Canvases** - Calendar, Document Editor, Flight Booking UI\n- üîÑ **Real-time IPC** - Bidirectional communication using Named Pipes (Windows) or Unix Sockets (Unix)\n- üì¶ **Claude Code Plugin** - Seamless integration with Claude Code\n\n## Requirements\n\n### Windows\n- [Bun](https://bun.sh) v1.0.0 or higher\n- **Windows Terminal** (recommended) or **ConEmu** or **PowerShell**\n- Windows 10/11\n\n### Unix/Linux/macOS\n- [Bun](https://bun.sh) v1.0.0 or higher\n- [tmux](https://github.com/tmux/tmux)\n\n## Installation\n\n### Option 1: Claude Code Plugin (Recommended)\n\nInstall as a Claude Code plugin from our marketplace:\n\n```bash\n# Step 1: Add this repository as a marketplace in Claude Code\n/plugin marketplace add ItamarZand88/claude-code-canvas-windows\n\n# Step 2: Install the canvas plugin\n/plugin install canvas@claude-code-canvas-windows\n\n# Step 3: Install dependencies in the plugin cache (REQUIRED)\ncd ~/.claude/plugins/cache/claude-code-canvas-windows/canvas/1.0.0 && bun install\n```\n\n**Important:** After installing the plugin, you MUST run `bun install` in the plugin cache directory to install the required dependencies (ink, react, etc.).\n\nOnce installed, you can use skills like `/canvas:calendar` or ask Claude about calendars, documents, and flights.\n\n### Post-Installation: Install Dependencies\n\nAfter installing the plugin, run this command to install required npm packages:\n\n**Windows (PowerShell):**\n```powershell\ncd $env:USERPROFILE\\.claude\\plugins\\cache\\claude-code-canvas-windows\\canvas\\1.0.0\nbun install\n```\n\n**Windows (Git Bash) / macOS / Linux:**\n```bash\ncd ~/.claude/plugins/cache/claude-code-canvas-windows/canvas/1.0.0 && bun install\n```\n\nThis installs: `ink`, `react`, `commander`, and other TUI dependencies.\n\n### Option 2: Local Development with --plugin-dir\n\nFor development and testing:\n\n```bash\n# Clone the repository\ngit clone https://github.com/ItamarZand88/claude-code-canvas-windows.git\ncd claude-code-canvas-windows\n\n# Install dependencies\nbun install\n\n# Run Claude Code with the plugin loaded locally\nclaude --plugin-dir ./canvas\n```\n\n### Option 3: Manual Installation (No Plugin)\n\n```bash\n# Clone the repository\ngit clone https://github.com/ItamarZand88/claude-code-canvas-windows.git\ncd claude-code-canvas-windows\n\n# Install dependencies\nbun install\n\n# Test the environment\nbun run env\n```\n\n## Quick Start\n\n### Check Your Environment\n\n```bash\n# See what terminal you're running in\nbun run env\n```\n\n**Output on Windows Terminal:**\n```\nTerminal Environment:\n  Platform: win32\n  Summary: Windows Terminal\n  Windows Terminal: true\n  ConEmu: false\n  PowerShell: false\n```\n\n### Test a Canvas\n\n```bash\n# Show a calendar in the current terminal\nbun run canvas/src/cli.ts show calendar\n\n# Spawn a calendar in a split pane (Windows Terminal/tmux)\nbun run canvas/src/cli.ts spawn calendar --config '{\"events\": [{\"id\":\"1\",\"title\":\"Team Meeting\",\"startTime\":\"2026-01-27T14:00:00\",\"endTime\":\"2026-01-27T15:00:00\"}]}'\n```\n\n## Available Canvases\n\n### Calendar\nDisplay events or pick meeting times interactively.\n\n```bash\n# Simple calendar view\nbun run spawn calendar\n\n# Meeting picker with multiple calendars\nbun run spawn calendar --scenario meeting-picker --config '{\n  \"calendars\": [\n    {\n      \"name\": \"Alice\",\n      \"color\": \"blue\",\n      \"events\": [...]\n    },\n    {\n      \"name\": \"Bob\",\n      \"color\": \"green\",\n      \"events\": [...]\n    }\n  ],\n  \"slotGranularity\": 30\n}'\n```\n\n**Controls:**\n- `‚Üê/‚Üí` - Navigate weeks\n- `t` - Jump to today\n- `Click` - Select time slot (meeting picker mode)\n- `q` or `Esc` - Quit\n\n### Document\nView or edit markdown documents with syntax highlighting.\n\n```bash\n# Display markdown document\nbun run spawn document --config '{\n  \"title\": \"My Document\",\n  \"content\": \"# Hello World\\n\\nThis is **markdown**.\"\n}'\n\n# Edit mode with text selection\nbun run spawn document --scenario edit --config '{\n  \"content\": \"# Draft\\n\\nEdit this content...\",\n  \"readOnly\": false\n}'\n```\n\n**Controls:**\n- `Click and drag` - Select text (edit mode)\n- `Type` - Edit content (edit mode)\n- `‚Üë/‚Üì` - Scroll\n- `q` or `Esc` - Quit\n\n### Flight Booking\nCyberpunk-themed flight comparison and seat selection.\n\n```bash\nbun run spawn flight --config '{\n  \"flights\": [\n    {\n      \"id\": \"ua123\",\n      \"airline\": \"United Airlines\",\n      \"flightNumber\": \"UA 123\",\n      \"origin\": {\"code\": \"SFO\", \"name\": \"San Francisco\", \"city\": \"San Francisco\", \"timezone\": \"PST\"},\n      \"destination\": {\"code\": \"DEN\", \"name\": \"Denver\", \"city\": \"Denver\", \"timezone\": \"MST\"},\n      \"departureTime\": \"2026-01-27T12:55:00-08:00\",\n      \"arrivalTime\": \"2026-01-27T16:37:00-07:00\",\n      \"duration\": 162,\n      \"price\": 34500,\n      \"currency\": \"USD\",\n      \"cabinClass\": \"economy\",\n      \"stops\": 0\n    }\n  ]\n}'\n```\n\n**Controls:**\n- `‚Üë/‚Üì` - Navigate flights\n- `Tab` - Switch between flight list and seatmap\n- `Arrows` - Navigate seatmap\n- `Space` - Select seat\n- `Enter` - Confirm selection\n- `q` or `Esc` - Cancel\n\n## Architecture\n\n### Terminal Detection & Spawning\n\nThe system automatically detects your terminal and uses the appropriate split mechanism:\n\n| Terminal | Detection | Split Method |\n|----------|-----------|--------------|\n| Windows Terminal | `WT_SESSION` env var | `wt.exe sp -H -s 0.67` |\n| ConEmu | `ConEmuPID` env var | `ConEmuC -GuiMacro Split(0,67)` |\n| PowerShell | Fallback | `Start-Process powershell` |\n| tmux | `TMUX` env var | `tmux split-window -h -p 67` |\n\n### IPC Communication\n\n**Windows:** Uses Named Pipes (`\\\\.\\pipe\\canvas-{id}`)\n**Unix:** Uses Unix Domain Sockets (`/tmp/canvas-{id}.sock`)\n\nThe IPC system is completely transparent - the same API works on all platforms.\n\n```typescript\n// Messages: Canvas ‚Üê ‚Üí Controller\nReady ‚Üí Started\nUpdate ‚Üê Send new config\nSelected ‚Üí User made selection\nCancelled ‚Üí User cancelled\n```\n\n### File Structure\n\n```\nclaude-canvas-windows/\n‚îú‚îÄ‚îÄ canvas/\n‚îÇ   ‚îú‚îÄ‚îÄ src/\n‚îÇ   ‚îÇ   ‚îú‚îÄ‚îÄ cli.ts                    # CLI entry point (cross-platform)\n‚îÇ   ‚îÇ   ‚îú‚îÄ‚îÄ terminal.ts               # Platform detection & routing\n‚îÇ   ‚îÇ   ‚îú‚îÄ‚îÄ terminal-windows.ts       # Windows Terminal implementation\n‚îÇ   ‚îÇ   ‚îú‚îÄ‚îÄ ipc/\n‚îÇ   ‚îÇ   ‚îÇ   ‚îú‚îÄ‚îÄ types.ts              # IPC message types\n‚îÇ   ‚îÇ   ‚îÇ   ‚îú‚îÄ‚îÄ index.ts              # Platform routing\n‚îÇ   ‚îÇ   ‚îÇ   ‚îú‚îÄ‚îÄ server-windows.ts     # Named Pipe server\n‚îÇ   ‚îÇ   ‚îÇ   ‚îú‚îÄ‚îÄ client-windows.ts     # Named Pipe client\n‚îÇ   ‚îÇ   ‚îÇ   ‚îú‚îÄ‚îÄ server.ts             # Unix socket server\n‚îÇ   ‚îÇ   ‚îÇ   ‚îî‚îÄ‚îÄ client.ts             # Unix socket client\n‚îÇ   ‚îÇ   ‚îú‚îÄ‚îÄ canvases/                 # Ink/React TUI components\n‚îÇ   ‚îÇ   ‚îÇ   ‚îú‚îÄ‚îÄ calendar.tsx\n‚îÇ   ‚îÇ   ‚îÇ   ‚îú‚îÄ‚îÄ document.tsx\n‚îÇ   ‚îÇ   ‚îÇ   ‚îî‚îÄ‚îÄ flight.tsx\n‚îÇ   ‚îÇ   ‚îî‚îÄ‚îÄ api/                      # High-level API\n‚îÇ   ‚îú‚îÄ‚îÄ skills/                       # Claude Code documentation\n‚îÇ   ‚îú‚îÄ‚îÄ commands/                     # User commands\n‚îÇ   ‚îú‚îÄ‚îÄ run-canvas.bat                # Windows launcher\n‚îÇ   ‚îî‚îÄ‚îÄ run-canvas.sh                 # Unix launcher\n‚îî‚îÄ‚îÄ README.md\n```\n\n## Troubleshooting\n\n### \"Failed to spawn canvas - no supported terminal found\"\n\n**Windows:**\n- Install [Windows Terminal](https://apps.microsoft.com/detail/9N0DX20HK701) (recommended)\n- Or use [ConEmu](https://conemu.github.io/)\n- Ensure you're running from within the terminal (not cmd.exe directly)\n\n**Unix:**\n- Ensure tmux is installed: `sudo apt install tmux` or `brew install tmux`\n- Start a tmux session: `tmux`\n\n### Named Pipe Connection Errors (Windows)\n\nIf you see \"Failed to connect to controller\":\n\n1. Check if another canvas is already running with the same ID\n2. Clean up stale pipes: Delete files in `%TEMP%\\canvas-*.json`\n3. Try a different canvas ID: `--id test-123`\n\n### Split Pane Not Appearing\n\n**Windows Terminal:**\n- Update to the latest version\n- Check that panes are enabled in settings\n- Try manually: `wt.exe sp -H` to test splits\n\n**ConEmu:**\n- Verify GuiMacro is enabled in settings\n- Try manually: `ConEmuC -GuiMacro:0 Split(0,50,\"cmd\")`\n\n### Permission Errors\n\nWindows may block execution of batch files:\n```powershell\n# Allow script execution (run as Administrator)\nSet-ExecutionPolicy -ExecutionPolicy RemoteSigned -Scope CurrentUser\n```\n\n## Development\n\n### Project Structure\n\n```typescript\n// Add a new canvas type\ncanvas/src/canvases/my-canvas.tsx    // Ink/React component\ncanvas/skills/my-canvas/SKILL.md     // Claude documentation\n\n// Register in canvases/index.tsx\nexport async function renderMyCanvas(...) { ... }\n```\n\n### Testing\n\n```bash\n# Test terminal detection\nbun run env\n\n# Test canvas spawning\nbun run spawn calendar --id test-1\n\n# Test IPC communication\nbun run update test-1 --config '{\"title\":\"Updated\"}'\nbun run selection test-1\n```\n\n### Building for Distribution\n\n```bash\n# Install dependencies\nbun install\n\n# Run tests\ncd canvas && bun test\n\n# Build (Bun handles TypeScript automatically)\n# No build step needed - Bun runs .ts files directly\n```\n\n## Differences from Original\n\nThis fork maintains 100% compatibility with the original `dvdsgl/claude-canvas` while adding Windows support:\n\n| Feature | Original | This Fork |\n|---------|----------|-----------|\n| **Terminals** | tmux only | Windows Terminal, ConEmu, PowerShell, tmux |\n| **IPC** | Unix sockets | Named Pipes (Windows) + Unix sockets |\n| **Platform** | macOS/Linux | Windows, macOS, Linux |\n| **Canvases** | Calendar, Document, Flight | Same (100% compatible) |\n| **API** | Same | Same |\n\n## Contributing\n\nContributions welcome! Areas of interest:\n\n- Additional terminal support (Alacritty, Kitty for Windows)\n- More canvas types (Email, Dashboard, Charts)\n- Improved Windows Terminal pane management\n- Better error handling and recovery\n\n## License\n\nMIT License - See [LICENSE](LICENSE) file\n\n## Credits\n\nOriginal project by [David Siegel](https://github.com/dvdsgl) - [dvdsgl/claude-canvas](https://github.com/dvdsgl/claude-canvas)\n\nWindows port and cross-platform support by [ItamarZand88](https://github.com/ItamarZand88)\n\n## Related Projects\n\n- [Claude Code](https://claude.ai/code) - Anthropic's agentic coding assistant\n- [Ink](https://github.com/vadimdemedes/ink) - React for CLIs\n- [Bun](https://bun.sh) - Fast JavaScript runtime\n\n---\n\n**Made with ‚ù§Ô∏è for the Claude Code community**\n",
        "canvas/README.md": "# Canvas Plugin\n\nInteractive terminal TUI components for Claude Code.\n\n## Overview\n\nCanvas provides spawnable terminal displays (calendars, documents, flight booking) with real-time IPC communication. Claude can spawn these TUIs in split panes and receive user selections.\n\n## Canvas Types\n\n| Type | Description |\n|------|-------------|\n| `calendar` | Display events |\n| `document` | View/edit markdown documents |\n| `flight` | Compare flights |\n\n## Installation\n\n### Via Claude Code Plugin\n\n```bash\n# In Claude Code\n/plugin marketplace add /path/to/claude-canvas-windows\n/plugin install canvas@claude-canvas\n```\n\n### Manual Installation\n\n```bash\ncd claude-canvas-windows\nbun install\n```\n\n## Usage\n\n```bash\n# Show calendar in current terminal\nbun run src/cli.ts show calendar\n\n# Spawn calendar in split pane\nbun run src/cli.ts spawn calendar --config '{\"events\": [...]}'\n\n# Spawn document editor\nbun run src/cli.ts spawn document --scenario edit --config '{\"content\": \"# Hello\"}'\n```\n\n## Commands\n\n- `/canvas` - Interactive canvas spawning\n\n## Skills\n\n- `canvas` - Main skill with overview and IPC details\n- `calendar` - Calendar display\n- `document` - Markdown rendering\n- `flight` - Flight comparison\n\n## Requirements\n\n- **Windows**: Windows Terminal (recommended), ConEmu, or PowerShell\n- **Unix/Linux/macOS**: tmux\n- **Bun** - Runtime for CLI commands\n- **Terminal with mouse support** - For interactive scenarios\n\n## License\n\nMIT\n"
      },
      "plugins": [
        {
          "name": "canvas",
          "description": "Spawn interactive terminal displays (calendars, documents, flights) in split panes with real-time IPC updates. Includes automatic plan mode viewer.",
          "version": "1.0.0",
          "author": {
            "name": "ItamarZand88",
            "email": "zanditamar@gmail.com"
          },
          "source": "./canvas",
          "category": "productivity",
          "categories": [
            "productivity"
          ],
          "install_commands": [
            "/plugin marketplace add ItamarZand88/claude-code-canvas-windows",
            "/plugin install canvas@claude-code-canvas-windows"
          ]
        }
      ]
    }
  ]
}