{
  "author": {
    "id": "ITlearning",
    "display_name": "Tabber (인병윤)",
    "avatar_url": "https://avatars.githubusercontent.com/u/11778058?u=3a966670488a91b307ce87f3c0c31974137c397e&v=4"
  },
  "marketplaces": [
    {
      "name": "study-ios",
      "version": null,
      "description": "Swift/iOS study skills for Claude Code",
      "repo_full_name": "ITlearning/study-ios",
      "repo_url": "https://github.com/ITlearning/study-ios",
      "repo_description": "Swift Study Skills",
      "signals": {
        "stars": 15,
        "forks": 1,
        "pushed_at": "2026-02-20T07:25:37Z"
      },
      "files": {
        ".claude-plugin/marketplace.json": "{\n  \"name\": \"study-ios\",\n  \"owner\": {\n    \"name\": \"tabber\"\n  },\n  \"metadata\": {\n    \"description\": \"Swift/iOS study skills for Claude Code\",\n    \"version\": \"1.0.0\"\n  },\n  \"plugins\": [\n    {\n      \"name\": \"swift-study-skills\",\n      \"source\": \"./\",\n      \"description\": \"Swift/iOS learning skills - Socratic tutoring, adaptive quizzes, and note-taking\",\n      \"version\": \"1.0.0\",\n      \"keywords\": [\"swift\", \"ios\", \"learning\", \"quiz\"]\n    }\n  ]\n}\n",
        ".claude-plugin/plugin.json": "{\n  \"name\": \"swift-study-skills\",\n  \"version\": \"1.0.0\",\n  \"description\": \"Swift/iOS learning skills - Socratic tutoring, adaptive quizzes, and note-taking\",\n  \"license\": \"MIT\",\n  \"keywords\": [\"swift\", \"ios\", \"learning\", \"quiz\", \"study\"],\n  \"skills\": \"./skills/\"\n}\n",
        "README.md": "# Swift Study Skills\n\n[한국어](#한국어) | [English](#english) | [제작의도](https://velog.io/@kirri1124/Swift-%EB%A9%98%ED%86%A0%EB%A5%BC-Skill%EB%A1%9C-%EB%A7%8C%EB%93%A4%EC%96%B4%EB%B2%84%EB%A6%AC%EA%B8%B0-with-Claude-Code)\n\n---\n\n## 한국어\n\nSwift/iOS 공부할 때 바로 가져다 쓸 수 있는 CLI 스킬 3개입니다.\nClaude Code, Codex CLI, Gemini CLI에서 같은 흐름으로 사용할 수 있습니다.\n\n핵심은 단순합니다.\n- 바로 답을 주기보다 먼저 생각하게 만들고\n- 퀴즈로 확인하고\n- 마지막에 노트로 남겨서 다음 학습으로 이어갑니다\n\n### 스킬 목록\n\n#### `/swift-study` - Classic + Mastery 학습\n\n학습 스타일을 고를 수 있습니다.\n\n- Classic: 설명을 먼저 듣고 질문으로 이해를 확인하는 방식 (처음 배우는 주제에 추천)\n- Mastery: 예측 -> 검증 -> 재진술 루프를 반복하는 훈련 방식 (실전 대비에 추천)\n- 모드 선택 문구에 각 모드의 용도와 난이도를 함께 안내\n- 용어는 한국어 우선으로 설명하고, 필요할 때 영어를 괄호로 병기\n- `격리 경계(isolation boundary)`처럼 낯선 표현은 바로 한 줄 설명을 붙여 이해를 돕는 방식\n- 실행 모드 선택 가능: Swift 컴파일러 실행 또는 설명 모드\n\n#### `/swift-quiz` - 적응형 퀴즈\n\nClassic/Mastery 모드를 선택해서 퀴즈를 진행합니다.\n\n- Classic: 빠른 점검 중심, 근거 설명은 권장\n- Mastery: 정답 + 이유(WHY) 검증, 근거 품질까지 반영\n- 출력 예측, 버그 찾기, 개념 질문, 코드 작성 문제 포함\n- 최근 학습 이력의 오해 포인트를 우선적으로 점검\n- 결과에 보완 포인트 분석과 다음 학습 추천 제공\n- 해설에서도 기술 용어를 처음 쓸 때 짧은 쉬운 설명을 함께 제공\n\n#### `/study-summary` - 학습 노트 저장\n\n세션 내용을 `notes/`에 Markdown 파일로 저장합니다.\n\n- Classic: 핵심 개념 위주로 간결하게 정리\n- Mastery: 규칙/혼동 포인트/seed 코드까지 상세 기록\n- 학습 진도와 취약 지점을 다음 세션에서 다시 활용 가능하도록 기록\n- 노트 안에서도 용어를 한국어 우선으로 쓰고, 필요한 영어 용어는 괄호로 병기\n\n### 설치 방법\n\n#### 방법 1: Skills로 설치 (권장)\n\n```bash\nnpx skills add https://github.com/itlearning/study-ios\n```\n\n설치 후 원하는 스킬을 선택해서 추가하면 됩니다.\n\n#### 방법 2: Plugin Marketplace (Claude Code)\n\n```bash\n# Claude Code에서 마켓플레이스 추가\n/plugin marketplace add itlearning/study-ios\n\n# 플러그인 설치\n/plugin install swift-study-skills@study-ios\n```\n\n#### 방법 3: 직접 복사\n\n```bash\n# 저장소 클론\ngit clone https://github.com/itlearning/study-ios.git\n\n# Claude Code\ncp -r study-ios/.agents/skills/swift-study YOUR_PROJECT/.claude/skills/\ncp -r study-ios/.agents/skills/swift-quiz YOUR_PROJECT/.claude/skills/\ncp -r study-ios/.agents/skills/study-summary YOUR_PROJECT/.claude/skills/\n\n# Codex CLI\ncp -r study-ios/.agents/skills/swift-study YOUR_PROJECT/.agents/skills/\ncp -r study-ios/.agents/skills/swift-quiz YOUR_PROJECT/.agents/skills/\ncp -r study-ios/.agents/skills/study-summary YOUR_PROJECT/.agents/skills/\n\n# Gemini CLI\ncp -r study-ios/.agents/skills/swift-study YOUR_PROJECT/.gemini/skills/\ncp -r study-ios/.agents/skills/swift-quiz YOUR_PROJECT/.gemini/skills/\ncp -r study-ios/.agents/skills/study-summary YOUR_PROJECT/.gemini/skills/\n```\n\n설치 후 다음 명령으로 실행할 수 있습니다.\n\n- `/swift-study-skills:swift-study`\n- `/swift-study-skills:swift-quiz`\n- `/swift-study-skills:study-summary`\n\n### 사용법\n\nAI CLI에서 슬래시 커맨드로 실행합니다.\n\n```bash\n/swift-study          # 새로운 주제 학습 시작\n/swift-quiz           # 퀴즈로 복습\n/study-summary        # 오늘 배운 내용 정리\n```\n\n### 권장 학습 흐름\n\n```text\n/swift-study로 학습\n        |\n        v\n/swift-quiz로 점검\n        |\n        v\n/study-summary로 정리\n        |\n        v\n다음 세션에서 이전 기록 기반으로 이어서 학습\n```\n\n### 지원 CLI\n\n| CLI | 스킬 위치 | 프로젝트 지침 |\n|-----|-----------|---------------|\n| [Claude Code](https://claude.ai/claude-code) | `.claude/skills/` | `CLAUDE.md` |\n| [Codex CLI](https://github.com/openai/codex) | `.agents/skills/` | `AGENTS.md` |\n| [Gemini CLI](https://github.com/google-gemini/gemini-cli) | `.gemini/skills/` | `.gemini/GEMINI.md` |\n\n### 요구 사항\n\n- 위 CLI 중 하나 이상\n- Swift 컴파일러 (`swift` 명령)\n\n### 라이선스\n\nMIT\n\n---\n\n## English\n\nThree CLI skills for studying Swift and iOS.\nThey work with Claude Code, Codex CLI, and Gemini CLI.\n\nThe workflow is straightforward.\n- Think first instead of getting instant answers\n- Check understanding with a quiz\n- Save what you learned so the next session starts with context\n\n### Skills\n\n#### `/swift-study` - Classic + Mastery study\n\nYou can choose the learning style per session.\n\n- Classic: explanation-first flow with question checks (recommended for new topics)\n- Mastery: prediction -> reveal -> restate loop with gate checks (recommended for practice)\n- Mode prompts include plain-language guidance on who each mode is for\n- Learner-facing wording uses plain terms first, with technical terms in parentheses when helpful\n- New technical terms are followed by a short one-line explanation\n- Supports run mode selection: real Swift execution or explanation mode\n\n#### `/swift-quiz` - Adaptive quiz\n\nYou can run the quiz in Classic or Mastery mode.\n\n- Classic: fast review, lighter reasoning requirements\n- Mastery: verifies both answer and WHY, and uses reasoning quality in scoring\n- Includes output prediction, bug finding, concept checks, and coding tasks\n- Correct answer without reasoning gets partial credit\n- Prioritizes recent weak points from study history\n- Returns a concrete gap analysis and next-study suggestion\n- Explanations include short plain-language glosses for unfamiliar technical terms\n\n#### `/study-summary` - Save learning notes\n\nThis skill saves the session as a Markdown note in `notes/`.\n\n- Classic: concise recap focused on core points\n- Mastery: detailed notes with rules, confusion points, and seed code history\n- Records progress so future sessions can target weak areas\n- Notes use plain wording first and add technical terms only when helpful\n\n### Installation\n\n#### Option 1: Install with Skills (recommended)\n\n```bash\nnpx skills add https://github.com/itlearning/study-ios\n```\n\nThen choose and install the skills you want.\n\n#### Option 2: Plugin Marketplace (Claude Code)\n\n```bash\n# Add the marketplace in Claude Code\n/plugin marketplace add itlearning/study-ios\n\n# Install the plugin\n/plugin install swift-study-skills@study-ios\n```\n\n#### Option 3: Manual copy\n\n```bash\n# Clone the repository\ngit clone https://github.com/itlearning/study-ios.git\n\n# Claude Code\ncp -r study-ios/.agents/skills/swift-study YOUR_PROJECT/.claude/skills/\ncp -r study-ios/.agents/skills/swift-quiz YOUR_PROJECT/.claude/skills/\ncp -r study-ios/.agents/skills/study-summary YOUR_PROJECT/.claude/skills/\n\n# Codex CLI\ncp -r study-ios/.agents/skills/swift-study YOUR_PROJECT/.agents/skills/\ncp -r study-ios/.agents/skills/swift-quiz YOUR_PROJECT/.agents/skills/\ncp -r study-ios/.agents/skills/study-summary YOUR_PROJECT/.agents/skills/\n\n# Gemini CLI\ncp -r study-ios/.agents/skills/swift-study YOUR_PROJECT/.gemini/skills/\ncp -r study-ios/.agents/skills/swift-quiz YOUR_PROJECT/.gemini/skills/\ncp -r study-ios/.agents/skills/study-summary YOUR_PROJECT/.gemini/skills/\n```\n\nAfter installation, you can run:\n\n- `/swift-study-skills:swift-study`\n- `/swift-study-skills:swift-quiz`\n- `/swift-study-skills:study-summary`\n\n### Usage\n\nRun slash commands in your AI CLI.\n\n```bash\n/swift-study          # Start a new topic\n/swift-quiz           # Review with a quiz\n/study-summary        # Save learning notes\n```\n\n### Suggested flow\n\n```text\nLearn with /swift-study\n        |\n        v\nReview with /swift-quiz\n        |\n        v\nSave notes with /study-summary\n        |\n        v\nContinue next time with history-based context\n```\n\n### Supported CLIs\n\n| CLI | Skills location | Project instructions |\n|-----|-----------------|----------------------|\n| [Claude Code](https://claude.ai/claude-code) | `.claude/skills/` | `CLAUDE.md` |\n| [Codex CLI](https://github.com/openai/codex) | `.agents/skills/` | `AGENTS.md` |\n| [Gemini CLI](https://github.com/google-gemini/gemini-cli) | `.gemini/skills/` | `.gemini/GEMINI.md` |\n\n### Requirements\n\n- One or more CLIs above\n- Swift compiler (`swift` command)\n\n## 기여하기 (Contributing)\n\n이 프로젝트에 대한 기여를 환영합니다! 버그 리포트, 기능 제안, Pull Request 모두 환영합니다.\n\nContributions are welcome! Feel free to submit bug reports, feature requests, or pull requests.\n\n### License\n\nMIT\n"
      },
      "plugins": [
        {
          "name": "swift-study-skills",
          "source": "./",
          "description": "Swift/iOS learning skills - Socratic tutoring, adaptive quizzes, and note-taking",
          "version": "1.0.0",
          "keywords": [
            "swift",
            "ios",
            "learning",
            "quiz"
          ],
          "categories": [
            "ios",
            "learning",
            "quiz",
            "swift"
          ],
          "install_commands": [
            "/plugin marketplace add ITlearning/study-ios",
            "/plugin install swift-study-skills@study-ios"
          ]
        }
      ]
    }
  ]
}