{
  "author": {
    "id": "itsbrex",
    "display_name": "Brian Roach",
    "avatar_url": "https://avatars.githubusercontent.com/u/9772694?u=f7a48b181419c48c5d682b4f47a1629ee2c987b4&v=4"
  },
  "marketplaces": [
    {
      "name": "cc-plugins",
      "version": null,
      "description": "ty LSP server plugin for Python type checking. ty is an extremely fast Python type checker written in Rust by Astral.",
      "repo_full_name": "itsbrex/claude-plugins",
      "repo_url": "https://github.com/itsbrex/claude-plugins",
      "repo_description": "Claude Code plugin integrating ty (Astral's extremely fast Python type checker and LSP)",
      "signals": {
        "stars": 0,
        "forks": 0,
        "pushed_at": "2026-01-05T01:12:23Z"
      },
      "files": {
        ".claude-plugin/marketplace.json": "{\n  \"name\": \"cc-plugins\",\n  \"owner\": {\n    \"name\": \"itsbrex\"\n  },\n  \"plugins\": [\n    {\n      \"name\": \"ty-lsp\",\n      \"source\": \"./ty-lsp-plugin\",\n      \"description\": \"ty LSP server plugin for Python type checking. ty is an extremely fast Python type checker written in Rust by Astral.\"\n    }\n  ]\n}\n",
        "README.md": "# cc-plugins\n\nA collection of Claude Code plugins by [@itsbrex](https://github.com/itsbrex).\n\n## Available Plugins\n\n| Plugin | Description |\n|--------|-------------|\n| [ty-lsp](./ty-lsp-plugin/) | Python type checking via [ty](https://docs.astral.sh/ty) - an extremely fast type checker by Astral |\n\n## Installation\n\n### From GitHub\n\nAdd this marketplace and install plugins:\n\n```bash\n# Add the marketplace\n/plugin marketplace add itsbrex/claude-plugins\n\n# Install a plugin\n/plugin install ty-lsp@cc-plugins\n```\n\n### Update Plugins\n\n```bash\n/plugin marketplace update cc-plugins\n```\n\n## Local Development\n\n```bash\ngit clone https://github.com/itsbrex/claude-plugins.git\ncd claude-plugins\n\n# Add as local marketplace\n/plugin marketplace add ./\n\n# Install plugin\n/plugin install ty-lsp@cc-plugins\n\n# Update after changes\n/plugin marketplace update cc-plugins\n```\n\n## Repository Structure\n\n```\nclaude-plugins/\n├── .claude-plugin/\n│   └── marketplace.json      # Marketplace catalog\n├── ty-lsp-plugin/            # ty LSP plugin\n│   ├── .claude-plugin/\n│   │   └── plugin.json       # Plugin manifest\n│   ├── .lsp.json             # LSP configuration\n│   └── ...\n└── README.md\n```\n\n## Adding New Plugins\n\n1. Create a new directory for your plugin (e.g., `my-plugin/`)\n2. Add `.claude-plugin/plugin.json` with plugin metadata\n3. Add your plugin files (commands, hooks, LSP config, etc.)\n4. Register in `.claude-plugin/marketplace.json`:\n\n```json\n{\n  \"name\": \"my-plugin\",\n  \"source\": \"./my-plugin\",\n  \"description\": \"Description of your plugin\"\n}\n```\n\n## Documentation\n\n- [Claude Code Plugin Documentation](https://docs.anthropic.com/en/docs/claude-code/plugins)\n- [ty Documentation](https://docs.astral.sh/ty)\n\n## License\n\nMIT\n",
        "ty-lsp-plugin/README.md": "# ty LSP Plugin for Claude Code\n\nThis plugin integrates [ty](https://docs.astral.sh/ty), an extremely fast Python type checker and language server written in Rust by Astral, with Claude Code to provide real-time type checking and code intelligence.\n\n## Features\n\n- Real-time Python type checking\n- Code intelligence for `.py` and `.pyi` files\n- Fast, incremental type checking powered by ty\n- Automatic installation via `uvx` (no manual setup required)\n\n## Prerequisites\n\n- Claude Code version 1.0.33 or later\n- `uvx` installed (comes with `uv`)\n\n## Installation\n\n### From GitHub\n\nAdd the marketplace and install the plugin:\n\n```bash\n/plugin marketplace add itsbrex/claude-plugins\n/plugin install ty-lsp@cc-plugins\n```\n\n### Local Development\n\nClone the repository and add it as a local marketplace:\n\n```bash\ngit clone https://github.com/itsbrex/claude-plugins.git\ncd claude-plugins\n\n# Add the local marketplace (from repo root)\n/plugin marketplace add ./\n\n# Install the plugin\n/plugin install ty-lsp@cc-plugins\n\n# Update after changes\n/plugin marketplace update cc-plugins\n```\n\n### Quick Test (without marketplace)\n\n```bash\nclaude --plugin-dir ./ty-lsp-plugin\n```\n\n## Usage\n\nOnce installed, the plugin automatically provides type checking and code intelligence for Python files. Claude Code will:\n\n- Show type errors as you work with Python code\n- Provide hover information for functions, classes, and variables\n- Enable go-to-definition and find-references functionality\n- Offer code completions based on type information\n\nThe ty LSP server runs automatically when you work with `.py` or `.pyi` files.\n\n## Configuration\n\nThe plugin uses `uvx ty@latest server` to run the ty LSP server, which means:\n\n- ty is automatically installed on first use\n- You'll always get the latest version of ty\n- No manual installation or configuration required\n\nFor additional ty configuration options, see the [ty editor settings documentation](https://docs.astral.sh/ty/reference/editor-settings/).\n\n## Troubleshooting\n\n### Plugin not loading\n\nEnsure you're running Claude Code version 1.0.33 or later:\n\n```bash\nclaude --version\n```\n\n### LSP server not starting\n\nVerify that `uvx` is installed and in your PATH:\n\n```bash\nuvx --version\n```\n\nIf not installed, install `uv` which includes `uvx`:\n\n```bash\ncurl -LsSf https://astral.sh/uv/install.sh | sh\n```\n\n### Type checking not working\n\nCheck that ty is working correctly:\n\n```bash\nuvx ty@latest --version\n```\n\n## Learn More\n\n- [ty Documentation](https://docs.astral.sh/ty) - ty is created by Astral\n- [ty Editor Settings](https://docs.astral.sh/ty/reference/editor-settings/)\n- [Claude Code LSP Documentation](https://code.claude.com/docs/en/plugins-reference#lsp-servers)\n\n## About\n\n**Plugin author**: Brian Roach\n\n**ty type checker**: Created by [Astral](https://astral.sh), the creators of uv and Ruff\n\n## License\n\nMIT\n"
      },
      "plugins": [
        {
          "name": "ty-lsp",
          "source": "./ty-lsp-plugin",
          "description": "ty LSP server plugin for Python type checking. ty is an extremely fast Python type checker written in Rust by Astral.",
          "categories": [],
          "install_commands": [
            "/plugin marketplace add itsbrex/claude-plugins",
            "/plugin install ty-lsp@cc-plugins"
          ]
        }
      ]
    }
  ]
}