{
  "author": {
    "id": "jamesrochabrun",
    "display_name": "James Rochabrun",
    "avatar_url": "https://avatars.githubusercontent.com/u/5378604?u=14ca67e2d1ad7f37d50122fcc3ae3b1aa3f0b3ec&v=4"
  },
  "marketplaces": [
    {
      "name": "skills-marketplace",
      "version": "2.1.0",
      "description": "A comprehensive collection of 23 custom skills for Claude Code covering engineering, iOS/Swift development, product management, design, content, trading, database, QA, educational, and AI prompt engineering domains. Install individual skills or the complete collection.",
      "repo_full_name": "jamesrochabrun/skills",
      "repo_url": "https://github.com/jamesrochabrun/skills",
      "repo_description": "Claude Code Skills",
      "signals": {
        "stars": 50,
        "forks": 7,
        "pushed_at": "2026-01-14T07:21:27Z"
      },
      "files": {
        ".claude-plugin/marketplace.json": "{\n  \"$schema\": \"https://anthropic.com/claude-code/marketplace.schema.json\",\n  \"name\": \"skills-marketplace\",\n  \"version\": \"2.1.0\",\n  \"description\": \"A comprehensive collection of 23 custom skills for Claude Code covering engineering, iOS/Swift development, product management, design, content, trading, database, QA, educational, and AI prompt engineering domains. Install individual skills or the complete collection.\",\n  \"owner\": {\n    \"name\": \"James Rochabrun\",\n    \"email\": \"jamesrochabrun@gmail.com\"\n  },\n  \"plugins\": [\n    {\n      \"name\": \"all-skills\",\n      \"description\": \"Complete collection of all 23 skills including engineering, iOS/Swift, product, design, content, finance, database, QA, educational, and AI prompt engineering skills\",\n      \"source\": \"./\",\n      \"strict\": true,\n      \"skills\": [\n        \"./skills/anthropic-architect\",\n        \"./skills/anthropic-prompt-engineer\",\n        \"./skills/apple-hig-designer\",\n        \"./skills/book-illustrator\",\n        \"./skills/content-brief-generator\",\n        \"./skills/design-brief-generator\",\n        \"./skills/engineer-expertise-extractor\",\n        \"./skills/engineer-skill-creator\",\n        \"./skills/frontend-designer\",\n        \"./skills/git-worktrees\",\n        \"./skills/kids-book-writer\",\n        \"./skills/leetcode-teacher\",\n        \"./skills/llm-router\",\n        \"./skills/math-teacher\",\n        \"./skills/openai-prompt-engineer\",\n        \"./skills/prd-generator\",\n        \"./skills/qa-test-planner\",\n        \"./skills/query-expert\",\n        \"./skills/reading-teacher\",\n        \"./skills/swift-concurrency\",\n        \"./skills/swiftui-animation\",\n        \"./skills/technical-launch-planner\",\n        \"./skills/trading-plan-generator\"\n      ]\n    },\n    {\n      \"name\": \"anthropic-architect\",\n      \"description\": \"Determine the best Anthropic architecture for your project by analyzing requirements and recommending the optimal combination of Skills, Agents, Prompts, and SDK primitives.\",\n      \"source\": \"./\",\n      \"strict\": true,\n      \"skills\": [\"./skills/anthropic-architect\"]\n    },\n    {\n      \"name\": \"anthropic-prompt-engineer\",\n      \"description\": \"Master Anthropic's prompt engineering techniques to generate new prompts or improve existing ones using best practices for Claude AI models.\",\n      \"source\": \"./\",\n      \"strict\": true,\n      \"skills\": [\"./skills/anthropic-prompt-engineer\"]\n    },\n    {\n      \"name\": \"apple-hig-designer\",\n      \"description\": \"Design iOS apps following Apple's Human Interface Guidelines. Generate native components, validate designs, and ensure accessibility compliance for iPhone, iPad, and Apple Watch.\",\n      \"source\": \"./\",\n      \"strict\": true,\n      \"skills\": [\"./skills/apple-hig-designer\"]\n    },\n    {\n      \"name\": \"book-illustrator\",\n      \"description\": \"Expert children's book illustrator guide with 2024-2025 best practices, focusing on age-appropriate styles, color theory, character design, and visual storytelling for kids books that captivate young readers.\",\n      \"source\": \"./\",\n      \"strict\": true,\n      \"skills\": [\"./skills/book-illustrator\"]\n    },\n    {\n      \"name\": \"content-brief-generator\",\n      \"description\": \"Generate comprehensive content briefs for writers, ensuring clarity, alignment, and strategic content creation across all formats.\",\n      \"source\": \"./\",\n      \"strict\": true,\n      \"skills\": [\"./skills/content-brief-generator\"]\n    },\n    {\n      \"name\": \"design-brief-generator\",\n      \"description\": \"Generate comprehensive design briefs for design projects. Use this skill when designers ask to 'create a design brief', 'structure a design project', 'define design requirements', or need help planning design work.\",\n      \"source\": \"./\",\n      \"strict\": true,\n      \"skills\": [\"./skills/design-brief-generator\"]\n    },\n    {\n      \"name\": \"engineer-expertise-extractor\",\n      \"description\": \"Research and extract an engineer's coding style, patterns, and best practices from their GitHub contributions. Creates structured knowledge base for replicating their expertise.\",\n      \"source\": \"./\",\n      \"strict\": true,\n      \"skills\": [\"./skills/engineer-expertise-extractor\"]\n    },\n    {\n      \"name\": \"engineer-skill-creator\",\n      \"description\": \"Transform extracted engineer expertise into an actionable skill with progressive disclosure, allowing agents to find and apply relevant patterns for specific tasks.\",\n      \"source\": \"./\",\n      \"strict\": true,\n      \"skills\": [\"./skills/engineer-skill-creator\"]\n    },\n    {\n      \"name\": \"frontend-designer\",\n      \"description\": \"Build accessible, responsive, and performant frontend components with design system best practices, modern CSS, and framework-agnostic patterns.\",\n      \"source\": \"./\",\n      \"strict\": true,\n      \"skills\": [\"./skills/frontend-designer\"]\n    },\n    {\n      \"name\": \"git-worktrees\",\n      \"description\": \"Manage Git worktrees for parallel Claude Code development. Use this skill when engineers ask to 'create a worktree', 'run parallel Claude sessions', 'work on multiple features simultaneously', or need help with worktree management.\",\n      \"source\": \"./\",\n      \"strict\": true,\n      \"skills\": [\"./skills/git-worktrees\"]\n    },\n    {\n      \"name\": \"kids-book-writer\",\n      \"description\": \"Expert children's book writer creating delightful, engaging books for ages 2-9. Specializes in rhyming books, stories, songs with proper values, educational content, and age-appropriate language. Crafts books that captivate young readers while teaching important life lessons.\",\n      \"source\": \"./\",\n      \"strict\": true,\n      \"skills\": [\"./skills/kids-book-writer\"]\n    },\n    {\n      \"name\": \"leetcode-teacher\",\n      \"description\": \"Interactive LeetCode-style teacher for technical interview preparation. Generates coding playgrounds with real product challenges, teaches patterns and techniques, supports Python/TypeScript/Kotlin/Swift, and provides progressive difficulty training for data structures and algorithms.\",\n      \"source\": \"./\",\n      \"strict\": true,\n      \"skills\": [\"./skills/leetcode-teacher\"]\n    },\n    {\n      \"name\": \"llm-router\",\n      \"description\": \"This skill should be used when users want to route LLM requests to different AI providers (OpenAI, Grok/xAI, Groq, DeepSeek, OpenRouter) using SwiftOpenAI-CLI. Use this skill when users ask to 'use grok', 'ask grok', 'use groq', 'ask deepseek', or any similar request to query a specific LLM provider in agent mode.\",\n      \"source\": \"./\",\n      \"strict\": true,\n      \"skills\": [\"./skills/llm-router\"]\n    },\n    {\n      \"name\": \"math-teacher\",\n      \"description\": \"Interactive math teacher that instantly generates playful, gamified learning experiences. Creates visual playgrounds, interactive artifacts, and engaging games for kids and adults to learn math concepts from basic arithmetic to advanced calculus.\",\n      \"source\": \"./\",\n      \"strict\": true,\n      \"skills\": [\"./skills/math-teacher\"]\n    },\n    {\n      \"name\": \"openai-prompt-engineer\",\n      \"description\": \"Generate and improve prompts using best practices for OpenAI GPT-5 and other LLMs. Apply advanced techniques like chain-of-thought, few-shot prompting, and progressive disclosure.\",\n      \"source\": \"./\",\n      \"strict\": true,\n      \"skills\": [\"./skills/openai-prompt-engineer\"]\n    },\n    {\n      \"name\": \"prd-generator\",\n      \"description\": \"Generate comprehensive Product Requirements Documents (PRDs) for product managers. Use this skill when users ask to 'create a PRD', 'write product requirements', 'document a feature', or need help structuring product specifications.\",\n      \"source\": \"./\",\n      \"strict\": true,\n      \"skills\": [\"./skills/prd-generator\"]\n    },\n    {\n      \"name\": \"qa-test-planner\",\n      \"description\": \"Generate comprehensive test plans, manual test cases, regression test suites, and bug reports for QA engineers. Includes Figma MCP integration for design validation.\",\n      \"source\": \"./\",\n      \"strict\": true,\n      \"skills\": [\"./skills/qa-test-planner\"]\n    },\n    {\n      \"name\": \"query-expert\",\n      \"description\": \"Master SQL and database queries across multiple systems. Generate optimized queries, analyze performance, design indexes, and troubleshoot slow queries for PostgreSQL, MySQL, MongoDB, and more.\",\n      \"source\": \"./\",\n      \"strict\": true,\n      \"skills\": [\"./skills/query-expert\"]\n    },\n    {\n      \"name\": \"reading-teacher\",\n      \"description\": \"Interactive reading teacher that instantly generates playful, engaging learning experiences for children ages 1-10. Creates visual playgrounds, phonics games, and interactive stories to build reading skills from letter recognition to comprehension.\",\n      \"source\": \"./\",\n      \"strict\": true,\n      \"skills\": [\"./skills/reading-teacher\"]\n    },\n    {\n      \"name\": \"swift-concurrency\",\n      \"description\": \"Guide for building, auditing, and refactoring Swift code using modern concurrency patterns (Swift 6+). This skill should be used when working with async/await, Tasks, actors, MainActor, Sendable types, isolation domains, or when migrating legacy callback/Combine code to structured concurrency. Covers Approachable Concurrency settings, isolated parameters, and common pitfalls.\",\n      \"source\": \"./\",\n      \"strict\": true,\n      \"skills\": [\"./skills/swift-concurrency\"]\n    },\n    {\n      \"name\": \"swiftui-animation\",\n      \"description\": \"This skill provides comprehensive guidance for implementing advanced SwiftUI animations, transitions, matched geometry effects, and Metal shader integration. Use when building animations, view transitions, hero animations, or GPU-accelerated effects in SwiftUI apps for iOS and macOS.\",\n      \"source\": \"./\",\n      \"strict\": true,\n      \"skills\": [\"./skills/swiftui-animation\"]\n    },\n    {\n      \"name\": \"technical-launch-planner\",\n      \"description\": \"Plan and execute technical product launches for developer tools, APIs, and technical products. Use this skill when technical PMMs need to 'plan a launch', 'create a launch strategy', 'coordinate a product release', or 'prepare for GA/beta launch'.\",\n      \"source\": \"./\",\n      \"strict\": true,\n      \"skills\": [\"./skills/technical-launch-planner\"]\n    },\n    {\n      \"name\": \"trading-plan-generator\",\n      \"description\": \"Generate comprehensive trading plans with risk management, position sizing, entry/exit strategies, and performance tracking to trade with discipline and consistency.\",\n      \"source\": \"./\",\n      \"strict\": true,\n      \"skills\": [\"./skills/trading-plan-generator\"]\n    }\n  ]\n}\n",
        ".claude-plugin/plugin.json": "{\n  \"name\": \"skills\",\n  \"version\": \"1.0.0\",\n  \"description\": \"A comprehensive collection of custom skills for Claude Code covering engineering, product management, design, content, trading, database, QA, and educational domains\",\n  \"skills\": \"./skills/\"\n}\n",
        "README.md": "# Skills Plugin & Marketplace\n\nA comprehensive plugin and marketplace for Claude Code containing 24 custom skills across engineering, Apple development, product management, design, content, trading, database, QA, educational, and AI architecture domains.\n\n## Overview\n\nThis repository provides Claude Code with specialized knowledge and workflows through a curated collection of skills. Each skill includes interactive scripts, comprehensive reference materials, and best practices for specific domains.\n\n**Use as a Marketplace** to browse and select individual skills, or **install as a Plugin** to get all skills at once.\n\n## Skills Index\n\nQuick navigation to all 24 skills organized by category:\n\n### AI & Architecture (2 skills)\n- [anthropic-architect](#anthropic-architect) - Determine the best Anthropic architecture for your project\n- [anthropic-prompt-engineer](#anthropic-prompt-engineer) - Master Anthropic's prompt engineering techniques\n\n### Engineering (5 skills)\n- [openai-prompt-engineer](#openai-prompt-engineer) - Generate and improve prompts using best practices for OpenAI GPT-5\n- [git-worktrees](#git-worktrees) - Manage Git worktrees for parallel development\n- [llm-router](#llm-router) - Route requests to different LLM providers\n- [engineer-expertise-extractor](#engineer-expertise-extractor) - Extract engineering expertise from GitHub\n- [engineer-skill-creator](#engineer-skill-creator) - Transform expertise into actionable skills\n\n### Apple Development (3 skills)\n- [swift-concurrency](#swift-concurrency) - Build, audit, and refactor Swift 6+ concurrency code\n- [swiftui-animation](#swiftui-animation) - Advanced SwiftUI animations and Metal shaders\n- [releasing-macos-apps](#releasing-macos-apps) - Create notarized macOS releases with Sparkle updates\n\n### Product Management (1 skill)\n- [prd-generator](#prd-generator) - Generate Product Requirements Documents\n\n### Product Marketing (1 skill)\n- [technical-launch-planner](#technical-launch-planner) - Plan technical product launches\n\n### Design (4 skills)\n- [design-brief-generator](#design-brief-generator) - Generate comprehensive design briefs\n- [frontend-designer](#frontend-designer) - Build accessible, responsive UIs\n- [apple-hig-designer](#apple-hig-designer) - Design native iOS apps\n- [book-illustrator](#book-illustrator) - Children's book illustration guide\n\n### Content & Writing (2 skills)\n- [content-brief-generator](#content-brief-generator) - Generate SEO-optimized content briefs\n- [kids-book-writer](#kids-book-writer) - Write engaging children's books\n\n### Trading & Finance (1 skill)\n- [trading-plan-generator](#trading-plan-generator) - Generate trading plans with risk management\n\n### Database & Query (1 skill)\n- [query-expert](#query-expert) - Master SQL and database queries\n\n### QA & Testing (1 skill)\n- [qa-test-planner](#qa-test-planner) - Generate test plans and bug reports\n\n### Educational & Learning (3 skills)\n- [math-teacher](#math-teacher) - Interactive math learning with gamification\n- [reading-teacher](#reading-teacher) - Interactive reading teacher for ages 1-10\n- [leetcode-teacher](#leetcode-teacher) - Technical interview preparation\n\n---\n\n## Skills\n\n### AI & Architecture Skills\n\n#### anthropic-architect\n\n**Determine the best Anthropic architecture for your project.** Analyze requirements and receive tailored recommendations on the optimal architecture using Skills, Agents, Subagents, Prompts, and SDK primitives based on proven decision rubrics and 2025 best practices.\n\n**Key features:**\n- Analyze project requirements and complexity\n- Recommend optimal architecture (Skills vs Agents vs Prompts vs SDK)\n- Apply comprehensive decision rubrics\n- Progressive disclosure design guidance\n- Security and performance best practices\n- Real-world architectural patterns\n- Cost optimization strategies\n\n**Usage:**\n- \"Using anthropic-architect, determine the best architecture for my code review system\"\n- \"Help me choose between Skills and Agents for this workflow\"\n- \"Analyze my project and recommend the right Anthropic primitives\"\n- \"What's the best architecture for automated testing?\"\n\n**The Four Anthropic Primitives:**\n- **Skills** - Reusable domain expertise with progressive disclosure\n- **Agents/Subagents** - Autonomous task handlers with isolated contexts\n- **Direct Prompts** - Simple, clear instructions for straightforward tasks\n- **SDK Primitives** - Custom workflows and system integrations\n\n**Decision Framework:**\n```\nTask Complexity:\n  Low (1-3) â†’ Direct Prompts\n  Medium (4-6) â†’ Skills\n  High (7-9) â†’ Agents/Subagents\n  Custom (10) â†’ SDK Primitives\n\nPlus evaluation of:\n- Reusability requirements\n- Context management needs\n- Security & control requirements\n- Performance needs\n- Maintenance burden\n- Time to market\n```\n\n**Reference materials:**\n- `decision_rubric.md` - Comprehensive 7-dimension decision framework\n- `architectural_patterns.md` - 14 proven architecture patterns\n- `best_practices.md` - 2025 Anthropic best practices (progressive disclosure, context management, security)\n- `use_case_examples.md` - Real-world architectures for common use cases\n\n**Perfect for:**\n- Choosing the right Anthropic primitives for your project\n- Designing scalable, maintainable AI architectures\n- Optimizing context usage and costs\n- Following 2025 best practices\n- Avoiding common anti-patterns\n- Learning when to use Skills vs Agents vs Prompts\n- Building production-ready AI systems\n\n**Example Recommendations:**\n\n**Use Case: Code Review System**\n```\nRecommended: Skills + Direct Prompts\nWhy: Reusable standards (Skills), simple workflow (Prompts)\nPattern: Load code-review-expert skill, review PRs with prompts\n```\n\n**Use Case: Full-Stack Feature**\n```\nRecommended: Specialist Agents + Skills\nWhy: Complex multi-layer work, parallel execution, specialized expertise\nPattern: Frontend/Backend/DevOps agents each load relevant skills\n```\n\n**Use Case: Simple Bug Fix**\n```\nRecommended: Direct Prompt\nWhy: One-time task, minimal complexity, no reusability needed\nPattern: Clear instruction to Claude\n```\n\n[View anthropic-architect skill â†’](./skills/anthropic-architect)\n\n---\n\n#### anthropic-prompt-engineer\n\n**Master Anthropic's prompt engineering techniques for Claude AI models.** Generate new prompts from scratch or improve existing ones using best practices, XML structuring, chain-of-thought reasoning, and progressive disclosure patterns optimized for Claude 4.x.\n\n**Key features:**\n- Generate effective prompts from requirements\n- Improve existing prompts with proven techniques\n- Claude-specific optimizations (XML tags, thinking, prefilling)\n- Apply core techniques: clear instructions, few-shot examples, role assignment\n- Advanced patterns: progressive disclosure, chain-of-thought, structured output\n- Avoid common mistakes and hallucinations\n- Production-ready prompt templates\n\n**Usage:**\n- \"Using anthropic-prompt-engineer, create a prompt for extracting structured data\"\n- \"Improve this prompt using Anthropic best practices\"\n- \"Generate a Claude-optimized prompt for code analysis\"\n- \"Debug why this prompt gives inconsistent results\"\n\n**Core Anthropic Techniques:**\n- **XML Tags** - Structure prompts with semantic tags like `<instructions>`, `<example>`, `<context>`\n- **Chain of Thought** - Ask Claude to think step-by-step for complex reasoning\n- **Prefilling** - Start Claude's response to guide format and style\n- **Few-Shot Examples** - Provide 2-5 diverse examples showing desired pattern\n- **Progressive Disclosure** - Load context incrementally to optimize token usage\n- **Clear Instructions** - Claude 4.x excels with explicit, unambiguous direction\n\n**Reference materials:**\n- `core_techniques.md` - Essential Anthropic techniques with examples\n- `advanced_techniques.md` - Advanced optimization methods\n- `common_mistakes.md` - Pitfalls to avoid\n- `claude_4_best_practices.md` - Claude 4.x specific guidance\n- `prompt_templates.md` - Ready-to-use production templates\n\n**Perfect for:**\n- Creating consistent, high-quality prompts for Claude\n- Learning Anthropic-specific techniques (vs OpenAI/GPT patterns)\n- Optimizing prompts for Claude 4.x models\n- Building prompt libraries for your team\n- Reducing hallucinations and errors\n- Achieving first-try success more often\n- Production prompt engineering\n\n**Example Improvements:**\n\nBefore:\n```\n\"Analyze this code\"\n```\n\nAfter (Anthropic-optimized):\n```\n<instructions>\nAnalyze the code below for:\n1. Security vulnerabilities\n2. Performance issues\n3. Code quality concerns\n\nFor each issue found:\n- Specify exact line number\n- Explain the problem\n- Provide specific fix recommendation\n</instructions>\n\n<code>\n[code here]\n</code>\n\n<output_format>\nReturn JSON array:\n[{\n  \"type\": \"security|performance|quality\",\n  \"line\": number,\n  \"issue\": \"description\",\n  \"fix\": \"recommendation\"\n}]\n</output_format>\n```\n\n[View anthropic-prompt-engineer skill â†’](./skills/anthropic-prompt-engineer)\n\n---\n\n### Engineering Skills\n\n#### openai-prompt-engineer\n\n**Generate and improve prompts using cutting-edge techniques for OpenAI GPT-5 and other LLMs.** Apply advanced patterns like chain-of-thought, few-shot prompting, structured output, and progressive disclosure to create effective, consistent prompts.\n\n**Key features:**\n- Generate new prompts from specifications\n- Improve existing prompts with proven techniques\n- Model-specific optimizations (GPT-5 vs Claude)\n- Advanced patterns: Chain-of-Thought, Few-Shot, XML structuring\n- Prompt quality analysis and debugging\n- Comprehensive best practices library\n\n**Usage:**\n- \"Using openai-prompt-engineer, create a prompt for code review\"\n- \"Improve this prompt for better results\"\n- \"Generate a GPT-5 optimized prompt for data analysis\"\n- \"Analyze this prompt and suggest improvements\"\n\n**Techniques covered:**\n- **GPT-5 specific**: Structured prompting (role+task+constraints), reasoning effort control, agentic behavior calibration, verbosity management\n- **Claude specific**: XML tag structuring, step-by-step thinking, progressive disclosure, long-context optimization\n- **Universal**: Chain-of-thought prompting, few-shot learning, zero-shot prompting, self-consistency, role-based prompting\n\n**Reference materials:**\n- `gpt5_techniques.md` - GPT-5 specific best practices and patterns\n- `claude_techniques.md` - Claude/Anthropic optimization strategies\n- `prompt_patterns.md` - Reusable templates for common tasks\n- `optimization_strategies.md` - Systematic prompt improvement framework\n\n**Perfect for:**\n- Creating consistent, high-quality prompts\n- Optimizing prompts for specific models\n- Learning advanced prompting techniques\n- Reducing API costs through better prompts\n- Achieving first-try success more often\n- Building prompt libraries for your team\n\n**Example improvements:**\n\nBefore:\n```\n\"Write code for authentication\"\n```\n\nAfter (GPT-5 optimized):\n```\nROLE: Senior TypeScript developer\nTASK: Implement JWT-based authentication service\nREQUIREMENTS:\n- TypeScript with strict mode\n- Include refresh token rotation\n- Comprehensive error handling\n- Unit tests with 80%+ coverage\nOUTPUT: Complete implementation with tests and usage example\n```\n\n[View openai-prompt-engineer skill â†’](./skills/openai-prompt-engineer)\n\n---\n\n#### git-worktrees\n\nManage Git worktrees for parallel Claude Code development. Run multiple Claude Code sessions simultaneously on different branches without conflicts.\n\n**Key features:**\n- Super simple scripts for worktree management\n- Interactive worktree creation and cleanup\n- Automatic sync with main branch\n- Best practices and command reference\n- Custom slash command template\n\n**Usage:**\n- \"Create a worktree for feature-api\"\n- \"List all active worktrees\"\n- \"Clean up old worktrees\"\n- \"Sync worktree with main branch\"\n\n**Includes:**\n- `create_worktree.sh` - Interactive worktree creation\n- `list_worktrees.sh` - View all active worktrees\n- `cleanup_worktrees.sh` - Remove old worktrees safely\n- `sync_worktree.sh` - Keep worktrees up-to-date\n- Complete command reference and best practices\n- Custom `/worktree` slash command template\n\n**Perfect for:**\n- Parallel AI development with multiple Claude sessions\n- Hotfixes during feature development\n- Code review without context switching\n- Experimentation without breaking main work\n\n[View git-worktrees skill â†’](./skills/git-worktrees)\n\n---\n\n#### llm-router\n\nRoute AI requests to different LLM providers using SwiftOpenAI-CLI.\n\n**Supported providers:**\n- OpenAI (GPT-4, GPT-5)\n- Grok (xAI)\n- Groq (Llama, Mixtral)\n- DeepSeek\n- OpenRouter (300+ models)\n\n**Usage:**\n- \"Use grok to explain quantum computing\"\n- \"Ask deepseek to solve this problem\"\n- \"Use groq for fast code generation\"\n\n[View llm-router skill â†’](./skills/llm-router)\n\n---\n\n#### engineer-expertise-extractor\n\n**ðŸ”¥ Extract and replicate engineering expertise from GitHub contributions.** Research any engineer's coding style, patterns, and best practices to create a structured knowledge base that AI agents can use to code like them.\n\n**Key features:**\n- GitHub CLI integration for PR analysis\n- Automated expertise extraction from code\n- Structured knowledge organization by topic\n- Coding style documentation (naming, formatting, structure)\n- Pattern identification and cataloging\n- Best practices extraction\n- Architectural decision documentation\n- Code review style analysis\n\n**Usage:**\n- \"Extract expertise from engineer @username\"\n- \"Research coding patterns from their PRs\"\n- \"Document their architectural decisions\"\n- \"Analyze their code review style\"\n- \"Create agent training profile\"\n\n**Includes:**\n- `extract_engineer.sh` - Full extraction workflow with GitHub CLI\n- Organized folder structure (coding_style/, patterns/, best_practices/, architecture/)\n- Template documentation files\n- PR analysis and pattern recognition\n- Profile README generation\n\n**Output Structure:**\n```\nengineer_profiles/\nâ””â”€â”€ [username]/\n    â”œâ”€â”€ README.md (profile overview)\n    â”œâ”€â”€ coding_style/ (conventions & preferences)\n    â”œâ”€â”€ patterns/ (common solutions & approaches)\n    â”œâ”€â”€ best_practices/ (quality standards)\n    â”œâ”€â”€ architecture/ (design decisions)\n    â”œâ”€â”€ code_review/ (feedback patterns)\n    â””â”€â”€ examples/ (real code samples)\n```\n\n**Perfect for:**\n- Creating \"digital mentors\" from senior engineers\n- Training AI agents to code in specific styles\n- Onboarding new engineers with real examples\n- Preserving knowledge before engineers leave\n- Establishing team coding standards\n- Code review training materials\n\n**Use Cases:**\n- **AI Agent Training:** \"Using engineer_profiles/senior_dev/, write code matching their style\"\n- **Knowledge Transfer:** Extract expertise before engineer leaves\n- **Team Standards:** Create evidence-based coding guidelines\n- **Onboarding:** Provide real examples from top engineers\n\n**Requirements:** GitHub CLI (`gh`) installed and authenticated\n\n[View engineer-expertise-extractor skill â†’](./skills/engineer-expertise-extractor)\n\n---\n\n#### engineer-skill-creator\n\n**Transform extracted expertise into actionable skills with progressive disclosure.** Takes engineer profiles from the extractor and creates structured, queryable skills that AI agents can use to find relevant expertise for specific tasks.\n\n**Key features:**\n- Progressive disclosure system (show only what's needed)\n- Task-based organization (authentication, API design, testing, etc.)\n- Language-specific guidance\n- Pattern library with examples\n- Interactive query tool\n- Quick reference guides\n- Automatic categorization\n\n**Usage:**\n- \"Create a skill from engineer profile\"\n- \"Transform expertise into queryable format\"\n- \"Generate progressive disclosure navigation\"\n- \"Package expertise for agent use\"\n\n**Workflow:**\n```bash\n# Step 1: Extract expertise\n./extract_engineer.sh senior_dev\n\n# Step 2: Create skill (THIS TOOL)\n./create_expert_skill.sh senior_dev\n\n# Step 3: Use with agents\n\"Using expert-skills/senior-dev-mentor/, implement auth\"\n```\n\n**Output Structure:**\n```\nexpert-skills/[name]-mentor/\nâ”œâ”€â”€ SKILL.md (documentation)\nâ”œâ”€â”€ query_expertise.sh (interactive query)\nâ”œâ”€â”€ expertise/\nâ”‚   â”œâ”€â”€ by_task/ (auth, API, testing, etc.)\nâ”‚   â”œâ”€â”€ by_language/ (TypeScript, Python, etc.)\nâ”‚   â”œâ”€â”€ by_pattern/ (DI, repository, etc.)\nâ”‚   â””â”€â”€ quick_reference/ (style, naming, etc.)\nâ””â”€â”€ examples/ (real code samples)\n```\n\n**Progressive Disclosure:**\nInstead of dumping all expertise at once, agents query specific needs:\n- \"How do they handle authentication?\" â†’ Gets only auth patterns\n- \"TypeScript coding style?\" â†’ Gets only TS conventions\n- \"Repository pattern?\" â†’ Gets only that pattern\n\n**Perfect for:**\n- Making expertise searchable and queryable\n- Enabling task-specific guidance\n- Creating AI agent training materials\n- Building onboarding resources\n- Scaling knowledge across teams\n\n**Use with agents:**\n```\n\"Using expert-skills/senior-dev-mentor/, write a user service\nfollowing their patterns and style\"\n\n\"Using expert-skills/tech-lead-mentor/, review this code using\ntheir standards\"\n```\n\n**Requirements:** Completed engineer profile from engineer-expertise-extractor\n\n**The Complete Workflow:**\n1. **Extract:** `engineer-expertise-extractor` â†’ Creates profile\n2. **Create:** `engineer-skill-creator` â†’ Transforms into skill\n3. **Use:** Reference skill in agent prompts â†’ Get expert guidance\n\n[View engineer-skill-creator skill â†’](./skills/engineer-skill-creator)\n\n---\n\n### Apple Development Skills\n\n#### swift-concurrency\n\n**Build, audit, and refactor Swift code using modern concurrency patterns (Swift 6+).** Comprehensive guide for async/await, Tasks, actors, MainActor, Sendable types, isolation domains, and Approachable Concurrency settings.\n\n**Key features:**\n- Building workflow with isolation decision trees\n- Auditing checklist for concurrency issues\n- Refactoring patterns (callbacks â†’ async/await, DispatchQueue â†’ actors)\n- Isolated parameters for non-Sendable types\n- Approachable Concurrency settings (Swift 6.2+)\n- Common mistakes and anti-patterns\n\n**Usage:**\n- \"Using swift-concurrency, audit this code for concurrency issues\"\n- \"Refactor this callback-based code to async/await\"\n- \"Should I use an actor or MainActor here?\"\n- \"Fix the Sendable errors in this code\"\n\n**Three Workflows:**\n- **Building:** Decision trees for isolation, async function design, parallel work\n- **Auditing:** Checklists for critical issues, common mistakes, SwiftUI-specific problems\n- **Refactoring:** Migrate callbacks, DispatchQueue, and Combine to modern concurrency\n\n**Quick Reference:**\n| Keyword | Purpose |\n|---------|---------|\n| `async` | Function can suspend |\n| `await` | Suspension point |\n| `Task { }` | Start async work, inherits isolation |\n| `@MainActor` | Runs on main thread |\n| `actor` | Type with isolated mutable state |\n| `nonisolated` | Opts out of actor isolation |\n| `@concurrent` | Always run on background (Swift 6.2+) |\n| `Sendable` | Safe to cross isolation boundaries |\n\n**Reference materials:**\n- `fundamentals.md` - async/await, Tasks, structured concurrency\n- `isolation.md` - Actors, MainActor, isolation domains\n- `sendable.md` - Sendable protocol, non-Sendable patterns\n- `common-mistakes.md` - Anti-patterns to avoid\n- `glossary.md` - Complete terminology reference\n\n**Perfect for:**\n- Swift 6 migration\n- Auditing existing concurrency code\n- Understanding isolation domains\n- Fixing Sendable errors\n- Learning modern Swift concurrency patterns\n\n[View swift-concurrency skill â†’](./skills/swift-concurrency)\n\n---\n\n#### swiftui-animation\n\n**Advanced SwiftUI animations, transitions, and Metal shader integration.** Comprehensive guidance for implementing animations, matched geometry effects, and GPU-accelerated visual effects in iOS and macOS apps.\n\n**Key features:**\n- Spring animations with iOS 17+ presets\n- View transitions (opacity, scale, slide, custom)\n- Matched geometry effect for hero animations\n- Metal shader integration (colorEffect, distortionEffect, layerEffect)\n- PhaseAnimator and KeyframeAnimator\n- HIG Motion design principles\n\n**Usage:**\n- \"Using swiftui-animation, create a hero animation between views\"\n- \"Add a spring animation to this button\"\n- \"Implement a Metal shader ripple effect\"\n- \"Create an expandable card animation\"\n\n**Animation Basics:**\n```swift\n// Explicit animation (preferred)\nwithAnimation(.spring(response: 0.4, dampingFraction: 0.75)) {\n    isExpanded.toggle()\n}\n\n// iOS 17+ spring presets\nwithAnimation(.snappy) { ... }  // Fast, small bounce\nwithAnimation(.smooth) { ... }  // Gentle, no bounce\nwithAnimation(.bouncy) { ... }  // More bounce\n```\n\n**Matched Geometry Effect:**\n```swift\n@Namespace var namespace\n\n// Source view\nThumbnailView()\n    .matchedGeometryEffect(id: \"hero\", in: namespace)\n\n// Destination view\nDetailView()\n    .matchedGeometryEffect(id: \"hero\", in: namespace)\n```\n\n**Reference materials:**\n- `motion-guidelines.md` - HIG Motion design principles\n- `animations.md` - Complete animation API guide\n- `transitions.md` - View transitions and hero animations\n- `metal-shaders.md` - GPU shader integration\n\n**Best Practices:**\n- Prefer explicit animations with `withAnimation`\n- Use spring animations for natural feel\n- Start with `.spring(response: 0.35, dampingFraction: 0.8)`\n- Keep animations under 400ms\n- Test on device (simulator timing differs)\n\n**Perfect for:**\n- iOS/macOS app developers\n- SwiftUI animation implementation\n- Hero transitions between views\n- Custom Metal shader effects\n- Polished, Apple-quality interactions\n\n[View swiftui-animation skill â†’](./skills/swiftui-animation)\n\n---\n\n#### releasing-macos-apps\n\n**Create notarized macOS app releases with Sparkle auto-updates, DMG installers, and GitHub releases.** Complete workflow for code signing, notarization, and distribution of macOS applications.\n\n**Key features:**\n- Step-by-step release checklist\n- Code signing with Developer ID certificates\n- Apple notarization (app-specific password & API key methods)\n- Sparkle framework integration for auto-updates\n- DMG creation with Applications folder symlink\n- GitHub release asset management\n- EdDSA signature generation for Sparkle\n\n**Usage:**\n- \"Release my macOS app with notarization\"\n- \"Create a DMG with Applications folder\"\n- \"Set up Sparkle auto-updates\"\n- \"Generate Sparkle signature for my app\"\n- \"Upload release assets to GitHub\"\n\n**Includes:**\n- `SKILL.md` - Complete release workflow with checklist\n- `NOTARIZATION.md` - Apple notarization guide (credentials & API keys)\n- `SPARKLE.md` - Sparkle framework setup and EdDSA signing\n- `TROUBLESHOOTING.md` - Common issues and solutions\n\n**Notarization Methods:**\n- **App-specific password:** Traditional method with Apple ID credentials\n- **API Key:** Modern method using App Store Connect API keys (better for CI/CD)\n\n**Sparkle Key Storage Options:**\n- File in project (gitignored)\n- macOS Keychain\n- Environment variables\n\n**Perfect for:**\n- macOS app developers\n- Independent software vendors\n- Open source macOS projects\n- Apps requiring auto-update functionality\n- GitHub-based distribution workflows\n\n**Use with Claude:**\n```\n\"Using releasing-macos-apps, create a notarized release of my app\"\n\n\"Set up Sparkle auto-updates with EdDSA signing\"\n\n\"Troubleshoot my notarization failure\"\n```\n\n[View releasing-macos-apps skill â†’](./skills/releasing-macos-apps)\n\n---\n\n### Product Management Skills\n\n#### prd-generator\n\nGenerate comprehensive Product Requirements Documents (PRDs) for product managers.\n\n**Key features:**\n- Interactive PRD generation workflow\n- Standard PRD templates (full, lean, one-pager)\n- User story creation with acceptance criteria\n- Success metrics frameworks (AARRR, HEART, North Star, OKRs)\n- PRD validation and completeness checking\n- Comprehensive reference materials\n\n**Usage:**\n- \"Create a PRD for user authentication\"\n- \"Generate a lean PRD for dark mode feature\"\n- \"Write requirements for a new dashboard\"\n- \"Help me create user stories for checkout flow\"\n\n**Includes:**\n- Complete PRD template with all standard sections\n- User story examples and best practices\n- Metrics frameworks guide (AARRR, HEART, OKRs)\n- Interactive generation script\n- Validation script for quality checking\n\n[View prd-generator skill â†’](./skills/prd-generator)\n\n---\n\n### Product Marketing Skills\n\n#### technical-launch-planner\n\nPlan and execute technical product launches for developer tools, APIs, and technical products.\n\n**Key features:**\n- Launch tier assessment (Tier 1/2/3 framework)\n- Interactive launch plan generation\n- Developer enablement checklists\n- Technical messaging templates\n- Launch readiness validation\n- Post-launch tracking\n\n**Usage:**\n- \"Plan a launch for our new API\"\n- \"Determine the launch tier for this feature\"\n- \"Create a developer enablement checklist\"\n- \"Generate technical launch messaging\"\n- \"Validate launch readiness\"\n\n**Includes:**\n- `assess_launch_tier.sh` - Determine appropriate launch tier\n- `generate_launch_plan.sh` - Create comprehensive launch plan\n- `validate_readiness.sh` - Pre-launch readiness checker\n- Developer enablement complete checklist\n- Technical messaging frameworks and templates\n- Launch tier frameworks (GA, Beta, Preview)\n\n**Perfect for:**\n- Developer tools and platforms\n- API and SDK launches\n- Technical infrastructure products\n- B2D (Business-to-Developer) products\n\n[View technical-launch-planner skill â†’](./skills/technical-launch-planner)\n\n---\n\n### Design Skills\n\n#### design-brief-generator\n\nGenerate comprehensive design briefs for design projects, ensuring alignment and clarity before design work begins.\n\n**Key features:**\n- Interactive design brief generation\n- Complete design brief template with all sections\n- Accessibility guidelines (WCAG 2.1)\n- Design principles framework\n- User research methods guide\n- Brief validation and completeness checking\n\n**Usage:**\n- \"Create a design brief for mobile app redesign\"\n- \"Generate a brief for new feature design\"\n- \"Help me document design requirements\"\n- \"Validate my design brief for completeness\"\n- \"What accessibility requirements should I include?\"\n\n**Includes:**\n- `generate_brief.sh` - Interactive brief generation\n- `validate_brief.sh` - Brief completeness validation\n- Complete design brief template\n- WCAG 2.1 accessibility guidelines\n- Design principles creation guide\n- User research methods reference\n\n**Perfect for:**\n- UX/UI designers planning projects\n- Design system work\n- Feature design projects\n- Redesign initiatives\n- Stakeholder alignment\n\n[View design-brief-generator skill â†’](./skills/design-brief-generator)\n\n---\n\n#### frontend-designer\n\n**Transform frontend design through progressive disclosure skills.** Build accessible, responsive, high-performance user interfaces with modern CSS, design tokens, and component-driven architecture.\n\n**Key features:**\n- Component generation with accessibility built-in\n- Design system setup with comprehensive tokens\n- WCAG 2.1 AA compliance auditing\n- Design tokens (colors, typography, spacing, shadows)\n- Responsive design patterns\n- Component library architecture\n- Accessibility-first approach\n- Performance optimization\n\n**Usage:**\n- \"Generate an accessible button component\"\n- \"Set up a design system with tokens\"\n- \"Audit this page for accessibility\"\n- \"Create a responsive card layout\"\n- \"Build a component library\"\n\n**Includes:**\n- `generate_component.sh` - Create accessible components (React, Vue, Vanilla JS)\n- `setup_design_system.sh` - Initialize design system with tokens\n- `audit_accessibility.sh` - Comprehensive WCAG 2.1 AA checker\n- Design tokens reference (colors, typography, spacing, etc.)\n- Accessibility checklist (complete WCAG 2.1 guide)\n- Responsive patterns (mobile-first, layouts, grids)\n- Component library architecture guide\n\n**Output:**\n```\ndesign-system/\nâ”œâ”€â”€ tokens/\nâ”‚   â”œâ”€â”€ colors.css (brand, semantic, neutral)\nâ”‚   â”œâ”€â”€ typography.css (fluid type, weights)\nâ”‚   â”œâ”€â”€ spacing.css (spacing scale, containers)\nâ”‚   â”œâ”€â”€ shadows.css (elevation system)\nâ”‚   â””â”€â”€ borders.css (radius, widths)\nâ””â”€â”€ components/\n    â””â”€â”€ Button/\n        â”œâ”€â”€ Button.tsx (accessible component)\n        â”œâ”€â”€ Button.test.tsx (unit tests)\n        â”œâ”€â”€ Button.module.css (scoped styles)\n        â””â”€â”€ Button.stories.tsx (Storybook)\n```\n\n**Perfect for:**\n- Frontend developers building design systems\n- Creating accessible user interfaces\n- Implementing responsive layouts\n- Component library development\n- WCAG 2.1 AA compliance\n- Modern CSS architecture\n- Design token systems\n\n**Features in depth:**\n- **Accessibility:** Focus management, ARIA attributes, keyboard navigation, screen reader support\n- **Responsive:** Mobile-first, fluid typography, container queries, responsive images\n- **Components:** Button, Input, Card, Modal, Dropdown with variants and states\n- **Design Tokens:** CSS custom properties for theming, dark mode support\n- **Testing:** Unit tests, accessibility tests, visual regression\n- **Performance:** Code splitting, lazy loading, optimized rendering\n\n**Use with Claude:**\n```\n\"Using the frontend-designer skill, create an accessible navigation\ncomponent with mobile menu, keyboard support, and WCAG 2.1 compliance\"\n\n\"Set up a design system with design tokens following the\nfrontend-designer patterns\"\n\n\"Audit my landing page for accessibility issues using the\nfrontend-designer skill\"\n```\n\n[View frontend-designer skill â†’](./skills/frontend-designer)\n\n---\n\n#### apple-hig-designer\n\n**Design native iOS apps following Apple's Human Interface Guidelines.** Create accessible, intuitive interfaces for iPhone, iPad, and Apple Watch with SwiftUI and UIKit components that feel truly native.\n\n**Key features:**\n- iOS component generation (SwiftUI & UIKit)\n- Apple HIG compliance validation\n- iOS accessibility auditing (VoiceOver, Dynamic Type)\n- San Francisco font system & Dynamic Type\n- Semantic colors with automatic dark mode\n- 8-point grid system & safe areas\n- Native iOS patterns & components\n- SF Symbols integration\n\n**Usage:**\n- \"Generate an iOS button component in SwiftUI\"\n- \"Validate my design against Apple HIG\"\n- \"Audit this view for iOS accessibility\"\n- \"Show me navigation patterns for iOS\"\n- \"Create a list view with proper spacing\"\n\n**Includes:**\n- `generate_ios_component.sh` - Create SwiftUI/UIKit components\n- `validate_design.sh` - Check Apple HIG compliance\n- `audit_accessibility.sh` - iOS accessibility checker\n- Typography reference (San Francisco, Dynamic Type)\n- Colors reference (semantic colors, dark mode)\n- Components catalog (buttons, lists, navigation, modals)\n- Accessibility guide (VoiceOver, reduce motion, contrast)\n- Layout & spacing guide (8pt grid, safe areas, touch targets)\n\n**Perfect for:**\n- iOS app developers\n- SwiftUI & UIKit development\n- Native iOS design\n- Apple HIG compliance\n- iOS accessibility (VoiceOver, Dynamic Type)\n- iPad multitasking support\n- Apple Watch app design\n\n**Design Principles:**\n- **Clarity:** Clean, focused content\n- **Deference:** UI supports content, doesn't compete\n- **Depth:** Visual layers and realistic motion\n\n**Components Covered:**\n- Navigation: NavigationStack, TabView, Toolbar\n- Controls: Button, Toggle, Slider, Picker, TextField\n- Content: List, ScrollView, Grid\n- Presentations: Sheet, Alert, ConfirmationDialog\n- Indicators: ProgressView, Activity Indicator\n\n**Accessibility Features:**\n- VoiceOver labels, hints, values\n- Dynamic Type (11 size categories)\n- Reduce Motion support\n- Increase Contrast support\n- Minimum 44pt touch targets\n- Color contrast validation\n\n**Use with Claude:**\n```\n\"Using apple-hig-designer, create a SwiftUI navigation view\nwith proper large titles and accessibility support\"\n\n\"Validate my iOS app design against Apple HIG guidelines\"\n\n\"Audit this SwiftUI view for VoiceOver and Dynamic Type compliance\"\n```\n\n[View apple-hig-designer skill â†’](./skills/apple-hig-designer)\n\n---\n\n#### book-illustrator\n\n**ðŸŽ¨ Expert children's book illustrator guide with 2024-2025 best practices.** Focuses on age-appropriate styles, color theory, character design, and visual storytelling for kids books that captivate young readers.\n\n**Key features:**\n- Age-appropriate design (ages 0-12)\n- Character development and expressiveness\n- Color theory for emotion and mood\n- Visual storytelling through composition\n- Current illustration trends and timeless techniques\n- Professional illustration standards\n- Print and digital publishing requirements\n\n**Usage:**\n- \"Design a character for a children's book about friendship\"\n- \"Create a color palette for a bedtime story\"\n- \"Develop illustration guidelines for ages 4-6\"\n- \"Plan visual storytelling for a picture book\"\n\n**Includes:**\n- Character design principles\n- Color theory and psychology\n- Composition and layout techniques\n- Illustration style guide\n- Age-specific design considerations\n\n**Perfect for:**\n- Children's book illustrators\n- Graphic designers working on kids content\n- Authors self-publishing picture books\n- Art directors for children's publishing\n\n[View book-illustrator skill â†’](./skills/book-illustrator)\n\n---\n\n### Content & Writing Skills\n\n#### content-brief-generator\n\nGenerate comprehensive content briefs for writers, ensuring strategic, SEO-optimized content across all formats.\n\n**Key features:**\n- Interactive content brief generation\n- SEO strategy and keyword research framework\n- Content structure frameworks (AIDA, PAS, How-To, etc.)\n- Tone and voice development guide\n- Brief validation and completeness checking\n- Templates for blog posts, documentation, landing pages, and more\n\n**Usage:**\n- \"Create a blog post brief for JWT authentication\"\n- \"Generate a landing page brief\"\n- \"Help me write a technical documentation brief\"\n- \"What SEO keywords should I target?\"\n- \"Validate my content brief\"\n\n**Includes:**\n- `generate_brief.sh` - Interactive brief generation\n- `validate_brief.sh` - Brief completeness validation\n- Complete SEO guidelines and best practices\n- Content structure frameworks (AIDA, PAS, storytelling, etc.)\n- Tone and voice development guide\n- Copywriting formulas and templates\n\n**Perfect for:**\n- Content writers and marketers\n- Technical writers\n- Copywriters\n- Content strategists\n- SEO specialists\n\n[View content-brief-generator skill â†’](./skills/content-brief-generator)\n\n---\n\n#### kids-book-writer\n\n**ðŸ“š Expert children's book writer creating delightful, engaging books for ages 2-9.** Specializes in rhyming books, stories, songs with proper values, educational content, and age-appropriate language. Crafts books that captivate young readers while teaching important life lessons.\n\n**Key features:**\n- Rhyming books with perfect meter and rhythm\n- Picture book stories with engaging narratives\n- Songs and poems for young learners\n- Educational content (phonics, sight words, vocabulary)\n- Values and life lessons (kindness, empathy, courage)\n- Age-appropriate language for reading stages\n- Interactive elements (call-and-response, repetition)\n- Illustration guidance for bringing stories to life\n\n**Usage:**\n- \"Write a rhyming book about sharing for 3-year-olds\"\n- \"Create a bedtime story with a lesson about courage\"\n- \"Generate a phonics song for letter sounds\"\n- \"Write a picture book about making friends\"\n\n**Includes:**\n- Age-appropriate writing guidelines\n- Story structure frameworks\n- Rhyming techniques and patterns\n- Values and themes reference\n- Bestseller elements guide\n\n**Perfect for:**\n- Children's book authors\n- Parents creating custom stories\n- Educators developing reading materials\n- Content creators for kids\n\n[View kids-book-writer skill â†’](./skills/kids-book-writer)\n\n---\n\n### Trading & Finance Skills\n\n#### trading-plan-generator\n\nGenerate comprehensive trading plans with risk management, position sizing, and discipline frameworks for consistent, profitable trading.\n\n**Key features:**\n- Interactive trading plan generation\n- Risk management frameworks (1% rule, daily loss limits)\n- Position sizing calculators\n- Entry/exit strategy templates\n- Trading psychology and discipline guide\n- Performance tracking metrics\n- Plan validation and compliance checking\n\n**Usage:**\n- \"Create a trading plan for swing trading\"\n- \"Calculate position size for this trade\"\n- \"What should my daily loss limit be?\"\n- \"Help me set up risk management rules\"\n- \"Validate my trading plan\"\n\n**Includes:**\n- `generate_plan.sh` - Interactive plan generation (7 steps)\n- `validate_plan.sh` - Plan completeness validation\n- `position_calculator.sh` - Quick position sizing tool\n- Complete risk management guide (1% rule, R:R, stops)\n- Trading psychology reference (emotions, discipline, tilt)\n- Performance metrics and tracking frameworks\n\n**Perfect for:**\n- Day traders\n- Swing traders\n- Position traders\n- Options traders\n- Anyone serious about trading discipline\n\n**âš ï¸ Important:** This provides frameworks, not financial advice. Trading involves substantial risk of loss.\n\n[View trading-plan-generator skill â†’](./skills/trading-plan-generator)\n\n---\n\n### Database & Query Skills\n\n#### query-expert\n\n**Master SQL and database queries across multiple systems.** Generate optimized queries, analyze performance with EXPLAIN plans, design effective indexes, and troubleshoot slow queries for PostgreSQL, MySQL, MongoDB, and more.\n\n**Key features:**\n- Interactive query generation (SQL, MongoDB, GraphQL)\n- Query optimization analysis with recommendations\n- EXPLAIN plan interpretation guide\n- Index strategy recommendations\n- Performance troubleshooting\n- Multi-database support\n- Best practices and anti-patterns\n- Automated query scoring\n\n**Usage:**\n- \"Generate an optimized SELECT query with JOINs\"\n- \"Analyze this slow query and suggest optimizations\"\n- \"How do I interpret this EXPLAIN output?\"\n- \"Create indexes for better performance\"\n- \"Convert this SQL to MongoDB aggregation\"\n\n**Includes:**\n- `generate_query.sh` - Interactive query generator\n- `optimize_query.sh` - Query optimization analyzer\n- `analyze_performance.sh` - EXPLAIN plan guide & performance analysis\n- SQL patterns reference (SELECT, JOIN, GROUP BY, CTEs, window functions)\n- Indexing strategies (composite, covering, partial indexes)\n- Query optimization techniques\n- NoSQL queries (MongoDB, GraphQL)\n\n**Databases Supported:**\n- **SQL:** PostgreSQL, MySQL, SQLite, SQL Server, Oracle\n- **NoSQL:** MongoDB, Redis, Elasticsearch, Cassandra\n- **Query Languages:** SQL, MongoDB Query Language, GraphQL, Cypher\n\n**Query Patterns:**\n- SELECT with JOINs (INNER, LEFT, RIGHT, FULL OUTER)\n- Aggregation (GROUP BY, HAVING, aggregates)\n- Window functions (ROW_NUMBER, RANK, running totals)\n- CTEs (Common Table Expressions)\n- Subqueries and correlated subqueries\n- MongoDB aggregation pipelines\n- GraphQL queries with fragments\n\n**Optimization Techniques:**\n- Avoid SELECT * (select only needed columns)\n- Index creation on WHERE/JOIN/ORDER BY columns\n- Composite index column ordering\n- Covering indexes for index-only scans\n- EXISTS vs IN for subqueries\n- Batch operations\n- LIMIT/pagination\n- Query plan analysis\n\n**Performance Analysis:**\n- PostgreSQL EXPLAIN ANALYZE interpretation\n- MySQL EXPLAIN output analysis\n- MongoDB explain() stats\n- Index usage verification\n- Table scan detection\n- JOIN type optimization\n- Automated performance scoring\n\n**Use with Claude:**\n```\n\"Using query-expert, generate an optimized query to get\ntop 10 customers by total order value with their details\"\n\n\"Analyze this query and suggest performance improvements:\nSELECT * FROM orders WHERE YEAR(created_at) = 2024\"\n\n\"Explain what this EXPLAIN ANALYZE output means and\nhow to optimize the query\"\n```\n\n[View query-expert skill â†’](./skills/query-expert)\n\n---\n\n### QA & Testing Skills\n\n#### qa-test-planner\n\nGenerate comprehensive test plans, manual test cases, regression suites, and bug reports for QA engineers. Includes Figma MCP integration for design validation.\n\n**Key features:**\n- Interactive test case generation\n- Test plan templates and strategy\n- Regression test suite builder\n- Figma design validation (with MCP)\n- Bug report templates\n- Test coverage analysis\n- Test execution tracking\n\n**Usage:**\n- \"Create test cases for login feature\"\n- \"Generate a regression test suite\"\n- \"Validate UI against Figma design\"\n- \"Create a bug report for payment issue\"\n- \"Build a test plan for new feature\"\n\n**Includes:**\n- `generate_test_cases.sh` - Interactive test case creation\n- `create_bug_report.sh` - Structured bug documentation\n- Figma validation guide (design-implementation comparison)\n- Regression testing best practices\n- Test plan templates and examples\n- Bug severity and priority frameworks\n\n**Perfect for:**\n- QA Engineers\n- Manual testers\n- Regression testers\n- UI/Visual testers\n- Test leads and managers\n\n**ðŸŽ¨ Figma MCP:** When configured, enables design-implementation validation and visual testing.\n\n[View qa-test-planner skill â†’](./skills/qa-test-planner)\n\n---\n\n### Educational & Learning Skills\n\n#### math-teacher\n\n**ðŸŽ“ Interactive math teacher that instantly generates playful, gamified learning experiences.** Creates visual playgrounds, interactive artifacts, and engaging games for kids and adults to learn math from basic arithmetic to advanced calculus.\n\n**Key features:**\n- Instant playground generation - creates HTML artifacts on demand\n- Adaptive learning - scales from elementary to college level\n- Visual learning - graphs, animations, interactive visualizations\n- Gamification - points, achievements, challenges, progress tracking\n- Question-driven - user asks, teacher generates custom experiences\n- Playful techniques - engaging animations, rewards, fun challenges\n- No setup required - all artifacts work standalone in browser\n\n**Topics covered:**\n- **Elementary**: Fractions, multiplication, geometry, patterns, time & money\n- **Middle School**: Linear equations, ratios, percentages, statistics, Pythagorean theorem\n- **High School**: Quadratics, trigonometry, exponentials, logarithms, polynomials\n- **Advanced**: Derivatives, integrals, limits, optimization, differential equations\n\n**Usage:**\n- \"Help me understand fractions\"\n- \"Show me how derivatives work\"\n- \"I don't understand quadratic functions\"\n- \"Challenge me on mental math\"\n- \"Let me explore the Pythagorean theorem\"\n\n**Includes:**\n- `generate_playground.sh` - Create interactive math playground\n- `generate_game.sh` - Build gamified math challenge\n- Complete reference materials (basic_math, algebra, calculus, gamification)\n- Interactive visualization templates\n- Game mechanics and reward systems\n\n**Perfect for:**\n- Students learning math concepts\n- Teachers creating interactive lessons\n- Parents helping kids with homework\n- Adults refreshing math skills\n- Anyone wanting to make math fun\n\n**Example artifacts:**\n- ðŸ• Fraction Pizza Party - visual fraction explorer with sliders\n- ðŸ“Š Quadratic Explorer - real-time parabola graphing with coefficients\n- ðŸ“ˆ Derivative Visualizer - tangent lines and limit animations\n- ðŸŽ® Speed Math Challenge - timed game with progressive difficulty\n- ðŸ§© Pattern Finder - discover number sequences interactively\n\n**Use with Claude:**\n```\n\"Using math-teacher, help me understand how integrals work\"\n\n\"Create an interactive playground for learning quadratic functions\"\n\n\"Generate a fun math game for practicing multiplication\"\n```\n\n[View math-teacher skill â†’](./skills/math-teacher)\n\n---\n\n#### reading-teacher\n\n**ðŸ“š Interactive reading teacher that instantly generates playful, engaging learning experiences for children ages 1-10.** Creates visual playgrounds, phonics games, and interactive stories to build reading skills from letter recognition to comprehension.\n\n**Key features:**\n- Instant playground generation - creates HTML artifacts on demand\n- Age-appropriate content - tailored for ages 1-10 with developmental stages\n- Multi-sensory learning - visual, auditory, and interactive elements\n- Phonics & sight words - systematic instruction and high-frequency words\n- Story building - interactive creation and comprehension activities\n- Gamification - stars, badges, rewards, and progress tracking\n- Parent/teacher tools - progress reports and customization options\n\n**Reading stages:**\n- **Pre-Reading (Ages 1-3)**: Letter recognition, sounds, phonemic awareness\n- **Early Reading (Ages 3-5)**: Letter-sound correspondence, CVC words, simple sight words\n- **Beginning Readers (Ages 5-7)**: Phonics patterns, expanding sight words, simple sentences\n- **Developing Readers (Ages 7-10)**: Advanced phonics, comprehension, vocabulary\n\n**Usage:**\n- \"Help my toddler learn letters\"\n- \"Practice sight words for first grade\"\n- \"Phonics games for kindergarten\"\n- \"Reading comprehension for 2nd grade\"\n- \"Build a story with my child\"\n\n**Includes:**\n- `generate_playground.sh` - Create interactive reading playground\n- `generate_game.sh` - Build phonics or sight word game\n- Complete reference materials (phonics, sight_words, comprehension)\n- Interactive activity templates\n- Progress tracking systems\n\n**Perfect for:**\n- Parents teaching young children\n- Homeschool reading instruction\n- Early literacy educators\n- ESL/ELL learners\n- Reading intervention support\n\n**Example artifacts:**\n- ðŸ”¤ Letter Land Adventure - interactive alphabet with sounds\n- ðŸ“– Sight Word Safari - timed recognition challenges\n- ðŸŽ¯ Phonics Matching - CVC word building games\n- ðŸ“š Story Builder Studio - create and read stories\n- ðŸ§© Word Family Explorer - rhyming and pattern practice\n\n**Use with Claude:**\n```\n\"Using reading-teacher, help my 4-year-old learn letter sounds\"\n\n\"Create a sight word practice game for kindergarten\"\n\n\"Generate an interactive story for reading comprehension\"\n```\n\n[View reading-teacher skill â†’](./skills/reading-teacher)\n\n---\n\n#### leetcode-teacher\n\n**ðŸš€ Interactive LeetCode-style teacher for mastering technical interviews.** Generates browser-based coding playgrounds with real product challenges, teaches the 20 essential patterns, supports Python/TypeScript/Kotlin/Swift, and provides progressive difficulty training.\n\n**Key features:**\n- Interactive code editor - browser-based with syntax highlighting\n- Multi-language support - Python, TypeScript, Kotlin, Swift\n- Real product challenges - Instagram, Uber, Netflix, Amazon scenarios\n- Pattern recognition - Master the 20 essential coding patterns\n- Progressive difficulty - Easy â†’ Medium â†’ Hard â†’ Expert\n- Instant feedback - Run tests in real-time with detailed explanations\n- Technique teaching - Learn optimization strategies\n\n**Patterns covered:**\n- **Arrays**: Two Pointers, Sliding Window, Fast & Slow Pointers\n- **Trees & Graphs**: BFS, DFS, Topological Sort\n- **Dynamic Programming**: Knapsack, Fibonacci, LCS\n- **Advanced**: Binary Search, Top K, Backtracking, Union Find, Tries\n\n**Usage:**\n- \"Practice two pointers with Instagram example\"\n- \"Generate sliding window problem for Netflix\"\n- \"Teach me BFS with LinkedIn connections\"\n- \"Hard dynamic programming challenge\"\n- \"Show me all heap patterns\"\n\n**Includes:**\n- `generate_playground.sh` - Create interactive coding environments\n- `generate_problem.sh` - Generate specific problem types\n- Complete reference materials (patterns, data_structures)\n- Multi-language code templates\n- Real product scenario examples\n\n**Perfect for:**\n- FAANG interview preparation\n- Coding pattern mastery\n- Algorithm practice\n- Technical interview training\n- Competitive programming\n\n**Example challenges:**\n- ðŸŽ¯ Two Sum (Instagram Mutual Likes)\n- ðŸ“Š Top K Elements (Reddit Top Posts)\n- ðŸ”— BFS (LinkedIn Degrees of Connection)\n- ðŸ“… Merge Intervals (Google Calendar Slots)\n- ðŸš— Shortest Path (Uber Driver Matching)\n\n**Use with Claude:**\n```\n\"Using leetcode-teacher, create a two pointers playground for Instagram\"\n\n\"Generate a BFS problem with LinkedIn connections context\"\n\n\"Show me sliding window pattern with Netflix recommendations\"\n```\n\n[View leetcode-teacher skill â†’](./skills/leetcode-teacher)\n\n---\n\n## Installation\n\nYou have two ways to use this skills collection:\n\n### Option 1: Install ALL Skills (Bundle)\n\nGet all 23 skills at once with intelligent routing:\n\n```bash\n/plugin marketplace add jamesrochabrun/skills\n/plugin install all-skills@skills-marketplace\n```\n\n**When to use this:**\n- You want access to all skills\n- You prefer Claude to automatically choose relevant skills\n- You work across multiple domains (engineering, product, design, etc.)\n\n### Option 2: Install Individual Skills\n\nPick only the skills you need for better performance and focused context:\n\n```bash\n# First, add the marketplace\n/plugin marketplace add jamesrochabrun/skills\n\n# Then install specific skills\n/plugin install anthropic-architect@skills-marketplace\n/plugin install prd-generator@skills-marketplace\n/plugin install frontend-designer@skills-marketplace\n# ... install any skills you need\n```\n\n**When to use this:**\n- You work in specific domains\n- You want optimal performance with smaller context\n- You prefer explicit skill activation\n\n### Available Individual Skills\n\n**AI & Architecture:**\n- `/plugin install anthropic-architect@skills-marketplace`\n- `/plugin install anthropic-prompt-engineer@skills-marketplace`\n\n**Engineering:**\n- `/plugin install openai-prompt-engineer@skills-marketplace`\n- `/plugin install git-worktrees@skills-marketplace`\n- `/plugin install llm-router@skills-marketplace`\n- `/plugin install engineer-expertise-extractor@skills-marketplace`\n- `/plugin install engineer-skill-creator@skills-marketplace`\n\n**Product Management:**\n- `/plugin install prd-generator@skills-marketplace`\n- `/plugin install technical-launch-planner@skills-marketplace`\n\n**Design:**\n- `/plugin install design-brief-generator@skills-marketplace`\n- `/plugin install frontend-designer@skills-marketplace`\n- `/plugin install apple-hig-designer@skills-marketplace`\n- `/plugin install book-illustrator@skills-marketplace`\n\n**Content & Writing:**\n- `/plugin install content-brief-generator@skills-marketplace`\n- `/plugin install kids-book-writer@skills-marketplace`\n\n**Trading & Finance:**\n- `/plugin install trading-plan-generator@skills-marketplace`\n\n**Database & Query:**\n- `/plugin install query-expert@skills-marketplace`\n\n**QA & Testing:**\n- `/plugin install qa-test-planner@skills-marketplace`\n\n**Educational & Learning:**\n- `/plugin install math-teacher@skills-marketplace`\n- `/plugin install reading-teacher@skills-marketplace`\n- `/plugin install leetcode-teacher@skills-marketplace`\n\n**Apple Development:**\n- `/plugin install swift-concurrency@skills-marketplace`\n- `/plugin install swiftui-animation@skills-marketplace`\n- `/plugin install releasing-macos-apps@skills-marketplace`\n\n### Plugin Structure\n\nThe plugin follows the standard Claude Code plugin architecture:\n\n```\nskills/\nâ”œâ”€â”€ .claude-plugin/\nâ”‚   â”œâ”€â”€ plugin.json          # Plugin metadata\nâ”‚   â””â”€â”€ marketplace.json     # Marketplace configuration (25 plugins: 1 bundle + 24 individual)\nâ”œâ”€â”€ skills/                   # All skills collection (24 total)\nâ”‚   â”œâ”€â”€ anthropic-architect/\nâ”‚   â”œâ”€â”€ anthropic-prompt-engineer/\nâ”‚   â”œâ”€â”€ openai-prompt-engineer/\nâ”‚   â”œâ”€â”€ git-worktrees/\nâ”‚   â”œâ”€â”€ llm-router/\nâ”‚   â”œâ”€â”€ engineer-expertise-extractor/\nâ”‚   â”œâ”€â”€ engineer-skill-creator/\nâ”‚   â”œâ”€â”€ swift-concurrency/\nâ”‚   â”œâ”€â”€ swiftui-animation/\nâ”‚   â”œâ”€â”€ releasing-macos-apps/\nâ”‚   â”œâ”€â”€ prd-generator/\nâ”‚   â”œâ”€â”€ technical-launch-planner/\nâ”‚   â”œâ”€â”€ design-brief-generator/\nâ”‚   â”œâ”€â”€ frontend-designer/\nâ”‚   â”œâ”€â”€ apple-hig-designer/\nâ”‚   â”œâ”€â”€ book-illustrator/\nâ”‚   â”œâ”€â”€ content-brief-generator/\nâ”‚   â”œâ”€â”€ kids-book-writer/\nâ”‚   â”œâ”€â”€ trading-plan-generator/\nâ”‚   â”œâ”€â”€ query-expert/\nâ”‚   â”œâ”€â”€ qa-test-planner/\nâ”‚   â”œâ”€â”€ math-teacher/\nâ”‚   â”œâ”€â”€ reading-teacher/\nâ”‚   â””â”€â”€ leetcode-teacher/\nâ”œâ”€â”€ README.md                 # This file\nâ””â”€â”€ LICENSE\n```\n\n### How It Works\n\n**Marketplace Configuration:**\n- The `marketplace.json` exposes 25 installable options\n- 1 \"all-skills\" bundle with `strict: false` (intelligent routing across all 24 skills)\n- 24 individual skills with `strict: true` (explicit activation when installed)\n\n**Installation Flexibility:**\n- Install the bundle for comprehensive coverage with smart skill selection\n- Install individual skills for focused, high-performance context\n- Mix and match based on your needs\n\n## Requirements\n\n- Claude Code\n- Skills may have their own dependencies (check individual skill README)\n\n## Contributing\n\nFeel free to contribute additional skills or improvements via pull requests.\n\n## License\n\nMIT License - See individual skills for their specific licenses.\n\n## Architecture\n\nThis marketplace provides flexible installation options:\n\n### Bundle Installation (all-skills)\n- **What:** All 23 skills in one package\n- **Behavior:** `strict: false` enables intelligent skill routing\n- **Best for:** Users who work across multiple domains and want comprehensive coverage\n- **Trade-off:** Larger context window, but Claude automatically selects relevant skills\n\n### Individual Installation\n- **What:** Install only specific skills you need\n- **Behavior:** `strict: true` ensures explicit skill activation\n- **Best for:** Focused workflows in specific domains (e.g., only engineering or only design)\n- **Trade-off:** Smaller context window for better performance, but requires manual skill selection\n\n### Technical Details\n\n**marketplace.json structure:**\n- 24 total plugin entries\n- 1 \"all-skills\" bundle pointing to root with all 23 skills\n- 23 individual plugins, each pointing to a single skill\n- All use same repository source (`./`) with different skill paths\n\n**Why this works:**\n- No duplication: Skills live in one place (`skills/` directory)\n- Flexible installation: Users choose bundle vs individual\n- No maintenance burden: No individual `plugin.json` files needed\n- Clean architecture: Single source of truth in `marketplace.json`\n\nFor more information about Claude Code plugins and marketplaces, visit the [official documentation](https://github.com/anthropics/claude-code/tree/main/plugins).\n\n## Credits\n\nCreated by [@jamesrochabrun](https://github.com/jamesrochabrun)\n\nBuilt for use with [Claude Code](https://claude.ai/code) by Anthropic.\n\n## Version\n\n**Current Version:** 2.2.0\n\n**What's New in 2.2.0:**\n- ðŸ“¦ releasing-macos-apps - Complete macOS release workflow with notarization\n- ðŸŽ Renamed category to \"Apple Development\" (3 skills)\n- ðŸ”‘ API Key authentication for notarization (App Store Connect)\n- ðŸ” Multiple Sparkle key storage options\n- ðŸŽ¯ 25 installable options (1 bundle + 24 individual skills)\n\n**What's New in 2.1.0:**\n- ðŸŽ New iOS & Swift Development category with 2 skills\n- âš¡ swift-concurrency - Modern Swift 6+ concurrency patterns\n- ðŸŽ¬ swiftui-animation - Advanced animations and Metal shaders\n- ðŸŽ¯ 24 installable options (1 bundle + 23 individual skills)\n\n**What's New in 2.0.0:**\n- âœ¨ Individual skill installation support\n- âš¡ Better performance with focused skill selection\n- ðŸ”§ Smart routing with `strict: false` for bundle, `strict: true` for individual skills\n\nSee [marketplace.json](./.claude-plugin/marketplace.json) for complete configuration.\n"
      },
      "plugins": [
        {
          "name": "all-skills",
          "description": "Complete collection of all 23 skills including engineering, iOS/Swift, product, design, content, finance, database, QA, educational, and AI prompt engineering skills",
          "source": "./",
          "strict": true,
          "skills": [
            "./skills/anthropic-architect",
            "./skills/anthropic-prompt-engineer",
            "./skills/apple-hig-designer",
            "./skills/book-illustrator",
            "./skills/content-brief-generator",
            "./skills/design-brief-generator",
            "./skills/engineer-expertise-extractor",
            "./skills/engineer-skill-creator",
            "./skills/frontend-designer",
            "./skills/git-worktrees",
            "./skills/kids-book-writer",
            "./skills/leetcode-teacher",
            "./skills/llm-router",
            "./skills/math-teacher",
            "./skills/openai-prompt-engineer",
            "./skills/prd-generator",
            "./skills/qa-test-planner",
            "./skills/query-expert",
            "./skills/reading-teacher",
            "./skills/swift-concurrency",
            "./skills/swiftui-animation",
            "./skills/technical-launch-planner",
            "./skills/trading-plan-generator"
          ],
          "categories": [],
          "install_commands": [
            "/plugin marketplace add jamesrochabrun/skills",
            "/plugin install all-skills@skills-marketplace"
          ]
        },
        {
          "name": "anthropic-architect",
          "description": "Determine the best Anthropic architecture for your project by analyzing requirements and recommending the optimal combination of Skills, Agents, Prompts, and SDK primitives.",
          "source": "./",
          "strict": true,
          "skills": [
            "./skills/anthropic-architect"
          ],
          "categories": [],
          "install_commands": [
            "/plugin marketplace add jamesrochabrun/skills",
            "/plugin install anthropic-architect@skills-marketplace"
          ]
        },
        {
          "name": "anthropic-prompt-engineer",
          "description": "Master Anthropic's prompt engineering techniques to generate new prompts or improve existing ones using best practices for Claude AI models.",
          "source": "./",
          "strict": true,
          "skills": [
            "./skills/anthropic-prompt-engineer"
          ],
          "categories": [],
          "install_commands": [
            "/plugin marketplace add jamesrochabrun/skills",
            "/plugin install anthropic-prompt-engineer@skills-marketplace"
          ]
        },
        {
          "name": "apple-hig-designer",
          "description": "Design iOS apps following Apple's Human Interface Guidelines. Generate native components, validate designs, and ensure accessibility compliance for iPhone, iPad, and Apple Watch.",
          "source": "./",
          "strict": true,
          "skills": [
            "./skills/apple-hig-designer"
          ],
          "categories": [],
          "install_commands": [
            "/plugin marketplace add jamesrochabrun/skills",
            "/plugin install apple-hig-designer@skills-marketplace"
          ]
        },
        {
          "name": "book-illustrator",
          "description": "Expert children's book illustrator guide with 2024-2025 best practices, focusing on age-appropriate styles, color theory, character design, and visual storytelling for kids books that captivate young readers.",
          "source": "./",
          "strict": true,
          "skills": [
            "./skills/book-illustrator"
          ],
          "categories": [],
          "install_commands": [
            "/plugin marketplace add jamesrochabrun/skills",
            "/plugin install book-illustrator@skills-marketplace"
          ]
        },
        {
          "name": "content-brief-generator",
          "description": "Generate comprehensive content briefs for writers, ensuring clarity, alignment, and strategic content creation across all formats.",
          "source": "./",
          "strict": true,
          "skills": [
            "./skills/content-brief-generator"
          ],
          "categories": [],
          "install_commands": [
            "/plugin marketplace add jamesrochabrun/skills",
            "/plugin install content-brief-generator@skills-marketplace"
          ]
        },
        {
          "name": "design-brief-generator",
          "description": "Generate comprehensive design briefs for design projects. Use this skill when designers ask to 'create a design brief', 'structure a design project', 'define design requirements', or need help planning design work.",
          "source": "./",
          "strict": true,
          "skills": [
            "./skills/design-brief-generator"
          ],
          "categories": [],
          "install_commands": [
            "/plugin marketplace add jamesrochabrun/skills",
            "/plugin install design-brief-generator@skills-marketplace"
          ]
        },
        {
          "name": "engineer-expertise-extractor",
          "description": "Research and extract an engineer's coding style, patterns, and best practices from their GitHub contributions. Creates structured knowledge base for replicating their expertise.",
          "source": "./",
          "strict": true,
          "skills": [
            "./skills/engineer-expertise-extractor"
          ],
          "categories": [],
          "install_commands": [
            "/plugin marketplace add jamesrochabrun/skills",
            "/plugin install engineer-expertise-extractor@skills-marketplace"
          ]
        },
        {
          "name": "engineer-skill-creator",
          "description": "Transform extracted engineer expertise into an actionable skill with progressive disclosure, allowing agents to find and apply relevant patterns for specific tasks.",
          "source": "./",
          "strict": true,
          "skills": [
            "./skills/engineer-skill-creator"
          ],
          "categories": [],
          "install_commands": [
            "/plugin marketplace add jamesrochabrun/skills",
            "/plugin install engineer-skill-creator@skills-marketplace"
          ]
        },
        {
          "name": "frontend-designer",
          "description": "Build accessible, responsive, and performant frontend components with design system best practices, modern CSS, and framework-agnostic patterns.",
          "source": "./",
          "strict": true,
          "skills": [
            "./skills/frontend-designer"
          ],
          "categories": [],
          "install_commands": [
            "/plugin marketplace add jamesrochabrun/skills",
            "/plugin install frontend-designer@skills-marketplace"
          ]
        },
        {
          "name": "git-worktrees",
          "description": "Manage Git worktrees for parallel Claude Code development. Use this skill when engineers ask to 'create a worktree', 'run parallel Claude sessions', 'work on multiple features simultaneously', or need help with worktree management.",
          "source": "./",
          "strict": true,
          "skills": [
            "./skills/git-worktrees"
          ],
          "categories": [],
          "install_commands": [
            "/plugin marketplace add jamesrochabrun/skills",
            "/plugin install git-worktrees@skills-marketplace"
          ]
        },
        {
          "name": "kids-book-writer",
          "description": "Expert children's book writer creating delightful, engaging books for ages 2-9. Specializes in rhyming books, stories, songs with proper values, educational content, and age-appropriate language. Crafts books that captivate young readers while teaching important life lessons.",
          "source": "./",
          "strict": true,
          "skills": [
            "./skills/kids-book-writer"
          ],
          "categories": [],
          "install_commands": [
            "/plugin marketplace add jamesrochabrun/skills",
            "/plugin install kids-book-writer@skills-marketplace"
          ]
        },
        {
          "name": "leetcode-teacher",
          "description": "Interactive LeetCode-style teacher for technical interview preparation. Generates coding playgrounds with real product challenges, teaches patterns and techniques, supports Python/TypeScript/Kotlin/Swift, and provides progressive difficulty training for data structures and algorithms.",
          "source": "./",
          "strict": true,
          "skills": [
            "./skills/leetcode-teacher"
          ],
          "categories": [],
          "install_commands": [
            "/plugin marketplace add jamesrochabrun/skills",
            "/plugin install leetcode-teacher@skills-marketplace"
          ]
        },
        {
          "name": "llm-router",
          "description": "This skill should be used when users want to route LLM requests to different AI providers (OpenAI, Grok/xAI, Groq, DeepSeek, OpenRouter) using SwiftOpenAI-CLI. Use this skill when users ask to 'use grok', 'ask grok', 'use groq', 'ask deepseek', or any similar request to query a specific LLM provider in agent mode.",
          "source": "./",
          "strict": true,
          "skills": [
            "./skills/llm-router"
          ],
          "categories": [],
          "install_commands": [
            "/plugin marketplace add jamesrochabrun/skills",
            "/plugin install llm-router@skills-marketplace"
          ]
        },
        {
          "name": "math-teacher",
          "description": "Interactive math teacher that instantly generates playful, gamified learning experiences. Creates visual playgrounds, interactive artifacts, and engaging games for kids and adults to learn math concepts from basic arithmetic to advanced calculus.",
          "source": "./",
          "strict": true,
          "skills": [
            "./skills/math-teacher"
          ],
          "categories": [],
          "install_commands": [
            "/plugin marketplace add jamesrochabrun/skills",
            "/plugin install math-teacher@skills-marketplace"
          ]
        },
        {
          "name": "openai-prompt-engineer",
          "description": "Generate and improve prompts using best practices for OpenAI GPT-5 and other LLMs. Apply advanced techniques like chain-of-thought, few-shot prompting, and progressive disclosure.",
          "source": "./",
          "strict": true,
          "skills": [
            "./skills/openai-prompt-engineer"
          ],
          "categories": [],
          "install_commands": [
            "/plugin marketplace add jamesrochabrun/skills",
            "/plugin install openai-prompt-engineer@skills-marketplace"
          ]
        },
        {
          "name": "prd-generator",
          "description": "Generate comprehensive Product Requirements Documents (PRDs) for product managers. Use this skill when users ask to 'create a PRD', 'write product requirements', 'document a feature', or need help structuring product specifications.",
          "source": "./",
          "strict": true,
          "skills": [
            "./skills/prd-generator"
          ],
          "categories": [],
          "install_commands": [
            "/plugin marketplace add jamesrochabrun/skills",
            "/plugin install prd-generator@skills-marketplace"
          ]
        },
        {
          "name": "qa-test-planner",
          "description": "Generate comprehensive test plans, manual test cases, regression test suites, and bug reports for QA engineers. Includes Figma MCP integration for design validation.",
          "source": "./",
          "strict": true,
          "skills": [
            "./skills/qa-test-planner"
          ],
          "categories": [],
          "install_commands": [
            "/plugin marketplace add jamesrochabrun/skills",
            "/plugin install qa-test-planner@skills-marketplace"
          ]
        },
        {
          "name": "query-expert",
          "description": "Master SQL and database queries across multiple systems. Generate optimized queries, analyze performance, design indexes, and troubleshoot slow queries for PostgreSQL, MySQL, MongoDB, and more.",
          "source": "./",
          "strict": true,
          "skills": [
            "./skills/query-expert"
          ],
          "categories": [],
          "install_commands": [
            "/plugin marketplace add jamesrochabrun/skills",
            "/plugin install query-expert@skills-marketplace"
          ]
        },
        {
          "name": "reading-teacher",
          "description": "Interactive reading teacher that instantly generates playful, engaging learning experiences for children ages 1-10. Creates visual playgrounds, phonics games, and interactive stories to build reading skills from letter recognition to comprehension.",
          "source": "./",
          "strict": true,
          "skills": [
            "./skills/reading-teacher"
          ],
          "categories": [],
          "install_commands": [
            "/plugin marketplace add jamesrochabrun/skills",
            "/plugin install reading-teacher@skills-marketplace"
          ]
        },
        {
          "name": "swift-concurrency",
          "description": "Guide for building, auditing, and refactoring Swift code using modern concurrency patterns (Swift 6+). This skill should be used when working with async/await, Tasks, actors, MainActor, Sendable types, isolation domains, or when migrating legacy callback/Combine code to structured concurrency. Covers Approachable Concurrency settings, isolated parameters, and common pitfalls.",
          "source": "./",
          "strict": true,
          "skills": [
            "./skills/swift-concurrency"
          ],
          "categories": [],
          "install_commands": [
            "/plugin marketplace add jamesrochabrun/skills",
            "/plugin install swift-concurrency@skills-marketplace"
          ]
        },
        {
          "name": "swiftui-animation",
          "description": "This skill provides comprehensive guidance for implementing advanced SwiftUI animations, transitions, matched geometry effects, and Metal shader integration. Use when building animations, view transitions, hero animations, or GPU-accelerated effects in SwiftUI apps for iOS and macOS.",
          "source": "./",
          "strict": true,
          "skills": [
            "./skills/swiftui-animation"
          ],
          "categories": [],
          "install_commands": [
            "/plugin marketplace add jamesrochabrun/skills",
            "/plugin install swiftui-animation@skills-marketplace"
          ]
        },
        {
          "name": "technical-launch-planner",
          "description": "Plan and execute technical product launches for developer tools, APIs, and technical products. Use this skill when technical PMMs need to 'plan a launch', 'create a launch strategy', 'coordinate a product release', or 'prepare for GA/beta launch'.",
          "source": "./",
          "strict": true,
          "skills": [
            "./skills/technical-launch-planner"
          ],
          "categories": [],
          "install_commands": [
            "/plugin marketplace add jamesrochabrun/skills",
            "/plugin install technical-launch-planner@skills-marketplace"
          ]
        },
        {
          "name": "trading-plan-generator",
          "description": "Generate comprehensive trading plans with risk management, position sizing, entry/exit strategies, and performance tracking to trade with discipline and consistency.",
          "source": "./",
          "strict": true,
          "skills": [
            "./skills/trading-plan-generator"
          ],
          "categories": [],
          "install_commands": [
            "/plugin marketplace add jamesrochabrun/skills",
            "/plugin install trading-plan-generator@skills-marketplace"
          ]
        }
      ]
    }
  ]
}