{
  "author": {
    "id": "jay05410",
    "display_name": "jay05410",
    "avatar_url": "https://avatars.githubusercontent.com/u/234632793?v=4"
  },
  "marketplaces": [
    {
      "name": "ecc",
      "version": null,
      "description": "Compose Claude Code - Multi-model agent orchestration with intelligent routing, domain initialization, and 20+ specialized agents",
      "repo_full_name": "jay05410/compose-claudecode",
      "repo_url": "https://github.com/jay05410/compose-claudecode",
      "repo_description": null,
      "signals": {
        "stars": 0,
        "forks": 0,
        "pushed_at": "2026-02-03T10:41:43Z"
      },
      "files": {
        ".claude-plugin/marketplace.json": "{\n  \"$schema\": \"https://anthropic.com/claude-code/marketplace.schema.json\",\n  \"name\": \"ecc\",\n  \"description\": \"Compose Claude Code - Multi-model agent orchestration with intelligent routing, domain initialization, and 20+ specialized agents\",\n  \"owner\": {\n    \"name\": \"jay05410\",\n    \"email\": \"\"\n  },\n  \"plugins\": [\n    {\n      \"name\": \"compose-claudecode\",\n      \"description\": \"Multi-model agent orchestration framework with intelligent model routing, domain-driven project setup, 20+ specialized agents, and comprehensive skill library.\",\n      \"version\": \"1.0.0\",\n      \"author\": {\n        \"name\": \"jay05410\"\n      },\n      \"source\": \"./\",\n      \"category\": \"productivity\",\n      \"homepage\": \"https://github.com/jay05410/compose-claudecode\",\n      \"tags\": [\"multi-agent\", \"orchestration\", \"domain-driven\", \"project-setup\", \"model-routing\"]\n    }\n  ]\n}\n",
        ".claude-plugin/plugin.json": "{\n  \"name\": \"compose-claudecode\",\n  \"version\": \"1.0.0\",\n  \"description\": \"Multi-model agent orchestration framework for Claude Code\",\n  \"skills\": \"./skills/\"\n}\n",
        "README.md": "# Compose ClaudeCode\n\n**Multi-model agent orchestration for Claude Code with intelligent configuration and workflow management.**\n\n## Quick Start\n\n```bash\n# 1. Install plugin\n/plugin install compose-claudecode\n\n# 2. (Optional) Setup MCP servers globally - ONE TIME for ALL projects\nnpx ecc mcp-setup\n\n# 3. Initialize for your project\n/setup\n\n# 4. Start building\n# Example: \"Add user authentication\"\n# Example: \"Create a dashboard page\"\n```\n\nThat's it! The `/setup` command will interview you about your project and automatically configure everything.\n\n**MCP Setup** (`npx ecc mcp-setup`):\n- Configure once, use in ALL projects\n- Just paste your API keys\n- Automatically updates `~/.claude.json`\n- No manual JSON editing needed!\n\n---\n\n## Features\n\n- **ğŸ¯ Smart Initialization**: `/setup` command configures your project automatically\n- **ğŸ¤– 24 Specialized Agents**: Optimal model assignments (40% token savings)\n- **âš¡ Two Modes**: Auto (flexible) or Structured (predefined workflows)\n- **ğŸ“Š Multi-Model**: Opus 4.5, Gemini 3, GLM-4.7, GPT-5.2\n- **ğŸ’° Cost Optimized**: Intelligent model selection saves tokens\n- **ğŸ”§ Reconfigurable**: Change settings anytime with `/setup`\n\n---\n\n## Configuration\n\nAll configuration happens in **two files**:\n\n1. **`CLAUDE.md`** (your project) - Generated by `/setup`\n   - Your tech stack\n   - Workflow preferences\n   - Custom rules\n\n2. **`config/stack.yaml`** (your project) - Auto-configured\n   - Model assignments\n   - Stack versions\n\n**Do not modify this plugin's `README.md`** - it's just documentation.\n**Do modify your project's `CLAUDE.md`** - it's your configuration.\n\n---\n\n## MCP Setup (One-Time, Optional)\n\n**Note:** MCP is optional. This plugin works with Claude's built-in models (Opus, Sonnet, Haiku) without MCP configuration.\n\n### Automated Setup (Recommended) ğŸš€\n\n**One command, works for ALL projects:**\n\n```bash\nnpx ecc mcp-setup\n```\n\nThis interactive command will:\n1. Ask which MCP servers you want (Gemini, OpenAI, GLM)\n2. Guide you to get API keys\n3. Automatically update `~/.claude.json` (global config)\n4. Available in **all projects** immediately after restart\n\n**Benefits:**\n- âœ… Configure once, use everywhere\n- âœ… No manual JSON editing\n- âœ… Automatic backup before changes\n- âœ… Secure (API keys hidden during input)\n\n### Manual Setup (Alternative)\n\nIf you prefer manual configuration:\n\n#### 1. Get API Keys First\n\n- **Gemini** (Free): [aistudio.google.com/apikey](https://aistudio.google.com/apikey) - 60 req/min, 1,500/day\n- **OpenAI** (Paid): [platform.openai.com/api-keys](https://platform.openai.com/api-keys) - GPT-4o, o1, o3\n- **GLM** (Paid): [open.bigmodel.cn](https://open.bigmodel.cn/) - 30% cheaper\n\n#### 2. Choose Your Setup Method\n\n##### Method A: Using Commands (Quick)\n\nRun these commands and replace with your actual API keys:\n\n```bash\n# Add Gemini\nclaude mcp add gemini --command \"npx\" --args \"-y\" --args \"github:aliargun/mcp-server-gemini\" -e GEMINI_API_KEY=\"your-gemini-key-here\"\n\n# Add OpenAI (optional)\nclaude mcp add openai --command \"npx\" --args \"-y\" --args \"@mzxrai/mcp-openai@latest\" -e OPENAI_API_KEY=\"your-openai-key-here\"\n\n# Add GLM (optional)\nclaude mcp add glm --command \"npx\" --args \"-y\" --args \"@zhipuai/mcp-server\" -e ZHIPUAI_API_KEY=\"your-glm-key-here\"\n\n# Verify\nclaude mcp list\n```\n\n#### Method B: Manual Configuration\n\nEdit `~/.claude.json` and add the `mcpServers` section:\n\n```json\n{\n  \"mcpServers\": {\n    \"gemini\": {\n      \"command\": \"npx\",\n      \"args\": [\"-y\", \"github:aliargun/mcp-server-gemini\"],\n      \"env\": {\n        \"GEMINI_API_KEY\": \"your-gemini-key-here\"\n      }\n    },\n    \"openai\": {\n      \"command\": \"npx\",\n      \"args\": [\"-y\", \"@mzxrai/mcp-openai@latest\"],\n      \"env\": {\n        \"OPENAI_API_KEY\": \"your-openai-key-here\"\n      }\n    }\n  }\n}\n```\n\n**Important:** If `~/.claude.json` already has content, merge the `\"mcpServers\"` section into your existing file.\n\n#### Method C: Environment Variables (Most Secure)\n\n1. Add to `~/.zshrc` or `~/.bashrc`:\n   ```bash\n   export GEMINI_API_KEY=\"your-gemini-key\"\n   export OPENAI_API_KEY=\"your-openai-key\"\n   export ZHIPUAI_API_KEY=\"your-glm-key\"\n   ```\n\n2. Reload shell: `source ~/.zshrc`\n\n3. Add MCP servers without hardcoding keys:\n   ```bash\n   claude mcp add gemini --command \"npx\" --args \"-y\" --args \"github:aliargun/mcp-server-gemini\"\n   claude mcp add openai --command \"npx\" --args \"-y\" --args \"@mzxrai/mcp-openai@latest\"\n   ```\n\n### 3. Verify\n\n```bash\nclaude mcp list\n# Should show: gemini âœ“ Connected (and others if added)\n\n---\n\n## How It Works\n\n```\nUser Request\n     â†“\nOrchestrator analyzes\n     â†“\nâ”œâ”€ Auto Mode: Creates plan on-the-fly\nâ””â”€ Structured Mode: Uses predefined workflow\n     â†“\nAgents execute (with optimal models)\n     â†“\nCheckpoints for review\n     â†“\nDone!\n```\n\n---\n\n## Usage\n\n### Automatic Execution\n\nEverything runs automatically. Just make a request and the system handles it:\n\n```\nYou: \"Add user authentication\"\n\nSystem:\nâœ“ Analyzing request...\nâœ“ Starting PM agent (progress tracking)\nâœ“ Using feature-development workflow (4 phases, est. $3-8)\nâœ“ Phase 1: Planning (2 min)\nâœ“ Phase 2: Backend (5 min)\nâœ“ Phase 3: Frontend (4 min)\nâœ“ Phase 4: Testing (3 min)\nâœ… Complete! See .plans/WORK_LOG.md for details\n```\n\nThe system only stops for **critical decisions** (architecture choices, security issues, destructive operations).\n\n### Manual Commands\n\n| Command | Description |\n|---------|-------------|\n| `/setup` | Initialize or reconfigure project |\n| `/status` | Check current progress with visual charts |\n| `/plan` | View current project plan |\n| `/log` | See work history |\n| `/stop` | Halt automatic execution |\n| `/help` | Context-aware help |\n| **Agent Invocation** | |\n| `/frontend-engineer` | Invoke specific agent manually |\n| `/backend-engineer` | Invoke backend agent |\n| `/architect` | Invoke architect for design |\n| _(any agent name)_ | Call any of the 24 agents directly |\n| **Workflow Invocation** | |\n| `/feature-development` | Use feature development workflow |\n| `/code-review` | Use code review workflow |\n\n### Progress Tracking\n\nThe PM agent automatically creates documentation:\n- `.plans/PROJECT_PLAN.md` - Project timeline with Mermaid charts\n- `.plans/WORK_LOG.md` - Detailed work history\n- `.plans/features/` - Per-feature progress tracking\n\n---\n\n## Example Session\n\n```\nYou: /setup\n\nAtlas: Let's configure your project!\n\nWhat's your stack?\n- Language: TypeScript 5.3\n- Frontend: Next.js 14\n- Backend: Node.js (Next.js API routes)\n- Database: PostgreSQL\n\nComplexity? Medium\nTeam? Solo\nSkill level? Intermediate\n\nâš™ï¸ Optimizing...\n\nâœ… Done! Created:\n- CLAUDE.md (your project config)\n- stack.yaml (optimized models)\n\nReady! Try: \"Add user authentication\"\n```\n\n---\n\n## Learn More\n\n- See `CLAUDE.md` (this plugin's documentation) for full architecture details\n- See your project's `CLAUDE.md` (generated by `/setup`) for your configuration\n- Run `/help` for context-aware assistance\n\n---\n\n## Inspired By\n\nThis project draws inspiration from:\n- [oh-my-opencode](https://github.com/moqimoqidea/oh-my-opencode)\n- [everything-claude-code](https://github.com/affaan-m/everything-claude-code)\n\n---\n\n## License\n\nMIT\n"
      },
      "plugins": [
        {
          "name": "compose-claudecode",
          "description": "Multi-model agent orchestration framework with intelligent model routing, domain-driven project setup, 20+ specialized agents, and comprehensive skill library.",
          "version": "1.0.0",
          "author": {
            "name": "jay05410"
          },
          "source": "./",
          "category": "productivity",
          "homepage": "https://github.com/jay05410/compose-claudecode",
          "tags": [
            "multi-agent",
            "orchestration",
            "domain-driven",
            "project-setup",
            "model-routing"
          ],
          "categories": [
            "domain-driven",
            "model-routing",
            "multi-agent",
            "orchestration",
            "productivity",
            "project-setup"
          ],
          "install_commands": [
            "/plugin marketplace add jay05410/compose-claudecode",
            "/plugin install compose-claudecode@ecc"
          ]
        }
      ]
    },
    {
      "name": "oss-claudecode-marketplace",
      "version": null,
      "description": "Open Source Software contribution toolkit for Claude Code",
      "repo_full_name": "jay05410/oss-claudecode",
      "repo_url": "https://github.com/jay05410/oss-claudecode",
      "repo_description": null,
      "signals": {
        "stars": 0,
        "forks": 0,
        "pushed_at": "2026-01-25T09:17:57Z"
      },
      "files": {
        ".claude-plugin/marketplace.json": "{\n  \"name\": \"oss-claudecode-marketplace\",\n  \"description\": \"Open Source Software contribution toolkit for Claude Code\",\n  \"owner\": {\n    \"name\": \"jay05410\",\n    \"url\": \"https://github.com/jay05410\"\n  },\n  \"plugins\": [\n    {\n      \"name\": \"oss-claudecode\",\n      \"description\": \"Complete OSS contribution tools for contributors and maintainers. Natural language interface for finding issues, analyzing code, creating PRs, reviewing code, and documenting contributions.\",\n      \"source\": \"./\",\n      \"version\": \"1.0.0\",\n      \"keywords\": [\"opensource\", \"contribution\", \"github\", \"pr\", \"issue\", \"maintainer\"]\n    }\n  ]\n}\n",
        ".claude-plugin/plugin.json": "{\n  \"name\": \"oss-claudecode\",\n  \"version\": \"2.2.0\",\n  \"description\": \"Open Source Software contribution toolkit - Complete tools for contributors and maintainers\",\n  \"author\": {\n    \"name\": \"Jay\",\n    \"url\": \"https://github.com/jay\"\n  },\n  \"homepage\": \"https://github.com/jay05410/oss-claudecode\",\n  \"repository\": \"https://github.com/jay05410/oss-claudecode\",\n  \"license\": \"MIT\",\n  \"keywords\": [\n    \"opensource\",\n    \"contribution\",\n    \"github\",\n    \"pull-request\",\n    \"issue\",\n    \"oss\",\n    \"maintainer\",\n    \"contributor\"\n  ]\n}\n",
        "README.md": "# oss-claudecode\n\nOpen Source Software contribution toolkit for Claude Code. Complete tools for both **contributors** and **maintainers**.\n\nEnglish | [í•œêµ­ì–´](README.ko.md)\n\n## Installation\n\n### Quick Install (Recommended)\n\n```bash\n# 1. Add the marketplace\n/plugin marketplace add jay05410/oss-claudecode\n\n# 2. Install the plugin\n/plugin install oss-claudecode\n```\n\n### Manual Install (Development)\n\n```bash\n# Clone and load directly\ngit clone https://github.com/jay05410/oss-claudecode.git\nclaude --plugin-dir ./oss-claudecode\n```\n\n## Setup\n\n### GitHub Token (Required)\n\nThe plugin uses GitHub MCP to fetch issues, PRs, and repository data. Set up your token:\n\n```bash\n# 1. Create a token at: https://github.com/settings/tokens\n#    Required scopes: repo, read:user\n\n# 2. Set environment variable\nexport GITHUB_TOKEN=ghp_your_token_here\n\n# 3. Add to your shell profile (~/.bashrc, ~/.zshrc)\necho 'export GITHUB_TOKEN=ghp_your_token_here' >> ~/.zshrc\n```\n\nThe GitHub MCP server starts automatically when the plugin is enabled.\n\n## Usage\n\n### Natural Language (Just Talk!)\n\nNo commands needed. Just describe what you want:\n\n```\n\"I'm a backend developer with 3 years experience. I want to contribute to kotest.\"\nâ†’ Analyzes kotest, recommends suitable issues\n\n\"Analyze issue #28934 in facebook/react\"\nâ†’ Deep analysis with implementation guidance\n\n\"Review this PR: https://github.com/vercel/next.js/pull/12345\"\nâ†’ Comprehensive code review\n\n\"Create a PR for my current changes\"\nâ†’ Generates convention-compliant branch, commits, PR description\n\n\"Document my contribution to #123 as a blog post\"\nâ†’ Creates blog post draft of your contribution journey\n```\n\n### Explicit Skills\n\nYou can also use skills directly:\n\n| Skill | Description |\n|-------|-------------|\n| `/oss-claudecode:analyze` | Analyze project structure and guidelines |\n| `/oss-claudecode:find-issue` | Find issues to contribute to |\n| `/oss-claudecode:prep-pr` | Prepare a PR |\n| `/oss-claudecode:create-issue` | Create a well-formatted issue |\n| `/oss-claudecode:triage` | Triage issues (maintainer) |\n| `/oss-claudecode:review` | Review PRs (maintainer) |\n| `/oss-claudecode:release` | Generate release notes (maintainer) |\n| `/oss-claudecode:doc-contrib` | Document your contribution |\n\n## Features\n\n### For Contributors\n\n- **Project Analysis** - Understand contribution requirements instantly\n- **Issue Discovery** - Find issues matching your skills\n- **Issue Analysis** - Get implementation guidance for any issue\n- **PR Preparation** - Create guideline-compliant PRs\n- **Contribution Documentation** - Document your journey for blogs/portfolios\n\n### For Maintainers\n\n- **Issue Triage** - Classify, label, prioritize incoming issues\n- **PR Review** - Comprehensive code review with feedback\n- **Release Management** - Generate changelogs and release notes\n\n## Project Structure\n\n```\noss-claudecode/\nâ”œâ”€â”€ .claude-plugin/\nâ”‚   â”œâ”€â”€ plugin.json           # Plugin manifest\nâ”‚   â””â”€â”€ marketplace.json      # Marketplace definition\nâ”œâ”€â”€ .mcp.json                  # GitHub MCP configuration\nâ”œâ”€â”€ agents/\nâ”‚   â”œâ”€â”€ oss-orchestrator.md   # Main router\nâ”‚   â”œâ”€â”€ repo-analyzer.md      # Project analysis\nâ”‚   â”œâ”€â”€ issue-finder.md       # Issue discovery\nâ”‚   â”œâ”€â”€ issue-analyst.md      # Issue deep-dive\nâ”‚   â”œâ”€â”€ pr-creator.md         # PR preparation\nâ”‚   â”œâ”€â”€ pr-reviewer.md        # PR review (maintainer)\nâ”‚   â”œâ”€â”€ issue-triager.md      # Issue triage (maintainer)\nâ”‚   â”œâ”€â”€ release-helper.md     # Release management\nâ”‚   â””â”€â”€ contribution-documenter.md\nâ”œâ”€â”€ skills/\nâ”‚   â”œâ”€â”€ analyze/SKILL.md\nâ”‚   â”œâ”€â”€ find-issue/SKILL.md\nâ”‚   â”œâ”€â”€ prep-pr/SKILL.md\nâ”‚   â”œâ”€â”€ create-issue/SKILL.md\nâ”‚   â”œâ”€â”€ triage/SKILL.md\nâ”‚   â”œâ”€â”€ review/SKILL.md\nâ”‚   â”œâ”€â”€ release/SKILL.md\nâ”‚   â””â”€â”€ doc-contrib/SKILL.md\nâ””â”€â”€ templates/                 # Document templates\n```\n\n## How It Works\n\n1. **Natural Language Understanding**: The orchestrator agent understands your intent\n2. **Automatic Routing**: Routes to the appropriate specialized agent/skill\n3. **GitHub Integration**: Uses GitHub MCP for real-time data\n4. **Multi-language Support**: Responds in your language\n\n## Examples\n\n### Find Your First Issue\n\n```\nUser: \"I want to contribute to React but I'm a beginner\"\n\nClaude: I'll help you find beginner-friendly issues in React!\n\n## Project Analysis\nReact is a JavaScript library for building UIs...\n- Good First Issues: 23 open\n- Help Wanted: 45 open\n\n## Recommended Issues\n\nğŸŸ¢ Beginner-Friendly\n#28934 - Fix typo in documentation\n- Labels: good-first-issue, documentation\n- Why: Clear scope, no code changes needed\n\n[More recommendations...]\n```\n\n### PR Review (Maintainer)\n\n```\nUser: \"Review https://github.com/my-project/pull/456\"\n\nClaude: ## PR Review: #456\n\n| Aspect | Assessment |\n|--------|------------|\n| Decision | Request Changes |\n| Risk | Medium |\n\n## Required Changes\nğŸ”´ [src/auth.ts:45] Missing null check\n...\n\n## Summary\nThanks for this PR! Please address the null check issue...\n```\n\n## Plugin Management\n\n```bash\n# Check installed plugins\n/plugin\n\n# Disable plugin\n/plugin disable oss-claudecode\n\n# Enable plugin\n/plugin enable oss-claudecode\n\n# Update plugin\n/plugin update oss-claudecode\n\n# Uninstall\n/plugin uninstall oss-claudecode\n```\n\n## Contributing\n\nSee [CONTRIBUTING.md](CONTRIBUTING.md) for guidelines.\n\n## License\n\nMIT License - see [LICENSE](LICENSE) for details.\n\n---\n\n**Made for the open source community** ğŸŒ\n"
      },
      "plugins": [
        {
          "name": "oss-claudecode",
          "description": "Complete OSS contribution tools for contributors and maintainers. Natural language interface for finding issues, analyzing code, creating PRs, reviewing code, and documenting contributions.",
          "source": "./",
          "version": "1.0.0",
          "keywords": [
            "opensource",
            "contribution",
            "github",
            "pr",
            "issue",
            "maintainer"
          ],
          "categories": [
            "contribution",
            "github",
            "issue",
            "maintainer",
            "opensource",
            "pr"
          ],
          "install_commands": [
            "/plugin marketplace add jay05410/oss-claudecode",
            "/plugin install oss-claudecode@oss-claudecode-marketplace"
          ]
        }
      ]
    }
  ]
}