{
  "author": {
    "id": "jmfontaine",
    "display_name": "Jean-Marc Fontaine",
    "avatar_url": "https://avatars.githubusercontent.com/u/174728?u=52b88c6f778ccd97e57d7871676419a5ec38654f&v=4"
  },
  "marketplaces": [
    {
      "name": "jmf-claude-plugins",
      "version": null,
      "description": "Guidelines for clearer thinking, disciplined coding, and concise communication",
      "repo_full_name": "jmfontaine/jmf-claude-plugins",
      "repo_url": "https://github.com/jmfontaine/jmf-claude-plugins",
      "repo_description": "Claude Plugins",
      "signals": {
        "stars": 0,
        "forks": 0,
        "pushed_at": "2026-02-21T22:45:49Z"
      },
      "files": {
        ".claude-plugin/marketplace.json": "{\n  \"name\": \"jmf-claude-plugins\",\n  \"owner\": {\n    \"name\": \"Jean-Marc Fontaine\"\n  },\n  \"plugins\": [\n    {\n      \"name\": \"better-assistant\",\n      \"source\": \"./plugins/better-assistant\",\n      \"description\": \"Guidelines for clearer thinking, disciplined coding, and concise communication\"\n    },\n    {\n      \"name\": \"python-dev\",\n      \"source\": \"./plugins/python-dev\",\n      \"description\": \"Python Development Assistant\"\n    },\n    {\n      \"name\": \"git\",\n      \"source\": \"./plugins/git\",\n      \"description\": \"Git management\"\n    },\n    {\n      \"name\": \"project-qa\",\n      \"source\": \"./plugins/project-qa\",\n      \"description\": \"Project quality assurance: review configuration and documentation files for consistency, completeness, and correctness\"\n    }\n  ]\n}\n",
        "README.md": "# Claude Plugins\n\nA collection of plugins for [Claude](https://claude.com/product/overview) and\n[Claude Code](https://claude.com/product/claude-code) I built these for my own use, but they might help you, either\nto use directly or as inspiration for your own custom tools.\n\n## Installation\n\nIn Claude Code, use the `/plugin` command to manage plugins:\n\n```shell\n# Add the plugin marketplace\n/plugin marketplace add jmfontaine/jmf-claude-plugins\n\n# Install a plugin from the collection\n/plugin install <plugin>@jmf-claude-plugins\n```\n\n## Plugins\n\n- [better-assistant](./plugins/better-assistant): Guidelines for clearer thinking, disciplined coding, and concise communication.\n- [git](./plugins/git): Git management with commit and branch naming guidelines.\n- [project-qa](./plugins/project-qa): Review project files for consistency, completeness, and correctness.\n- [python-dev](./plugins/python-dev): Python development assistant.\n\n## License\n\nClaude Plugins is licensed under the [Apache License 2.0](LICENSE.txt).\n",
        "plugins/better-assistant/README.md": "# Better Assistant\n\nGuidelines for clearer thinking, disciplined coding, and concise communication.\n\n## Credit\n\nPortions of the instructions are borrowed from the [Karpathy Guidelines](https://github.com/forrestchang/andrej-karpathy-skills/blob/main/skills/karpathy-guidelines/SKILL.md).\n"
      },
      "plugins": [
        {
          "name": "better-assistant",
          "source": "./plugins/better-assistant",
          "description": "Guidelines for clearer thinking, disciplined coding, and concise communication",
          "categories": [],
          "install_commands": [
            "/plugin marketplace add jmfontaine/jmf-claude-plugins",
            "/plugin install better-assistant@jmf-claude-plugins"
          ]
        },
        {
          "name": "python-dev",
          "source": "./plugins/python-dev",
          "description": "Python Development Assistant",
          "categories": [],
          "install_commands": [
            "/plugin marketplace add jmfontaine/jmf-claude-plugins",
            "/plugin install python-dev@jmf-claude-plugins"
          ]
        },
        {
          "name": "git",
          "source": "./plugins/git",
          "description": "Git management",
          "categories": [],
          "install_commands": [
            "/plugin marketplace add jmfontaine/jmf-claude-plugins",
            "/plugin install git@jmf-claude-plugins"
          ]
        },
        {
          "name": "project-qa",
          "source": "./plugins/project-qa",
          "description": "Project quality assurance: review configuration and documentation files for consistency, completeness, and correctness",
          "categories": [],
          "install_commands": [
            "/plugin marketplace add jmfontaine/jmf-claude-plugins",
            "/plugin install project-qa@jmf-claude-plugins"
          ]
        }
      ]
    }
  ]
}