{
  "author": {
    "id": "joestump",
    "display_name": "Joe Stump",
    "avatar_url": "https://avatars.githubusercontent.com/u/37667?u=969ecdb950ae00b6145f777c01e9c1fde3501aa1&v=4"
  },
  "marketplaces": [
    {
      "name": "claude-plugin-design",
      "version": null,
      "description": "Architecture Decision Records (MADR), specifications, and Docusaurus documentation generation.",
      "repo_full_name": "joestump/claude-plugin-design",
      "repo_url": "https://github.com/joestump/claude-plugin-design",
      "repo_description": "A Claude Code plugin for architecture decision records (ADRs), OpenSpec specifications, and Docusaurus documentation generation.",
      "signals": {
        "stars": 0,
        "forks": 0,
        "pushed_at": "2026-02-14T13:46:19Z"
      },
      "files": {
        ".claude-plugin/marketplace.json": "{\n  \"name\": \"claude-plugin-design\",\n  \"owner\": {\n    \"name\": \"Joe Stump\",\n    \"url\": \"https://github.com/joestump\"\n  },\n  \"plugins\": [\n    {\n      \"name\": \"design\",\n      \"source\": {\n        \"source\": \"github\",\n        \"repo\": \"joestump/claude-plugin-design\"\n      },\n      \"description\": \"Architecture Decision Records (MADR), specifications, and Docusaurus documentation generation.\"\n    }\n  ]\n}\n",
        ".claude-plugin/plugin.json": "{\n  \"name\": \"design\",\n  \"version\": \"1.0.0\",\n  \"description\": \"Architecture Decision Records (MADR), specifications, and Docusaurus documentation generation.\",\n  \"author\": {\n    \"name\": \"Joe Stump\",\n    \"url\": \"https://github.com/joestump\"\n  },\n  \"homepage\": \"https://github.com/joestump/claude-plugin-design\",\n  \"repository\": \"https://github.com/joestump/claude-plugin-design\",\n  \"license\": \"MIT\",\n  \"keywords\": [\"adr\", \"openspec\", \"docusaurus\", \"architecture\", \"specifications\", \"documentation\"]\n}\n",
        "README.md": "# claude-plugin-design\n\nA Claude Code plugin for architecture decision records (ADRs), specifications, and Docusaurus documentation generation.\n\n## Skills\n\n| Skill | Invoke | Description |\n|-------|--------|-------------|\n| **ADR** | `/design:adr [description] [--review]` | Create an ADR using MADR format with Mermaid diagrams |\n| **Spec** | `/design:spec [capability] [--review]` | Create spec.md + design.md with RFC 2119 requirements and Mermaid diagrams |\n| **Init** | `/design:init` | Set up CLAUDE.md with architecture context for design-aware sessions |\n| **Prime** | `/design:prime [topic]` | Load ADR and spec context into the session, optionally filtered by topic |\n| **Check** | `/design:check [target]` | Quick-check code against ADRs and specs for drift |\n| **Audit** | `/design:audit [scope] [--review]` | Comprehensive audit of design artifact alignment across the project |\n| **Docs** | `/design:docs [project name]` | Scaffold a Docusaurus site from your ADRs and specs |\n| **List** | `/design:list [adr\\|spec\\|all]` | List all ADRs and specs with their status |\n| **Status** | `/design:status [ID] [status]` | Change the status of an ADR or spec |\n\n## Install\n\nAdd to your project's `.claude/settings.json`:\n\n```json\n{\n  \"extraKnownMarketplaces\": {\n    \"claude-plugin-design\": {\n      \"source\": {\n        \"source\": \"github\",\n        \"repo\": \"joestump/claude-plugin-design\"\n      }\n    }\n  },\n  \"enabledPlugins\": {\n    \"design@claude-plugin-design\": true\n  }\n}\n```\n\nThen restart Claude Code. The plugin's skills will be available as `/design:init`, `/design:prime`, `/design:adr`, `/design:spec`, `/design:check`, `/design:audit`, `/design:docs`, `/design:list`, and `/design:status`.\n\n## Development\n\nClone the repo and run Claude Code from the project directory:\n\n```bash\ngit clone https://github.com/joestump/claude-plugin-design.git\ncd claude-plugin-design\nclaude\n```\n\nThe `.claude/settings.json` in this repo registers the local directory as a marketplace and enables the plugin automatically. Any changes to skills or templates are picked up on the next Claude Code launch.\n\n## What It Does\n\n### `/design:adr` -- Architecture Decision Records\n\nCreates ADRs using [MADR](https://adr.github.io/madr/) format:\n- Sequential numbering: `ADR-0001`, `ADR-0002`, etc.\n- Stored in `docs/adrs/`\n- Mermaid architecture diagrams included by default\n- YAML frontmatter with status, date, decision-makers\n- Single-agent by default; add `--review` for team-based drafting with architect review\n- Offers to add an Architecture Context section to your CLAUDE.md on first use\n\n### `/design:spec` -- Specifications\n\nCreates paired spec.md + design.md using [OpenSpec](https://github.com/Fission-AI/OpenSpec):\n- Spec numbering: `SPEC-0001`, `SPEC-0002`, etc.\n- Requirements in [RFC 2119](https://www.rfc-editor.org/rfc/rfc2119) format (MUST, SHALL, MAY, etc.)\n- Scenarios with `####` headings and WHEN/THEN format\n- Mermaid architecture diagrams required in design.md\n- Stored in `docs/openspec/specs/{capability-name}/`\n- Single-agent by default; add `--review` for team-based drafting with architect review\n\n### `/design:init` -- Initialize Design Plugin\n\nSets up your project's `CLAUDE.md` with architecture context:\n- Creates `CLAUDE.md` if it doesn't exist, or updates the existing one\n- Adds an `## Architecture Context` section with references to `docs/adrs/` and `docs/openspec/specs/`\n- Includes a skills reference table and a note about `/design:prime`\n- Idempotent -- safe to re-run without duplicating content\n\n### `/design:prime` -- Prime Architecture Context\n\nLoads existing ADRs and specs into the session for architecture-aware responses:\n- Summarizes all ADRs (title, status, key decision) and specs (title, status, requirement counts)\n- Optional topic argument for semantic filtering (e.g., `/design:prime security` surfaces auth, encryption, access control decisions)\n- Suggests `/design:init` if CLAUDE.md hasn't been set up yet\n- Read-only -- never modifies any files\n\n### `/design:check` -- Quick Drift Check\n\nFast, focused drift check on a specific target:\n- Target can be a file path, directory, `ADR-XXXX`, or `SPEC-XXXX`\n- Checks 3 drift categories: code vs. spec, code vs. ADR, ADR vs. spec\n- Produces a concise findings table with severity levels (critical, warning, info)\n- Always single-agent (no `--review` support)\n- Suggests `/design:audit` for deeper analysis when warranted\n\n### `/design:audit` -- Comprehensive Design Audit\n\nDeep audit of design artifact alignment across the project:\n- Covers all 6 drift categories: code vs. spec, code vs. ADR, ADR vs. spec, coverage gaps, stale artifacts, policy violations\n- Produces a structured report with categorized findings and summary matrix\n- Prioritized recommended actions ordered by severity\n- Single-agent by default; add `--review` for team-based auditing with auditor and reviewer agents\n\n### `/design:docs` -- Docusaurus Documentation Site\n\nScaffolds a complete Docusaurus site that transforms your ADRs and specs into a polished doc site:\n- Pre-flight checks (Node.js, existing content)\n- RFC 2119 keyword highlighting (color-coded MUST/SHALL/MAY)\n- Cross-reference linking (ADR-0001 and SPEC-NNN become clickable links)\n- Mermaid diagram rendering\n- Status/Date/Domain badge components\n- Requirement box components with anchor links\n- Consequence keyword highlighting (Good/Bad/Neutral)\n- Dark mode support\n- Auto-generated sidebars\n\n### `/design:list` -- List Decisions and Specs\n\nLists all ADRs and specs with their status, date, and title. Filter by type with `adr`, `spec`, or `all`.\n\n### `/design:status` -- Update Status\n\nChanges the status of an ADR or spec. Valid statuses:\n- **ADR**: proposed, accepted, deprecated, superseded\n- **Spec**: draft, review, approved, implemented, deprecated\n\n## Project Structure\n\n```\nyour-project/\n├── docs/\n│   ├── adrs/                    # ADRs (created by /design:adr)\n│   │   ├── ADR-0001-short-title.md\n│   │   └── ADR-0002-short-title.md\n│   └── openspec/specs/          # Specs (created by /design:spec)\n│       └── capability-name/\n│           ├── spec.md\n│           └── design.md\n├── docs-site/                   # Docusaurus site (created by /design:docs)\n│   ├── package.json\n│   ├── docusaurus.config.ts\n│   ├── scripts/                 # Build-time transforms\n│   └── src/                     # Components, CSS, data\n└── docs-generated/              # Build artifact (generated by docs-site build)\n```\n\n## Workflow\n\n1. **Setup**: `/design:init` to configure CLAUDE.md with architecture context\n2. **Prime**: `/design:prime` at the start of each session (or `/design:prime security` for a focused topic)\n3. **Decide**: `/design:adr We need to choose a web framework for the admin dashboard`\n4. **Review**: `/design:list adr` to see all decisions, `/design:status ADR-0001 accepted` to approve\n5. **Specify**: `/design:spec Convert ADR-0001 to a spec`\n6. **Check**: `/design:check src/auth/` to quick-check for drift while coding\n7. **Audit**: `/design:audit --review` for a comprehensive design review\n8. **Document**: `/design:docs my-project`\n9. **Develop**: `cd docs-site && npm run dev`\n\nFor thorough team review on critical decisions, add `--review`:\n- `/design:adr Choose a database --review`\n- `/design:spec authentication-service --review`\n- `/design:audit --review`\n\n## CLAUDE.md Integration\n\nRun `/design:init` to set up your project's CLAUDE.md with architecture context. This adds references to `docs/adrs/` and `docs/openspec/specs/`, a plugin skills table, and a note about `/design:prime`:\n\n```markdown\n## Architecture Context\n- Architecture Decision Records are in `docs/adrs/`\n- Specifications are in `docs/openspec/specs/`\n```\n\n## License\n\nMIT\n"
      },
      "plugins": [
        {
          "name": "design",
          "source": {
            "source": "github",
            "repo": "joestump/claude-plugin-design"
          },
          "description": "Architecture Decision Records (MADR), specifications, and Docusaurus documentation generation.",
          "categories": [],
          "install_commands": [
            "/plugin marketplace add joestump/claude-plugin-design",
            "/plugin install design@claude-plugin-design"
          ]
        }
      ]
    }
  ]
}