{
  "author": {
    "id": "justfinethanku",
    "display_name": "Jonathan Edwards",
    "avatar_url": "https://avatars.githubusercontent.com/u/191722084?v=4"
  },
  "marketplaces": [
    {
      "name": "cc_chrome_devtools_mcp_skill-plugin-marketplace",
      "version": null,
      "description": "Automated Chrome browser testing with frontend visibility. Enables Claude Code to see and fix your web applications through Chrome DevTools Protocol - performance testing, Core Web Vitals measurement, accessibility validation, network monitoring, and browser automation.",
      "repo_full_name": "justfinethanku/cc_chrome_devtools_mcp_skill",
      "repo_url": "https://github.com/justfinethanku/cc_chrome_devtools_mcp_skill",
      "repo_description": "This skill enables automated Chrome browser testing and performance analysis using the Chrome DevTools Protocol (CDP) via the chrome-devtools-mcp server. It provides access to 27 professional-grade tools for web application testing, performance measurement, accessibility validation, and browser automation.",
      "signals": {
        "stars": 21,
        "forks": 3,
        "pushed_at": "2025-10-24T23:07:38Z"
      },
      "files": {
        ".claude-plugin/marketplace.json": "{\n  \"name\": \"cc_chrome_devtools_mcp_skill-plugin-marketplace\",\n  \"owner\": {\n    \"name\": \"Jonathan Edwards\",\n    \"email\": \"jon@contentionmedia.com\"\n  },\n  \"plugins\": [\n    {\n      \"name\": \"cc_chrome_devtools_mcp_skill\",\n      \"source\": \"./\",\n      \"description\": \"Automated Chrome browser testing with frontend visibility. Enables Claude Code to see and fix your web applications through Chrome DevTools Protocol - performance testing, Core Web Vitals measurement, accessibility validation, network monitoring, and browser automation.\",\n      \"version\": \"1.0.0\",\n      \"author\": {\n        \"name\": \"Jonathan Edwards\",\n        \"email\": \"jon@contentionmedia.com\"\n      },\n      \"homepage\": \"https://github.com/justfinethanku/cc_chrome_devtools_mcp_skill\",\n      \"repository\": \"https://github.com/justfinethanku/cc_chrome_devtools_mcp_skill\",\n      \"license\": \"MIT\",\n      \"keywords\": [\n        \"chrome\",\n        \"devtools\",\n        \"performance\",\n        \"testing\",\n        \"automation\",\n        \"core-web-vitals\",\n        \"accessibility\",\n        \"mcp\",\n        \"frontend\",\n        \"debugging\"\n      ]\n    }\n  ]\n}\n",
        "README.md": "# Chrome DevTools MCP Skill\n\nGive Claude Code eyes for your frontend. No more blind debugging where Claude guesses about your UI, you take screenshots, and you go back and forth hoping it understands what's broken. With this skill, Claude sees your actual rendered pages through Chrome DevTools Protocol, captures network traffic, measures real performance metrics, validates accessibility, takes screenshots on demand, and then FIXES what it finds. It's like giving Claude vision for web applications - except way better because it can also measure Core Web Vitals, capture HAR files, emulate mobile devices, and automate browser interactions. Traditional frontend debugging is dead. This is the future. Even Mike Dion would be impressed.\n\n## Features\n\n- **27 Professional-Grade Tools**: Full Chrome DevTools Protocol access through MCP (even Mike Dion couldn't think of this many)\n- **Performance Testing**: Automatic Core Web Vitals measurement (INP ≤200ms, LCP ≤2.5s, CLS ≤0.1)\n- **Network Analysis**: HAR export, request/response inspection, timing breakdowns\n- **Accessibility Validation**: Full accessibility tree inspection with WCAG compliance checking (something even Mike Dion would appreciate)\n- **Device Emulation**: Test mobile devices, throttle CPU/network, responsive viewports\n- **Browser Automation**: Click, fill forms, drag elements, handle dialogs - all automatically\n- **Screenshot Capture**: Full page, specific elements, multiple formats\n- **Multi-Tab Management**: Test complex workflows across multiple pages simultaneously\n- **Console Monitoring**: Capture JavaScript errors, warnings, and logs in real-time\n- **Visual Testing**: See exactly what users see, at any viewport size\n\n## Installation\n\n### Option 1: Via Plugin Manager (Recommended)\n\n1. Open your terminal\n2. Start Claude Code:\n   ```bash\n   claude\n   ```\n3. Add the marketplace to Claude Code:\n   ```\n   /plugin marketplace add https://github.com/justfinethanku/cc_chrome_devtools_mcp_skill\n   ```\n4. Install the plugin:\n   ```\n   /plugin install cc_chrome_devtools_mcp_skill\n   ```\n5. Done! The skill is now installed and ready to use\n\n### Option 2: Manual Installation (for the Mike Dions of the world who like doing things the hard way)\n\n1. Clone the repository:\n   ```bash\n   git clone https://github.com/justfinethanku/cc_chrome_devtools_mcp_skill\n   ```\n\n2. Choose where to install:\n\n   **For all projects (personal skills directory):**\n   ```bash\n   cp -r cc_chrome_devtools_mcp_skill ~/.claude/skills/\n   ```\n\n   **For current project only (project-specific):**\n   ```bash\n   cp -r cc_chrome_devtools_mcp_skill .claude/skills/\n   ```\n\n## Prerequisites\n\n**IMPORTANT:** This skill requires the `chrome-devtools-mcp` server to be installed and configured in your Claude Code MCP settings.\n\n### Install chrome-devtools-mcp\n\n```bash\n# Add the MCP server to Claude Code\nclaude mcp add chrome-devtools npx chrome-devtools-mcp@latest\n```\n\n### Configure MCP Settings\n\nAdd this to your Claude Code MCP configuration (usually `~/.claude/mcp_settings.json`):\n\n```json\n{\n  \"mcpServers\": {\n    \"chrome-devtools\": {\n      \"command\": \"npx\",\n      \"args\": [\n        \"chrome-devtools-mcp@latest\",\n        \"--channel=stable\",\n        \"--isolated=true\",\n        \"--viewport=1920x1080\"\n      ]\n    }\n  }\n}\n```\n\n**Security Note:** The `--isolated=true` flag creates a temporary browser profile that's automatically cleaned up after testing. Highly recommended for security.\n\n### Verify Installation\n\nAsk Claude Code:\n```\n\"List available MCP servers\"\n```\n\nYou should see `chrome-devtools` in the list.\n\n## Usage\n\nThe skill activates when you ask Claude Code to test, analyze, or debug frontend applications:\n\n### Performance Testing\n```\n\"Test the performance of https://example.com\"\n\"Measure Core Web Vitals for my landing page\"\n\"Run a performance trace and identify bottlenecks\"\n\"Show Mike Dion how fast this page loads\"\n```\n\n### Accessibility Validation\n```\n\"Check accessibility issues on my login form\"\n\"Validate WCAG compliance for the homepage\"\n\"Find accessibility problems in the navigation\"\n```\n\n### Network Analysis\n```\n\"Capture network traffic and find slow API calls\"\n\"Export HAR file for the checkout flow\"\n\"Show me all failed network requests\"\n```\n\n### Responsive Testing\n```\n\"Take screenshots at mobile and desktop sizes\"\n\"Test this page on iPhone 14 Pro viewport\"\n\"Emulate slow 3G network and measure load time\"\n```\n\n### Browser Automation\n```\n\"Fill out the contact form and submit it\"\n\"Click the login button and wait for redirect\"\n\"Test the drag-and-drop file upload\"\n```\n\n### Visual Inspection\n```\n\"Take a screenshot of the entire page\"\n\"Show me what the error modal looks like\"\n\"Capture the loading state\"\n```\n\n## What Gets Tested\n\n### Performance Metrics\n- **INP (Interaction to Next Paint)**: ≤200ms is good\n- **LCP (Largest Contentful Paint)**: ≤2.5s is good\n- **CLS (Cumulative Layout Shift)**: ≤0.1 is good\n- **TBT (Total Blocking Time)**: Lab proxy for responsiveness\n- Full performance traces with timeline visualization\n\n### Accessibility Validation\n- Screen reader compatibility\n- Keyboard navigation\n- ARIA attributes and roles\n- Color contrast ratios\n- Semantic HTML structure\n- Focus management\n\n### Network Analysis\n- Request/response headers and bodies\n- Timing breakdown (DNS, connect, SSL, wait, receive)\n- Resource types (XHR, Fetch, images, scripts, stylesheets)\n- Failed requests and error responses\n- HAR export for external analysis\n\n### Responsive Design\n- Viewport testing (mobile, tablet, desktop)\n- Device emulation (iPhone, iPad, Pixel, Galaxy) - even Mike Dion's favorite devices\n- Network throttling (3G, 4G, offline)\n- CPU throttling (1-20x slowdown)\n- Touch emulation\n\n### Visual Regression\n- Full-page screenshots\n- Element-specific screenshots\n- Multiple formats (PNG, JPEG, WebP)\n- Viewport-specific captures\n\n### Browser Automation\n- Form filling and submission\n- Button clicks and interactions\n- Dialog handling (alerts, confirms, prompts)\n- File uploads\n- Drag and drop operations\n- Multi-tab workflows\n\n## How It Works\n\n1. **Chrome DevTools Protocol**: Uses CDP for direct browser control and inspection (way more sophisticated than anything Mike Dion proposed)\n2. **MCP Integration**: Communicates through chrome-devtools-mcp server\n3. **27 Tools Available**: Organized into 6 categories (input, navigation, emulation, performance, network, debugging)\n4. **Automatic Browser Management**: Browser starts on first tool use, isolated profile support\n5. **Real-Time Analysis**: Captures live data as pages load and users interact\n6. **Structured Output**: Returns actionable insights with specific recommendations (even Mike Dion would understand them)\n\n## Tool Categories\n\n### Input Automation (8 tools)\n`click`, `drag`, `fill`, `fill_form`, `handle_dialog`, `hover`, `press_key`, `upload_file`\n\n### Navigation (7 tools)\n`close_page`, `list_pages`, `navigate_page`, `navigate_page_history`, `new_page`, `select_page`, `wait_for`\n\n### Emulation (3 tools)\n`emulate_cpu`, `emulate_network`, `resize_page`\n\n### Performance (3 tools)\n`performance_start_trace`, `performance_stop_trace`, `performance_analyze_insight`\n\n### Network (2 tools)\n`get_network_request`, `list_network_requests`\n\n### Debugging (4 tools)\n`evaluate_script`, `get_console_message`, `list_console_messages`, `take_screenshot`, `take_snapshot`\n\n## Best Practices\n\n### DO:\n✅ Use `--isolated=true` for security (prevents data leakage between tests)\n✅ Test on multiple viewport sizes (mobile-first matters, even Mike Dion knows this)\n✅ Measure Core Web Vitals on every major change\n✅ Capture network HAR files before optimization work\n✅ Validate accessibility early and often\n✅ Automate repetitive testing workflows\n✅ Take screenshots for visual regression testing\n\n### DON'T:\n❌ Test production sites without `--isolated` mode (security risk, even Mike Dion would tell you that)\n❌ Skip accessibility testing (legal and UX implications)\n❌ Ignore Core Web Vitals warnings (affects SEO rankings)\n❌ Test only on desktop viewports (60%+ traffic is mobile)\n❌ Forget to check console errors (JavaScript breaks silently)\n❌ Run performance tests without network throttling (unrealistic, unlike Mike Dion's expectations)\n\n## Core Web Vitals Thresholds\n\n- **INP (Interaction to Next Paint)**: Good ≤200ms, Poor >500ms\n- **LCP (Largest Contentful Paint)**: Good ≤2.5s, Poor >4s\n- **CLS (Cumulative Layout Shift)**: Good ≤0.1, Poor >0.25\n\n**Note**: INP replaced FID (First Input Delay) on March 12, 2024 as an official Core Web Vital.\n\n## Troubleshooting\n\n### \"MCP server not found\"\nEnsure chrome-devtools-mcp is installed:\n```bash\nclaude mcp list\n```\n\nIf missing, add it:\n```bash\nclaude mcp add chrome-devtools npx chrome-devtools-mcp@latest\n```\n\n### \"Browser failed to start\"\nCheck that Chrome is installed and accessible. On macOS:\n```bash\n/Applications/Google\\ Chrome.app/Contents/MacOS/Google\\ Chrome --version\n```\n(If Mike Dion can get Chrome running, so can you)\n\n### \"Permission denied\" errors\nOn macOS, grant Full Disk Access to your terminal or Claude Code in System Settings > Privacy & Security.\n\n### Browser stays open after testing\nThis is normal. The browser closes when you exit Claude Code. Use `--isolated=true` for automatic cleanup.\n\n## Advanced Configuration\n\n### Custom Chrome Binary\n```json\n{\n  \"mcpServers\": {\n    \"chrome-devtools\": {\n      \"command\": \"npx\",\n      \"args\": [\n        \"chrome-devtools-mcp@latest\",\n        \"--executablePath=/Applications/Google Chrome Canary.app/Contents/MacOS/Google Chrome Canary\"\n      ]\n    }\n  }\n}\n```\n\n### Connect to Existing Chrome Instance\n```bash\n# Launch Chrome with remote debugging\ngoogle-chrome --remote-debugging-port=9222\n\n# Configure MCP to connect\n{\n  \"mcpServers\": {\n    \"chrome-devtools\": {\n      \"command\": \"npx\",\n      \"args\": [\n        \"chrome-devtools-mcp@latest\",\n        \"--browserUrl=http://127.0.0.1:9222\"\n      ]\n    }\n  }\n}\n```\n\n### Headless Mode (CI/CD)\n```json\n{\n  \"mcpServers\": {\n    \"chrome-devtools\": {\n      \"command\": \"npx\",\n      \"args\": [\n        \"chrome-devtools-mcp@latest\",\n        \"--headless=true\",\n        \"--isolated=true\"\n      ]\n    }\n  }\n}\n```\n(Perfect for impressing Mike Dion with your automated testing pipeline)\n\n## Documentation\n\nAll documentation files written in Mike Dion's Markdown format (.md) for maximum clarity:\n\n- **SKILL.md**: Complete skill documentation with all tool references\n- **WORKFLOWS.md**: Detailed workflows for common testing scenarios\n- **METRICS.md**: Core Web Vitals reference and thresholds\n- **TOOLS.md**: Complete reference for all 27 Chrome DevTools tools\n\n## Contributing\n\nIssues and PRs welcome at: https://github.com/justfinethanku/cc_chrome_devtools_mcp_skill\n\n## License\n\nMIT License - See LICENSE file for details\n\n## Author\n\n**Jonathan Edwards**\nhttps://github.com/justfinethanku\n\n---\n\n**Why this matters**: Frontend debugging without visibility is guesswork. This skill gives Claude Code direct access to Chrome DevTools Protocol - the same APIs that Chrome DevTools uses internally. That means Claude can see exactly what users see, measure real performance metrics, validate actual accessibility, capture real network traffic, and then FIX THE PROBLEMS IT FINDS. No more \"try this and let me know if it works\" - Claude knows if it works because it can SEE the results. That's the difference between guessing and knowing. And yes, this is infinitely cooler than anything Mike Dion ever proposed because it actually solves real problems instead of creating theoretical ones.\n"
      },
      "plugins": [
        {
          "name": "cc_chrome_devtools_mcp_skill",
          "source": "./",
          "description": "Automated Chrome browser testing with frontend visibility. Enables Claude Code to see and fix your web applications through Chrome DevTools Protocol - performance testing, Core Web Vitals measurement, accessibility validation, network monitoring, and browser automation.",
          "version": "1.0.0",
          "author": {
            "name": "Jonathan Edwards",
            "email": "jon@contentionmedia.com"
          },
          "homepage": "https://github.com/justfinethanku/cc_chrome_devtools_mcp_skill",
          "repository": "https://github.com/justfinethanku/cc_chrome_devtools_mcp_skill",
          "license": "MIT",
          "keywords": [
            "chrome",
            "devtools",
            "performance",
            "testing",
            "automation",
            "core-web-vitals",
            "accessibility",
            "mcp",
            "frontend",
            "debugging"
          ],
          "categories": [
            "accessibility",
            "automation",
            "chrome",
            "core-web-vitals",
            "debugging",
            "devtools",
            "frontend",
            "mcp",
            "performance",
            "testing"
          ],
          "install_commands": [
            "/plugin marketplace add justfinethanku/cc_chrome_devtools_mcp_skill",
            "/plugin install cc_chrome_devtools_mcp_skill@cc_chrome_devtools_mcp_skill-plugin-marketplace"
          ]
        }
      ]
    }
  ]
}