{
  "author": {
    "id": "kanopi",
    "display_name": "Kanopi Studios",
    "avatar_url": "https://avatars.githubusercontent.com/u/8863513?v=4"
  },
  "marketplaces": [
    {
      "name": "claude-toolbox",
      "version": "1.0.0",
      "description": "Official Claude Code toolbox from Kanopi Studios for Content Management System (CMS) development",
      "repo_full_name": "kanopi/claude-toolbox",
      "repo_url": "https://github.com/kanopi/claude-toolbox",
      "repo_description": "Official marketplace for Claude Code plugins from Kanopi Studios.",
      "signals": {
        "stars": 1,
        "forks": 0,
        "pushed_at": "2025-11-21T17:38:08Z"
      },
      "files": {
        ".claude-plugin/marketplace.json": "{\n  \"name\": \"claude-toolbox\",\n  \"displayName\": \"Claude Toolbox\",\n  \"description\": \"Official Claude Code toolbox from Kanopi Studios for Content Management System (CMS) development\",\n  \"version\": \"1.0.0\",\n  \"owner\": {\n    \"name\": \"Kanopi Studios\",\n    \"email\": \"code@kanopi.com\",\n    \"url\": \"https://kanopi.com\"\n  },\n  \"repository\": {\n    \"type\": \"git\",\n    \"url\": \"https://github.com/kanopi/claude-toolbox\"\n  },\n  \"homepage\": \"https://github.com/kanopi/claude-toolbox\",\n  \"license\": \"GPL-2.0-or-later\",\n  \"plugins\": [\n    {\n      \"name\": \"cms-cultivator\",\n      \"description\": \"Comprehensive workflow commands for Drupal and WordPress development\",\n      \"version\": \"0.1.0\",\n      \"source\": {\n        \"source\": \"github\",\n        \"repo\": \"kanopi/cms-cultivator\"\n      },\n      \"homepage\": \"https://kanopi.github.io/cms-cultivator/\",\n      \"keywords\": [\"Drupal\", \"WordPress\", \"cms\", \"accessibility\", \"performance\", \"ddev\"]\n    },\n    {\n      \"name\": \"claude-dev-insights\",\n      \"description\": \"Comprehensive developer analytics and productivity insights for Claude Code. Automatically tracks session analytics, enforces security policies, guards against cost overruns, and ensures code quality with 4 intelligent hooks: SessionEnd, SessionStart, PreToolUse, and PostToolUse.\",\n      \"version\": \"1.0.0\",\n      \"source\": {\n        \"source\": \"github\",\n        \"repo\": \"kanopi/claude-dev-insights\"\n      },\n      \"homepage\": \"https://kanopi.github.io/claude-dev-insights/\",\n      \"keywords\": [\"analytics\", \"session-tracking\", \"cost-management\", \"security\", \"code-quality\", \"productivity\", \"developer-insights\", \"hooks\"]\n    },\n    {\n      \"name\": \"cms-planner\",\n      \"description\": \"AI-powered project planning for web development. Generate comprehensive Functional Requirements Documents (FRDs) with story point estimates, Teamwork-ready CSV backlogs, and implementation roadmaps. Perfect for Drupal, WordPress, and recipe-based architectures.\",\n      \"version\": \"0.1.0\",\n      \"source\": {\n        \"source\": \"github\",\n        \"repo\": \"kanopi/cms-planner\"\n      },\n      \"homepage\": \"https://kanopi.github.io/cms-planner/\",\n      \"keywords\": [\"frd\", \"functional-requirements\", \"project-planning\", \"story-points\", \"agile\", \"scrum\", \"backlog\", \"teamwork\", \"drupal\", \"wordpress\", \"cms\", \"recipes\", \"architecture\", \"estimation\", \"documentation\"]\n    }\n  ]\n}\n",
        "README.md": "# Claude Toolbox\n\n[![License: GPL v2](https://img.shields.io/badge/License-GPL%20v2-blue.svg)](https://www.gnu.org/licenses/gpl-2.0)\n\nA curated toolbox of Claude Code resources from Kanopi Studios for CMS development.\n\n## Installation\n\n### Add the Marketplace\n\nInside Claude Code CLI:\n\n```bash\n/plugin marketplace add kanopi/claude-toolbox\n```\n\n### Install a Plugin\n\n```bash\n/plugin install cms-cultivator@claude-toolbox\n```\n\n### List Available Plugins\n\n```bash\n/plugin\n```\n\nThen select \"Browse Plugins\" to see all available tools.\n\n## Available Plugins\n\n### üå± CMS Cultivator\n\nComprehensive workflow commands for Drupal and WordPress development.\n\n**Features:**\n- üìù PR Workflow (6 commands) - Generate descriptions, automate releases, manage documentation\n- ‚ôø Accessibility (5 commands) - WCAG 2.1 AA compliance audits and fixes\n- ‚ö° Performance (5 commands) - Query optimization, asset analysis, bundle inspection\n- üîí Security (3 commands) - Dependency audits, vulnerability scanning, security reports\n- üß™ Testing (3 commands) - Coverage analysis, report generation\n- ‚ú® Code Quality (2 commands) - Standards enforcement, automated fixes\n- üìö Documentation (1 command) - Automated API documentation generation\n\n**Installation:**\n```bash\n/plugin install cms-cultivator@claude-toolbox\n```\n\n**Documentation:** [https://kanopi.github.io/cms-cultivator/](https://kanopi.github.io/cms-cultivator/)\n\n**Repository:** [https://github.com/kanopi/cms-cultivator](https://github.com/kanopi/cms-cultivator)\n\n---\n\n### üìä Claude Dev Insights\n\nComprehensive developer analytics and productivity insights for Claude Code.\n\n**Features:**\n- üìä Session Analytics - Track 21+ data points per session (duration, tokens, costs, tools)\n- üîí Security Scanner - Block sensitive file access and dangerous commands\n- üí∞ Cost Guard - Session budget tracking and real-time cost alerts\n- ‚úÖ Quality Automator - Auto-run linters and enforce commit message standards\n- ‚òÅÔ∏è Google Sheets Integration - Optional cloud sync for team sharing\n\n**Installation:**\n```bash\n/plugin install claude-dev-insights@claude-toolbox\n```\n\n**Documentation:** [https://kanopi.github.io/claude-dev-insights/](https://kanopi.github.io/claude-dev-insights/)\n\n**Repository:** [https://github.com/kanopi/claude-dev-insights](https://github.com/kanopi/claude-dev-insights)\n\n---\n\n### üìã CMS Planner\n\nAI-powered project planning for web development. Generate comprehensive FRDs with story point estimates and Teamwork-ready CSV backlogs.\n\n**Features:**\n- üìã Functional Requirements Documents - Executive summaries, technical specs, implementation plans\n- üìä Story Point Estimation - Fibonacci sequence estimation (1-34+ points)\n- üì¶ Teamwork Integration - CSV export with phase-based organization\n- üèóÔ∏è Recipe-Based Architecture Support - Special handling for Drupal recipes\n- ‚ö†Ô∏è Risk Assessment - Technical and project risk identification\n- ‚úÖ Success Criteria - Functional, technical, and business metrics\n\n**Installation:**\n```bash\n/plugin install cms-planner@claude-toolbox\n```\n\n**Documentation:** [https://kanopi.github.io/cms-planner/](https://kanopi.github.io/cms-planner/)\n\n**Repository:** [https://github.com/kanopi/cms-planner](https://github.com/kanopi/cms-planner)\n\n## Requirements\n\n- [Claude Code CLI](https://docs.claude.com/en/docs/claude-code) installed\n- Git (for plugin installation)\n\n## Support\n\nFor issues, questions, or feature requests:\n\n1. **Plugin-specific issues:** Open an issue in the respective plugin repository\n2. **Marketplace issues:** Open an issue in this repository\n\n## Contributing\n\nWe welcome contributions! Please see individual plugin repositories for contribution guidelines.\n\n### Adding a New Plugin to the Marketplace\n\n1. Ensure your plugin follows the [Claude Code plugin structure](https://docs.claude.com/en/docs/claude-code/plugins)\n2. Add your plugin metadata to `marketplace.json`\n3. Submit a pull request with:\n   - Plugin description\n   - Documentation link\n   - Test results\n   - Example usage\n\n## License\n\nGPL-2.0-or-later - see [LICENSE.md](LICENSE.md) file for details.\n\n## About Kanopi Studios\n\n[Kanopi Studios](https://kanopi.com) is a woman-owned web design, development, and support agency dedicated to helping you create the strongest possible connections between your content and your audiences.\n\nWith concentrations in nonprofits, higher education, healthcare and corporate work, Kanopi works with a diverse group of organizations that strive to create a better digital world. Our holistic yet nimble approach allows us to jump in at any stage of your site‚Äôs lifecycle to help it achieve its full potential.\n"
      },
      "plugins": [
        {
          "name": "cms-cultivator",
          "description": "Comprehensive workflow commands for Drupal and WordPress development",
          "version": "0.1.0",
          "source": {
            "source": "github",
            "repo": "kanopi/cms-cultivator"
          },
          "homepage": "https://kanopi.github.io/cms-cultivator/",
          "keywords": [
            "Drupal",
            "WordPress",
            "cms",
            "accessibility",
            "performance",
            "ddev"
          ],
          "categories": [
            "accessibility",
            "cms",
            "ddev",
            "drupal",
            "performance",
            "wordpress"
          ],
          "install_commands": [
            "/plugin marketplace add kanopi/claude-toolbox",
            "/plugin install cms-cultivator@claude-toolbox"
          ]
        },
        {
          "name": "claude-dev-insights",
          "description": "Comprehensive developer analytics and productivity insights for Claude Code. Automatically tracks session analytics, enforces security policies, guards against cost overruns, and ensures code quality with 4 intelligent hooks: SessionEnd, SessionStart, PreToolUse, and PostToolUse.",
          "version": "1.0.0",
          "source": {
            "source": "github",
            "repo": "kanopi/claude-dev-insights"
          },
          "homepage": "https://kanopi.github.io/claude-dev-insights/",
          "keywords": [
            "analytics",
            "session-tracking",
            "cost-management",
            "security",
            "code-quality",
            "productivity",
            "developer-insights",
            "hooks"
          ],
          "categories": [
            "analytics",
            "code-quality",
            "cost-management",
            "developer-insights",
            "hooks",
            "productivity",
            "security",
            "session-tracking"
          ],
          "install_commands": [
            "/plugin marketplace add kanopi/claude-toolbox",
            "/plugin install claude-dev-insights@claude-toolbox"
          ]
        },
        {
          "name": "cms-planner",
          "description": "AI-powered project planning for web development. Generate comprehensive Functional Requirements Documents (FRDs) with story point estimates, Teamwork-ready CSV backlogs, and implementation roadmaps. Perfect for Drupal, WordPress, and recipe-based architectures.",
          "version": "0.1.0",
          "source": {
            "source": "github",
            "repo": "kanopi/cms-planner"
          },
          "homepage": "https://kanopi.github.io/cms-planner/",
          "keywords": [
            "frd",
            "functional-requirements",
            "project-planning",
            "story-points",
            "agile",
            "scrum",
            "backlog",
            "teamwork",
            "drupal",
            "wordpress",
            "cms",
            "recipes",
            "architecture",
            "estimation",
            "documentation"
          ],
          "categories": [
            "agile",
            "architecture",
            "backlog",
            "cms",
            "documentation",
            "drupal",
            "estimation",
            "frd",
            "functional-requirements",
            "project-planning",
            "recipes",
            "scrum",
            "story-points",
            "teamwork",
            "wordpress"
          ],
          "install_commands": [
            "/plugin marketplace add kanopi/claude-toolbox",
            "/plugin install cms-planner@claude-toolbox"
          ]
        }
      ]
    }
  ]
}