{
  "author": {
    "id": "king8fisher",
    "display_name": "king8fisher",
    "avatar_url": "https://avatars.githubusercontent.com/u/140904760?v=4"
  },
  "marketplaces": [
    {
      "name": "king8fisher-plugins",
      "version": null,
      "description": "Claude Code plugins collection",
      "repo_full_name": "king8fisher/claude-code-marketplace",
      "repo_url": "https://github.com/king8fisher/claude-code-marketplace",
      "repo_description": null,
      "signals": {
        "stars": 0,
        "forks": 0,
        "pushed_at": "2026-01-12T15:51:56Z"
      },
      "files": {
        ".claude-plugin/marketplace.json": "{\n  \"name\": \"king8fisher-plugins\",\n  \"owner\": {\n    \"name\": \"king8fisher\"\n  },\n  \"metadata\": {\n    \"description\": \"Claude Code plugins collection\"\n  },\n  \"plugins\": [\n    {\n      \"name\": \"ralph-wiggum\",\n      \"source\": \"./plugins/ralph-wiggum\",\n      \"description\": \"Self-referential AI loop - Claude iterates on tasks until completion\",\n      \"tags\": [\"loop\", \"iteration\", \"automation\"]\n    }\n  ]\n}",
        "README.md": "# Claude Code Plugins\n\nCustom plugins for Claude Code.\n\n## Installation\n\n```bash\n# Add marketplace\n/plugin marketplace add king8fisher/claude-code-marketplace\n\n# Install a plugin\n/plugin install ralph-wiggum@king8fisher-plugins\n```\n\n## Plugins\n\n### ralph-wiggum\n\nFork of [ralph-wiggum from claude-plugins-official](https://github.com/anthropics/claude-plugins-official/tree/main/plugins/ralph-wiggum) with multi-session support.\n\nSelf-referential AI loop - Claude iterates on tasks until completion.\n\n**Enhancements:**\n- Multi-session support: Multiple Claude sessions in the same directory no longer interfere with each other (uses session-specific state files)\n- Multi-line bash fix: Completion promise logic moved to setup script (equivalent to [PR #58](https://github.com/anthropics/claude-plugins-official/pull/58))\n\n```bash\n/ralph-wiggum:ralph-loop Fix the auth bug\n```\n\n**Features:**\n- Default 10 iterations max (`-n 0` for unlimited)\n- Default completion promise \"IMPLEMENTED\" (`-p 'custom'` to override)\n- Claude exits when it outputs `<promise>IMPLEMENTED</promise>`\n- \"IMPLEMENTED\" means code is written - planning alone won't exit the loop\n\n**Options:**\n- `-n <N>` - Max iterations (default: 10)\n- `-p '<text>'` - Completion promise (default: IMPLEMENTED)\n\n**Examples:**\n```bash\n/ralph-wiggum:ralph-loop Fix the auth bug\n/ralph-wiggum:ralph-loop -n 5 Refactor the cache layer\n/ralph-wiggum:ralph-loop -p 'Tests pass' Add unit tests\n```"
      },
      "plugins": [
        {
          "name": "ralph-wiggum",
          "source": "./plugins/ralph-wiggum",
          "description": "Self-referential AI loop - Claude iterates on tasks until completion",
          "tags": [
            "loop",
            "iteration",
            "automation"
          ],
          "categories": [
            "automation",
            "iteration",
            "loop"
          ],
          "install_commands": [
            "/plugin marketplace add king8fisher/claude-code-marketplace",
            "/plugin install ralph-wiggum@king8fisher-plugins"
          ]
        }
      ]
    }
  ]
}