{
  "author": {
    "id": "lagz0ne",
    "display_name": "Duke Dao",
    "avatar_url": "https://avatars.githubusercontent.com/u/15101444?u=79982d7442076ae106413a6559b3d20acf238136&v=4"
  },
  "marketplaces": [
    {
      "name": "c3-skill-marketplace",
      "version": null,
      "description": "C3 architecture design methodology plugin marketplace",
      "repo_full_name": "lagz0ne/c3-skill",
      "repo_url": "https://github.com/lagz0ne/c3-skill",
      "repo_description": "C3 (Context-Container-Component) architecture design methodology plugin for Claude Code",
      "signals": {
        "stars": 7,
        "forks": 0,
        "pushed_at": "2026-01-29T10:55:25Z"
      },
      "files": {
        ".claude-plugin/marketplace.json": "{\n  \"name\": \"c3-skill-marketplace\",\n  \"description\": \"C3 architecture design methodology plugin marketplace\",\n  \"owner\": {\n    \"name\": \"Lagz0ne\",\n    \"email\": \"lagz0ne@users.noreply.github.com\"\n  },\n  \"plugins\": [\n    {\n      \"name\": \"c3-skill\",\n      \"description\": \"C3 (Context-Container-Component) architecture design methodology with structured top-down documentation, mermaid diagrams, and intention-based workflows\",\n      \"version\": \"3.8.0\",\n      \"source\": \"./\",\n      \"author\": {\n        \"name\": \"Lagz0ne\",\n        \"email\": \"lagz0ne@users.noreply.github.com\"\n      }\n    }\n  ]\n}\n",
        ".claude-plugin/plugin.json": "{\n  \"name\": \"c3-skill\",\n  \"description\": \"C3 (Context-Container-Component) architecture design methodology with structured top-down documentation, mermaid diagrams, and intention-based workflows\",\n  \"version\": \"3.8.0\",\n  \"author\": {\n    \"name\": \"Lagz0ne\",\n    \"email\": \"lagz0ne@users.noreply.github.com\"\n  },\n  \"homepage\": \"https://github.com/Lagz0ne/c3-skill\",\n  \"repository\": \"https://github.com/Lagz0ne/c3-skill\",\n  \"license\": \"MIT\",\n  \"keywords\": [\"architecture\", \"design\", \"c3\", \"documentation\", \"mermaid\", \"system-design\"]\n}\n",
        "README.md": "# c3-skill\n\nC3 (Context-Container-Component) architecture methodology for Claude Code. Top-down documentation with ADR-first changes and TDD implementation.\n\n![Agent Ecosystem](https://diashort.apps.quickable.co/e/ee8922f6)\n\n## Installation\n\n```bash\nclaude plugin install c3-skill\n```\n\n## Commands\n\n| Command | Triggers | Purpose |\n|---------|----------|---------|\n| `/onboard` | \"adopt C3\", \"init C3\", \"scaffold docs\" | Initialize C3 documentation for a project |\n| `/query` | \"where is X\", \"how does X work\", \"explain X\" | Navigate architecture docs |\n| `/alter` | \"add component\", \"refactor X\", \"fix bug\" | Make changes via ADR workflow |\n| `/c3` | \"audit\", \"validate\", general C3 ops | Route to appropriate workflow |\n\n## Skills\n\n| Skill | Triggers | Purpose |\n|-------|----------|---------|\n| `c3-query` | \"where/what is X\", \"what does X do\", \"explain/describe X\", \"diagram of X\", \"dependencies of X\", \"who/what calls X\", \"trace X\", \"flow of X\" | Deep architecture navigation |\n| `c3-alter` | \"add/change/edit/update/remove X\", \"implement/extend/improve X\", \"make X do Y\", \"refactor X\", \"fix bug\", \"rename/move/split/merge/delete component\" | Full ADR change workflow |\n| `c3-ref` | \"add/define pattern\", \"best practice for X\", \"coding standard\", \"guideline for X\", \"how should we X\", \"what's the convention\", \"list refs\" | Manage cross-cutting patterns |\n| `onboard` | \"adopt/init/initialize/start/bootstrap C3\", \"create C3 docs\", \"start documenting\", \"document this project/codebase\" | Staged Socratic discovery |\n| `c3` | \"audit/validate C3\", \"check/verify docs\", \"sync/refresh docs\", \"is documentation current\", \"docs out of sync\" | Routing + audit |\n\n## Quick Example\n\n```bash\n# 1. Initialize (asks questions about your system)\n/onboard\n\n# 2. Query (finds and explains architecture)\n/query \"where is authentication handled?\"\n# → c3-1-api: c3-101-auth-middleware, c3-102-user-service\n\n# 3. Change (ADR workflow with impact analysis)\n/alter \"add rate limiting\"\n# → Clarify → Analyze → ADR → Accept → Execute (optional)\n```\n\n## Architecture\n\n### Agents\n\n**User-facing:**\n\n| Agent | Role | Model |\n|-------|------|-------|\n| `c3-navigator` | Answer architecture questions | inherit |\n| `c3-orchestrator` | Orchestrate changes via ADR | opus |\n| `c3-dev` | Execute ADR with TDD | opus |\n| `c3-adr-transition` | Transition ADR to implemented | haiku |\n\n**Internal (dispatched by orchestrator):**\n\n| Agent | Role | Model |\n|-------|------|-------|\n| `c3-analysis` | Comprehensive analysis (state, impact, patterns) | sonnet |\n| `c3-synthesizer` | Combine analysis, validate readiness | opus |\n| `c3-summarizer` | Extract facts from docs | haiku |\n| `c3-content-classifier` | Classify content for audit | haiku |\n\n### Change Workflow\n\n```\nIntent → Analysis → Synthesis → ADR → Accept → Execute → Transition\n             │                          │\n      c3-analysis       ← validation gate ──┘\n      (state+impact+patterns)\n```\n\n1. **Clarify** - Socratic dialogue (what? why? scope?)\n2. **Analyze** - c3-analysis performs state, impact, patterns\n3. **Synthesize** - Combine findings, validate checks\n4. **ADR** - Create decision record with approved files\n5. **Accept** - User reviews, captures base commit\n6. **Execute** - c3-dev implements with TDD (optional)\n7. **Transition** - Mark implemented after verification\n\n### TDD Workflow (c3-dev)\n\n![TDD Workflow](https://diashort.apps.quickable.co/e/e43110a1)\n\nTask states: `pending → in_progress → blocked → testing → implementing → completed`\n\n## Documentation Structure\n\n```\n.c3/\n├── README.md                    # System context (c3-0)\n├── TOC.md                       # Auto-generated TOC\n├── c3-N-{container}/            # Container docs\n│   ├── README.md                # Container overview\n│   └── c3-NXX-{component}.md    # Component docs\n├── refs/                        # Cross-cutting patterns\n│   └── ref-{name}.md            # Pattern constraints\n└── adr/                         # Decision records\n    └── adr-YYYYMMDD-{slug}.md   # ADR lifecycle\n```\n\n![C3 Structure](https://diashort.apps.quickable.co/e/c08ec10d)\n\n## Proactive Pattern Awareness\n\nC3 provides **ambient context** without explicit invocation:\n\n### SessionStart\nWhen entering a C3-documented project, Claude automatically learns:\n- System goal and key decisions\n- All refs (patterns) with their purposes\n- File → component mapping\n\n### Edit/Write Context\nWhen editing files in documented areas, Claude receives:\n- Which component owns the file\n- Applicable patterns (refs)\n- Guidance to maintain consistency\n\nThis enables **drift prevention** - changes naturally align with established patterns.\n\n## Key Concepts\n\n| Concept | Description |\n|---------|-------------|\n| **ADR** | Architecture Decision Record. States: `proposed → accepted → implemented` |\n| **Ref** | Cross-cutting pattern. Components must follow; violations require override justification |\n| **Task** | c3-dev work item linked to ADR via metadata |\n\n## Hooks\n\n| Hook | Script | Purpose |\n|------|--------|---------|\n| SessionStart | `c3-context-loader` | Load patterns + file mapping into context |\n| PreToolUse (Edit/Write) | `c3-edit-context` | Surface applicable refs when editing |\n| PreToolUse (Edit/Write) | `c3-gate` | Gate edits to ADR-approved files |\n| PreToolUse (Bash) | `pre-commit-toc` | Rebuild TOC on git commit |\n\n## References\n\n| File | Purpose |\n|------|---------|\n| `references/skill-harness.md` | Behavioral constraints |\n| `references/layer-navigation.md` | C3 doc traversal |\n| `references/adr-template.md` | ADR structure |\n| `references/audit-checks.md` | Audit procedure |\n\n## License\n\nMIT\n"
      },
      "plugins": [
        {
          "name": "c3-skill",
          "description": "C3 (Context-Container-Component) architecture design methodology with structured top-down documentation, mermaid diagrams, and intention-based workflows",
          "version": "3.8.0",
          "source": "./",
          "author": {
            "name": "Lagz0ne",
            "email": "lagz0ne@users.noreply.github.com"
          },
          "categories": [],
          "install_commands": [
            "/plugin marketplace add lagz0ne/c3-skill",
            "/plugin install c3-skill@c3-skill-marketplace"
          ]
        }
      ]
    },
    {
      "name": "design-skill-marketplace",
      "version": null,
      "description": "System design skill for Claude Code using EventStorming and Mermaid diagrams",
      "repo_full_name": "lagz0ne/design-skill",
      "repo_url": "https://github.com/lagz0ne/design-skill",
      "repo_description": "System design skill for Claude Code using EventStorming and Mermaid diagrams",
      "signals": {
        "stars": 0,
        "forks": 1,
        "pushed_at": "2025-11-06T04:19:58Z"
      },
      "files": {
        ".claude-plugin/marketplace.json": "{\n  \"name\": \"design-skill-marketplace\",\n  \"owner\": {\n    \"name\": \"lagz0ne\",\n    \"email\": \"lagz0ne@users.noreply.github.com\"\n  },\n  \"metadata\": {\n    \"description\": \"System design skill for Claude Code using EventStorming and Mermaid diagrams\",\n    \"version\": \"1.0.0\"\n  },\n  \"plugins\": [\n    {\n      \"name\": \"system-design\",\n      \"source\": {\n        \"source\": \"url\",\n        \"url\": \"https://github.com/lagz0ne/design-skill.git\"\n      },\n      \"description\": \"Transform requirements into navigable design catalogs using EventStorming methodology, Mermaid diagrams, and progressive elaboration through 5 phases\",\n      \"version\": \"1.0.0\",\n      \"strict\": true\n    }\n  ]\n}\n",
        ".claude-plugin/plugin.json": "{\n  \"name\": \"system-design\",\n  \"description\": \"Transform requirements into navigable design catalogs using EventStorming methodology, Mermaid diagrams, and progressive elaboration\",\n  \"version\": \"1.0.0\",\n  \"author\": {\n    \"name\": \"lagz0ne\",\n    \"email\": \"lagz0ne@users.noreply.github.com\"\n  },\n  \"homepage\": \"https://github.com/lagz0ne/design-skill\",\n  \"repository\": \"https://github.com/lagz0ne/design-skill\",\n  \"license\": \"MIT\",\n  \"keywords\": [\"design\", \"architecture\", \"eventstorming\", \"mermaid\", \"system-design\", \"diagrams\", \"catalog\"]\n}\n",
        "README.md": "# Design Skill Marketplace\n\nClaude Code marketplace for system design using EventStorming and Mermaid diagrams.\n\n## Installation\n\nAdd this marketplace to Claude Code:\n\n```bash\n/plugin marketplace add lagz0ne/design-skill\n```\n\nThen install the system-design plugin:\n\n```bash\n/plugin install system-design@design-skill-marketplace\n```\n\n## Available Plugins\n\n### System Design\n\n**Description:** Transform requirements into navigable design catalogs using EventStorming methodology, Mermaid diagrams, and progressive elaboration\n\n**Categories:** Architecture, Design, EventStorming, Documentation\n\n**What you get:**\n- EventStorming-based design process\n- 5-phase progressive elaboration (Requirements → Big Picture → Processes → Data/Flows → Integration)\n- Mermaid diagram templates (EventStorming, ERD, State Charts, Sequence Diagrams)\n- Standardized catalog structure (`docs/design-catalog/`)\n- Token-efficient visual artifacts\n\n**Repository:** https://github.com/lagz0ne/design-skill\n\n**Triggers:** \"design a system\", \"architect a solution\", \"plan a backend\"\n\n---\n\n## How It Works\n\nThe system-design skill guides you through 5 phases:\n\n1. **Requirements** - Interactive questions to understand context (no assumptions)\n2. **Big Picture** - EventStorming timeline with color-coded events/commands/actors\n3. **Processes** - Detail 2-4 critical workflows with aggregates and policies\n4. **Data & Flows** - ERD, state charts for complex entities, sequence diagrams for critical flows\n5. **Integration** - Assemble navigable catalog with all diagrams embedded\n\n### Output Structure\n\n```\ndocs/design-catalog/\n  README.md              # Navigation hub with all diagrams embedded\n  requirements.md\n  big-picture.mmd\n  processes/\n    process-{name}.mmd\n  data/\n    erd.mmd\n    state-{entity}.mmd\n  flows/\n    sequence-{flow}.mmd\n```\n\nAll diagrams use Mermaid format and follow EventStorming color conventions.\n\n## Example: E-commerce Platform\n\nThe skill transforms a simple request into a complete design catalog:\n\n**Input:** \"I want to build an e-commerce platform where artisans can sell handmade products\"\n\n**Output:**\n- 10 Mermaid diagrams (big picture, 3 processes, ERD, 2 states, 3 sequences)\n- 14 hotspots identified for decisions\n- Complete navigable catalog\n- ~45K tokens (vs 49K baseline without skill)\n\nSee `test-scenarios/ecommerce/with-skill/` for full example.\n\n## Plugin Structure\n\n```\ndesign-skill/\n├── skills/\n│   └── system-design/          # The skill\n│       ├── SKILL.md            # Main skill (470 lines)\n│       └── templates/          # 7 Mermaid templates\n├── .claude-plugin/\n│   ├── plugin.json             # Plugin metadata\n│   └── marketplace.json        # Marketplace catalog\n├── docs/\n│   └── plans/                  # Design documentation\n├── test-scenarios/             # TDD test cases\n├── LICENSE                     # MIT\n└── README.md                   # This file\n```\n\n## Support\n\n- **Issues:** https://github.com/lagz0ne/design-skill/issues\n- **Skill Documentation:** `skills/system-design/SKILL.md`\n\n## License\n\nMIT License\n\n---\n\n## For Developers\n\nThis skill was built using **TDD for documentation**:\n\n1. **RED:** Baseline test (49K tokens, 0 questions, ASCII diagrams)\n2. **GREEN:** Skill created (45K tokens, 6 questions, Mermaid)\n3. **REFACTOR:** Closed loopholes (explicit limits, counters)\n\nSee `test-scenarios/` and `docs/plans/` for full development process.\n"
      },
      "plugins": [
        {
          "name": "system-design",
          "source": {
            "source": "url",
            "url": "https://github.com/lagz0ne/design-skill.git"
          },
          "description": "Transform requirements into navigable design catalogs using EventStorming methodology, Mermaid diagrams, and progressive elaboration through 5 phases",
          "version": "1.0.0",
          "strict": true,
          "categories": [],
          "install_commands": [
            "/plugin marketplace add lagz0ne/design-skill",
            "/plugin install system-design@design-skill-marketplace"
          ]
        }
      ]
    }
  ]
}