{
  "author": {
    "id": "lgbarn",
    "display_name": "Luther Barnum",
    "avatar_url": "https://avatars.githubusercontent.com/u/4458104?u=26f5eea3df0f20d9e9d88f391e94a5817120410f&v=4"
  },
  "marketplaces": [
    {
      "name": "shipyard",
      "version": null,
      "description": "Ship software systematically: project lifecycle, TDD, parallel agents, code review, security auditing, and infrastructure validation",
      "repo_full_name": "lgbarn/shipyard",
      "repo_url": "https://github.com/lgbarn/shipyard",
      "repo_description": "Structured project lifecycle plugin for Claude Code â€” from idea to production with discipline, parallel agents, and quality gates.",
      "signals": {
        "stars": 3,
        "forks": 0,
        "pushed_at": "2026-02-02T04:11:44Z"
      },
      "files": {
        ".claude-plugin/marketplace.json": "{\n  \"$schema\": \"https://anthropic.com/claude-code/marketplace.schema.json\",\n  \"name\": \"shipyard\",\n  \"description\": \"Ship software systematically: project lifecycle, TDD, parallel agents, code review, security auditing, and infrastructure validation\",\n  \"owner\": {\n    \"name\": \"lgbarn\",\n    \"email\": \"lgbarn@users.noreply.github.com\"\n  },\n  \"plugins\": [\n    {\n      \"name\": \"shipyard\",\n      \"version\": \"2.1.0\",\n      \"description\": \"Ship software systematically: project lifecycle, TDD, parallel agents, code review, security auditing, and infrastructure validation\",\n      \"source\": \"./\",\n      \"category\": \"development\"\n    }\n  ]\n}\n",
        ".claude-plugin/plugin.json": "{\n  \"name\": \"shipyard\",\n  \"description\": \"Ship software systematically: project lifecycle, TDD, parallel agents, code review, security auditing, and infrastructure validation\",\n  \"author\": {\n    \"name\": \"lgbarn\",\n    \"email\": \"lgbarn@users.noreply.github.com\"\n  }\n}\n",
        "README.md": "# Shipyard\n\nShip software systematically â€” from idea to production with discipline, parallel agents, and zero context rot.\n\nShipyard is a Claude Code plugin that combines structured project lifecycle management with rigorous development practices. It replaces ad-hoc workflows with a systematic pipeline: brainstorm requirements, plan in phases, execute with fresh subagents, review with two-stage gates, audit for security, audit for simplification, and ship with confidence.\n\n## Prerequisites\n\n- [Claude Code](https://docs.anthropic.com/en/docs/claude-code) CLI installed and authenticated\n- `jq` (used by session hooks for state injection)\n\n## Installation\n\n### From GitHub (recommended)\n\n```bash\nclaude plugin marketplace add lgbarn/shipyard\nclaude plugin install shipyard@shipyard\n```\n\n### From a local clone\n\n```bash\ngit clone git@github.com:lgbarn/shipyard.git\nclaude plugin marketplace add /absolute/path/to/shipyard\nclaude plugin install shipyard@shipyard\n```\n\n### Verify\n\n```bash\nclaude /shipyard:status\n```\n\n## Quick Start\n\nOnce installed, navigate to any project directory and run:\n\n```bash\n# Initialize a new project\n/shipyard:init\n\n# Plan a phase\n/shipyard:plan 1\n\n# Build it\n/shipyard:build\n\n# Check progress\n/shipyard:status\n\n# Ship it\n/shipyard:ship\n```\n\n## Commands\n\n| Command | Purpose |\n|---------|---------|\n| `/shipyard:init` | Initialize project â€” gather requirements, analyze codebase, create roadmap |\n| `/shipyard:plan [phase] [--skip-research]` | Decompose a phase into executable plans with atomic tasks |\n| `/shipyard:build [phase] [--plan N] [--light]` | Execute plans with parallel builder agents and review gates |\n| `/shipyard:status` | Show progress dashboard and route to next action |\n| `/shipyard:resume` | Restore context from a previous session |\n| `/shipyard:quick [task]` | Execute a small task with full guarantees |\n| `/shipyard:ship [--phase \\| --milestone \\| --branch]` | Verify and deliver â€” merge, PR, or preserve |\n| `/shipyard:issues [--add \\| --resolve \\| --list]` | View and manage deferred issues across sessions |\n| `/shipyard:rollback [checkpoint] [--list]` | Revert to a previous checkpoint |\n| `/shipyard:recover` | Diagnose and recover from interrupted state |\n| `/shipyard:worktree [create\\|list\\|switch\\|remove] [name]` | Manage git worktrees for isolated feature development |\n\n## Skills (Auto-Activating)\n\nShipyard includes 16 skills that activate automatically based on context:\n\n| Skill | When It Activates |\n|-------|-------------------|\n| `shipyard-tdd` | Writing any new code, features, or fixes |\n| `shipyard-debugging` | Any error, test failure, or unexpected behavior |\n| `shipyard-verification` | Before claiming any task is complete |\n| `shipyard-brainstorming` | Creative work: features, components, design |\n| `security-audit` | Working with code, configs, dependencies, or IaC |\n| `code-simplification` | After implementation, before shipping, reviewing AI code |\n| `documentation` | After implementation, before shipping, when docs are incomplete |\n| `infrastructure-validation` | Working with Terraform, Ansible, Docker, or IaC files |\n| `parallel-dispatch` | 2+ independent tasks that can run concurrently |\n| `shipyard-writing-plans` | Creating implementation plans |\n| `shipyard-executing-plans` | Implementing from a written plan |\n| `git-workflow` | Branch management, commits, delivery |\n| `using-shipyard` | Every session (skill discovery protocol) |\n| `shipyard-testing` | Writing effective, maintainable tests |\n| `shipyard-writing-skills` | Creating new skills |\n| `lessons-learned` | After phase completion, before shipping, reflecting on work |\n\n## Agents\n\nShipyard dispatches specialized agents for different phases of work:\n\n| Agent | Role | Dispatched By |\n|-------|------|---------------|\n| **mapper** | Brownfield codebase analysis (4 parallel instances) | `/shipyard:init` |\n| **researcher** | Domain/technology research | `/shipyard:plan` |\n| **architect** | Roadmap + plan decomposition | `/shipyard:init`, `/shipyard:plan`, `/shipyard:quick` |\n| **builder** | Task execution with TDD, IaC validation, atomic commits | `/shipyard:build`, `/shipyard:quick` |\n| **reviewer** | Two-stage code review (spec + quality) | `/shipyard:build` |\n| **auditor** | Comprehensive security & compliance analysis | `/shipyard:build`, `/shipyard:ship` |\n| **simplifier** | Cross-task duplication and complexity analysis | `/shipyard:build` |\n| **documenter** | Documentation generation & updates | `/shipyard:build`, `/shipyard:ship` |\n| **verifier** | Post-execution verification (including IaC) | `/shipyard:plan`, `/shipyard:build`, `/shipyard:ship` |\n\n## How It Works\n\n### The Lifecycle\n\n```\nIDEA â†’ /init (brainstorm + roadmap)\n     â†’ /plan (research + decompose)\n     â†’ /build (parallel execute + review)\n     â†’ /status (check progress)\n     â†’ repeat planâ†’build per phase\n     â†’ /ship (verify + deliver)\n     â†’ SHIPPED\n```\n\n### State Management\n\nShipyard uses a dual state system:\n\n- **File state** (`.shipyard/` directory): Cross-session persistence for project vision, roadmap, plans, and progress. Survives session restarts and can be committed to git.\n- **Native tasks** (TaskCreate/TaskUpdate): In-session UI visibility showing real-time progress of phases and plans.\n\n### Key Design Principles\n\n- **Fresh context per task**: Each builder agent runs in a clean 200k-token context, preventing quality degradation\n- **Two-stage review + security audit**: Spec compliance and code quality per task, comprehensive security audit per phase\n- **Configurable gates**: Security audit, simplification review, and IaC validation can be toggled in `config.json` or skipped with `--light`\n- **Code simplification**: Post-phase analysis catches AI-generated duplication and bloat across tasks\n- **Documentation generation**: Post-phase documentation keeps docs synchronized with code changes\n- **IaC support**: Terraform, Ansible, Docker validation workflows built into the builder and verifier\n- **Max 3 tasks per plan**: Keeps each agent's workload within the quality budget\n- **Atomic commits**: Every task produces a separate, revertable commit\n- **Phase-based planning**: Break large projects into manageable phases with clear success criteria\n\n## Project State Structure\n\n```\n.shipyard/\nâ”œâ”€â”€ PROJECT.md          # Vision, decisions, constraints\nâ”œâ”€â”€ ROADMAP.md          # Phase structure with success criteria\nâ”œâ”€â”€ STATE.md            # Current position, session memory\nâ”œâ”€â”€ config.json         # Workflow preferences\nâ”œâ”€â”€ codebase/           # Brownfield analysis (optional)\nâ”œâ”€â”€ phases/\nâ”‚   â””â”€â”€ 01-{name}/\nâ”‚       â”œâ”€â”€ RESEARCH.md\nâ”‚       â”œâ”€â”€ 01-PLAN.md\nâ”‚       â”œâ”€â”€ 01-SUMMARY.md\nâ”‚       â”œâ”€â”€ VERIFICATION.md\nâ”‚       â”œâ”€â”€ AUDIT-{N}.md          # Security audit report\nâ”‚       â”œâ”€â”€ SIMPLIFICATION-{N}.md # Code simplification report\nâ”‚       â””â”€â”€ DOCUMENTATION-{N}.md  # Documentation generation report\nâ””â”€â”€ quick/              # Ad-hoc tasks\n```\n\n## Plugin Structure\n\n```\nshipyard/\nâ”œâ”€â”€ .claude-plugin/\nâ”‚   â”œâ”€â”€ marketplace.json   # Marketplace metadata (version, category)\nâ”‚   â””â”€â”€ plugin.json        # Plugin definition (name, description)\nâ”œâ”€â”€ agents/                # Specialized subagent definitions\nâ”‚   â”œâ”€â”€ architect.md       # Roadmap and plan decomposition\nâ”‚   â”œâ”€â”€ auditor.md         # Security and compliance analysis\nâ”‚   â”œâ”€â”€ builder.md         # Task execution with TDD\nâ”‚   â”œâ”€â”€ documenter.md      # Documentation generation\nâ”‚   â”œâ”€â”€ mapper.md          # Brownfield codebase analysis\nâ”‚   â”œâ”€â”€ researcher.md      # Domain/technology research\nâ”‚   â”œâ”€â”€ reviewer.md        # Two-stage code review\nâ”‚   â”œâ”€â”€ simplifier.md      # Complexity and duplication analysis\nâ”‚   â””â”€â”€ verifier.md        # Post-execution verification\nâ”œâ”€â”€ commands/              # Slash command definitions\nâ”‚   â”œâ”€â”€ init.md            # /shipyard:init\nâ”‚   â”œâ”€â”€ plan.md            # /shipyard:plan\nâ”‚   â”œâ”€â”€ build.md           # /shipyard:build\nâ”‚   â”œâ”€â”€ status.md          # /shipyard:status\nâ”‚   â”œâ”€â”€ resume.md          # /shipyard:resume\nâ”‚   â”œâ”€â”€ quick.md           # /shipyard:quick\nâ”‚   â”œâ”€â”€ ship.md            # /shipyard:ship\nâ”‚   â”œâ”€â”€ issues.md          # /shipyard:issues\nâ”‚   â”œâ”€â”€ rollback.md        # /shipyard:rollback\nâ”‚   â”œâ”€â”€ recover.md         # /shipyard:recover\nâ”‚   â””â”€â”€ worktree.md        # /shipyard:worktree\nâ”œâ”€â”€ docs/\nâ”‚   â””â”€â”€ PROTOCOLS.md       # Model routing and config.json reference\nâ”œâ”€â”€ hooks/\nâ”‚   â””â”€â”€ hooks.json         # SessionStart hook for state injection\nâ”œâ”€â”€ scripts/\nâ”‚   â”œâ”€â”€ state-read.sh      # Adaptive context loading on session start\nâ”‚   â”œâ”€â”€ state-write.sh     # Updates .shipyard/STATE.md\nâ”‚   â””â”€â”€ checkpoint.sh      # Git tag checkpoint management\nâ”œâ”€â”€ skills/                # Auto-activating skill definitions\nâ”‚   â”œâ”€â”€ code-simplification/\nâ”‚   â”œâ”€â”€ documentation/\nâ”‚   â”œâ”€â”€ git-workflow/\nâ”‚   â”œâ”€â”€ infrastructure-validation/\nâ”‚   â”œâ”€â”€ lessons-learned/\nâ”‚   â”œâ”€â”€ parallel-dispatch/\nâ”‚   â”œâ”€â”€ security-audit/\nâ”‚   â”œâ”€â”€ shipyard-brainstorming/\nâ”‚   â”œâ”€â”€ shipyard-debugging/\nâ”‚   â”œâ”€â”€ shipyard-executing-plans/\nâ”‚   â”œâ”€â”€ shipyard-tdd/\nâ”‚   â”œâ”€â”€ shipyard-testing/\nâ”‚   â”œâ”€â”€ shipyard-verification/\nâ”‚   â”œâ”€â”€ shipyard-writing-plans/\nâ”‚   â”œâ”€â”€ shipyard-writing-skills/\nâ”‚   â””â”€â”€ using-shipyard/\nâ”œâ”€â”€ test/                  # bats-core test suite (dev only)\nâ”‚   â”œâ”€â”€ run.sh             # Test runner\nâ”‚   â”œâ”€â”€ test_helper.bash   # Shared fixtures\nâ”‚   â”œâ”€â”€ state-read.bats\nâ”‚   â”œâ”€â”€ state-write.bats\nâ”‚   â”œâ”€â”€ checkpoint.bats\nâ”‚   â”œâ”€â”€ integration.bats\nâ”‚   â””â”€â”€ e2e-smoke.bats\nâ”œâ”€â”€ CHANGELOG.md\nâ”œâ”€â”€ CONTRIBUTING.md\nâ”œâ”€â”€ LICENSE\nâ””â”€â”€ package.json\n```\n\n## Configuration\n\nWhen you run `/shipyard:init`, Shipyard creates a `.shipyard/config.json` in your project with these options:\n\n| Option | Values | Default | Description |\n|--------|--------|---------|-------------|\n| `interaction_mode` | `interactive`, `autonomous` | â€” | Approve each phase or execute full roadmap |\n| `git_strategy` | `per_task`, `per_phase`, `manual` | â€” | When to create git commits |\n| `review_depth` | `detailed`, `lightweight` | â€” | Review gate depth between build steps |\n| `security_audit` | `true`, `false` | `true` | Run security audit after each phase |\n| `simplification_review` | `true`, `false` | `true` | Check for duplication and complexity |\n| `iac_validation` | `auto`, `true`, `false` | `auto` | Validate Terraform/Ansible/Docker changes |\n| `documentation_generation` | `true`, `false` | `true` | Generate docs after each phase |\n| `model_routing` | object | see `docs/PROTOCOLS.md` | Model selection per task type |\n| `context_tier` | `auto`, `minimal`, `full` | `auto` | Context loading at session start |\n\nSee `docs/PROTOCOLS.md` for model routing configuration and the full config.json skeleton.\n\n## Feature Comparison\n\n| Capability | Shipyard v2.1.0 | GSD v1.10.1 | Superpowers v3.6.2 |\n|-----------|:---:|:---:|:---:|\n| **Project Lifecycle** | | | |\n| Init / requirements gathering | âœ… | âœ… | âœ… |\n| Phase-based roadmap | âœ… | âœ… | âŒ |\n| Research agents | âœ… (researcher + 4 mappers) | âœ… (4 parallel) | âŒ |\n| Discussion / decision capture | âŒ | âœ… | âŒ |\n| Structured planning (waves) | âœ… | âœ… | âœ… |\n| Max 3 tasks per plan | âœ… | âœ… | âŒ |\n| Quick task mode | âœ… | âœ… | âŒ |\n| Progress dashboard | âœ… | âœ… | âŒ |\n| Ship / deliver command | âœ… | âœ… | âŒ |\n| **Execution** | | | |\n| Fresh 200k context per agent | âœ… | âœ… | âœ… |\n| Parallel wave execution | âœ… | âœ… | âœ… |\n| TDD enforcement | âœ… (rigid skill) | âœ… (implicit) | âœ… (rigid skill) |\n| Atomic commits per task | âœ… | âœ… | âœ… |\n| IaC validation (Terraform, Ansible, Docker) | âœ… | âŒ | âŒ |\n| **Quality Gates** | | | |\n| Two-stage code review | âœ… (spec + quality) | âœ… (single-stage) | âœ… (spec + quality) |\n| Security audit (OWASP, secrets, deps) | âœ… (dedicated agent) | âŒ | âŒ |\n| Code simplification | âœ… (skill + agent) | âŒ | ğŸ§ª (lab, experimental) |\n| Documentation generation | âœ… (dedicated agent) | âŒ | âŒ |\n| Phase verification | âœ… | âœ… | âŒ |\n| Configurable gate toggles | âœ… (`--light`, config.json) | âŒ | âŒ |\n| **Context & Models** | | | |\n| Multi-model routing | âœ… (7 categories) | âœ… (profiles) | âŒ |\n| Adaptive context loading | âœ… (4 tiers) | âœ… (5 tiers, fork) | âœ… (<2k bootstrap) |\n| Session resume / state persistence | âœ… | âœ… | âŒ |\n| Episodic memory | âŒ | âŒ | âœ… (plugin) |\n| **Git & Recovery** | | | |\n| Git worktree management | âœ… (command + agent context) | âŒ | âœ… (skill) |\n| Rollback / checkpoints | âœ… | âœ… (fork) | âŒ |\n| State recovery | âœ… | âœ… (fork) | âŒ |\n| Issue tracking (cross-session) | âœ… | âœ… (todos) | âŒ |\n| **Skills & Extensibility** | | | |\n| Auto-activating skills | âœ… (16 skills) | âŒ | âœ… (15+ skills) |\n| Deterministic skill triggers | âœ… (4 trigger types) | âŒ | âŒ (description-based) |\n| Systematic debugging | âœ… | âœ… | âœ… (4-phase + escalation) |\n| Verification before completion | âœ… | âœ… | âœ… |\n| Brainstorming / design | âœ… | âœ… (discuss phase) | âœ… |\n| Skill authoring guide | âœ… | âŒ | âœ… |\n| Plugin marketplace | âŒ | âŒ | âœ… (7 plugins) |\n| **Distribution** | | | |\n| Install via CLI | âœ… (`lgbarn/shipyard`) | âœ… (`npx get-shit-done-cc`) | âœ… (marketplace) |\n| Multi-runtime | âŒ (Claude Code) | âœ… (Claude + OpenCode + Gemini) | âŒ (Claude Code) |\n| **Scale** | | | |\n| Commands | 11 | 20+ | 3 |\n| Skills | 16 | 0 | 15+ |\n| Named agents | 9 | implicit | implicit |\n\n## Acknowledgments\n\nShipyard draws inspiration from:\n\n- [Superpowers](https://github.com/obra/superpowers) by Jesse Vincent â€” composable skills, TDD discipline, two-stage code review\n- [GSD (Get Shit Done)](https://gsd.site/) by TÃ‚CHES â€” project lifecycle management, phase-based planning, context engineering\n\n## Contributing\n\nSee [CONTRIBUTING.md](CONTRIBUTING.md) for how to add commands, skills, and agents, run tests, and submit pull requests.\n\n## License\n\nMIT\n"
      },
      "plugins": [
        {
          "name": "shipyard",
          "version": "2.1.0",
          "description": "Ship software systematically: project lifecycle, TDD, parallel agents, code review, security auditing, and infrastructure validation",
          "source": "./",
          "category": "development",
          "categories": [
            "development"
          ],
          "install_commands": [
            "/plugin marketplace add lgbarn/shipyard",
            "/plugin install shipyard@shipyard"
          ]
        }
      ]
    },
    {
      "name": "superpowers-dev",
      "version": null,
      "description": "Development marketplace for Superpowers core skills library",
      "repo_full_name": "lgbarn/devops-skills",
      "repo_url": "https://github.com/lgbarn/devops-skills",
      "repo_description": "DevOps skills for Claude Code: Terraform/OpenTofu workflows, AWS infrastructure management, safety-first IaC practices",
      "signals": {
        "stars": 0,
        "forks": 0,
        "pushed_at": "2026-01-23T19:52:23Z"
      },
      "files": {
        ".claude-plugin/marketplace.json": "{\n  \"name\": \"superpowers-dev\",\n  \"description\": \"Development marketplace for Superpowers core skills library\",\n  \"owner\": {\n    \"name\": \"Jesse Vincent\",\n    \"email\": \"jesse@fsck.com\"\n  },\n  \"plugins\": [\n    {\n      \"name\": \"superpowers\",\n      \"description\": \"Core skills library for Claude Code: TDD, debugging, collaboration patterns, and proven techniques\",\n      \"version\": \"4.0.3\",\n      \"source\": \"./\",\n      \"author\": {\n        \"name\": \"Jesse Vincent\",\n        \"email\": \"jesse@fsck.com\"\n      }\n    }\n  ]\n}\n",
        ".claude-plugin/plugin.json": "{\n  \"name\": \"devops-skills\",\n  \"description\": \"DevOps skills for Claude Code: Terraform/OpenTofu workflows, AWS infrastructure management, safety-first IaC practices, and parallel agent orchestration\",\n  \"version\": \"1.0.0\",\n  \"author\": {\n    \"name\": \"lgbarn\",\n    \"email\": \"\"\n  },\n  \"homepage\": \"\",\n  \"repository\": \"\",\n  \"license\": \"MIT\",\n  \"keywords\": [\"devops\", \"terraform\", \"opentofu\", \"aws\", \"infrastructure\", \"iac\", \"safety\", \"parallel-agents\"]\n}\n",
        "README.md": "# devops-skills\n\n> A fork of [superpowers](https://github.com/obra/superpowers) by [Jesse Vincent](https://github.com/obra)\n\nDevOps skills for Claude Code: Terraform/OpenTofu workflows, AWS infrastructure management, safety-first IaC practices, and parallel agent orchestration.\n\n## What's Different from Superpowers\n\nThis fork adds infrastructure/DevOps capabilities while keeping all the original development skills (TDD, debugging, code review, etc.):\n\n### Added: Operations Skills\n- **terraform-plan-review** - Parallel agent analysis before any apply\n- **terraform-drift-detection** - Detect out-of-band changes\n- **terraform-state-operations** - Safe state surgery workflows\n- **aws-profile-management** - Credential verification\n\n### Added: Safety Hooks\n- Blocks `terraform apply`, `destroy`, `state rm`, `-auto-approve`\n- Requires explicit approval workflow for all infrastructure changes\n\n### Added: Specialized Agents\n- terraform-plan-analyzer, security-reviewer, drift-detector\n- historical-pattern-analyzer, conflict-arbiter\n\n### Added: Commands\n- `/plan`, `/drift`, `/review-infra`, `/upgrade-check`, `/env-compare`\n\n## Core Principles\n\n1. **Never Auto-Apply** - All changes require explicit approval\n2. **Fewer Mistakes** - Safety over speed\n3. **Full DevOps Lifecycle** - Development AND Operations\n\n---\n\n## Original Superpowers Documentation\n\nThe sections below are from the original superpowers plugin:\n\n### How it works\n\nIt starts from the moment you fire up your coding agent. As soon as it sees that you're building something, it *doesn't* just jump into trying to write code. Instead, it steps back and asks you what you're really trying to do.\n\nOnce it's teased a spec out of the conversation, it shows it to you in chunks short enough to actually read and digest.\n\nAfter you've signed off on the design, your agent puts together an implementation plan that's clear enough for an enthusiastic junior engineer with poor taste, no judgement, no project context, and an aversion to testing to follow. It emphasizes true red/green TDD, YAGNI (You Aren't Gonna Need It), and DRY.\n\nNext up, once you say \"go\", it launches a *subagent-driven-development* process, having agents work through each engineering task, inspecting and reviewing their work, and continuing forward. It's not uncommon for Claude to be able to work autonomously for a couple hours at a time without deviating from the plan you put together.\n\nThere's a bunch more to it, but that's the core of the system. And because the skills trigger automatically, you don't need to do anything special.\n\n## Installation\n\n### Claude Code (Manual)\n\nClone this repository and register it as a plugin:\n\n```bash\ngit clone https://github.com/lgbarn/devops-skills.git ~/.claude/plugins/devops-skills\n\n# In Claude Code:\n/plugin add ~/.claude/plugins/devops-skills\n```\n\n### Verify Installation\n\nCheck that commands appear:\n\n```bash\n/help\n```\n\n```\n# Should see:\n# /devops-skills:brainstorm - Interactive design refinement\n# /devops-skills:write-plan - Create implementation plan\n# /devops-skills:execute-plan - Execute plan in batches\n# /plan - Run terraform plan with analysis\n# /drift - Detect infrastructure drift\n```\n\n## The Basic Workflow\n\n### Development Workflow (from Superpowers)\n\n1. **brainstorming** - Activates before writing code. Refines rough ideas through questions, explores alternatives, presents design in sections for validation. Saves design document.\n\n2. **using-git-worktrees** - Activates after design approval. Creates isolated workspace on new branch, runs project setup, verifies clean test baseline.\n\n3. **writing-plans** - Activates with approved design. Breaks work into bite-sized tasks (2-5 minutes each). Every task has exact file paths, complete code, verification steps.\n\n4. **subagent-driven-development** or **executing-plans** - Activates with plan. Dispatches fresh subagent per task with two-stage review (spec compliance, then code quality), or executes in batches with human checkpoints.\n\n5. **test-driven-development** - Activates during implementation. Enforces RED-GREEN-REFACTOR: write failing test, watch it fail, write minimal code, watch it pass, commit. Deletes code written before tests.\n\n6. **requesting-code-review** - Activates between tasks. Reviews against plan, reports issues by severity. Critical issues block progress.\n\n7. **finishing-a-development-branch** - Activates when tasks complete. Verifies tests, presents options (merge/PR/keep/discard), cleans up worktree.\n\n### Infrastructure Workflow (DevOps Skills)\n\n1. **terraform-plan-review** - Activates before any apply. Dispatches parallel agents to analyze risks, security, and historical patterns.\n\n2. **terraform-drift-detection** - Detect infrastructure drift between state and actual resources.\n\n3. **terraform-state-operations** - Safe workflows for state surgery (import, mv, rm).\n\n4. **aws-profile-management** - Verify credentials match the target environment.\n\n**The agent checks for relevant skills before any task.** Mandatory workflows, not suggestions.\n\n## What's Inside\n\n### Skills Library\n\n**Infrastructure (DevOps)**\n- **terraform-plan-review** - Multi-agent plan analysis\n- **terraform-drift-detection** - Drift detection and categorization\n- **terraform-state-operations** - Safe state surgery\n- **aws-profile-management** - Credential verification\n\n**Testing**\n- **test-driven-development** - RED-GREEN-REFACTOR cycle (includes testing anti-patterns reference)\n\n**Debugging**\n- **systematic-debugging** - 4-phase root cause process (includes root-cause-tracing, defense-in-depth, condition-based-waiting techniques)\n- **verification-before-completion** - Ensure it's actually fixed\n\n**Collaboration**\n- **brainstorming** - Socratic design refinement\n- **writing-plans** - Detailed implementation plans\n- **executing-plans** - Batch execution with checkpoints\n- **dispatching-parallel-agents** - Concurrent subagent workflows\n- **requesting-code-review** - Pre-review checklist\n- **receiving-code-review** - Responding to feedback\n- **using-git-worktrees** - Parallel development branches\n- **finishing-a-development-branch** - Merge/PR decision workflow\n- **subagent-driven-development** - Fast iteration with two-stage review (spec compliance, then code quality)\n\n**Meta**\n- **writing-skills** - Create new skills following best practices (includes testing methodology)\n- **using-devops-skills** - Introduction to the skills system\n\n## Philosophy\n\n- **Test-Driven Development** - Write tests first, always\n- **Systematic over ad-hoc** - Process over guessing\n- **Complexity reduction** - Simplicity as primary goal\n- **Evidence over claims** - Verify before declaring success\n- **Never auto-apply** - All infrastructure changes require approval\n\nRead more: [Superpowers for Claude Code](https://blog.fsck.com/2025/10/09/superpowers/)\n\n## Contributing\n\nSkills live directly in this repository. To contribute:\n\n1. Fork the repository\n2. Create a branch for your skill\n3. Follow the `writing-skills` skill for creating and testing new skills\n4. Submit a PR\n\nSee `skills/writing-skills/SKILL.md` for the complete guide.\n\n## License\n\nMIT License - see LICENSE file for details\n\n## Attribution\n\nOriginal superpowers plugin by [Jesse Vincent](https://github.com/obra).\n\nThis is a fork that adds DevOps/Infrastructure capabilities. The original project is available at https://github.com/obra/superpowers.\n\n## Support\n\n- **Issues**: https://github.com/lgbarn/devops-skills/issues\n- **Original Project**: https://github.com/obra/superpowers\n"
      },
      "plugins": [
        {
          "name": "superpowers",
          "description": "Core skills library for Claude Code: TDD, debugging, collaboration patterns, and proven techniques",
          "version": "4.0.3",
          "source": "./",
          "author": {
            "name": "Jesse Vincent",
            "email": "jesse@fsck.com"
          },
          "categories": [],
          "install_commands": [
            "/plugin marketplace add lgbarn/devops-skills",
            "/plugin install superpowers@superpowers-dev"
          ]
        }
      ]
    }
  ]
}