{
  "author": {
    "id": "LiamFuller07",
    "display_name": "Liam Fuller",
    "avatar_url": "https://avatars.githubusercontent.com/u/96925424?v=4"
  },
  "marketplaces": [
    {
      "name": "strawberry-plugins",
      "version": null,
      "description": "Strawberry Terminal plugin marketplace - VM orchestration, browser automation, and activity tracking",
      "repo_full_name": "LiamFuller07/strawberry-terminal-plugin",
      "repo_url": "https://github.com/LiamFuller07/strawberry-terminal-plugin",
      "repo_description": "Claude Code plugin marketplace for VM orchestration, browser automation, and activity tracking",
      "signals": {
        "stars": 0,
        "forks": 0,
        "pushed_at": "2026-01-19T05:35:29Z"
      },
      "files": {
        ".claude-plugin/marketplace.json": "{\n  \"name\": \"strawberry-plugins\",\n  \"owner\": {\n    \"name\": \"Liam Fuller\",\n    \"email\": \"liam@example.com\"\n  },\n  \"metadata\": {\n    \"description\": \"Strawberry Terminal plugin marketplace - VM orchestration, browser automation, and activity tracking\",\n    \"version\": \"1.0.0\"\n  },\n  \"plugins\": [\n    {\n      \"name\": \"strawberry-terminal\",\n      \"source\": \"./plugins/strawberry-terminal\",\n      \"description\": \"VM orchestration via TryCua, local computer control, and Claude activity tracking for the Strawberry terminal\",\n      \"version\": \"1.0.0\",\n      \"author\": {\n        \"name\": \"Liam Fuller\"\n      },\n      \"keywords\": [\"strawberry\", \"terminal\", \"vm\", \"browser\", \"automation\", \"trycua\", \"computer-use\"],\n      \"category\": \"automation\"\n    }\n  ]\n}\n",
        "README.md": "# Strawberry Terminal Plugin Marketplace\n\nA Claude Code plugin marketplace for VM orchestration, browser automation, and activity tracking.\n\n## Quick Install\n\n```bash\n# Add this marketplace to Claude Code\n/plugin marketplace add LiamFuller07/strawberry-terminal-plugin\n\n# Install the strawberry-terminal plugin\n/plugin install strawberry-terminal@strawberry-plugins\n```\n\n## What's Included\n\n### strawberry-terminal Plugin\n\nProvides:\n\n- **VM Automation** - Spawn and control cloud VMs via TryCua\n- **Local Computer Use** - Control your local Mac (screenshots, mouse, keyboard)\n- **Activity Tracking** - Real-time Claude activity logging for the Strawberry terminal UI\n\n#### Skills\n- `vm-automation` - Cloud VM management\n- `local-computer-use` - Local desktop control\n\n#### Commands\n- `/spawn-vm` - Spawn a new cloud VM\n- `/local-screenshot` - Take a local screenshot\n\n#### MCP Servers\n- `trycua` - TryCua VM management API\n- `local-computer-use` - Local Mac computer use\n\n## Setup\n\n### Environment Variables\n\nSet the following before using:\n\n```bash\n# Required for TryCua VM features\nexport CUA_API_KEY=\"your-api-key-here\"\n```\n\n### macOS Permissions\n\nFor local computer use, grant Accessibility permissions:\n**System Settings > Privacy & Security > Accessibility**\n\n## Development\n\n```bash\n# Clone\ngit clone https://github.com/LiamFuller07/strawberry-terminal-plugin.git\ncd strawberry-terminal-plugin\n\n# Add as local marketplace\n/plugin marketplace add ./\n\n# Install plugin locally\n/plugin install strawberry-terminal@strawberry-plugins\n```\n\n## License\n\nMIT\n"
      },
      "plugins": [
        {
          "name": "strawberry-terminal",
          "source": "./plugins/strawberry-terminal",
          "description": "VM orchestration via TryCua, local computer control, and Claude activity tracking for the Strawberry terminal",
          "version": "1.0.0",
          "author": {
            "name": "Liam Fuller"
          },
          "keywords": [
            "strawberry",
            "terminal",
            "vm",
            "browser",
            "automation",
            "trycua",
            "computer-use"
          ],
          "category": "automation",
          "categories": [
            "automation",
            "browser",
            "computer-use",
            "strawberry",
            "terminal",
            "trycua",
            "vm"
          ],
          "install_commands": [
            "/plugin marketplace add LiamFuller07/strawberry-terminal-plugin",
            "/plugin install strawberry-terminal@strawberry-plugins"
          ]
        }
      ]
    }
  ]
}