{
  "author": {
    "id": "lostendfound",
    "display_name": "lost end found",
    "avatar_url": "https://avatars.githubusercontent.com/u/209547151?v=4"
  },
  "marketplaces": [
    {
      "name": "lostendfound-plugins",
      "version": null,
      "description": "Custom Claude Code plugins for code review and development workflows",
      "repo_full_name": "lostendfound/claude-plugins-marketplace",
      "repo_url": "https://github.com/lostendfound/claude-plugins-marketplace",
      "repo_description": "Custom Claude Code plugins for code review and development workflows",
      "signals": {
        "stars": 0,
        "forks": 0,
        "pushed_at": "2026-01-11T17:50:27Z"
      },
      "files": {
        ".claude-plugin/marketplace.json": "{\n  \"name\": \"lostendfound-plugins\",\n  \"owner\": {\n    \"name\": \"Lost End Found\"\n  },\n  \"metadata\": {\n    \"description\": \"Custom Claude Code plugins for code review and development workflows\",\n    \"version\": \"1.0.0\"\n  },\n  \"plugins\": [\n    {\n      \"name\": \"smart-code-review\",\n      \"source\": \"./smart-code-review\",\n      \"description\": \"Intelligent code review with re-review support for new commits\",\n      \"version\": \"1.0.0\"\n    },\n    {\n      \"name\": \"setup-code-review\",\n      \"source\": \"./setup-code-review\",\n      \"description\": \"Install smart code review workflow to any repository via PR\",\n      \"version\": \"1.0.0\"\n    }\n  ]\n}\n",
        "README.md": "# Claude Plugins Marketplace\n\nA collection of custom Claude Code plugins for code review and development workflows.\n\n## Available Plugins\n\n| Plugin | Description |\n|--------|-------------|\n| [smart-code-review](./smart-code-review) | Intelligent code review with re-review support for new commits |\n| [setup-code-review](./setup-code-review) | Install smart code review workflow to any repository via PR |\n\n## Quick Start\n\nTo add smart code review to any repository, run:\n\n```\n/setup-code-review:install\n```\n\nThis creates a PR with:\n- The `smart-code-review` plugin embedded in `.claude/plugins/`\n- A GitHub Actions workflow file\n\nAfter merging, add the `CLAUDE_CODE_OAUTH_TOKEN` secret.\n\n## Installation Options\n\n### Option A: Embed Plugin in Repository (Recommended)\n\nThis approach commits the plugin to your repo, avoiding any external dependencies at runtime.\n\n**Step 1:** Copy the plugin to your repository:\n\n```bash\nmkdir -p .claude/plugins\ngit clone --depth 1 https://github.com/lostendfound/claude-plugins-marketplace.git /tmp/marketplace\ncp -r /tmp/marketplace/smart-code-review .claude/plugins/\nrm -rf /tmp/marketplace\n```\n\n**Step 2:** Create `.github/workflows/claude-code-review.yml`:\n\n```yaml\nname: Claude Code Review\n\non:\n  pull_request:\n    types: [opened, synchronize, ready_for_review, reopened]\n\njobs:\n  claude-review:\n    runs-on: ubuntu-latest  # or self-hosted\n    permissions:\n      contents: read\n      pull-requests: write\n      issues: read\n      id-token: write\n\n    steps:\n      - name: Checkout repository\n        uses: actions/checkout@v4\n        with:\n          fetch-depth: 1\n\n      - name: Run Claude Code Review\n        uses: anthropics/claude-code-action@v1\n        with:\n          claude_code_oauth_token: ${{ secrets.CLAUDE_CODE_OAUTH_TOKEN }}\n          # Plugin is auto-discovered from .claude/plugins/\n          prompt: \"/smart-code-review:code-review ${{ github.repository }}/pull/${{ github.event.pull_request.number }}\"\n```\n\n**Step 3:** Commit both the plugin and workflow, then add `CLAUDE_CODE_OAUTH_TOKEN` secret.\n\n### Option B: Clone Plugin at Runtime\n\nIf you don't want to commit the plugin to your repo, you can clone it during the workflow:\n\n```yaml\nname: Claude Code Review\n\non:\n  pull_request:\n    types: [opened, synchronize, ready_for_review, reopened]\n\njobs:\n  claude-review:\n    runs-on: ubuntu-latest\n    permissions:\n      contents: read\n      pull-requests: write\n      issues: read\n      id-token: write\n\n    steps:\n      - name: Checkout repository\n        uses: actions/checkout@v4\n        with:\n          fetch-depth: 1\n\n      - name: Setup smart-code-review plugin\n        run: |\n          mkdir -p .claude/plugins\n          git clone --depth 1 https://github.com/lostendfound/claude-plugins-marketplace.git /tmp/marketplace\n          cp -r /tmp/marketplace/smart-code-review .claude/plugins/\n          rm -rf /tmp/marketplace\n\n      - name: Run Claude Code Review\n        uses: anthropics/claude-code-action@v1\n        with:\n          claude_code_oauth_token: ${{ secrets.CLAUDE_CODE_OAUTH_TOKEN }}\n          prompt: \"/smart-code-review:code-review ${{ github.repository }}/pull/${{ github.event.pull_request.number }}\"\n```\n\n## For Local Claude Code\n\nAdd the marketplace and install the plugin:\n\n```bash\nclaude /plugin marketplace add https://github.com/lostendfound/claude-plugins-marketplace.git\nclaude /plugin install smart-code-review@lostendfound-plugins\n```\n\n> **Note:** For GitHub Actions, we recommend the embedded approach above instead of using `plugin_marketplaces`, which can cause conflicts on self-hosted runners.\n\n## Creating New Plugins\n\n1. Create a new directory under the root (e.g., `my-plugin/`)\n2. Add `.claude-plugin/plugin.json` with plugin metadata\n3. Add commands in `commands/` directory\n4. Update `.claude-plugin/marketplace.json` to include your plugin\n5. Commit and push\n\n## License\n\nMIT\n",
        "smart-code-review/README.md": "# Smart Code Review Plugin\n\nAn intelligent code review plugin for Claude Code that supports re-reviewing PRs after new commits are pushed.\n\n## Features\n\n- **Smart eligibility checking**: Detects when new commits have been pushed since the last review\n- **Full review mode**: Comprehensive code review for new PRs\n- **Re-review mode**: Verifies if previous issues were fixed AND scans for new issues\n- **Confidence scoring**: Only reports issues with 80%+ confidence to reduce false positives\n- **CLAUDE.md compliance**: Checks code against project guidelines\n\n## Review Modes\n\n### Full Review (Initial)\nWhen no previous Claude review exists on the PR:\n- Runs 5 parallel agents to check CLAUDE.md compliance, bugs, git history, previous PR comments, and code comments\n- Scores each issue for confidence\n- Posts a standard code review comment\n\n### Re-Review (Follow-Up)\nWhen a previous Claude review exists AND new commits have been pushed:\n- Parses previous review to extract issues\n- Verifies if each issue was addressed (FIXED/STILL PRESENT)\n- Scans new commits for new issues\n- Posts a follow-up comment with status summary\n\n### Skip\nWhen a previous Claude review exists but NO new commits have been pushed:\n- Skips the review (already reviewed, no changes)\n\n## Usage\n\n### In GitHub Actions Workflow\n\n```yaml\n- name: Run Claude Code Review\n  uses: anthropics/claude-code-action@v1\n  with:\n    claude_code_oauth_token: ${{ secrets.CLAUDE_CODE_OAUTH_TOKEN }}\n    plugin_marketplaces: |\n      https://github.com/YOUR_USERNAME/claude-plugins-marketplace.git\n    plugins: |\n      smart-code-review@lostendfound-plugins\n    prompt: \"/smart-code-review:code-review ${{ github.repository }}/pull/${{ github.event.pull_request.number }}\"\n```\n\n### Manual Invocation\n```\n/smart-code-review:code-review owner/repo/pull/123\n```\n\n## Configuration\n\nThe plugin uses an 80% confidence threshold by default. Issues below this threshold are filtered out to reduce noise.\n",
        "setup-code-review/README.md": "# Setup Code Review Plugin\n\nA Claude Code plugin that installs the smart code review workflow to any repository via pull request.\n\n## Usage\n\nRun in any GitHub repository:\n\n```\n/setup-code-review:install\n```\n\nThis will:\n1. Create a new branch `add-claude-code-review`\n2. Add the workflow file at `.github/workflows/claude-code-review.yml`\n3. Create a pull request with setup instructions\n\n## What Gets Installed\n\nThe workflow includes:\n- Automatic code review on every PR\n- Smart re-review support for new commits\n- CLAUDE.md compliance checking\n- 80% confidence threshold to reduce false positives\n\n## After Merging\n\nYou'll need to add the `CLAUDE_CODE_OAUTH_TOKEN` secret:\n\n1. Go to **Settings > Secrets and variables > Actions**\n2. Click **New repository secret**\n3. Name: `CLAUDE_CODE_OAUTH_TOKEN`\n4. Value: Your Claude Code OAuth token\n"
      },
      "plugins": [
        {
          "name": "smart-code-review",
          "source": "./smart-code-review",
          "description": "Intelligent code review with re-review support for new commits",
          "version": "1.0.0",
          "categories": [],
          "install_commands": [
            "/plugin marketplace add lostendfound/claude-plugins-marketplace",
            "/plugin install smart-code-review@lostendfound-plugins"
          ]
        },
        {
          "name": "setup-code-review",
          "source": "./setup-code-review",
          "description": "Install smart code review workflow to any repository via PR",
          "version": "1.0.0",
          "categories": [],
          "install_commands": [
            "/plugin marketplace add lostendfound/claude-plugins-marketplace",
            "/plugin install setup-code-review@lostendfound-plugins"
          ]
        }
      ]
    }
  ]
}