{
  "author": {
    "id": "lukeocodes",
    "display_name": "Luke Oliff",
    "avatar_url": "https://avatars.githubusercontent.com/u/956290?u=1b4382d74bcc5b36396bbf20028b08a81cabbe2b&v=4"
  },
  "marketplaces": [
    {
      "name": "lukeocodes-claude-plugins",
      "version": null,
      "description": "Personal collection of Claude Code plugins",
      "repo_full_name": "lukeocodes/claude-plugins",
      "repo_url": "https://github.com/lukeocodes/claude-plugins",
      "repo_description": "Personal collection of Claude Code plugins.",
      "signals": {
        "stars": 0,
        "forks": 0,
        "pushed_at": "2026-01-27T12:10:41Z"
      },
      "files": {
        ".claude-plugin/marketplace.json": "{\n  \"name\": \"lukeocodes-claude-plugins\",\n  \"owner\": {\n    \"name\": \"Luke Oliff\"\n  },\n  \"metadata\": {\n    \"description\": \"Personal collection of Claude Code plugins\",\n    \"version\": \"1.0.0\"\n  },\n  \"plugins\": [\n    {\n      \"name\": \"btl\",\n      \"source\": {\n        \"source\": \"github\",\n        \"repo\": \"lukeocodes/btl\"\n      }\n    }\n  ]\n}\n",
        "README.md": "# My Claude Plugins\n\nPersonal collection of Claude Code plugins.\n\n## Installation\n\nAdd this marketplace to Claude Code:\n\n```shell\n/plugin marketplace add lukeocodes/claude-plugins\n```\n\n## Available Plugins\n\n### BTL (Bottle)\n\nA lightweight background task manager that automatically replaces processes when you re-run the same command.\n\n**Install:**\n```shell\n/plugin install btl@lukeocodes-claude-plugins\n```\n\n**Learn more:** [github.com/lukeocodes/btl](https://github.com/lukeocodes/btl)\n\n## Updating\n\nGet the latest plugin versions:\n\n```shell\n/plugin marketplace update lukeocodes-claude-plugins\n```\n\n## License\n\nMIT\n"
      },
      "plugins": [
        {
          "name": "btl",
          "source": {
            "source": "github",
            "repo": "lukeocodes/btl"
          },
          "description": null,
          "categories": [],
          "install_commands": [
            "/plugin marketplace add lukeocodes/claude-plugins",
            "/plugin install btl@lukeocodes-claude-plugins"
          ]
        }
      ]
    }
  ]
}