{
  "author": {
    "id": "MaxGhenis",
    "display_name": "Max Ghenis",
    "avatar_url": "https://avatars.githubusercontent.com/u/6076111?u=60dc65a6a832c364b06c4e46b00d2e18424b6abb&v=4"
  },
  "marketplaces": [
    {
      "name": "namecast",
      "version": null,
      "description": "AI-powered brand name oracle - generate, filter, and evaluate brand names",
      "repo_full_name": "MaxGhenis/namecast",
      "repo_url": "https://github.com/MaxGhenis/namecast",
      "repo_description": "AI-powered brand name evaluation - check domains, social handles, trademarks, pronunciation, and brand perception",
      "signals": {
        "stars": 0,
        "forks": 0,
        "pushed_at": "2026-01-25T19:30:23Z"
      },
      "files": {
        ".claude-plugin/marketplace.json": "{\n  \"$schema\": \"https://anthropic.com/claude-code/marketplace.schema.json\",\n  \"name\": \"namecast\",\n  \"owner\": {\n    \"name\": \"Max Ghenis\"\n  },\n  \"plugins\": [\n    {\n      \"name\": \"namecast\",\n      \"source\": \"./\",\n      \"description\": \"AI-powered brand name oracle - generate, filter, and evaluate brand names\",\n      \"version\": \"0.5.0\"\n    }\n  ]\n}\n",
        "README.md": "# Namecast\n\nAI-powered brand name oracle. Generate, filter, and evaluate brand names with domain checks, social handles, similar company analysis, and dynamic persona perception forecasting.\n\n## Features\n\n- **Name Generation**: AI generates brand name candidates based on your project description\n- **Domain Availability**: Checks .com, .io, .co, .ai, .app domains via WHOIS\n- **Social Handle Checks**: Twitter/X and GitHub availability\n- **Similar Company Search**: Finds existing companies with similar names\n- **Pronunciation Analysis**: Syllable count, spelling difficulty, phonetic clarity\n- **International Safety**: Checks for problematic meanings in 7 major languages\n- **Dynamic Persona Perception**: AI role-plays as your target audience to forecast brand perception\n\n## Installation\n\n```bash\npip install namecast\n```\n\nOr from source:\n\n```bash\ngit clone https://github.com/MaxGhenis/namecast\ncd namecast\npip install -e \".[dev]\"\n```\n\nRequires an Anthropic API key:\n\n```bash\nexport ANTHROPIC_API_KEY=your-key-here\n```\n\n## Usage\n\n### CLI\n\n**Find names for a new project:**\n\n```bash\nnamecast find \"A SaaS tool for tracking carbon emissions\"\n```\n\n**Include your own ideas:**\n\n```bash\nnamecast find \"Dog walking app\" --ideas Waggle --ideas PupPath\n```\n\n**Evaluate a specific name:**\n\n```bash\nnamecast eval Acme\n```\n\n**Evaluate with mission context:**\n\n```bash\nnamecast eval Cloudify --mission \"Cloud infrastructure automation for startups\"\n```\n\n**Compare multiple names:**\n\n```bash\nnamecast eval --compare Acme Globex Initech\n```\n\n### Claude Code Plugin\n\nIf you use [Claude Code](https://claude.ai/claude-code), Namecast is available as a plugin:\n\n**Find names:**\n\n```\n/namecast:find A marketplace connecting local farmers with restaurants --ideas FarmLink,HarvestHub\n```\n\n**Evaluate a name:**\n\n```\n/namecast:evaluate Cloudify --mission Cloud infrastructure automation\n```\n\nThe Claude Code plugin runs natively (no API calls) and is free with Claude Max.\n\n## Methodology\n\n### Scoring System\n\nNames are scored on a 100-point scale:\n\n| Category | Points | Description |\n|----------|--------|-------------|\n| Domain Availability | 40 | .com = 40pts, .io only = 25pts |\n| Persona Perception | 40 | Average of memorability + professionalism ratings |\n| Linguistic Quality | 20 | Pronunciation ease, international safety, uniqueness |\n\n### Dynamic Persona Generation\n\nUnlike static persona sets, Namecast generates **personas tailored to your specific project**. When you provide a company description, the AI identifies 5 relevant personas who would interact with your brand:\n\n- **Primary customers/users** - Who will use the product?\n- **Decision makers** - Who approves purchases?\n- **Investors** - Who might fund the company?\n- **Industry experts** - Who analyzes this space?\n- **End consumers** - Who benefits ultimately?\n\nFor example, a B2B SaaS might get personas like:\n- CFO (50s, enterprise, values ROI)\n- Startup founder (30s, fast-mover, values innovation)\n- Developer (25, technical, values ease of use)\n- VC partner (40s, evaluates hundreds of startups)\n- Industry analyst (45, writes about the space)\n\nWhile a consumer app might get:\n- College student (20, social media native)\n- Working parent (35, values convenience)\n- Small business owner (40, budget-conscious)\n\nEach persona then evaluates your name on:\n- **Memorability** (1-10): Will they remember it?\n- **Professionalism** (1-10): Does it seem credible?\n- **Trust**: Would they use a company with this name?\n- **Industry guess**: What sector do they assume?\n- **Gut reaction**: One-sentence impression\n\n### Domain Checking\n\nChecks WHOIS data for:\n- `.com` (weighted highest)\n- `.io` (popular for tech)\n- `.co`\n- `.ai`\n- `.app`\n\nNames where both .com and .io are taken are filtered out in the `find` workflow.\n\n### Social Handle Verification\n\nChecks availability on:\n- Twitter/X\n- GitHub\n\n### Similar Company Analysis\n\nWeb searches for:\n- Exact name matches\n- Companies in similar industries\n- Potential trademark conflicts\n\n**Note:** This is informational only. Always consult a trademark attorney before finalizing your brand name.\n\n### International Safety\n\nChecks if the name has problematic meanings in:\n- Spanish\n- French\n- German\n- Mandarin\n- Japanese\n- Portuguese\n- Arabic\n\n### Pronunciation Analysis\n\nEvaluates:\n- **Syllable count**: Shorter is generally better\n- **Spelling difficulty**: Easy/Medium/Hard\n- **Phonetic clarity**: Would someone spell it correctly after hearing it?\n\n## Architecture\n\n```\nnamecast/\n├── namecast/\n│   ├── cli.py          # Click CLI commands\n│   ├── evaluator.py    # BrandEvaluator and NamecastWorkflow\n│   ├── perception.py   # Dynamic persona generation and analysis\n│   ├── api.py          # FastAPI server (optional)\n│   └── tests/          # pytest test suite\n├── .claude-plugin/\n│   ├── plugin.json     # Claude Code plugin manifest\n│   ├── marketplace.json\n│   └── commands/\n│       ├── find.md     # /find command (native execution)\n│       └── evaluate.md # /evaluate command (native execution)\n└── src/                # React frontend (optional)\n```\n\n### CLI vs Plugin Alignment\n\nBoth the CLI and Claude Code plugin use the same methodology:\n\n| Feature | CLI | Claude Code Plugin |\n|---------|-----|-------------------|\n| Dynamic personas | `perception.py` | Native Claude roleplay |\n| Domain checks | `python-whois` | WebFetch to who.is |\n| Social checks | `httpx` | WebFetch |\n| Similar companies | `httpx` | WebSearch |\n| API cost | Anthropic API credits | Free (Claude Max) |\n\nThe key difference: CLI calls the Anthropic API (costs credits), while the Claude Code plugin uses Claude's native capabilities (free with Claude Max subscription).\n\n## Development\n\n```bash\n# Install dev dependencies\npip install -e \".[dev]\"\n\n# Run tests\npytest\n\n# Run linting\nruff check namecast/\n```\n\n## License\n\nMIT\n\n## Disclaimer\n\nNamecast provides general information only and does not constitute legal advice. Domain availability and trademark searches are informational. Always consult a trademark attorney before finalizing your brand name.\n"
      },
      "plugins": [
        {
          "name": "namecast",
          "source": "./",
          "description": "AI-powered brand name oracle - generate, filter, and evaluate brand names",
          "version": "0.5.0",
          "categories": [],
          "install_commands": [
            "/plugin marketplace add MaxGhenis/namecast",
            "/plugin install namecast@namecast"
          ]
        }
      ]
    },
    {
      "name": "maxghenis-plugins",
      "version": "1.0.0",
      "description": "Claude Code plugins for research, policy analysis, and development",
      "repo_full_name": "MaxGhenis/claude-plugins",
      "repo_url": "https://github.com/MaxGhenis/claude-plugins",
      "repo_description": "Claude Code plugins for research, policy analysis, and development",
      "signals": {
        "stars": 0,
        "forks": 0,
        "pushed_at": "2025-12-21T06:33:52Z"
      },
      "files": {
        ".claude-plugin/marketplace.json": "{\n  \"name\": \"maxghenis-plugins\",\n  \"version\": \"1.0.0\",\n  \"description\": \"Claude Code plugins for research, policy analysis, and development\",\n  \"owner\": {\n    \"name\": \"Max Ghenis\",\n    \"email\": \"max@policyengine.org\",\n    \"url\": \"https://github.com/MaxGhenis\"\n  },\n  \"plugins\": [\n    {\n      \"name\": \"academic-referee\",\n      \"source\": \"./plugins/academic-referee\",\n      \"description\": \"Multi-perspective academic paper review with journal-matched referee personas\"\n    }\n  ]\n}\n",
        "README.md": "# Max Ghenis Claude Plugins\n\nA collection of Claude Code plugins for research, policy analysis, and development.\n\n## Installation\n\n```bash\n/plugin marketplace add MaxGhenis/claude-plugins\n```\n\nThen install individual plugins:\n\n```bash\n/plugin install academic-referee@maxghenis-plugins\n```\n\n## Available Plugins\n\n### academic-referee\n\n**Multi-perspective academic paper review with journal-matched referee personas.**\n\nSimulates the peer review process to help improve your research before submission.\n\n#### Workflow\n\n1. **Find a journal**: `/find-journal [topic]`\n   - Analyzes your paper/software\n   - Searches for suitable open access journals\n   - Recommends top 3-5 venues with fit assessment\n\n2. **Generate referees**: `/generate-referees <journal>`\n   - Researches the target journal's standards\n   - Creates 3-4 domain-matched referee personas\n   - Always includes a reproducibility reviewer\n\n3. **Run reviews**: `/run-review [referees]`\n   - Launches all referee reviews in parallel\n   - Each referee produces structured feedback\n   - Synthesizes into editorial decision\n\n4. **Full cycle**: `/review-cycle [journal]`\n   - Complete workflow from journal selection to acceptance\n   - Iterates until all referees recommend Accept\n\n#### Default Referee Personas\n\n| Referee | Focus |\n|---------|-------|\n| **Methodology** | Mathematical rigor, statistical validity, algorithmic correctness |\n| **Domain Expert** | Application relevance, related work, field context |\n| **Practitioner** | Usability, documentation, practical value |\n| **Reproducibility** | Code quality, tests, documentation, replication |\n\n#### Example Usage\n\n```bash\n# Start the full review cycle\n/review-cycle\n\n# Or step by step:\n/find-journal \"differentially private econometrics\"\n/generate-referees \"Journal of Privacy and Confidentiality\"\n/run-review\n```\n\n## Creating New Plugins\n\nAdd new plugins to `plugins/` directory:\n\n```\nplugins/\n└── my-new-plugin/\n    ├── plugin.json\n    ├── commands/\n    ├── agents/\n    └── skills/\n```\n\nThen add to `.claude-plugin/marketplace.json`.\n\n## License\n\nMIT\n\n## Author\n\nMax Ghenis (max@policyengine.org)\n"
      },
      "plugins": [
        {
          "name": "academic-referee",
          "source": "./plugins/academic-referee",
          "description": "Multi-perspective academic paper review with journal-matched referee personas",
          "categories": [],
          "install_commands": [
            "/plugin marketplace add MaxGhenis/claude-plugins",
            "/plugin install academic-referee@maxghenis-plugins"
          ]
        }
      ]
    }
  ]
}