{
  "author": {
    "id": "maxlee",
    "display_name": "Max",
    "avatar_url": "https://avatars.githubusercontent.com/u/341446?u=cd483a074bf6349776d26b5cd0f7aa259012f369&v=4"
  },
  "marketplaces": [
    {
      "name": "sololoop-marketplace",
      "version": null,
      "description": "SoloLoop è¿­ä»£å¾ªç¯æ’ä»¶ - è®© Claude åœ¨åŒä¸€ä»»åŠ¡ä¸ŠæŒç»­è¿­ä»£ç›´åˆ°å®Œæˆ",
      "repo_full_name": "maxlee/sololoop",
      "repo_url": "https://github.com/maxlee/sololoop",
      "repo_description": null,
      "signals": {
        "stars": 0,
        "forks": 0,
        "pushed_at": "2026-01-14T23:41:07Z"
      },
      "files": {
        ".claude-plugin/marketplace.json": "{\n  \"$schema\": \"https://anthropic.com/claude-code/marketplace.schema.json\",\n  \"name\": \"sololoop-marketplace\",\n  \"description\": \"SoloLoop è¿­ä»£å¾ªç¯æ’ä»¶ - è®© Claude åœ¨åŒä¸€ä»»åŠ¡ä¸ŠæŒç»­è¿­ä»£ç›´åˆ°å®Œæˆ\",\n  \"owner\": {\n    \"name\": \"Max Lee\",\n    \"email\": \"maxlee@example.com\"\n  },\n  \"plugins\": [\n    {\n      \"name\": \"sololoop\",\n      \"description\": \"ç®€åŒ–ç‰ˆè¿­ä»£å¾ªç¯æ’ä»¶ - è®© Claude åœ¨åŒä¸€ä»»åŠ¡ä¸ŠæŒç»­è¿­ä»£ç›´åˆ°å®Œæˆ\",\n      \"category\": \"productivity\",\n      \"source\": \"./\",\n      \"homepage\": \"https://github.com/maxlee/sololoop\",\n      \"tags\": [\"loop\", \"iteration\", \"automation\", \"ralph-wiggum\"]\n    }\n  ]\n}\n",
        ".claude-plugin/plugin.json": "{\n  \"name\": \"sololoop\",\n  \"version\": \"9.0.0\",\n  \"description\": \"é¡½å¼ºå¾ªç¯å¼•æ“ v9 - æ–°å¢ç›®æ ‡è®°å¿†æœºåˆ¶ï¼ˆGoal Memoryï¼‰ã€å‘¨æœŸæ€§é‡é”šã€æ¼‚ç§»æ£€æµ‹ã€å†³ç­–è®°å½•åŠŸèƒ½\",\n  \"author\": {\n    \"name\": \"maxlee\",\n    \"url\": \"https://github.com/maxlee/sololoop\"\n  },\n  \"repository\": \"https://github.com/maxlee/sololoop\",\n  \"license\": \"MIT\",\n  \"keywords\": [\"iteration\", \"loop\", \"productivity\", \"openspec\", \"promise\", \"goal-memory\", \"anchoring\"],\n  \"hooks\": \"./hooks/hooks.json\"\n}\n",
        "README.md": "# SoloLoop Plugin\n\nClaude Code è¿­ä»£å¾ªç¯æ’ä»¶ï¼Œè®© Claude åœ¨åŒä¸€ä»»åŠ¡ä¸ŠæŒç»­è¿­ä»£ç›´åˆ°å®Œæˆã€‚\n\n[![GitHub](https://img.shields.io/badge/GitHub-maxlee%2Fsololoop-blue)](https://github.com/maxlee/sololoop)\n[![Version](https://img.shields.io/badge/version-9.0.0-green)](https://github.com/maxlee/sololoop)\n\n## ä»€ä¹ˆæ˜¯ SoloLoopï¼Ÿ\n\nSoloLoop é€šè¿‡ Stop Hook æœºåˆ¶æ‹¦æˆª Claude çš„é€€å‡ºå°è¯•ï¼Œå°†ç›¸åŒçš„ prompt åå¤è¾“å…¥ï¼Œå®ç°è‡ªå¼•ç”¨çš„è¿­ä»£æ”¹è¿›ã€‚\n\n**v8 å¢å¼ºç‰ˆæœ¬**ï¼šæ–°å¢æ’ä»¶åŒ…è£…å™¨æ¨¡å¼ã€ä¼šè¯æ¢å¤æ£€æµ‹ã€é‡å¤å¤±è´¥æ£€æµ‹ã€ä½¿ç”¨ç»Ÿè®¡è¿½è¸ªã€‚\n\n**v9 ç›®æ ‡è®°å¿†ç‰ˆæœ¬**ï¼šæ–°å¢ç›®æ ‡è®°å¿†æœºåˆ¶ï¼ˆPlanMemï¼‰ï¼Œæä¾›ç›®æ ‡é”šå®šã€å‘¨æœŸæ€§é‡é”šã€æ¼‚ç§»æ£€æµ‹åŠŸèƒ½ï¼Œè§£å†³é•¿æ—¶é—´è‡ªä¸»æ‰§è¡Œä¸­çš„ç›®æ ‡é—å¿˜å’Œæ¼‚ç§»é—®é¢˜ã€‚\n\n```\nç”¨æˆ·è¿è¡Œ /sololoop:sololoop \"ä»»åŠ¡æè¿°\" --max 10\n    â†“\nClaude å¤„ç†ä»»åŠ¡\n    â†“\nClaude å°è¯•é€€å‡º\n    â†“\nStop Hook æ‹¦æˆªï¼Œæ£€æŸ¥ Promise æ ‡è®°\n    â†“\né‡å¤ç›´åˆ° Promise åŒ¹é…æˆ–è¾¾åˆ°æœ€å¤§è¿­ä»£æ¬¡æ•°\n```\n\n### v9 ç›®æ ‡è®°å¿†æœºåˆ¶\n\n| ç‰¹æ€§ | v8 | v9 |\n|------|----|----|\n| ç›®æ ‡è®°å¿† | æ—  | `.sololoop/` ç›®å½•å­˜å‚¨ç›®æ ‡é”šç‚¹ |\n| è‡ªåŠ¨åˆå§‹åŒ– | æ—  | é¦–æ¬¡ä½¿ç”¨è‡ªåŠ¨åˆ›å»ºç›®æ ‡æ–‡ä»¶ |\n| å‘¨æœŸæ€§é‡é”š | æ—  | æ¯ N æ¬¡è¿­ä»£å¼ºåˆ¶é‡è¯»ç›®æ ‡ |\n| æ¼‚ç§»æ£€æµ‹ | æ—  | æ£€æµ‹è¾“å‡ºæ˜¯å¦åç¦»æ ¸å¿ƒçº¦æŸ |\n| å†³ç­–è®°å½• | æ—  | `/sololoop:log` è®°å½•é‡è¦å†³ç­– |\n| çŠ¶æ€æ˜¾ç¤º | æ—  | `/sololoop:status` æŸ¥çœ‹ç›®æ ‡çŠ¶æ€ |\n\n### v8 æ ¸å¿ƒå¢å¼º\n\n| ç‰¹æ€§ | v7 | v8 |\n|------|----|----|\n| æ’ä»¶åŒ…è£…å™¨ | æ—  | `/sololoop:wrap` åŒ…è£…ä»»æ„æ’ä»¶å‘½ä»¤ |\n| ä¼šè¯æ¢å¤ | æ—  | SessionStart Hook æ£€æµ‹æœªå®Œæˆå¾ªç¯ |\n| é‡å¤å¤±è´¥æ£€æµ‹ | æ—  | è¿ç»­ 3 æ¬¡ç›¸åŒé”™è¯¯æ—¶å»ºè®®æ¢ç­–ç•¥ |\n| ä½¿ç”¨ç»Ÿè®¡ | æ—  | `/sololoop:stats` æŸ¥çœ‹ç»Ÿè®¡æ•°æ® |\n| ä¼˜é›…é€€å‡º | åŸºç¡€ | å¢å¼ºçš„é€€å‡ºçŠ¶æ€å’ŒåŸå› è¯´æ˜ |\n\n### v7 æ ¸å¿ƒä¿®å¤\n\n| é—®é¢˜ | v6 | v7 |\n|------|----|----|\n| hooks.json æ ¼å¼ | æ‰å¹³æ•°ç»„ï¼ˆé”™è¯¯ï¼‰ | åµŒå¥—å¯¹è±¡ï¼ˆå®˜æ–¹è§„èŒƒï¼‰ |\n| OpenSpec é»˜è®¤ Promise | `DONE` | æ— é»˜è®¤å€¼ |\n| Stop Hook è§¦å‘ | ä»æœªè§¦å‘ | æ­£å¸¸å·¥ä½œ |\n\n### v6 æ ¸å¿ƒå˜æ›´\n\n| ç‰¹æ€§ | v5 | v6 |\n|------|----|----|\n| é€€å‡ºæ¡ä»¶ | å¤é€‰æ¡† 100% æˆ– Promise | ä»… Promise é©±åŠ¨ |\n| å˜æ›´åˆ—è¡¨ | æ‰‹åŠ¨è¾“å…¥åç§° | `+` è§¦å‘ç¬¦å¿«é€Ÿåˆ—å‡º |\n| é»˜è®¤ Promise | æ—  | `DONE` |\n| è‡ªæˆ‘å®¡æŸ¥ | æ—  | Prompt åŒ…å«å®¡æŸ¥æŒ‡å¼• |\n\n## å®‰è£…æ–¹å¼\n\n### ğŸš€ æ–¹å¼ Aï¼šä» GitHub Marketplace å®‰è£…ï¼ˆæ¨èï¼‰\n\n```bash\n# 1. æ·»åŠ  SoloLoop ä½œä¸º marketplace\n/plugin marketplace add maxlee/sololoop\n\n# 2. å®‰è£…æ’ä»¶\n/plugin install sololoop@sololoop-marketplace\n```\n\nå®‰è£…åç›´æ¥ä½¿ç”¨ï¼š\n```bash\n# çº¯å¾ªç¯æ¨¡å¼\n/sololoop:sololoop \"ä½ çš„ä»»åŠ¡æè¿°\" --max 10\n\n# OpenSpec é›†æˆæ¨¡å¼\n/sololoop:openspec feature-name --max 10\n```\n\n### ğŸš€ æ–¹å¼ Bï¼šå…‹éš†åæœ¬åœ°å®‰è£…\n\n```bash\n# 1. å…‹éš†ä»“åº“åˆ°æœ¬åœ°\ngit clone https://github.com/maxlee/sololoop.git ~/sololoop\n\n# 2. åœ¨ Claude Code ä¸­å®‰è£…æ’ä»¶\n/plugin install ~/sololoop\n```\n\n### ğŸ”§ æœ¬åœ°å¼€å‘æµ‹è¯•\n\n#### æ–¹å¼ Aï¼šæ²‰æµ¸å¼å¼€å‘æ¨¡å¼ï¼ˆæ¨èï¼‰\n\nè·³è¿‡æ‰€æœ‰æƒé™ç¡®è®¤ï¼Œè®©è¿­ä»£å¾ªç¯æ›´åŠ æµç•…ï¼š\n\n```bash\nclaude --dangerously-skip-permissions --plugin-dir /path/to/sololoop\n```\n\n> âš ï¸ **æ³¨æ„**ï¼šæ­¤æ¨¡å¼ä¼šè·³è¿‡æ‰€æœ‰å®‰å…¨ç¡®è®¤ï¼Œä»…å»ºè®®åœ¨å—ä¿¡ä»»çš„é¡¹ç›®ä¸­ä½¿ç”¨ã€‚\n\n#### æ–¹å¼ Bï¼šæ ‡å‡†å¼€å‘æ¨¡å¼\n\n```bash\nclaude --plugin-dir /path/to/sololoop\n```\n\n#### æ–¹å¼ Cï¼šè°ƒè¯•æ¨¡å¼\n\næŸ¥çœ‹æ’ä»¶åŠ è½½è¯¦æƒ…ï¼š\n\n```bash\nclaude --debug --plugin-dir /path/to/sololoop\n```\n\n## å¿«é€Ÿå¼€å§‹\n\n### çº¯å¾ªç¯æ¨¡å¼ï¼ˆåŸºæœ¬ç”¨æ³•ï¼‰\n\n```bash\n# åŸºæœ¬ç”¨æ³•ï¼ˆé»˜è®¤æœ€å¤š 10 æ¬¡è¿­ä»£ï¼‰\n/sololoop:sololoop \"å®ç°ä¸€ä¸ªè®¡ç®—å™¨å‡½æ•°\"\n\n# æŒ‡å®šæœ€å¤§è¿­ä»£æ¬¡æ•°\n/sololoop:sololoop \"ç¼–å†™å•å…ƒæµ‹è¯•\" --max 15\n\n# ä½¿ç”¨å®Œæˆæ ‡è®°\n/sololoop:sololoop \"é‡æ„ä»£ç \" --promise \"DONE\" --max 20\n\n# æŸ¥çœ‹å¸®åŠ©\n/sololoop:sololoop --help\n\n# å–æ¶ˆå¾ªç¯\n/sololoop:cancel-sololoop\n```\n\n### ğŸ†• v6 OpenSpec é›†æˆæ¨¡å¼ï¼ˆæ¨èï¼‰\n\nä½¿ç”¨ `/sololoop:openspec` å‘½ä»¤ä¸ OpenSpec æ— ç¼é›†æˆï¼š\n\n```bash\n# ğŸ†• v6: åˆ—å‡ºæ‰€æœ‰å¯ç”¨å˜æ›´\n/sololoop:openspec +\n\n# åŸºæœ¬ç”¨æ³•\n/sololoop:openspec feature-name\n\n# æŒ‡å®šæœ€å¤§è¿­ä»£æ¬¡æ•°\n/sololoop:openspec feature-name --max 20\n\n# ä½¿ç”¨å®Œæˆæ ‡è®°ï¼ˆv6 é»˜è®¤ä¸º DONEï¼‰\n/sololoop:openspec feature-name --promise \"DONE\" --max 15\n```\n\n**å‰ç½®æ¡ä»¶**ï¼š\n1. é¡¹ç›®ä¸­å·²å®‰è£… OpenSpecï¼ˆå­˜åœ¨ `openspec/` ç›®å½•ï¼‰\n2. å·²åˆ›å»ºå˜æ›´ç›®å½• `openspec/changes/<feature-name>/`\n3. å˜æ›´ç›®å½•ä¸­å­˜åœ¨ `tasks.md` æ–‡ä»¶\n\n**ğŸ†• v6 `+` è§¦å‘ç¬¦**ï¼š\n\nå¿«é€ŸæŸ¥çœ‹æ‰€æœ‰å¯ç”¨çš„ OpenSpec å˜æ›´ï¼š\n\n```bash\n/sololoop:openspec +\n```\n\nè¾“å‡ºç¤ºä¾‹ï¼š\n```\nğŸ“‚ å¯ç”¨çš„ OpenSpec å˜æ›´ï¼š\n\n  âœ… user-auth\n  âœ… payment-integration\n  âš ï¸ new-feature (ç¼ºå°‘ tasks.md)\n\nè¯·ä½¿ç”¨å®Œæ•´å‘½ä»¤ï¼š\n  /sololoop:openspec <feature-name>\n```\n\n**ğŸ†• v6 Promise é©±åŠ¨é€€å‡º**ï¼š\n\nv6 ç§»é™¤äº†ã€Œå¤é€‰æ¡† 100% = è‡ªåŠ¨é€€å‡ºã€çš„é€»è¾‘ï¼Œæ”¹ä¸º Promise é©±åŠ¨ï¼š\n\n1. å¤é€‰æ¡†å®Œæˆä¸ä¼šè‡ªåŠ¨é€€å‡ºå¾ªç¯\n2. Claude éœ€è¦è¾“å‡º `<promise>DONE</promise>` æ‰èƒ½é€€å‡º\n3. è¿™è®© Claude æœ‰æœºä¼šåœ¨é€€å‡ºå‰è¿›è¡Œè‡ªæˆ‘å®¡æŸ¥\n\n**OpenSpec æ¨¡å¼å·¥ä½œæµ**ï¼š\n1. æ¡¥æ¥è„šæœ¬æ£€æŸ¥ OpenSpec ç›®å½•å’Œ tasks.md æ–‡ä»¶\n2. è‡ªåŠ¨æ„å»ºå¼•ç”¨ tasks.md çš„ promptï¼ˆåŒ…å« Promise é€€å‡ºè¯´æ˜ï¼‰\n3. Claude æŒ‰ç…§ tasks.md æ‰§è¡Œä»»åŠ¡å¹¶å‹¾é€‰å¤é€‰æ¡†\n4. å®Œæˆæ‰€æœ‰ä»»åŠ¡åï¼ŒClaude è¿›è¡Œè‡ªæˆ‘å®¡æŸ¥\n5. ç¡®è®¤å®Œæˆåï¼ŒClaude è¾“å‡º `<promise>DONE</promise>` é€€å‡ºå¾ªç¯\n\n**è‡ªåŠ¨æ„å»ºçš„ Prompt**ï¼š\n```\næŒ‰ç…§ openspec/changes/<feature-name>/tasks.md å®ç°æ‰€æœ‰ä»»åŠ¡ã€‚\n\nå‚è€ƒè§„æ ¼ï¼šopenspec/changes/<feature-name>/specs/\né¡¹ç›®çº¦å®šï¼šopenspec/project.mdï¼ˆå¦‚å­˜åœ¨ï¼‰\n\n## ä»»åŠ¡æ‰§è¡Œè§„åˆ™\n\n1. å®Œæˆæ¯ä¸ªä»»åŠ¡ååœ¨ tasks.md ä¸­å‹¾é€‰å¯¹åº”å¤é€‰æ¡†\n2. å¤é€‰æ¡†å®Œæˆä¸ä¼šè‡ªåŠ¨é€€å‡ºå¾ªç¯\n3. å®Œæˆæ‰€æœ‰ä»»åŠ¡åï¼Œè¿›è¡Œè‡ªæˆ‘å®¡æŸ¥ï¼š\n   - æ£€æŸ¥æ˜¯å¦æœ‰é—æ¼çš„ä»»åŠ¡\n   - æ£€æŸ¥æ˜¯å¦æœ‰éœ€è¦æ”¹è¿›çš„åœ°æ–¹\n   - ç¡®è®¤ä»£ç è´¨é‡ç¬¦åˆé¢„æœŸ\n4. ç¡®è®¤ä¸€åˆ‡å®Œæˆåï¼Œè¾“å‡º <promise>DONE</promise> é€€å‡ºå¾ªç¯\n```\n\n### ğŸ†• Manus æœ€ä½³å®è·µï¼ˆSteering æ¨¡æ¿ï¼‰\n\nSoloLoop æä¾› Manus å·¥ä½œæµæœ€ä½³å®è·µçš„ Steering æ¨¡æ¿ï¼ŒåŒ…å«ï¼š\n- **2-Action Rule**ï¼šåŒåŠ¨ä½œè§„åˆ™ï¼Œé˜²æ­¢ä¿¡æ¯ä¸¢å¤±\n- **3-Strike Protocol**ï¼šä¸‰æŒ¯å‡ºå±€åè®®ï¼Œæ™ºèƒ½é”™è¯¯å¤„ç†\n- **5-Question Test**ï¼šäº”é—®é‡å¯æµ‹è¯•ï¼Œä¸Šä¸‹æ–‡æ¢å¤\n\n```bash\n# åˆå§‹åŒ– Steering æ¨¡æ¿åˆ°é¡¹ç›®\n/sololoop:init-steering\n\n# ä½¿ç”¨æ—¶é€šè¿‡ # æ‰‹åŠ¨è§¦å‘\n#manus-rules æ‰§è¡Œå¤æ‚çš„é‡æ„ä»»åŠ¡...\n```\n\n> ğŸ’¡ è¿™äº›è§„åˆ™é€šè¿‡ Claude Code åŸç”Ÿ Steering æœºåˆ¶å®ç°ï¼Œä¸ SoloLoop å¾ªç¯å¼•æ“å®Œå…¨è§£è€¦ã€‚\n\n### ğŸ†• v8 æ’ä»¶åŒ…è£…å™¨æ¨¡å¼\n\nä½¿ç”¨ `/sololoop:wrap` å‘½ä»¤å°†å¾ªç¯èƒ½åŠ›åº”ç”¨åˆ°ä»»æ„æ’ä»¶å‘½ä»¤ï¼š\n\n```bash\n# åŸºæœ¬ç”¨æ³•ï¼šåŒ…è£…å…¶ä»–æ’ä»¶å‘½ä»¤\n/sololoop:wrap \"@code-review:review src/\"\n\n# æŒ‡å®šæœ€å¤§è¿­ä»£æ¬¡æ•°\n/sololoop:wrap \"@linter:fix .\" --max 5\n\n# ä½¿ç”¨å®Œæˆæ ‡è®°\n/sololoop:wrap \"@test:run\" --promise \"ALL_TESTS_PASSED\" --max 15\n```\n\n**å·¥ä½œåŸç†**ï¼š\n1. wrap å‘½ä»¤åˆ›å»ºçŠ¶æ€æ–‡ä»¶ï¼Œæ ‡è®° `wrap_mode: true`\n2. Stop Hook æ£€æµ‹åˆ°åŒ…è£…æ¨¡å¼ï¼Œæ„å»º Skill Tool è°ƒç”¨æŒ‡ä»¤\n3. Claude ä½¿ç”¨ Skill Tool æ‰§è¡Œè¢«åŒ…è£…çš„å‘½ä»¤\n4. å¾ªç¯ç»§ç»­ç›´åˆ° Promise åŒ¹é…æˆ–è¾¾åˆ°æœ€å¤§è¿­ä»£æ¬¡æ•°\n\n**å‚æ•°è¯´æ˜**ï¼š\n| å‚æ•° | å¿…éœ€ | é»˜è®¤å€¼ | è¯´æ˜ |\n|------|------|--------|------|\n| `<plugin-command>` | æ˜¯ | - | è¦åŒ…è£…çš„æ’ä»¶å‘½ä»¤ï¼Œéœ€ç”¨å¼•å·åŒ…è£¹ |\n| `--max <N>` | å¦ | 10 | æœ€å¤§è¿­ä»£æ¬¡æ•° |\n| `--promise <TEXT>` | å¦ | - | å®Œæˆæ ‡è®°æ–‡æœ¬ |\n\n### ğŸ†• v8 ä½¿ç”¨ç»Ÿè®¡\n\næŸ¥çœ‹ SoloLoop ä½¿ç”¨ç»Ÿè®¡ï¼š\n\n```bash\n/sololoop:stats\n```\n\nè¾“å‡ºç¤ºä¾‹ï¼š\n```\nğŸ“Š SoloLoop ä½¿ç”¨ç»Ÿè®¡\n\næ€»ä¼šè¯æ•°: 42\næ€»è¿­ä»£æ•°: 156\nå¹³å‡è¿­ä»£: 3.7\n\né€€å‡ºåŸå› åˆ†å¸ƒ:\n  promise_matched: 28\n  max_iterations: 12\n  user_cancelled: 2\n```\n\nç»Ÿè®¡æ•°æ®å­˜å‚¨åœ¨ `~/.claude/sololoop/stats.json`ï¼Œè·¨é¡¹ç›®å…±äº«ã€‚\n\n### ğŸ†• v8 ä¼šè¯æ¢å¤æ£€æµ‹\n\nå½“ä¼šè¯å¯åŠ¨æ—¶ï¼Œå¦‚æœæ£€æµ‹åˆ°æœªå®Œæˆçš„å¾ªç¯ï¼Œä¼šè‡ªåŠ¨æç¤ºï¼š\n\n```\nâš ï¸ æ£€æµ‹åˆ°æœªå®Œæˆçš„ SoloLoop å¾ªç¯ (3/10)ã€‚\nç»§ç»­: ç›´æ¥è¿è¡Œå‘½ä»¤ï¼›é‡æ–°å¼€å§‹: å…ˆè¿è¡Œ /sololoop:cancel-sololoop\n```\n\nè¿™é€šè¿‡ SessionStart Hook å®ç°ï¼Œç¡®ä¿ä¸ä¼šä¸¢å¤±è¿›åº¦ã€‚\n\n### ğŸ†• v8 é‡å¤å¤±è´¥æ£€æµ‹\n\nå½“è¿ç»­ 3 æ¬¡é‡åˆ°ç›¸åŒé”™è¯¯æ—¶ï¼ŒStop Hook ä¼šåœ¨ systemMessage ä¸­æ·»åŠ å»ºè®®ï¼š\n\n```\nğŸ”„ SoloLoop è¿­ä»£ 5/10 | âš ï¸ æ£€æµ‹åˆ°è¿ç»­ 3 æ¬¡ç›¸åŒé”™è¯¯ï¼Œå»ºè®®æ¢ä¸€ç§æ–¹æ³•\n```\n\nè¿™å¸®åŠ©é¿å…åœ¨åŒä¸€é—®é¢˜ä¸Šæµªè´¹è¿­ä»£æ¬¡æ•°ã€‚\n\n### ğŸ†• v9 ç›®æ ‡è®°å¿†æœºåˆ¶\n\nv9 å¼•å…¥ã€Œç›®æ ‡è®°å¿†ã€æœºåˆ¶ï¼ˆå†…éƒ¨ä»£å· PlanMemï¼‰ï¼Œè§£å†³é•¿æ—¶é—´è‡ªä¸»æ‰§è¡Œä¸­çš„æ ¸å¿ƒç—›ç‚¹ï¼š\n\n- **ç›®æ ‡é—å¿˜é—®é¢˜** - è¿è¡Œ 50~300+ è¿­ä»£åï¼ŒéåŠŸèƒ½çº¦æŸã€åŸå§‹å–èˆåŠ¨æœºé€æ¸æ·¡åŒ–\n- **è·¨ä¼šè¯æ¢å¤é—®é¢˜** - éš”å¤©/éš”å‘¨é‡å¯æ—¶ï¼Œéš¾ä»¥å¯é æ¢å¤åŸå§‹ç›®æ ‡ä¸Šä¸‹æ–‡\n- **ç›®æ ‡æ¼‚ç§»é—®é¢˜** - é•¿æœŸå…»è‚²å‹é¡¹ç›®æœ€å®¹æ˜“å‘ç”Ÿã€Œè¶Šè·‘è¶Šåã€\n\n#### ç›®æ ‡è®°å¿†è‡ªåŠ¨æ¿€æ´»\n\nç›®æ ‡è®°å¿†é‡‡ç”¨**é¦–æ¬¡ä½¿ç”¨è‡ªåŠ¨åˆå§‹åŒ–**æ¨¡å¼ï¼Œé›¶é…ç½®å³å¯ä½¿ç”¨ï¼š\n\n```bash\n# ç›´æ¥ä½¿ç”¨ sololoopï¼ˆé¦–æ¬¡è‡ªåŠ¨åˆå§‹åŒ–ç›®æ ‡è®°å¿†ï¼‰\n/sololoop:sololoop \"å®Œæˆç”¨æˆ·è®¤è¯åŠŸèƒ½ï¼Œè¦æ±‚æ”¯æŒ OAuth2\" --max 50\n\n# ç›®æ ‡è®°å¿†è‡ªåŠ¨ï¼š\n# 1. åˆ›å»º .sololoop/ ç›®å½•\n# 2. ä» prompt æå–ç›®æ ‡å†™å…¥ goal.md\n# 3. åç»­è¿­ä»£ä¸­è‡ªåŠ¨é‡é”šå’Œæ¼‚ç§»æ£€æµ‹\n```\n\n#### .sololoop/ ç›®å½•ç»“æ„\n\n```\n.sololoop/\nâ”œâ”€â”€ goal.md              # å½“å‰ç›®æ ‡æè¿°\nâ”œâ”€â”€ invariants.md        # æ ¸å¿ƒçº¦æŸæ¸…å•\nâ”œâ”€â”€ decisions-log.md     # å†³ç­–å†å²è®°å½•\nâ””â”€â”€ archived-goals/      # å†å²ç›®æ ‡å½’æ¡£\n```\n\n#### ç›®æ ‡æ–‡ä»¶æ¨¡æ¿\n\n**goal.md** - å½“å‰ç›®æ ‡ï¼š\n```markdown\n# Current Goal\n\n## Summary\n[ä»ç”¨æˆ· prompt è‡ªåŠ¨æå–æˆ–æ‰‹åŠ¨å¡«å†™çš„ç›®æ ‡æ‘˜è¦]\n\n## Success Criteria\n- [ ] æ¡ä»¶ 1\n- [ ] æ¡ä»¶ 2\n\n## Scope Boundaries\n- åŒ…å«: ...\n- ä¸åŒ…å«: ...\n```\n\n**invariants.md** - æ ¸å¿ƒçº¦æŸï¼š\n```markdown\n# Core Invariants\n\n## Must Have\n- å…³é”®çº¦æŸ 1\n- å…³é”®çº¦æŸ 2\n\n## Must Not\n- ç¦æ­¢äº‹é¡¹ 1\n- ç¦æ­¢äº‹é¡¹ 2\n\n## Performance Constraints\n- æ€§èƒ½è¦æ±‚ 1\n```\n\n#### æ‰‹åŠ¨åˆå§‹åŒ–ï¼ˆå¯é€‰ï¼‰\n\n```bash\n# æå‰åˆå§‹åŒ–ç›®æ ‡è®°å¿†ç›®å½•\n/sololoop:init\n\n# ç„¶åæ‰‹åŠ¨ç¼–è¾‘ç›®æ ‡æ–‡ä»¶\n# .sololoop/goal.md\n# .sololoop/invariants.md\n```\n\n#### å‘¨æœŸæ€§é‡é”š\n\næ¯ 15 æ¬¡è¿­ä»£ï¼ˆé»˜è®¤ï¼‰ï¼ŒStop Hook ä¼šè‡ªåŠ¨å°† `goal.md` å†…å®¹æ³¨å…¥åˆ° systemMessageï¼Œå¼ºåˆ¶ Claude é‡è¯»ç›®æ ‡ï¼š\n\n```\nğŸ”„ SoloLoop è¿­ä»£ 15/50 | [Goal Memory Active] | é‡é”šï¼šè¯·é‡æ–°å®¡è§†åŸå§‹ç›®æ ‡...\n```\n\n#### æ¼‚ç§»æ£€æµ‹\n\nStop Hook ä¼šæ£€æµ‹ Claude çš„è¾“å‡ºæ˜¯å¦åŒ…å« `invariants.md` ä¸­çš„å…³é”®è¯ã€‚å¦‚æœè¿ç»­å¤šæ¬¡è¾“å‡ºéƒ½æœªæåŠæ ¸å¿ƒçº¦æŸï¼Œä¼šæ·»åŠ æ¼‚ç§»è­¦å‘Šï¼š\n\n```\nâš ï¸ æ¼‚ç§»è­¦å‘Šï¼šæœ€è¿‘è¾“å‡ºæœªæåŠæ ¸å¿ƒçº¦æŸï¼Œå»ºè®®é‡è¯» goal.md\n```\n\nè¿ç»­ 3 æ¬¡æ¼‚ç§»è­¦å‘Šåï¼Œä¼šå¼ºåˆ¶è§¦å‘é‡é”šã€‚\n\n#### å†³ç­–è®°å½•\n\nè®°å½•æ‰§è¡Œè¿‡ç¨‹ä¸­çš„é‡è¦å†³ç­–ï¼š\n\n```bash\n# æ·»åŠ å†³ç­–è®°å½•\n/sololoop:log \"å†³å®šä½¿ç”¨æ–¹æ¡ˆ A è€Œéæ–¹æ¡ˆ Bï¼Œå› ä¸ºæ€§èƒ½æ›´å¥½\"\n\n# æŸ¥çœ‹å†³ç­–å†å²\n/sololoop:show-log\n```\n\n#### çŠ¶æ€æ˜¾ç¤º\n\næŸ¥çœ‹å½“å‰ç›®æ ‡è®°å¿†çŠ¶æ€ï¼š\n\n```bash\n/sololoop:status\n```\n\nè¾“å‡ºç¤ºä¾‹ï¼š\n```\nğŸ“‹ SoloLoop ç›®æ ‡è®°å¿†çŠ¶æ€\n\nå½“å‰ç›®æ ‡: å®Œæˆç”¨æˆ·è®¤è¯åŠŸèƒ½\nè¿­ä»£è®¡æ•°: 23/50\né‡é”šè®¡æ•°: 1\næ¼‚ç§»è­¦å‘Š: 0\næœ€åæ´»åŠ¨: 2026-01-15T10:30:00Z\n```\n\n### âš ï¸ åºŸå¼ƒå‚æ•°è­¦å‘Š\n\nv5 å·²åºŸå¼ƒä»¥ä¸‹å‚æ•°ï¼Œä½¿ç”¨æ—¶ä¼šæ˜¾ç¤ºè­¦å‘Šï¼š\n\n| åºŸå¼ƒå‚æ•° | æ›¿ä»£æ–¹æ¡ˆ |\n|---------|---------|\n| `--plan` | ä½¿ç”¨ `/sololoop:openspec` |\n| `--spec` | ä½¿ç”¨ `/sololoop:openspec` |\n\n```bash\n# âŒ åºŸå¼ƒç”¨æ³•ï¼ˆä¼šæ˜¾ç¤ºè­¦å‘Šï¼‰\n/sololoop:sololoop \"ä»»åŠ¡\" --plan\n/sololoop:sololoop \"ä»»åŠ¡\" --spec\n\n# âœ… æ¨èç”¨æ³•\n/sololoop:openspec feature-name\n```\n\n### ä¸­æ–­æ¢å¤æœºåˆ¶\n\nå½“ Bash å‘½ä»¤æ‰§è¡Œè¢«ä¸­æ–­æ—¶ï¼ŒSoloLoop ä¼šè‡ªåŠ¨å¤„ç†ï¼š\n\n- **è‡ªåŠ¨æ£€æµ‹**ï¼šä» transcript æ£€æµ‹ \"Interrupted\" æ¨¡å¼\n- **æ¢å¤æŒ‡ä»¤**ï¼šåœ¨ systemMessage ä¸­æ·»åŠ æ¢å¤æŒ‡å¯¼\n- **å‡çº§å¤„ç†**ï¼šè¿ç»­ä¸­æ–­ 3 æ¬¡ä»¥ä¸Šæ—¶ï¼Œå»ºè®®æ›¿ä»£æ–¹æ¡ˆ\n- **çŠ¶æ€è·Ÿè¸ª**ï¼šè®°å½•ä¸­æ–­æ¬¡æ•°ï¼ŒæˆåŠŸè¿­ä»£åè‡ªåŠ¨é‡ç½®\n\nè¿™ç¡®ä¿äº†å·¥ä½œæµä¸ä¼šå› ä¸ºé•¿æ—¶é—´è¿è¡Œçš„å‘½ä»¤è¢«ä¸­æ–­è€Œåœæ­¢ã€‚\n\n## å‘½ä»¤å‚æ•°\n\n### /sololoop:sololoopï¼ˆçº¯å¾ªç¯æ¨¡å¼ï¼‰\n\n| å‚æ•° | è¯´æ˜ | é»˜è®¤å€¼ |\n|------|------|--------|\n| PROMPT | ä»»åŠ¡æè¿°ï¼ˆå¿…éœ€ï¼‰ | - |\n| --max N | æœ€å¤§è¿­ä»£æ¬¡æ•° | 10 |\n| --promise TEXT | å®Œæˆæ ‡è®° | æ—  |\n| --plan | âš ï¸ å·²åºŸå¼ƒï¼Œæ˜¾ç¤ºè­¦å‘Š | - |\n| --spec | âš ï¸ å·²åºŸå¼ƒï¼Œæ˜¾ç¤ºè­¦å‘Š | - |\n\n### /sololoop:wrapï¼ˆğŸ†• v8 æ’ä»¶åŒ…è£…å™¨æ¨¡å¼ï¼‰\n\n| å‚æ•° | è¯´æ˜ | é»˜è®¤å€¼ |\n|------|------|--------|\n| `<plugin-command>` | è¦åŒ…è£…çš„æ’ä»¶å‘½ä»¤ï¼ˆå¿…éœ€ï¼Œéœ€å¼•å·åŒ…è£¹ï¼‰ | - |\n| --max N | æœ€å¤§è¿­ä»£æ¬¡æ•° | 10 |\n| --promise TEXT | å®Œæˆæ ‡è®° | æ—  |\n\n### /sololoop:openspecï¼ˆOpenSpec é›†æˆæ¨¡å¼ï¼‰\n\n| å‚æ•° | è¯´æ˜ | é»˜è®¤å€¼ |\n|------|------|--------|\n| change-name | OpenSpec å˜æ›´åç§°ï¼ˆå¿…éœ€ï¼‰ | - |\n| + | åˆ—å‡ºæ‰€æœ‰å¯ç”¨å˜æ›´ | - |\n| --max N | æœ€å¤§è¿­ä»£æ¬¡æ•° | 10 |\n| --promise TEXT | å®Œæˆæ ‡è®°ï¼ˆå¯é€‰ï¼Œä¸è®¾ç½®åˆ™ä»…ä¾èµ–æœ€å¤§è¿­ä»£æ¬¡æ•°é€€å‡ºï¼‰ | æ—  |\n\n### /sololoop:statsï¼ˆğŸ†• v8 ä½¿ç”¨ç»Ÿè®¡ï¼‰\n\næ— å‚æ•°ï¼Œæ˜¾ç¤º SoloLoop ä½¿ç”¨ç»Ÿè®¡ä¿¡æ¯ã€‚\n\n### /sololoop:initï¼ˆğŸ†• v9 ç›®æ ‡è®°å¿†åˆå§‹åŒ–ï¼‰\n\næ‰‹åŠ¨åˆå§‹åŒ–ç›®æ ‡è®°å¿†ç›®å½•ï¼Œåˆ›å»º `.sololoop/` åŠæ¨¡æ¿æ–‡ä»¶ã€‚\n\n| å‚æ•° | è¯´æ˜ | é»˜è®¤å€¼ |\n|------|------|--------|\n| æ—  | åˆ›å»ºç›®å½•å’Œæ¨¡æ¿æ–‡ä»¶ | - |\n\n### /sololoop:logï¼ˆğŸ†• v9 å†³ç­–è®°å½•ï¼‰\n\næ·»åŠ å†³ç­–è®°å½•åˆ° `.sololoop/decisions-log.md`ã€‚\n\n| å‚æ•° | è¯´æ˜ | é»˜è®¤å€¼ |\n|------|------|--------|\n| `<description>` | å†³ç­–æè¿°æ–‡æœ¬ï¼ˆå¿…éœ€ï¼‰ | - |\n\n### /sololoop:show-logï¼ˆğŸ†• v9 æŸ¥çœ‹å†³ç­–å†å²ï¼‰\n\næ˜¾ç¤ºæœ€è¿‘çš„å†³ç­–è®°å½•ã€‚\n\n| å‚æ•° | è¯´æ˜ | é»˜è®¤å€¼ |\n|------|------|--------|\n| æ—  | æ˜¾ç¤ºæœ€è¿‘å†³ç­–è®°å½• | - |\n\n### /sololoop:statusï¼ˆğŸ†• v9 ç›®æ ‡çŠ¶æ€ï¼‰\n\næ˜¾ç¤ºå½“å‰ç›®æ ‡è®°å¿†çŠ¶æ€ã€‚\n\n| å‚æ•° | è¯´æ˜ | é»˜è®¤å€¼ |\n|------|------|--------|\n| æ—  | æ˜¾ç¤ºç›®æ ‡æ‘˜è¦ã€è¿­ä»£è®¡æ•°ã€é‡é”šè®¡æ•°ç­‰ | - |\n\n### /sololoop:init-steeringï¼ˆSteering æ¨¡æ¿åˆå§‹åŒ–ï¼‰\n\næ— å‚æ•°ï¼Œå°† Manus æœ€ä½³å®è·µæ¨¡æ¿å¤åˆ¶åˆ°é¡¹ç›®çš„ `.claude/steering/` ç›®å½•ã€‚\n\n### /sololoop:cancel-sololoopï¼ˆå–æ¶ˆå¾ªç¯ï¼‰\n\næ— å‚æ•°ï¼Œåˆ é™¤çŠ¶æ€æ–‡ä»¶å¹¶ç»ˆæ­¢å½“å‰å¾ªç¯ã€‚\n\n### é€€å‡ºæ¡ä»¶ä¼˜å…ˆçº§\n\nv6 ç®€åŒ–äº†é€€å‡ºæ¡ä»¶ï¼Œé‡‡ç”¨ Promise é©±åŠ¨ï¼š\n\n1. **Promise åŒ¹é…**ï¼šæ£€æµ‹åˆ° `<promise>TEXT</promise>` ç²¾ç¡®åŒ¹é…ï¼ˆä¼˜å…ˆçº§ 1ï¼‰\n2. **æœ€å¤§è¿­ä»£**ï¼šè¾¾åˆ° --max æŒ‡å®šçš„æ¬¡æ•°ï¼ˆä¼˜å…ˆçº§ 2ï¼Œå®‰å…¨ç½‘ï¼‰\n\n> âš ï¸ **v6 å˜æ›´**ï¼šå¤é€‰æ¡† 100% å®Œæˆä¸å†è§¦å‘è‡ªåŠ¨é€€å‡ºï¼Œä»…ä½œä¸ºè¿›åº¦æŒ‡ç¤ºå™¨æ˜¾ç¤ºã€‚\n\n## å·¥ä½œåŸç†\n\n### æ¶æ„æ¦‚è§ˆ\n\n```\nSoloLoop v5 (è½»é‡å¾ªç¯å¼•æ“)     OpenSpec (å¤–éƒ¨å·¥å…·)\nâ”œâ”€â”€ å¾ªç¯å¼•æ“                   â”œâ”€â”€ è§„æ ¼å®šä¹‰ (specs/)\nâ”œâ”€â”€ ä¸­æ–­æ¢å¤                   â”œâ”€â”€ å˜æ›´ç®¡ç† (changes/)\nâ”œâ”€â”€ OpenSpec æ¡¥æ¥              â”œâ”€â”€ ä»»åŠ¡åˆ†è§£ (tasks.md)\nâ””â”€â”€ é€€å‡ºæ¡ä»¶åˆ¤æ–­               â””â”€â”€ å½’æ¡£æ¼”è¿›\n```\n\n### æ ¸å¿ƒè„šæœ¬\n\n1. **setup-sololoop.sh**ï¼šè§£æå‚æ•°ï¼Œåˆ›å»ºçŠ¶æ€æ–‡ä»¶ `.claude/sololoop.local.md`\n2. **openspec-bridge.sh**ï¼šæ£€æŸ¥ OpenSpec ç›®å½•ï¼Œæ„å»ºå¼•ç”¨ tasks.md çš„ prompt\n3. **stop-hook.sh**ï¼šåœ¨ Claude å°è¯•åœæ­¢æ—¶è¢«è°ƒç”¨ï¼Œæ£€æŸ¥çŠ¶æ€æ–‡ä»¶å’Œè¿›åº¦ï¼Œå†³å®šæ˜¯å¦ç»§ç»­å¾ªç¯\n\n### Stop Hook å†³ç­–é€»è¾‘\n\n```\nçŠ¶æ€æ–‡ä»¶ä¸å­˜åœ¨ï¼Ÿ â†’ å…è®¸é€€å‡º\næ£€æµ‹åˆ°å®Œæˆæ ‡è®° (Promise)ï¼Ÿ â†’ å…è®¸é€€å‡ºï¼Œåˆ é™¤çŠ¶æ€æ–‡ä»¶\nè¾¾åˆ°æœ€å¤§è¿­ä»£ï¼Ÿ â†’ å…è®¸é€€å‡ºï¼Œåˆ é™¤çŠ¶æ€æ–‡ä»¶\næ£€æµ‹åˆ° Bash ä¸­æ–­ï¼Ÿ â†’ é˜»æ­¢é€€å‡ºï¼ŒsystemMessage æ·»åŠ æ¢å¤æŒ‡ä»¤\nå¦åˆ™ â†’ é˜»æ­¢é€€å‡ºï¼Œè¿”å›åŸå§‹ prompt ç»§ç»­è¿­ä»£\n```\n\n> âš ï¸ **v6 å˜æ›´**ï¼šå¤é€‰æ¡† 100% å®Œæˆä¸å†ä½œä¸ºé€€å‡ºæ¡ä»¶ï¼Œä»…åœ¨ systemMessage ä¸­æ˜¾ç¤ºè¿›åº¦ã€‚\n\n### çŠ¶æ€æ–‡ä»¶æ ¼å¼ (v9)\n\n```markdown\n---\niteration: 1\nmax_iterations: 10\ncompletion_promise: \"DONE\"\nwrap_mode: false              # v8: åŒ…è£…å™¨æ¨¡å¼æ ‡è®°\nwrapped_command: \"\"           # v8: è¢«åŒ…è£…çš„å‘½ä»¤\nsame_error_count: 0           # v8: è¿ç»­ç›¸åŒé”™è¯¯è®¡æ•°\nlast_error: \"\"                # v8: ä¸Šæ¬¡é”™è¯¯ä¿¡æ¯\nsession_id: \"abc123\"          # v8: ä¼šè¯ ID\nopenspec_mode: false\nopenspec_tasks_file: \"\"\nstarted_at: \"2026-01-13T10:30:00Z\"\ninterruption_count: 0\nlast_interruption_type: null\ngoal_memory_enabled: true     # ğŸ†• v9: ç›®æ ‡è®°å¿†å¯ç”¨çŠ¶æ€\niteration_since_anchor: 7     # ğŸ†• v9: è·ä¸Šæ¬¡é‡é”šçš„è¿­ä»£æ•°\nanchor_interval: 15           # ğŸ†• v9: é‡é”šé—´éš”\ndrift_warning_count: 0        # ğŸ†• v9: æ¼‚ç§»è­¦å‘Šè®¡æ•°\ntotal_anchors: 2              # ğŸ†• v9: æ€»é‡é”šæ¬¡æ•°\nlast_activity_timestamp: \"2026-01-13T10:30:00Z\"  # ğŸ†• v9: æœ€åæ´»åŠ¨æ—¶é—´\n---\n\nåŸå§‹ prompt å†…å®¹...\n```\n\n### Hook è¾“å‡ºæ ¼å¼ (v8)\n\nv8 å¢å¼ºäº† Hook è¾“å‡ºï¼Œæ”¯æŒä¼˜é›…é€€å‡ºå’Œé‡å¤å¤±è´¥æ£€æµ‹ï¼š\n\n**ç»§ç»­è¿­ä»£**ï¼š\n```json\n{\n  \"decision\": \"block\",\n  \"reason\": \"åŸå§‹ prompt å†…å®¹ï¼ˆçº¯å‡€ï¼‰\",\n  \"systemMessage\": \"ğŸ”„ SoloLoop è¿­ä»£ 2/10 | è¿›åº¦: 22/22 (100%) | ç­‰å¾…å®Œæˆæ ‡è®°\"\n}\n```\n\n**ç»§ç»­è¿­ä»£ï¼ˆæ£€æµ‹åˆ°é‡å¤å¤±è´¥ï¼‰**ï¼š\n```json\n{\n  \"decision\": \"block\",\n  \"reason\": \"åŸå§‹ prompt å†…å®¹\",\n  \"systemMessage\": \"ğŸ”„ SoloLoop è¿­ä»£ 5/10 | âš ï¸ æ£€æµ‹åˆ°è¿ç»­ 3 æ¬¡ç›¸åŒé”™è¯¯ï¼Œå»ºè®®æ¢ä¸€ç§æ–¹æ³•\"\n}\n```\n\n**å…è®¸é€€å‡ºï¼ˆPromise åŒ¹é…ï¼‰**ï¼š\n```json\n{\n  \"decision\": \"allow\",\n  \"continue\": false,\n  \"stopReason\": \"âœ… SoloLoop å®Œæˆï¼šPromise åŒ¹é…æˆåŠŸ\"\n}\n```\n\n**å…è®¸é€€å‡ºï¼ˆæœ€å¤§è¿­ä»£ï¼‰**ï¼š\n```json\n{\n  \"decision\": \"allow\",\n  \"continue\": false,\n  \"stopReason\": \"âš ï¸ SoloLoop å®Œæˆï¼šè¾¾åˆ°æœ€å¤§è¿­ä»£æ¬¡æ•° (10/10)\"\n}\n```\n\n## æ–‡ä»¶ç»“æ„\n\n```\nsololoop/\nâ”œâ”€â”€ .claude-plugin/\nâ”‚   â”œâ”€â”€ plugin.json          # æ’ä»¶å…ƒæ•°æ®ï¼ˆv9.0.0ï¼‰\nâ”‚   â””â”€â”€ marketplace.json     # Marketplace é…ç½®\nâ”œâ”€â”€ commands/\nâ”‚   â”œâ”€â”€ sololoop.md          # çº¯å¾ªç¯å‘½ä»¤\nâ”‚   â”œâ”€â”€ openspec.md          # OpenSpec æ¡¥æ¥å‘½ä»¤\nâ”‚   â”œâ”€â”€ cancel-sololoop.md   # å–æ¶ˆå‘½ä»¤\nâ”‚   â”œâ”€â”€ wrap.md              # v8 æ’ä»¶åŒ…è£…å™¨å‘½ä»¤\nâ”‚   â”œâ”€â”€ stats.md             # v8 ç»Ÿè®¡å‘½ä»¤\nâ”‚   â”œâ”€â”€ init-steering.md     # åˆå§‹åŒ– Steering æ¨¡æ¿å‘½ä»¤\nâ”‚   â”œâ”€â”€ init.md              # ğŸ†• v9 ç›®æ ‡è®°å¿†åˆå§‹åŒ–å‘½ä»¤\nâ”‚   â”œâ”€â”€ log.md               # ğŸ†• v9 å†³ç­–è®°å½•å‘½ä»¤\nâ”‚   â”œâ”€â”€ show-log.md          # ğŸ†• v9 æŸ¥çœ‹å†³ç­–å†å²å‘½ä»¤\nâ”‚   â””â”€â”€ status.md            # ğŸ†• v9 ç›®æ ‡çŠ¶æ€å‘½ä»¤\nâ”œâ”€â”€ hooks/\nâ”‚   â”œâ”€â”€ hooks.json           # Hook é…ç½®ï¼ˆv9: ç›®æ ‡è®°å¿†å¢å¼ºï¼‰\nâ”‚   â”œâ”€â”€ stop-hook.sh         # Stop Hook è„šæœ¬ï¼ˆv9: é‡é”šã€æ¼‚ç§»æ£€æµ‹ï¼‰\nâ”‚   â””â”€â”€ session-start.sh     # SessionStart Hook è„šæœ¬ï¼ˆv9: ç›®æ ‡æ³¨å…¥ï¼‰\nâ”œâ”€â”€ scripts/\nâ”‚   â”œâ”€â”€ setup-sololoop.sh    # åˆå§‹åŒ–è„šæœ¬ï¼ˆv9: ç›®æ ‡è®°å¿†å­—æ®µï¼‰\nâ”‚   â”œâ”€â”€ openspec-bridge.sh   # OpenSpec æ¡¥æ¥è„šæœ¬\nâ”‚   â”œâ”€â”€ cancel-sololoop.sh   # å–æ¶ˆè„šæœ¬\nâ”‚   â”œâ”€â”€ wrap-plugin.sh       # v8 åŒ…è£…å™¨è„šæœ¬\nâ”‚   â”œâ”€â”€ show-stats.sh        # v8 ç»Ÿè®¡æ˜¾ç¤ºè„šæœ¬\nâ”‚   â”œâ”€â”€ init-steering.sh     # Steering æ¨¡æ¿åˆå§‹åŒ–è„šæœ¬\nâ”‚   â”œâ”€â”€ init-sololoop.sh     # ğŸ†• v9 ç›®æ ‡è®°å¿†åˆå§‹åŒ–è„šæœ¬\nâ”‚   â”œâ”€â”€ log-decision.sh      # ğŸ†• v9 å†³ç­–è®°å½•è„šæœ¬\nâ”‚   â”œâ”€â”€ show-log.sh          # ğŸ†• v9 æŸ¥çœ‹å†³ç­–å†å²è„šæœ¬\nâ”‚   â””â”€â”€ show-status.sh       # ğŸ†• v9 ç›®æ ‡çŠ¶æ€è„šæœ¬\nâ”œâ”€â”€ templates/               # ğŸ†• v9 ç›®æ ‡æ–‡ä»¶æ¨¡æ¿ç›®å½•\nâ”‚   â”œâ”€â”€ goal.md              # ç›®æ ‡æ¨¡æ¿\nâ”‚   â”œâ”€â”€ invariants.md        # çº¦æŸæ¨¡æ¿\nâ”‚   â””â”€â”€ decisions-log.md     # å†³ç­–è®°å½•æ¨¡æ¿\nâ”œâ”€â”€ steering/                # Steering æ¨¡æ¿ç›®å½•\nâ”‚   â””â”€â”€ manus-rules.md       # Manus æœ€ä½³å®è·µæ¨¡æ¿\nâ”œâ”€â”€ tests/                   # æµ‹è¯•æ–‡ä»¶\nâ”‚   â”œâ”€â”€ setup-sololoop.bats\nâ”‚   â”œâ”€â”€ openspec-bridge.bats\nâ”‚   â”œâ”€â”€ stop-hook.bats\nâ”‚   â”œâ”€â”€ cancel-sololoop.bats\nâ”‚   â”œâ”€â”€ command-format.bats\nâ”‚   â”œâ”€â”€ integration.bats\nâ”‚   â”œâ”€â”€ wrap-plugin.bats     # v8 åŒ…è£…å™¨æµ‹è¯•\nâ”‚   â”œâ”€â”€ stats.bats           # v8 ç»Ÿè®¡æµ‹è¯•\nâ”‚   â”œâ”€â”€ session-start.bats   # v8 ä¼šè¯æ¢å¤æµ‹è¯•\nâ”‚   â”œâ”€â”€ format-compliance-v8.bats  # v8 æ ¼å¼åˆè§„æµ‹è¯•\nâ”‚   â”œâ”€â”€ state-cleanup.bats   # v8 çŠ¶æ€æ¸…ç†æµ‹è¯•\nâ”‚   â”œâ”€â”€ init-sololoop.bats   # ğŸ†• v9 åˆå§‹åŒ–æµ‹è¯•\nâ”‚   â”œâ”€â”€ goal-memory-detection.bats  # ğŸ†• v9 ç›®æ ‡è®°å¿†æ£€æµ‹æµ‹è¯•\nâ”‚   â”œâ”€â”€ re-anchoring.bats    # ğŸ†• v9 é‡é”šæµ‹è¯•\nâ”‚   â”œâ”€â”€ drift-detection.bats # ğŸ†• v9 æ¼‚ç§»æ£€æµ‹æµ‹è¯•\nâ”‚   â”œâ”€â”€ decision-log.bats    # ğŸ†• v9 å†³ç­–è®°å½•æµ‹è¯•\nâ”‚   â”œâ”€â”€ backward-compat.bats # ğŸ†• v9 å‘åå…¼å®¹æµ‹è¯•\nâ”‚   â”œâ”€â”€ format-compliance-v9.bats  # ğŸ†• v9 æ ¼å¼åˆè§„æµ‹è¯•\nâ”‚   â””â”€â”€ helpers/\nâ””â”€â”€ README.md\n\n# è¿è¡Œæ—¶ç”Ÿæˆçš„æ–‡ä»¶\nproject/\nâ”œâ”€â”€ .claude/\nâ”‚   â””â”€â”€ sololoop.local.md    # çŠ¶æ€æ–‡ä»¶ï¼ˆv9: ç›®æ ‡è®°å¿†å­—æ®µï¼‰\nâ””â”€â”€ .sololoop/               # ğŸ†• v9 ç›®æ ‡è®°å¿†ç›®å½•\n    â”œâ”€â”€ goal.md              # å½“å‰ç›®æ ‡\n    â”œâ”€â”€ invariants.md        # æ ¸å¿ƒçº¦æŸ\n    â”œâ”€â”€ decisions-log.md     # å†³ç­–å†å²\n    â””â”€â”€ archived-goals/      # å†å²ç›®æ ‡å½’æ¡£\n\n# å…¨å±€ç»Ÿè®¡æ–‡ä»¶ï¼ˆv8ï¼‰\n~/.claude/sololoop/\nâ””â”€â”€ stats.json               # ä½¿ç”¨ç»Ÿè®¡æ•°æ®\n```\n\n## æ•…éšœæ’é™¤\n\n| é—®é¢˜ | è§£å†³æ–¹æ¡ˆ |\n|------|----------|\n| Unknown slash command | æ£€æŸ¥æ’ä»¶æ˜¯å¦æ­£ç¡®åŠ è½½ï¼Œä½¿ç”¨ `claude --debug` æŸ¥çœ‹æ—¥å¿— |\n| æƒé™é”™è¯¯ | ä½¿ç”¨ `--dangerously-skip-permissions` æˆ–æ‰‹åŠ¨æ·»åŠ æƒé™ |\n| å¾ªç¯æ²¡æœ‰å¯åŠ¨ | æ£€æŸ¥ prompt æ˜¯å¦ä¸ºç©ºï¼Œ--max æ˜¯å¦ä¸ºæ­£æ•´æ•° |\n| å¾ªç¯æ²¡æœ‰åœæ­¢ | è¿è¡Œ `/sololoop:cancel-sololoop` æˆ–åˆ é™¤ `.claude/sololoop.local.md` |\n| ä¸­æ–­åå¾ªç¯åœæ­¢ | å‡çº§åˆ° v3+ï¼Œè‡ªåŠ¨å¤„ç† Bash ä¸­æ–­ |\n| è¿­ä»£æ¬¡æ•°ä¸å‡†ç¡® | å‡çº§åˆ° v3+ï¼Œä¸¥æ ¼æŒ‰ç…§ `--max` æ‰§è¡Œ |\n| openspec å‘½ä»¤å¤±è´¥ | ç¡®è®¤ `openspec/` ç›®å½•å­˜åœ¨ä¸”åŒ…å« tasks.md |\n| --plan/--spec è­¦å‘Š | è¿™äº›å‚æ•°å·²åºŸå¼ƒï¼Œè¯·ä½¿ç”¨ `/sololoop:openspec` |\n| è¿›åº¦ä¸æ˜¾ç¤º | ç¡®è®¤ tasks.md ä¸­ä½¿ç”¨æ ‡å‡†å¤é€‰æ¡†æ ¼å¼ `- [ ]` / `- [x]` |\n| å¤é€‰æ¡† 100% ä½†ä¸é€€å‡º | æ­£å¸¸è¡Œä¸ºï¼Œéœ€è¦è¾“å‡º `<promise>DONE</promise>` æ‰èƒ½é€€å‡º |\n| `+` è§¦å‘ç¬¦æ— è¾“å‡º | ç¡®è®¤ `openspec/changes/` ç›®å½•å­˜åœ¨ |\n| wrap å‘½ä»¤æ— æ•ˆ | ç¡®è®¤æ’ä»¶å‘½ä»¤æ ¼å¼æ­£ç¡®ï¼Œéœ€ç”¨å¼•å·åŒ…è£¹ |\n| stats æ— æ•°æ® | é¦–æ¬¡ä½¿ç”¨ï¼Œå®Œæˆä¸€æ¬¡å¾ªç¯åä¼šæœ‰ç»Ÿè®¡æ•°æ® |\n| ä¼šè¯æ¢å¤æç¤º | æ­£å¸¸è¡Œä¸ºï¼Œå¯ç»§ç»­æˆ–è¿è¡Œ `/sololoop:cancel-sololoop` é‡æ–°å¼€å§‹ |\n| é‡å¤å¤±è´¥å»ºè®® | è¿ç»­ 3 æ¬¡ç›¸åŒé”™è¯¯æ—¶çš„æ­£å¸¸æç¤ºï¼Œå»ºè®®å°è¯•ä¸åŒæ–¹æ³• |\n| ğŸ†• ç›®æ ‡è®°å¿†æœªæ¿€æ´» | ç¡®è®¤ `.sololoop/goal.md` å­˜åœ¨ï¼Œæˆ–è¿è¡Œ `/sololoop:init` |\n| ğŸ†• é‡é”šæœªè§¦å‘ | æ£€æŸ¥ `iteration_since_anchor` æ˜¯å¦è¾¾åˆ° `anchor_interval`ï¼ˆé»˜è®¤ 15ï¼‰ |\n| ğŸ†• æ¼‚ç§»æ£€æµ‹æ— æ•ˆ | ç¡®è®¤ `.sololoop/invariants.md` åŒ…å«å…³é”®è¯ |\n| ğŸ†• å†³ç­–è®°å½•å¤±è´¥ | ç¡®è®¤ `.sololoop/decisions-log.md` å­˜åœ¨ä¸”å¯å†™ |\n| ğŸ†• çŠ¶æ€æ˜¾ç¤ºä¸ºç©º | è¿è¡Œ `/sololoop:init` åˆå§‹åŒ–ç›®æ ‡è®°å¿†ç›®å½• |\n\n---\n\n## æ’ä»¶å¼€å‘å‚è€ƒæ–‡æ¡£\n\nä»¥ä¸‹æ˜¯ä» [Claude Code å®˜æ–¹æ–‡æ¡£](https://code.claude.com/docs/en/plugins) æ•´ç†çš„æ’ä»¶å¼€å‘å…³é”®ä¿¡æ¯ã€‚\n\n### æ’ä»¶ç›®å½•ç»“æ„\n\n```\nplugin-name/\nâ”œâ”€â”€ .claude-plugin/\nâ”‚   â””â”€â”€ plugin.json          # å¿…éœ€ï¼šæ’ä»¶å…ƒæ•°æ®\nâ”œâ”€â”€ commands/                 # æ–œæ å‘½ä»¤ Markdown æ–‡ä»¶\nâ”œâ”€â”€ agents/                   # è‡ªå®šä¹‰ agent å®šä¹‰\nâ”œâ”€â”€ skills/                   # Agent Skillsï¼ˆå« SKILL.mdï¼‰\nâ”œâ”€â”€ hooks/\nâ”‚   â””â”€â”€ hooks.json           # Hook é…ç½®\nâ”œâ”€â”€ .mcp.json                # MCP æœåŠ¡å™¨é…ç½®\nâ””â”€â”€ .lsp.json                # LSP æœåŠ¡å™¨é…ç½®\n```\n\n### plugin.json å®Œæ•´ Schema\n\n```json\n{\n  \"name\": \"plugin-name\",           // å¿…éœ€ï¼šå”¯ä¸€æ ‡è¯†ç¬¦ï¼ˆkebab-caseï¼‰\n  \"version\": \"1.2.0\",              // è¯­ä¹‰åŒ–ç‰ˆæœ¬\n  \"description\": \"æ’ä»¶æè¿°\",\n  \"author\": {\n    \"name\": \"ä½œè€…å\",\n    \"email\": \"email@example.com\",\n    \"url\": \"https://github.com/author\"\n  },\n  \"homepage\": \"https://docs.example.com/plugin\",\n  \"repository\": \"https://github.com/author/plugin\",\n  \"license\": \"MIT\",\n  \"keywords\": [\"keyword1\", \"keyword2\"],\n  \"commands\": [\"./custom/commands/special.md\"],\n  \"agents\": \"./custom/agents/\",\n  \"skills\": \"./custom/skills/\",\n  \"hooks\": \"./config/hooks.json\",\n  \"mcpServers\": \"./mcp-config.json\",\n  \"lspServers\": \"./.lsp.json\"\n}\n```\n\n### å‘½ä»¤æ–‡ä»¶ Frontmatter\n\nå‘½ä»¤æ–‡ä»¶æ”¯æŒä»¥ä¸‹ frontmatter å­—æ®µï¼š\n\n| å­—æ®µ | ç”¨é€” | é»˜è®¤å€¼ |\n|------|------|--------|\n| `description` | å‘½ä»¤ç®€è¿° | ä½¿ç”¨ prompt ç¬¬ä¸€è¡Œ |\n| `allowed-tools` | å‘½ä»¤å¯ç”¨çš„å·¥å…·åˆ—è¡¨ | ç»§æ‰¿ä¼šè¯è®¾ç½® |\n| `argument-hint` | å‚æ•°æç¤º | æ—  |\n| `model` | æŒ‡å®šæ¨¡å‹ | ç»§æ‰¿ä¼šè¯è®¾ç½® |\n| `disable-model-invocation` | ç¦æ­¢ SlashCommand å·¥å…·è°ƒç”¨ | false |\n\n### allowed-tools æ ¼å¼\n\n```yaml\n# å•ä¸ªå·¥å…·\nallowed-tools: Read\n\n# å¤šä¸ªå·¥å…·ï¼ˆé€—å·åˆ†éš”å­—ç¬¦ä¸²ï¼‰\nallowed-tools: Read, Write, Edit\n\n# å¤šä¸ªå·¥å…·ï¼ˆæ•°ç»„æ ¼å¼ï¼‰\nallowed-tools:\n  - Read\n  - Write\n  - Bash(git:*)\n\n# Bash å‘½ä»¤è¿‡æ»¤å™¨\nallowed-tools: Bash(git:*)              # åªå…è®¸ git å‘½ä»¤\nallowed-tools: Bash(*)                  # å…è®¸æ‰€æœ‰ bash å‘½ä»¤\nallowed-tools: Bash(git status:*)       # åªå…è®¸ git status\n\n# é€šé…ç¬¦\nallowed-tools: \"*\"                      # å…è®¸æ‰€æœ‰å·¥å…·\n\n# âŒ é”™è¯¯æ ¼å¼\nallowed-tools: Bash                     # ç¼ºå°‘å‘½ä»¤è¿‡æ»¤å™¨\n```\n\n### å‘½ä»¤ä¸­æ‰§è¡Œ Bash\n\nä½¿ç”¨ `!` å‰ç¼€æ‰§è¡Œ bash å‘½ä»¤ï¼Œè¾“å‡ºä¼šåŒ…å«åœ¨å‘½ä»¤ä¸Šä¸‹æ–‡ä¸­ï¼š\n\n```markdown\n---\ndescription: åˆ†æä»£ç è´¨é‡\nallowed-tools: Bash(node:*)\n---\n\nåˆ†æç»“æœ: !`node ${CLAUDE_PLUGIN_ROOT}/scripts/analyze.js $1`\n```\n\n### ç¯å¢ƒå˜é‡\n\n- `${CLAUDE_PLUGIN_ROOT}`: æ’ä»¶ç›®å½•çš„ç»å¯¹è·¯å¾„\n- `${CLAUDE_PROJECT_DIR}`: é¡¹ç›®ç›®å½•è·¯å¾„ï¼ˆä»…åœ¨ hook ä¸­å¯ç”¨ï¼‰\n\n### Hook é…ç½®\n\nhooks.json ç»“æ„ï¼š\n\n```json\n{\n  \"hooks\": {\n    \"Stop\": [\n      {\n        \"hooks\": [\n          {\n            \"type\": \"command\",\n            \"command\": \"${CLAUDE_PLUGIN_ROOT}/hooks/stop-hook.sh\"\n          }\n        ]\n      }\n    ]\n  }\n}\n```\n\næ”¯æŒçš„ Hook äº‹ä»¶ï¼š\n- `PreToolUse`: å·¥å…·è°ƒç”¨å‰\n- `PostToolUse`: å·¥å…·è°ƒç”¨å\n- `UserPromptSubmit`: ç”¨æˆ·æäº¤ prompt æ—¶\n- `Stop`: ä¸» agent å®Œæˆå“åº”æ—¶\n- `SubagentStop`: å­ agent å®Œæˆæ—¶\n- `SessionStart`: ä¼šè¯å¼€å§‹æ—¶\n- `SessionEnd`: ä¼šè¯ç»“æŸæ—¶\n\n### Stop Hook è¾“å‡ºæ ¼å¼\n\nv8 é‡‡ç”¨ `systemMessage` åˆ†ç¦»è¿­ä»£ä¿¡æ¯ï¼Œæ”¯æŒä¼˜é›…é€€å‡ºï¼š\n\n**é˜»æ­¢é€€å‡º**ï¼š\n```json\n{\n  \"decision\": \"block\",\n  \"reason\": \"åŸå§‹ promptï¼ˆçº¯å‡€ï¼‰\",\n  \"systemMessage\": \"ğŸ”„ SoloLoop è¿­ä»£ 2/10 | è¿›åº¦: 3/5 (60%) | ç­‰å¾…å®Œæˆæ ‡è®°\"\n}\n```\n\n**å…è®¸é€€å‡º**ï¼š\n```json\n{\n  \"decision\": \"allow\",\n  \"continue\": false,\n  \"stopReason\": \"âœ… SoloLoop å®Œæˆï¼šPromise åŒ¹é…æˆåŠŸ\"\n}\n```\n\n### Marketplace é…ç½®\n\n.claude-plugin/marketplace.jsonï¼š\n\n```json\n{\n  \"$schema\": \"https://anthropic.com/claude-code/marketplace.schema.json\",\n  \"name\": \"marketplace-name\",\n  \"description\": \"Marketplace æè¿°\",\n  \"owner\": {\n    \"name\": \"Owner Name\",\n    \"email\": \"email@example.com\"\n  },\n  \"plugins\": [\n    {\n      \"name\": \"plugin-name\",\n      \"description\": \"æ’ä»¶æè¿°\",\n      \"category\": \"productivity\",\n      \"source\": \"./\",\n      \"homepage\": \"https://github.com/user/plugin\",\n      \"tags\": [\"tag1\", \"tag2\"]\n    }\n  ]\n}\n```\n\n### æ’ä»¶å®‰è£…ä½œç”¨åŸŸ\n\n| ä½œç”¨åŸŸ | é…ç½®æ–‡ä»¶ | ç”¨é€” |\n|--------|----------|------|\n| user | ~/.claude/settings.json | ä¸ªäººæ’ä»¶ï¼Œè·¨é¡¹ç›®å¯ç”¨ï¼ˆé»˜è®¤ï¼‰ |\n| project | .claude/settings.json | å›¢é˜Ÿæ’ä»¶ï¼Œé€šè¿‡ç‰ˆæœ¬æ§åˆ¶å…±äº« |\n| local | .claude/settings.local.json | é¡¹ç›®ç‰¹å®šï¼Œgitignore |\n\n### CLI å‘½ä»¤\n\n```bash\n# å®‰è£…æ’ä»¶\nclaude plugin install <plugin>@<marketplace> [--scope user|project|local]\n\n# å¸è½½æ’ä»¶\nclaude plugin uninstall <plugin> [--scope user|project|local]\n\n# å¯ç”¨/ç¦ç”¨æ’ä»¶\nclaude plugin enable <plugin>\nclaude plugin disable <plugin>\n\n# æ›´æ–°æ’ä»¶\nclaude plugin update <plugin>\n```\n\n### è°ƒè¯•\n\n```bash\n# æŸ¥çœ‹æ’ä»¶åŠ è½½è¯¦æƒ…\nclaude --debug\n\n# ç›´æ¥åŠ è½½æœ¬åœ°æ’ä»¶ç›®å½•\nclaude --plugin-dir /path/to/plugin\n```\n\n### å¸¸è§é—®é¢˜\n\n| é—®é¢˜ | åŸå›  | è§£å†³æ–¹æ¡ˆ |\n|------|------|----------|\n| æ’ä»¶æœªåŠ è½½ | plugin.json æ— æ•ˆ | éªŒè¯ JSON è¯­æ³• |\n| å‘½ä»¤ä¸æ˜¾ç¤º | ç›®å½•ç»“æ„é”™è¯¯ | ç¡®ä¿ commands/ åœ¨æ’ä»¶æ ¹ç›®å½• |\n| Hook ä¸è§¦å‘ | è„šæœ¬ä¸å¯æ‰§è¡Œ | è¿è¡Œ `chmod +x script.sh` |\n| MCP æœåŠ¡å™¨å¤±è´¥ | è·¯å¾„é”™è¯¯ | ä½¿ç”¨ `${CLAUDE_PLUGIN_ROOT}` |\n| è·¯å¾„é”™è¯¯ | ä½¿ç”¨ç»å¯¹è·¯å¾„ | æ‰€æœ‰è·¯å¾„å¿…é¡»ç›¸å¯¹ä¸”ä»¥ `./` å¼€å¤´ |\n\n---\n\n## ç‰ˆæœ¬å†å²\n\n| ç‰ˆæœ¬ | ä¸»è¦ç‰¹æ€§ |\n|------|----------|\n| v9.0.0 | ç›®æ ‡è®°å¿†æœºåˆ¶ï¼ˆPlanMemï¼‰ï¼šè‡ªåŠ¨åˆå§‹åŒ–ã€å‘¨æœŸæ€§é‡é”šã€æ¼‚ç§»æ£€æµ‹ã€å†³ç­–è®°å½•ã€çŠ¶æ€æ˜¾ç¤º |\n| v8.0.0 | æ’ä»¶åŒ…è£…å™¨æ¨¡å¼ã€ä¼šè¯æ¢å¤æ£€æµ‹ã€é‡å¤å¤±è´¥æ£€æµ‹ã€ä½¿ç”¨ç»Ÿè®¡è¿½è¸ªã€ä¼˜é›…é€€å‡ºå¢å¼º |\n| v7.0.0 | ä¿®å¤ hooks.json æ ¼å¼ç¬¦åˆå®˜æ–¹è§„èŒƒã€ç§»é™¤ OpenSpec é»˜è®¤ Promiseã€Stop Hook æ­£å¸¸è§¦å‘ |\n| v6.0.0 | Promise é©±åŠ¨é€€å‡ºã€`+` è§¦å‘ç¬¦åˆ—å‡ºå˜æ›´ã€é»˜è®¤ Promise ä¸º DONEã€ç§»é™¤å¤é€‰æ¡†è‡ªåŠ¨é€€å‡º |\n| v5.0.0 | æ¶æ„é‡æ„ï¼šèŒè´£åˆ†ç¦»ã€ç§»é™¤ `--plan`/`--spec`ã€æ–°å¢ `/sololoop:openspec` æ¡¥æ¥ã€systemMessage åˆ†ç¦»è¿­ä»£ä¿¡æ¯ |\n| v4.0.0 | è§„æ ¼é©±åŠ¨è§„åˆ’ï¼šå¢å¼º Spec æ¨¡æ¿ã€`--spec` ä¸¥æ ¼æ¨¡å¼ã€é€€å‡ºæ¡ä»¶ä¼˜å…ˆçº§ä¼˜åŒ–ã€`/sololoop:update-spec` å‘½ä»¤ |\n| v3.0.0 | ä¸­æ–­æ¢å¤æœºåˆ¶ã€`.sololoop/` ç›®å½•ç»“æ„ã€ä¸¥æ ¼é€€å‡ºæ¡ä»¶ã€ä¸­æ–­è®¡æ•°è·Ÿè¸ª |\n| v2.0.0 | è§„åˆ’æ–‡ä»¶æ¨¡å¼ (`--plan`)ã€å¤é€‰æ¡†è¿›åº¦è·Ÿè¸ªã€task_plan.md/notes.md/deliverable.md |\n| v1.0.0 | åŸºç¡€è¿­ä»£å¾ªç¯ã€Stop Hook æœºåˆ¶ã€`--max` å’Œ `--promise` å‚æ•° |\n\n### v9 è¿ç§»æŒ‡å—\n\nä» v8 è¿ç§»åˆ° v9ï¼š\n\n1. **æ–°å¢å‘½ä»¤**ï¼š\n   - `/sololoop:init` - æ‰‹åŠ¨åˆå§‹åŒ–ç›®æ ‡è®°å¿†ç›®å½•\n   - `/sololoop:log` - æ·»åŠ å†³ç­–è®°å½•\n   - `/sololoop:show-log` - æŸ¥çœ‹å†³ç­–å†å²\n   - `/sololoop:status` - æŸ¥çœ‹ç›®æ ‡è®°å¿†çŠ¶æ€\n\n2. **ç›®æ ‡è®°å¿†ç›®å½•**ï¼šé¦–æ¬¡ä½¿ç”¨ `/sololoop` æ—¶è‡ªåŠ¨åˆ›å»º `.sololoop/` ç›®å½•\n\n3. **çŠ¶æ€æ–‡ä»¶æ‰©å±•**ï¼šæ–°å¢ `goal_memory_enabled`ã€`iteration_since_anchor`ã€`anchor_interval`ã€`drift_warning_count`ã€`total_anchors`ã€`last_activity_timestamp` å­—æ®µ\n\n4. **Hook å¢å¼º**ï¼š\n   - SessionStart Hook è‡ªåŠ¨æ³¨å…¥ç›®æ ‡æ–‡ä»¶å†…å®¹\n   - Stop Hook æ”¯æŒå‘¨æœŸæ€§é‡é”šå’Œæ¼‚ç§»æ£€æµ‹\n\n5. **å‘åå…¼å®¹**ï¼šæ‰€æœ‰ v8 åŠŸèƒ½ä¿æŒä¸å˜ï¼Œæ—  `.sololoop/` ç›®å½•æ—¶è¡Œä¸ºä¸ v8 ä¸€è‡´\n\n### v8 è¿ç§»æŒ‡å—\n\nä» v7 è¿ç§»åˆ° v8ï¼š\n\n1. **æ–°å¢å‘½ä»¤**ï¼š\n   - `/sololoop:wrap` - åŒ…è£…ä»»æ„æ’ä»¶å‘½ä»¤ä½¿å…¶å…·æœ‰å¾ªç¯èƒ½åŠ›\n   - `/sololoop:stats` - æŸ¥çœ‹ä½¿ç”¨ç»Ÿè®¡\n\n2. **æ–°å¢ Hook**ï¼šSessionStart Hook è‡ªåŠ¨æ£€æµ‹æœªå®Œæˆçš„å¾ªç¯\n\n3. **çŠ¶æ€æ–‡ä»¶æ‰©å±•**ï¼šæ–°å¢ `wrap_mode`ã€`wrapped_command`ã€`same_error_count`ã€`last_error`ã€`session_id` å­—æ®µ\n\n4. **ç»Ÿè®¡æ–‡ä»¶**ï¼šä½¿ç”¨ç»Ÿè®¡å­˜å‚¨åœ¨ `~/.claude/sololoop/stats.json`\n\n5. **å‘åå…¼å®¹**ï¼šæ‰€æœ‰ v7 åŠŸèƒ½ä¿æŒä¸å˜\n\n### v7 è¿ç§»æŒ‡å—\n\nä» v6 è¿ç§»åˆ° v7ï¼š\n\n1. **hooks.json æ ¼å¼å˜æ›´**ï¼šv7 ä½¿ç”¨å®˜æ–¹è§„èŒƒçš„åµŒå¥—å¯¹è±¡æ ¼å¼ï¼ŒStop Hook ç°åœ¨èƒ½æ­£ç¡®è§¦å‘\n2. **OpenSpec é»˜è®¤ Promise ç§»é™¤**ï¼šä¸å†è‡ªåŠ¨è®¾ç½® `COMPLETION_PROMISE=\"DONE\"`ï¼Œéœ€è¦æ˜¾å¼ä½¿ç”¨ `--promise` å‚æ•°\n\n### v6 è¿ç§»æŒ‡å—\n\nä» v5 è¿ç§»åˆ° v6ï¼š\n\n1. **é€€å‡ºè¡Œä¸ºå˜æ›´**ï¼šå¤é€‰æ¡† 100% å®Œæˆä¸å†è‡ªåŠ¨é€€å‡ºï¼Œéœ€è¦ Claude è¾“å‡º `<promise>DONE</promise>`\n2. **é»˜è®¤ Promise**ï¼šv6 é»˜è®¤ä½¿ç”¨ `DONE` ä½œä¸ºå®Œæˆæ ‡è®°ï¼Œæ— éœ€æ‰‹åŠ¨æŒ‡å®š `--promise`\n3. **æ–°åŠŸèƒ½**ï¼šä½¿ç”¨ `/sololoop:openspec +` å¿«é€ŸæŸ¥çœ‹å¯ç”¨å˜æ›´\n\n### v5 è¿ç§»æŒ‡å—\n\nä» v4 è¿ç§»åˆ° v5ï¼š\n\n1. **ç§»é™¤ `.sololoop/` ç›®å½•**ï¼šv5 ä¸å†ä½¿ç”¨æ­¤ç›®å½•\n2. **å®‰è£… OpenSpec**ï¼šå¦‚éœ€è§„æ ¼é©±åŠ¨å¼€å‘ï¼Œè¯·å®‰è£… OpenSpec\n3. **æ›´æ–°å‘½ä»¤**ï¼š\n   - `--plan` â†’ `/sololoop:openspec <change-name>`\n   - `--spec` â†’ `/sololoop:openspec <change-name>`\n4. **çº¯å¾ªç¯æ¨¡å¼**ï¼šç»§ç»­ä½¿ç”¨ `/sololoop:sololoop \"prompt\" --max N`\n\n---\n\n## å‚è€ƒé“¾æ¥\n\n- [Claude Code Plugins æ–‡æ¡£](https://code.claude.com/docs/en/plugins)\n- [Plugins Reference](https://code.claude.com/docs/en/plugins-reference)\n- [Slash Commands](https://code.claude.com/docs/en/slash-commands)\n- [Hooks Reference](https://code.claude.com/docs/en/hooks)\n- [Plugin Marketplaces](https://code.claude.com/docs/en/plugin-marketplaces)\n- [Ralph Wiggum åŸå§‹æŠ€æœ¯](https://ghuntley.com/ralph/)\n\n## License\n\nMIT\n"
      },
      "plugins": [
        {
          "name": "sololoop",
          "description": "ç®€åŒ–ç‰ˆè¿­ä»£å¾ªç¯æ’ä»¶ - è®© Claude åœ¨åŒä¸€ä»»åŠ¡ä¸ŠæŒç»­è¿­ä»£ç›´åˆ°å®Œæˆ",
          "category": "productivity",
          "source": "./",
          "homepage": "https://github.com/maxlee/sololoop",
          "tags": [
            "loop",
            "iteration",
            "automation",
            "ralph-wiggum"
          ],
          "categories": [
            "automation",
            "iteration",
            "loop",
            "productivity",
            "ralph-wiggum"
          ],
          "install_commands": [
            "/plugin marketplace add maxlee/sololoop",
            "/plugin install sololoop@sololoop-marketplace"
          ]
        }
      ]
    }
  ]
}