{
  "author": {
    "id": "MobAI-App",
    "display_name": "MobAI-App",
    "avatar_url": "https://avatars.githubusercontent.com/u/253323700?u=6ff7dc3662eb2a74af02c04e88ddcc0e0b84db22&v=4"
  },
  "marketplaces": [
    {
      "name": "mobai-marketplace",
      "version": null,
      "description": "Official marketplace for MobAI Claude Code plugins",
      "repo_full_name": "MobAI-App/mobai-marketplace",
      "repo_url": "https://github.com/MobAI-App/mobai-marketplace",
      "repo_description": null,
      "signals": {
        "stars": 5,
        "forks": 2,
        "pushed_at": "2026-02-01T13:25:08Z"
      },
      "files": {
        ".claude-plugin/marketplace.json": "{\n  \"name\": \"mobai-marketplace\",\n  \"owner\": {\n    \"name\": \"MobAI\",\n    \"email\": \"contact@mobai.run\"\n  },\n  \"metadata\": {\n    \"description\": \"Official marketplace for MobAI Claude Code plugins\"\n  },\n  \"plugins\": [\n    {\n      \"name\": \"mobai\",\n      \"source\": \"./plugins/mobai\",\n      \"description\": \"Control Android and iOS devices, emulators, and simulators through MobAI HTTP API\",\n      \"version\": \"1.2.0\",\n      \"author\": {\n        \"name\": \"MobAI\",\n        \"email\": \"contact@mobai.run\",\n        \"url\": \"https://mobai.run\"\n      },\n      \"repository\": \"https://github.com/MobAI-App/mobai-marketplace\",\n      \"license\": \"Apache-2.0\",\n      \"keywords\": [\"mobile\", \"automation\", \"android\", \"ios\", \"device-control\", \"emulator\", \"simulator\", \"ai-agent\"]\n    }\n  ]\n}\n",
        "README.md": "# MobAI Marketplace\n\n[![License](https://img.shields.io/badge/License-Apache%202.0-blue.svg)](https://opensource.org/licenses/Apache-2.0)\n\nOfficial plugin marketplace for [MobAI](https://mobai.run) - AI-powered mobile device automation. This repository contains Claude Code plugins for controlling Android and iOS devices.\n\n## Available Plugins\n\n| Plugin | Description |\n|--------|-------------|\n| [mobai](plugins/mobai/) | Control Android/iOS devices, emulators, and simulators |\n\n## Installation\n\n### Add Marketplace\n\n```bash\n# From GitHub\n/plugin marketplace add MobAI-App/mobai-marketplace\n\n# Or from local clone\ngit clone https://github.com/MobAI-App/mobai-marketplace.git\n/plugin marketplace add ./mobai-marketplace\n```\n\n### Install Plugin\n\n```bash\n/plugin install mobai@mobai-marketplace\n```\n\n## Quick Start\n\n### 1. Install Claude Code\n\nDownload and install [Claude Code CLI](https://claude.ai/code).\n\n### 2. Install MobAI Desktop App\n\nDownload [MobAI](https://mobai.run) and ensure it's running (provides HTTP API on port 8686).\n\n### 3. Add Marketplace and Install Plugin\n\n```bash\n/plugin marketplace add MobAI-App/mobai-marketplace\n/plugin install mobai@mobai-marketplace\n```\n\n### 4. Connect a Device\n\nConnect an Android/iOS device via USB, or start an emulator/simulator.\n\n### 5. Start Automating\n\n```\n/devices           # List connected devices\n/screenshot ABC123 # Take a screenshot\n/agent ABC123 Open Settings and enable WiFi\n```\n\n## Repository Structure\n\n```\nmobai-marketplace/\n├── .claude-plugin/\n│   └── marketplace.json    # Marketplace catalog\n├── plugins/\n│   └── mobai/              # MobAI device control plugin\n│       ├── .claude-plugin/\n│       ├── commands/\n│       ├── skills/\n│       └── mcp/\n├── LICENSE\n└── README.md\n```\n\n## For Other AI Tools\n\nThis marketplace is for Claude Code. For other AI tools (Cursor, Windsurf, Cline), use the standalone MCP server:\n\n- **MCP Server**: [mobai-mcp](https://github.com/MobAI-App/mobai-mcp)\n\n## Contributing\n\nWe welcome contributions! To add a new plugin:\n\n1. Fork this repository\n2. Create your plugin in `plugins/your-plugin-name/`\n3. Add plugin entry to `.claude-plugin/marketplace.json`\n4. Submit a pull request\n\n## License\n\nApache 2.0 - see [LICENSE](LICENSE) for details.\n\n## Links\n\n- [MobAI Website](https://mobai.run)\n- [MobAI MCP Server](https://github.com/MobAI-App/mobai-mcp)\n- [Claude Code Documentation](https://claude.ai/code)\n",
        "plugins/mobai/README.md": "# MobAI Claude Code Plugin\n\n[![License](https://img.shields.io/badge/License-Apache%202.0-blue.svg)](https://opensource.org/licenses/Apache-2.0)\n\n[Claude Code](https://claude.ai/code) plugin for [MobAI](https://mobai.run) - AI-powered mobile device automation. This plugin enables Claude Code to control Android and iOS devices, emulators, and simulators through natural language commands.\n\n## Features\n\n- **Device Control**: List, connect, and manage Android/iOS devices\n- **Native App Automation**: Tap, type, swipe using accessibility tree\n- **Web Automation**: Control Safari/Chrome with CSS selectors\n- **DSL Batch Execution**: Execute multiple automation steps efficiently\n- **AI Agent**: Run autonomous agents to complete complex tasks\n\n## Prerequisites\n\n- [Claude Code CLI](https://claude.ai/code)\n- [MobAI desktop app](https://mobai.run) running locally (provides the HTTP API on port 8686)\n- Connected Android or iOS device (or emulator/simulator)\n\n## Installation\n\n### Install from Marketplace\n\n```bash\n# Add marketplace first\n/plugin marketplace add MobAI-App/mobai-marketplace\n\n# Install the plugin\n/plugin install mobai@mobai-marketplace\n```\n\n### Install from Local Clone\n\n```bash\ngit clone https://github.com/MobAI-App/mobai-marketplace.git\n/plugin marketplace add ./mobai-marketplace\n/plugin install mobai@mobai-marketplace\n```\n\n## Available Skills\n\n### mobai\nMain skill for device control. Use when interacting with mobile devices, taking screenshots, tapping elements, etc.\n\n### native-runner\nSpecialized sub-agent for native UI automation. Use for automating native apps like Settings, Mail, Instagram using element predicates and the DSL batch execution system.\n\n### web-runner\nSpecialized sub-agent for web automation. Use for automating Safari, Chrome, and WebViews using CSS selectors, DOM inspection, and JavaScript execution.\n\n## Available Commands\n\n### /devices\nList all connected Android and iOS devices.\n\n### /screenshot [device_id]\nCapture a screenshot from a device.\n\n### /agent <device_id> <task>\nRun an AI agent to perform a task on the device.\n\n## Example Usage\n\n### List devices\n```\n/devices\n```\n\n### Take screenshot\n```\n/screenshot ABC123\n```\n\n### Run agent task\n```\n/agent ABC123 Open Settings and enable WiFi\n```\n\n### Use native-runner for automation\n```\nUse the native-runner skill to: Open the Settings app and navigate to Privacy settings\nDevice ID: ABC123\n```\n\n### Use web-runner for web automation\n```\nUse the web-runner skill to: Navigate to example.com and fill in the login form\nDevice ID: ABC123\n```\n\n## Plugin Structure\n\n```\nplugins/mobai/\n├── .claude-plugin/\n│   └── plugin.json          # Plugin manifest\n├── .mcp.json                 # MCP server configuration\n├── commands/\n│   ├── devices.md           # /devices command\n│   ├── screenshot.md        # /screenshot command\n│   └── agent.md             # /agent command\n├── skills/\n│   ├── mobai/\n│   │   ├── SKILL.md         # Main MobAI skill\n│   │   ├── api-reference.md # API documentation\n│   │   └── examples.md      # Usage examples\n│   ├── native-runner/\n│   │   └── SKILL.md         # Native app automation\n│   └── web-runner/\n│       └── SKILL.md         # Web automation\n├── mcp/                     # Bundled MCP server\n│   ├── src/index.ts\n│   ├── package.json\n│   └── dist/\n└── README.md\n```\n\n## How It Works\n\nThe plugin provides:\n\n1. **MCP Server** - HTTP request tool for calling MobAI API\n2. **Skills** - Prompt-based guides for automation patterns\n3. **Commands** - Quick actions for common operations\n\nAll automation goes through the MobAI desktop app's HTTP API running on `http://127.0.0.1:8686`.\n\n## Comparison with MCP Server\n\n| Feature | Claude Code Plugin | MCP Server |\n|---------|-------------------|------------|\n| Platform | Claude Code only | Any MCP client |\n| Tools | http_request (generic) | Named tools + http_request |\n| Resources | Skills (markdown) | MCP resources |\n| Setup | Plugin install | npx config |\n\nUse this plugin for Claude Code. For other AI tools (Cursor, Windsurf, Cline), use [mobai-mcp](https://github.com/MobAI-App/mobai-mcp).\n\n## Troubleshooting\n\n### \"Connection refused\" error\n- Ensure MobAI desktop app is running\n- Check that API is available at http://127.0.0.1:8686\n\n### \"Bridge not running\" error\n- Start the bridge first using the API or the native-runner skill\n- iOS bridge may take up to 60 seconds to start\n\n### Screenshots not visible\n- Screenshots are saved to `/tmp/mobai/screenshots/`\n- Use the Read tool to view them\n\n## Development\n\n```bash\n# Clone the marketplace\ngit clone https://github.com/MobAI-App/mobai-marketplace.git\ncd mobai-marketplace/plugins/mobai\n\n# Build MCP server\ncd mcp\nnpm install\nnpm run build\ncd ..\n\n# Install plugin locally\nclaude plugins add .\n```\n\n## License\n\nApache 2.0 - see [LICENSE](../../LICENSE) for details.\n"
      },
      "plugins": [
        {
          "name": "mobai",
          "source": "./plugins/mobai",
          "description": "Control Android and iOS devices, emulators, and simulators through MobAI HTTP API",
          "version": "1.2.0",
          "author": {
            "name": "MobAI",
            "email": "contact@mobai.run",
            "url": "https://mobai.run"
          },
          "repository": "https://github.com/MobAI-App/mobai-marketplace",
          "license": "Apache-2.0",
          "keywords": [
            "mobile",
            "automation",
            "android",
            "ios",
            "device-control",
            "emulator",
            "simulator",
            "ai-agent"
          ],
          "categories": [
            "ai-agent",
            "android",
            "automation",
            "device-control",
            "emulator",
            "ios",
            "mobile",
            "simulator"
          ],
          "install_commands": [
            "/plugin marketplace add MobAI-App/mobai-marketplace",
            "/plugin install mobai@mobai-marketplace"
          ]
        }
      ]
    }
  ]
}