{
  "author": {
    "id": "Montinou",
    "display_name": "Agustin Montoya",
    "avatar_url": "https://avatars.githubusercontent.com/u/33442778?v=4"
  },
  "marketplaces": [
    {
      "name": "quolar-marketplace",
      "version": null,
      "description": "Quolar AI Test Automation Plugin Marketplace",
      "repo_full_name": "Montinou/quolar",
      "repo_url": "https://github.com/Montinou/quolar",
      "repo_description": "Quolar - AI-Powered Test Automation Workflow Engine for Claude Code",
      "signals": {
        "stars": 0,
        "forks": 0,
        "pushed_at": "2026-01-23T01:39:58Z"
      },
      "files": {
        ".claude-plugin/marketplace.json": "{\n  \"name\": \"quolar-marketplace\",\n  \"owner\": {\n    \"name\": \"Montinou\"\n  },\n  \"metadata\": {\n    \"description\": \"Quolar AI Test Automation Plugin Marketplace\",\n    \"version\": \"1.0.0\"\n  },\n  \"plugins\": [\n    {\n      \"name\": \"quolar\",\n      \"source\": {\n        \"source\": \"github\",\n        \"repo\": \"Montinou/quolar\"\n      },\n      \"description\": \"AI-Powered Test Automation - Convert Linear tickets into self-healing Playwright E2E tests with automatic PR creation, CI integration, and Quoth documentation compliance\",\n      \"version\": \"0.2.0\",\n      \"homepage\": \"https://github.com/Montinou/quolar\",\n      \"repository\": \"https://github.com/Montinou/quolar\",\n      \"license\": \"MIT\",\n      \"keywords\": [\n        \"testing\",\n        \"automation\",\n        \"playwright\",\n        \"linear\",\n        \"e2e\",\n        \"self-healing\",\n        \"test-generation\",\n        \"ci-cd\",\n        \"mcp\",\n        \"quoth\"\n      ],\n      \"category\": \"testing\"\n    }\n  ]\n}\n",
        ".claude-plugin/plugin.json": "{\n  \"name\": \"quolar\",\n  \"version\": \"0.2.0\",\n  \"description\": \"AI-Powered Test Automation - Convert Linear tickets into self-healing Playwright E2E tests with automatic PR creation and CI integration\",\n  \"author\": {\n    \"name\": \"Montinou\",\n    \"url\": \"https://github.com/Montinou\"\n  },\n  \"homepage\": \"https://github.com/Montinou/quolar\",\n  \"repository\": \"https://github.com/Montinou/quolar\",\n  \"license\": \"MIT\",\n  \"keywords\": [\n    \"testing\",\n    \"automation\",\n    \"playwright\",\n    \"e2e\",\n    \"linear\",\n    \"self-healing\",\n    \"test-generation\",\n    \"ci-cd\",\n    \"mcp\"\n  ]\n}\n",
        "README.md": "# Quolar\n\nAI-Powered Test Automation Workflow Engine for Claude Code.\n\nQuolar orchestrates the end-to-end process of converting Linear tickets into fully automated, self-healing Playwright E2E tests.\n\n## Installation\n\n### Via Claude Code Plugin (Recommended)\n\n```bash\n# Add the Quolar marketplace\n/plugin marketplace add Montinou/quolar\n\n# Install the plugin\n/plugin install quolar@quolar-marketplace\n```\n\n### Manual Installation\n\n```bash\n# Clone to your Claude Code skills directory\nmkdir -p ~/.claude/skills\ncd ~/.claude/skills\ngit clone https://github.com/Montinou/quolar.git\n\n# Reload Claude Code\nclaude-code reload\n```\n\n## Usage\n\n```bash\n# Start Claude Code\nclaude-code\n\n# Run the workflow with a ticket ID\n/test-ticket ENG-123\n\n# Dry run (generate tests without executing)\n/test-ticket ENG-456 --dry-run\n\n# Skip PR creation\n/test-ticket ENG-789 --skip-pr\n```\n\n## What It Does\n\n1. **Reads your Linear ticket** - Extracts requirements and acceptance criteria\n2. **Searches for patterns** - Finds similar tests in your codebase\n3. **Plans test scenarios** - Generates comprehensive test plan\n4. **Writes Playwright tests** - Creates tests following your project's conventions\n5. **Executes with auto-healing** - Runs tests up to 3 times, fixing failures automatically\n6. **Integrates with CI** - Updates GitHub Actions configuration\n7. **Creates PR** - Opens pull request linked to the ticket\n\n## Prerequisites\n\n### Required MCP Servers\n- **linear** - For fetching ticket details\n\n### Optional MCP Servers (Enhanced Features)\n- **quoth** - For documentation pattern search\n- **exolar** - For test analytics and failure classification\n\n## Configuration\n\nCreate `quolar.config.ts` in your project root:\n\n```typescript\nimport { defineConfig } from '@quolar/core'\n\nexport default defineConfig({\n  testFramework: {\n    provider: 'playwright',\n    config: './playwright.config.ts',\n    testDir: './tests',\n  },\n  tickets: {\n    provider: 'linear',\n    workspace: 'your-workspace',\n  },\n  documentation: {\n    provider: 'quoth',  // optional\n  },\n  analytics: {\n    provider: 'exolar',  // optional\n  },\n})\n```\n\n## Architecture\n\n```\n┌─────────────────────────────────────────────────────────────┐\n│                    WORKFLOW ORCHESTRATOR                     │\n│  ┌─────────────┬────────────────┬─────────────────────────┐ │\n│  │ Analysis    │ Generation     │ Validation              │ │\n│  │ Layer       │ Layer          │ Layer                   │ │\n│  └─────────────┴────────────────┴─────────────────────────┘ │\n└─────────────────────────────────────────────────────────────┘\n                              ↓\n┌─────────────────────────────────────────────────────────────┐\n│               PROVIDER ABSTRACTION LAYER                     │\n│  ┌────────────────┐ ┌────────────────┐ ┌─────────────────┐  │\n│  │ TicketProvider │ │ DocsProvider   │ │ AnalyticsProvider│  │\n│  └────────────────┘ └────────────────┘ └─────────────────┘  │\n│  ┌────────────────┐ ┌────────────────┐                      │\n│  │ VCSProvider    │ │ TestFramework  │                      │\n│  │                │ │ Provider       │                      │\n│  └────────────────┘ └────────────────┘                      │\n└─────────────────────────────────────────────────────────────┘\n                              ↓\n┌─────────────────────────────────────────────────────────────┐\n│                   MCP ADAPTER LAYER                          │\n│  ┌─────────┐ ┌─────────┐ ┌─────────┐ ┌─────────┐ ┌───────┐  │\n│  │ Linear  │ │ Quoth   │ │ Exolar  │ │ GitHub  │ │Playw. │  │\n│  │ Adapter │ │ Adapter │ │ Adapter │ │ Adapter │ │Adapter│  │\n│  └─────────┘ └─────────┘ └─────────┘ └─────────┘ └───────┘  │\n└─────────────────────────────────────────────────────────────┘\n```\n\n## Packages\n\n| Package | Description |\n|---------|-------------|\n| `@quolar/core` | Workflow orchestrator, provider interfaces, configuration |\n| `@quolar/provider-linear` | Linear ticket management adapter |\n| `@quolar/provider-github` | GitHub VCS adapter |\n| `@quolar/provider-playwright` | Playwright test framework adapter |\n| `@quolar/provider-quoth` | Quoth documentation adapter |\n| `@quolar/provider-exolar` | Exolar analytics adapter |\n\n## Default Stack\n\n| Provider Type | Default | Alternatives |\n|---------------|---------|--------------|\n| Tickets | Linear | Jira, GitHub Issues |\n| Documentation | Quoth | Confluence, Notion |\n| Analytics | Exolar | DataDog, Allure |\n| VCS | GitHub | GitLab, Bitbucket |\n| Test Framework | Playwright | Vitest, Cypress |\n\n## Development\n\n```bash\n# Install dependencies\npnpm install\n\n# Build all packages\npnpm build\n\n# Run tests\npnpm test\n```\n\n## Documentation\n\nSee the [docs/](./docs/) directory for detailed documentation:\n\n- **[Complete Analysis & Documentation](./docs/QUOLAR-COMPLETE-ANALYSIS.md)** - Comprehensive single-source-of-truth documentation covering all aspects of Quolar\n- [Architecture](./docs/automated-testing-workflow/architecture.md)\n- [Installation Guide](./docs/automated-testing-workflow/installation.md)\n- [Usage Guide](./docs/automated-testing-workflow/usage-guide.md)\n- [Workflow Steps](./docs/automated-testing-workflow/workflow-steps.md)\n- [Troubleshooting](./docs/automated-testing-workflow/troubleshooting.md)\n\n## Plugin Structure\n\n```\nquolar/\n├── .claude-plugin/\n│   └── plugin.json          # Plugin manifest\n├── skills/\n│   └── test-ticket/\n│       ├── SKILL.md         # Main skill file\n│       └── reference.md     # Detailed documentation\n├── marketplace.json         # Marketplace catalog\n├── packages/                # Core packages (for programmatic use)\n│   ├── core/\n│   ├── providers/\n│   └── skill/\n└── docs/                    # Full documentation\n```\n\n## License\n\nMIT\n"
      },
      "plugins": [
        {
          "name": "quolar",
          "source": {
            "source": "github",
            "repo": "Montinou/quolar"
          },
          "description": "AI-Powered Test Automation - Convert Linear tickets into self-healing Playwright E2E tests with automatic PR creation, CI integration, and Quoth documentation compliance",
          "version": "0.2.0",
          "homepage": "https://github.com/Montinou/quolar",
          "repository": "https://github.com/Montinou/quolar",
          "license": "MIT",
          "keywords": [
            "testing",
            "automation",
            "playwright",
            "linear",
            "e2e",
            "self-healing",
            "test-generation",
            "ci-cd",
            "mcp",
            "quoth"
          ],
          "category": "testing",
          "categories": [
            "automation",
            "ci-cd",
            "e2e",
            "linear",
            "mcp",
            "playwright",
            "quoth",
            "self-healing",
            "test-generation",
            "testing"
          ],
          "install_commands": [
            "/plugin marketplace add Montinou/quolar",
            "/plugin install quolar@quolar-marketplace"
          ]
        }
      ]
    }
  ]
}