{
  "author": {
    "id": "mpuig",
    "display_name": "Marc Puig",
    "avatar_url": "https://avatars.githubusercontent.com/u/231605?v=4"
  },
  "marketplaces": [
    {
      "name": "threads-marketplace",
      "version": null,
      "description": "Local marketplace for Agent Threads plugin development",
      "repo_full_name": "mpuig/threads",
      "repo_url": "https://github.com/mpuig/threads",
      "repo_description": "Claude Code plugin that lets you persist your coding sessions to GitHub Gists, enabling you to save, list, and restore session context across different Claude Code sessions.",
      "signals": {
        "stars": 2,
        "forks": 0,
        "pushed_at": "2025-12-06T09:01:05Z"
      },
      "files": {
        ".claude-plugin/marketplace.json": "{\n  \"name\": \"threads-marketplace\",\n  \"description\": \"Local marketplace for Agent Threads plugin development\",\n  \"owner\": {\n    \"name\": \"Marc Puig\"\n  },\n  \"plugins\": [\n    {\n      \"name\": \"threads\",\n      \"source\": \"./\",\n      \"description\": \"Save and manage Claude Code sessions as GitHub Gists\"\n    }\n  ]\n}\n",
        ".claude-plugin/plugin.json": "{\n  \"name\": \"threads\",\n  \"version\": \"0.1.0\",\n  \"description\": \"Save and manage Claude Code sessions as GitHub Gists\",\n  \"author\": {\n    \"name\": \"Marc Puig\"\n  },\n  \"license\": \"MIT\",\n  \"repository\": \"github.com/mpuig/threads\",\n  \"keywords\": [\n    \"threads\",\n    \"gist\",\n    \"sessions\",\n    \"persistence\",\n    \"context\",\n    \"ai-workflow\",\n    \"agent-memory\"\n  ],\n  \"hooks\": {\n    \"SessionStart\": [\n      {\n        \"matcher\": \"\",\n        \"hooks\": [\n          {\n            \"type\": \"command\",\n            \"command\": \"th prime\"\n          }\n        ]\n      }\n    ]\n  }\n}\n",
        "README.md": "# Threads\n\nSave and manage Claude Code sessions as GitHub Gists.\n\nThreads is a Claude Code plugin that lets you persist your coding sessions to GitHub Gists, enabling you to save, list, and restore session context across different Claude Code sessions.\n\n## Installation\n\n### From Plugin Marketplace\n\n```bash\n/plugin marketplace add mpuig/threads\n/plugin install threads\n```\n\n### From Source (Development)\n\n```bash\ngit clone https://github.com/mpuig/threads\ncd threads\nuv sync\nuv run th --help\n```\n\n## Usage\n\n### Save a Session\n\nSave your current Claude Code session as a GitHub Gist:\n\n```bash\nth save --name \"feature-auth\" --description \"JWT authentication implementation\"\n```\n\nOptions:\n- `--name, -n` - Thread name (auto-generated if not provided)\n- `--description, -d` - Description for the gist\n- `--public` - Make the gist public (default: secret)\n\n### List Saved Threads\n\nView all your saved thread sessions:\n\n```bash\nth list\n```\n\nOptions:\n- `--limit, -l` - Maximum number of threads to show (default: 10)\n- `--filter, -f` - Filter threads by keyword\n- `--json` - Output as JSON\n\n### Load a Thread\n\nRestore a previous session's context:\n\n```bash\nth open <gist-id>\nth open https://gist.github.com/user/abc123def\n```\n\n### Context Injection\n\nThe `th prime` command is automatically run on session start to show available commands and recent threads:\n\n```bash\nth prime\n```\n\n## How It Works\n\n1. **Session Storage**: Claude Code stores session data in `~/.claude/projects/<project>/` as JSONL files\n2. **Conversion**: Threads converts the JSONL session data to readable markdown format\n3. **Persistence**: The markdown is saved as a GitHub Gist with the `[Claude Thread]` prefix\n4. **Restoration**: When loading a thread, the markdown content is output for Claude to ingest\n\n## Requirements\n\n- Python 3.10+\n- GitHub CLI (`gh`) authenticated, or `GITHUB_TOKEN` environment variable\n\n### GitHub Authentication\n\nThreads uses the GitHub API to manage gists. You can authenticate using either:\n\n1. **GitHub CLI (recommended)**:\n   ```bash\n   gh auth login\n   ```\n\n2. **Environment variable**:\n   ```bash\n   export GITHUB_TOKEN=your_token_here\n   ```\n\n## Plugin Configuration\n\nThe plugin automatically configures a `SessionStart` hook to run `th prime` when starting a new Claude Code session.\n\n### Hook Configuration (`.claude-plugin/plugin.json`)\n\n```json\n{\n  \"hooks\": {\n    \"SessionStart\": [\n      {\n        \"hooks\": [\n          {\n            \"type\": \"command\",\n            \"command\": \"th prime\"\n          }\n        ]\n      }\n    ]\n  }\n}\n```\n\n## Local Storage\n\nThreads stores local configuration in `.threads/` directory:\n\n- `config.json` - Local configuration\n- `threads.json` - Index of saved threads for the project\n\n## Troubleshooting\n\n### \"GitHub authentication required\"\n\nThe `gh` CLI is not authenticated or `GITHUB_TOKEN` is not set.\n\n```bash\n# Option 1: Authenticate via gh CLI (recommended)\ngh auth login\n\n# Option 2: Set environment variable\nexport GITHUB_TOKEN=your_personal_access_token\n```\n\nTo create a personal access token, visit [GitHub Settings > Tokens](https://github.com/settings/tokens) and create a token with `gist` scope.\n\n### \"No active session found\"\n\nThis error occurs when Threads cannot find a Claude Code session for the current directory.\n\n**Causes:**\n- You're not in a directory where you've used Claude Code before\n- Claude Code stores sessions in `~/.claude/projects/`, and no matching project exists\n\n**Solution:**\nRun `th save` from within a project directory where you have an active Claude Code session.\n\n### \"No threads found\" when running `th list`\n\nYou haven't saved any threads yet, or your gists don't have the `[Claude Thread]` prefix.\n\n**Solution:**\nSave your first thread with `th save --name \"my-first-thread\"`.\n\n### Thread not loading correctly with `th open`\n\nEnsure you're using a valid gist ID. You can use either:\n- Short ID: `th open abc123def`\n- Full URL: `th open https://gist.github.com/username/abc123def`\n\n## Development\n\n```bash\n# Clone and install\ngit clone https://github.com/mpuig/threads\ncd threads\nuv sync\n\n# Run tests\nuv run pytest\n\n# Run CLI\nuv run th --help\n```\n\nSee [CONTRIBUTING.md](CONTRIBUTING.md) for development guidelines.\n\n## License\n\nMIT\n"
      },
      "plugins": [
        {
          "name": "threads",
          "source": "./",
          "description": "Save and manage Claude Code sessions as GitHub Gists",
          "categories": [],
          "install_commands": [
            "/plugin marketplace add mpuig/threads",
            "/plugin install threads@threads-marketplace"
          ]
        }
      ]
    }
  ]
}