{
  "author": {
    "id": "nickth3man",
    "display_name": "Nicolas Alexander",
    "avatar_url": "https://avatars.githubusercontent.com/u/179685354?v=4"
  },
  "marketplaces": [
    {
      "name": "claude_market",
      "version": null,
      "description": "Claude Code marketplace for PocketFlow and future plugins",
      "repo_full_name": "nickth3man/claude_market",
      "repo_url": "https://github.com/nickth3man/claude_market",
      "repo_description": null,
      "signals": {
        "stars": 0,
        "forks": 0,
        "pushed_at": "2025-10-24T06:38:49Z"
      },
      "files": {
        ".claude-plugin/marketplace.json": "{\n  \"name\": \"claude_market\",\n  \"owner\": { \"name\": \"nickth3man\" },\n  \"metadata\": {\n    \"description\": \"Claude Code marketplace for PocketFlow and future plugins\",\n    \"version\": \"0.1.0\"\n  },\n  \"plugins\": [\n    {\n      \"name\": \"pocketflow\",\n      \"source\": \"./\",\n      \"description\": \"PocketFlow Skill packaged as a plugin\",\n      \"version\": \"0.1.0\",\n      \"category\": \"skills\",\n      \"keywords\": [\"pocketflow\", \"skills\", \"agents\", \"rag\", \"workflow\"]\n    }\n  ]\n}\n",
        ".claude-plugin/plugin.json": "{\n  \"name\": \"pocketflow\",\n  \"version\": \"0.1.0\",\n  \"description\": \"PocketFlow Skill, cookbook examples, and templates for graph-based LLM workflows.\",\n  \"author\": { \"name\": \"claude_market\" },\n  \"keywords\": [\"skill\", \"pocketflow\", \"agents\", \"rag\", \"workflow\"]\n}\n",
        "README.md": "# claude_market\n\nClaude Code plugin marketplace named \"claude_market\" with an included plugin \"pocketflow\" (a Skill + Python examples).\n\n- start_here/marketplace_guide.md — Marketplaces overview and schema\n- start_here/plugins_guide.md — Building and testing plugins\n- start_here/plugins_reference.md — Technical reference (schemas, components)\n- start_here/settings.md — User and repo configuration\n\n## Current repository contents\n\n```\nclaude_market/\n├── .claude-plugin/\n│   ├── marketplace.json        # Marketplace (name: \"claude_market\")\n│   └── plugin.json             # Plugin manifest (name: \"pocketflow\")\n├── start_here/\n│   ├── marketplace_guide.md\n│   ├── plugins_guide.md\n│   ├── plugins_reference.md\n│   └── settings.md\n├── skills/\n│   └── pocketflow/\n│       ├── SKILL.md\n│       ├── assets/\n│       │   ├── COOKBOOK_GUIDE.md\n│       │   ├── common_patterns.py\n│       │   ├── examples/\n│       │   │   ├── 01_chat.py\n│       │   │   ├── 02_workflow.py\n│       │   │   ├── 03_agent.py\n│       │   │   ├── 04_rag.py\n│       │   │   ├── 05_structured_output.py\n│       │   │   └── 06_multi_agent.py\n│       │   ├── flow_template.py\n│       │   ├── node_template.py\n│       │   └── template/\n│       │       ├── README.md\n│       │       ├── flow.py\n│       │       ├── main.py\n│       │       ├── nodes.py\n│       │       ├── requirements.txt\n│       │       └── utils.py\n│       ├── references/\n│       │   ├── core_abstraction.md\n│       │   └── index.md\n│       └── scripts/\n│           ├── pocketflow_init.py\n│           └── test_llm_connection.py\n└── README.md\n```\n\n\n## Marketplace manifest\n\nAlready provided at `.claude-plugin/marketplace.json`:\n\n```json\n{\n  \"name\": \"claude_market\",\n  \"owner\": { \"name\": \"claude_market\" },\n  \"metadata\": {\n    \"description\": \"Claude Code marketplace for PocketFlow and future plugins\",\n    \"version\": \"0.1.0\"\n  },\n  \"plugins\": [\n    {\n      \"name\": \"pocketflow\",\n      \"source\": \"./\",\n      \"description\": \"PocketFlow Skill packaged as a plugin\",\n      \"version\": \"0.1.0\",\n      \"category\": \"skills\",\n      \"keywords\": [\"pocketflow\", \"skills\", \"agents\", \"rag\", \"workflow\"]\n    }\n  ]\n}\n```\n\nNotes:\n- Marketplace name is `claude_market`.\n- You can add more plugins later by appending entries to `plugins` with `source` pointing to subfolders or external repos.\n\n## Included plugin: pocketflow\n\nThis repository is also a plugin (manifest at `.claude-plugin/plugin.json`) that exposes the Skill at `skills/pocketflow/`.\n\n```json\n{\n  \"name\": \"pocketflow\",\n  \"version\": \"0.1.0\",\n  \"description\": \"PocketFlow Skill, cookbook examples, and templates for graph-based LLM workflows.\",\n  \"author\": { \"name\": \"claude_market\" },\n  \"keywords\": [\"skill\", \"pocketflow\", \"agents\", \"rag\", \"workflow\"]\n}\n```\n\n## Add this marketplace in Claude Code\n\nAdd the marketplace:\n\n```shell\n/plugin marketplace add ./\n/plugin marketplace list\n/plugin\n```\n\nInstall the plugin from this marketplace:\n\n```shell\n/plugin install pocketflow@claude_market\n```\n\nOther useful commands:\n\n```shell\n/plugin enable plugin-name@claude_market\n/plugin disable plugin-name@claude_market\n/plugin uninstall plugin-name@claude_market\n/plugin marketplace update claude_market\n/plugin marketplace remove claude_market\n```\n\n## Team setup via settings\n\nAdd repository-level config in `.claude/settings.json` so teammates auto-discover this marketplace and specific plugins:\n\n```json\n{\n  \"enabledPlugins\": {\n    \"pocketflow@claude_market\": true\n  },\n  \"extraKnownMarketplaces\": {\n    \"claude_market\": {\n      \"source\": {\n        \"source\": \"github\",\n        \"repo\": \"owner/claude_market\"\n      }\n    }\n  }\n}\n```\n\nSee `start_here/settings.md` for full options (git URL, local directory sources, enabling/disabling plugins, scopes).\n\n## Use the PocketFlow examples locally\n\nThe PocketFlow Skill includes runnable Python examples and a project template under `skills/pocketflow/assets/`:\n\n```shell\n# optional: create a virtual environment first\npip install -r skills/pocketflow/assets/template/requirements.txt\npython skills/pocketflow/assets/examples/01_chat.py\n```\n\n## References\n\n- start_here/marketplace_guide.md — Managing and hosting marketplaces\n- start_here/plugins_guide.md — Building and testing plugins\n- start_here/plugins_reference.md — Schemas and component specs\n- start_here/settings.md — Settings for marketplaces and plugins\n"
      },
      "plugins": [
        {
          "name": "pocketflow",
          "source": "./",
          "description": "PocketFlow Skill packaged as a plugin",
          "version": "0.1.0",
          "category": "skills",
          "keywords": [
            "pocketflow",
            "skills",
            "agents",
            "rag",
            "workflow"
          ],
          "categories": [
            "agents",
            "pocketflow",
            "rag",
            "skills",
            "workflow"
          ],
          "install_commands": [
            "/plugin marketplace add nickth3man/claude_market",
            "/plugin install pocketflow@claude_market"
          ]
        }
      ]
    }
  ]
}