{
  "author": {
    "id": "noopz",
    "display_name": "Zack",
    "avatar_url": "https://avatars.githubusercontent.com/u/14660757?u=8b565d4c285d3332b94fbe777719fd960cba3da3&v=4"
  },
  "marketplaces": [
    {
      "name": "stray-bits-sanctuary",
      "version": null,
      "description": "A sanctuary for stray bits - plugins that wandered in and found purpose",
      "repo_full_name": "noopz/stray-bits-sanctuary",
      "repo_url": "https://github.com/noopz/stray-bits-sanctuary",
      "repo_description": "A sanctuary for stray bits - plugins that found purpose",
      "signals": {
        "stars": 0,
        "forks": 0,
        "pushed_at": "2025-12-22T05:31:59Z"
      },
      "files": {
        ".claude-plugin/marketplace.json": "{\n  \"name\": \"stray-bits-sanctuary\",\n  \"owner\": {\n    \"name\": \"Zack\"\n  },\n  \"metadata\": {\n    \"description\": \"A sanctuary for stray bits - plugins that wandered in and found purpose\",\n    \"homepage\": \"https://straybits.dev\"\n  },\n  \"plugins\": [\n    {\n      \"name\": \"obsidian-shaper\",\n      \"source\": {\n        \"source\": \"github\",\n        \"repo\": \"noopz/obsidian-shaper\"\n      },\n      \"description\": \"Shape your Obsidian vault - create notes, search tags, analyze links, and manage frontmatter\",\n      \"keywords\": [\"obsidian\", \"vault\", \"notes\", \"knowledge-management\"]\n    }\n  ]\n}\n",
        "README.md": "# Stray Bits Sanctuary\n\nA sanctuary for stray bits - plugins that wandered in and found purpose.\n\n## Installation\n\nAdd this marketplace to Claude Code:\n\n```bash\n/plugin marketplace add github:noopz/stray-bits-sanctuary\n```\n\n## Available Plugins\n\n| Plugin | Description |\n|--------|-------------|\n| [obsidian-shaper](https://github.com/noopz/obsidian-shaper) | Shape your Obsidian vault - create notes, search tags, analyze links, and manage frontmatter |\n\n## Installing Plugins\n\n```bash\n/plugin install obsidian-shaper@stray-bits-sanctuary\n```\n\n## About\n\nVisit [straybits.dev](https://straybits.dev) for more information.\n"
      },
      "plugins": [
        {
          "name": "obsidian-shaper",
          "source": {
            "source": "github",
            "repo": "noopz/obsidian-shaper"
          },
          "description": "Shape your Obsidian vault - create notes, search tags, analyze links, and manage frontmatter",
          "keywords": [
            "obsidian",
            "vault",
            "notes",
            "knowledge-management"
          ],
          "categories": [
            "knowledge-management",
            "notes",
            "obsidian",
            "vault"
          ],
          "install_commands": [
            "/plugin marketplace add noopz/stray-bits-sanctuary",
            "/plugin install obsidian-shaper@stray-bits-sanctuary"
          ]
        }
      ]
    }
  ]
}