{
  "author": {
    "id": "nschwermann",
    "display_name": "Nathan Schwermann",
    "avatar_url": "https://avatars.githubusercontent.com/u/891141?u=a654e900d77a58738387ad78f4375ffc34ef8efb&v=4"
  },
  "marketplaces": [
    {
      "name": "claude-tools",
      "version": null,
      "description": "Custom Claude Code plugins for blockchain development, subgraph exploration, and workflow automation",
      "repo_full_name": "nschwermann/claude-tools",
      "repo_url": "https://github.com/nschwermann/claude-tools",
      "repo_description": "Claude Code plugin marketplace for blockchain development, subgraph exploration, and workflow automation",
      "signals": {
        "stars": 0,
        "forks": 0,
        "pushed_at": "2025-11-06T09:19:51Z"
      },
      "files": {
        ".claude-plugin/marketplace.json": "{\n  \"name\": \"claude-tools\",\n  \"description\": \"Custom Claude Code plugins for blockchain development, subgraph exploration, and workflow automation\",\n  \"owner\": {\n    \"name\": \"Nathan Schwermann\",\n    \"url\": \"https://github.com/nschwermann\"\n  },\n  \"plugins\": [\n    {\n      \"name\": \"subgraph-explorer\",\n      \"source\": \"./subgraph-explorer\",\n      \"description\": \"Explore and query blockchain subgraphs through a private MCP server with Docker management and query export utilities\"\n    }\n  ]\n}\n",
        "README.md": "# Claude Tools\n\nA collection of custom Claude Code plugins for blockchain development, subgraph exploration, and workflow automation.\n\n## What is this?\n\nThis repository is a **Claude Code plugin marketplace** that provides specialized tools and Skills for working with blockchain data, GraphQL subgraphs, and development workflows. All plugins can be installed directly into Claude Code for enhanced capabilities.\n\n## Available Plugins\n\n### üîç Subgraph Explorer\n\nExplore and query blockchain subgraphs through a private MCP server running in Docker.\n\n**Features:**\n- Docker management scripts for MCP server (start, stop, status)\n- GraphQL schema exploration and introspection\n- Query execution against configured or ad-hoc subgraph endpoints\n- Query export utility (JavaScript, Python, GraphQL, JSON formats)\n- Comprehensive GraphQL patterns reference for blockchain data\n\n**Use Cases:**\n- Querying NFT transfers and ownership data\n- Analyzing DEX swaps and trading volume\n- Exploring DeFi protocol metrics\n- Exporting queries for project integration\n\n**Requirements:** Docker, Docker Compose, Python 3\n\n[View Plugin Details ‚Üí](./subgraph-explorer/)\n\n## Installation\n\n### Quick Start\n\n1. **Add this marketplace to Claude Code:**\n   ```shell\n   /plugin marketplace add nschwermann/claude-tools\n   ```\n\n2. **Install a plugin:**\n   ```shell\n   /plugin install subgraph-explorer@claude-tools\n   ```\n\n3. **Use the plugin:**\n   - Skills are automatically available to Claude\n   - Check `/help` for new commands (if any)\n   - Follow plugin-specific documentation for setup\n\n### Alternative: Local Development\n\nFor local testing or development:\n\n```bash\n# Clone the repository\ngit clone https://github.com/nschwermann/claude-tools.git\n\n# Add as local marketplace\n/plugin marketplace add ./claude-tools\n\n# Install plugins\n/plugin install subgraph-explorer@claude-tools\n```\n\n## Plugin Structure\n\nThis marketplace follows the Claude Code plugin structure:\n\n```\nclaude-tools/\n‚îú‚îÄ‚îÄ .claude-plugin/\n‚îÇ   ‚îî‚îÄ‚îÄ marketplace.json          # Marketplace metadata\n‚îú‚îÄ‚îÄ subgraph-explorer/            # Plugin: Subgraph Explorer\n‚îÇ   ‚îú‚îÄ‚îÄ .claude-plugin/\n‚îÇ   ‚îÇ   ‚îî‚îÄ‚îÄ plugin.json          # Plugin metadata\n‚îÇ   ‚îî‚îÄ‚îÄ skills/\n‚îÇ       ‚îî‚îÄ‚îÄ subgraph-explorer/   # Skill implementation\n‚îÇ           ‚îú‚îÄ‚îÄ SKILL.md\n‚îÇ           ‚îú‚îÄ‚îÄ scripts/\n‚îÇ           ‚îú‚îÄ‚îÄ references/\n‚îÇ           ‚îî‚îÄ‚îÄ README.md\n‚îî‚îÄ‚îÄ README.md                     # This file\n```\n\n## Development\n\n### Adding New Plugins\n\nTo add a new plugin to this marketplace:\n\n1. **Create plugin directory:**\n   ```bash\n   mkdir my-plugin\n   cd my-plugin\n   ```\n\n2. **Create plugin manifest:**\n   ```bash\n   mkdir .claude-plugin\n   # Create .claude-plugin/plugin.json with plugin metadata\n   ```\n\n3. **Add plugin components:**\n   - `skills/` - Agent Skills\n   - `commands/` - Custom slash commands\n   - `agents/` - Custom agents\n   - `hooks/` - Event handlers\n\n4. **Update marketplace manifest:**\n   Add your plugin to `.claude-plugin/marketplace.json`\n\n5. **Test locally:**\n   ```shell\n   /plugin marketplace add ./claude-tools\n   /plugin install my-plugin@claude-tools\n   ```\n\n### Testing Changes\n\nWhen developing plugins locally:\n\n```shell\n# Uninstall current version\n/plugin uninstall plugin-name@claude-tools\n\n# Reinstall after changes\n/plugin install plugin-name@claude-tools\n```\n\n## Requirements\n\n- **Claude Code** - Latest version recommended\n- **Git** - For cloning and version control\n- **Plugin-specific requirements** - See individual plugin documentation\n\n## Related Projects\n\n- [Private Subgraph MCP Server](https://github.com/nschwermann/subgraph-mcp) - The MCP server used by subgraph-explorer\n- [Claude Code Documentation](https://docs.claude.com/claude-code) - Official Claude Code docs\n\n## Contributing\n\nContributions are welcome! To contribute:\n\n1. Fork this repository\n2. Create a feature branch\n3. Add or improve a plugin\n4. Submit a pull request\n\n## License\n\nMIT\n\n## Author\n\n**Nathan Schwermann**\n- GitHub: [@nschwermann](https://github.com/nschwermann)\n\n---\n\nBuilt for use with [Claude Code](https://claude.com/claude-code) - The AI coding assistant\n",
        "subgraph-explorer/README.md": "# Subgraph Explorer Plugin\n\nA Claude Code plugin that enables exploration and querying of blockchain subgraphs through a private MCP server running in Docker.\n\n## Overview\n\nThis plugin adds a powerful Skill to Claude Code for working with blockchain subgraphs. It provides Docker management utilities, GraphQL schema exploration, query execution, and export tools for integrating queries into your projects.\n\n## Features\n\n### Skill: Subgraph Explorer\n\nThe main Skill enables Claude to:\n\n- **Manage MCP Server**: Start, stop, and check status of Docker-based MCP server\n- **Explore Schemas**: Introspect GraphQL schemas from configured or ad-hoc subgraph endpoints\n- **Execute Queries**: Run GraphQL queries against subgraphs (NFT, DEX, DeFi data)\n- **Export Queries**: Save discovered queries in multiple formats (JS, Python, GraphQL, JSON)\n- **Access Patterns**: Reference guide with common GraphQL patterns for blockchain data\n\n### Included Utilities\n\n#### Docker Management Scripts\n- `start_mcp_server.sh` - Start the MCP server container\n- `stop_mcp_server.sh` - Stop the MCP server container\n- `check_mcp_status.sh` - Check server status and health\n\n#### Query Export Tool\n- `export_query.py` - Export queries to JavaScript, Python, GraphQL, or JSON\n\n#### Reference Documentation\n- `graphql_patterns.md` - Comprehensive GraphQL query patterns for blockchain subgraphs\n\n## Installation\n\n### From Marketplace\n\n```shell\n/plugin marketplace add nschwermann/claude-tools\n/plugin install subgraph-explorer@claude-tools\n```\n\n### Local Development\n\n```bash\ngit clone https://github.com/nschwermann/claude-tools.git\ncd claude-tools\n```\n\n```shell\n/plugin marketplace add ./\n/plugin install subgraph-explorer@claude-tools\n```\n\n## Requirements\n\n- **Docker and Docker Compose** - For running the MCP server\n- **Python 3** - For query export utility\n- **Private Subgraph MCP Server** - [nschwermann/subgraph-mcp](https://github.com/nschwermann/subgraph-mcp)\n\n## Quick Start\n\nAfter installing the plugin, the Skill is automatically available to Claude.\n\n### 1. Start the MCP Server\n\nThe skill can help you start the Docker-based MCP server:\n\n```\nYou: Start the subgraph MCP server\n\nClaude will execute the start script and verify the server is running.\n```\n\n### 2. Explore Subgraphs\n\nAsk Claude to explore subgraphs:\n\n```\nYou: Show me the latest NFT transfers from the Ebisu's Bay subgraph\n\nClaude will:\n1. List or search for the relevant subgraph\n2. Get the GraphQL schema\n3. Build and execute an appropriate query\n4. Present the results\n```\n\n### 3. Export Queries\n\nSave working queries for your projects:\n\n```\nYou: Export that query as a JavaScript module\n\nClaude will use the export utility to save the query in your preferred format.\n```\n\n## Usage Examples\n\n### Exploring NFT Data\n```\nYou: What NFTs does address 0x123... own on Cronos?\n```\n\nClaude will search the NFT subgraph, build a query for ERC721/ERC1155 balances, and show the results.\n\n### Analyzing DEX Volume\n```\nYou: Show me today's trading volume on Ebisu's Bay DEX\n```\n\nClaude will query the DEX subgraph for daily volume data, handling UTC timezone considerations.\n\n### Ad-hoc Exploration\n```\nYou: Explore the GraphQL schema at https://example.com/graphql\n```\n\nClaude will introspect the schema and help you build queries even for unconfigured endpoints.\n\n## Configuration\n\nThe scripts default to `~/Workspace/subgraph-mcp` for the MCP server location. Override with:\n\n```bash\nexport SUBGRAPH_MCP_PATH=/path/to/your/subgraph-mcp\n```\n\nThe MCP server configuration (`subgraphs.json`) defines which subgraphs are available in the registry.\n\n## Skill Structure\n\n```\nsubgraph-explorer/\n‚îú‚îÄ‚îÄ .claude-plugin/\n‚îÇ   ‚îî‚îÄ‚îÄ plugin.json              # Plugin metadata\n‚îî‚îÄ‚îÄ skills/\n    ‚îî‚îÄ‚îÄ subgraph-explorer/       # Skill implementation\n        ‚îú‚îÄ‚îÄ SKILL.md            # Main skill instructions\n        ‚îú‚îÄ‚îÄ scripts/\n        ‚îÇ   ‚îú‚îÄ‚îÄ start_mcp_server.sh\n        ‚îÇ   ‚îú‚îÄ‚îÄ stop_mcp_server.sh\n        ‚îÇ   ‚îú‚îÄ‚îÄ check_mcp_status.sh\n        ‚îÇ   ‚îî‚îÄ‚îÄ export_query.py\n        ‚îî‚îÄ‚îÄ references/\n            ‚îî‚îÄ‚îÄ graphql_patterns.md\n```\n\n## MCP Server Integration\n\nThis plugin works with the Private Subgraph MCP Server, which provides:\n\n**Registry-based tools:**\n- `list_subgraphs` - List configured subgraphs\n- `search_subgraphs_by_keyword` - Search by keyword\n- `get_schema_by_id` - Get schema for configured subgraph\n- `execute_query_by_id` - Execute query against configured subgraph\n- `get_query_examples_by_id` - Get query examples\n- `get_subgraph_guidance_by_id` - Get usage guidance\n\n**Ad-hoc tools:**\n- `get_schema_by_url` - Get schema from any GraphQL endpoint\n- `execute_query_by_url` - Execute query against any endpoint\n\n## Documentation\n\nSee the skill's `SKILL.md` for comprehensive documentation including:\n- Core workflows for subgraph exploration\n- Query development process\n- Data considerations and best practices\n- Troubleshooting guide\n\n## Related Projects\n\n- [claude-tools](https://github.com/nschwermann/claude-tools) - This plugin marketplace\n- [subgraph-mcp](https://github.com/nschwermann/subgraph-mcp) - The MCP server\n- [Claude Code](https://claude.com/claude-code) - The AI coding assistant\n\n## License\n\nMIT\n\n## Author\n\n**Nathan Schwermann**\n- GitHub: [@nschwermann](https://github.com/nschwermann)\n"
      },
      "plugins": [
        {
          "name": "subgraph-explorer",
          "source": "./subgraph-explorer",
          "description": "Explore and query blockchain subgraphs through a private MCP server with Docker management and query export utilities",
          "categories": [],
          "install_commands": [
            "/plugin marketplace add nschwermann/claude-tools",
            "/plugin install subgraph-explorer@claude-tools"
          ]
        }
      ]
    }
  ]
}