{
  "author": {
    "id": "omkamal",
    "display_name": "Omar Kamal",
    "avatar_url": "https://avatars.githubusercontent.com/u/7251307?u=1435778c3cafa127d5781e12145b45ae4a7ba64e&v=4"
  },
  "marketplaces": [
    {
      "name": "claude-skills",
      "version": null,
      "description": "Custom skills for Claude Code",
      "repo_full_name": "omkamal/claude-skills",
      "repo_url": "https://github.com/omkamal/claude-skills",
      "repo_description": "A claude skills repo",
      "signals": {
        "stars": 0,
        "forks": 0,
        "pushed_at": "2025-12-17T00:04:29Z"
      },
      "files": {
        ".claude-plugin/marketplace.json": "{\n  \"name\": \"claude-skills\",\n  \"metadata\": {\n    \"description\": \"Custom skills for Claude Code\",\n    \"version\": \"1.0.0\"\n  },\n  \"owner\": {\n    \"name\": \"Omar Kamal Hosney\"\n  },\n  \"plugins\": [\n    {\n      \"name\": \"nano-banana-illustrator\",\n      \"source\": \"./skills/nano-banana-illustrator\",\n      \"description\": \"Generate images using Google's Gemini Image API. Supports pro and flash models with multiple aspect ratios.\",\n      \"version\": \"1.0.0\",\n      \"license\": \"Apache-2.0\",\n      \"keywords\": [\"image\", \"generation\", \"gemini\", \"ai\", \"illustration\"],\n      \"category\": \"creative\",\n      \"strict\": false\n    }\n  ]\n}\n",
        "README.md": "# Claude Skills\n\nA collection of custom skills for [Claude Code](https://claude.ai/code) that extend its capabilities with specialized tools and workflows.\n\n## What are Skills?\n\nSkills are self-contained utilities that Claude Code loads automatically when relevant. When you install a skill, Claude gains new capabilities - like generating images, manipulating documents, or integrating with external APIs - without any manual intervention.\n\n## Installation\n\n### Prerequisites\n\n1. Install [Claude Code CLI](https://claude.ai/code)\n2. Ensure you have an active Claude Code session\n\n### Method 1: Plugin Marketplace (Recommended)\n\n**Step 1:** Add this repository as a marketplace:\n\n```bash\n/plugin marketplace add omkamal/claude-skills\n```\n\n**Step 2:** Browse and install skills interactively:\n\n```bash\n/plugin\n```\n\nSelect **\"Browse and install plugins\"** → **\"claude-skills\"** → Choose your skill → **\"Install now\"**\n\n### Method 2: Direct Install\n\nInstall a specific skill in one command:\n\n```bash\n/plugin install nano-banana-illustrator@claude-skills\n```\n\n### Method 3: Manual Installation\n\n**Personal use** (available in all your projects):\n```bash\ngit clone https://github.com/omkamal/claude-skills.git\ncp -r claude-skills/skills/nano-banana-illustrator ~/.claude/skills/\n```\n\n**Project-wide** (shared with team via git):\n```bash\nmkdir -p .claude/skills\ncp -r claude-skills/skills/nano-banana-illustrator .claude/skills/\ngit add .claude/skills\ngit commit -m \"Add nano-banana-illustrator skill\"\n```\n\n## Using Skills in Claude Code\n\nOnce installed, skills activate automatically based on context. Simply describe what you want:\n\n```\n\"Generate an image of a sunset over mountains\"\n\"Create a portrait illustration of a robot\"\n\"Make a cinematic wide shot of a forest\"\n```\n\nClaude will recognize the intent and use the appropriate skill.\n\n## Available Skills\n\n### nano-banana-illustrator\n\nGenerate images using Google's Gemini Image API (Nano Banana).\n\n**Setup:**\n```bash\npip install google-genai\nexport GOOGLE_API_KEY=your_api_key_here\n```\n\n**Features:**\n- **Models**: `pro` (high quality, 4K) or `flash` (fast generation)\n- **Aspect Ratios**: landscape (16:9), portrait (9:16), square (1:1), cinematic (21:9)\n- **Image Editing**: Pass reference images for style transfer or editing\n\n**CLI Usage:**\n```bash\n# Basic generation\npython generate_image.py \"A sunset over mountains\" -o sunset.jpg\n\n# Portrait mode with flash model\npython generate_image.py \"A robot\" -o robot.jpg -a portrait -m flash\n\n# With reference image\npython generate_image.py \"Make this image more colorful\" -i reference.jpg -o output.jpg\n```\n\n**In Claude Code:**\n```\n\"Generate a landscape image of a cyberpunk city at night\"\n\"Create a square profile picture of a friendly AI assistant\"\n```\n\n## Managing Plugins\n\n```bash\n# List installed plugins\n/plugin\n\n# Update marketplace\n/plugin marketplace update claude-skills\n\n# Remove a plugin\n/plugin uninstall nano-banana-illustrator\n\n# Remove marketplace\n/plugin marketplace remove claude-skills\n```\n\n## Creating New Skills\n\n1. Create a directory under `skills/`:\n   ```bash\n   mkdir skills/my-skill-name\n   ```\n\n2. Add `SKILL.md` with YAML frontmatter:\n   ```yaml\n   ---\n   name: my-skill-name\n   description: When to use this skill. Include trigger phrases and required env vars.\n   ---\n\n   # My Skill Name\n\n   Instructions Claude follows when using this skill...\n\n   ## Usage\n   Examples and guidelines...\n   ```\n\n3. Add implementation files (Python, shell scripts, etc.)\n\n4. Update `.claude-plugin/marketplace.json` to include your skill:\n   ```json\n   {\n     \"name\": \"my-skill-name\",\n     \"source\": \"./skills/my-skill-name\",\n     \"description\": \"Brief description\",\n     \"version\": \"1.0.0\"\n   }\n   ```\n\n## Repository Structure\n\n```\nclaude-skills/\n├── .claude-plugin/\n│   └── marketplace.json    # Plugin marketplace configuration\n├── skills/\n│   └── nano-banana-illustrator/\n│       ├── SKILL.md        # Skill manifest and documentation\n│       └── generate_image.py\n├── CLAUDE.md               # Claude Code guidance\n├── LICENSE                 # Apache 2.0\n└── README.md\n```\n\n## Contributing\n\n1. Fork this repository\n2. Create your skill in `skills/your-skill-name/`\n3. Add a `SKILL.md` with proper frontmatter\n4. Update `marketplace.json`\n5. Submit a pull request\n\n## License\n\nApache 2.0 - See [LICENSE](LICENSE) for details.\n\n## Author\n\nOmar Kamal Hosney\n"
      },
      "plugins": [
        {
          "name": "nano-banana-illustrator",
          "source": "./skills/nano-banana-illustrator",
          "description": "Generate images using Google's Gemini Image API. Supports pro and flash models with multiple aspect ratios.",
          "version": "1.0.0",
          "license": "Apache-2.0",
          "keywords": [
            "image",
            "generation",
            "gemini",
            "ai",
            "illustration"
          ],
          "category": "creative",
          "strict": false,
          "categories": [
            "ai",
            "creative",
            "gemini",
            "generation",
            "illustration",
            "image"
          ],
          "install_commands": [
            "/plugin marketplace add omkamal/claude-skills",
            "/plugin install nano-banana-illustrator@claude-skills"
          ]
        }
      ]
    }
  ]
}