{
  "author": {
    "id": "ourines",
    "display_name": "ourines",
    "avatar_url": "https://avatars.githubusercontent.com/u/15307679?u=334c656ee19747a971e855fce36624325caf1c87&v=4"
  },
  "marketplaces": [
    {
      "name": "claude-code-learn",
      "version": null,
      "description": "Persistent knowledge base for Claude Code. Research, save, and auto-maintain structured knowledge.",
      "repo_full_name": "ourines/claude-code-learn",
      "repo_url": "https://github.com/ourines/claude-code-learn",
      "repo_description": "Persistent knowledge base for Claude Code",
      "signals": {
        "stars": 1,
        "forks": 0,
        "pushed_at": "2026-02-12T12:15:53Z"
      },
      "files": {
        ".claude-plugin/marketplace.json": "{\n  \"name\": \"claude-code-learn\",\n  \"owner\": {\n    \"name\": \"ourines\"\n  },\n  \"plugins\": [\n    {\n      \"name\": \"claude-code-learn\",\n      \"source\": \"./\",\n      \"description\": \"Persistent knowledge base for Claude Code. Research, save, and auto-maintain structured knowledge.\",\n      \"version\": \"0.1.0\",\n      \"license\": \"MIT\",\n      \"keywords\": [\"learn\", \"knowledge\", \"research\", \"memory\"]\n    }\n  ]\n}\n",
        ".claude-plugin/plugin.json": "{\n  \"name\": \"claude-code-learn\",\n  \"version\": \"0.1.0\",\n  \"description\": \"Research topics and build a persistent knowledge base for Claude Code.\",\n  \"author\": {\n    \"name\": \"ourines\"\n  },\n  \"license\": \"MIT\",\n  \"keywords\": [\"learn\", \"knowledge\", \"research\", \"memory\"]\n}\n",
        "README.md": "# claude-code-learn\n\nPersistent knowledge base for Claude Code. Research topics, save structured knowledge, and let Claude maintain it automatically.\n\n## What It Does\n\n- **`/claude-code-learn:learn <topic>`** — Quick research using available tools, save to `~/.claude/learnings/`\n- **`/claude-code-learn:deep-learn <topic>`** — Deep research using parallel agents (subagents or team), comprehensive coverage\n- **`/claude-code-learn:recall <topic>`** — Load saved knowledge into session context (silent, no lecture)\n- **`/claude-code-learn:forget <topic>`** — Remove saved knowledge\n- **Auto-recall** — Detects project dependencies at session start, automatically loads matching knowledge\n- **Autonomous capture** — Claude proactively saves knowledge before context compaction and after substantial sessions\n- **Auto-maintenance** — Claude silently updates stale or incorrect knowledge during normal work\n\n## Installation\n\n### From GitHub (Remote)\n\n**Step 1:** Add the marketplace in Claude Code:\n\n```\n/plugin marketplace add ourines/claude-code-learn\n```\n\n**Step 2:** Install the plugin:\n\n```\n/plugin\n```\n\nNavigate to **Discover** tab, find `claude-code-learn`, and enable it.\n\nOr install via CLI:\n\n```bash\nclaude plugin install claude-code-learn@ourines/claude-code-learn\n```\n\n**Step 3:** Create the knowledge directory:\n\n```bash\nmkdir -p ~/.claude/learnings\n```\n\nRestart Claude Code to activate.\n\n### Local Development\n\nClone and install:\n\n```bash\ngit clone https://github.com/ourines/claude-code-learn.git\ncd claude-code-learn\nchmod +x install.sh\n./install.sh\n```\n\nThen start Claude Code with the plugin loaded:\n\n```bash\nclaude --plugin-dir /path/to/claude-code-learn\n```\n\n`install.sh` does two things:\n1. Creates `~/.claude/learnings/` for knowledge storage\n2. Symlinks the plugin to `~/.claude/plugins/claude-code-learn`\n\n### Manual Installation\n\n```bash\n# 1. Clone or download the repo\ngit clone https://github.com/ourines/claude-code-learn.git\n\n# 2. Symlink to plugins directory\nln -s /path/to/claude-code-learn ~/.claude/plugins/claude-code-learn\n\n# 3. Create knowledge directory\nmkdir -p ~/.claude/learnings\n\n# 4. Start with plugin flag\nclaude --plugin-dir /path/to/claude-code-learn\n```\n\nHooks and MCP servers are auto-configured when the plugin is active — no manual `settings.json` editing needed.\n\n## Skills\n\n### /claude-code-learn:learn\n\nQuick single-agent research. Adapts strategy based on topic type:\n\n| Topic Type | Primary Tools | Focus |\n|-----------|--------------|-------|\n| Library/Framework | Context7, GitHub grep, WebSearch | APIs, patterns, pitfalls, versions |\n| Concept/Pattern | WebSearch, WebFetch | Principles, tradeoffs, implementations |\n| Tool/CLI | WebSearch, WebFetch | Commands, config, recipes |\n| Language Feature | WebSearch, Context7 | Syntax, constraints, best practices |\n\n### /claude-code-learn:deep-learn\n\nMulti-agent deep research. Claude autonomously decides:\n\n- **How many agents** to spawn (2–5, based on topic breadth)\n- **Which strategy** to use:\n  - **Subagents** — independent parallel research, best for well-defined topics\n  - **Team agents** — coordinated research with shared task list, best for broad/unfamiliar topics where findings from one agent should influence others\n- **What dimensions** each agent covers (docs, code patterns, gotchas, ecosystem, etc.)\n\nOutput includes an `Advanced Topics` section and `research_depth: \"deep\"` marker in frontmatter.\n\n### /claude-code-learn:recall\n\nSilently loads knowledge into session context. Does not recite the file — just confirms:\n\n> Loaded knowledge on \"TanStack Router\" (verified 2026-02-11, confidence: high).\n\nShares details only when asked.\n\n### /claude-code-learn:forget\n\nDeletes knowledge file. If MCP memory is available, also cleans up the knowledge graph. If not, skips gracefully.\n\n## How It Works\n\n### SessionStart Hook\n\nAt session start, the hook scans `~/.claude/learnings/` and outputs a compact summary:\n\n```\n[claude-code-learn] 3 topic(s) in knowledge base: TanStack Router, Go concurrency, Redis Streams.\nStale (>90d): Go concurrency.\n[Knowledge maintenance] When a topic above is relevant...\n[Auto-recall] Project dependencies match saved knowledge. READ now: ~/.claude/learnings/tanstack-router.md.\n```\n\nThe hook also detects project dependencies (`package.json`, `go.mod`, `requirements.txt`, `Cargo.toml`) and matches them against saved knowledge. When a match is found, Claude is instructed to load the relevant files immediately rather than waiting for the user to ask.\n\n### Autonomous Knowledge Capture\n\nClaude proactively saves knowledge without user intervention through two hooks:\n\n- **PreCompact hook** — When context is about to be compacted (details will be lost to summarization), Claude is prompted to persist any valuable discoveries from the session. This is the highest-signal trigger: long sessions that fill the context window are most likely to contain knowledge worth saving.\n\n- **Stop hook** — After substantial work sessions (transcript > 50KB), Claude is nudged to reflect on what it learned. Rate-limited to fire at most once per session to avoid noise.\n\nCombined with the existing PostToolUse hook (fires after research tool calls), this gives Claude three autonomous opportunities to capture knowledge during normal work — without requiring `/learn`.\n\n### Self-Maintenance\n\n- **Stale detection** — flags topics where `last_verified` > 90 days\n- **Silent updates** — when Claude finds outdated knowledge during work, it fixes the file automatically\n- **Organic growth** — Claude saves new knowledge it discovers during normal sessions\n\n### Knowledge Graph (Bundled)\n\nThe plugin bundles `@anthropic/mcp-memory` via `.mcp.json`. Auto-loaded when active — no separate configuration. No conflict if you already have the memory MCP server configured elsewhere.\n\n## Knowledge File Format\n\n```\n~/.claude/learnings/\n├── tanstack-router.md\n├── go-concurrency-patterns.md\n├── redis-streams.md\n└── posix-shell-scripting.md\n```\n\nEach file has YAML frontmatter + structured sections:\n\n```markdown\n---\ntopic: \"TanStack Router\"\nslug: \"tanstack-router\"\ncategory: \"library\"\ncreated: \"2026-02-11\"\nlast_verified: \"2026-02-11\"\nconfidence: \"high\"\ntags: [tanstack, router, react, file-based-routing]\nsources_count: 4\nresearch_depth: \"deep\"        # only for /deep-learn output\nagents_used: 3                # only for /deep-learn output\nstrategy: \"subagents\"         # only for /deep-learn output\n---\n\n# TanStack Router\n\n## TL;DR\n## Core APIs / Concepts\n## Patterns & Recipes\n## Gotchas\n## Advanced Topics          # only for /deep-learn output\n## Quick Reference\n## Sources\n```\n\n## Requirements\n\n- Claude Code CLI\n- Node.js (required by Claude Code)\n\n## License\n\nMIT\n"
      },
      "plugins": [
        {
          "name": "claude-code-learn",
          "source": "./",
          "description": "Persistent knowledge base for Claude Code. Research, save, and auto-maintain structured knowledge.",
          "version": "0.1.0",
          "license": "MIT",
          "keywords": [
            "learn",
            "knowledge",
            "research",
            "memory"
          ],
          "categories": [
            "knowledge",
            "learn",
            "memory",
            "research"
          ],
          "install_commands": [
            "/plugin marketplace add ourines/claude-code-learn",
            "/plugin install claude-code-learn@claude-code-learn"
          ]
        }
      ]
    },
    {
      "name": "oss-promoter",
      "version": null,
      "description": "Claude Code plugin for batch promoting open source projects to tech weeklies and communities",
      "repo_full_name": "ourines/oss-promoter",
      "repo_url": "https://github.com/ourines/oss-promoter",
      "repo_description": null,
      "signals": {
        "stars": 0,
        "forks": 0,
        "pushed_at": "2025-11-28T04:35:04Z"
      },
      "files": {
        ".claude-plugin/marketplace.json": "{\n  \"name\": \"oss-promoter\",\n  \"owner\": {\n    \"name\": \"ourines\",\n    \"email\": \"github@ourines\"\n  },\n  \"metadata\": {\n    \"description\": \"Claude Code plugin for batch promoting open source projects to tech weeklies and communities\",\n    \"version\": \"1.0.0\"\n  },\n  \"plugins\": [\n    {\n      \"name\": \"oss-promoter\",\n      \"source\": \"./\",\n      \"description\": \"Batch promote open source projects to tech weeklies and communities. Auto-generate tailored submissions and create issues on multiple weeklies with one command.\",\n      \"version\": \"1.0.0\",\n      \"author\": {\n        \"name\": \"ourines\"\n      },\n      \"homepage\": \"https://github.com/ourines/oss-promoter\",\n      \"repository\": \"https://github.com/ourines/oss-promoter\",\n      \"license\": \"MIT\",\n      \"keywords\": [\n        \"claude-code\",\n        \"oss\",\n        \"opensource\",\n        \"promotion\",\n        \"weekly\",\n        \"newsletter\",\n        \"github\",\n        \"automation\"\n      ],\n      \"category\": \"productivity\",\n      \"tags\": [\"oss\", \"promotion\", \"weekly\", \"newsletter\", \"automation\"]\n    }\n  ]\n}\n",
        ".claude-plugin/plugin.json": "{\n  \"name\": \"oss-promoter\",\n  \"version\": \"1.0.0\",\n  \"description\": \"Batch promote open source projects to tech weeklies and communities. Auto-generate tailored submissions and create issues on multiple weeklies with one command.\",\n  \"author\": {\n    \"name\": \"ourines\",\n    \"email\": \"github@ourines\"\n  },\n  \"homepage\": \"https://github.com/ourines/oss-promoter\",\n  \"repository\": \"https://github.com/ourines/oss-promoter\",\n  \"license\": \"MIT\",\n  \"keywords\": [\n    \"claude-code\",\n    \"oss\",\n    \"opensource\",\n    \"promotion\",\n    \"weekly\",\n    \"newsletter\",\n    \"github\",\n    \"automation\"\n  ]\n}\n",
        "README.md": "# OSS Promoter\n\n> Claude Code plugin for batch promoting open source projects to tech weeklies and communities.\n\n[![License: MIT](https://img.shields.io/badge/License-MIT-yellow.svg)](https://opensource.org/licenses/MIT)\n[![Claude Code](https://img.shields.io/badge/Claude_Code-Plugin-blue)](https://claude.ai)\n\n## Features\n\n- **Batch Submit**: Submit your project to multiple tech weeklies with one command\n- **Smart Templates**: Auto-generate tailored content for each weekly's format\n- **Weekly Discovery**: Search for new weeklies to add to your promotion list\n- **Progress Tracking**: Track submission status with TodoWrite\n\n## Installation\n\n```bash\n/plugin install oss-promoter@oss-promoter\n```\n\nOr install from GitHub:\n\n```bash\n/plugin install https://github.com/ourines/oss-promoter\n```\n\n## Usage\n\n### Promote a Project\n\n```bash\n/oss-promoter:promote https://github.com/yourname/your-project\n```\n\nThis will:\n\n1. Extract project info from GitHub\n2. Generate submission content\n3. Create issues/comments on all enabled weeklies\n4. Report results\n\n### Search for Weeklies\n\n```bash\n/oss-promoter:search\n```\n\nFind new tech weeklies with >100 stars that accept submissions.\n\n### List Configured Weeklies\n\n```bash\n/oss-promoter:list\n```\n\nShow all weeklies in the config with their status.\n\n## Configuration\n\nEdit `config/weeklies.json` to:\n\n- Enable/disable specific weeklies\n- Add new weeklies\n- Customize title templates\n\n### Weekly Config Format\n\n```json\n{\n  \"id\": \"weekly-id\",\n  \"name\": \"Weekly Name\",\n  \"repo\": \"owner/repo\",\n  \"stars\": 1000,\n  \"language\": \"zh\",\n  \"type\": \"issue\",\n  \"title_template\": \"{name} - {short_description}\",\n  \"categories\": [\"tech\", \"tools\"],\n  \"enabled\": true\n}\n```\n\n## Supported Weeklies\n\n| Weekly | Stars | Language | Status |\n|--------|-------|----------|--------|\n| 科技爱好者周刊 | 79.7k | 中文 | Enabled |\n| HelloGitHub 月刊 | 95k | 中文 | Enabled |\n| 前端精读周刊 | 30.6k | 中文 | Enabled |\n| 独立开发变现周刊 | 3.6k | 中文 | Enabled |\n| DevWeekly | 1.9k | 中文 | Enabled |\n| Github精选周刊 | 1.4k | 中文 | Enabled |\n| 老胡的信息技术周刊 | 977 | 中文 | Enabled |\n| 二丫讲梵学习周刊 | 500 | 中文 | Enabled |\n\n> Run `/oss-promoter:list` to see the full list with current status.\n\n## Requirements\n\n- `gh` (GitHub CLI) - authenticated\n- Claude Code with WebSearch enabled\n\n## Author\n\n**ourines** - [GitHub](https://github.com/ourines)\n\n## License\n\n[MIT](LICENSE)\n"
      },
      "plugins": [
        {
          "name": "oss-promoter",
          "source": "./",
          "description": "Batch promote open source projects to tech weeklies and communities. Auto-generate tailored submissions and create issues on multiple weeklies with one command.",
          "version": "1.0.0",
          "author": {
            "name": "ourines"
          },
          "homepage": "https://github.com/ourines/oss-promoter",
          "repository": "https://github.com/ourines/oss-promoter",
          "license": "MIT",
          "keywords": [
            "claude-code",
            "oss",
            "opensource",
            "promotion",
            "weekly",
            "newsletter",
            "github",
            "automation"
          ],
          "category": "productivity",
          "tags": [
            "oss",
            "promotion",
            "weekly",
            "newsletter",
            "automation"
          ],
          "categories": [
            "automation",
            "claude-code",
            "github",
            "newsletter",
            "opensource",
            "oss",
            "productivity",
            "promotion",
            "weekly"
          ],
          "install_commands": [
            "/plugin marketplace add ourines/oss-promoter",
            "/plugin install oss-promoter@oss-promoter"
          ]
        }
      ]
    }
  ]
}