{
  "author": {
    "id": "pddhkt",
    "display_name": "pddhkt",
    "avatar_url": "https://avatars.githubusercontent.com/u/1543813?v=4"
  },
  "marketplaces": [
    {
      "name": "kotlin-kmp-skills",
      "version": null,
      "description": "Kotlin Multiplatform stack skills for Team Claude",
      "repo_full_name": "pddhkt/kotlin-kmp-skills",
      "repo_url": "https://github.com/pddhkt/kotlin-kmp-skills",
      "repo_description": "Kotlin Multiplatform stack skills plugin for Team Claude",
      "signals": {
        "stars": 0,
        "forks": 0,
        "pushed_at": "2026-02-03T08:00:52Z"
      },
      "files": {
        ".claude-plugin/marketplace.json": "{\r\n  \"name\": \"kotlin-kmp-skills\",\r\n  \"owner\": {\r\n    \"name\": \"pddhkt\"\r\n  },\r\n  \"metadata\": {\r\n    \"description\": \"Kotlin Multiplatform stack skills for Team Claude\",\r\n    \"version\": \"1.0.0\"\r\n  },\r\n  \"plugins\": [\r\n    {\r\n      \"name\": \"kotlin-kmp\",\r\n      \"source\": \"./plugins/kotlin-kmp\",\r\n      \"description\": \"Stack-specific skills and agents for Kotlin Multiplatform development including shared code, Android, iOS, SQLDelight, and Ktor\",\r\n      \"version\": \"1.0.0\",\r\n      \"keywords\": [\"kotlin\", \"kmp\", \"multiplatform\", \"android\", \"ios\", \"sqldelight\", \"ktor\"]\r\n    }\r\n  ]\r\n}\r\n",
        "README.md": "# Kotlin Multiplatform Skills\r\n\r\nClaude Code plugin providing stack-specific skills and agents for Kotlin Multiplatform (KMP) development.\r\n\r\n## Installation\r\n\r\n### Add the Marketplace\r\n\r\n```bash\r\n/plugin marketplace add pddhkt/kotlin-kmp-skills\r\n```\r\n\r\n### Install the Plugin\r\n\r\n```bash\r\n# Project scope (recommended)\r\n/plugin install kotlin-kmp@kotlin-kmp-skills --scope project\r\n\r\n# User scope\r\n/plugin install kotlin-kmp@kotlin-kmp-skills\r\n```\r\n\r\n## Available Skills\r\n\r\n| Skill | Usage | Description |\r\n|-------|-------|-------------|\r\n| kmp | `/kotlin-kmp:kmp` | KMP project structure, expect/actual, Gradle |\r\n| sqldelight | `/kotlin-kmp:sqldelight` | SQLDelight schema and migrations |\r\n| ktor | `/kotlin-kmp:ktor` | Ktor networking patterns |\r\n| koin | `/kotlin-kmp:koin` | Koin dependency injection |\r\n| android | `/kotlin-kmp:android` | Android-specific implementation |\r\n| ios | `/kotlin-kmp:ios` | iOS-specific implementation |\r\n| reflect | `/kotlin-kmp:reflect` | Push skill improvements back to source repo |\r\n\r\n## Included Agents\r\n\r\n| Agent | Description |\r\n|-------|-------------|\r\n| shared-impl | Shared/common code implementation specialist |\r\n| android-impl | Android platform implementation specialist |\r\n| ios-impl | iOS platform implementation specialist |\r\n| database-impl | SQLDelight database specialist |\r\n| network-impl | Ktor networking specialist |\r\n\r\n## Stack Detection\r\n\r\nThis stack is auto-detected when a project contains:\r\n- `shared/` directory\r\n- `composeApp/` directory\r\n- `iosApp/` directory\r\n\r\n## Updating\r\n\r\n```bash\r\n/plugin marketplace update kotlin-kmp-skills\r\n```\r\n\r\n## Repository Structure\r\n\r\n```\r\nkotlin-kmp-skills/\r\n├── .claude-plugin/\r\n│   └── marketplace.json\r\n├── stack.json\r\n│\r\n└── plugins/\r\n    └── kotlin-kmp/\r\n        ├── .claude-plugin/\r\n        │   └── plugin.json\r\n        ├── agents/\r\n        │   ├── shared-impl.md\r\n        │   ├── android-impl.md\r\n        │   ├── ios-impl.md\r\n        │   ├── database-impl.md\r\n        │   └── network-impl.md\r\n        └── skills/\r\n            ├── kmp/\r\n            ├── sqldelight/\r\n            ├── ktor/\r\n            ├── koin/\r\n            ├── android/\r\n            ├── ios/\r\n            └── reflect/\r\n```\r\n\r\n## License\r\n\r\nMIT\r\n"
      },
      "plugins": [
        {
          "name": "kotlin-kmp",
          "source": "./plugins/kotlin-kmp",
          "description": "Stack-specific skills and agents for Kotlin Multiplatform development including shared code, Android, iOS, SQLDelight, and Ktor",
          "version": "1.0.0",
          "keywords": [
            "kotlin",
            "kmp",
            "multiplatform",
            "android",
            "ios",
            "sqldelight",
            "ktor"
          ],
          "categories": [
            "android",
            "ios",
            "kmp",
            "kotlin",
            "ktor",
            "multiplatform",
            "sqldelight"
          ],
          "install_commands": [
            "/plugin marketplace add pddhkt/kotlin-kmp-skills",
            "/plugin install kotlin-kmp@kotlin-kmp-skills"
          ]
        }
      ]
    }
  ]
}