{
  "author": {
    "id": "pinecone-io",
    "display_name": "Pinecone",
    "avatar_url": "https://avatars.githubusercontent.com/u/54333248?v=4"
  },
  "marketplaces": [
    {
      "name": "pinecone-plugins",
      "version": null,
      "description": "Pinecone vector database integration. Streamline your Pinecone development with powerful tools for managing vector indexes, querying data, and rapid prototyping. Use slash commands like /quickstart to generate AGENTS.md files and initialize Python projects and /query to quickly explore indexes. Access the Pinecone MCP server for creating, describing, upserting and querying indexes with Claude. Perfect for developers building semantic search, RAG applications, recommendation systems, and other vector-based applications with Pinecone.",
      "repo_full_name": "pinecone-io/pinecone-claude-code-plugin",
      "repo_url": "https://github.com/pinecone-io/pinecone-claude-code-plugin",
      "repo_description": "The official Pinecone marketplace for Claude Code Plugins",
      "signals": {
        "stars": 36,
        "forks": 1,
        "pushed_at": "2026-01-27T21:09:40Z"
      },
      "files": {
        ".claude-plugin/marketplace.json": "{\n\"name\": \"pinecone-plugins\",\n\"owner\": {\n\"name\": \"Pinecone\"\n},\n\"plugins\": [\n{\n  \"name\": \"pinecone\",\n  \"source\": \"./\",\n  \"description\": \"Pinecone vector database integration. Streamline your Pinecone development with powerful tools for managing vector indexes, querying data, and rapid prototyping. Use slash commands like /quickstart to generate AGENTS.md files and initialize Python projects and /query to quickly explore indexes. Access the Pinecone MCP server for creating, describing, upserting and querying indexes with Claude. Perfect for developers building semantic search, RAG applications, recommendation systems, and other vector-based applications with Pinecone.\"\n}\n]\n}\n",
        ".claude-plugin/plugin.json": "{\n    \"name\": \"pinecone\",\n    \"description\": \"Pinecone vector database integration. Streamline your Pinecone development with powerful tools for managing vector indexes, querying data, and rapid prototyping. Use slash commands like /quickstart to generate AGENTS.md files and initialize Python projects and /query to quickly explore indexes. Access the Pinecone MCP server for creating, describing, upserting and querying indexes with Claude. Perfect for developers building semantic search, RAG applications, recommendation systems, and other vector-based applications with Pinecone.\",\n    \"version\": \"1.1.2\",\n    \"author\": {\n        \"name\": \"Pinecone\"\n    },\n    \"keywords\": [\"pinecone\", \"semantic search\", \"retrieval\", \"vector search\", \"vector database\", \"retrieval augmented generation\", \"rag\", \"agentic rag\", \"sparse search\", \"assistant\", \"pinecone assistant\", \"rag chatbot\"]\n}\n",
        "README.md": "# Pinecone Plugin for Claude Code\n\nA lightweight plugin that integrates [Pinecone](https://www.pinecone.io/) vector database capabilities directly into Claude Code, enabling semantic search, index management, and RAG (Retrieval Augmented Generation) workflows.\n\n## Features\n\n- **Pinecone Assistant** â€“ Fully managed RAG service for document Q&A with citations, natural language support, and incremental file syncing\n- **Pinecone MCP Server** â€“ Full integration with the Pinecone Model Context Protocol server for index creation, listing, searching, and more\n- **Slash Commands** â€“ Quick access to common Pinecone operations directly from Claude Code\n- **Semantic Search** â€“ Query your vector indexes using natural language\n- **Natural Language Recognition** â€“ Assistant commands work without explicit slash commands\n\n## Installation\n\n### Option A: Claude Code Plugins Directory (Recommended)\n\nInstall from the [official Claude Code Plugins Directory](https://github.com/anthropics/claude-plugins-official):\n\n1. Install the plugin:\n   ```\n   /plugin install pinecone\n   ```\n\n2. **Restart Claude Code** to activate the plugin.\n\n### Option B: Pinecone Marketplace\n\nAlternatively, install directly from the Pinecone marketplace:\n\n1. **Add the Pinecone plugin marketplace:**\n   ```\n   /plugin marketplace add pinecone-io/pinecone-claude-code-plugin\n   ```\n\n2. **Install the plugin:**\n   ```\n   /plugin install pinecone@pinecone-claude-code-plugin\n   ```\n\n3. **When prompted**, select your preferred installation scope:\n   - **User scope** (default) â€“ Available across all your projects\n   - **Project scope** â€“ Shared with your team via version control\n   - **Local scope** â€“ Project-specific, not shared (gitignored)\n\n4. **Restart Claude Code** to activate the plugin.\n\n### Set Your API Key\n\n4. Restart Claude Code to activate the plugin.\n\n---\n\n### Set Your API Key\n\nAfter installing via either method, configure your Pinecone API key before running Claude Code:\n\n```bash\nexport PINECONE_API_KEY=\"your-api-key-here\"\n```\n\n> **Don't have a Pinecone account?** Sign up for free at [app.pinecone.io](https://app.pinecone.io/?sessionType=signup)\n\n\n### Install uv (Required for Assistant Commands)\n\nTo use Pinecone Assistant functionality, you must have uv installed. uv is a fast Python package and project manager:\n\n**macOS and Linux:**\n```bash\ncurl -LsSf https://astral.sh/uv/install.sh | sh\n```\n\n**Windows:**\n```powershell\npowershell -ExecutionPolicy ByPass -c \"irm https://astral.sh/uv/install.ps1 | iex\"\n```\n\n**With Homebrew:**\n```bash\nbrew install uv\n```\n\nAfter installation, restart your terminal and verify with: `uv --version`\n\nFull installation guide: https://docs.astral.sh/uv/getting-started/installation/\n\n### Install the Pinecone CLI (Optional)\n\nFor additional command-line capabilities, install the Pinecone CLI:\n\n```bash\nbrew tap pinecone-io/tap\nbrew install pinecone-io/tap/pinecone\n```\n\n## Available Commands\n\n### Core Commands\n\n### `/pinecone:help`\n\nDisplay help information about the plugin, including:\n- Available functionality\n- API key configuration\n- Troubleshooting tips\n\nRun this when first installing the Plugin, then proceed to the quickstart.\n\n### `/pinecone:quickstart`\n\nGet started quickly with Pinecone! This command:\n1. Downloads and generates an AGENTS.md file, optimized for use with Claude Code and Pinecone\n2. Walks you through a Python quickstart tutorial\n3. Helps you create your first index and perform semantic searches\n\n### `/pinecone:query`\n\nQuery your Pinecone indexes using natural language. This command wraps the Pinecone MCP server for easy searching of integrated indexes.\nMost useful when you already have an integrated index created, and want to query it quickly from Claude.\n\n**Usage:**\n```\n/pinecone:query query [your search text] index [indexName] namespace [ns] reranker [rerankModel]\n```\n\n**Parameters:**\n| Parameter | Required | Description |\n|-----------|----------|-------------|\n| `query` | Yes | The text to search for |\n| `index` | Yes | The name of the Pinecone index to search |\n| `namespace` | No | The namespace within the index |\n| `reranker` | No | The reranking model to use for improved relevance |\n\nIf you omit required arguments, the command will interactively guide you through selecting available indexes and namespaces.\n\n> **Note:** The `/query` command currently only works with integrated indexes that use Pinecone's hosted embedding models. Third-party embedding models (OpenAI, HuggingFace, etc.) are not yet supported.\n\n### Pinecone Assistant Commands\n\nPinecone Assistant is a fully managed RAG (Retrieval Augmented Generation) service that enables document Q&A with citations. The plugin includes full support with both slash commands and natural language recognition.\n\n#### `/pinecone:assistant-create`\n\nCreate a new Pinecone Assistant for document-based Q&A with custom instructions and regional deployment.\n\n**Usage:**\n```\n/pinecone:assistant-create --name my-docs-assistant [--instructions \"Use professional tone\"] [--region us]\n```\n\n#### `/pinecone:assistant-upload`\n\nUpload files or entire directories to your assistant for indexing. Supports PDF, Markdown, TXT, DOCX, and JSON files.\n\n**Usage:**\n```\n/pinecone:assistant-upload --assistant my-docs-assistant --source ./docs\n```\n\n#### `/pinecone:assistant-sync`\n\nSync local files with your assistant. Only uploads new or changed files (uses mtime and size detection). Optionally delete files from assistant that no longer exist locally.\n\n**Usage:**\n```\n/pinecone:assistant-sync --assistant my-docs-assistant --source ./docs [--delete-missing] [--dry-run]\n```\n\n#### `/pinecone:assistant-chat`\n\nChat with your assistant and receive cited responses with page numbers and source references.\n\n**Usage:**\n```\n/pinecone:assistant-chat --assistant my-docs-assistant --message \"What is RAG?\"\n```\n\n#### `/pinecone:assistant-context`\n\nRetrieve relevant context snippets from your assistant without generating a full chat response. Useful for custom RAG workflows.\n\n**Usage:**\n```\n/pinecone:assistant-context --assistant my-docs-assistant --query \"embedding models\" [--top-k 5]\n```\n\n#### `/pinecone:assistant-list`\n\nList all assistants in your account with status, region, and file count details.\n\n**Usage:**\n```\n/pinecone:assistant-list [--files]\n```\n\n#### Natural Language Support\n\nThe assistant skill automatically recognizes natural language requests without requiring slash commands:\n\n- \"Create a Pinecone assistant from my docs\"\n- \"Upload my docs to the assistant\"\n- \"Sync my documentation with the assistant\"\n- \"Ask my assistant about authentication\"\n- \"Search my assistant for information about embedding models\"\n\nThe skill remembers the last assistant you used, so you can say \"my assistant\" or \"it\" in follow-up requests.\n\n**Learn more:** https://docs.pinecone.io/guides/assistant/quickstart\n\n## MCP Server Tools\n\nThe plugin includes the full Pinecone MCP Server with the following tools:\n\n| Tool | Description |\n|------|-------------|\n| `list-indexes` | List all available Pinecone indexes |\n| `describe-index` | Get index configuration and namespaces |\n| `describe-index-stats` | Get statistics including record counts and namespaces |\n| `search-records` | Search records with optional metadata filtering and reranking |\n| `create-index-for-model` | Create a new index with integrated embeddings |\n| `upsert-records` | Insert or update records in an index |\n| `rerank-documents` | Rerank documents using a specified reranking model |\n\nFor complete MCP server documentation, visit: [Pinecone MCP Server Guide](https://docs.pinecone.io/guides/operations/mcp-server)\n\n## Troubleshooting\n\n### \"API Key not found\" or access errors\n\nMake sure your `PINECONE_API_KEY` environment variable is set correctly:\n\n```bash\necho $PINECONE_API_KEY\n```\n\nIf it's empty, set it and restart Claude Code.\n\n### MCP server not responding\n\n1. Ensure you have Node.js installed (the MCP server runs via `npx`)\n2. Check that your API key is valid\n3. Restart Claude Code after setting environment variables\n\n### Query command not working with my index\n\nThe `/query` command only works with **integrated indexes** that use Pinecone's hosted embedding models. If you're using external embedding providers (OpenAI, HuggingFace, etc.), you'll need to use the MCP tools directly or wait for expanded support.\n\n### Assistant commands not working\n\nMake sure you have uv installed. uv is required for all assistant commands:\n\n```bash\n# Verify uv is installed\nuv --version\n\n# Install if missing\ncurl -LsSf https://astral.sh/uv/install.sh | sh  # macOS/Linux\n```\n\nAfter installing uv, restart your terminal.\n\n## Keywords\n\n`pinecone` Â· `semantic search` Â· `vector search` Â· `vector database` Â· `retrieval` Â· `RAG` Â· `agentic RAG` Â· `sparse search` Â· `document Q&A` Â· `citations` Â· `assistant` Â· `managed RAG`\n\n## License\n\nMIT License â€“ see [LICENSE](./LICENSE) for details.\n\n\n**Have fun and enjoy developing with Pinecone!** ðŸŒ²\n"
      },
      "plugins": [
        {
          "name": "pinecone",
          "source": "./",
          "description": "Pinecone vector database integration. Streamline your Pinecone development with powerful tools for managing vector indexes, querying data, and rapid prototyping. Use slash commands like /quickstart to generate AGENTS.md files and initialize Python projects and /query to quickly explore indexes. Access the Pinecone MCP server for creating, describing, upserting and querying indexes with Claude. Perfect for developers building semantic search, RAG applications, recommendation systems, and other vector-based applications with Pinecone.",
          "categories": [],
          "install_commands": [
            "/plugin marketplace add pinecone-io/pinecone-claude-code-plugin",
            "/plugin install pinecone@pinecone-plugins"
          ]
        }
      ]
    }
  ]
}