{
  "author": {
    "id": "Pitchlab",
    "display_name": "Erik van der Pluijm",
    "avatar_url": "https://avatars.githubusercontent.com/u/297937?v=4"
  },
  "marketplaces": [
    {
      "name": "founder-support-system",
      "version": null,
      "description": "Strategic planning and executive coaching for founders",
      "repo_full_name": "Pitchlab/founder-support-system",
      "repo_url": "https://github.com/Pitchlab/founder-support-system",
      "repo_description": "Claude Code Plugin for Founder Support",
      "signals": {
        "stars": 2,
        "forks": 0,
        "pushed_at": "2026-01-03T01:05:13Z"
      },
      "files": {
        ".claude-plugin/marketplace.json": "{\n  \"name\": \"founder-support-system\",\n  \"owner\": {\n    \"name\": \"Erik van der Pluijm\",\n    \"email\": \"erik@pitchlab.nl\"\n  },\n  \"metadata\": {\n    \"description\": \"Strategic planning and executive coaching for founders\"\n  },\n  \"plugins\": [\n    {\n      \"name\": \"founder-support-system\",\n      \"source\": \"./\",\n      \"description\": \"Strategic planning, quarterly reviews, and executive coaching for founders\",\n      \"version\": \"1.0.1\"\n    }\n  ]\n}\n",
        ".claude-plugin/plugin.json": "{\n  \"name\": \"founder-support-system\",\n  \"description\": \"Strategic planning, quarterly reviews, and executive coaching for founders. Includes Year Plan, OKRs, Personal Operating Model, multi-coach system (Executive, Financial), and comprehensive self-assessment tools.\",\n  \"version\": \"1.0.1\",\n  \"author\": {\n    \"name\": \"Erik van der Pluijm\",\n    \"email\": \"erik@pitchlab.nl\"\n  },\n  \"homepage\": \"https://github.com/Pitchlab/founder-support-system\",\n  \"repository\": \"https://github.com/Pitchlab/founder-support-system\",\n  \"license\": \"MIT\",\n  \"keywords\": [\n    \"planning\",\n    \"strategy\",\n    \"quarterly-review\",\n    \"okr\",\n    \"coaching\",\n    \"personal-operating-model\",\n    \"founder\",\n    \"bootstrap\",\n    \"vision\",\n    \"financial-planning\"\n  ]\n}\n",
        "README.md": "# Founder Support System\n\nStrategic planning and executive coaching plugin for founders and solopreneurs.\n\n## Overview\n\nA comprehensive Claude Code plugin providing:\n- **Year Planning**: OKR-based annual planning with strategic constraints\n- **Quarterly Reviews**: 30-60 min structured reviews with START/STOP/STAY/DOUBLE-DOWN decisions\n- **Personal Operating Model**: 60-90 min self-assessment covering strengths, weaknesses, pitfalls, decision system\n- **Vision & Manifesto**: Philosophical foundation with conviction and edge\n- **Multi-Coach System**: Executive Coach (strategy), Financial Coach (burn rate/runway)\n- **Working with Me**: User manual for colleagues and partners\n\n## Installation\n\n### Prerequisites\n\n1. **Claude Code** installed and configured\n2. **Notion MCP Server** - Required for Notion integration\n   - Install: [Notion MCP Server Guide](https://github.com/anthropics/notion-mcp)\n   - Configuration: Add to your Claude Code MCP settings\n3. **Notion workspace** with configured pages (see [SETUP.md](./SETUP.md))\n\n### Install Plugin\n\n```bash\n# From GitHub\nclaude plugin install github:Pitchlab/founder-support-system\n\n# Or clone and install locally\ngit clone https://github.com/Pitchlab/founder-support-system.git\ncd founder-support-system\nclaude plugin install .\n```\n\n### Quick Setup\n\n**Interactive Setup (Recommended)**:\n```bash\n/founder-support-system:setup\n```\nThe setup wizard will guide you through:\n1. Verifying Notion MCP Server installation\n2. Creating required Notion pages\n3. Configuring your Notion URLs\n4. Testing the connection\n\n**Manual Setup**: See [SETUP.md](./SETUP.md) for detailed step-by-step instructions.\n\n## Planning System Structure\n\nThe plugin integrates with a structured Notion workspace:\n\n```\n┌─────────────────────────────────────────────────────────────┐\n│                         DASHBOARD                            │\n├─────────────────────────────────────────────────────────────┤\n│  • Inbox (capture zone)                                     │\n│  • The System (daily operating rhythm)                      │\n│  • Daily Rhythm (habits, routines)                          │\n│  • Quarterly Rhythm (review cadence)                        │\n│  • Logbook (quarterly review entries)                       │\n└─────────────────────────────────────────────────────────────┘\n\n┌─────────────────────────────────────────────────────────────┐\n│                         STRATEGY                             │\n├─────────────────────────────────────────────────────────────┤\n│  • Year Plan (OKRs, quarterly themes, strategic constraints)│\n│  • Vision (mission themes, core beliefs, manifesto)         │\n│  • Personal Operating Model (strengths, weaknesses, system) │\n│  • Golden Rules (non-negotiable working principles)         │\n│  • Founder Wisdom (curated principles from thought leaders) │\n└─────────────────────────────────────────────────────────────┘\n```\n\n**Integration**: The plugin reads and updates these pages using the Notion MCP server.\n\n## Commands\n\n### Planning & Review\n- `/founder-support-system:year-plan` - Create/update annual Year Plan (60-90 min)\n- `/founder-support-system:quarterly-review` - Structured quarterly review (30-60 min)\n- `/founder-support-system:vision` - Create vision and manifesto (60-90 min)\n- `/founder-support-system:personal-operating-model` - Comprehensive self-assessment (60-90 min)\n- `/founder-support-system:working-with-me` - User manual creation (20-30 min)\n\n### Coaching\n- `/founder-support-system:coach` - Executive coach for daily decisions (< 2 min)\n- `/founder-support-system:financial-coach` - Burn rate and revenue coach (< 2 min)\n\n### Utilities\n- `/founder-support-system:get-year-and-quarter` - Get current year and quarter\n\n## Skills\n\nSkills auto-trigger based on conversation context:\n\n- **Year Plan**: Triggers when user mentions \"year plan\", \"OKRs\", \"annual planning\"\n- **Quarterly Review**: Triggers when user mentions \"quarterly review\", \"Q1/Q2/Q3/Q4 review\"\n- **Vision**: Triggers when user mentions \"vision\", \"manifesto\", \"mission\"\n- **Personal Operating Model**: Triggers when user mentions \"POM\", \"operating model\", \"strengths assessment\"\n- **Working with Me**: Triggers when user mentions \"working with me\", \"user manual\"\n- **Executive Coach**: Triggers when user says \"coach me\", \"am I on track\", \"what should I focus on\"\n- **Financial Coach**: Triggers when user asks about \"burn rate\", \"runway\", \"revenue targets\", \"finances\"\n\n## Features\n\n### Year Planning\n- OKR-based annual planning (max 2-3 OKRs)\n- Quarterly themes and outcomes\n- Strategic constraints and anti-goals\n- Financial targets and kill criteria\n- \"The Challenge\": one out-of-comfort-zone behavior shift\n\n### Quarterly Reviews\n- 7-section review framework\n- START/STOP/STAY/DOUBLE-DOWN decisions\n- Financial and capability tracking\n- Meta-analysis with constraint identification\n- Saves to Notion Logbook (organized by year/quarter)\n\n### Personal Operating Model\n- 11 comprehensive sections\n- Core Loop: Input → Transformation → Output\n- Evidence-based strengths assessment\n- Failure patterns with interrupt rules\n- Decision defaults and execution playbook\n- Philosophy: \"Design a system that works\"\n\n### Multi-Coach System\n- **Executive Coach**: Strategic alignment, OKRs, focus checks\n- **Financial Coach**: Burn rate, runway, Base/Best/Worst scenarios\n- Both reference your Year Plan, Vision, Golden Rules, and Founder Wisdom\n\n### Vision & Manifesto\n- 7 mission themes (big-picture objectives)\n- Core beliefs (operating principles)\n- Anti-manifesto (what you stand against)\n- Saved to Notion for reference by coaches\n\n### Working with Me\n- Personal user manual for colleagues/partners\n- Covers communication, management style, boundaries\n- References Personal Operating Model and Golden Rules\n\n## Philosophy\n\nBased on:\n- **OKR frameworks** (Google, Measure What Matters)\n- **Personal Operating Model** (Reboot.io)\n- **Pieter Levels' bootstrapping** (ship fast, monetize early)\n- **Stage 2 Capital's Base/Best/Worst planning** (scenario-based financial planning)\n- **Clare Hughes Johnson's leadership frameworks** (Scaling People)\n\n**Prime Directive**: Turn reflection into decisions.\n\n## Requirements\n\n- Claude Code CLI\n- Notion workspace with configured pages\n- Notion MCP Server configured\n\n## Configuration\n\nThe plugin loads Notion page URLs in the following order (first found wins):\n\n### 1. Project-Specific Configuration (Recommended)\n\nAdd configuration to `.claude/config.md` or `CLAUDE.md` in your project directory:\n\n```markdown\n# Project Configuration\n\n## Notion URLs\n\n- vision: https://www.notion.so/YOUR-VISION-PAGE-URL\n- yearPlan: https://www.notion.so/YOUR-YEAR-PLAN-PAGE-URL\n- personalOperatingModel: https://www.notion.so/YOUR-POM-PAGE-URL\n- goldenRules: https://www.notion.so/YOUR-GOLDEN-RULES-PAGE-URL\n- logbook: https://www.notion.so/YOUR-LOGBOOK-PAGE-URL\n- founderWisdom: https://www.notion.so/YOUR-FOUNDER-WISDOM-PAGE-URL\n```\n\n**Benefits**: Per-project configuration, workspace-specific URLs, version-controlled\n\n### 2. Plugin Default Configuration\n\nAlternatively, use `.claude-plugin/config.json` for global defaults:\n\n```json\n{\n  \"notion\": {\n    \"vision\": \"https://www.notion.so/YOUR-VISION-PAGE-URL\",\n    \"yearPlan\": \"https://www.notion.so/YOUR-YEAR-PLAN-PAGE-URL\",\n    \"personalOperatingModel\": \"https://www.notion.so/YOUR-POM-PAGE-URL\",\n    \"goldenRules\": \"https://www.notion.so/YOUR-GOLDEN-RULES-PAGE-URL\",\n    \"logbook\": \"https://www.notion.so/YOUR-LOGBOOK-PAGE-URL\",\n    \"founderWisdom\": \"https://www.notion.so/YOUR-FOUNDER-WISDOM-PAGE-URL\"\n  }\n}\n```\n\n**Benefits**: Single configuration for all projects\n\nSee [SETUP.md](./SETUP.md) for detailed configuration instructions.\n\n## Documentation\n\n- [SETUP.md](./SETUP.md) - Step-by-step setup guide\n- [CHANGELOG.md](./CHANGELOG.md) - Version history\n- [PUBLISH.md](./PUBLISH.md) - GitHub publishing guide\n\n## License\n\nMIT\n\n## Author\n\nErik van der Pluijm (erik@pitchlab.nl)\n"
      },
      "plugins": [
        {
          "name": "founder-support-system",
          "source": "./",
          "description": "Strategic planning, quarterly reviews, and executive coaching for founders",
          "version": "1.0.1",
          "categories": [],
          "install_commands": [
            "/plugin marketplace add Pitchlab/founder-support-system",
            "/plugin install founder-support-system@founder-support-system"
          ]
        }
      ]
    }
  ]
}