{
  "author": {
    "id": "qtnx",
    "display_name": "qtnx",
    "avatar_url": "https://avatars.githubusercontent.com/u/123870525?v=4"
  },
  "marketplaces": [
    {
      "name": "qtnx-marketplace",
      "version": null,
      "description": "Claude Code plugin with skills for task delegation to clink codex/gemini, PR review workflows, and code review iteration",
      "repo_full_name": "qtnx/qtnx-claude-plugin",
      "repo_url": "https://github.com/qtnx/qtnx-claude-plugin",
      "repo_description": "Claude Code plugin with skills for task delegation to clink codex/gemini, PR review workflows, and code review iteration",
      "signals": {
        "stars": 0,
        "forks": 0,
        "pushed_at": "2025-12-15T12:21:53Z"
      },
      "files": {
        ".claude-plugin/marketplace.json": "{\n  \"name\": \"qtnx-marketplace\",\n  \"owner\": {\n    \"name\": \"qtnx\"\n  },\n  \"plugins\": [\n    {\n      \"name\": \"qtnx-plugin\",\n      \"source\": \"./qtnx-plugin\",\n      \"description\": \"Claude Code plugin with skills for task delegation to clink codex/gemini, PR review workflows, and code review iteration\"\n    }\n  ]\n}\n",
        "README.md": "# qtnx-claude-plugin\n\nClaude Code plugin with skills for task delegation, PR review workflows, and code review iteration.\n\n## Skills Included\n\n| Skill | Trigger | Description |\n|-------|---------|-------------|\n| `clink-codex-delegate` | \"clink codex\" | Delegate coding tasks to clink codex/gemini with structured task briefs |\n| `gh-pr-review` | \"PR review\", \"show PR comments\" | Manage GitHub PR inline comments from terminal using gh-pr-review extension |\n| `iterate-review-with-codex` | \"codex review\", \"fix pr code review\" | Iterate code review workflow with codex |\n\n## Installation\n\n### Prerequisites\n\n- [Claude Code CLI](https://docs.anthropic.com/en/docs/claude-code) installed and configured\n- Git\n\n### Method 1: Install from GitHub Marketplace (Recommended)\n\n```bash\n# Start Claude Code\nclaude\n\n# Add the marketplace\n/plugin marketplace add qtnx/qtnx-claude-plugin\n\n# Install the plugin\n/plugin install qtnx-plugin@qtnx-marketplace\n```\n\n### Method 2: Install from Local Directory\n\n```bash\n# Clone the repository\ngit clone https://github.com/qtnx/qtnx-claude-plugin.git\n\n# Start Claude Code\nclaude\n\n# Add local marketplace\n/plugin marketplace add ./qtnx-claude-plugin\n\n# Install the plugin\n/plugin install qtnx-plugin@qtnx-marketplace\n```\n\n### Verify Installation\n\nAfter installation, restart Claude Code and verify:\n\n```bash\n# Check available commands\n/help\n\n# Check plugins\n/plugin\n```\n\n## Usage\n\nOnce installed, the skills activate automatically based on trigger keywords:\n\n### Delegate Tasks to Clink Codex\n\n```\nUse clink codex to implement the user authentication module\n```\n\nIf codex fails, switch to gemini:\n\n```\nUse clink gemini instead of codex for this task\n```\n\n### PR Review with gh-pr-review\n\n```\nShow me the unresolved PR review comments\n```\n\n```\nReply to the review thread about the null check\n```\n\n### Iterate Code Review\n\n```\nFix the codex review comments on this PR\n```\n\n## Plugin Structure\n\n```\nqtnx-claude-plugin/                  # Marketplace root (this repo)\n├── .claude-plugin/\n│   └── marketplace.json             # Marketplace manifest\n├── README.md\n└── qtnx-plugin/                     # Plugin directory\n    ├── .claude-plugin/\n    │   └── plugin.json              # Plugin metadata\n    ├── commands/                    # Custom slash commands\n    └── skills/\n        ├── clink-codex-delegate/    # Task delegation skill\n        ├── gh-pr-review/            # PR review management skill\n        └── iterate-review-with-codex/ # Review iteration skill\n```\n\n## Requirements for Skills\n\n### gh-pr-review Skill\n\nRequires the gh-pr-review extension:\n\n```bash\ngh extension install agynio/gh-pr-review\n```\n\n### clink-codex-delegate Skill\n\nRequires clink CLI with codex/gemini configured.\n\n## License\n\nMIT\n"
      },
      "plugins": [
        {
          "name": "qtnx-plugin",
          "source": "./qtnx-plugin",
          "description": "Claude Code plugin with skills for task delegation to clink codex/gemini, PR review workflows, and code review iteration",
          "categories": [],
          "install_commands": [
            "/plugin marketplace add qtnx/qtnx-claude-plugin",
            "/plugin install qtnx-plugin@qtnx-marketplace"
          ]
        }
      ]
    }
  ]
}