{
  "author": {
    "id": "rafaelkamimura",
    "display_name": "Rafael Kamimura",
    "avatar_url": "https://avatars.githubusercontent.com/u/49506004?u=f8d1c490cc7d94694779a61d27e36b4a219c213a&v=4"
  },
  "marketplaces": [
    {
      "name": "claude-tools",
      "version": null,
      "description": "Comprehensive Claude Code toolkit with FastAPI skills, Brazilian financial integrations, workflow automation, and 46 specialized AI agents",
      "repo_full_name": "rafaelkamimura/claude-tools",
      "repo_url": "https://github.com/rafaelkamimura/claude-tools",
      "repo_description": "Comprehensive Claude Code toolkit with FastAPI skills, Brazilian financial integrations, workflow automation, and 46 specialized AI agents",
      "signals": {
        "stars": 5,
        "forks": 0,
        "pushed_at": "2026-01-06T16:31:30Z"
      },
      "files": {
        ".claude-plugin/marketplace.json": "{\n  \"name\": \"claude-tools\",\n  \"description\": \"Comprehensive Claude Code toolkit with FastAPI skills, Brazilian financial integrations, workflow automation, and 46 specialized AI agents\",\n  \"owner\": {\n    \"name\": \"Rafael Kamimura\"\n  },\n  \"plugins\": [\n    {\n      \"name\": \"claude-tools\",\n      \"source\": \"./\",\n      \"description\": \"Full toolkit with skills, commands, hooks, and 46 specialized agents for Python/FastAPI development, Brazilian financial integrations, and workflow automation\",\n      \"version\": \"1.0.0\"\n    }\n  ]\n}\n",
        ".claude-plugin/plugin.json": "{\n  \"name\": \"claude-tools\",\n  \"description\": \"Comprehensive Claude Code toolkit: FastAPI clean architecture, Brazilian financial integrations, async testing patterns, workflow automation commands, and 46 specialized AI agents\",\n  \"version\": \"1.0.0\",\n  \"author\": {\n    \"name\": \"Rafael Kamimura\"\n  },\n  \"repository\": \"https://github.com/rafaelkamimura/claude-tools\",\n  \"license\": \"MIT\",\n  \"keywords\": [\n    \"fastapi\",\n    \"python\",\n    \"clean-architecture\",\n    \"brazilian-finance\",\n    \"pix\",\n    \"boleto\",\n    \"async-testing\",\n    \"pytest\",\n    \"workflow\",\n    \"productivity\",\n    \"agents\",\n    \"sso\",\n    \"authentication\"\n  ]\n}\n",
        "README.md": "# claude-tools\n\nA comprehensive Claude Code plugin with specialized skills, workflow commands, intelligent hooks, and 46 AI agents for Python/FastAPI development, Brazilian financial integrations, and productivity automation.\n\n## Installation\n\n```bash\n# Add the marketplace\n/plugin marketplace add rafaelkamimura/claude-tools\n\n# Install the plugin\n/plugin install claude-tools@claude-tools\n```\n\n## Contents\n\n### Skills (5 Domain Expertise Areas)\n\n| Skill | Description | Auto-Triggers |\n|-------|-------------|---------------|\n| **fastapi-clean-architecture** | Clean Architecture patterns for FastAPI with 3-layer design, DI, repository pattern | `fastapi`, `clean architecture` |\n| **brazilian-financial-integration** | Boleto, PIX payments, parcelamento, CPF/CNPJ validation, Banco do Brasil API | `boleto`, `pix`, `brazilian payment` |\n| **async-testing-expert** | pytest patterns for async Python testing, fixtures, mocking, 387-test reference | `pytest`, `async test` |\n| **multi-system-sso-authentication** | Enterprise SSO with JWT RS256, multi-provider support, session management | `sso`, `authentication`, `jwt` |\n| **skill-developer** | Meta-skill for creating and managing Claude Code skills | `create skill`, `skill development` |\n\n### Utility Skills\n\n- **mariadb-database-explorer** - Schema exploration and documentation generation\n- **gitlab-cli-troubleshooter** - GitLab CLI configuration and diagnostics\n- **mcp-setup-wizard** - Model Context Protocol server configuration\n\n### Commands (32 Workflow Automation)\n\n#### Task Management\n- `/task-init` - Intelligent task initialization with codebase exploration\n- `/brainstorm` - Deep thinking sessions for implementation ideas\n- `/todo-worktree` - Todo implementation program\n- `/dev-docs` - Strategic plan creation\n- `/dev-docs-update` - Documentation updates before context compaction\n\n#### Code Quality\n- `/review-code` - Pre-commit code review\n- `/test-suite` - Test suite runner\n- `/security-scan` - Security vulnerability scanning\n- `/perf-check` - Performance analysis\n- `/tech-debt` - Technical debt tracking\n- `/debug-assistant` - Intelligent debugging helper\n\n#### Git & Deployment\n- `/commit` - Smart git commit with conventional commits\n- `/deploy` - Smart deployment manager\n- `/rollback` - Emergency rollback procedures\n\n#### Documentation\n- `/read-specs` - Specification reader and task decomposer\n- `/write-documentation` - Documentation writer\n- `/mr-draft` - Merge request draft generator\n- `/handoff` - Team handoff assistant\n\n#### Azure DevOps Integration\n- `/fetch-azure-task` - Fetch Azure DevOps work items\n- `/update-azure-task` - Update work items\n- `/close-azure-task` - Close work items\n\n#### Utilities\n- `/standup` - Daily status generator\n- `/env-sync` - Environment manager\n- `/deps-update` - Dependency manager\n- `/sync-config` - Sync configuration to GitHub\n- `/create-skill` - Skill creation workflow\n- `/bslist` - Brainstorm list viewer\n\n### Agents (46 Specialized AI Subagents)\n\n#### Architecture & Design\n`backend-architect`, `code-architecture-reviewer`, `cloud-architect`, `graphql-architect`, `documentation-architect`, `plan-reviewer`\n\n#### Development\n`code-refactor-master`, `code-reviewer`, `frontend-developer`, `python-pro`, `golang-pro`, `typescript-expert`, `rust-pro`, `php-developer`, `laravel-vue-developer`, `nextjs-app-router-developer`, `drupal-developer`, `directus-developer`, `legacy-modernizer`\n\n#### Quality & Testing\n`test-automator`, `frontend-qa-tester`, `database-optimizer`, `performance-engineer`, `security-auditor`, `debugger`, `devops-troubleshooter`\n\n#### Data & AI\n`data-scientist`, `data-engineer`, `ml-engineer`, `ai-engineer`\n\n#### Financial & Crypto\n`payment-integration`, `arbitrage-bot`, `crypto-analyst`, `crypto-trader`, `crypto-risk-manager`, `defi-strategist`, `quant-analyst`\n\n#### Specialized\n`game-developer`, `mobile-developer`, `blockchain-developer`, `accessibility-specialist`, `api-documenter`, `web-research-specialist`, `ui-ux-designer`, `refactor-planner`\n\n### Hooks (Intelligent Automation)\n\nThis plugin includes a TypeScript-based hook system for automatic skill activation:\n\n- **UserPromptSubmit Hook** - Analyzes prompts and suggests relevant skills based on keywords and intent patterns\n- **PostToolUse Hook** - Tracks edited files and caches build commands for affected repositories\n\n**Requirements**: Node.js and npm/npx for hook execution.\n\n## Skill Activation System\n\nThe plugin includes `skill-rules.json` which defines automatic triggers for skills:\n\n```json\n{\n  \"skills\": {\n    \"fastapi-clean-architecture\": {\n      \"type\": \"domain\",\n      \"enforcement\": \"suggest\",\n      \"priority\": \"high\",\n      \"promptTriggers\": {\n        \"keywords\": [\"fastapi\", \"clean architecture\", \"repository pattern\"],\n        \"intentPatterns\": [\"build.*api\", \"create.*endpoint\"]\n      }\n    }\n  }\n}\n```\n\nWhen you type a prompt containing trigger keywords, the hook system will suggest activating the relevant skill.\n\n## Configuration\n\nAfter installation, skills and commands are available immediately. To customize:\n\n1. **Modify skill triggers**: Edit `skills/skill-rules.json`\n2. **Customize commands**: Edit individual command files in `commands/`\n3. **Add new agents**: Add markdown files to `agents/`\n\n## Requirements\n\n- Claude Code CLI\n- Node.js 18+ (for hooks)\n- npm or npx\n\n## License\n\nMIT\n\n## Author\n\nRafael Kamimura\n\n## Version\n\n1.0.0\n"
      },
      "plugins": [
        {
          "name": "claude-tools",
          "source": "./",
          "description": "Full toolkit with skills, commands, hooks, and 46 specialized agents for Python/FastAPI development, Brazilian financial integrations, and workflow automation",
          "version": "1.0.0",
          "categories": [],
          "install_commands": [
            "/plugin marketplace add rafaelkamimura/claude-tools",
            "/plugin install claude-tools@claude-tools"
          ]
        }
      ]
    }
  ]
}