{
  "author": {
    "id": "railroadmedia",
    "display_name": "Railroad Media",
    "avatar_url": "https://avatars.githubusercontent.com/u/26257100?v=4"
  },
  "marketplaces": [
    {
      "name": "musora-engineering",
      "version": "1.0.0",
      "description": "Internal marketplace for Musora's Claude Code plugins and MCP servers",
      "repo_full_name": "railroadmedia/claude-code-plugin-marketplace",
      "repo_url": "https://github.com/railroadmedia/claude-code-plugin-marketplace",
      "repo_description": "Musora's engineering claude code marketplace for distributing plugins internally. ",
      "signals": {
        "stars": 0,
        "forks": 0,
        "pushed_at": "2025-11-13T19:29:38Z"
      },
      "files": {
        ".claude-plugin/marketplace.json": "{\n  \"name\": \"musora-engineering\",\n  \"owner\": {\n    \"name\": \"Musora Engineering\"\n  },\n  \"description\": \"Internal marketplace for Musora's Claude Code plugins and MCP servers\",\n  \"version\": \"1.0.0\",\n  \"pluginRoot\": \"./plugins\",\n  \"plugins\": [\n    {\n      \"name\": \"backend-engineer-assistant\",\n      \"source\": \"./plugins/backend-engineer-assistant\",\n      \"description\": \"Backend engineering assistant with GitHub, Jira, and Context7 (Laravel) MCP integrations\",\n      \"version\": \"1.0.0\",\n      \"author\": {\n        \"name\": \"Musora Engineering\"\n      },\n      \"category\": \"development\",\n      \"keywords\": [\"backend\", \"laravel\", \"github\", \"jira\", \"mcp\"]\n    }\n  ]\n}\n",
        "README.md": "# Claude Code Plugin Marketplace\n\nMusora's internal marketplace for distributing Claude Code plugins and MCP servers across engineering teams.\n\n## Overview\n\nThis marketplace provides a centralized way to discover, install, and manage Claude Code plugins that enhance development workflows with integrations for GitHub, Jira, Laravel, and more.\n\n## Quick Start\n\n### Adding the Marketplace\n\nAdd this marketplace to your Claude Code installation:\n\n```bash\n/plugin marketplace add /path/to/claude-code-plugin-marketplace\n```\n\nOr if hosted on GitHub:\n\n```bash\n/plugin marketplace add railroadmedia/claude-code-plugin-marketplace\n```\n\n### Installing Plugins\n\nInstall the backend engineer assistant plugin:\n\n```bash\n/plugin install backend-engineer-assistant@musora-engineering\n```\n\nOr use the interactive menu:\n\n```bash\n/plugin\n```\n\nThen select \"Browse Plugins\" and choose from available plugins.\n\n## Available Plugins\n\n### Backend Engineer Assistant\n\nA comprehensive plugin for backend engineers working with Laravel, GitHub, and Jira.\n\n**Features:**\n- GitHub MCP integration for PR reviews, issue management, and repository operations\n- Jira MCP integration for ticket creation and project management\n- Context7 (Laravel) MCP for Laravel-specific code understanding and generation\n- Custom slash commands for common backend engineering tasks\n\n**Slash Commands:**\n- `/review-pr` - Review GitHub pull requests with detailed feedback\n- `/create-jira-ticket` - Create well-formatted Jira tickets\n- `/laravel-endpoint` - Generate complete Laravel API endpoints\n- `/debug-laravel` - Debug Laravel issues with context awareness\n- `/api-design` - Design RESTful APIs following best practices\n\n## Environment Setup\n\n### Quick Setup (Recommended)\n\nEach plugin includes a setup script to help configure environment variables:\n\n```bash\ncd plugins/backend-engineer-assistant\n./setup.sh\n```\n\nThe setup script will:\n- Interactively prompt for each required credential\n- Show where to find credentials in 1Password\n- Add environment variables directly to your shell profile\n- Export variables to your current terminal session\n\n### Manual Setup\n\nBefore using the plugins, configure the required environment variables:\n\n#### GitHub MCP\n```bash\nexport BE_GITHUB_TOKEN=\"your_github_personal_access_token\"\n```\n\n#### Jira MCP\n```bash\nexport BE_JIRA_URL=\"https://your-domain.atlassian.net\"\nexport BE_JIRA_EMAIL=\"your-email@musora.com\"\nexport BE_JIRA_API_TOKEN=\"your_jira_api_token\"\n```\n\n#### Context7 (Laravel) MCP\n```bash\nexport BE_LARAVEL_PROJECT_PATH=\"/path/to/your/laravel/project\"\n```\n\nCheck 1Password Engineering notes for team credentials.\n\nNote: All variables use the `BE_` prefix to avoid conflicts with other environment variables.\n\n## Team Configuration\n\nTo automatically install this marketplace for your team, add to your project's `.claude/settings.json`:\n\n```json\n{\n  \"extraKnownMarketplaces\": [\n    {\n      \"source\": \"railroadmedia/claude-code-plugin-marketplace\"\n    }\n  ],\n  \"plugins\": [\n    \"backend-engineer-assistant@musora-engineering\"\n  ]\n}\n```\n\n## Creating New Plugins\n\n1. Create a new directory under `plugins/`\n2. Add `.claude-plugin/plugin.json` with metadata\n3. Add optional components:\n   - `commands/` - Slash commands (markdown files)\n   - `.mcp.json` - MCP server configurations\n   - `agents/` - Custom agents\n   - `skills/` - Agent capabilities\n   - `hooks/` - Event handlers\n\n4. Register the plugin in `.claude-plugin/marketplace.json`\n\nExample plugin structure:\n```\nplugins/your-plugin/\n├── .claude-plugin/\n│   └── plugin.json\n├── commands/\n│   └── your-command.md\n└── .mcp.json\n```\n\n## Getting API Tokens\n\n### GitHub Token\n1. Go to GitHub Settings > Developer settings > Personal access tokens\n2. Generate new token with `repo` and `read:org` scopes\n3. Set as `BE_GITHUB_TOKEN` environment variable\n\n### Jira Token\n1. Go to https://id.atlassian.com/manage-profile/security/api-tokens\n2. Create API token\n3. Set `BE_JIRA_URL`, `BE_JIRA_EMAIL`, and `BE_JIRA_API_TOKEN` environment variables\n\n## Support\n\nFor issues or questions, contact the Musora Engineering team or create an issue at https://github.com/railroadmedia/claude-code-plugin-marketplace/issues \n",
        "plugins/backend-engineer-assistant/README.md": "# Backend Engineer Assistant Plugin\n\nA comprehensive Claude Code plugin designed for backend engineers working with Laravel, GitHub, and Jira.\n\n## Features\n\n### MCP Server Integrations\n\nThis plugin includes three powerful MCP (Model Context Protocol) servers:\n\n1. **GitHub MCP** - Direct integration with GitHub for:\n   - Pull request reviews and analysis\n   - Issue management\n   - Repository operations\n   - Code search across repositories\n\n2. **Jira MCP** - Jira integration for:\n   - Ticket creation and management\n   - Sprint planning\n   - Issue tracking\n   - Project management\n\n3. **Context7 (Laravel) MCP** - Laravel-specific tooling:\n   - Laravel codebase understanding\n   - Artisan command suggestions\n   - Laravel best practices\n   - Framework-aware code generation\n\n### Custom Slash Commands\n\n#### `/example-command`\nExample command for copying and setting up new commands.\n\n## Installation\n\nInstall this plugin from the Musora marketplace:\n\n```bash\n/plugin install backend-engineer-assistant@musora-engineering\n```\n\n## Configuration\n\n### Quick Setup (Recommended)\n\nRun the interactive setup script:\n\n```bash\ncd plugins/backend-engineer-assistant\n./setup.sh\n```\n\nThe script will:\n- Prompt you for each required environment variable\n- Provide instructions on where to find credentials in 1Password\n- Add the environment variables directly to your shell profile (~/.bashrc, ~/.zshrc, etc.)\n- Export the variables to your current terminal session\n\n### Manual Setup\n\nAlternatively, set up the following environment variables manually:\n\n```bash\n# GitHub\nexport BE_GITHUB_TOKEN=\"your_github_personal_access_token\"\n\n# Jira\nexport BE_JIRA_URL=\"https://your-domain.atlassian.net\"\nexport BE_JIRA_EMAIL=\"your-email@musora.com\"\nexport BE_JIRA_API_TOKEN=\"your_jira_api_token\"\n\n# Laravel/Context7\nexport BE_LARAVEL_PROJECT_PATH=\"/path/to/your/laravel/project\"\n```\n\nCheck 1Password Engineering notes for existing credentials.\n\nNote: All variables are prefixed with `BE_` to avoid conflicts with other environment variables on your machine.\n\n## Usage Examples\n\n### Review a Pull Request\n```\n/review-pr\n```\nClaude will use the GitHub MCP to fetch the PR details and provide a comprehensive review.\n\n### Create a Jira Ticket\n```\n/create-jira-ticket\n```\nDescribe your feature or bug, and Claude will help format a professional Jira ticket.\n\n### Generate a Laravel API Endpoint\n```\n/laravel-endpoint\n```\nSpecify your requirements, and Claude will generate a complete, tested API endpoint following Laravel best practices.\n\n### Debug a Laravel Issue\n```\n/debug-laravel\n```\nDescribe the issue, and Claude will use Context7 to understand your Laravel codebase and help identify the problem.\n\n### Design an API\n```\n/api-design\n```\nDescribe your requirements, and Claude will help design a RESTful API with proper structure and best practices.\n\n## Requirements\n\n- Claude Code CLI\n- Node.js and npm (for MCP servers)\n- Access to GitHub, Jira, and Laravel projects as needed\n\n## Troubleshooting\n\n### MCP Server Not Connecting\n- Verify environment variables are set correctly\n- Check that npm can access the MCP server packages\n- Ensure tokens have the required permissions\n\n### Commands Not Working\n- Verify the plugin is enabled: `/plugin`\n- Reinstall the plugin if needed\n- Check Claude Code logs for errors\n\n## Contributing\n\nTo add new commands or features to this plugin:\n\n1. Add new command files to the `commands/` directory\n2. Update the plugin version in `.claude-plugin/plugin.json`\n3. Test the changes locally\n4. Submit for review to the Musora engineering team\n\n## Support\n\nFor issues or questions about this plugin, contact the Musora Engineering team.\n"
      },
      "plugins": [
        {
          "name": "backend-engineer-assistant",
          "source": "./plugins/backend-engineer-assistant",
          "description": "Backend engineering assistant with GitHub, Jira, and Context7 (Laravel) MCP integrations",
          "version": "1.0.0",
          "author": {
            "name": "Musora Engineering"
          },
          "category": "development",
          "keywords": [
            "backend",
            "laravel",
            "github",
            "jira",
            "mcp"
          ],
          "categories": [
            "backend",
            "development",
            "github",
            "jira",
            "laravel",
            "mcp"
          ],
          "install_commands": [
            "/plugin marketplace add railroadmedia/claude-code-plugin-marketplace",
            "/plugin install backend-engineer-assistant@musora-engineering"
          ]
        }
      ]
    }
  ]
}