{
  "author": {
    "id": "rand",
    "display_name": "Rand Arete",
    "avatar_url": "https://avatars.githubusercontent.com/u/2835?u=682e1f30172b40f29d6fbd85ba75be9355299fb7&v=4"
  },
  "marketplaces": [
    {
      "name": "cc-polymath-marketplace",
      "version": null,
      "description": "Official marketplace for cc-polymath: efficient skill management with progressive discovery across 33+ domains",
      "repo_full_name": "rand/cc-polymath",
      "repo_url": "https://github.com/rand/cc-polymath",
      "repo_description": "Claude Code skills and workflows, optimized for context-efficiency and skill quality. Skills ranging from cloud infrastructure to design to advanced maths.",
      "signals": {
        "stars": 65,
        "forks": 7,
        "pushed_at": "2026-02-03T02:33:27Z"
      },
      "files": {
        ".claude-plugin/marketplace.json": "{\n  \"name\": \"cc-polymath-marketplace\",\n  \"description\": \"Official marketplace for cc-polymath: efficient skill management with progressive discovery across 33+ domains\",\n  \"owner\": {\n    \"name\": \"rand\",\n    \"url\": \"https://github.com/rand/cc-polymath\"\n  },\n  \"plugins\": [\n    {\n      \"name\": \"cc-polymath\",\n      \"source\": \"./\",\n      \"description\": \"Efficient skill management with progressive discovery ‚Äî 410+ production-ready skills across 33+ domains.\",\n      \"version\": \"3.1.0\"\n    }\n  ]\n}\n",
        ".claude-plugin/plugin.json": "{\n  \"name\": \"cc-polymath\",\n  \"version\": \"3.1.0\",\n  \"description\": \"Efficient skill management system with progressive discovery ‚Äî 410+ production-ready skills across 33+ domains\",\n  \"author\": {\n    \"name\": \"rand\"\n  },\n  \"homepage\": \"https://github.com/rand/cc-polymath\",\n  \"repository\": \"https://github.com/rand/cc-polymath\",\n  \"license\": \"MIT\",\n  \"keywords\": [\n    \"skills\",\n    \"gateway\",\n    \"progressive-loading\",\n    \"diagrams\",\n    \"mermaid\",\n    \"ml\",\n    \"api\",\n    \"database\",\n    \"testing\",\n    \"infrastructure\",\n    \"mathematics\",\n    \"debugging\",\n    \"frontend\",\n    \"backend\",\n    \"rust\",\n    \"python\",\n    \"zig\",\n    \"cryptography\",\n    \"protocols\",\n    \"engineering\",\n    \"mobile\",\n    \"cloud\",\n    \"devops\",\n    \"security\",\n    \"performance\",\n    \"observability\",\n    \"pyo3\",\n    \"dspy\",\n    \"mcp\",\n    \"agentic\",\n    \"prompt-engineering\",\n    \"git-workflows\",\n    \"code-review\",\n    \"context-efficient\"\n  ],\n  \"skills\": \"./skills\",\n  \"agents\": \"./agents\",\n  \"commands\": \"./commands\",\n  \"hooks\": {\n    \"SessionStart\": [\n      {\n        \"matcher\": \"\",\n        \"hooks\": [\n          {\n            \"type\": \"command\",\n            \"command\": \"echo 'cc-polymath v3.1.0 loaded (410+ skills, 40 gateways). Use /skills to discover relevant skills. Root: ${CLAUDE_PLUGIN_ROOT}'\"\n          }\n        ]\n      }\n    ]\n  }\n}\n",
        "README.md": "# Atomic Skills for Claude Code\n\n[![Claude Code Plugin](https://img.shields.io/badge/Claude%20Code-Plugin-blue)](https://docs.claude.com/en/docs/claude-code/plugins)\n[![Skills](https://img.shields.io/badge/Skills-410%2B-green)](skills/)\n[![License](https://img.shields.io/badge/License-MIT-yellow)](LICENSE)\n\n**Context-efficient development knowledge via progressive skill discovery**\n\n## New? Start Here\n\n**Install in 30 seconds**:\n```\n/plugin marketplace add rand/cc-polymath\n/plugin install cc-polymath@cc-polymath\n```\n\n**Your first 3 commands**:\n```bash\n/skills                    # See what's recommended for your project\n/discover-frontend         # Load React, Next.js, TypeScript skills (example)\nbash <cc-polymath-root>/scripts/verify-install.sh  # Verify installation\n```\n\n**Learn more**:\n- üìñ **[Getting Started Guide](docs/GETTING_STARTED.md)** - 5-minute quick start\n- üí¨ **[Example Conversations](docs/FIRST_CONVERSATIONS.md)** - See it in action\n- üÜò **[Troubleshooting](docs/TROUBLESHOOTING.md)** - Common issues & solutions\n- ‚ùì **[FAQ](docs/FAQ.md)** - Quick answers\n\n---\n\nThis repository solves a tradeoff problem: how to give Claude Code access to comprehensive development knowledge without overwhelming its context window on boot. The solution is atomic, composable skills organized through a multi-tier discovery system.\n\n## The Problem: Context vs Coverage\n\nUsing the default mechanism with many atomic skills yields a dilemma:\n- **Load everything upfront** ‚Üí 25K+ tokens consumed before any real work begins\n- **Load nothing** ‚Üí Claude lacks essential patterns and best practices\n- **Manual loading** ‚Üí Users must know what exists to ask for it\n\nThis creates an challenging tradeoff between comprehensive coverage and context efficiency.\n\n## The Solution: Atomic Skills + Progressive Discovery\n\n### Atomic Skills (410+ total)\nEach skill is **focused, self-contained, and composable**:\n- Average 320 lines - small enough to load quickly\n- Single responsibility - covers one clear topic\n- Production-tested - real patterns from building at scale\n- Cross-referenced - links to related skills for composition\n\n**Why atomic matters**: Loading 5 focused skills (1.5K tokens) beats loading one monolithic guide (8K tokens) when you only need specific knowledge. Granularity enables precision.\n\n### Three-Tier Architecture\n\n**Tier 1: Gateway Skills (40 auto-discovered Agent Skills)**\nLightweight entry points that activate automatically based on keywords:\n- `discover-api` ‚Üí triggers on \"REST\", \"GraphQL\", \"authentication\"\n- `discover-database` ‚Üí triggers on \"PostgreSQL\", \"MongoDB\", \"Redis\"\n- `discover-zig` ‚Üí triggers on \"Zig\", \"comptime\", \"allocators\"\n\nEach gateway is ~200 lines with quick reference and loading commands.\n\n**Tier 2: Category Indexes (30 detailed references)**\nFull skill listings with descriptions, use cases, and workflows:\n- `api/INDEX.md` ‚Üí All 7 API skills with integration patterns\n- `database/INDEX.md` ‚Üí All 11 database skills with decision trees\n- Only loaded when browsing or planning work\n\n**Tier 3: Individual Skills (on-demand)**\nComplete implementation guides loaded only when needed:\n- `api/rest-api-design.md` ‚Üí Full REST patterns\n- `database/postgres-query-optimization.md` ‚Üí EXPLAIN plans, indexes\n\n### Why This Works\n\n**Context efficiency**: 60-84% reduction vs monolithic index\n- Old approach: Load 25K token index on boot\n- New approach: Load 2-5K tokens of relevant gateways as needed\n- Result: More context available for actual code and conversation\n\n**No boot overhead**: Claude Code starts with zero skills loaded\n- Gateway skills auto-discover based on your prompt keywords\n- Manual loading available when auto-discovery isn't enough\n- System scales to hundreds more skills without boot cost\n\n**Discoverability**: Users don't need to know what exists\n- Keywords in prompts trigger relevant gateways automatically\n- Gateways show what's available in their domain\n- Progressive loading: gateway ‚Üí index ‚Üí specific skill\n\n## What's Covered\n\n### Core Development (125 skills)\n\n**Languages & Frameworks**:\n- **Backend**: Python (uv), Zig, Rust, Go (31 skills)\n- **Frontend**: React, Next.js, TypeScript, Elegant Design (9 skills)\n- **Mobile**: SwiftUI, Swift concurrency, SwiftData, React Native (10 skills)\n\n**Infrastructure & DevOps**:\n- **Build Systems**: Make, CMake, Gradle, Maven, Bazel, cross-platform (8 skills)\n- **Debugging**: GDB, LLDB, Python, browser, memory, concurrency, production, distributed systems (14 skills)\n- **Cloud**: AWS (7), GCP (6), Modal.com, Cloudflare Workers, Vercel (13 skills)\n- **Containers**: Docker, Kubernetes, security (5 skills)\n- **CI/CD**: GitHub Actions, pipelines (4 skills)\n- **Observability**: Logging, metrics, tracing, OpenTelemetry, incident response (8 skills)\n\n**Data & APIs**:\n- **Databases**: Postgres, MongoDB, Redis, Redpanda, Iceberg, DuckDB (11 skills)\n- **Caching**: Multi-layer (browser, HTTP, CDN, Redis), invalidation strategies (7 skills)\n- **API Design**: REST, GraphQL, auth, rate limiting, versioning (7 skills)\n- **Data Engineering**: ETL, streaming, batch processing (5 skills)\n- **Testing**: Unit, integration, e2e, TDD, coverage (6 skills)\n\n### Specialized Domains (85 skills)\n\n**Machine Learning & AI** (33 skills):\n- **LLM Evaluation**: Benchmarks (MMLU, HellaSwag), frameworks (Arize Phoenix, Braintrust), LLM-as-judge (Prometheus, G-Eval), RAGAS metrics\n- **Model Routing**: RouteLLM, model comparison, multi-model orchestration\n- **Advanced RAG**: Hybrid search, reranking (cross-encoder, LLM), GraphRAG, hierarchical retrieval\n- **DSPy Framework**: Signatures, modules, optimizers, RAG, assertions (7 skills)\n- **HuggingFace**: Hub, Transformers, Datasets, Spaces, AutoTrain (5 skills)\n- **Fine-tuning**: Unsloth, LoRA/PEFT, dataset prep (3 skills)\n\n**Rust & PyO3** (19 skills):\n- **DSPy-PyO3 Integration**: RAG pipelines, agents, async streaming, production deployment, optimization (7 skills with 36 production examples)\n- **Performance**: GIL management, parallel execution, data science, collections/iterators (6 skills)\n- **Web**: Axum frameworks, streaming responses, IPC, gRPC (2 skills)\n- **Production**: Packaging, testing, debugging, modules/functions/errors (4 skills with 20 examples)\n\n**Information Retrieval** (5 skills):\n- Search fundamentals (TF-IDF, BM25, Elasticsearch)\n- Vector search (dense retrieval, embeddings)\n- Ranking & reranking (learning to rank, cross-encoders)\n- Recommendation systems (collaborative, content-based, hybrid)\n- Query understanding (expansion, spell correction, semantic search)\n\n**Programming Language Theory** (13 skills):\n- Lambda calculus, type systems, dependent types\n- Curry-Howard correspondence, operational semantics\n- Program verification with Hoare logic\n- **Typed Holes & Live Programming**: Hazel/Hazelnut calculus, incremental typing\n- **AI-Assisted Programming**: LLM + typed holes integration (OOPSLA 2024), type-driven code synthesis\n\n**Formal Methods** (10 skills):\n- **SAT/SMT Solvers**: Z3 basics, SAT strategies, SMT theory (3 skills)\n- **Lean 4**: Proof basics, tactics, mathlib4, theorem proving (4 skills)\n- **Constraint Satisfaction**: CSP modeling, propagation, backtracking (3 skills)\n\n**Advanced Mathematics** (11 skills):\n- **Numerical**: Linear algebra, optimization, probability/statistics (4 skills)\n- **Pure Math**: Topology (point-set, algebraic), category theory, differential equations, abstract algebra, set theory, number theory (7 skills)\n\n**Systems Programming** (8 skills):\n- **WebAssembly**: Fundamentals, Rust toolchain, browser integration, server-side (4 skills)\n- **eBPF**: Fundamentals, tracing/observability, networking, security monitoring (4 skills)\n\n**Collaboration & Process** (14 skills):\n- **GitHub**: Repository management, pull requests, issues/projects, security, Actions (5 skills)\n- **PRD Writing**: Structure, requirements gathering, user stories, technical specs (4 skills)\n- **RFC Writing**: Structure, technical design, consensus building, decision docs (4 skills)\n\n**Real-time & Networking** (5 skills):\n- WebSocket, Server-Sent Events, pub/sub patterns\n- Tailscale VPN, mTLS, NAT traversal, Mosh\n- Network resilience patterns\n\n### Workflow & Meta Skills (7 skills)\n\n- **Beads**: AI-native task management, context strategies, multi-session workflows (4 skills)\n- **TUI Development**: Bubble Tea (Go), Ratatui (Rust) (5 skills)\n- **Skill Discovery**: Intelligent skill activation for repos and prompts (5 skills)\n- **Anti-Slop**: Detection and cleanup of AI-generated patterns (Agent Skill)\n- **Elegant Design**: World-class accessible interfaces, design systems (Agent Skill)\n- **Typed Holes Refactor**: Systematic TDD-based refactoring (Agent Skill)\n\n## Quick Start\n\n### Installation\n\n**As Claude Code Plugin (Recommended)**:\n```bash\n/plugin install https://github.com/rand/cc-polymath\n```\n\nThat's it! All 410+ skills and the `/skills` command are immediately available.\n\n**For local development or testing**:\n```bash\n/plugin install /Users/rand/src/cc-polymath\n```\n\n### Auto-Discovery (How It Works)\nJust start working. Claude Code automatically activates relevant gateway skills based on your task keywords.\n\n**Example**: Mention \"REST API with PostgreSQL\" ‚Üí `discover-api` and `discover-database` gateways activate automatically.\n\n### Manual Loading\nWhen you need to browse or plan:\n\n```bash\n# Browse skills catalog\ncat skills/README.md\n\n# View a category\ncat skills/api/INDEX.md          # All API skills\ncat skills/database/INDEX.md     # All database skills\n\n# Load a gateway\ncat skills/discover-ml/SKILL.md  # ML gateway with quick reference\n\n# Load specific skills\ncat skills/api/rest-api-design.md\ncat skills/database/postgres-query-optimization.md\n```\n\n### Composing Workflows\n\nSkills are designed to combine for complex workflows:\n\n**Full-stack web app**:\n```bash\ncat skills/api/rest-api-design.md\ncat skills/frontend/nextjs-app-router.md\ncat skills/database/postgres-schema-design.md\ncat skills/caching/redis-caching-patterns.md\ncat skills/cicd/github-actions-workflows.md\n```\n\n**ML deployment with DSPy**:\n```bash\ncat skills/ml/dspy-setup.md\ncat skills/ml/dspy-modules.md\ncat skills/modal/modal-gpu-workloads.md\ncat skills/modal/modal-web-endpoints.md\ncat skills/observability/structured-logging.md\n```\n\n**Multi-layer caching strategy**:\n```bash\ncat skills/caching/caching-fundamentals.md\ncat skills/caching/service-worker-caching.md    # Browser\ncat skills/caching/http-caching.md              # HTTP layer\ncat skills/caching/cdn-edge-caching.md          # CDN edge\ncat skills/caching/redis-caching-patterns.md    # Application\ncat skills/caching/cache-invalidation-strategies.md\n```\n\n**iOS app with streaming backend**:\n```bash\ncat skills/mobile/swiftui-architecture.md\ncat skills/mobile/swift-concurrency.md\ncat skills/mobile/swiftdata-persistence.md\ncat skills/mobile/ios-networking.md\ncat skills/database/redpanda-streaming.md\n```\n\n## Repository Structure\n\n```\n.\n‚îú‚îÄ‚îÄ CLAUDE.md              # Development guidelines & protocols\n‚îÇ                          # - Multi-agent orchestration\n‚îÇ                          # - Work Plan Protocol (4 phases)\n‚îÇ                          # - Language standards (uv, cargo, zig)\n‚îÇ                          # - Testing protocols\n‚îÇ                          # - Anti-patterns\n‚îÇ\n‚îú‚îÄ‚îÄ README.md              # This file\n‚îÇ\n‚îî‚îÄ‚îÄ skills/                # 283 atomic skills, 31 gateways, 30 categories\n    ‚îÇ\n    ‚îú‚îÄ‚îÄ README.md          # Skills catalog\n    ‚îÇ\n    ‚îú‚îÄ‚îÄ Gateway Skills (31 auto-discovered Agent Skills)\n    ‚îÇ   ‚îú‚îÄ‚îÄ discover-api/           # REST, GraphQL, authentication\n    ‚îÇ   ‚îú‚îÄ‚îÄ discover-database/      # PostgreSQL, MongoDB, Redis\n    ‚îÇ   ‚îú‚îÄ‚îÄ discover-frontend/      # React, Next.js, UI components\n    ‚îÇ   ‚îú‚îÄ‚îÄ discover-ml/            # Machine learning, models\n    ‚îÇ   ‚îú‚îÄ‚îÄ discover-math/          # Mathematics, algorithms\n    ‚îÇ   ‚îú‚îÄ‚îÄ discover-plt/           # Programming language theory\n    ‚îÇ   ‚îú‚îÄ‚îÄ discover-formal/        # Formal methods, verification\n    ‚îÇ   ‚îú‚îÄ‚îÄ discover-cloud/         # Serverless, cloud platforms\n    ‚îÇ   ‚îú‚îÄ‚îÄ discover-zig/           # Zig systems programming\n    ‚îÇ   ‚îú‚îÄ‚îÄ discover-networking/    # SSH, mTLS, VPN, resilience\n    ‚îÇ   ‚îú‚îÄ‚îÄ discover-workflow/      # Beads, context strategies\n    ‚îÇ   ‚îî‚îÄ‚îÄ ... 20 more gateways\n    ‚îÇ\n    ‚îú‚îÄ‚îÄ Category Indexes (30 detailed references)\n    ‚îÇ   ‚îú‚îÄ‚îÄ api/INDEX.md            # All API skills overview\n    ‚îÇ   ‚îú‚îÄ‚îÄ database/INDEX.md       # All database skills overview\n    ‚îÇ   ‚îú‚îÄ‚îÄ ml/INDEX.md             # All ML skills overview\n    ‚îÇ   ‚îî‚îÄ‚îÄ ... 27 more indexes\n    ‚îÇ\n    ‚îî‚îÄ‚îÄ Skills by Category\n        ‚îú‚îÄ‚îÄ api/           # REST, GraphQL, auth (7)\n        ‚îú‚îÄ‚îÄ database/      # Postgres, MongoDB, Redis, streaming (11)\n        ‚îú‚îÄ‚îÄ frontend/      # React, Next.js, performance (8)\n        ‚îú‚îÄ‚îÄ mobile/        # iOS/Swift, SwiftUI, SwiftData (10)\n        ‚îú‚îÄ‚îÄ testing/       # Unit, integration, e2e (6)\n        ‚îú‚îÄ‚îÄ caching/       # Multi-layer caching (7)\n        ‚îú‚îÄ‚îÄ build-systems/ # Make, CMake, Gradle, Maven, Bazel (8)\n        ‚îú‚îÄ‚îÄ debugging/     # GDB, LLDB, production, memory (14)\n        ‚îú‚îÄ‚îÄ cloud/         # AWS, GCP, Modal, serverless (13)\n        ‚îú‚îÄ‚îÄ containers/    # Docker, Kubernetes (5)\n        ‚îú‚îÄ‚îÄ cicd/          # GitHub Actions, pipelines (4)\n        ‚îú‚îÄ‚îÄ observability/ # Logging, metrics, tracing (8)\n        ‚îú‚îÄ‚îÄ ml/            # DSPy, HuggingFace, LLM, RAG (30)\n        ‚îú‚îÄ‚îÄ ir/            # Information retrieval (5)\n        ‚îú‚îÄ‚îÄ math/          # Linear algebra, topology, category theory (19)\n        ‚îú‚îÄ‚îÄ plt/           # Type systems, verification, typed holes (13)\n        ‚îú‚îÄ‚îÄ formal/        # SAT/SMT, Lean, CSP (10)\n        ‚îú‚îÄ‚îÄ wasm/          # WebAssembly (4)\n        ‚îú‚îÄ‚îÄ ebpf/          # eBPF kernel programming (4)\n        ‚îú‚îÄ‚îÄ networking/    # SSH, mTLS, VPN, NAT traversal (5)\n        ‚îú‚îÄ‚îÄ tui/           # Terminal UI: Bubble Tea, Ratatui (5)\n        ‚îú‚îÄ‚îÄ zig/           # Zig systems programming (6)\n        ‚îú‚îÄ‚îÄ rust/          # Rust & PyO3: DSPy integration, performance, production (19)\n        ‚îú‚îÄ‚îÄ workflow/      # Beads task management (4)\n        ‚îú‚îÄ‚îÄ data/          # ETL, streaming, batch (5)\n        ‚îú‚îÄ‚îÄ deployment/    # Heroku, Netlify (6)\n        ‚îú‚îÄ‚îÄ realtime/      # WebSocket, SSE, pub/sub (4)\n        ‚îú‚îÄ‚îÄ collaboration/ # GitHub, CodeTour (6)\n        ‚îú‚îÄ‚îÄ product/       # PRD writing (4)\n        ‚îú‚îÄ‚îÄ engineering/   # RFC writing (4)\n        ‚îú‚îÄ‚îÄ infrastructure/# Terraform, Cloudflare Workers (6)\n        ‚îÇ\n        ‚îú‚îÄ‚îÄ Agent Skills (Root)\n        ‚îÇ   ‚îú‚îÄ‚îÄ anti-slop/          # AI slop detection & cleanup\n        ‚îÇ   ‚îú‚îÄ‚îÄ elegant-design/     # World-class UI design\n        ‚îÇ   ‚îî‚îÄ‚îÄ typed-holes-refactor/ # Systematic refactoring\n        ‚îÇ\n        ‚îî‚îÄ‚îÄ Meta Skills (Root)\n            ‚îú‚îÄ‚îÄ skill-repo-discovery.md    # Analyze repos for skills\n            ‚îú‚îÄ‚îÄ skill-prompt-discovery.md  # Extract signals from prompts\n            ‚îú‚îÄ‚îÄ skill-creation.md          # Create new skills\n            ‚îî‚îÄ‚îÄ skill-*-planning.md        # Planning workflows\n```\n\n## Technology Coverage\n\n| Domain | Technologies | Skills | Gateway |\n|--------|-------------|--------|---------|\n| **Backend** | Python, Zig, Rust, Go | 18 | discover-backend |\n| **Frontend** | React, Next.js, TypeScript | 9 | discover-frontend |\n| **Mobile** | SwiftUI, Swift, React Native | 10 | discover-mobile |\n| **Build** | Make, CMake, Gradle, Maven, Bazel | 8 | discover-build-systems |\n| **Debug** | GDB, LLDB, pdb, DevTools, Valgrind | 14 | discover-debugging |\n| **Cloud** | AWS, GCP, Modal, Vercel, Cloudflare | 27 | discover-cloud |\n| **Database** | Postgres, Mongo, Redis, Redpanda, Iceberg | 11 | discover-database |\n| **Caching** | Redis, HTTP, CDN, Service Workers | 7 | discover-caching |\n| **ML/AI** | DSPy, HuggingFace, Arize, GraphRAG | 33 | discover-ml |\n| **Rust/PyO3** | DSPy integration, RAG, agents, async, production | 19 | N/A |\n| **IR** | Elasticsearch, Vector DBs, Ranking | 5 | discover-ir |\n| **Systems** | WebAssembly, eBPF | 8 | discover-wasm, discover-ebpf |\n| **Collaboration** | GitHub, PRD, RFC | 17 | discover-collaboration, discover-product, discover-engineering |\n| **Formal** | Z3, Lean 4, CSP | 10 | discover-formal |\n| **Math** | Linear algebra, topology, category theory | 19 | discover-math |\n| **PLT** | Lambda calculus, type systems, typed holes | 13 | discover-plt |\n| **DevOps** | GitHub Actions, Terraform, K8s, Docker | 16 | discover-cicd, discover-infrastructure, discover-containers |\n| **Observability** | Prometheus, OpenTelemetry, Grafana | 8 | discover-observability |\n| **Networking** | SSH, mTLS, VPN, Tailscale, NAT | 5 | discover-networking |\n| **TUI** | Bubble Tea, Ratatui | 5 | discover-tui |\n| **Zig** | Build systems, C interop, memory management | 6 | discover-zig |\n| **Workflow** | Beads, context strategies | 4 | discover-workflow |\n\n## Development Philosophy\n\n### Atomic & Composable\n- **Focused**: Each skill covers one topic (~320 lines)\n- **Self-contained**: Can be loaded independently\n- **Cross-referenced**: Links to related skills\n- **Production-tested**: Real patterns from building at scale\n\n### Progressive Discovery\n- **Zero boot cost**: No skills loaded until needed\n- **Automatic activation**: Gateway skills trigger on keywords\n- **Manual override**: Browse and load specific skills\n- **Context efficient**: Load only what's relevant\n\n### Quality Standards\n- ‚úÖ **Code Block Validation**: 1100+ blocks syntax-checked\n- ‚úÖ **Frontmatter Validation**: 283 skills with YAML metadata\n- ‚úÖ **Date Validation**: No future dates in \"Last Updated\"\n- ‚úÖ **CI/CD Pipeline**: Automated validation on every commit\n- ‚úÖ **Cross-References**: Related skills linked for discoverability\n\n## CLAUDE.md Development Guidelines\n\nThis repository includes comprehensive development guidelines in `CLAUDE.md`:\n\n- **Multi-Agent Orchestration**: Coordinated system with Orchestrator, Optimizer, Reviewer, Executor\n- **Work Plan Protocol**: 4-phase development (Prompt‚ÜíSpec‚ÜíFull Spec‚ÜíPlan‚ÜíArtifacts)\n- **Beads Workflow**: AI-native task management with dependencies\n- **Language Standards**: Correct tools (uv not pip, etc.)\n- **Testing Protocol**: Commit before testing (mandatory)\n- **Anti-Patterns**: Critical violations and recovery procedures\n\n## Example Use Cases\n\n### Build ML-powered API\n```bash\ncat skills/ml/dspy-setup.md              # Configure DSPy\ncat skills/ml/dspy-modules.md            # Build RAG pipeline\ncat skills/ml/dspy-optimizers.md         # Optimize prompts\ncat skills/modal/modal-gpu-workloads.md  # Deploy on GPU\ncat skills/modal/modal-web-endpoints.md  # Expose API\ncat skills/api/rest-api-design.md        # Design contract\ncat skills/api/api-rate-limiting.md      # Protect endpoint\n```\n\n### Formal Verification\n```bash\ncat skills/plt/type-systems.md           # Type soundness\ncat skills/plt/dependent-types.md        # Œ†-types, Œ£-types\ncat skills/plt/program-verification.md   # Hoare logic\ncat skills/formal/lean-proof-basics.md   # Formalize in Lean\ncat skills/formal/z3-solver-basics.md    # SMT checking\n```\n\n### AI-Assisted Programming\n```bash\ncat skills/plt/typed-holes-foundations.md  # Gradual typing\ncat skills/plt/typed-holes-llm.md          # LLM integration\ncat skills/plt/live-programming-holes.md   # Real-time feedback\n```\n\n### Multi-Layer Caching\n```bash\ncat skills/caching/caching-fundamentals.md           # Core patterns\ncat skills/caching/service-worker-caching.md         # Browser layer\ncat skills/caching/http-caching.md                   # HTTP layer\ncat skills/caching/cdn-edge-caching.md               # CDN layer\ncat skills/caching/redis-caching-patterns.md         # Application layer\ncat skills/caching/cache-invalidation-strategies.md  # Invalidation\ncat skills/caching/cache-performance-monitoring.md   # Monitoring\n```\n\n## Level 3 Resources: Production-Ready Tools & References\n\n**In Progress**: Building comprehensive Level 3 Resources for high-priority skills.\n\n### What Are Level 3 Resources?\n\nEach skill follows Anthropic's agent skills framework with three progressive levels:\n- **Level 1**: Skill file (300-400 lines) - Core concepts, patterns, quick reference\n- **Level 2**: Category INDEX - Detailed listings and workflows\n- **Level 3**: Resources directory - Production tools, comprehensive references, examples\n\n**Level 3 Resources** transform skills from guides into executable toolkits:\n\n**REFERENCE.md** (1,500-4,000 lines):\n- Comprehensive technical documentation\n- Architecture patterns and best practices\n- Troubleshooting guides and anti-patterns\n- Integration examples and production patterns\n\n**Scripts** (3 per skill, 550-800+ lines each):\n- Production-ready Python tools\n- Executable with `--help` and `--json` support\n- Type hints and comprehensive error handling\n- No TODOs or placeholders - fully implemented\n\n**Examples** (7-10 per skill):\n- Production-ready code across multiple languages/platforms\n- Complete implementations with error handling\n- Docker Compose setups, CI/CD workflows\n- Monitoring and observability configurations\n\n### Progress: Waves 1-10 Complete\n\n**Status**: 48/123 HIGH priority skills have Level 3 Resources (39%)\n\n#### Recent Completion (Waves 9-10)\n\n**Wave 9** (6 skills, +51,979 lines):\n- **Cryptography**: signing-verification, hsm-integration\n- **Protocols**: amqp-rabbitmq, protobuf-schemas\n- **Engineering**: sre-practices, feature-flags\n\n**Wave 10** (2 skills, +14,375 lines):\n- **Cryptography**: secrets-rotation (completes 6/7 in category)\n- **Protocols**: http3-quic\n\n#### Strategic Focus: Zero-Coverage Categories\n\n**Target**: 28 skills across Cryptography, Protocols, Engineering\n**Progress**: 18/28 complete (64%)\n\n**Cryptography**: 6/7 complete (86%)\n- ‚úÖ encryption-at-rest, key-management, certificate-management, hsm-integration, signing-verification, secrets-rotation\n- ‚è≥ pki-fundamentals (60% complete)\n\n**Protocols**: 6/8 complete (75%)\n- ‚úÖ grpc-implementation, kafka-streams, mqtt-messaging, amqp-rabbitmq, protobuf-schemas, http3-quic\n- ‚è≥ websocket-protocols (15% complete)\n- ‚è≥ tcp-optimization\n\n**Engineering**: 6/14 complete (43%)\n- ‚úÖ deployment-strategies, e2e-testing, monitoring-alerts, incident-response, sre-practices, feature-flags\n- ‚è≥ ci-cd-pipelines (10% complete), capacity-planning (5% complete)\n- ‚è≥ 6 more skills\n\n### Methodology\n\n**Hybrid Approach**: Combines manual quality control with template-based acceleration\n- 24-35 completed skills serve as templates\n- Pattern consistency enforced via quality gates\n- 40-50% faster than pure manual while maintaining standards\n- 6 parallel agents per wave (optimal throughput)\n\n**Quality Gates** (enforced before commit):\n- REFERENCE.md: 1,500-4,000 lines\n- Scripts: 3 per skill, executable, --help/--json support, type hints\n- Examples: 7-10 per skill, production-ready, no placeholders\n- No TODO/stub/mock comments anywhere\n- CI validation on all PRs\n\n### CI/CD Integration\n\nAutomated validation runs on all resource changes:\n- REFERENCE.md line count validation\n- Script executability and shebang checks\n- TODO/stub/mock comment detection\n- Python syntax validation for examples\n- Full validation results in PR comments\n\nSee `.github/workflows/validate-resources.yml` for details.\n\n### Future Waves\n\n**Next Sessions** (tracked in `.work/WAVE_10_INCOMPLETE.md`):\n- Complete 4 partial Wave 10 skills (pki-fundamentals, websocket-protocols, ci-cd-pipelines, capacity-planning)\n- 6 additional skills to reach 100% strategic focus coverage\n- Estimated: 30-40 hours across 2-3 sessions\n\n**Long-term**: 75+ additional skills need Level 3 Resources to reach comprehensive coverage\n\n## Contributing\n\nThis is a personal reference repository maintained through practical development experience. Skills are added when new technologies are mastered, updated when better patterns emerge, and refined based on production use.\n\nFeel free to fork and adapt for your own use. Pull requests welcome.\n\n---\n\n**410+ atomic skills** ‚Ä¢ **40 gateway Agent Skills** ‚Ä¢ **33+ categories** ‚Ä¢ **100% CI-validated**\n"
      },
      "plugins": [
        {
          "name": "cc-polymath",
          "source": "./",
          "description": "Efficient skill management with progressive discovery ‚Äî 410+ production-ready skills across 33+ domains.",
          "version": "3.1.0",
          "categories": [],
          "install_commands": [
            "/plugin marketplace add rand/cc-polymath",
            "/plugin install cc-polymath@cc-polymath-marketplace"
          ]
        }
      ]
    },
    {
      "name": "disciplined-process-plugin",
      "version": null,
      "description": "Disciplined Process plugin - rigorous AI-assisted development workflows with Go validation binaries and cross-plugin event coordination",
      "repo_full_name": "rand/disciplined-process-plugin",
      "repo_url": "https://github.com/rand/disciplined-process-plugin",
      "repo_description": "Claude Code plugin for rigorous AI-assisted development workflows",
      "signals": {
        "stars": 2,
        "forks": 0,
        "pushed_at": "2026-02-02T20:26:28Z"
      },
      "files": {
        ".claude-plugin/marketplace.json": "{\n  \"name\": \"disciplined-process-plugin\",\n  \"owner\": {\n    \"name\": \"Rand Arete\",\n    \"url\": \"https://github.com/rand\"\n  },\n  \"description\": \"Disciplined Process plugin - rigorous AI-assisted development workflows with Go validation binaries and cross-plugin event coordination\",\n  \"plugins\": [\n    {\n      \"name\": \"disciplined-process\",\n      \"source\": \"./disciplined-process-plugin\",\n      \"description\": \"A disciplined AI-assisted development workflow with specification-first development, test-driven implementation, ADRs, traceable task management, hybrid prompt+binary hooks, and cross-plugin event system\",\n      \"version\": \"2.1.1\"\n    }\n  ]\n}\n",
        "README.md": "# Disciplined Process Plugin\n\nA rigorous, traceable AI-assisted development workflow plugin for Claude Code.\n\n## Why Use This?\n\nAI coding assistants are powerful but can produce inconsistent results. This plugin brings discipline to AI-assisted development by enforcing a proven workflow:\n\n- **Specify before you code** ‚Äî Write requirements with traceable IDs before implementation\n- **Test before you implement** ‚Äî Tests reference specs and must exist before code\n- **Document decisions** ‚Äî Architecture Decision Records capture the \"why\"\n- **Track dependencies** ‚Äî Know what's ready to work on and what's blocked\n- **Enforce or guide** ‚Äî Strict mode blocks bad commits; guided mode just warns\n\nInspired by the [Rue language](https://github.com/rue-language/rue) development process.\n\n## Features\n\n- **Specification-first**: Write specs before code, with traceable paragraph IDs (`[SPEC-01.03]`)\n- **Test-driven**: Tests reference specs via `@trace` markers, run before implementation\n- **ADRs**: Document architectural decisions systematically\n- **Task tracking**: Dependency-aware work management (Beads default, or GitHub/Linear/Markdown)\n- **Traceability**: Every line links to specs ‚Äî know why code exists\n- **Enforcement**: Configurable hooks enforce the process (strict), warn (guided), or stay out of the way (minimal)\n\n## The Workflow\n\nA 7-phase loop: **Orient ‚Üí Specify ‚Üí Decide ‚Üí Test ‚Üí Implement ‚Üí Review ‚Üí Close**\n\nEach phase has supporting commands (`/dp:task`, `/dp:spec`, `/dp:adr`, `/dp:review`). See [full documentation](./disciplined-process-plugin/README.md) for details.\n\n## Quick Start\n\n```bash\n# 1. Add the plugin repository\n/plugin marketplace add rand/disciplined-process-plugin\n\n# 2. Install the plugin\n/plugin install disciplined-process@disciplined-process-plugin\n\n# 3. Initialize your project (interactive wizard)\n/dp:init\n\n# 4. Start working\n/dp:task ready\n```\n\nSee [full documentation](./disciplined-process-plugin/README.md) for detailed usage.\n\n## Installation\n\n### Prerequisites\n\n- **Claude Code** version 2.0.0 or higher\n- **Git** (for Beads task tracker, if used)\n\n### Step-by-Step\n\n1. **Add the plugin repository:**\n   ```bash\n   /plugin marketplace add rand/disciplined-process-plugin\n   ```\n\n2. **Install the plugin:**\n   ```bash\n   /plugin install disciplined-process@disciplined-process-plugin\n   ```\n\n3. **Verify installation:**\n   ```bash\n   /plugin list\n   ```\n   You should see `disciplined-process` listed.\n\n4. **Initialize your project:**\n   ```bash\n   /dp:init\n   ```\n   The wizard will configure language, task tracking, test frameworks, and enforcement level.\n\n5. **Validate setup:**\n   ```bash\n   /dp:help                      # Should show command reference\n   cat .claude/dp-config.yaml    # Should show your configuration\n   ```\n\n## Commands\n\n| Command | Description |\n|---------|-------------|\n| `/dp:init` | Initialize project with interactive wizard |\n| `/dp:task` | Task tracking (ready, create, show, update, close) |\n| `/dp:spec` | Specification management (create, add, coverage) |\n| `/dp:adr` | Architecture Decision Records |\n| `/dp:review` | Code review checklist |\n| `/dp:help` | Help and workflow reference |\n\n## Updating\n\n```bash\n/plugin marketplace update rand/disciplined-process-plugin\n/plugin update disciplined-process@disciplined-process-plugin\n```\n\n**Important:** After updating, re-merge hooks to update paths:\n\n```bash\npython3 ~/.claude/scripts/merge-plugin-hooks.py\n```\n\n## Hooks\n\nThis plugin uses a **hybrid hook architecture** combining prompt-based hooks (for LLM judgment calls) with compiled Go binaries (for fast, deterministic validation).\n\n### Go Validation Binaries (v2.1.0+)\n\nPre-compiled binaries in `bin/` provide fast validation without runtime dependencies:\n\n| Binary | Purpose |\n|--------|---------|\n| `trace-validator` | Recursively discovers test files and validates `@trace SPEC-XX.YY` markers |\n| `coverage-check` | Checks spec coverage against test traces |\n| `adr-validator` | Validates ADR format and required sections |\n| `phase-emitter` | Emits phase-transition events for cross-plugin coordination |\n\nBinaries are cross-compiled for Linux (amd64/arm64), macOS (amd64/arm64), and Windows (amd64).\n\n### Prompt-Based Hooks\n\nPrompt hooks inject context into Claude's reasoning for judgment-based enforcement (e.g., \"is this commit ready?\" decisions that require understanding intent).\n\n### Hook Summary\n\n| Hook | Type | Event | Purpose |\n|------|------|-------|---------|\n| `trace-validator` | Binary | `PreToolUse(git commit)` | Block commits without tests/traces (strict mode) |\n| `check-trace-markers` | Prompt | `PostToolUse(Write)` | Warn about missing `@trace` markers |\n| `phase-emitter` | Binary | `SessionStart` | Emit orient phase event, show ready work |\n| `pre-push-sync` | Prompt | `PreToolUse(git push)` | Sync task tracker before push |\n\n### Legacy Fallback\n\nTo use the previous Python hook scripts instead of Go binaries:\n\n```bash\nexport DP_USE_LEGACY_HOOKS=1\n```\n\nLegacy scripts are preserved in `scripts/legacy/`.\n\n### Hook Setup\n\nPlugin hooks need to be merged into `~/.claude/settings.json`:\n\n```bash\n# After install or update:\npython3 ~/.claude/scripts/merge-plugin-hooks.py\n```\n\nIf you don't have the merge script:\n\n```bash\nmkdir -p ~/.claude/scripts\ncurl -o ~/.claude/scripts/merge-plugin-hooks.py \\\n  https://raw.githubusercontent.com/rand/rlm-claude-code/main/scripts/merge-plugin-hooks.py\n```\n\n### Verifying Hooks\n\n```bash\n# Check hooks are registered\ncat ~/.claude/settings.json | jq '.hooks | keys'\n\n# Should show: PreToolUse, PostToolUse, SessionStart\n```\n\n### Troubleshooting Hooks\n\n**Hooks not running:**\n1. Check enforcement level isn't \"minimal\" in `dp-config.yaml`\n2. Run `python3 ~/.claude/scripts/merge-plugin-hooks.py`\n3. Restart Claude Code\n\n**Commits not being blocked (strict mode):**\n1. Verify hooks point to current plugin version\n2. Check `~/.claude/settings.json` has `PreToolUse` with `Bash(git commit*)` matcher\n\n## Cross-Plugin Event System (v2.1.0+)\n\nDP emits structured JSON events that other plugins (e.g., RLM) can consume for coordination:\n\n| Event | Trigger | Consumers |\n|-------|---------|-----------|\n| `phase-transition` | Moving between DP phases | RLM (adjusts reasoning mode) |\n| `spec-review` | Spec added or modified | RLM (triggers thorough analysis) |\n| `task-update` | Task status change | Beads, external trackers |\n\nEvents follow JSON Schema definitions in `schemas/events/`. Python helpers in `scripts/events/` provide `emit_event()` and `consume_event()` utilities.\n\n## Uninstalling\n\n```bash\n/plugin uninstall disciplined-process@disciplined-process-plugin\n/plugin marketplace remove rand/disciplined-process-plugin\n```\n\nNote: Project files created by `/dp:init` are not removed automatically.\n\n## Troubleshooting\n\n### Commands not recognized\n1. Verify installation: `/plugin list`\n2. Restart Claude Code\n3. Reinstall the plugin\n\n### Wizard doesn't detect my language\nSelect \"other\" when prompted. The wizard checks for `package.json`, `Cargo.toml`, `pyproject.toml`, `go.mod`, and `build.zig`.\n\n### Hooks not running\n1. Check enforcement level isn't \"minimal\"\n2. Verify `.claude/settings.json` exists\n3. Run `chmod +x .claude/scripts/*.sh`\n\n### Beads commands fail\n1. Ensure Git is initialized: `git status`\n2. Check `.beads/` directory exists\n3. Run `bd init` manually if needed\n\n## License\n\nMIT\n\n## Support\n\n- [Documentation](./disciplined-process-plugin/README.md)\n- [GitHub Issues](https://github.com/rand/disciplined-process-plugin/issues)\n- [Discussions](https://github.com/rand/disciplined-process-plugin/discussions)\n",
        "disciplined-process-plugin/README.md": "# Disciplined Process Plugin\n\nA rigorous, traceable AI-assisted development workflow for Claude Code. Inspired by the [Rue language](https://github.com/rue-language/rue) development process.\n\n**Version:** 2.0.0\n\nSee the [project README](../README.md) for overview and installation.\n\n## The Workflow\n\nA 7-phase loop: **Orient ‚Üí Specify ‚Üí Decide ‚Üí Test ‚Üí Implement ‚Üí Review ‚Üí Close**\n\n| Phase | Action | Command |\n|-------|--------|---------|\n| 1. Orient | Find and claim work | `/dp:task ready` |\n| 2. Specify | Write requirements with `[SPEC-XX.YY]` IDs | `/dp:spec add` |\n| 3. Decide | Record architectural choices | `/dp:adr create` |\n| 4. Test | Write failing tests with `@trace` markers | ‚Äî |\n| 5. Implement | Make tests pass, add `@trace` to code | ‚Äî |\n| 6. Review | Self-review + adversarial review | `/dp:review` |\n| 7. Close | Complete task, commit | `/dp:task close` |\n\nSee [references/workflow.md](./references/workflow.md) for detailed phase descriptions.\n\n## Commands\n\n| Command | Description |\n|---------|-------------|\n| `/dp:init` | Initialize project with wizard |\n| `/dp:task` | Task tracking (ready, create, show, update, close, discover) |\n| `/dp:spec` | Specification management (create, add, link, coverage) |\n| `/dp:adr` | Architecture Decision Records (create, list, status, link) |\n| `/dp:review` | Run code review (with optional adversarial mode) |\n| `/dp:session` | Session management (Chainlink only) |\n| `/dp:migrate` | Migrate between task trackers |\n| `/dp:trace` | Traceability validation |\n| `/dp:help` | Show help and workflow reference |\n\n### Task Commands\n\n```bash\n/dp:task ready                          # Show available work\n/dp:task create \"Fix bug\" -t bug        # Create a task\n/dp:task show <id>                      # View task details\n/dp:task update <id> --status in_progress\n/dp:task close <id> --reason \"Fixed\"\n/dp:task discover \"Edge case\" --from <id>  # File discovered work\n/dp:task tree                           # Dependency visualization (Chainlink)\n/dp:task blocked                        # Show blocked issues\n```\n\n### Session Commands (Chainlink only)\n\n```bash\n/dp:session start \"Working on auth\"     # Start tracked session\n/dp:session work <id>                   # Claim task and start timer\n/dp:session status                      # Show current session\n/dp:session end --notes \"Handoff notes\" # End session with context\n```\n\n### Migration Commands\n\n```bash\n/dp:migrate beads-to-chainlink          # Migrate from Beads to Chainlink\n/dp:migrate chainlink-to-beads          # Migrate from Chainlink to Beads\n/dp:migrate --dry-run                   # Preview without changes\n```\n\n### Traceability Commands\n\n```bash\n/dp:trace coverage                      # Show spec-to-code coverage\n/dp:trace validate                      # Verify all traces resolve\n/dp:trace find SPEC-01.03               # Find code implementing spec\n```\n\n### Spec Commands\n\n```bash\n/dp:spec create 02 \"Authentication\"     # Create spec section\n/dp:spec add 02 \"Users MUST authenticate before access\"\n/dp:spec coverage                       # Check trace coverage\n/dp:spec list                           # List all specs\n```\n\n### ADR Commands\n\n```bash\n/dp:adr create \"Use JWT for authentication\"\n/dp:adr list                            # List all ADRs\n/dp:adr status 0001 accepted            # Update ADR status\n/dp:adr link 0001 SPEC-05.12            # Link ADR to spec/task\n```\n\n## Configuration\n\n### Enforcement Levels\n\n| Level | Behavior |\n|-------|----------|\n| **Strict** | Hooks block commits without tests/traces |\n| **Guided** | Hooks warn but don't block |\n| **Minimal** | Skills on demand, no enforcement |\n\nSee [references/enforcement-config.md](./references/enforcement-config.md) for per-hook overrides and team recommendations.\n\n### Task Tracking Providers\n\n| Provider | Requirements | Key Features | Availability |\n|----------|--------------|--------------|--------------|\n| **Beads** (recommended) | Git, `bd` CLI | Git-native, dependencies, MCP server | Public |\n| **Builtin** | Claude Code v2.1.16+ | Zero setup, dependency tracking | Built-in |\n| **Chainlink** | `chainlink` CLI | Sessions, time tracking, tree view | Private |\n| **GitHub Issues** | `gh` CLI | Team collaboration, web UI | Public |\n| **Linear** | `linear` CLI | Native priorities, projects | Public |\n| **Markdown** | None | No dependencies, human-readable | Built-in |\n| **None** | None | External tracking | - |\n\nSee [commands/task.md](./commands/task.md) for the full feature matrix and provider details.\n\n### Adversarial Review\n\nEnable VDD-style adversarial code review with a fresh-context model:\n\n```bash\n/dp:review --adversarial               # Run adversarial review\n/dp:review --adversarial --max-iterations 3\n```\n\nThe adversarial reviewer (Sarcasmotron) uses Gemini with fresh context to:\n- Detect hallucinations (invalid line numbers, missing functions)\n- Find logic errors and edge cases\n- Challenge assumptions\n- Iterate until issues are resolved or accepted\n\nSee [commands/review.md](./commands/review.md) for configuration options.\n\n### Project Structure After Init\n\n```\nproject/\n‚îú‚îÄ‚îÄ .claude/\n‚îÇ   ‚îú‚îÄ‚îÄ dp-config.yaml      # Plugin configuration\n‚îÇ   ‚îú‚îÄ‚îÄ settings.json       # Hooks configuration\n‚îÇ   ‚îú‚îÄ‚îÄ rules/              # Language-specific rules\n‚îÇ   ‚îÇ   ‚îú‚îÄ‚îÄ python.md\n‚îÇ   ‚îÇ   ‚îî‚îÄ‚îÄ typescript.md\n‚îÇ   ‚îî‚îÄ‚îÄ traceability/       # Auto-generated trace index\n‚îÇ       ‚îî‚îÄ‚îÄ index.json\n‚îú‚îÄ‚îÄ docs/\n‚îÇ   ‚îú‚îÄ‚îÄ spec/               # Specifications\n‚îÇ   ‚îÇ   ‚îî‚îÄ‚îÄ 00-overview.md\n‚îÇ   ‚îî‚îÄ‚îÄ adr/                # Architecture Decision Records\n‚îÇ       ‚îú‚îÄ‚îÄ template.md\n‚îÇ       ‚îî‚îÄ‚îÄ 0001-adopt-disciplined-process.md\n‚îú‚îÄ‚îÄ CLAUDE.md               # Project context for Claude\n‚îî‚îÄ‚îÄ .beads/                 # Task tracker (if using Beads)\n```\n\n### Configuration File\n\nFull `dp-config.yaml` example:\n\n```yaml\nversion: \"2.0\"\n\nproject:\n  name: \"my-project\"\n  languages:\n    - typescript\n    - python\n\n# Issue tracker selection\ntask_tracker: beads  # beads | builtin | chainlink | github | linear | markdown | none\n\n# Beads-specific configuration\nbeads:\n  auto_sync: true\n    milestones: true\n    time_tracking: true\n  rules_path: .claude/rules/\n\n# Beads-specific configuration (when task_tracker: beads)\nbeads:\n  auto_sync: true\n  daemon: true\n\n# Enforcement level\nenforcement: guided  # strict | guided | minimal\n\n# Adversarial review configuration\nadversarial_review:\n  enabled: true\n  model: gemini-2.5-flash\n  max_iterations: 5\n\n# Spec configuration\nspecs:\n  directory: docs/spec/\n  id_format: \"SPEC-{section:02d}.{item:02d}\"\n\n# ADR configuration\nadrs:\n  directory: docs/adr/\n  template: .claude/templates/adr.md\n\n# Degradation behavior\ndegradation:\n  on_tracker_unavailable: warn  # warn | skip | fail\n  on_hook_failure: warn\n```\n\n## Skills (Auto-Invoked)\n\nThese skills activate automatically based on context:\n\n- **disciplined-workflow**: Core process orchestration\n- **spec-tracing**: Specification format and traceability\n- **tdd-methodology**: Test-first patterns for all test types\n- **adr-authoring**: Decision record format\n\n## Troubleshooting\n\nSee the [project README](../README.md) for installation and update issues.\n\n### `/dp:init` fails\n- Ensure you're in a valid project directory\n- Check write permissions\n- Use `/dp:init --force` to overwrite existing files\n\n### Trace markers not found\n\nTrace markers must follow `@trace SPEC-XX.YY` format:\n\n```typescript\n// @trace SPEC-01.03\nfunction validateInput(data: string): boolean {\n  // ...\n}\n```\n\n### Provider CLI issues\n\nIf task commands fail, check your provider's CLI:\n- **Chainlink**: `chainlink --version` (requires `.chainlink/` initialized)\n- **Beads**: `bd --version` (requires git repo with `.beads/`)\n- **GitHub**: `gh auth status`\n- **Linear**: `linear --version`\n\n### Adversarial review not working\n\n- Ensure `adversarial_review.enabled: true` in dp-config.yaml\n- Check that Gemini API access is configured in rlm-claude-code\n- Use `/dp:status` to check component health\n\n### Migration issues\n\n- Use `--dry-run` first to preview changes\n- Check `.claude/dp-migration-map.json` for ID mappings after migration\n- Spec references are updated automatically\n\n## More Information\n\n- [Commands Reference](./commands/)\n- [Skills Reference](./skills/)\n- [Workflow Reference](./references/workflow.md)\n- [Enforcement Config](./references/enforcement-config.md)\n- [Adversarial Review](./commands/review.md)\n- [Migration Guide](./commands/migrate.md)\n"
      },
      "plugins": [
        {
          "name": "disciplined-process",
          "source": "./disciplined-process-plugin",
          "description": "A disciplined AI-assisted development workflow with specification-first development, test-driven implementation, ADRs, traceable task management, hybrid prompt+binary hooks, and cross-plugin event system",
          "version": "2.1.1",
          "categories": [],
          "install_commands": [
            "/plugin marketplace add rand/disciplined-process-plugin",
            "/plugin install disciplined-process@disciplined-process-plugin"
          ]
        }
      ]
    }
  ]
}