{
  "author": {
    "id": "Raudbjorn",
    "display_name": "Sveinbj√∂rn Geirsson",
    "avatar_url": "https://avatars.githubusercontent.com/u/2589582?u=b95fd888b7cb538f721f483abf2bfc0c188e8302&v=4"
  },
  "marketplaces": [
    {
      "name": "massif-skills",
      "version": null,
      "description": "Skills for my development stack",
      "repo_full_name": "Raudbjorn/claude",
      "repo_url": "https://github.com/Raudbjorn/claude",
      "repo_description": null,
      "signals": {
        "stars": 6,
        "forks": 0,
        "pushed_at": "2025-10-29T12:26:00Z"
      },
      "files": {
        ".claude-plugin/marketplace.json": "{\n  \"name\": \"massif-skills\",\n  \"owner\": {\n    \"name\": \"Sveinbjorn Geirsson\",\n    \"email\": \"sveinbjorn@sveinbjorn.dev\"\n  },\n  \"metadata\": {\n    \"description\": \"Skills for my development stack\",\n    \"version\": \"1.0.0\"\n  },\n  \"plugins\": [\n    {\n      \"name\": \"supabase\",\n      \"description\": \"Comprehensive Supabase development expert covering Edge Functions, database schema management, migrations, PostgreSQL functions, and RLS policies. Use for any Supabase development including TypeScript/Deno Edge Functions, declarative schema management, SQL formatting, migration creation, database function authoring with SECURITY INVOKER, and RLS policy implementation with auth.uid() and auth.jwt().\",\n      \"source\": \"./supabase\"\n    },\n    {\n      \"name\": \"supabase-storage\",\n      \"description\": \"Expert guide for Supabase Storage including bucket management, file operations, URL generation, and RLS policies. Use when working with file uploads/downloads, creating public or private buckets, generating signed URLs, implementing storage RLS policies, handling resumable uploads, image transformations, or any Supabase Storage-related tasks.\",\n      \"source\": \"./supabase-storage\"\n    },\n    {\n      \"name\": \"supabase-realtime\",\n      \"description\": \"Comprehensive guide for implementing Supabase Realtime features with best practices, scalable patterns, and migration strategies. Use when building realtime features in Supabase applications including messaging, notifications, presence, live updates, collaborative features, or migrating from postgres_changes to broadcast.\",\n      \"source\": \"./supabase-realtime\"\n    },\n    {\n      \"name\": \"svelte-expert\",\n      \"description\": \"Expert Svelte/SvelteKit development assistant for building components, utilities, and applications. Use when creating Svelte components, SvelteKit applications, implementing reactive patterns, handling state management, working with stores, transitions, animations, or any Svelte/SvelteKit development task.\",\n      \"source\": \"./svelte-expert\"\n    },\n    {\n      \"name\": \"skill-creator\",\n      \"description\": \"Guide for creating effective skills. This skill should be used when users want to create a new skill (or update an existing skill) that extends Claude's capabilities with specialized knowledge, workflows, or tool integrations.\",\n      \"source\": \"./skill-creator\"\n    }\n  ]\n}\n",
        "README.md": "# Massif Skills Marketplace\n\nA curated collection of Claude Code skills for modern web development, specializing in Supabase and Svelte/SvelteKit.\n\nüåê **Live Marketplace:** [massifnet.work](https://massifnet.work)\n\n## üì¶ Available Skills\n\n### üóÑÔ∏è Supabase\nComprehensive Supabase development expert covering Edge Functions, database schema management, migrations, PostgreSQL functions, and RLS policies.\n\n**Use for:**\n- TypeScript/Deno Edge Functions (npm:/jsr: specifiers)\n- Declarative schema management\n- SQL formatting and style guide\n- Migration creation (YYYYMMDDHHmmss format)\n- Database functions with SECURITY INVOKER\n- RLS policy implementation\n\n[View Skill](./supabase/SKILL.md)\n\n---\n\n### üì¶ Supabase Storage\nExpert guide for Supabase Storage including bucket management, file operations, URL generation, and RLS policies.\n\n**Use for:**\n- File uploads/downloads\n- Public and private bucket configuration\n- Signed URL generation\n- Storage RLS policies\n- Resumable uploads (tus-js-client, Uppy.js)\n- Image transformations\n\n[View Skill](./supabase-storage/SKILL.md)\n\n---\n\n### üì° Supabase Realtime\nComprehensive guide for implementing Supabase Realtime features with best practices, scalable patterns, and migration strategies.\n\n**Use for:**\n- Real-time messaging and notifications\n- Presence tracking\n- Live updates\n- Collaborative features\n- Migrating from postgres_changes to broadcast\n\n[View Skill](./supabase-realtime/SKILL.md)\n\n---\n\n### üé® Svelte Expert\nExpert Svelte/SvelteKit development assistant for building components, utilities, and applications.\n\n**Use for:**\n- Svelte 5 components with runes\n- SvelteKit applications\n- Reactive patterns and state management\n- Stores, transitions, and animations\n- Form handling and validation\n\n[View Skill](./svelte-expert/SKILL.md)\n\n---\n\n### üõ†Ô∏è Skill Creator\nGuide for creating effective Claude Code skills that extend capabilities with specialized knowledge, workflows, or tool integrations.\n\n**Use for:**\n- Creating new skills\n- Updating existing skills\n- Structuring skill documentation\n- Best practices for skill authoring\n\n[View Skill](./skill-creator/SKILL.md)\n\n---\n\n## üöÄ Installation\n\n### Using Claude Code\n\nFirst, register this marketplace in Claude Code:\n\n```bash\n/plugin marketplace add massifnet.work\n```\n\nOr using the GitHub repository:\n\n```bash\n/plugin marketplace add Raudbjorn/claude\n```\n\nThen install individual skills:\n\n```bash\n# Install the Supabase skill\n/plugin install supabase@massif-skills\n\n# Install the Supabase Storage skill\n/plugin install supabase-storage@massif-skills\n\n# Install the Supabase Realtime skill\n/plugin install supabase-realtime@massif-skills\n\n# Install the Svelte Expert skill\n/plugin install svelte-expert@massif-skills\n\n# Install the Skill Creator skill\n/plugin install skill-creator@massif-skills\n```\n\nAlternatively, browse and install via the plugin manager:\n\n1. In Claude Code, run `/plugin marketplace add massifnet.work`\n2. Run `/plugin install` and select `Browse and install plugins`\n3. Select `massif-skills`\n4. Select the skills you want to install\n5. Select `Install now`\n\nAfter installing, skills will be automatically invoked when relevant to your task, or you can mention them explicitly.\n\n### Manual Installation\n\n1. Download individual skill folders from this repository\n2. Copy to your `.claude/skills/` directory\n3. Skills will be auto-invoked based on context\n\n## üìö Marketplace Configuration\n\n```json\n{\n  \"name\": \"massif-skills\",\n  \"owner\": {\n    \"name\": \"Sveinbjorn Geirsson\",\n    \"email\": \"sveinbjorn@sveinbjorn.dev\"\n  },\n  \"metadata\": {\n    \"description\": \"Skills for my development stack\",\n    \"version\": \"1.0.0\"\n  }\n}\n```\n\n## üîó Links\n\n- **Marketplace:** [massifnet.work](https://massifnet.work)\n- **Repository:** [github.com/Raudbjorn/claude](https://github.com/Raudbjorn/claude)\n- **Marketplace JSON:** [massifnet.work/marketplace.json](https://massifnet.work/marketplace.json)\n\n## üìù License\n\nMIT License - Feel free to use and adapt these skills for your own projects.\n\n## ü§ù Contributing\n\nContributions are welcome! Feel free to submit issues or pull requests.\n\n---\n\nBuilt with ‚ù§Ô∏è using Claude Code and MCP servers\n"
      },
      "plugins": [
        {
          "name": "supabase",
          "description": "Comprehensive Supabase development expert covering Edge Functions, database schema management, migrations, PostgreSQL functions, and RLS policies. Use for any Supabase development including TypeScript/Deno Edge Functions, declarative schema management, SQL formatting, migration creation, database function authoring with SECURITY INVOKER, and RLS policy implementation with auth.uid() and auth.jwt().",
          "source": "./supabase",
          "categories": [],
          "install_commands": [
            "/plugin marketplace add Raudbjorn/claude",
            "/plugin install supabase@massif-skills"
          ]
        },
        {
          "name": "supabase-storage",
          "description": "Expert guide for Supabase Storage including bucket management, file operations, URL generation, and RLS policies. Use when working with file uploads/downloads, creating public or private buckets, generating signed URLs, implementing storage RLS policies, handling resumable uploads, image transformations, or any Supabase Storage-related tasks.",
          "source": "./supabase-storage",
          "categories": [],
          "install_commands": [
            "/plugin marketplace add Raudbjorn/claude",
            "/plugin install supabase-storage@massif-skills"
          ]
        },
        {
          "name": "supabase-realtime",
          "description": "Comprehensive guide for implementing Supabase Realtime features with best practices, scalable patterns, and migration strategies. Use when building realtime features in Supabase applications including messaging, notifications, presence, live updates, collaborative features, or migrating from postgres_changes to broadcast.",
          "source": "./supabase-realtime",
          "categories": [],
          "install_commands": [
            "/plugin marketplace add Raudbjorn/claude",
            "/plugin install supabase-realtime@massif-skills"
          ]
        },
        {
          "name": "svelte-expert",
          "description": "Expert Svelte/SvelteKit development assistant for building components, utilities, and applications. Use when creating Svelte components, SvelteKit applications, implementing reactive patterns, handling state management, working with stores, transitions, animations, or any Svelte/SvelteKit development task.",
          "source": "./svelte-expert",
          "categories": [],
          "install_commands": [
            "/plugin marketplace add Raudbjorn/claude",
            "/plugin install svelte-expert@massif-skills"
          ]
        },
        {
          "name": "skill-creator",
          "description": "Guide for creating effective skills. This skill should be used when users want to create a new skill (or update an existing skill) that extends Claude's capabilities with specialized knowledge, workflows, or tool integrations.",
          "source": "./skill-creator",
          "categories": [],
          "install_commands": [
            "/plugin marketplace add Raudbjorn/claude",
            "/plugin install skill-creator@massif-skills"
          ]
        }
      ]
    }
  ]
}