{
  "author": {
    "id": "RedPlanetHQ",
    "display_name": "RedPlanetHQ",
    "avatar_url": "https://avatars.githubusercontent.com/u/157399902?v=4"
  },
  "marketplaces": [
    {
      "name": "RedplanetHQ",
      "version": null,
      "description": "Automatic CORE memory search and ingest plugin for Claude Code",
      "repo_full_name": "RedPlanetHQ/redplanethq-marketplace",
      "repo_url": "https://github.com/RedPlanetHQ/redplanethq-marketplace",
      "repo_description": null,
      "signals": {
        "stars": 24,
        "forks": 3,
        "pushed_at": "2025-10-22T10:47:06Z"
      },
      "files": {
        ".claude-plugin/marketplace.json": "{\n  \"name\": \"RedplanetHQ\",\n  \"owner\": {\n    \"name\": \"RedplanetHQ\"\n  },\n  \"plugins\": [\n    {\n      \"name\": \"core-memory\",\n      \"source\": \"./core-memory\",\n      \"description\": \"Automatic CORE memory search and ingest plugin for Claude Code\"\n    }\n  ]\n}\n",
        "README.md": "# RedplanetHQ Claude Code Marketplace\n\nA curated collection of Claude Code plugins maintained by RedplanetHQ.\n\n## What is CORE Memory?\n\nCORE is an open-source AI memory system that gives Claude Code and other coding agents persistent memory across all your sessions. Instead of re-explaining your codebase, architecture decisions, and coding patterns every time, CORE remembers everything.\n\n**The Problem:** Claude Code forgets everything when you close it. Every session starts from scratch.\n\n**The Solution:** CORE uses a temporal knowledge graph to remember:\n- Your codebase architecture and patterns\n- When and why you made decisions\n- Context from previous conversations\n- Your coding preferences and standards\n\n**The Result:** After a few weeks, Claude Code develops deep understanding of your projects - like a living wiki that actually remembers your context.\n\nüèÜ **Proven Results:** CORE achieved 88.24% accuracy on the LoCoMo benchmark (current state-of-the-art for AI memory systems)\n\n**Learn more:** \n- [Main Repo:RedPlanetHQ/core](https://github.com/RedPlanetHQ/core)\n- [Docs](https://docs.heysol.ai)\n- [Website](https://heysol.ai)\n\n\n## Installation\n\nTo add this marketplace to your Claude Code installation:\n\n```bash\n/plugin marketplace add https://github.com/RedPlanetHQ/redplanethq-marketplace.git\n```\n\nAfter adding the marketplace, you can browse and install plugins from it.\n\n## Available Plugins\n\n### core-memory\n\n**Stop re-explaining your codebase every session.** \n\nThis plugin connects Claude Code to CORE Memory, giving it persistent memory across all your coding sessions. Claude automatically remembers your architecture, decisions, and patterns.\n\n**How it works:**\n- Automatic memory search at conversation start\n- Automatic context capture after responses  \n- Manual search and ingest commands available\n- Session hooks for context loading\n\n**Installation:**\n\n```bash\n/plugin install core-memory@redplanethq\n```\nAfter installing the plugin, restart claude to load the plugin\n\n**Authentication:**\n\nAfter restarting the Claude, you need to authenticate with the CORE Memory MCP server:\n\n```bash\n/mcp\n```\n\nFollow the authentication prompts to connect your CORE Memory account.\n\n**Usage:**\n\nThe plugin automatically searches and stores memories through hooks, but you can also use manual commands:\n\n- `/core-memory:init` - Initialize CORE memory with comprehensive project context\n- `/core-memory:search` - Search CORE memory for specific information\n- `/core-memory:ingest` - Manually trigger memory ingest for the current conversation\n\n**How it works:**\n\n1. **Session Start**: When you start a new conversation, Claude automatically searches for relevant context about your project\n2. **Before Responding**: For each user message, Claude searches memory for relevant past conversations and context\n3. **After Responding**: Claude automatically stores the conversation, decisions made, and key insights\n\n## Usage\n\n### Adding the Marketplace\n\n```bash\n/plugin marketplace add redplanethq/redplanethq-marketplace\n```\n\n### Browsing Plugins\n\n```bash\n/plugin list\n```\n\n### Installing a Plugin\n\n```bash\n/plugin install redplanethq/<plugin-name>\n```\n\n### Authenticating MCP Servers\n\nIf a plugin requires MCP server authentication (like core-memory), use:\n\n```bash\n/mcp\n```\n\n## Plugin Development\n\nWant to contribute a plugin to this marketplace? Plugins should follow the Claude Code plugin structure:\n\n```\nplugin-name/\n‚îú‚îÄ‚îÄ commands/        # Slash commands\n‚îú‚îÄ‚îÄ agents/          # Specialized agents\n‚îú‚îÄ‚îÄ hooks/           # Event hooks\n‚îî‚îÄ‚îÄ plugin.json      # Plugin metadata\n```\n\nSee the [official Claude Code documentation](https://docs.claude.com/en/docs/claude-code/plugin-marketplaces) for more details.\n\n## Support\n\nFor issues or feature requests, please open an issue in this repository.\n\n## License\n\nIndividual plugins may have their own licenses. Please check each plugin's directory for license information.\n"
      },
      "plugins": [
        {
          "name": "core-memory",
          "source": "./core-memory",
          "description": "Automatic CORE memory search and ingest plugin for Claude Code",
          "categories": [],
          "install_commands": [
            "/plugin marketplace add RedPlanetHQ/redplanethq-marketplace",
            "/plugin install core-memory@RedplanetHQ"
          ]
        }
      ]
    }
  ]
}