{
  "author": {
    "id": "rstarkey",
    "display_name": "Rob Starkey",
    "avatar_url": "https://avatars.githubusercontent.com/u/2244441?u=7b643727972e2dfd7ed49eb673e614ce085ed1ec&v=4"
  },
  "marketplaces": [
    {
      "name": "s5y-dev",
      "version": null,
      "description": "Development marketplace for s5y-plugins",
      "repo_full_name": "rstarkey/s5y-plugins",
      "repo_url": "https://github.com/rstarkey/s5y-plugins",
      "repo_description": "Claude Code plugin with development expertise skills",
      "signals": {
        "stars": 1,
        "forks": 0,
        "pushed_at": "2025-11-22T00:23:31Z"
      },
      "files": {
        ".claude-plugin/marketplace.json": "{\n  \"name\": \"s5y-dev\",\n  \"description\": \"Development marketplace for s5y-plugins\",\n  \"owner\": {\n    \"name\": \"Rob Starkey\",\n    \"email\": \"rstarkey@gmail.com\"\n  },\n  \"plugins\": [\n    {\n      \"name\": \"s5y-plugins\",\n      \"source\": \"./\"\n    }\n  ]\n}\n",
        ".claude-plugin/plugin.json": "{\n  \"name\": \"s5y-plugins\",\n  \"version\": \"1.0.0\",\n  \"description\": \"Comprehensive Python development expertise suite combining core development, testing, async programming, and type system mastery\",\n  \"author\": {\n    \"name\": \"Rob Starkey\",\n    \"email\": \"rstarkey@gmail.com\"\n  },\n  \"repository\": {\n    \"type\": \"git\",\n    \"url\": \"https://github.com/rstarkey/s5y-plugins\"\n  },\n  \"license\": \"MIT\",\n  \"keywords\": [\n    \"python\",\n    \"development\",\n    \"testing\",\n    \"async\",\n    \"type-system\",\n    \"best-practices\"\n  ]\n}\n",
        "README.md": "# s5y-plugins\n\nComprehensive Python development expertise suite for Claude Code.\n\n## Overview\n\nThis plugin provides a combined Python expert skill that covers:\n\n- **Core Python Development** - Architecture, code review, best practices\n- **Testing Excellence** - pytest, async testing, mocking patterns\n- **Async/Await Mastery** - asyncio, concurrency, event loops\n- **Type System Expertise** - generics, variance, type error fixing\n- **Security Best Practices** - input validation, SQL injection prevention\n- **Performance Optimization** - profiling, efficient data structures\n\n## Installation\n\n### Local Development\n\n1. Add the development marketplace:\n   ```bash\n   /plugin marketplace add ~/Code/s5y-plugins\n   ```\n\n2. Install the plugin:\n   ```bash\n   /plugin install s5y-plugins@s5y-dev\n   ```\n\n3. Restart Claude Code to load the plugin.\n\n### From GitHub (after publishing)\n\n```bash\n/plugin marketplace add rstarkey/s5y-plugins\n/plugin install s5y-plugins@rstarkey\n```\n\n## Skills\n\n### python-expert\n\n**Description**: Use when doing ANY Python development - implementation, optimization, debugging, testing, async programming, or type system issues.\n\n**Triggers automatically when**:\n- Implementing Python features or fixing bugs\n- Writing or debugging tests\n- Working with async/await or asyncio\n- Fixing type errors or complex type annotations\n- Reviewing code for quality, security, or performance\n- Optimizing Python performance\n- Designing Python architecture\n\n## Usage\n\nThe skill activates automatically when Claude Code detects Python development tasks. You can also explicitly invoke it by mentioning Python development needs.\n\n### Examples\n\n- \"Implement a user authentication service with proper password hashing\"\n- \"Fix the type errors in my async function\"\n- \"Review this code for security vulnerabilities\"\n- \"Optimize this database query pattern\"\n- \"Write tests for my FastAPI endpoint\"\n\n## Sources\n\nThis skill combines expertise from:\n\n- Core Python development and code review methodology\n- Python testing patterns (pytest, async testing, mocking)\n- Async/await and concurrency patterns\n- Type system expertise (generics, variance, error fixing)\n- Industry best practices and coding standards\n- Security patterns and performance optimization techniques\n\n## Development\n\n### Testing Changes\n\nAfter modifying the skill:\n\n```bash\n/plugin uninstall s5y-plugins@s5y-dev\n/plugin install s5y-plugins@s5y-dev\n# Restart Claude Code\n```\n\n### Adding New Skills\n\n1. Create a new directory under `skills/`\n2. Add a `SKILL.md` file with frontmatter (name, description)\n3. Reinstall the plugin\n\n## License\n\nMIT\n\n## Author\n\nRob Starkey <rstarkey@gmail.com>\n"
      },
      "plugins": [
        {
          "name": "s5y-plugins",
          "source": "./",
          "description": null,
          "categories": [],
          "install_commands": [
            "/plugin marketplace add rstarkey/s5y-plugins",
            "/plugin install s5y-plugins@s5y-dev"
          ]
        }
      ]
    }
  ]
}