{
  "author": {
    "id": "safaiyeh",
    "display_name": "Jason Safaiyeh",
    "avatar_url": "https://avatars.githubusercontent.com/u/8675043?u=9d4c75d627e9f36d3db34eaa0072c4ea7765217d&v=4"
  },
  "marketplaces": [
    {
      "name": "app-store-review",
      "version": null,
      "description": "Apple App Store Review Guidelines skill for Claude Code",
      "repo_full_name": "safaiyeh/app-store-review-skill",
      "repo_url": "https://github.com/safaiyeh/app-store-review-skill",
      "repo_description": "Skill to validate your codebase against Apple App Review",
      "signals": {
        "stars": 19,
        "forks": 0,
        "pushed_at": "2026-01-27T18:50:24Z"
      },
      "files": {
        ".claude-plugin/marketplace.json": "{\n  \"name\": \"app-store-review\",\n  \"owner\": {\n    \"name\": \"safaiyeh\"\n  },\n  \"metadata\": {\n    \"description\": \"Apple App Store Review Guidelines skill for Claude Code\"\n  },\n  \"plugins\": [\n    {\n      \"name\": \"app-store-review\",\n      \"source\": \"./\",\n      \"description\": \"Evaluates code against Apple's App Store Review Guidelines for iOS, macOS, tvOS, watchOS, and visionOS apps\",\n      \"version\": \"1.0.0\",\n      \"author\": {\n        \"name\": \"safaiyeh\"\n      },\n      \"category\": \"compliance\",\n      \"tags\": [\"apple\", \"app-store\", \"review\", \"guidelines\", \"ios\", \"swift\", \"react-native\"],\n      \"strict\": true\n    }\n  ]\n}\n",
        ".claude-plugin/plugin.json": "{\n  \"name\": \"app-store-review\",\n  \"description\": \"Evaluates code against Apple's App Store Review Guidelines for iOS, macOS, tvOS, watchOS, and visionOS apps\",\n  \"version\": \"1.0.0\",\n  \"author\": {\n    \"name\": \"safaiyeh\"\n  },\n  \"homepage\": \"https://github.com/safaiyeh/app-store-review-skill\",\n  \"repository\": \"https://github.com/safaiyeh/app-store-review-skill\",\n  \"license\": \"MIT\",\n  \"keywords\": [\"apple\", \"app-store\", \"review\", \"guidelines\", \"ios\", \"macos\", \"swift\", \"react-native\", \"expo\"]\n}\n",
        "README.md": "# App Store Review Guidelines Skill\n\nAn AI agent skill that exhaustively evaluates iOS, macOS, tvOS, watchOS, and visionOS app code against **every point** in Apple's App Store Review Guidelines.\n\n**Supports:** Swift, Objective-C, **React Native**, and **Expo** apps\n\n## Installation\n\n### Claude Code Plugin Marketplace\n\n```bash\n/plugin marketplace add safaiyeh/app-store-review-skill\n/plugin install app-store-review@app-store-review\n```\n\n### skills.sh\n\n```bash\nnpx skills add safaiyeh/app-store-review-skill\n```\n\n## Setup\n\n### Supported AI Agents\n\nThis skill works with any AI coding agent that supports the skills.sh standard:\n\n- [Claude Code](https://claude.ai/code)\n- [Cursor](https://cursor.sh)\n- [Windsurf](https://codeium.com/windsurf)\n- And other compatible agents\n\n### How It Works\n\n1. **Install the skill** in your project using the command above\n2. **Start your AI agent** in the project directory\n3. **Ask for an App Store review** - the agent will automatically load relevant guidelines\n4. **Review the findings** - the agent identifies potential rejection issues with code references\n\n### Example Prompts\n\n```\n\"Review this app for App Store compliance\"\n\"Check if my IAP implementation follows Apple's guidelines\"\n\"Audit the privacy and data collection in this React Native app\"\n\"What App Store issues might block my submission?\"\n```\n\n### Telemetry\n\nThe skills CLI collects anonymous usage telemetry. To opt out:\n\n```bash\nSKILLS_NO_TELEMETRY=1 npx skills add safaiyeh/app-store-review-skill\n```\n\n## Structure\n\n```\napp-store-review-skill/\n├── SKILL.md                    # Index with quick reference & checklist\n└── rules/\n    ├── 1-safety.md             # Section 1: Safety guidelines\n    ├── 2-performance.md        # Section 2: Performance guidelines\n    ├── 3-business.md           # Section 3: Business guidelines\n    ├── 4-design.md             # Section 4: Design guidelines\n    └── 5-legal.md              # Section 5: Legal guidelines\n```\n\n## Coverage\n\nThis skill covers **ALL 5 major sections** with **EVERY guideline point**:\n\n### [1. Safety](rules/1-safety.md)\n- 1.1 Objectionable Content (1.1.1-1.1.7)\n- 1.2 User-Generated Content & Creator Content\n- 1.3 Kids Category (parental gates, privacy, analytics)\n- 1.4 Physical Harm (medical apps, drug dosage, substances)\n- 1.5 Developer Information\n- 1.6 Data Security\n- 1.7 Reporting Criminal Activity\n\n### [2. Performance](rules/2-performance.md)\n- 2.1 App Completeness (final versions, IAP)\n- 2.2 Beta Testing\n- 2.3 Accurate Metadata (2.3.1-2.3.13)\n- 2.4 Hardware Compatibility (2.4.1-2.4.5)\n- 2.5 Software Requirements (2.5.1-2.5.18)\n\n### [3. Business](rules/3-business.md)\n- 3.1 Payments (IAP, subscriptions, external links, crypto)\n- 3.1.1-3.1.5 In-App Purchase rules\n- 3.2 Other Business Models (acceptable/unacceptable)\n\n### [4. Design](rules/4-design.md)\n- 4.1 Copycats\n- 4.2 Minimum Functionality\n- 4.3 Spam\n- 4.4 Extensions (keyboard, Safari)\n- 4.5 Apple Sites and Services\n- 4.7 Mini Apps, Chatbots, Game Emulators\n- 4.8 Login Services\n- 4.9 Apple Pay\n- 4.10 Monetizing Built-In Capabilities\n\n### [5. Legal](rules/5-legal.md)\n- 5.1 Privacy (data collection, use, sharing, health, kids, location)\n- 5.2 Intellectual Property\n- 5.3 Gaming, Gambling, Lotteries\n- 5.4 VPN Apps\n- 5.5 Mobile Device Management\n\n## Features\n\n- **Modular structure** - Agent loads only relevant sections\n- **2000+ lines** of comprehensive guidelines\n- **Checklists** for every guideline point\n- **Code patterns** for Swift AND React Native/Expo\n- **Package references** for both Expo and bare React Native\n- **Quick reference** for high-risk rejection patterns\n- **Pre-submission checklist** in main SKILL.md\n\n## React Native / Expo Support\n\nEach rule file includes:\n- TypeScript/JavaScript code patterns to flag\n- Expo package recommendations (preferred)\n- Bare React Native package alternatives\n- React Native-specific checklists\n\nKey packages covered:\n- `expo-tracking-transparency` / `react-native-tracking-transparency`\n- `expo-in-app-purchases` / `react-native-iap`\n- `expo-secure-store` / `react-native-keychain`\n- `expo-apple-authentication` / `@invertase/react-native-apple-authentication`\n- `expo-local-authentication` / `react-native-biometrics`\n\n## What It Checks\n\n### Critical Issues (Immediate Rejection)\n- Private API usage\n- Hardcoded secrets/credentials\n- External payment for digital goods\n- On-device cryptocurrency mining\n- Dynamic code execution\n\n### High-Risk Issues\n- Missing App Tracking Transparency\n- Account creation without deletion\n- IAP without restore purchases\n- UGC without moderation\n- Kids apps without parental gates\n\n### Medium-Risk Issues\n- Vague purpose strings\n- Over-requesting permissions\n- Unjustified background modes\n- References to other platforms\n\n## When It Triggers\n\nThe skill activates when working on:\n- App Store submission preparation\n- Code compliance review\n- Payment/StoreKit implementation\n- Privacy and data handling\n- User-generated content features\n- Kids Category apps\n- Health/medical apps\n- VPN/MDM apps\n- Gambling/lottery apps\n\n## License\n\nMIT\n"
      },
      "plugins": [
        {
          "name": "app-store-review",
          "source": "./",
          "description": "Evaluates code against Apple's App Store Review Guidelines for iOS, macOS, tvOS, watchOS, and visionOS apps",
          "version": "1.0.0",
          "author": {
            "name": "safaiyeh"
          },
          "category": "compliance",
          "tags": [
            "apple",
            "app-store",
            "review",
            "guidelines",
            "ios",
            "swift",
            "react-native"
          ],
          "strict": true,
          "categories": [
            "app-store",
            "apple",
            "compliance",
            "guidelines",
            "ios",
            "react-native",
            "review",
            "swift"
          ],
          "install_commands": [
            "/plugin marketplace add safaiyeh/app-store-review-skill",
            "/plugin install app-store-review@app-store-review"
          ]
        }
      ]
    }
  ]
}