{
  "author": {
    "id": "SecurityRonin",
    "display_name": "Security Ronin",
    "avatar_url": "https://avatars.githubusercontent.com/u/233419394?v=4"
  },
  "marketplaces": [
    {
      "name": "ronin-marketplace",
      "version": null,
      "description": "Battle-tested skills for shipping software with Claude Code",
      "repo_full_name": "SecurityRonin/ronin-marketplace",
      "repo_url": "https://github.com/SecurityRonin/ronin-marketplace",
      "repo_description": "Battle-tested skills for Claude Code. Deployment patterns, browser automation, and hard-won knowledge from real projects.",
      "signals": {
        "stars": 0,
        "forks": 0,
        "pushed_at": "2026-02-14T02:23:59Z"
      },
      "files": {
        ".claude-plugin/marketplace.json": "{\n  \"name\": \"ronin-marketplace\",\n  \"description\": \"Battle-tested skills for shipping software with Claude Code\",\n  \"owner\": {\n    \"name\": \"Albert Hui\",\n    \"email\": \"albert@securityronin.com\"\n  },\n  \"plugins\": [\n    {\n      \"name\": \"deployment-skills\",\n      \"description\": \"Cloud deployment patterns for Vercel, Fly.io, and Cloudflare\",\n      \"version\": \"1.0.0\",\n      \"source\": \"./plugins/deployment-skills\"\n    },\n    {\n      \"name\": \"packaging-skills\",\n      \"description\": \"Cross-platform installers: DMG, MSI, DEB with GitHub Actions\",\n      \"version\": \"1.0.0\",\n      \"source\": \"./plugins/packaging-skills\"\n    },\n    {\n      \"name\": \"docs-skills\",\n      \"description\": \"Documentation pipelines: MkDocs, Pandoc, GitHub Pages\",\n      \"version\": \"1.0.0\",\n      \"source\": \"./plugins/docs-skills\"\n    },\n    {\n      \"name\": \"automation-skills\",\n      \"description\": \"Browser automation with Playwright, Puppeteer, and CDP\",\n      \"version\": \"1.0.0\",\n      \"source\": \"./plugins/automation-skills\"\n    },\n    {\n      \"name\": \"observability-skills\",\n      \"description\": \"Structured logging and Axiom observability for Next.js via Vercel Log Drains\",\n      \"version\": \"1.0.0\",\n      \"source\": \"./plugins/observability-skills\"\n    }\n  ]\n}\n",
        "README.md": "# Ronin Marketplace\n\n**Battle-tested skills for shipping software.** Hard-won knowledge from real deployments, packaged for Claude Code.\n\n[![Sponsor](https://img.shields.io/badge/Sponsor-Albert_Hui-ea4aaa?logo=github-sponsors)](https://github.com/sponsors/h4x0r)\n\n```\nronin-marketplace\n├── deployment-skills (4 skills)\n├── packaging-skills (2 skills)\n├── docs-skills (2 skills)\n├── automation-skills (1 skill)\n├── development-skills (2 skills)\n├── data-skills (1 skill)\n├── ui-skills (3 skills)\n└── observability-skills (1 skill)\n```\n\n## Installation\n\n### Claude Code\n\nFirst, add the marketplace:\n```\n/plugin marketplace add SecurityRonin/ronin-marketplace\n```\n\nThen install the plugins you need:\n```\n/plugin install deployment-skills@ronin-marketplace\n/plugin install packaging-skills@ronin-marketplace\n/plugin install docs-skills@ronin-marketplace\n/plugin install automation-skills@ronin-marketplace\n/plugin install development-skills@ronin-marketplace\n/plugin install data-skills@ronin-marketplace\n/plugin install ui-skills@ronin-marketplace\n/plugin install observability-skills@ronin-marketplace\n```\n\nOr install all at once:\n```\n/plugin install deployment-skills@ronin-marketplace packaging-skills@ronin-marketplace docs-skills@ronin-marketplace automation-skills@ronin-marketplace development-skills@ronin-marketplace data-skills@ronin-marketplace ui-skills@ronin-marketplace observability-skills@ronin-marketplace\n```\n\nVerify installation:\n```\n/skills\n```\n\n### Claude Desktop\n\nAdd to your config file:\n\n**macOS:** `~/Library/Application Support/Claude/claude_desktop_config.json`\n**Windows:** `%APPDATA%\\Claude\\claude_desktop_config.json`\n\n```json\n{\n  \"mcpServers\": {\n    \"ronin-marketplace\": {\n      \"command\": \"npx\",\n      \"args\": [\"-y\", \"@anthropic/claude-code-mcp\", \"--plugin\", \"https://github.com/SecurityRonin/ronin-marketplace\"]\n    }\n  }\n}\n```\n\nRestart Claude Desktop after adding.\n\n### Updates\n\n```\n/plugin update deployment-skills@ronin-marketplace\n```\n\n## Plugins\n\n### deployment-skills\n\nCloud deployment patterns for Vercel, Fly.io, and Cloudflare.\n\n```\n/plugin install deployment-skills@ronin-marketplace\n```\n\n| Skill | Use When |\n|-------|----------|\n| **deployment** | Choosing a deployment platform. Routes to Vercel, Fly.io, or Cloudflare based on workload type. |\n| **vercel-deployment** | Deploying to Vercel. **Fluid Compute** (60s timeout bug, duration limits), vercel.json config, maxDuration patterns, cron jobs, env var gotchas (printf!), monorepo setup, Next.js errors, GCP WIF, async operations (Vercel kills background tasks!). |\n| **fly-deployment** | Deploying to Fly.io. Single volume limit, monorepo patterns, Next.js provider errors. |\n| **cloudflare-r2-d1** | Using Cloudflare D1/R2/KV. Critical limits (10GB DB, 1 write/sec/key), multi-tenant patterns. |\n\n### packaging-skills\n\nCross-platform installers: DMG, MSI, DEB with GitHub Actions.\n\n```\n/plugin install packaging-skills@ronin-marketplace\n```\n\n| Skill | Use When |\n|-------|----------|\n| **build-cross-platform-packages** | Building installers for macOS (DMG), Windows (MSI/WiX), Linux (DEB). GitHub Actions automation, SLSA attestations, Homebrew updates. |\n| **robust-dependency-installation** | Bundling portable executables (FFmpeg, Tesseract, ExifTool) in MSI installers. Unified detection/execution code paths. |\n\n### docs-skills\n\nDocumentation pipelines: MkDocs, Pandoc, GitHub Pages.\n\n```\n/plugin install docs-skills@ronin-marketplace\n```\n\n| Skill | Use When |\n|-------|----------|\n| **mkdocs-github-pages-deployment** | Deploying MkDocs to GitHub Pages. Python-Markdown gotchas: 4-space indentation, footnotes, grid tables. |\n| **pandoc-pdf-generation** | Generating PDFs from Markdown. Blank line rules, fix scripts, visual testing workflow. |\n\n### automation-skills\n\nBrowser automation with Playwright, Puppeteer, and CDP.\n\n```\n/plugin install automation-skills@ronin-marketplace\n```\n\n| Skill | Use When |\n|-------|----------|\n| **browser-automation** | Automating browsers with Playwright/Puppeteer, handling dynamic content, CDP techniques, AI-powered tools. |\n\n### development-skills\n\nSoftware development patterns and tooling.\n\n```\n/plugin install development-skills@ronin-marketplace\n```\n\n| Skill | Use When |\n|-------|----------|\n| **chrome-extension-development** | Building Chrome extensions (Manifest V3). Floating panel architecture, sidepanel API, SPA navigation detection, storage patterns, message passing, content scripts, Vitest testing, Playwright E2E. |\n| **2026-migration-patterns** | Upgrading Zod 3→4, Vitest 2→4, Tailwind CSS 3→4, Pinecone 6→7, AI SDK. Breaking API changes (`.errors`→`.issues`, mock constructors, CSS-first config), type errors, migration checklist. |\n\n### data-skills\n\nAnalytics and data warehouse patterns for DuckDB, MotherDuck, and Parquet.\n\n```\n/plugin install data-skills@ronin-marketplace\n```\n\n| Skill | Use When |\n|-------|----------|\n| **duckdb-motherduck-parquet** | Using DuckDB/MotherDuck for analytics. Connection string auth (token in URL!), GLIBC compatibility on Vercel/Lambda, Parquet loading, BigInt serialization, CORS headers for WASM. |\n\n### ui-skills\n\nUI patterns for real-time updates and interactive components.\n\n```\n/plugin install ui-skills@ronin-marketplace\n```\n\n| Skill | Use When |\n|-------|----------|\n| **server-sent-events** | Real-time progress updates with SSE. TransformStream patterns, Next.js App Router, client consumption, Vercel timeout limits, error handling, batch processing. |\n| **chatbox-layout-patterns** | Building WhatsApp-style chat UIs. CSSence double-reverse scroll pattern, `min-h-0` grid/flex fix, `h-dvh` viewport locking, scroll sentinel anchoring, typing indicators, mobile bottom sheets. |\n| **humanlike-chat-timing** | Natural AI chat timing. Weber-Fechner delays, beta-distribution first-token delay (2-5s), character-by-character typing with position awareness, punctuation pauses, model response padding. |\n\n### observability-skills\n\nStructured logging and Axiom observability for Next.js applications.\n\n```\n/plugin install observability-skills@ronin-marketplace\n```\n\n| Skill | Use When |\n|-------|----------|\n| **structured-logging-axiom** | Implementing structured logging in Next.js. Zero-dependency `createLogger` pattern with JSON output for Axiom, Vercel Log Drains setup, child loggers for request tracing, `LOG_LEVEL` env var override, ESLint `no-console` guard, migration patterns from `console.*`, and pitfalls (`removeConsole`, `next-axiom`). |\n\n## Philosophy\n\nThese aren't generic tutorials. Each skill exists because something broke in production.\n\n- **Real failures** — Problems discovered shipping software, not theory\n- **Working code** — Tested across multiple projects\n- **Edge cases** — The gotchas that waste hours when you don't know them\n- **Automation** — Scripts and workflows to prevent manual errors\n\n> \"The best documentation is written in the blood of those who came before.\"\n\nThe DMG race condition fix came from 6 failed releases. The Python-Markdown rules from 469 formatting issues. The bundled dependency architecture from users reporting \"dependencies not found\" despite successful installation.\n\n## Contributing\n\nFound a gotcha we missed? PRs welcome. Follow the pattern in existing skills.\n\n## Sponsorship\n\nIf these skills save you time, consider [sponsoring](https://github.com/sponsors/h4x0r) continued development.\n\n## License\n\nMIT — Use freely, ship confidently.\n\n---\n\n*Built by [Security Ronin](https://securityronin.com)*\n"
      },
      "plugins": [
        {
          "name": "deployment-skills",
          "description": "Cloud deployment patterns for Vercel, Fly.io, and Cloudflare",
          "version": "1.0.0",
          "source": "./plugins/deployment-skills",
          "categories": [],
          "install_commands": [
            "/plugin marketplace add SecurityRonin/ronin-marketplace",
            "/plugin install deployment-skills@ronin-marketplace"
          ]
        },
        {
          "name": "packaging-skills",
          "description": "Cross-platform installers: DMG, MSI, DEB with GitHub Actions",
          "version": "1.0.0",
          "source": "./plugins/packaging-skills",
          "categories": [],
          "install_commands": [
            "/plugin marketplace add SecurityRonin/ronin-marketplace",
            "/plugin install packaging-skills@ronin-marketplace"
          ]
        },
        {
          "name": "docs-skills",
          "description": "Documentation pipelines: MkDocs, Pandoc, GitHub Pages",
          "version": "1.0.0",
          "source": "./plugins/docs-skills",
          "categories": [],
          "install_commands": [
            "/plugin marketplace add SecurityRonin/ronin-marketplace",
            "/plugin install docs-skills@ronin-marketplace"
          ]
        },
        {
          "name": "automation-skills",
          "description": "Browser automation with Playwright, Puppeteer, and CDP",
          "version": "1.0.0",
          "source": "./plugins/automation-skills",
          "categories": [],
          "install_commands": [
            "/plugin marketplace add SecurityRonin/ronin-marketplace",
            "/plugin install automation-skills@ronin-marketplace"
          ]
        },
        {
          "name": "observability-skills",
          "description": "Structured logging and Axiom observability for Next.js via Vercel Log Drains",
          "version": "1.0.0",
          "source": "./plugins/observability-skills",
          "categories": [],
          "install_commands": [
            "/plugin marketplace add SecurityRonin/ronin-marketplace",
            "/plugin install observability-skills@ronin-marketplace"
          ]
        }
      ]
    }
  ]
}