{
  "author": {
    "id": "shadowX4fox",
    "display_name": "Luis",
    "avatar_url": "https://avatars.githubusercontent.com/u/8646740?u=7c1fa373c5f38b91aa933dcb87578ad01090e21f&v=4"
  },
  "marketplaces": [
    {
      "name": "shadowx4fox-solution-architect-marketplace",
      "version": null,
      "description": "Official plugin marketplace by shadowX4fox",
      "repo_full_name": "shadowX4fox/solutions-architect-skills",
      "repo_url": "https://github.com/shadowX4fox/solutions-architect-skills",
      "repo_description": "Professional architecture documentation workflow for Claude Code",
      "signals": {
        "stars": 1,
        "forks": 0,
        "pushed_at": "2026-02-20T00:29:07Z"
      },
      "files": {
        ".claude-plugin/marketplace.json": "{\n  \"name\": \"shadowx4fox-solution-architect-marketplace\",\n  \"owner\": {\n    \"name\": \"shadowX4fox\",\n    \"url\": \"https://github.com/shadowX4fox\"\n  },\n  \"plugins\": [\n    {\n      \"name\": \"solutions-architect-skills\",\n      \"source\": \"./\",\n      \"description\": \"Professional architecture documentation workflow: Business requirements, technical architecture, and compliance documentation (10 specialized agents)\",\n      \"version\": \"2.3.6\",\n      \"author\": {\n        \"name\": \"shadowX4fox\"\n      }\n    }\n  ],\n  \"metadata\": {\n    \"description\": \"Official plugin marketplace by shadowX4fox\"\n  }\n}\n",
        ".claude-plugin/plugin.json": "{\n  \"name\": \"solutions-architect-skills\",\n  \"version\": \"2.3.6\",\n  \"description\": \"Professional architecture documentation workflow: Business requirements ‚Üí Technical architecture ‚Üí Compliance documents (10 specialized compliance agents)\",\n  \"author\": {\n    \"name\": \"shadowX4fox\",\n    \"email\": \"your-email@example.com\",\n    \"url\": \"https://github.com/shadowX4fox\"\n  },\n  \"homepage\": \"https://github.com/shadowX4fox/solutions-architect-skills\",\n  \"repository\": \"https://github.com/shadowX4fox/solutions-architect-skills\",\n  \"license\": \"MIT\",\n  \"keywords\": [\n    \"architecture\",\n    \"documentation\",\n    \"compliance\",\n    \"enterprise\",\n    \"templates\",\n    \"SRE\",\n    \"security\",\n    \"cloud\",\n    \"governance\",\n    \"technical-writing\",\n    \"presentations\",\n    \"powerpoint\"\n  ]\n}",
        "README.md": "# Solutions Architect Skills\n\n[![Version](https://img.shields.io/badge/version-1.5.23-blue.svg)](https://github.com/shadowx4fox/solutions-architect-skills/releases)\n[![License](https://img.shields.io/badge/license-MIT-green.svg)](LICENSE)\n[![Claude Code](https://img.shields.io/badge/Claude%20Code-Plugin-purple.svg)](https://claude.com/claude-code)\n\nProfessional architecture documentation workflow for Claude Code: Transform business requirements into technical architecture and compliance documents.\n\n## Overview\n\nThis Claude Code plugin provides a complete three-phase workflow for enterprise architecture documentation:\n\n```\nPhase 1: Business Requirements (PO Spec)\n    ‚Üì\nPhase 2: Technical Architecture (ARCHITECTURE.md)\n    ‚Üì\nPhase 3: Compliance Documents (10 contracts)\n```\n\n## Claude Code Marketplace & Plugin System\n\nThis project is distributed as a **Claude Code Plugin** via the **shadowX4fox Marketplace**:\n\n- **Marketplace**: A catalog of available plugins ([Learn more](https://docs.anthropic.com/claude/docs/claude-code-plugins))\n- **Plugin**: This repository, installable from the marketplace\n- **Skills**: Three specialized tools within the plugin\n\nFor detailed information about Claude Code's plugin system, see the [official Claude Code documentation](https://docs.anthropic.com/claude/docs/claude-code).\n\n---\n\n### What's Included\n\n- **3 Integrated Skills**\n  - `architecture-readiness`: Product Owner Specifications\n  - `architecture-docs`: ARCHITECTURE.md creation and maintenance\n  - `architecture-compliance`: Generate 10 compliance contracts\n\n- **10 Compliance Templates**\n  - Business Continuity, SRE, Cloud, Security, Enterprise Architecture, and more\n\n- **Automatic Validation** ‚≠ê NEW v1.3.0\n  - External validation system (0-10 scoring) for all 10 contracts\n  - 4-tier approval workflow (Auto-approve, Manual review, Needs work, Rejected)\n  - Template-specific validation configurations\n  - Metric consistency checking\n  - Design Drivers calculation\n\n- **Complete Documentation**\n  - Installation guide, Quick Start tutorial, Workflow guide, Troubleshooting\n\n## Quick Start\n\n### Installation\n\n**See [Installation Guide](docs/INSTALLATION.md) for detailed instructions.**\n\n**Quick Start (Using Marketplace - Recommended):**\n\n```bash\n# Step 1: Register marketplace (one-time)\n/plugin marketplace add shadowX4fox/solutions-architect-skills\n\n# Step 2: Install plugin\n/plugin install solutions-architect-skills@shadowx4fox-solution-architect-marketplace\n\n# Step 3: Verify installation\n/plugin list\n```\n\n**Alternative: Direct Git Clone**\n\n```bash\n# Clone directly to plugins directory\ngit clone https://github.com/shadowX4fox/solutions-architect-skills.git ~/.claude/plugins/solutions-architect-skills\n\n# Restart Claude Code and verify\n/plugin list\n```\n\nYou should see `solutions-architect-skills v1.9.0` in the list.\n\n**Important:** Marketplace registration is a security feature - you must explicitly add marketplaces before installing plugins. See [docs/INSTALLATION.md](docs/INSTALLATION.md) for detailed setup instructions.\n\n### First Workflow\n\n```bash\n# Phase 1: Create Product Owner Spec\n/skill architecture-readiness\n\n# Phase 2: Create ARCHITECTURE.md\n/skill architecture-docs\n\n# Phase 3: Generate compliance documents\n/skill architecture-compliance\n```\n\n## Features\n\n### Phase 1: Architecture Readiness (Product Owner)\n\nCreate comprehensive Product Owner Specifications before technical design begins.\n\n**Key Features:**\n- 8-section template (Business Context, User Personas, Use Cases, Success Criteria, etc.)\n- Weighted scoring methodology (0-10 scale)\n- Readiness threshold: ‚â•7.5 for architecture handoff\n- Focus: Business requirements, no technical implementation\n\n**Output:** `PRODUCT_OWNER_SPEC.md`\n\n### Phase 2: Architecture Documentation\n\nCreate and maintain technical architecture documentation following enterprise standards.\n\n**Key Features:**\n- 12-section standardized structure (Executive Summary ‚Üí ADRs)\n- Automatic Document Index (lines 1-50)\n- 5 architecture type templates (META, 3-Tier, Microservices, N-Layer, BIAN) ‚≠ê UPDATED v1.5\n- Interactive Mermaid diagrams in Section 4\n- Metric consistency validation across document\n- Design Drivers calculation (Value Delivery %, Scale, Impacts)\n- 9 mandatory Architecture Principles + 1 optional\n- ADR (Architecture Decision Record) templates\n- **Automatic ADR file generation** from Section 12 table ‚≠ê NEW v1.5\n\n**Output:** `ARCHITECTURE.md` (2,000-3,000 lines typically)\n\n### Phase 3: Compliance Documentation\n\nGenerate compliance contracts from ARCHITECTURE.md with full traceability.\n\n**Key Features:**\n- Context-efficient generation (70-80% reduction in loaded content)\n- **v1.3.0**: 11 complete compliance contracts with external validation system ‚≠ê NEW\n- **Automatic Validation (0-10 scoring)**: All contracts validated with granular scoring ‚≠ê NEW\n- **4-Tier Approval Workflow**: Auto-approve (8.0-10), Manual review (7.0-7.9), Needs work (5.0-6.9), Rejected (0-4.9) ‚≠ê NEW\n- Source traceability (section + line number references)\n- [PLACEHOLDER] markers for missing data with completion guidance\n- Compliance manifest (index of all generated documents)\n\n**Output:** `/compliance-docs/` directory with all 10 contracts + manifest (v1.3.0)\n\n**üéØ New in v1.5.0: Business Continuity v2.0**\n- Table-based format with 43 LACN requirements (expanded from 10 LABC)\n- 6-column compliance summary table\n- 330% increase in validation data points\n- Cloud-native resilience patterns (circuit breaker, retry, bulkhead, auto-scaling)\n\n#### Compliance Contract Types ‚≠ê v1.3.0: All 10 Contracts Complete\n\n**‚úÖ All 10 Contracts with External Validation System**:\n\n1. **Business Continuity** - RTO/RPO, disaster recovery, backup strategy, resilience\n2. **SRE Architecture** - SLOs, error budgets, monitoring, incident management, observability\n3. **Cloud Architecture** - Deployment model, cloud provider, connectivity, security\n4. **Security Architecture** - API security, authentication, encryption, compliance, controls\n5. **Data & Analytics/AI Architecture** - Data quality, AI governance, model validation, hallucination control\n6. **Development Architecture** - Technology stack, coding standards, technical debt, **26-item validation**\n7. **Process Transformation** - Automation, efficiency, ROI analysis, workflow optimization\n8. **Platform & IT Infrastructure** - Environments, databases, capacity, naming conventions\n9. **Enterprise Architecture** - Strategic alignment, modularity, cloud-first, API-first, governance\n10. **Integration Architecture** - Integration catalog, patterns, API security, standards\n\n**üéØ New in v1.3.0: External Validation System**\n\nAll 10 contracts now include automatic validation with:\n- **Scoring (0-10 scale)**: Granular feedback on compliance completeness\n- **4-Tier Approval**:\n  - **8.0-10.0**: Auto-approved by system (high confidence)\n  - **7.0-7.9**: Manual review required by approval authority\n  - **5.0-6.9**: Draft status - must address gaps\n  - **0.0-4.9**: Rejected - cannot proceed\n- **Template-Specific Rules**: Each contract has customized validation criteria\n- **Full Traceability**: All scores link back to ARCHITECTURE.md sources\n- **Actionable Feedback**: Clear recommendations for improving scores\n\n**Validation Configuration Files**: 11 JSON configs in `/skills/architecture-compliance/validation/`\n\n## Architecture Types & Visualization\n\n### 5 Supported Architecture Types\n\nChoose the architecture type that best fits your system:\n\n**1. META (6-Layer Enterprise)** - Large enterprise systems with complex integrations\n- Layers: Channels ‚Üí UX ‚Üí Business Scenarios ‚Üí Business ‚Üí Domain ‚Üí Core\n- Best for: Financial services, regulated industries, enterprise platforms\n- Template: Section 4 META with BIAN V12.0 alignment\n- **BIAN Standard**: Full V12.0 compliance with 12 metadata fields ‚≠ê ENHANCED v1.5\n- **Layer 5 Enhancement**: Matches BIAN Layer 4 comprehensiveness with complete service domain metadata\n\n**2. 3-Tier (Classic Web Application)** - Standard web applications and REST APIs\n- Tiers: Presentation ‚Üí Application/Business Logic ‚Üí Data\n- Best for: Web apps, line-of-business applications, standard CRUD systems\n- Template: Section 4 3-Tier with tier separation enforcement\n\n**3. Microservices (Cloud-Native)** - Distributed systems with independent services\n- Components: API Gateway, Service Mesh, Event Bus, independent services\n- Best for: Cloud-native systems, event-driven architectures, polyglot environments\n- Template: Section 4 Microservices with service catalog\n\n**4. N-Layer (DDD/Clean Architecture)** - Flexible custom patterns\n- Patterns: Classic DDD (4-Layer), Extended (5-Layer), Clean Architecture\n- Best for: Domain-Driven Design, Hexagonal Architecture, testable systems\n- Template: Section 4 N-Layer with dependency inversion\n\n**5. BIAN (Full BIAN V12.0 Certification)** - Pure BIAN Service Landscape architecture ‚≠ê NEW v1.5\n- Layers: Channels ‚Üí BIAN Business Scenarios ‚Üí BIAN Business Capabilities ‚Üí BIAN Service Domains ‚Üí Core Systems\n- Best for: Banking, financial services requiring full BIAN certification\n- Template: Section 4 BIAN and Section 5 BIAN with comprehensive metadata\n- **Compliance**: Mandatory full BIAN V12.0 compliance (12 metadata fields, 7 standard operations)\n- **Validation**: All service domain names validated against official [BIAN Service Landscape V12.0](https://bian.org/servicelandscape-12-0-0/views/view_51891.html)\n- **Traceability**: Full BIAN hierarchy (Service Domain ‚Üí Business Domain ‚Üí Business Area)\n\n**How to Choose**: See [ARCHITECTURE_TYPE_SELECTOR.md](skills/architecture-docs/templates/ARCHITECTURE_TYPE_SELECTOR.md) for decision tree and comparison matrix.\n\n### Interactive Mermaid Diagrams\n\nAll ARCHITECTURE.md documents include **Mermaid architecture diagrams** integrated into Section 4:\n\n**Capabilities**:\n- ‚úÖ Interactive visualization (zoom, pan, clickable components)\n- ‚úÖ Color-coded components (Blue=Orchestrators, Orange=Workers, Green=Query, Purple=Events)\n- ‚úÖ Data flow patterns (solid arrows=synchronous, dashed arrows=asynchronous)\n- ‚úÖ Security protocol visualization (OAuth 2.0, JWT, mTLS, TLS 1.2+, SASL)\n- ‚úÖ GitHub/GitLab native rendering (no plugins required)\n- ‚úÖ Professional, maintainable, version-control-friendly\n\n**Comprehensive Guide**: See [MERMAID_DIAGRAMS_GUIDE.md](skills/architecture-docs/MERMAID_DIAGRAMS_GUIDE.md) for templates, color schemes, and examples.\n\n## Documentation\n\n- **[Installation Guide](docs/INSTALLATION.md)** - Detailed installation instructions\n- **[Quick Start](docs/QUICK_START.md)** - 5-minute getting started tutorial\n- **[Workflow Guide](docs/WORKFLOW_GUIDE.md)** - Complete end-to-end workflow\n- **[Troubleshooting](docs/TROUBLESHOOTING.md)** - FAQ and common issues\n\n## Examples\n\n### Real-World Example Repository\n\n**[Task Scheduling Platform Example](https://github.com/shadowX4fox/task-scheduling-example)** ‚≠ê\n\nComplete end-to-end demonstration of the three-phase workflow:\n\n**Phase 1: Product Owner Specification**\n- Business requirements and user personas\n- Use cases and success criteria\n- Weighted readiness scoring (8.3/10)\n\n**Phase 2: Technical Architecture (ARCHITECTURE.md)**\n- 12-section comprehensive architecture document\n- Microservices architecture pattern\n- Interactive Mermaid diagrams\n- Technology stack documentation\n- Complete with metrics, SLOs, and ADRs\n\n**Phase 3: Compliance Documentation**\n- All 11 generated compliance contracts with v1.3.0 validation\n- Development Architecture with 26-item stack validation\n- Security, Cloud, SRE, and Enterprise Architecture contracts\n- Full source traceability to ARCHITECTURE.md\n\n**Repository**: https://github.com/shadowX4fox/task-scheduling-example\n\n---\n\n**Additional Examples in This Repository:**\n\nThe `examples/` directory contains reference templates:\n\n- **PRODUCT_OWNER_SPEC_example.md** - PO Spec template (Job Scheduling Platform)\n- **ARCHITECTURE_example.md** - Full ARCHITECTURE.md template (2000+ lines)\n\n---\n\n**Want More Examples?**\n\nTo request specific examples or use cases, [open an issue](https://github.com/shadowx4fox/solutions-architect-skills/issues/new).\n\n## Requirements\n\n- **Claude Code** (latest version)\n- **Bun** (v1.0.0 or later) - Required for compliance generation and template validation\n- **Platform:** macOS, Linux, or Windows\n\n### Why Bun?\n\nThe architecture-compliance skill uses Bun for:\n- Template expansion with `@include` directives\n- Pre-validation of template structure (Phase 4.1)\n- Post-validation of generated contracts (Phase 4.6)\n- High-performance TypeScript execution\n\n**Installation:** See [INSTALLATION.md](docs/INSTALLATION.md#installing-bun) for Bun setup instructions.\n\n## Use Cases\n\nPerfect for:\n- Enterprise architects documenting solution designs\n- Product Owners preparing requirements for architecture teams\n- Compliance teams generating organizational contracts\n- Technical leads maintaining architecture documentation\n- Teams needing standardized architecture workflows\n\n## Workflow Integration\n\n```mermaid\ngraph LR\n    A[Product Owner] -->|Creates| B[PO Spec]\n    B -->|Input to| C[Architecture Team]\n    C -->|Creates| D[ARCHITECTURE.md]\n    D -->|Generates| E[10 Compliance Contracts]\n    E -->|Review by| F[Compliance Team]\n```\n\n## External Validation System (v1.3.0)\n\nAll 10 compliance contracts use an **external validation system** with standardized 0-10 scoring:\n\n### Validation States & Scoring\n- ‚úÖ **PASS (10 points)**: Complies with requirements\n- ‚ùå **FAIL (0 points)**: Non-compliant or deprecated technology\n- ‚ö™ **N/A (10 points)**: Not applicable to this architecture\n- ‚ùì **UNKNOWN (0 points)**: Missing data in ARCHITECTURE.md\n- üîì **EXCEPTION (10 points)**: Documented exception via LADES2 process\n\n### Scoring Formula\n```\nFinal Score = (Completeness √ó 0.4) + (Compliance √ó 0.5) + (Quality √ó 0.1)\n\nWhere:\n- Completeness = (Filled required fields / Total required) √ó 10\n- Compliance = (PASS + N/A + EXCEPTION items / Total applicable) √ó 10\n- Quality = Source traceability coverage (0-10)\n```\n\n### Approval Workflow\n| Score | Status | Review Actor | Outcome |\n|-------|--------|--------------|---------|\n| 8.0-10.0 | Approved | System (Auto-Approved) | Ready for implementation |\n| 7.0-7.9 | In Review | [Approval Authority] | Manual review required |\n| 5.0-6.9 | Draft | Architecture Team | Address gaps before review |\n| 0.0-4.9 | Rejected | N/A (Blocked) | Cannot proceed to review |\n\n### Validation Configuration\n- **11 JSON config files**: One per contract type in `/skills/architecture-compliance/validation/`\n- **Template-specific weights**: Each contract can customize Completeness/Compliance/Quality weights\n- **Validation schema**: `VALIDATION_SCHEMA.json` defines standard structure\n- **Example scenarios**: `VALIDATION_EXAMPLES.md` shows all 4 outcome tiers\n\n### Example: Development Architecture Validation\nThe Development Architecture contract validates against a **26-item checklist**:\n- **Java Backend** (6 items): Version, Spring Boot, tools, containers, libraries, naming\n- **.NET Backend** (6 items): C# version, ASP.NET Core, tools, containers, libraries, naming\n- **Frontend** (6 items): Framework, TypeScript/JavaScript, tools, architecture, libraries, naming\n- **Other Stacks** (5 items): Automation, IaC, databases, APIs, CI/CD\n- **Exceptions** (3 items): Deviations exist?, Documented?, Approved?\n\n## Roadmap\n\n### v1.5.0 (Current Release) ‚úÖ\n**Major Release: BIAN Full Compliance + Business Continuity v2.0**\n\n- ‚úÖ **5th Architecture Type: Full BIAN V12.0** ‚≠ê MAJOR\n  - New SECTION_4_BIAN.md and SECTION_5_BIAN.md templates\n  - Mandatory Full BIAN V12.0 compliance (no Partial/Custom options)\n  - 12 BIAN metadata fields (expanded from 4)\n  - 7 standardized BIAN service operations (Initiate, Update, Retrieve, Control, Exchange, Execute, Request)\n  - Full BIAN hierarchy traceability (Service Domain ‚Üí Business Domain ‚Üí Business Area)\n  - All service domain names validated against official BIAN V12.0 Service Landscape\n- ‚úÖ **META Layer 5 Enhancement** - Upgraded to match BIAN Layer 4 comprehensiveness\n  - Expanded from 4 to 12 BIAN metadata fields\n  - Complete service domain documentation requirements\n- ‚úÖ **Business Continuity v2.0** - Table-based format with 43 LACN requirements ‚≠ê MAJOR\n  - Expanded from 10 LABC to 43 LACN requirements (330% increase in validation coverage)\n  - 6-column compliance summary table (Code, Requirement, Category, Status, Source, Role)\n  - 6 validation categories: BC-GEN, BC-RTO, BC-DR, BC-BACKUP, BC-AUTO, BC-CLOUD\n  - Cloud-native resilience patterns (circuit breaker, retry, bulkhead, auto-scaling)\n  - Comprehensive disaster recovery documentation\n- ‚úÖ **Automatic ADR file generation** from Section 12 table in ARCHITECTURE.md\n  - 4-option prompt: Generate, Preview, Skip, Learn More\n  - Automatic metadata population (title, status, date, authors)\n  - Slug generation with conflict handling\n  - Creates `adr/` directory with properly formatted ADR files\n- ‚úÖ **Enhanced compliance validation** - Multi-layer format enforcement\n  - LACN003 extraction for META architecture layers\n  - Template format validators with strict enforcement\n  - Improved error messages and validation feedback\n- ‚úÖ **Principle #10 rename** - \"Decouple Through Events\" (formerly \"Event-Driven Integration\")\n\n### v1.3.0 (Previous Release)\n**Major Release: Complete Validation System**\n\n- ‚úÖ **All 10 compliance contracts** with templates and validation ‚≠ê MAJOR\n- ‚úÖ **External validation system** (0-10 scoring, 4-tier approval) ‚≠ê MAJOR\n- ‚úÖ **10 validation configuration files** (JSON-based, template-specific)\n- ‚úÖ **Validation documentation**:\n  - `VALIDATION_SCHEMA.json` - Schema definition\n  - `VALIDATION_EXAMPLES.md` - 4-tier outcome examples\n  - Updated COMPLIANCE_GENERATION_GUIDE.md\n  - Updated SKILL.md workflow\n- ‚úÖ **Document Control standardization** across all 11 templates\n- ‚úÖ **Automated approval workflow**:\n  - Auto-approve: Score ‚â• 8.0\n  - Manual review: Score 7.0-7.9\n  - Needs work: Score 5.0-6.9\n  - Rejected: Score < 5.0\n\n### v1.2.2 (Previous Release)\n- ‚úÖ Document Control format standardization\n- ‚úÖ Strict source traceability enforcement\n\n### v1.2.0\n- ‚úÖ 3 integrated skills (architecture-readiness, architecture-docs, architecture-compliance)\n- ‚úÖ 4 architecture types with Mermaid diagrams (META, 3-Tier, Microservices, N-Layer)\n- ‚úÖ BIAN V12.0 integration for META architecture\n- ‚úÖ 4 ready-to-use compliance contracts\n- ‚úÖ Enhanced Data & AI Architecture compliance (Version 2.0)\n\n### v1.1.0\n- ‚úÖ Initial release with 3 compliance contracts\n- ‚úÖ Foundation for architecture documentation workflow\n\n### Future Releases üöÄ\n\n### v2.0.0 (Future)\n- Multi-project support\n- Custom compliance contract templates\n- Integration with CI/CD pipelines\n- Advanced reporting and dashboards\n\n---\n\n## Contributing\n\nContributions are welcome! Please feel free to submit issues or pull requests.\n\n### Reporting Issues\n\nIf you encounter problems:\n1. Check the [Troubleshooting Guide](docs/TROUBLESHOOTING.md)\n2. Search [existing issues](https://github.com/shadowx4fox/solutions-architect-skills/issues)\n3. Open a new issue with detailed description\n\n### Feature Requests\n\nHave an idea for improvement? Open an issue with the `enhancement` label.\n\n## Version History\n\nSee [CHANGELOG.md](CHANGELOG.md) for detailed version history.\n\n## License\n\nThis project is licensed under the MIT License - see the [LICENSE](LICENSE) file for details.\n\n## Author\n\n**shadowx4fox**\n- GitHub: [@shadowx4fox](https://github.com/shadowx4fox)\n- Repository: [solutions-architect-skills](https://github.com/shadowx4fox/solutions-architect-skills)\n\n## Acknowledgments\n\n- Built for [Claude Code](https://claude.com/claude-code) by Anthropic\n- Follows enterprise architecture best practices\n- Inspired by organizational compliance frameworks\n\n---\n\n**Get Started:** Download the [latest release](https://github.com/shadowx4fox/solutions-architect-skills/releases) and transform your architecture workflow today!"
      },
      "plugins": [
        {
          "name": "solutions-architect-skills",
          "source": "./",
          "description": "Professional architecture documentation workflow: Business requirements, technical architecture, and compliance documentation (10 specialized agents)",
          "version": "2.3.6",
          "author": {
            "name": "shadowX4fox"
          },
          "categories": [],
          "install_commands": [
            "/plugin marketplace add shadowX4fox/solutions-architect-skills",
            "/plugin install solutions-architect-skills@shadowx4fox-solution-architect-marketplace"
          ]
        }
      ]
    }
  ]
}