{
  "author": {
    "id": "Shahfarzane",
    "display_name": "Shah",
    "avatar_url": "https://avatars.githubusercontent.com/u/42602105?u=13217399bb4ec4bd05750ede26d2a4a2b5843fb5&v=4"
  },
  "marketplaces": [
    {
      "name": "browser-skill-marketplace",
      "version": null,
      "description": "Browser automation skill for Claude Code",
      "repo_full_name": "Shahfarzane/claude-code-browser-skills",
      "repo_url": "https://github.com/Shahfarzane/claude-code-browser-skills",
      "repo_description": null,
      "signals": {
        "stars": 0,
        "forks": 0,
        "pushed_at": "2025-12-17T07:39:21Z"
      },
      "files": {
        ".claude-plugin/marketplace.json": "{\n  \"name\": \"browser-skill-marketplace\",\n  \"owner\": {\n    \"name\": \"Shahfarzane\",\n    \"url\": \"https://github.com/Shahfarzane\"\n  },\n  \"metadata\": {\n    \"description\": \"Browser automation skill for Claude Code\",\n    \"version\": \"1.0.0\"\n  },\n  \"plugins\": [\n    {\n      \"name\": \"browser-automation\",\n      \"source\": \"./\",\n      \"description\": \"Control Chrome with natural language - navigate websites, fill forms, extract data, take screenshots, and debug with DevTools.\"\n    }\n  ]\n}\n",
        ".claude-plugin/plugin.json": "{\n  \"name\": \"browser-automation\",\n  \"version\": \"1.0.0\",\n  \"description\": \"Browser automation skill for Claude Code. Control Chrome with natural language - navigate websites, fill forms, extract data, take screenshots, and monitor network requests.\",\n  \"author\": {\n    \"name\": \"Shahfarzane\",\n    \"url\": \"https://github.com/Shahfarzane\"\n  },\n  \"homepage\": \"https://github.com/Shahfarzane/claude-code-browser-skill\",\n  \"repository\": \"https://github.com/Shahfarzane/claude-code-browser-skill\",\n  \"license\": \"MIT\",\n  \"keywords\": [\n    \"browser\",\n    \"automation\",\n    \"web-scraping\",\n    \"stagehand\",\n    \"screenshots\",\n    \"devtools\",\n    \"chrome\",\n    \"playwright\"\n  ]\n}\n",
        "README.md": "# Claude Code Browser Skill\n\n[![License: MIT](https://img.shields.io/badge/License-MIT-yellow.svg)](https://opensource.org/licenses/MIT)\n[![Node.js Version](https://img.shields.io/badge/node-%3E%3D18.0.0-brightgreen)](https://nodejs.org)\n\nA browser automation skill for [Claude Code](https://docs.anthropic.com/en/docs/claude-code) that enables natural language control of Chrome using [Stagehand](https://github.com/browserbase/stagehand). Just ask Claude to browse the web, and it handles the rest.\n\n## Features\n\n- **Natural Language Control** - Describe actions in plain English: \"click the login button\", \"fill in the email field\"\n- **Web Scraping** - Extract structured data from any webpage with schema validation\n- **Screenshots** - Automatic screenshot capture after every action for visual verification\n- **Form Filling** - Fill out forms, click buttons, and interact with any web element\n- **DevTools Integration** - Monitor network requests, console logs, and execute JavaScript\n- **Design Token Extraction** - Extract colors, typography, spacing, and component styles from any site\n- **Session Persistence** - Browser stays open between commands, preserving cookies and login state\n- **Stealth Mode** - Anti-bot detection features to avoid being blocked\n\n## Installation\n\n### Claude Code Plugin (Recommended)\n\nAdd the marketplace and install the plugin:\n\n```bash\n# In Claude Code, run:\n/plugin marketplace add Shahfarzane/claude-code-browser-skill\n/plugin install browser-automation@browser-skill-marketplace\n```\n\nThen restart Claude Code for changes to take effect.\n\n### Manual Installation\n\n```bash\n# Clone the repository\ngit clone https://github.com/Shahfarzane/claude-code-browser-skill.git\ncd claude-code-browser-skill\n\n# Install dependencies (automatically builds TypeScript)\npnpm install\n# or: npm install\n\n# Link the CLI globally\nnpm link\n\n# Set your API key\nexport ANTHROPIC_API_KEY=\"your-api-key\"\n```\n\n## Quick Start\n\nOnce installed, just ask Claude to browse:\n\n```\n\"Go to Hacker News and get the top 5 stories\"\n\"Navigate to github.com and take a screenshot\"\n\"Fill out the contact form on example.com with test data\"\n```\n\nClaude will automatically use the browser skill when appropriate.\n\n### Direct CLI Usage\n\nYou can also use the CLI directly:\n\n```bash\n# Navigate to a URL\nbrowser navigate https://example.com\n\n# Perform an action\nbrowser act \"click the Sign In button\"\n\n# Extract data\nbrowser extract \"get all product names and prices\" '{\"name\": \"string\", \"price\": \"number\"}'\n\n# Take a screenshot\nbrowser screenshot\n\n# Close the browser\nbrowser close\n```\n\n## Available Commands\n\n| Command | Description |\n|---------|-------------|\n| `browser navigate <url>` | Navigate to a URL |\n| `browser act \"<action>\"` | Perform a natural language action |\n| `browser extract \"<instruction>\" [schema]` | Extract structured data |\n| `browser observe \"<query>\"` | Discover elements on the page |\n| `browser screenshot` | Take a screenshot |\n| `browser design [url]` | Extract design tokens from a page |\n| `browser close` | Close the browser |\n\n### DevTools Commands\n\n| Command | Description |\n|---------|-------------|\n| `browser network [filter]` | List captured network requests |\n| `browser network-get <id>` | Get full request details including body |\n| `browser console [filter]` | List console messages |\n| `browser eval \"<javascript>\"` | Execute JavaScript in page context |\n| `browser clear` | Clear captured DevTools data |\n\n## Requirements\n\n- **Node.js** >= 18.0.0\n- **Google Chrome** installed locally\n- **Anthropic API Key** - Set as `ANTHROPIC_API_KEY` environment variable\n\n### Chrome Installation\n\n- **macOS/Windows**: [Download Chrome](https://www.google.com/chrome/)\n- **Linux**: `sudo apt install google-chrome-stable`\n\n## How It Works\n\nThis skill uses [Stagehand](https://github.com/browserbase/stagehand) by Browserbase, an AI-powered browser automation framework that wraps Playwright. Stagehand uses Claude to:\n\n1. **Understand** your natural language instructions\n2. **Locate** the right elements on the page\n3. **Execute** the appropriate browser actions\n4. **Extract** structured data with schema validation\n\nThe browser persists between commands, so you can chain multiple actions without reopening Chrome.\n\n## Advanced Usage\n\n### Interactive Agent Mode\n\nFor a conversational interface with multi-turn support:\n\n```bash\npnpm run claude\n# or: npm run claude\n```\n\nThis starts an interactive session where you can have ongoing conversations about browser tasks.\n\n### Design Token Extraction\n\nExtract a complete design system from any website:\n\n```bash\nbrowser design https://example.com\n```\n\nReturns colors, typography, spacing, borders, button styles, and detected CSS frameworks.\n\n### Network Monitoring\n\nDebug API calls and monitor requests:\n\n```bash\nbrowser navigate https://api-heavy-site.com\nbrowser network api          # Filter requests containing \"api\"\nbrowser network-get <id>     # Get full request/response details\n```\n\n## Troubleshooting\n\n### Chrome not found\n\nEnsure Chrome is installed at a standard location, or the CLI will show installation instructions.\n\n### Browser won't start\n\nCheck if port 9222 is in use by another Chrome debugging session:\n```bash\nlsof -i :9222\n```\n\n### API key not found\n\nSet your Anthropic API key:\n```bash\nexport ANTHROPIC_API_KEY=\"your-key\"\n# Or create a .env file (see .env.example)\n```\n\n### Profile refresh\n\nTo clear cookies and start fresh:\n```bash\nrm -rf .chrome-profile\n```\n\n## Architecture\n\n```\nclaude-code-browser-skill/\n├── .claude/skills/browser-automation/   # Claude Code skill definition\n│   ├── SKILL.md                         # Main skill instructions\n│   ├── EXAMPLES.md                      # Usage examples\n│   └── REFERENCE.md                     # Technical reference\n├── src/\n│   ├── cli.ts                           # Main CLI entry point\n│   ├── browser-utils.ts                 # Chrome discovery & profiles\n│   ├── stealth.ts                       # Anti-bot detection\n│   └── design-extractor.ts              # Design token extraction\n└── agent-browse.ts                      # Interactive agent mode\n```\n\nFor detailed architecture documentation, see [docs/ARCHITECTURE.md](docs/ARCHITECTURE.md).\n\n## Contributing\n\nContributions are welcome! Please see [CONTRIBUTING.md](CONTRIBUTING.md) for guidelines.\n\n## License\n\n[MIT](LICENSE) - Copyright (c) 2024 Shahfarzane\n\n## Acknowledgments\n\n- [Stagehand](https://github.com/browserbase/stagehand) by Browserbase - AI browser automation framework\n- [Playwright](https://playwright.dev/) - Browser automation library\n- [Claude Code](https://docs.anthropic.com/en/docs/claude-code) - AI coding assistant by Anthropic\n"
      },
      "plugins": [
        {
          "name": "browser-automation",
          "source": "./",
          "description": "Control Chrome with natural language - navigate websites, fill forms, extract data, take screenshots, and debug with DevTools.",
          "categories": [],
          "install_commands": [
            "/plugin marketplace add Shahfarzane/claude-code-browser-skills",
            "/plugin install browser-automation@browser-skill-marketplace"
          ]
        }
      ]
    }
  ]
}