{
  "author": {
    "id": "Slowth-KIM",
    "display_name": "DOHEE KIM",
    "avatar_url": "https://avatars.githubusercontent.com/u/45562511?v=4"
  },
  "marketplaces": [
    {
      "name": "slowth-agents",
      "version": null,
      "description": "A collection of AI agents for Claude Code",
      "repo_full_name": "Slowth-KIM/slowth-agents",
      "repo_url": "https://github.com/Slowth-KIM/slowth-agents",
      "repo_description": "A collection of AI agents for Claude Code",
      "signals": {
        "stars": 1,
        "forks": 0,
        "pushed_at": "2026-01-11T10:56:46Z"
      },
      "files": {
        ".claude-plugin/marketplace.json": "{\n  \"$schema\": \"https://claude.ai/schemas/marketplace.json\",\n  \"name\": \"slowth-agents\",\n  \"owner\": {\n    \"name\": \"Slowth-KIM\",\n    \"url\": \"https://github.com/Slowth-KIM\"\n  },\n  \"displayName\": \"Slowth Agents\",\n  \"description\": \"A collection of AI agents for Claude Code\",\n  \"repository\": \"https://github.com/Slowth-KIM/slowth-agents\",\n  \"plugins\": [\n    {\n      \"name\": \"raven\",\n      \"source\": \"./raven/.claude\",\n      \"description\": \"GTD-based autonomous coding with specialized AI agents\"\n    }\n  ]\n}\n",
        "README.md": "# slowth-agents\n\n> A collection of AI agents for Claude Code\n\n## Available Plugins\n\n| Plugin | Description | Status |\n|--------|-------------|--------|\n| [raven](./raven) | GTD-based autonomous coding framework | Active |\n\n## Installation\n\nIn Claude Code, run:\n\n```bash\n# 1. Add marketplace\n/plugin marketplace add Slowth-KIM/slowth-agents\n\n# 2. Install plugin\n/plugin install raven@slowth-agents\n```\n\n### Updating\n\n```bash\n/plugin marketplace update slowth-agents\n/plugin update raven@slowth-agents\n```\n\n## Plugins\n\n### Raven\n\nGTD-based autonomous coding with specialized AI agents.\n\n**Features:**\n- GTD Task Manager (capture, clarify, organize)\n- Context Engineer (PRD creation)\n- Developer (feature implementation)\n- QA Engineer (verification)\n\n[Learn more](./raven/README.md)\n\n---\n\n## Adding New Plugins\n\nCreate a new folder with `.claude/plugin.json`:\n\n```\nslowth-agents/\n├── .claude-plugin/\n│   └── marketplace.json\n├── raven/\n│   └── .claude/plugin.json\n├── new-plugin/\n│   └── .claude/plugin.json\n└── README.md\n```\n\n## Marketplace Setup\n\nTo register a repository as a marketplace, create `.claude-plugin/marketplace.json`:\n\n```json\n{\n  \"$schema\": \"https://claude.ai/schemas/marketplace.json\",\n  \"name\": \"slowth-agents\",\n  \"owner\": {\n    \"name\": \"Slowth-KIM\",\n    \"url\": \"https://github.com/Slowth-KIM\"\n  },\n  \"displayName\": \"Slowth Agents\",\n  \"description\": \"A collection of AI agents for Claude Code\",\n  \"repository\": \"https://github.com/Slowth-KIM/slowth-agents\",\n  \"plugins\": [\n    {\n      \"name\": \"raven\",\n      \"source\": \"./raven/.claude\",\n      \"description\": \"GTD-based autonomous coding with specialized AI agents\"\n    }\n  ]\n}\n```\n\n## License\n\nMIT\n"
      },
      "plugins": [
        {
          "name": "raven",
          "source": "./raven/.claude",
          "description": "GTD-based autonomous coding with specialized AI agents",
          "categories": [],
          "install_commands": [
            "/plugin marketplace add Slowth-KIM/slowth-agents",
            "/plugin install raven@slowth-agents"
          ]
        }
      ]
    }
  ]
}