{
  "author": {
    "id": "starburst997",
    "display_name": "JD Boivin",
    "avatar_url": "https://avatars.githubusercontent.com/u/77518?u=ddf984e27ddbbf941a88017cb71872be0429a2e4&v=4"
  },
  "marketplaces": [
    {
      "name": "jd",
      "version": null,
      "description": "Plugins for Claude Code tailored for my needs",
      "repo_full_name": "starburst997/claude",
      "repo_url": "https://github.com/starburst997/claude",
      "repo_description": "Plugins for Claude Code tailored for my needs",
      "signals": {
        "stars": 0,
        "forks": 0,
        "pushed_at": "2025-11-25T17:38:11Z"
      },
      "files": {
        ".claude-plugin/marketplace.json": "{\n  \"name\": \"jd\",\n  \"owner\": {\n    \"name\": \"JD Boivin\",\n    \"email\": \"jd@boiv.in\",\n    \"url\": \"https://github.com/starburst997\"\n  },\n  \"metadata\": {\n    \"description\": \"Plugins for Claude Code tailored for my needs\",\n    \"version\": \"1.0.0\",\n    \"homepage\": \"https://claude.jd.boiv.in\",\n    \"pluginRoot\": \"./plugins\"\n  },\n  \"plugins\": [\n    {\n      \"name\": \"common\",\n      \"source\": \"./plugins/common\",\n      \"category\": \"jd\",\n      \"tags\": [\"common\"]\n    }\n  ]\n}\n",
        "README.md": "# Claude Code Plugins\n\nA curated collection of plugins for [Claude Code](https://claude.com/claude-code) tailored for my needs.\n\n## Overview\n\nThis repository contains custom plugins designed to extend Claude Code functionality with project-specific context, commands, and automation. These plugins help inject guidelines, provide slash commands, and customize the Claude Code experience across different project types.\n\n## Available Plugins\n\n### Common Plugin (`common@jd`)\n\nGeneric plugin useful for all types of projects. Automatically injects custom context and guidelines at the start of every Claude Code session.\n\n**Hooks:**\n\n- `SessionStart` - Injects project guidelines from `context/instructions.md` or (`CONTEXT.md` / `CONTEXT_ADD.md`)\n\n**Commands:**\n\n- `/common:readme [folder_path]` - Create / update professional README files\n- `/common:gh-pages [theme]` - Generate professional GitHub Pages in docs/ (theme: `dark` or `light`)\n- `/common:issue` - Create a PR to fix the current GitHub issue (for use with `claude-code-action`)\n- `/common:hello` - Personalized greeting command\n\n**Context Files:**\n\n- `context/instructions.md` - Customizable project guidelines and instructions\n\n[View Common Plugin Documentation →](./plugins/common/README.md)\n\n### Coming Soon\n\n- `nextjs@jd` - Next.js specific optimizations and guidelines\n- `typescript@jd` - TypeScript development enhancements\n\n## Installation\n\n### Step 1: Add the Marketplace\n\nFirst, add this repository as a plugin marketplace in Claude Code:\n\n```bash\n/plugin marketplace add starburst997/claude\n```\n\n### Step 2: Install Plugins\n\nOnce the marketplace is added, install plugins from it:\n\n```bash\n/plugin install common@jd\n```\n\n### Alternative: Team Configuration\n\nFor team-wide plugin installation, add to your project's `.claude/settings.json`:\n\n```json\n{\n  \"extraKnownMarketplaces\": {\n    \"jd\": {\n      \"source\": {\n        \"source\": \"github\",\n        \"repo\": \"starburst997/claude\"\n      }\n    }\n  },\n  \"enabledPlugins\": {\n    \"common@jd\": true\n  }\n}\n```\n\nWhen teammates trust the folder, they'll be prompted to install the marketplace and plugins automatically.\n\n### Local Development\n\nFor local plugin development or testing:\n\n```bash\n/plugin marketplace add /path/to/repo\n/plugin install common@jd\n```\n\n## Plugin Structure\n\nEach plugin can include any combination of these features:\n\n```\nplugin-name/\n├── .claude-plugin/\n│   └── plugin.json         # Plugin metadata\n├── commands/               # Slash commands (user-invoked)\n│   └── *.md                # Command definitions\n├── agents/                 # Specialized subagents\n│   └── *.md                # Agent definitions\n├── skills/                 # Model-invoked capabilities\n│   └── skill-name/\n│       └── SKILL.md        # Skill definition\n├── hooks/                  # Event handlers\n│   ├── hooks.json          # Hook configuration\n│   └── *.sh                # Hook executables\n├── .mcp.json               # MCP server configurations\n└── README.md               # Plugin documentation\n```\n\n## Usage\n\nAfter installing a plugin, its features become available in Claude Code:\n\n- **Commands**: User-invoked slash commands (e.g., `/common:readme`)\n- **Agents**: Specialized subagents invoked automatically by Claude or explicitly by user\n- **Skills**: Model-invoked functions - Claude autonomously uses based on task context\n- **Hooks**: Event-driven automation that runs automatically (SessionStart, PreToolUse, etc.)\n- **MCP Servers**: External tool integration that starts automatically when plugin is enabled\n\n## Marketplace\n\nThis repository is configured as a Claude Code plugin marketplace:\n\n- **Marketplace ID**: `jd`\n- **Author**: JD Boivin\n- **Homepage**: https://claude.jd.boiv.in\n- **GitHub**: https://github.com/starburst997\n\n## Benefits\n\n- Share common guidelines across multiple projects\n- No need to duplicate context files\n- Easy to version control and distribute\n- Combine multiple plugins for layered functionality\n- Automatic context loading without manual intervention\n\n## Development\n\n### Creating a New Plugin\n\n1. Create a new directory in `plugins/`\n2. Add `.claude-plugin/plugin.json` with metadata\n3. Add hooks, commands, etc. as needed\n4. Document in plugin's README.md\n5. Register in `.claude-plugin/marketplace.json`\n\n## License\n\nMIT License - see [LICENSE](./LICENSE) file for details.\n\nCopyright (c) 2025 JD Boivin\n\n## Resources\n\n- [Claude Code Documentation](https://docs.claude.com/en/docs/claude-code)\n- [Plugin Development Guide](https://docs.claude.com/en/docs/claude-code/plugins)\n- [Project Homepage](https://claude.jd.boiv.in)\n",
        "plugins/common/README.md": "# Common Plugin\n\nGeneric plugin useful for all types of projects. Automatically injects custom context and guidelines at the start of every Claude Code session.\n\n## Features\n\n**Hooks:**\n\n- `SessionStart` - Injects project guidelines with support for project-specific customization\n\n**Commands:**\n\n- `/common:readme [folder_path]` - Create/update professional README files\n- `/common:gh-pages [theme]` - Generate professional GitHub Pages (index.html) in docs/ (theme: dark or light, default: dark)\n- `/common:issue` - Create a PR to fix the current GitHub issue (designed for use with claude-code-action)\n- `/common:hello` - Personalized greeting command\n\n## How It Works\n\n### SessionStart Hook\n\nThis plugin uses a SessionStart hook to automatically inject custom context into Claude's prompts at the beginning of each session. This works similarly to CLAUDE.md files but can be shared across multiple projects via the plugin system.\n\nThe hook executes `hooks/session-context.sh` which supports a flexible context loading system:\n\n1. **Project-specific context** - Checks for `CONTEXT.md` in the current working directory\n2. **Default context** - Falls back to plugin's `context/instructions.md` if no project context exists\n3. **Additional context** - Appends `CONTEXT_ADD.md` from the current directory if it exists (works with both project and default context)\n\n## Customization\n\n### Plugin-level (affects all projects)\n\nEdit `context/instructions.md` in the plugin directory to customize the default guidelines injected at session start.\n\n### Project-level (affects only specific projects)\n\nCreate one or both of these files in your project's root directory:\n\n- **`CONTEXT.md`** - Replaces the plugin's default context entirely for this project\n- **`CONTEXT_ADD.md`** - Appends additional context on top of either the project-specific `CONTEXT.md` or the plugin's default `instructions.md`\n\n**Priority order:**\n1. If `CONTEXT.md` exists in project → use it as base context\n2. Otherwise → use plugin's `context/instructions.md` as base context\n3. If `CONTEXT_ADD.md` exists in project → append it to the base context\n"
      },
      "plugins": [
        {
          "name": "common",
          "source": "./plugins/common",
          "category": "jd",
          "tags": [
            "common"
          ],
          "description": null,
          "categories": [
            "common",
            "jd"
          ],
          "install_commands": [
            "/plugin marketplace add starburst997/claude",
            "/plugin install common@jd"
          ]
        }
      ]
    }
  ]
}