{
  "author": {
    "id": "tmdgusya",
    "display_name": "roach",
    "avatar_url": "https://avatars.githubusercontent.com/u/57784077?u=387caf2969a851378614ad7712d1e78c7731d792&v=4"
  },
  "marketplaces": [
    {
      "name": "ralph-agent-marketplace",
      "version": null,
      "description": "Implementation agents with planning, building, and loop control workflows using IMPLEMENTATION_PLAN.md with continuous task execution, verification, git workflow, and iteration limits",
      "repo_full_name": "tmdgusya/roach-loop",
      "repo_url": "https://github.com/tmdgusya/roach-loop",
      "repo_description": null,
      "signals": {
        "stars": 0,
        "forks": 0,
        "pushed_at": "2026-01-23T02:53:40Z"
      },
      "files": {
        ".claude-plugin/marketplace.json": "{\n  \"name\": \"ralph-agent-marketplace\",\n  \"owner\": {\n    \"name\": \"tmdgusya\",\n    \"email\": \"dev0jsh@gmail.com\"\n  },\n  \"plugins\": [\n    {\n      \"name\": \"ralph-agent\",\n      \"source\": \"./ralph-agent\",\n      \"description\": \"Implementation agents with planning, building, and loop control workflows using IMPLEMENTATION_PLAN.md with continuous task execution, verification, git workflow, and iteration limits\",\n      \"version\": \"0.5.0\",\n      \"author\": {\n        \"name\": \"tmdgusya\"\n      },\n      \"keywords\": [\n        \"automation\",\n        \"implementation\",\n        \"task-runner\",\n        \"verification\",\n        \"planning\",\n        \"git-workflow\",\n        \"iteration-control\",\n        \"loop\"\n      ],\n      \"homepage\": \"https://github.com/tmdgusya/roach-loop\",\n      \"repository\": \"https://github.com/tmdgusya/roach-loop.git\",\n      \"license\": \"MIT\",\n      \"strict\": false\n    }\n  ]\n}\n",
        "README.md": "# Ralph Agent Plugin\n\nImplementation agents for Claude Code that follow structured implementation plans with continuous task execution, verification, and optional git workflow.\n\n## Overview\n\nThis plugin provides two complementary workflows for automated implementation:\n\n### Geoff's Iterative Planning & Building\nFor projects with specification files in `specs/` directory:\n- **Geoff's Planner** (`/ralph-agent:gplan`): Analyzes specs and code, creates prioritized `IMPLEMENTATION_PLAN.md`\n- **Geoff's Builder** (`/ralph-agent:gbuild`): Implements tasks with automatic git commits, pushes, and version tags\n- Best for: Spec-driven projects requiring git workflow and version tracking\n\n### Ralph's Direct Execution\nFor projects with manual or existing implementation plans:\n- **Ralph** (`/ralph-agent:ralph`): Executes tasks from `IMPLEMENTATION_PLAN.md` sequentially\n- Best for: Simple task lists where you manage your own git workflow\n\n## Features\n\n### Geoff's Workflow\n- **Parallel Analysis**: Configurable parallel subagents for specs and codebase analysis\n- **Spec-Driven Planning**: Automatic plan generation from `specs/` directory\n- **Git Workflow**: Automatic add → commit → push → tag (0.0.0 → 0.0.1 → ...)\n- **Gap Detection**: Compares implementation against specs, identifies missing features\n- **Ultrathink Prioritization**: Uses Opus for deep analysis and task ordering\n\n### Ralph's Workflow\n- **Continuous Execution**: Automatically moves to the next task after verification passes\n- **Verification Gated**: Never marks a task complete without passing verification\n- **Progress Tracking**: Uses markdown checklist format (`- [ ]` / `- [x]`) for task status\n- **Error Recovery**: Fixes failed verification and retries until tasks pass\n- **Clear Reporting**: Shows progress after each task completion\n\n## Installation\n\n### Method 1: Via Marketplace (Recommended)\n\nAdd the ralph-agent marketplace to Claude Code:\n\n```bash\n/plugin marketplace add tmdgusya/roach-loop\n```\n\nThen install the plugin:\n\n```bash\n/plugin install ralph-agent@ralph-agent-marketplace\n```\n\nThe plugin will be installed globally and available in all projects.\n\n**To update to the latest version:**\n\n```bash\n/plugin update ralph-agent\n```\n\n### Method 2: Project Local\n\nCopy the plugin to your project's `.claude-plugin/` directory:\n\n```bash\ncp -r ralph-agent /path/to/your-project/.claude-plugin/\n```\n\n**Optional:** Copy `loop.py` script for external iteration control:\n\n```bash\ncp ralph-agent/ralph-agent:loop.py /path/to/your-project/\nchmod +x loop.py\n```\n\n### Method 3: Global Manual Installation\n\n```bash\ncp -r ralph-agent ~/.claude/plugins/ralph-agent:ralph-agent\n```\n\n**Optional:** Install `loop.py` globally:\n\n```bash\nsudo cp ralph-agent/ralph-agent:loop.py /usr/local/bin/ralph-agent:ralph-loop\n# Or create a symlink\nln -s ~/.claude/plugins/ralph-agent:ralph-agent/ralph-agent:loop.py ~/bin/ralph-agent:ralph-loop\n```\n\n### Method 4: Command-Line Flag\n\n```bash\ncc --plugin-dir /path/to/ralph-agent:ralph-agent\n```\n\n**Note:** The `loop.py` script requires access to the ralph-agent plugin. If using global installation, use `--plugin-dir` to specify the plugin path:\n\n```bash\n./ralph-agent:loop.py ralph 10 --plugin-dir ~/.claude/plugins/ralph-agent:ralph-agent\n```\n\n## Quick Start\n\n### Workflow A: Geoff's Iterative (Recommended for spec-driven projects)\n\n#### 1. Create Specifications Directory\n\n```bash\nmkdir specs\n```\n\n#### 2. Write Your Specs\n\nCreate specification files in `specs/`:\n\n```markdown\n# specs/user-auth.md\n\n## Feature: User Authentication\n\n### Requirements\n- Users can register with email/password\n- Users can login with JWT tokens\n- Passwords are hashed with bcrypt\n\n### Acceptance Criteria\n- POST /auth/register creates new user\n- POST /auth/login returns JWT token\n- Passwords stored as hash, not plaintext\n```\n\n#### 3. Generate Implementation Plan\n\n```bash\n/ralph-agent:gplan\n```\n\nThis analyzes your specs and creates `IMPLEMENTATION_PLAN.md`.\n\n#### 4. Build with Git Workflow\n\n```bash\n/ralph-agent:gbuild\n```\n\nGeoff's Builder will:\n- Implement each task\n- Run tests and fix failures\n- Git commit → push → tag (0.0.0, 0.0.1, ...)\n- Continue until all tasks complete\n\n### Workflow B: Ralph's Direct (For simple task lists)\n\n#### 1. Create an Implementation Plan\n\n```bash\n/ralph-agent:ralph-init\n```\n\nThis creates `IMPLEMENTATION_PLAN.md` with a template.\n\n#### 2. Edit the Plan\n\nOpen `IMPLEMENTATION_PLAN.md` and add your tasks:\n\n```markdown\n# Implementation Plan\n\n## Tasks\n- [ ] Create database models\n- [ ] Implement API endpoints\n- [ ] Write unit tests\n- [ ] Add authentication\n```\n\n#### 3. Set Up Verification\n\nCreate or edit `AGENTS.md` with verification commands:\n\n```markdown\n# Verification Commands\n- `pytest tests/`\n- `ruff check .`\n```\n\n#### 4. Start Ralph\n\n```bash\n/ralph-agent:ralph\n```\n\nRalph will work through all tasks continuously until complete.\n\n**Note:** Ralph does NOT handle git workflow. Commit manually or use `/ralph-agent:gbuild`.\n\n## Commands\n\n### `/ralph-agent:gplan` - Geoff's Planner\n\nCreate or update `IMPLEMENTATION_PLAN.md` by analyzing your `specs/` directory.\n\n**Usage:**\n```\n/ralph-agent:gplan\n```\n\nWith custom parallelism:\n```\n/ralph-agent:gplan --parallel=50\n```\n\n**What happens:**\n1. Studies all files in `specs/` directory using parallel subagents\n2. Studies existing `IMPLEMENTATION_PLAN.md` and `src/lib/*`\n3. Compares `src/*` implementation against `specs/*` requirements\n4. Uses Opus with \"Ultrathink\" for task prioritization\n5. Creates/updates `IMPLEMENTATION_PLAN.md` with prioritized tasks\n\n**Requirements:**\n- `specs/` directory must exist with specification files\n\n### `/ralph-agent:gbuild` - Geoff's Builder\n\nImplement tasks from `IMPLEMENTATION_PLAN.md` with git workflow and auto-tagging.\n\n**Usage:**\n```\n/ralph-agent:gbuild\n```\n\nWith custom parallelism:\n```\n/ralph-agent:gbuild --parallel=100\n```\n\n**What happens:**\n1. Studies `specs/*` with parallel subagents\n2. Reads `IMPLEMENTATION_PLAN.md` for task list\n3. Searches codebase (doesn't assume not implemented)\n4. Implements task completely (no placeholders)\n5. Runs tests, fixes failures until pass\n6. Git add → commit → push\n7. Creates git tag (0.0.0 → 0.0.1 → ...)\n8. Continues to next task until all complete\n\n**Requirements:**\n- `IMPLEMENTATION_PLAN.md` must exist\n- Git repository with remote configured\n\n### `/ralph-agent:ralph`\n\nStart Ralph to work through tasks in `IMPLEMENTATION_PLAN.md`.\n\n**Usage:**\n```\n/ralph-agent:ralph\n```\n\n**What happens:**\n1. Ralph reads `IMPLEMENTATION_PLAN.md`\n2. Finds the first unchecked task\n3. Implements the task\n4. Runs verification commands from `AGENTS.md`\n5. Marks task complete when verification passes\n6. Continues to the next task automatically\n\n**Note:** Ralph does NOT handle git workflow. Use `/ralph-agent:gbuild` for automatic commits/tags.\n\n### `/ralph-agent:ralph-init`\n\nCreate a new `IMPLEMENTATION_PLAN.md` template file.\n\n**Usage:**\n```\n/ralph-agent:ralph-init\n```\n\nCreates a template with:\n- Project description section\n- Prerequisites section\n- Task checklist\n- Verification section\n- Notes section\n\n### `/ralph-agent:loop` - Loop Wrapper Command\n\nExecute any agent with explicit iteration control, pause prompts, and checkpoint summaries.\n\n**Usage:**\n```\n/ralph-agent:loop ralph max=5 pause=true\n/ralph-agent:loop geoff-builder max=10 pause=true parallel=50\n/ralph-agent:loop geoff-builder max=0 pause=false\n```\n\n**Features:**\n- `max=N`: Maximum iterations (0 = unlimited)\n- `pause=true`: Prompt user after each task for review\n- `parallel=M`: Pass to geoff agents for parallelism\n\n**Best for:**\n- Interactive development (5-20 tasks with review)\n- Learning agent behavior\n- Testing workflows\n\n## Iteration Control\n\nAll agents support iteration limits for controlled execution:\n\n### Agent Flags (Simple Limit)\n\n```bash\n# Limit to 5 tasks\n/ralph-agent:ralph --max-iterations=5\n\n# Limit to 10 tasks with git workflow\n/ralph-agent:gbuild --max-iterations=10\n\n# Unlimited (default)\n/ralph-agent:gbuild\n```\n\n### `/ralph-agent:loop` Command (Full Control)\n\n```bash\n# Pause between tasks for review\n/ralph-agent:loop ralph max=5 pause=true\n\n# Continuous batch execution\n/ralph-agent:loop geoff-builder max=20 pause=false\n```\n\n### External `loop.py` Script (Production)\n\nFor long-running autonomous work that survives Claude Code session limits:\n\n**Installation:**\n\nThe `loop.py` script is included in the ralph-agent plugin. To use it:\n\n```bash\n# Option 1: Copy to your project\ncp ralph-agent/ralph-agent:loop.py ./\n\n# Option 2: Install globally\nsudo cp ralph-agent/ralph-agent:loop.py /usr/local/bin/ralph-agent:ralph-loop\n\n# Option 3: Create symlink\nln -s /path/to/ralph-agent:ralph-agent/ralph-agent:loop.py ~/bin/ralph-agent:ralph-loop\n```\n\n**Usage:**\n\n```bash\n# Ralph unlimited\n./ralph-agent:loop.py ralph\n\n# Ralph max 10 iterations\n./ralph-agent:loop.py ralph 10\n\n# Geoff Builder unlimited with custom parallelism\n./ralph-agent:loop.py gbuild 0 --parallel 100\n\n# Geoff Builder max 50 iterations\n./ralph-agent:loop.py gbuild 50\n\n# With custom plugin path\n./ralph-agent:loop.py ralph 20 --plugin-dir /path/to/ralph-agent:ralph-agent\n```\n\n**Features:**\n- Spawns NEW Claude process each iteration\n- Survives Claude Code crashes/restarts\n- Git commit between each iteration\n- True \"infinite loop\" capability\n- Best for: Production workflows, overnight builds\n\n**Comparison:**\n\n| Method | Session | Max Iterations | Best For |\n|--------|---------|---------------|----------|\n| Agent flags | Internal | Yes (`--max-iterations`) | Simple limits |\n| `/ralph-agent:loop` command | Internal | Yes + pause prompts | Interactive review |\n| `loop.py` script | External | Yes + true infinite | Production, long-running |\n\n## File Format\n\n### IMPLEMENTATION_PLAN.md\n\nUses standard markdown checklist format:\n\n```markdown\n# Implementation Plan\n\n## Description\nBrief description of plan objectives.\n\n## Prerequisites\n- [ ] Dependency 1\n- [ ] Dependency 2\n\n## Tasks\n- [ ] Task 1: First task description\n- [ ] Task 2: Second task description\n- [x] Task 3: Already completed\n\n## Verification\n- `pytest tests/`\n- `npm test`\n\n## Notes\nAdditional context or reminders.\n```\n\n### AGENTS.md\n\nContains verification commands:\n\n```markdown\n# Verification Commands\n\n## General\n- `pytest tests/` - Run all tests\n- `npm test` - Run test suite\n\n## Linting\n- `ruff check .` - Python linting\n- `eslint .` - JavaScript linting\n```\n\n## How Ralph Works\n\n```\n┌─────────────────────────────────────────────────────────────┐\n│  1. Read IMPLEMENTATION_PLAN.md                              │\n│     → Find first unchecked task (- [ ])                       │\n├─────────────────────────────────────────────────────────────┤\n│  2. Understand task requirements                              │\n│     → Read related files if needed                            │\n├─────────────────────────────────────────────────────────────┤\n│  3. Implement the task                                       │\n│     → Write/modify code                                      │\n├─────────────────────────────────────────────────────────────┤\n│  4. Verify work                                              │\n│     → Read AGENTS.md for verification commands               │\n│     → Run ALL verification commands                          │\n│     → If fail: fix code and retry                            │\n├─────────────────────────────────────────────────────────────┤\n│  5. Mark task complete                                       │\n│     → Change - [ ] to - [x] in plan                          │\n├─────────────────────────────────────────────────────────────┤\n│  6. Continue or report                                       │\n│     → More tasks? Go to step 2                               │\n│     → All done? Report completion and exit                   │\n└─────────────────────────────────────────────────────────────┘\n```\n\n## User Interaction Flow\n\nThis plugin provides two workflows for different use cases:\n\n### Workflow 1: Geoff's Iterative Planning & Building\n\nFor projects with specification files in `specs/` directory:\n\n```\n┌─────────────────────────────────────────────────────────────────────────────┐\n│                        GEOFF'S ITERATIVE WORKFLOW                            │\n├─────────────────────────────────────────────────────────────────────────────┤\n│                                                                             │\n│  ┌─────────────┐      ┌─────────────┐      ┌─────────────────────────┐    │\n│  │   specs/    │─────▶│    /ralph-agent:gplan   │─────▶│ IMPLEMENTATION_PLAN.md │    │\n│  │  directory  │      │  (planner)  │      │   (prioritized tasks)   │    │\n│  └─────────────┘      └─────────────┘      └───────────┬─────────────┘    │\n│         │                                            │ review?             │\n│         │           ┌─────────────┐                  │                     │\n│         │           │  Edit plan  │◀─────────────────┘                     │\n│         │           │  (optional) │                                       │\n│         │           └──────┬──────┘                                       │\n│         │                  │                                              │\n│         │                  ▼                                              │\n│         │           ┌─────────────┐      ┌─────────────────────────┐    │\n│         │           │   /ralph-agent:gbuild   │─────▶│  Git commits + tags     │    │\n│         └──────────▶│  (builder)  │      │  (0.0.0 → 0.0.1 → ...)  │    │\n│                     └─────────────┘      └───────────┬─────────────┘    │\n│                                                           │               │\n│  Specs change? ──────────────────────────────────────────┘               │\n│       │                                                                   │\n│       ▼                                                                   │\n│   Re-run /ralph-agent:gplan                                                           │\n│   (updates plan with gaps)                                                │\n│                                                                             │\n└─────────────────────────────────────────────────────────────────────────────┘\n\nKey Features:\n• Parallel analysis of specs/ and src/ (configurable with --parallel=N)\n• Auto-generates IMPLEMENTATION_PLAN.md from specifications\n• Git workflow: commit → push → auto-tag (each task = new version)\n• Continuous: repeats until all tasks complete\n• Iteration control: --max-iterations=N, /ralph-agent:loop command, or loop.py script\n```\n\n### Workflow 2: Ralph's Direct Execution\n\nFor projects with manual or existing implementation plans:\n\n```\n┌─────────────────────────────────────────────────────────────────────────────┐\n│                          RALPH'S DIRECT WORKFLOW                            │\n├─────────────────────────────────────────────────────────────────────────────┤\n│                                                                             │\n│  ┌─────────────────┐      ┌─────────────┐      ┌───────────────────────┐  │\n│  │ Manual plan OR  │─────▶│ /ralph-agent:ralph-init │─────▶│ IMPLEMENTATION_PLAN.md│  │\n│  │ /ralph-agent:ralph-init     │      │ (optional)  │      │  (you create tasks)   │  │\n│  └─────────────────┘      └─────────────┘      └───────────┬───────────┘  │\n│                                                     │                     │\n│                              ┌─────────────┐        │                     │\n│                              │   Edit plan │◀───────┘                     │\n│                              │  (required) │                              │\n│                              └──────┬──────┘                              │\n│                                     │                                      │\n│                              ┌──────▼──────┐                              │\n│                              │   /ralph-agent:ralph    │                              │\n│                              │  (executor) │                              │\n│                              └──────┬──────┘                              │\n│                                     │                                      │\n│                              ┌──────▼──────┐                              │\n│                              │ Tasks done  │                              │\n│                              │  one by one│                              │\n│                              └─────────────┘                              │\n│                                                                             │\n└─────────────────────────────────────────────────────────────────────────────┘\n\nKey Features:\n• Simple: create plan → run /ralph-agent:ralph\n• No git workflow (you handle commits)\n• No specs/ directory required\n• Continuous: repeats until all tasks complete\n• Iteration control: --max-iterations=N, /ralph-agent:loop command, or loop.py script\n```\n\n### Choosing Your Workflow\n\n| Use Case | Recommended Workflow | Commands |\n|----------|---------------------|----------|\n| I have `specs/` with feature specifications | Geoff's Iterative | `/ralph-agent:gplan` → `/ralph-agent:gbuild` |\n| I want automatic git commits + version tags | Geoff's Iterative | `/ralph-agent:gplan` → `/ralph-agent:gbuild` |\n| I have a simple task list | Ralph's Direct | `/ralph-agent:ralph-init` → `/ralph-agent:ralph` |\n| I manage my own git workflow | Ralph's Direct | `/ralph-agent:ralph` |\n| I need to update plan after spec changes | Geoff's Iterative | `/ralph-agent:gplan` (re-run) |\n\n### Comparison\n\n| Feature | Geoff's Workflow | Ralph's Workflow |\n|---------|------------------|------------------|\n| Specs required | Yes (`specs/` directory) | No |\n| Git workflow | Automatic (commit/push/tag) | Manual |\n| Planning | Automatic from specs | Manual |\n| Version tags | Yes (0.0.0, 0.0.1, ...) | No |\n| Parallel analysis | Yes (configurable) | No |\n| Iteration control | `--max-iterations`, `/ralph-agent:loop`, `loop.py` | `--max-iterations`, `/ralph-agent:loop`, `loop.py` |\n| Best for | Spec-driven projects | Quick task lists |\n\n## Stopping Ralph\n\nTo stop Ralph while it's working:\n\n```\nstop\n```\n\nOr:\n```\ncancel\n```\n\nRalph will:\n- Complete the current task (if in progress)\n- Save current state in `IMPLEMENTATION_PLAN.md`\n- Report how many tasks remain\n\n## Requirements\n\n- **IMPLEMENTATION_PLAN.md**: Must exist in the current directory\n- **AGENTS.md**: Should contain verification commands (optional but recommended)\n\n## Example Workflow\n\n```bash\n# Create initial plan\n/ralph-agent:ralph-init\n\n# Edit the plan with your tasks\n# Edit AGENTS.md with verification commands\n\n# Start Ralph\n/ralph-agent:ralph\n\n# Ralph output:\n✓ Task completed: Task 1: Create database models\n  - Files modified: models.py\n  - Verification: PASSED\n  - Next task: Task 2: Implement API endpoints\n\n✓ Task completed: Task 2: Implement API endpoints\n  - Files modified: api.py\n  - Verification: PASSED\n  - Next task: Task 3: Write unit tests\n\n╔══════════════════════════════════════════╗\n║   ALL TASKS COMPLETED SUCCESSFULLY ✓    ║\n╚══════════════════════════════════════════╝\n\nSummary:\n- Total tasks: 3\n- Completed: 3\n- Verification: All passed\n```\n\n## Components\n\n### Agents\n\n#### `ralph`\nCore executor agent that implements tasks from `IMPLEMENTATION_PLAN.md` sequentially.\n\n#### `geoff-planner`\nPlanning agent that analyzes `specs/` directory and codebase to create/update `IMPLEMENTATION_PLAN.md` with prioritized tasks.\n\n#### `geoff-builder`\nImplementation agent that executes tasks with git workflow (add/commit/push/tag) and continuous verification.\n\n### Commands\n\n#### `/ralph-agent:ralph`\nStart Ralph to execute tasks sequentially without git workflow.\n\n#### `/ralph-agent:ralph-init`\nCreate an empty `IMPLEMENTATION_PLAN.md` template file.\n\n#### `/ralph-agent:gplan`\nTrigger Geoff's Planner to analyze specs and generate/update implementation plan.\n\n#### `/ralph-agent:gbuild`\nTrigger Geoff's Builder to implement tasks with full git workflow and auto-tagging.\n\n### Skill: `implementation-plan`\nProvides knowledge about:\n- Parsing markdown checklists\n- Reading verification commands\n- Updating task completion status\n- Continuous execution patterns\n\n## Plugin Structure\n\n```\nralph-agent/\n├── .claude-plugin/\n│   └── plugin.json          # Plugin manifest\n├── agents/\n│   ├── ralph.md             # Ralph executor agent\n│   ├── geoff-planner.md     # Geoff's Planner agent\n│   └── geoff-builder.md     # Geoff's Builder agent\n├── commands/\n│   ├── ralph.md             # /ralph-agent:ralph command\n│   ├── ralph-init.md        # /ralph-agent:ralph-init command\n│   ├── gplan.md             # /ralph-agent:gplan command\n│   ├── gbuild.md            # /ralph-agent:gbuild command\n│   └── loop.md              # /ralph-agent:loop wrapper command\n├── skills/\n│   └── implementation-plan/\n│       ├── SKILL.md         # Main skill file\n│       ├── references/      # Detailed references\n│       │   ├── task-examples.md\n│       │   └── verification-patterns.md\n│       ├── examples/        # Working examples\n│       │   ├── IMPLEMENTATION_PLAN.md.template\n│       │   └── AGENTS.md.example\n│       └── scripts/         # Utility scripts\n│           └── parse-tasks.sh\n├── loop.py                  # External loop controller script\n├── README.md\n└── .gitignore\n```\n\n## Best Practices\n\n### Writing Tasks\n- Be specific: \"Add JWT authentication\" instead of \"Work on auth\"\n- Keep tasks independent: Each task should be completable separately\n- Make tasks verifiable: Include acceptance criteria\n- Reasonable scope: Tasks should take 30 minutes to 2 hours\n\n### Verification Commands\n- Order by speed: Fast checks first (linting) then slow (tests)\n- Be specific: Use paths to test only affected code when possible\n- Include all checks: Linting, type checking, and tests\n- Use AGENTS.md: Keep verification commands out of the plan file\n\n### Using Ralph\n- Let it run: Ralph works best when allowed to complete multiple tasks\n- Check progress: Ralph reports after each task\n- Stop gracefully: Use \"stop\" to halt between tasks\n- Verify before commit: All verification commands pass automatically\n\n## Troubleshooting\n\n### \"No IMPLEMENTATION_PLAN.md found\"\nRun `/ralph-agent:ralph-init` to create a template plan file.\n\n### \"No verification commands found\"\nCreate `AGENTS.md` with verification commands.\n\n### Verification keeps failing\nRalph will automatically fix and retry. If it fails repeatedly, Ralph will ask for guidance.\n\n### Ralph stopped unexpectedly\nRalph saves progress after each task. Just run `/ralph-agent:ralph` again to continue.\n\n## Publishing & Distribution\n\nThis plugin is distributed via the Claude Code marketplace system from the [roach-loop repository](https://github.com/tmdgusya/roach-loop).\n\n### For Users - Quick Start\n\n**Install the plugin in 2 commands:**\n\n```bash\n# 1. Add the marketplace\n/plugin marketplace add tmdgusya/roach-loop\n\n# 2. Install the plugin\n/plugin install ralph-agent@ralph-agent-marketplace\n```\n\n**Update to latest version:**\n\n```bash\n/plugin update ralph-agent\n```\n\n**Verify installation:**\n\n```bash\n/plugin list\n```\n\nYou should see `ralph-agent` in the installed plugins list.\n\n### For Plugin Developers\n\nTo publish updates to this plugin:\n\n1. **Update version** in both files:\n   - `ralph-agent/.claude-plugin/plugin.json` (line 3)\n   - `.claude-plugin/marketplace.json` at repository root (line 11)\n\n2. **Commit and push changes**:\n   ```bash\n   git add .\n   git commit -m \"Release v0.4.0: Add new features\"\n   git push origin main\n   ```\n\n3. **Create a release tag** (recommended):\n   ```bash\n   git tag v0.4.0\n   git push origin v0.4.0\n   ```\n\n4. **Users update automatically**:\n   Users who have added your marketplace can update with:\n   ```bash\n   /plugin update ralph-agent\n   ```\n\n### Repository Structure\n\n```\nroach-loop/                              # GitHub repository root\n├── .claude-plugin/\n│   └── marketplace.json                 # Marketplace catalog (source: ./ralph-agent:ralph-agent)\n├── ralph-agent/                         # Plugin directory\n│   ├── .claude-plugin/\n│   │   ├── plugin.json                  # Plugin manifest\n│   │   └── marketplace.json             # (backup/reference)\n│   ├── agents/                          # ralph, geoff-planner, geoff-builder\n│   ├── commands/                        # /ralph-agent:ralph, /ralph-agent:gplan, /ralph-agent:gbuild, etc.\n│   ├── skills/                          # implementation-plan skill\n│   ├── loop.py                          # External loop controller\n│   └── README.md                        # This file\n└── ...\n```\n\n### Marketplace System\n\nClaude Code uses a **decentralized marketplace model**:\n\n| Traditional App Store | Claude Code Marketplace |\n|----------------------|------------------------|\n| ❌ Submit to centralized authority | ✅ Host on your own GitHub |\n| ❌ Wait for approval | ✅ Instant distribution |\n| ❌ Follow store policies | ✅ Full control over updates |\n| ❌ Revenue sharing | ✅ Free and open |\n\n**How it works:**\n1. **Plugin author** creates `marketplace.json` in their GitHub repo\n2. **Users** add the marketplace: `/plugin marketplace add tmdgusya/roach-loop`\n3. **Claude Code** fetches plugin from GitHub when user installs\n4. **Updates** are pulled from GitHub when user runs `/plugin update`\n\n**Advantages:**\n- ✅ No gatekeepers - publish instantly\n- ✅ Version control via Git\n- ✅ Users choose which marketplaces to trust\n- ✅ Open source and transparent\n- ✅ No lock-in to Anthropic's marketplace\n\n### Distribution URLs\n\n**Primary distribution (Recommended):**\n```bash\n/plugin marketplace add tmdgusya/roach-loop\n/plugin install ralph-agent@ralph-agent-marketplace\n```\n\n**Alternative - Direct Git URL:**\n```bash\n/plugin install https://github.com/tmdgusya/roach-loop.git --subdirectory ralph-agent\n```\n\n**Alternative - Clone and install locally:**\n```bash\ngit clone https://github.com/tmdgusya/roach-loop.git\n/plugin install ./roach-loop/ralph-agent:ralph-agent\n```\n\n## License\n\nMIT\n\n## Contributing\n\nContributions welcome! Please feel free to submit issues or pull requests.\n"
      },
      "plugins": [
        {
          "name": "ralph-agent",
          "source": "./ralph-agent",
          "description": "Implementation agents with planning, building, and loop control workflows using IMPLEMENTATION_PLAN.md with continuous task execution, verification, git workflow, and iteration limits",
          "version": "0.5.0",
          "author": {
            "name": "tmdgusya"
          },
          "keywords": [
            "automation",
            "implementation",
            "task-runner",
            "verification",
            "planning",
            "git-workflow",
            "iteration-control",
            "loop"
          ],
          "homepage": "https://github.com/tmdgusya/roach-loop",
          "repository": "https://github.com/tmdgusya/roach-loop.git",
          "license": "MIT",
          "strict": false,
          "categories": [
            "automation",
            "git-workflow",
            "implementation",
            "iteration-control",
            "loop",
            "planning",
            "task-runner",
            "verification"
          ],
          "install_commands": [
            "/plugin marketplace add tmdgusya/roach-loop",
            "/plugin install ralph-agent@ralph-agent-marketplace"
          ]
        }
      ]
    }
  ]
}