{
  "author": {
    "id": "tolgaio",
    "display_name": "Tolga Akyuz",
    "avatar_url": "https://avatars.githubusercontent.com/u/892891?u=7ad61d00bd24f41255684a8545cdfd61cf80b5e5&v=4"
  },
  "marketplaces": [
    {
      "name": "mindwork",
      "version": null,
      "description": "Therapy session analysis and personal journaling toolkit for Claude Code",
      "repo_full_name": "tolgaio/mindwork",
      "repo_url": "https://github.com/tolgaio/mindwork",
      "repo_description": "A Claude Code plugin for therapy session analysis and personal journaling",
      "signals": {
        "stars": 0,
        "forks": 1,
        "pushed_at": "2025-12-28T16:26:40Z"
      },
      "files": {
        ".claude-plugin/marketplace.json": "{\n  \"name\": \"mindwork\",\n  \"owner\": {\n    \"name\": \"Tolga\"\n  },\n  \"metadata\": {\n    \"description\": \"Therapy session analysis and personal journaling toolkit for Claude Code\",\n    \"version\": \"1.0.0\"\n  },\n  \"plugins\": [\n    {\n      \"name\": \"mindwork\",\n      \"source\": \"./\",\n      \"description\": \"Transcribe recordings, extract patterns, track progress, and gain insights from therapy sessions and journals\",\n      \"version\": \"1.0.0\",\n      \"author\": {\n        \"name\": \"Tolga\"\n      },\n      \"homepage\": \"https://github.com/tolgaio/mindwork\",\n      \"repository\": \"https://github.com/tolgaio/mindwork\",\n      \"license\": \"MIT\",\n      \"keywords\": [\"therapy\", \"journaling\", \"mental-health\", \"transcription\", \"analysis\", \"self-reflection\"],\n      \"category\": \"productivity\"\n    }\n  ]\n}\n",
        ".claude-plugin/plugin.json": "{\n  \"name\": \"mindwork\",\n  \"description\": \"Therapy session analysis and personal journaling toolkit. Transcribe recordings, extract patterns, track progress, and gain insights from your mental wellness journey.\",\n  \"version\": \"1.0.0\",\n  \"author\": {\n    \"name\": \"Tolga\"\n  },\n  \"homepage\": \"https://github.com/tolgaio/mindwork\",\n  \"repository\": \"https://github.com/tolgaio/mindwork\",\n  \"license\": \"MIT\",\n  \"keywords\": [\"therapy\", \"journaling\", \"mental-health\", \"transcription\", \"analysis\", \"self-reflection\"]\n}\n",
        "README.md": "# Mindwork\n\nA Claude Code plugin for therapy session analysis and personal journaling. Transcribe recordings, extract patterns, track progress, and gain insights from your mental wellness journey.\n\n```\n┌─────────────────────────────────────────────────────────────────────────────┐\n│                              MINDWORK                                       │\n│         Your AI-powered companion for therapy and self-reflection          │\n├─────────────────────────────────────────────────────────────────────────────┤\n│                                                                             │\n│   Audio Recording ───► transcribe ───► Transcript                          │\n│                                              │                              │\n│   Journal Entry ─────────────────────────────┤                              │\n│                                              ▼                              │\n│                                         ┌─────────┐                         │\n│                                         │ analyze │                         │\n│                                         └────┬────┘                         │\n│                                              │                              │\n│                    ┌─────────────────────────┼─────────────────────────┐    │\n│                    │                         │                         │    │\n│                    ▼                         ▼                         ▼    │\n│              ┌──────────┐             ┌──────────┐             ┌─────────┐  │\n│              │ progress │             │ insights │             │ summary │  │\n│              │  (how    │             │  (who    │             │ (what   │  │\n│              │  things  │             │  you     │             │ happened│  │\n│              │  change) │             │  are)    │             │ quickly)│  │\n│              └──────────┘             └──────────┘             └─────────┘  │\n│                                                                             │\n└─────────────────────────────────────────────────────────────────────────────┘\n```\n\n## How It Works\n\nMindwork is a suite of 5 interconnected skills that help you understand your therapy journey:\n\n### The Pipeline\n\n1. **Input**: You provide therapy session recordings or journal entries\n2. **Transcribe**: Audio files are converted to clean, formatted text\n3. **Analyze**: Each session/entry is analyzed for patterns, themes, and insights\n4. **Build Knowledge**: Over time, the system tracks your progress, builds your profile, and provides summaries\n\n### What Each Skill Does\n\n| Skill | Question It Answers | Input | Output |\n|-------|---------------------|-------|--------|\n| `transcribe` | \"What was said?\" | Audio file | Formatted transcript |\n| `analyze` | \"What patterns are in this session?\" | Transcript/journal | Detailed analysis |\n| `progress` | \"How am I changing over time?\" | Multiple analyses | Trend reports |\n| `insights` | \"Who am I? What are my patterns?\" | All analyses | Living profile |\n| `summary` | \"What happened, quickly?\" | Any content | Condensed summary |\n\n### Data Flow\n\n```\nYour Vault/\n├── recordings/           ◄── You add audio files here\n│   └── session-001.m4a\n│\n├── journals/             ◄── You write journal entries here\n│   └── 2024-01-15.md\n│\n├── transcriptions/       ◄── transcribe skill outputs here\n│   └── 2024-01-15-session-001.md\n│\n├── analysis/             ◄── analyze skill outputs here\n│   └── 2024-01-15-session-001-analysis.md\n│\n├── progress/             ◄── progress skill outputs here\n│   └── 2024-01-weekly-report.md\n│\n├── profile.md            ◄── insights skill maintains this\n├── goals.md              ◄── You define therapy goals here\n└── mindwork.yaml         ◄── Configuration file\n```\n\n---\n\n## Example Queries\n\n### Getting Started\n```\n\"Transcribe my therapy session recording session-001.m4a\"\n\"Analyze today's journal entry\"\n\"Build my profile from all analyses\"\n```\n\n### After a Session\n```\n\"Transcribe and analyze my latest session\"\n\"Give me a one-liner summary of today's session\"\n\"What action items came out of this session?\"\n```\n\n### Weekly Check-in\n```\n\"Generate my weekly progress report\"\n\"What patterns showed up this week?\"\n\"Update my profile with this week's sessions\"\n```\n\n### Monthly Review\n```\n\"Compare my sessions from January vs March\"\n\"Show me my highlights from this month\"\n\"How has my catastrophizing changed over time?\"\n```\n\n### Before Your Next Session\n```\n\"Prep me for my session tomorrow\"\n\"Summarize what to tell my therapist since last time\"\n\"What were my action items and did I complete them?\"\n```\n\n### Understanding Yourself\n```\n\"What does my profile say about my triggers?\"\n\"What coping strategies work best for me?\"\n\"What are my core patterns?\"\n```\n\n### Sharing with Others\n```\n\"Summarize today's session for my partner\"\n\"Create an update for my therapist about the past week\"\n\"What can I share about my progress with my support system?\"\n```\n\n### Goal Tracking\n```\n\"How am I progressing on my goals?\"\n\"Have I made progress on reducing anxiety?\"\n\"What evidence is there that I'm improving at boundary-setting?\"\n```\n\n---\n\n## Installation\n\n### Option 1: Claude Code Marketplace (Recommended)\n\nAdd the marketplace and install the plugin:\n\n```bash\n/plugin marketplace add tolgaio/mindwork\n/plugin install mindwork@mindwork\n```\n\nOr install directly via command line:\n\n```bash\nclaude plugin marketplace add tolgaio/mindwork\nclaude plugin install mindwork@mindwork\n```\n\n### Option 2: Clone and Add to Settings\n\n```bash\ngit clone https://github.com/tolgaio/mindwork.git ~/src/mindwork\n```\n\nAdd to `~/.claude/settings.json`:\n```json\n{\n  \"plugins\": [\"~/src/mindwork\"]\n}\n```\n\n### Option 3: Use Directly\n\n```bash\nclaude --plugin-dir ~/src/mindwork\n```\n\n## Setup\n\nBuild the Docker image for the transcription tool:\n\n```bash\ncd ~/src/mindwork/transcribe\ndocker build -t mindwork-transcribe .\n```\n\nSet your OpenAI API key (for transcription only):\n```bash\nexport OPENAI_API_KEY=\"sk-...\"\n```\n\n## Configuration\n\nCreate a `mindwork.yaml` file in your vault directory:\n\n```yaml\nvault: ~/Therapy\n\nsources:\n  recordings:\n    paths: [recordings/]\n  journals:\n    paths: [journals/]\n\noutputs:\n  transcriptions: transcriptions/\n  analysis: analysis/\n  progress: progress/\n```\n\nSee `config/mindwork.example.yaml` for all options.\n\n**Config locations** (checked in order):\n1. `./mindwork.yaml` (your vault directory)\n2. `~/.config/mindwork/config.yaml`\n3. `~/.mindwork.yaml`\n\n---\n\n## Skills Reference\n\n### transcribe\n\nConverts therapy session recordings into clean, formatted transcripts.\n\n```\n┌──────────────────────────────────────────────────────────────┐\n│  Audio File  ───►  Chunk at Silence  ───►  Whisper API      │\n│                                                ▼             │\n│                         Formatted Transcript ◄───  GPT-4o   │\n│                         (Me: / Therapist:)       (cleanup)  │\n└──────────────────────────────────────────────────────────────┘\n```\n\n**Example queries:**\n- `\"Transcribe my therapy session recording session-001.m4a\"`\n- `\"Transcribe the audio in recordings/\"`\n\n**Features:**\n- Splits large audio at silence points (sentence boundaries)\n- Transcribes using OpenAI Whisper API\n- Formats as **Me:** / **Therapist:** dialogue\n- Fixes grammar and transcription errors\n- Translates to English (for non-English sessions)\n\n**Supported formats:** mp3, mp4, m4a, wav, webm, ogg, flac\n\n**Cost:** ~$0.30-0.50 per 50-minute session\n\n---\n\n### analyze\n\nDeep analysis of a single session or journal entry.\n\n```\n┌──────────────────────────────────────────────────────────────┐\n│  Transcript/Journal                                          │\n│         │                                                    │\n│         ▼                                                    │\n│  ┌─────────────────────────────────────────────────────────┐ │\n│  │ • Cognitive Patterns (catastrophizing, all-or-nothing) │ │\n│  │ • Emotional Themes (anxiety, triggers, relief)         │ │\n│  │ • Key Insights (realizations, connections)             │ │\n│  │ • Progress Notes (compared to recent sessions)         │ │\n│  │ • Suggested Focus Areas                                │ │\n│  └─────────────────────────────────────────────────────────┘ │\n│         │                                                    │\n│         ▼                                                    │\n│  analysis/2024-01-15-session-analysis.md                     │\n└──────────────────────────────────────────────────────────────┘\n```\n\n**Example queries:**\n- `\"Analyze my therapy session from transcriptions/2024-01-15-session.md\"`\n- `\"Analyze today's journal entry\"`\n- `\"What patterns do you see in this session?\"`\n\n**Cognitive patterns detected:**\n- All-or-nothing thinking\n- Catastrophizing\n- Mind reading\n- Fortune telling\n- Emotional reasoning\n- Should statements\n- Labeling\n- Personalization\n- And more...\n\n---\n\n### progress\n\nTrack changes over time, compare sessions, measure goal progress.\n\n```\n┌──────────────────────────────────────────────────────────────┐\n│                     PROGRESS MODES                           │\n├──────────────────────────────────────────────────────────────┤\n│                                                              │\n│  Trend Tracking        Session Comparison      Goal Progress │\n│  ───────────────       ──────────────────      ───────────── │\n│  Pattern frequency     Side-by-side diff       Evidence of   │\n│  over time             highlighting changes    progress       │\n│                                                              │\n│  Period Summaries                                            │\n│  ────────────────                                            │\n│  Weekly, monthly, quarterly reports                          │\n│                                                              │\n└──────────────────────────────────────────────────────────────┘\n```\n\n**Example queries:**\n- `\"Generate my weekly progress report\"`\n- `\"Compare my first session with my most recent one\"`\n- `\"How has my catastrophizing changed over the past month?\"`\n- `\"How am I progressing on my goals?\"`\n\n**Goal tracking:** Create a `goals.md` file to define therapy goals. See `config/goals.example.md`.\n\n---\n\n### insights\n\nBuild and maintain a personal profile - a living document of self-knowledge.\n\n```\n┌──────────────────────────────────────────────────────────────┐\n│                      profile.md                              │\n│            (Updated incrementally over time)                 │\n├──────────────────────────────────────────────────────────────┤\n│                                                              │\n│  Core Patterns           │  Strengths                       │\n│  ─────────────           │  ─────────                       │\n│  • Thinking patterns     │  • Self-reflection capacity      │\n│  • Emotional patterns    │  • Emotional vocabulary          │\n│  • Triggers              │  • Growth commitment             │\n│                          │                                   │\n│  Coping Strategies       │  Growth Journey                  │\n│  ─────────────────       │  ──────────────                  │\n│  • What works for you    │  • Major realizations            │\n│  • Techniques tried      │  • Skills developing             │\n│                          │                                   │\n│  Relationship Dynamics   │  Focus Areas                     │\n│  ─────────────────────   │  ───────────                     │\n│  • With authority        │  • Current therapeutic work      │\n│  • With peers            │                                   │\n│  • With self             │                                   │\n│                                                              │\n└──────────────────────────────────────────────────────────────┘\n```\n\n**Example queries:**\n- `\"Build my profile from all analyses\"`\n- `\"Update my profile with recent sessions\"`\n- `\"What does my profile say about my triggers?\"`\n- `\"What are my strengths according to my profile?\"`\n\n**Unique behavior:** Updates a single `profile.md` file rather than creating new files. Your profile grows richer over time.\n\n---\n\n### summary\n\nCondense content for quick reference, different audiences, and session prep.\n\n```\n┌──────────────────────────────────────────────────────────────┐\n│                      SUMMARY MODES                           │\n├──────────────────────────────────────────────────────────────┤\n│                                                              │\n│  LENGTH OPTIONS          AUDIENCE OPTIONS                    │\n│  ──────────────          ────────────────                    │\n│  • One-liner             • For self (full detail)           │\n│  • Paragraph             • For therapist (update format)    │\n│  • Full page             • For sharing (non-clinical)       │\n│                                                              │\n│  SPECIAL MODES                                               │\n│  ─────────────                                               │\n│  • Action items (homework, next steps)                       │\n│  • Highlights (breakthroughs, key quotes)                    │\n│  • Session prep (recap + topics for next session)            │\n│                                                              │\n└──────────────────────────────────────────────────────────────┘\n```\n\n**Example queries:**\n- `\"Give me a one-liner for today's session\"`\n- `\"Summarize this for my partner\"`\n- `\"What are my action items from recent sessions?\"`\n- `\"Prep me for my session tomorrow\"`\n- `\"Show me highlights from this month\"`\n\n---\n\n## Typical Workflows\n\n### New User: First Session\n\n```\n1. \"Transcribe my first therapy session recording\"\n   → Creates: transcriptions/2024-01-15-session-001.md\n\n2. \"Analyze this session\"\n   → Creates: analysis/2024-01-15-session-001-analysis.md\n\n3. \"Build my initial profile\"\n   → Creates: profile.md\n\n4. \"What are my main patterns so far?\"\n   → Claude summarizes from the analysis\n```\n\n### Weekly Routine\n\n```\nMonday:    \"Analyze my journal entry from yesterday\"\nWednesday: \"Transcribe and analyze yesterday's session\"\nFriday:    \"Generate my weekly progress report\"\n           \"Update my profile with this week's insights\"\n```\n\n### Before Therapy Session\n\n```\n\"Prep me for my session tomorrow\"\n→ Shows: Last session recap, journal highlights, suggested topics\n\n\"What action items did I have from last time?\"\n→ Shows: Checklist of homework and whether completed\n\n\"Create an update for my therapist\"\n→ Shows: What happened since last session, what worked, questions\n```\n\n### Monthly Review\n\n```\n\"Monthly summary of my therapy progress\"\n\"Compare this month to last month\"\n\"How are my goals progressing?\"\n\"Show me my breakthroughs from this month\"\n```\n\n---\n\n## All Skills\n\n| Skill | Purpose | Key Differentiator |\n|-------|---------|-------------------|\n| `transcribe` | Audio → Text | Uses Docker + Whisper API |\n| `analyze` | Deep pattern analysis | Per-session cognitive/emotional mapping |\n| `progress` | Track changes over time | Trends, comparisons, goal tracking |\n| `insights` | Build personal profile | Living document that evolves |\n| `summary` | Quick condensed reference | Multiple lengths and audiences |\n\n---\n\n## Privacy Note\n\nThis tool processes sensitive personal data:\n\n- **Transcription**: Audio chunking happens locally; transcription via OpenAI's Whisper API\n- **Analysis/Progress/Insights/Summary**: Performed by Claude directly (no additional API calls beyond your Claude Code session)\n\nNo data is stored by this plugin. Your files stay in your vault.\n\nReview OpenAI's data usage policies for their API and Anthropic's policies for Claude.\n\n---\n\n## Requirements\n\n- Docker (for transcription)\n- OpenAI API key (for transcription only)\n- Claude Code CLI\n\n---\n\n## License\n\nMIT\n"
      },
      "plugins": [
        {
          "name": "mindwork",
          "source": "./",
          "description": "Transcribe recordings, extract patterns, track progress, and gain insights from therapy sessions and journals",
          "version": "1.0.0",
          "author": {
            "name": "Tolga"
          },
          "homepage": "https://github.com/tolgaio/mindwork",
          "repository": "https://github.com/tolgaio/mindwork",
          "license": "MIT",
          "keywords": [
            "therapy",
            "journaling",
            "mental-health",
            "transcription",
            "analysis",
            "self-reflection"
          ],
          "category": "productivity",
          "categories": [
            "analysis",
            "journaling",
            "mental-health",
            "productivity",
            "self-reflection",
            "therapy",
            "transcription"
          ],
          "install_commands": [
            "/plugin marketplace add tolgaio/mindwork",
            "/plugin install mindwork@mindwork"
          ]
        }
      ]
    }
  ]
}