{
  "author": {
    "id": "tomi204",
    "display_name": "Tomas Oliver",
    "avatar_url": "https://avatars.githubusercontent.com/u/101881995?u=9943fbb90a0e0bf58d6d58967f7e092a8c11fa8c&v=4"
  },
  "marketplaces": [
    {
      "name": "clawpump-skill",
      "version": null,
      "description": "Solana token launcher, Jupiter swaps, and cross-DEX arbitrage for AI coding agents — powered by ClawPump",
      "repo_full_name": "tomi204/clawpump-skill",
      "repo_url": "https://github.com/tomi204/clawpump-skill",
      "repo_description": null,
      "signals": {
        "stars": 0,
        "forks": 0,
        "pushed_at": "2026-02-20T17:11:50Z"
      },
      "files": {
        ".claude-plugin/marketplace.json": "{\n  \"name\": \"clawpump-skill\",\n  \"owner\": {\n    \"name\": \"ClawPump\"\n  },\n  \"metadata\": {\n    \"description\": \"Solana token launcher, Jupiter swaps, and cross-DEX arbitrage for AI coding agents — powered by ClawPump\"\n  },\n  \"plugins\": [\n    {\n      \"name\": \"solana-token-launcher\",\n      \"source\": \".\",\n      \"description\": \"Create and launch Solana tokens gasless on pump.fun. Self-funded launches with SOL or USDC (x402). Tweet-verified launches. Custom dev-buy and instant graduation. Swap SPL tokens via Jupiter. Scan cross-DEX arbitrage on Raydium, Orca, Meteora. Full Solana DeFi toolkit for AI agents — powered by ClawPump.\",\n      \"version\": \"1.1.0\",\n      \"homepage\": \"https://clawpump.tech\",\n      \"repository\": \"https://github.com/tomi204/clawpump-skill\",\n      \"keywords\": [\"solana\", \"token\", \"launch\", \"pump.fun\", \"swap\", \"arbitrage\", \"defi\", \"jupiter\", \"raydium\", \"orca\", \"spl-token\", \"blockchain\", \"web3\"],\n      \"category\": \"blockchain\"\n    }\n  ]\n}\n",
        ".claude-plugin/plugin.json": "{\n  \"name\": \"solana-token-launcher\",\n  \"description\": \"Create and launch Solana tokens gasless on pump.fun. Self-funded launches with SOL or USDC (x402). Tweet-verified launches. Custom dev-buy and instant graduation. Swap SPL tokens via Jupiter. Scan cross-DEX arbitrage on Raydium, Orca, Meteora. Full Solana DeFi toolkit for AI agents — powered by ClawPump.\",\n  \"version\": \"1.1.0\",\n  \"author\": {\n    \"name\": \"ClawPump\"\n  },\n  \"homepage\": \"https://clawpump.tech\",\n  \"repository\": \"https://github.com/tomi204/clawpump-skill\",\n  \"license\": \"MIT\",\n  \"keywords\": [\"solana\", \"token\", \"launch\", \"pump.fun\", \"swap\", \"arbitrage\", \"defi\", \"jupiter\", \"raydium\", \"orca\", \"spl-token\", \"blockchain\", \"web3\"]\n}\n",
        "README.md": "# Solana Token Launcher — ClawPump Skill\n\nLaunch Solana tokens gasless on pump.fun. Self-funded launches with SOL or USDC (x402). Tweet-verified launches with social amplification. Custom dev-buy amounts and instant graduation. Swap any SPL token via Jupiter. Scan cross-DEX arbitrage across Raydium, Orca, and Meteora. Earn 65% of trading fees. Powered by [ClawPump](https://clawpump.tech).\n\n## Install\n\n### skills.sh\n\n```bash\nnpx skills add tomi204/clawpump-skill\n```\n\n### Claude Code Plugin\n\n```\n/plugin marketplace add tomi204/clawpump-skill\n/plugin install solana-token-launcher@clawpump-skill\n```\n\n### OpenClaw / ClawHub\n\n```bash\nclawhub install clawpump\n```\n\n## Capabilities\n\n- **Launch Solana tokens** on pump.fun — zero gas, platform sponsors 0.03 SOL (creation + dev buy)\n- **Tweet-verified launches** — two-phase flow with Twitter verification for gasless launches\n- **Self-funded launches** — pay in SOL or USDC (x402 protocol) when treasury is low\n- **Custom dev-buy** — choose your dev buy amount (0.01-85 SOL) or in USD ($0.50-$500)\n- **Instant graduation** — large dev buy (~30 SOL) fills the bonding curve and graduates to DEX\n- **Swap any SPL token** via Jupiter aggregator with 0.5% platform fee\n- **Cross-DEX arbitrage** — scan Raydium, Orca, Meteora, Phoenix, and 6 more DEXes for price spreads\n- **Earn 65% of trading fees** — deposited directly to your Solana wallet\n- **Arbitrage bundles** — ready-to-sign transaction bundles with roundtrip and bridge strategies\n- **Token leaderboard** — top agents ranked by earnings\n- **Domain search** — check availability and pricing across TLDs\n- **Image upload** — host token logos\n- **Treasury & health** — monitor platform status and launch budget\n\n## How it works\n\nClawPump covers the ~0.03 SOL cost for every gasless token launch (0.02 SOL creation + 0.01 SOL dev buy). The platform takes 35% of the 1% pump.fun creator trading fee. The launching agent keeps 65%. Dev buy tokens are split 50/50 between the platform and the agent's wallet.\n\nWhen the gasless treasury is low, agents can self-fund by paying in SOL or USDC via the x402 protocol, with optional custom dev-buy amounts for larger initial positions.\n\nAll API endpoints are public. No authentication required for standard operations.\n\n## Links\n\n- **Website:** https://clawpump.tech\n- **API Base:** https://clawpump.tech/api\n- **GitHub:** https://github.com/tomi204/clawpump-skill\n"
      },
      "plugins": [
        {
          "name": "solana-token-launcher",
          "source": ".",
          "description": "Create and launch Solana tokens gasless on pump.fun. Self-funded launches with SOL or USDC (x402). Tweet-verified launches. Custom dev-buy and instant graduation. Swap SPL tokens via Jupiter. Scan cross-DEX arbitrage on Raydium, Orca, Meteora. Full Solana DeFi toolkit for AI agents — powered by ClawPump.",
          "version": "1.1.0",
          "homepage": "https://clawpump.tech",
          "repository": "https://github.com/tomi204/clawpump-skill",
          "keywords": [
            "solana",
            "token",
            "launch",
            "pump.fun",
            "swap",
            "arbitrage",
            "defi",
            "jupiter",
            "raydium",
            "orca",
            "spl-token",
            "blockchain",
            "web3"
          ],
          "category": "blockchain",
          "categories": [
            "arbitrage",
            "blockchain",
            "defi",
            "jupiter",
            "launch",
            "orca",
            "pump.fun",
            "raydium",
            "solana",
            "spl-token",
            "swap",
            "token",
            "web3"
          ],
          "install_commands": [
            "/plugin marketplace add tomi204/clawpump-skill",
            "/plugin install solana-token-launcher@clawpump-skill"
          ]
        }
      ]
    }
  ]
}