{
  "author": {
    "id": "treasure-data",
    "display_name": "Treasure Data",
    "avatar_url": "https://avatars.githubusercontent.com/u/747746?v=4"
  },
  "marketplaces": [
    {
      "name": "td-skills",
      "version": null,
      "description": "Internal Treasure Data skills for Claude Code to enhance productivity with TD-specific tools and workflows",
      "repo_full_name": "treasure-data/td-skills",
      "repo_url": "https://github.com/treasure-data/td-skills",
      "repo_description": "Treasure Data Skills for Claude Code",
      "signals": {
        "stars": 10,
        "forks": 13,
        "pushed_at": "2026-02-19T05:16:09Z"
      },
      "files": {
        ".claude-plugin/marketplace.json": "{\n  \"name\": \"td-skills\",\n  \"owner\": {\n    \"name\": \"Treasure Data\",\n    \"email\": \"support@treasuredata.com\"\n  },\n  \"metadata\": {\n    \"version\": \"1.0.0\",\n    \"description\": \"Internal Treasure Data skills for Claude Code to enhance productivity with TD-specific tools and workflows\"\n  },\n  \"plugins\": [\n    {\n      \"name\": \"sql-skills\",\n      \"description\": \"SQL query skills for Treasure Data including Trino and Hive query optimization, time-based filtering with td_interval, and TD MCP server for Claude Code integration with natural language data exploration\",\n      \"source\": \"./\",\n      \"strict\": false,\n      \"skills\": [\n        \"./sql-skills/trino\",\n        \"./sql-skills/hive\",\n        \"./sql-skills/trino-optimizer\",\n        \"./sql-skills/trino-to-hive-migration\",\n        \"./sql-skills/td-mcp\",\n        \"./sql-skills/time-filtering\"\n      ]\n    },\n    {\n      \"name\": \"realtime-skills\",\n      \"description\": \"RT 2.0 (Real-Time Personalization) skills for configuring parent segments with event tables and RT attributes, creating personalization services for real-time API responses, managing real-time journeys with event-triggered activations, and querying activation/identity logs. Includes end-to-end orchestrator skills for complete RT setup workflows and validation tools for error-free personalization entity creation.\",\n      \"source\": \"./\",\n      \"strict\": false,\n      \"skills\": [\n        \"./realtime-skills/rt-setup-personalization\",\n        \"./realtime-skills/rt-setup-triggers\",\n        \"./realtime-skills/rt-personalization-validation\",\n        \"./realtime-skills/activations\",\n        \"./realtime-skills/identity\",\n        \"./realtime-skills/rt-config\",\n        \"./realtime-skills/rt-config-setup\",\n        \"./realtime-skills/rt-config-events\",\n        \"./realtime-skills/rt-config-attributes\",\n        \"./realtime-skills/rt-config-id-stitching\",\n        \"./realtime-skills/rt-personalization\",\n        \"./realtime-skills/rt-triggers\",\n        \"./realtime-skills/rt-journey-create\",\n        \"./realtime-skills/rt-journey-activations\",\n        \"./realtime-skills/rt-journey-monitor\"\n      ]\n    },\n    {\n      \"name\": \"field-agent-skills\",\n      \"description\": \"Field Agent development and production best practices including deployment workflows, documentation standards, and professional Plotly visualization guidelines for creating executive-ready agents\",\n      \"source\": \"./\",\n      \"strict\": false,\n      \"skills\": [\n        \"./field-agent-skills/deployment\",\n        \"./field-agent-skills/documentation\",\n        \"./field-agent-skills/visualization\"\n      ]\n    },\n    {\n      \"name\": \"semantic-layer\",\n      \"description\": \"Semantic layer skills for data governance and catalog management including data dictionary helper for asset documentation and schema auto-tagger for automated policy-based tagging with intelligent pattern detection and compliance support\",\n      \"source\": \"./\",\n      \"strict\": false,\n      \"skills\": [\n        \"./semantic-layer/data-dictionary-helper\",\n        \"./semantic-layer/schema-auto-tagger\"\n      ]\n    },\n    {\n      \"name\": \"workflow-skills\",\n      \"description\": \"Treasure Workflow orchestration and data transformation skills including workflow creation, management, debugging, optimization, and dbt (data build tool) for Treasure Data Trino\",\n      \"source\": \"./\",\n      \"strict\": false,\n      \"skills\": [\n        \"./workflow-skills/digdag\",\n        \"./workflow-skills/workflow-management\",\n        \"./workflow-skills/dbt\"\n      ]\n    },\n    {\n      \"name\": \"sdk-skills\",\n      \"description\": \"Skills for using Treasure Data SDKs including JavaScript SDK for browser-based event tracking and pytd (Python SDK) for querying data, importing pandas DataFrames, and building analytical pipelines\",\n      \"source\": \"./\",\n      \"strict\": false,\n      \"skills\": [\n        \"./sdk-skills/javascript\",\n        \"./sdk-skills/python\"\n      ]\n    },\n    {\n      \"name\": \"tdx-skills\",\n      \"description\": \"tdx CLI for managing Treasure Data from the command line including database management, table operations, queries, context configuration, CDP parent segments, child segments with activations, segment validation, journey orchestration, and workflow management\",\n      \"source\": \"./\",\n      \"strict\": false,\n      \"skills\": [\n        \"./tdx-skills/tdx-basic\",\n        \"./tdx-skills/parent-segment\",\n        \"./tdx-skills/segment\",\n        \"./tdx-skills/validate-segment\",\n        \"./tdx-skills/journey\",\n        \"./tdx-skills/validate-journey\",\n        \"./tdx-skills/connector-config\",\n        \"./tdx-skills/agent\",\n        \"./tdx-skills/agent-test\",\n        \"./tdx-skills/agent-prompt\",\n        \"./tdx-skills/workflow\",\n        \"./tdx-skills/parent-segment-analysis\"\n      ]\n    },\n    {\n      \"name\": \"template-skill\",\n      \"description\": \"Template for creating new TD-specific Claude Code skills with best practices and standard structure\",\n      \"source\": \"./\",\n      \"strict\": false,\n      \"skills\": [\n        \"./template-skill\"\n      ]\n    },\n    {\n      \"name\": \"aps-doc-skills\",\n      \"description\": \"Modular technical documentation generation for Treasure Data pipeline layers and CDP. Layer-specific expert skills for core patterns, ingestion, staging, hist-union, ID unification, golden layers, and CDP master segment configurations with intelligent auto-detection and comprehensive documentation.\",\n      \"source\": \"./\",\n      \"strict\": false,\n      \"skills\": [\n        \"./aps-doc-skills/core\",\n        \"./aps-doc-skills/ingestion\",\n        \"./aps-doc-skills/staging\",\n        \"./aps-doc-skills/hist-union\",\n        \"./aps-doc-skills/id-unification\",\n        \"./aps-doc-skills/golden\",\n        \"./aps-doc-skills/master-segment\"\n      ]\n    },\n    {\n      \"name\": \"email-campaign-skills\",\n      \"description\": \"Generate enterprise-grade HTML email campaigns with strategy briefs, live preview in Treasure Studio, iterative natural language editing, and push to Treasure Engage\",\n      \"source\": \"./\",\n      \"strict\": false,\n      \"skills\": [\n        \"./email-campaign-skills/email-campaign\"\n      ]\n    }\n  ]\n}\n",
        "README.md": "# TD Skills for Claude Code\n\nTreasure Data skills for [Claude Code](https://claude.com/claude-code) to enhance productivity with TD-specific tools and workflows.\n\n## What Are Skills?\n\nSkills are folders of instructions and resources that Claude loads dynamically to improve performance on specialized tasks. These TD skills teach Claude how to use our tools and follow our best practices.\n\n## Available Skills\n\n### SQL Skills\n\n- **[sql-skills/trino](./sql-skills/trino)** - Write and optimize SQL queries for Trino with TD best practices\n- **[sql-skills/hive](./sql-skills/hive)** - Create efficient Hive queries following TD conventions\n- **[sql-skills/time-filtering](./sql-skills/time-filtering)** - Time-based filtering with td_interval() and td_time_range() for partition pruning and query performance\n- **[sql-skills/trino-optimizer](./sql-skills/trino-optimizer)** - Optimize slow Trino queries, fix timeouts and memory errors, reduce costs\n- **[sql-skills/trino-to-hive-migration](./sql-skills/trino-to-hive-migration)** - Convert Trino queries to Hive to resolve memory errors and handle large datasets\n- **[sql-skills/td-mcp](./sql-skills/td-mcp)** - Connect Claude Code to TD via MCP server for natural language data exploration and queries\n\n### Realtime Skills\n\n#### End-to-End Orchestrators (Recommended for New Setups)\n- **[realtime-skills/rt-setup-personalization](./realtime-skills/rt-setup-personalization)** - Complete personalization setup workflow: validates parent segment RT status, discovers events/attributes, configures RT infrastructure (events, attributes, ID stitching), creates personalization service AND entity with payload. Implements full 9-step workflow from discovery to deployment.\n- **[realtime-skills/rt-setup-triggers](./realtime-skills/rt-setup-triggers)** - Complete RT triggers/journey setup workflow: same RT configuration as personalization, then creates RT journey with activations (webhook, Salesforce, email) and launches for event processing.\n\n#### RT 2.0 Setup & Configuration\n- **[realtime-skills/rt-config](./realtime-skills/rt-config)** - RT 2.0 configuration overview (entry point)\n- **[realtime-skills/rt-config-setup](./realtime-skills/rt-config-setup)** - Initial RT setup: check enablement, initialize configuration, verify prerequisites\n- **[realtime-skills/rt-config-events](./realtime-skills/rt-config-events)** - Configure event tables and key events with filters\n- **[realtime-skills/rt-config-attributes](./realtime-skills/rt-config-attributes)** - Configure RT attributes: single, list, counter, and batch attributes\n- **[realtime-skills/rt-config-id-stitching](./realtime-skills/rt-config-id-stitching)** - Configure ID stitching and profile merging\n\n#### RT Personalization\n- **[realtime-skills/rt-personalization](./realtime-skills/rt-personalization)** - Create RT personalization service AND entity (both required). Creates service configuration via YAML and Personalization entity via API with payload definition, making it visible in Console UI. Handles proper subAttributeIdentifier for list attributes.\n\n#### RT Journeys (Triggers)\n- **[realtime-skills/rt-triggers](./realtime-skills/rt-triggers)** - RT journeys overview (entry point)\n- **[realtime-skills/rt-journey-create](./realtime-skills/rt-journey-create)** - Create RT journeys with event triggers\n- **[realtime-skills/rt-journey-activations](./realtime-skills/rt-journey-activations)** - Configure activations: webhook, Salesforce, email\n- **[realtime-skills/rt-journey-monitor](./realtime-skills/rt-journey-monitor)** - Monitor journeys, debug failures, query activation logs\n\n#### Activation & Identity Monitoring\n- **[realtime-skills/activations](./realtime-skills/activations)** - Query activation logs to check for errors and view volume for digital marketing activations\n- **[realtime-skills/identity](./realtime-skills/identity)** - Query id change logs to get information about new, updated and merged realtime profiles\n\n### Workflow Skills\n\n- **[workflow-skills/digdag](./workflow-skills/digdag)** - Design and implement Treasure Workflow with proper error handling\n- **[workflow-skills/workflow-management](./workflow-skills/workflow-management)** - Manage, debug, and optimize existing Treasure Workflows\n- **[workflow-skills/dbt](./workflow-skills/dbt)** - Use dbt (data build tool) with TD Trino, includes setup, TD-specific macros, and incremental models\n\n### SDK Skills\n\n- **[sdk-skills/javascript](./sdk-skills/javascript)** - Import data to TD using the JavaScript SDK for browser-based event tracking and page analytics\n- **[sdk-skills/python](./sdk-skills/python)** - Query and import data using pytd (Python SDK) for analytical workflows, pandas integration, and ETL pipelines\n\n### TDX CLI Skills\n\n- **[tdx-skills/tdx-basic](./tdx-skills/tdx-basic)** - Core [tdx](https://tdx.treasuredata.com) CLI operations for managing TD from command line: databases, tables, queries, and context management\n- **[tdx-skills/parent-segment](./tdx-skills/parent-segment)** - Manage CDP parent segments with YAML-based configuration for master tables, attributes, and behaviors\n- **[tdx-skills/segment](./tdx-skills/segment)** - Manage CDP child segments with rules, activations, and folder organization\n- **[tdx-skills/validate-segment](./tdx-skills/validate-segment)** - Validate segment YAML configurations against CDP API spec for correct operators, time units, and field names\n- **[tdx-skills/journey](./tdx-skills/journey)** - Create CDP journey definitions in YAML with stages, steps (wait, activation, decision_point, ab_test, merge, jump, end), and simulation workflow\n- **[tdx-skills/validate-journey](./tdx-skills/validate-journey)** - Validate journey YAML configurations for correct step types, parameters, and segment references\n- **[tdx-skills/connector-config](./tdx-skills/connector-config)** - Configure connector_config for segment/journey activations using `tdx connection schema` to discover fields\n- **[tdx-skills/agent](./tdx-skills/agent)** - Build LLM agents using `tdx agent pull/push` with YAML/Markdown config, tools, and knowledge bases\n- **[tdx-skills/agent-test](./tdx-skills/agent-test)** - Run automated tests for LLM agents using `tdx agent test` with test.yml format and judge evaluation\n- **[tdx-skills/agent-prompt](./tdx-skills/agent-prompt)** - Write effective system prompts for TD AI agents with role definition, constraints, and output formatting\n- **[tdx-skills/workflow](./tdx-skills/workflow)** - Manage TD workflows via `tdx wf` commands: project sync, run, sessions, timeline, attempts, retry, and secrets\n\n### Field Agent Skills\n\n- **[field-agent-skills/deployment](./field-agent-skills/deployment)** - Best practices for developing, testing, and deploying production-ready Field Agents including R&D workflows and release management\n- **[field-agent-skills/documentation](./field-agent-skills/documentation)** - Comprehensive templates and guidelines for documenting Field Agents with standardized structure, system prompts, and tool specifications\n- **[field-agent-skills/visualization](./field-agent-skills/visualization)** - Professional Plotly visualization best practices with TD color palette, chart specifications, and formatting standards for executive-ready visualizations\n\n### Reference\n\n- **[template-skill](./template-skill)** - Template for creating new TD-specific skills\n\n## Using These Skills\n\n### In Claude Code\n\n1. **Register the TD skills marketplace:**\n   ```\n   /plugin marketplace add https://github.com/treasure-data/td-skills\n   ```\n\n2. **Browse and install plugins:**\n\n   Select \"Browse and install plugins\" from the menu, then choose from:\n   - `sql-skills` - Trino and Hive query assistance, Trino CLI, and TD MCP server\n   - `realtime-skills` - RT 2.0 end-to-end orchestrators, configuration, personalization services, real-time journeys, and activation/identity log monitoring\n   - `workflow-skills` - Treasure Workflow creation, management, and dbt transformations\n   - `sdk-skills` - TD JavaScript SDK and pytd Python SDK\n   - `tdx-skills` - tdx CLI for managing TD from command line\n   - `field-agent-skills` - Field Agent deployment, documentation, and visualization best practices\n   - `template-skill` - Template for creating new skills\n\n3. **Or install directly:**\n   ```\n   /plugin install sql-skills@td-skills\n   /plugin install realtime-skills@td-skills\n   /plugin install workflow-skills@td-skills\n   /plugin install sdk-skills@td-skills\n   /plugin install tdx-skills@td-skills\n   /plugin install field-agent-skills@td-skills\n   ```\n\n### Invoking Skills\n\nOnce installed, explicitly reference skills using the `skill` keyword to trigger them:\n\n```\n\"Use the Trino skill to extract data from sample_datasets.nasdaq table\"\n\"Use the Hive skill to write a query for daily user aggregation\"\n\"Use the time-filtering skill to add partition pruning to my query\"\n\"Use the Trino CLI skill to help me connect to TD from the terminal\"\n\"Use the TD MCP skill to set up Claude Code to access my TD databases\"\n\"Use the rt-setup-personalization skill to create realtime personalization for product recommendations\"\n\"Use the rt-setup-triggers skill to set up a welcome email trigger when users sign up\"\n\"Use the rt-config-setup skill to check RT enablement status\"\n\"Use the rt-config-events skill to configure event tables for parent segment 394649\"\n\"Use the rt-config-attributes skill to add RT attributes\"\n\"Use the rt-config-id-stitching skill to configure profile merging\"\n\"Use the rt-personalization skill to create a product recommendation service\"\n\"Use the rt-personalization skill to build a cart recovery service\"\n\"Use the rt-personalization skill to integrate personalization API with my web app\"\n\"Use the rt-journey-create skill to create a welcome email journey\"\n\"Use the rt-journey-activations skill to configure webhook activations\"\n\"Use the rt-journey-monitor skill to debug activation failures\"\n\"Use the activations skill to query activation logs for parent segment 394649\"\n\"Use the identity skill to check recent profile merges for parent segment 394649\"\n\"Use the digdag skill to create a workflow that runs every morning\"\n\"Use the workflow-management skill to debug this failing workflow\"\n\"Use the dbt skill to create an incremental model for user events\"\n\"Use the JavaScript SDK skill to implement event tracking on my website\"\n\"Use the pytd skill to query TD from Python and load results into pandas\"\n\"Use the tdx-basic skill to list all databases in the Tokyo region\"\n\"Use the parent-segment skill to configure a CDP parent segment\"\n\"Use the segment skill to create child segments with activation rules\"\n\"Use the validate-segment skill to check my segment YAML for errors\"\n\"Use the journey skill to create a customer onboarding journey\"\n\"Use the validate-journey skill to check my journey YAML for errors\"\n\"Use the connector-config skill to configure an SFMC activation\"\n\"Use the agent skill to create an LLM agent with knowledge base tools\"\n\"Use the agent-test skill to run automated tests for my agent\"\n\"Use the agent-prompt skill to write an effective system prompt for my agent\"\n\"Use the workflow skill to debug a failing workflow session\"\n\"Use the deployment skill to set up a production publishing workflow\"\n\"Use the documentation skill to create comprehensive Field Agent documentation\"\n\"Use the visualization skill to create a Plotly chart with TD colors\"\n```\n\nTips for triggering skills:\n- Include the skill name (Trino, Hive, time-filtering, Trino CLI, TD MCP, rt-setup-personalization, rt-setup-triggers, rt-config-setup, rt-config-events, rt-config-attributes, rt-config-id-stitching, rt-personalization, rt-journey-create, rt-journey-activations, rt-journey-monitor, activations, identity, digdag, workflow, dbt, JavaScript SDK, pytd, tdx, tdx-basic, validate-segment, journey, validate-journey, connector-config, agent, agent-test, agent-prompt, deployment, documentation, visualization)\n- Use the word \"skill\" in your request\n- Be specific about what you want to accomplish\n\n## Creating Your Own TD Skills\n\nTo add a new TD-specific skill:\n\n1. Create a new directory under the appropriate category:\n   ```bash\n   mkdir sql-skills/your-skill-name\n   # or\n   mkdir workflow-skills/your-skill-name\n   # or\n   mkdir field-agent-skills/your-skill-name\n   ```\n\n2. Create a `SKILL.md` file with YAML frontmatter (see [template-skill](./template-skill/SKILL.md))\n\n3. Update `.claude-plugin/marketplace.json` to register the new skill:\n   ```json\n   {\n     \"name\": \"sql-skills\",\n     \"skills\": [\n       \"./sql-skills/trino\",\n       \"./sql-skills/hive\",\n       \"./sql-skills/your-skill-name\"  // Add your skill path here (must start with ./)\n     ]\n   }\n\n   ```\n\n## Contributing\n\nTo contribute a new skill or improve an existing one:\n\n1. Create or update the skill in a feature branch\n2. Test the skill with Claude Code\n3. Submit a pull request with clear documentation\n\n## Support\n\nFor questions or issues:\n- Open an issue in this repository\n- Contact the Data Engineering team\n\n---\n\n**Note:** These skills are for internal TD use only.\n"
      },
      "plugins": [
        {
          "name": "sql-skills",
          "description": "SQL query skills for Treasure Data including Trino and Hive query optimization, time-based filtering with td_interval, and TD MCP server for Claude Code integration with natural language data exploration",
          "source": "./",
          "strict": false,
          "skills": [
            "./sql-skills/trino",
            "./sql-skills/hive",
            "./sql-skills/trino-optimizer",
            "./sql-skills/trino-to-hive-migration",
            "./sql-skills/td-mcp",
            "./sql-skills/time-filtering"
          ],
          "categories": [],
          "install_commands": [
            "/plugin marketplace add treasure-data/td-skills",
            "/plugin install sql-skills@td-skills"
          ]
        },
        {
          "name": "realtime-skills",
          "description": "RT 2.0 (Real-Time Personalization) skills for configuring parent segments with event tables and RT attributes, creating personalization services for real-time API responses, managing real-time journeys with event-triggered activations, and querying activation/identity logs. Includes end-to-end orchestrator skills for complete RT setup workflows and validation tools for error-free personalization entity creation.",
          "source": "./",
          "strict": false,
          "skills": [
            "./realtime-skills/rt-setup-personalization",
            "./realtime-skills/rt-setup-triggers",
            "./realtime-skills/rt-personalization-validation",
            "./realtime-skills/activations",
            "./realtime-skills/identity",
            "./realtime-skills/rt-config",
            "./realtime-skills/rt-config-setup",
            "./realtime-skills/rt-config-events",
            "./realtime-skills/rt-config-attributes",
            "./realtime-skills/rt-config-id-stitching",
            "./realtime-skills/rt-personalization",
            "./realtime-skills/rt-triggers",
            "./realtime-skills/rt-journey-create",
            "./realtime-skills/rt-journey-activations",
            "./realtime-skills/rt-journey-monitor"
          ],
          "categories": [],
          "install_commands": [
            "/plugin marketplace add treasure-data/td-skills",
            "/plugin install realtime-skills@td-skills"
          ]
        },
        {
          "name": "field-agent-skills",
          "description": "Field Agent development and production best practices including deployment workflows, documentation standards, and professional Plotly visualization guidelines for creating executive-ready agents",
          "source": "./",
          "strict": false,
          "skills": [
            "./field-agent-skills/deployment",
            "./field-agent-skills/documentation",
            "./field-agent-skills/visualization"
          ],
          "categories": [],
          "install_commands": [
            "/plugin marketplace add treasure-data/td-skills",
            "/plugin install field-agent-skills@td-skills"
          ]
        },
        {
          "name": "semantic-layer",
          "description": "Semantic layer skills for data governance and catalog management including data dictionary helper for asset documentation and schema auto-tagger for automated policy-based tagging with intelligent pattern detection and compliance support",
          "source": "./",
          "strict": false,
          "skills": [
            "./semantic-layer/data-dictionary-helper",
            "./semantic-layer/schema-auto-tagger"
          ],
          "categories": [],
          "install_commands": [
            "/plugin marketplace add treasure-data/td-skills",
            "/plugin install semantic-layer@td-skills"
          ]
        },
        {
          "name": "workflow-skills",
          "description": "Treasure Workflow orchestration and data transformation skills including workflow creation, management, debugging, optimization, and dbt (data build tool) for Treasure Data Trino",
          "source": "./",
          "strict": false,
          "skills": [
            "./workflow-skills/digdag",
            "./workflow-skills/workflow-management",
            "./workflow-skills/dbt"
          ],
          "categories": [],
          "install_commands": [
            "/plugin marketplace add treasure-data/td-skills",
            "/plugin install workflow-skills@td-skills"
          ]
        },
        {
          "name": "sdk-skills",
          "description": "Skills for using Treasure Data SDKs including JavaScript SDK for browser-based event tracking and pytd (Python SDK) for querying data, importing pandas DataFrames, and building analytical pipelines",
          "source": "./",
          "strict": false,
          "skills": [
            "./sdk-skills/javascript",
            "./sdk-skills/python"
          ],
          "categories": [],
          "install_commands": [
            "/plugin marketplace add treasure-data/td-skills",
            "/plugin install sdk-skills@td-skills"
          ]
        },
        {
          "name": "tdx-skills",
          "description": "tdx CLI for managing Treasure Data from the command line including database management, table operations, queries, context configuration, CDP parent segments, child segments with activations, segment validation, journey orchestration, and workflow management",
          "source": "./",
          "strict": false,
          "skills": [
            "./tdx-skills/tdx-basic",
            "./tdx-skills/parent-segment",
            "./tdx-skills/segment",
            "./tdx-skills/validate-segment",
            "./tdx-skills/journey",
            "./tdx-skills/validate-journey",
            "./tdx-skills/connector-config",
            "./tdx-skills/agent",
            "./tdx-skills/agent-test",
            "./tdx-skills/agent-prompt",
            "./tdx-skills/workflow",
            "./tdx-skills/parent-segment-analysis"
          ],
          "categories": [],
          "install_commands": [
            "/plugin marketplace add treasure-data/td-skills",
            "/plugin install tdx-skills@td-skills"
          ]
        },
        {
          "name": "template-skill",
          "description": "Template for creating new TD-specific Claude Code skills with best practices and standard structure",
          "source": "./",
          "strict": false,
          "skills": [
            "./template-skill"
          ],
          "categories": [],
          "install_commands": [
            "/plugin marketplace add treasure-data/td-skills",
            "/plugin install template-skill@td-skills"
          ]
        },
        {
          "name": "aps-doc-skills",
          "description": "Modular technical documentation generation for Treasure Data pipeline layers and CDP. Layer-specific expert skills for core patterns, ingestion, staging, hist-union, ID unification, golden layers, and CDP master segment configurations with intelligent auto-detection and comprehensive documentation.",
          "source": "./",
          "strict": false,
          "skills": [
            "./aps-doc-skills/core",
            "./aps-doc-skills/ingestion",
            "./aps-doc-skills/staging",
            "./aps-doc-skills/hist-union",
            "./aps-doc-skills/id-unification",
            "./aps-doc-skills/golden",
            "./aps-doc-skills/master-segment"
          ],
          "categories": [],
          "install_commands": [
            "/plugin marketplace add treasure-data/td-skills",
            "/plugin install aps-doc-skills@td-skills"
          ]
        },
        {
          "name": "email-campaign-skills",
          "description": "Generate enterprise-grade HTML email campaigns with strategy briefs, live preview in Treasure Studio, iterative natural language editing, and push to Treasure Engage",
          "source": "./",
          "strict": false,
          "skills": [
            "./email-campaign-skills/email-campaign"
          ],
          "categories": [],
          "install_commands": [
            "/plugin marketplace add treasure-data/td-skills",
            "/plugin install email-campaign-skills@td-skills"
          ]
        }
      ]
    }
  ]
}