{
  "author": {
    "id": "TyrealQ",
    "display_name": "TyrealQ",
    "avatar_url": "https://avatars.githubusercontent.com/u/59893022?u=7a2d3f3406bc35a54f7a1613a997866e51f7e9cd&v=4"
  },
  "marketplaces": [
    {
      "name": "q-skills",
      "version": null,
      "description": "End-to-end skills for academic writing, data analysis, teaching, and research communication",
      "repo_full_name": "TyrealQ/q-skills",
      "repo_url": "https://github.com/TyrealQ/q-skills",
      "repo_description": "End-to-end skills for academic writing, data analysis, teaching, and research communication.",
      "signals": {
        "stars": 2,
        "forks": 0,
        "pushed_at": "2026-02-21T23:58:23Z"
      },
      "files": {
        ".claude-plugin/marketplace.json": "{\n  \"name\": \"q-skills\",\n  \"owner\": {\n    \"name\": \"Tyreal Q\"\n  },\n  \"metadata\": {\n    \"description\": \"End-to-end skills for academic writing, data analysis, teaching, and research communication\",\n    \"version\": \"1.4.7\"\n  },\n  \"plugins\": [\n    {\n      \"name\": \"q-scholar\",\n      \"description\": \"Academic manuscript writing suite (intro, methods, results, exploratory analysis)\",\n      \"source\": \"./\",\n      \"strict\": false,\n      \"skills\": [\n        \"./skills/q-scholar\",\n        \"./skills/q-scholar/q-intro\",\n        \"./skills/q-scholar/q-exploratory-analysis\",\n        \"./skills/q-scholar/q-methods\",\n        \"./skills/q-scholar/q-results\"\n      ]\n    },\n    {\n      \"name\": \"q-educator\",\n      \"description\": \"Course content development for lectures, demos, assignments, and feedback\",\n      \"source\": \"./\",\n      \"strict\": false,\n      \"skills\": [\n        \"./skills/q-educator\"\n      ]\n    },\n    {\n      \"name\": \"q-infographics\",\n      \"description\": \"Convert documents into business stories and infographics\",\n      \"source\": \"./\",\n      \"strict\": false,\n      \"skills\": [\n        \"./skills/q-infographics\"\n      ]\n    },\n    {\n      \"name\": \"q-presentations\",\n      \"description\": \"Convert content into branded slide decks with style presets\",\n      \"source\": \"./\",\n      \"strict\": false,\n      \"skills\": [\n        \"./skills/q-presentations\"\n      ]\n    },\n    {\n      \"name\": \"q-topic-finetuning\",\n      \"description\": \"Consolidate topic modeling outputs into theory-driven frameworks\",\n      \"source\": \"./\",\n      \"strict\": false,\n      \"skills\": [\n        \"./skills/q-topic-finetuning\"\n      ]\n    }\n  ]\n}\n",
        "README.md": "﻿# q-skills\n\nEnd-to-end skills for academic writing, data analysis, teaching, and research communication.\n\n## Prerequisites\n\n- [Claude Code](https://claude.ai/code) or compatible AI coding assistant\n- Python 3.8+ (for script-based skills)\n- pandas, openpyxl (for data processing skills)\n- [Node.js](https://nodejs.org/) (for `npx`-based installation)\n\n## Installation\n\nChoose **one** of the methods below.\n\n| Method | Best for |\n| ------ | -------- |\n| [Ask the Agent](#option-1-ask-the-agent-beginner-friendly) | **No coding experience needed** — just talk to Claude |\n| [Quick Install](#option-2-quick-install) | Command-line users — installs all skills at once |\n| [Plugin Marketplace](#option-3-plugin-marketplace) | Register once, then install all or specific skills |\n| [Manual](#option-4-manual-clone-and-copy) | Offline or restricted environments |\n\n---\n\n### Option 1: Ask the Agent (Beginner-Friendly)\n\n> **No coding experience required.** If you are new to Claude Code or not comfortable with the command line, this is the easiest way to get started. Just open Claude Code and type:\n\n```\nPlease install skills from github.com/TyrealQ/q-skills\n```\n\nClaude will handle the installation for you — no terminal, no commands.\n\n---\n\n### Option 2: Quick Install\n\nRequires [Node.js](https://nodejs.org/) for `npx`:\n\n```bash\nnpx skills add TyrealQ/q-skills\n```\n\n---\n\n### Option 3: Plugin Marketplace\n\nRegister q-skills as a plugin source in Claude Code, then install all or selected skills.\n\n**Step 1 — Register** (run once inside Claude Code):\n\n```\n/plugin marketplace add TyrealQ/q-skills\n```\n\n**Step 2 — Install:**\n\nTo install all skills at once, use [Option 2](#option-2-quick-install) or browse via the Claude Code plugin UI after Step 1.\n\nTo install specific skills only:\n\n```\n/plugin install q-scholar@q-skills\n/plugin install q-educator@q-skills\n/plugin install q-infographics@q-skills\n/plugin install q-presentations@q-skills\n/plugin install q-topic-finetuning@q-skills\n```\n\n---\n\n### Option 4: Manual (Clone and Copy)\n\n```bash\ngit clone https://github.com/TyrealQ/q-skills.git\n```\n\n**Windows (PowerShell):**\n\n```powershell\nCopy-Item -Recurse -Force q-skills\\skills\\q-* $env:USERPROFILE\\.claude\\skills\\\n```\n\n**macOS/Linux:**\n\n```bash\ncp -r q-skills/skills/q-* ~/.claude/skills/\n```\n\n> **Note:** The exact skills path depends on your AI assistant. Common locations: `~/.claude/skills/`, `~/.gemini/skills/`\n\n## Update Skills\n\n### Via Plugin UI (Recommended)\n\n1. Run `/plugin` in Claude Code\n2. Switch to the **Marketplaces** tab (arrow keys or Tab)\n3. Select **q-skills**\n4. Choose **Update marketplace**\n\nYou can also enable **auto-update** to receive the latest versions automatically.\n\n### Force Reinstall\n\n```bash\nnpx skills add TyrealQ/q-skills --force\n```\n\n### Manual Update\n\n```bash\ncd q-skills\ngit pull\n```\n\nThen re-copy the skills to your skills directory (see Manual install above).\n\n---\n\n## Available Skills\n\n### Academic Writing Skills\n\n| Skill                      | Description                                                   |\n| -------------------------- | ------------------------------------------------------------- |\n| [q-scholar](#q-scholar)    | Academic manuscript writing suite (methods, results, analysis) |\n\n### Data Analysis Skills\n\n| Skill                                     | Description                                                      |\n| ----------------------------------------- | ---------------------------------------------------------------- |\n| [q-topic-finetuning](#q-topic-finetuning) | Consolidate topic modeling outputs into theory-driven frameworks |\n\n### Education Skills\n\n| Skill                         | Description                                                                 |\n| ----------------------------- | --------------------------------------------------------------------------- |\n| [q-educator](#q-educator)     | Course content development for lectures, demos, assignments, and feedback   |\n\n### Research Promotion Skills\n\n| Skill                               | Description                                              |\n| ----------------------------------- | -------------------------------------------------------- |\n| [q-infographics](#q-infographics)   | Convert documents into business stories and infographics |\n| [q-presentations](#q-presentations) | Convert content into branded slide decks with style presets |\n\n---\n\n## Skill Details\n\n### q-scholar\n\nAcademic manuscript writing suite for drafting journal-ready prose following APA 7th edition standards. Orchestrates specialized sub-skills for complete manuscript preparation workflows.\n\n**Sub-Skills:**\n\n| Sub-Skill | Description |\n| --------- | ----------- |\n| q-intro | Introduction drafting and refinement with argumentative architecture guidance |\n| q-exploratory-analysis | Universal EDA with auto-detected column types and measurement-appropriate statistics |\n| q-methods | Methods section drafting in clear, narrative style |\n| q-results | Results section drafting with APA-compliant tables |\n\n**Triggers:**\n\n- \"Help me write the methods and results for my study\"\n- \"Draft a results section for this analysis\"\n- \"Analyze this dataset and generate descriptive statistics\"\n\n**Features:**\n\n- End-to-end manuscript support (data exploration -> methods -> results)\n- APA 7th edition formatting (tables, statistics, notation)\n- Narrative prose style (no bullet points or em-dashes)\n- Shared style guides and templates\n- Appendix strategies for technical details\n\n**Workflow Phases:**\n\n1. **Data Exploration** - Invoke q-exploratory-analysis for statistics and summaries\n2. **Introduction Drafting** - Invoke q-intro for context, gaps, RQs, and contributions\n3. **Methods Documentation** - Invoke q-methods for data collection and analysis procedures\n4. **Results Presentation** - Invoke q-results for findings organized by research questions\n\n**Folder Structure:**\n\n```text\nq-scholar/\n|-- SKILL.md                              # Orchestration skill\n|-- references/                           # Shared style guides\n|   |-- apa_style_guide.md                # Numbers, statistics, notation\n|   `-- table_formatting.md               # APA 7th table examples\n|-- q-intro/\n|   |-- SKILL.md                          # Introduction drafting skill\n|   `-- references/                       # Templates and interview questions\n|-- q-exploratory-analysis/\n|   |-- SKILL.md                          # Data exploration skill\n|   `-- scripts/                          # run_eda.py + requirements.txt\n|-- q-methods/\n|   |-- SKILL.md                          # Methods drafting skill\n|   `-- references/                       # Methods and appendix templates\n`-- q-results/\n    |-- SKILL.md                          # Results drafting skill\n    `-- references/                       # Results template\n```\n\n**Example:**\n\n```\nHelp me write the methods and results sections for my topic modeling study on esports discourse\n```\n\n---\n\n### q-topic-finetuning\n\nFine-tune and consolidate topic modeling outputs (BERTopic, LDA, NMF) into theory-driven classification frameworks.\n\n**Triggers:**\n\n- \"Consolidate these BERTopic topics...\"\n- \"Classify topics using [framework]...\"\n- \"Merge topic modeling results for my manuscript...\"\n\n**Features:**\n\n- Convert 50+ raw topics into 20-50 manuscript-ready categories\n- Apply theoretical frameworks (legitimacy, stakeholder theory, sentiment)\n- Preserve domain-specific distinctions (entity, event, geography)\n- Handle multi-category assignments with overlap reconciliation\n- Generate Excel output with classification labels\n\n**Folder Structure:**\n\n```text\nq-topic-finetuning/\n|-- SKILL.md                                  # Main skill file\n|-- scripts/\n|   |-- classify_outliers.py                  # Outlier reclassification via Gemini\n|   |-- generate_implementation_plan.py       # Full plan generation\n|   `-- update_excel_with_labels.py           # Excel column updates\n`-- references/\n    |-- esports_ugc_example.md                # Worked example\n    `-- SP_OUTLIER_TEMPLATE.txt               # Outlier classification prompt template\n```\n\n**Example:**\n\n```\nConsolidate my 129 BERTopic topics using organizational legitimacy framework\n```\n\n**Reference:** See `references/esports_ugc_example.md` for complete worked example.\n\n---\n\n### q-infographics\n\nConvert documents into compelling business stories and cartoon-style infographics using Gemini 3.0 Pro.\n\n**Triggers:**\n\n- \"Create an infographic from this document...\"\n- \"Convert this paper to a visual summary...\"\n- \"Generate a business story from...\"\n\n**Features:**\n\n- Two-stage pipeline: Document -> Story -> Infographic\n- Business story style (36Kr/Huxiu format) with \"golden sentences\"\n- Hand-drawn cartoon-style infographics (16:9)\n- Automatic logo branding on generated infographics\n- Review checkpoints at each stage\n- Supports PDF, DOCX, and text input (via markitdown)\n\n**Requirements:**\n\n- `pip install google-genai Pillow markitdown`\n- `GEMINI_API_KEY` environment variable\n- PowerShell (Windows): `$env:GEMINI_API_KEY = (Get-Content path\\to\\.env | Where-Object { $_ -match '^GEMINI_API_KEY=' } | Select-Object -First 1).Split('=',2)[1]`\n- Bash (macOS/Linux): `export $(cat /path/to/.env | xargs)`\n\n**Folder Structure:**\n\n```text\nskills/q-infographics/\n|-- SKILL.md                              # Main skill file\n|-- requirements.txt                      # Python dependencies\n|-- assets/\n|   `-- Logo_Q.png                        # Brand logo, auto-overlaid on infographics\n|-- prompts/\n|   |-- story.txt                         # Story generation prompt\n|   `-- image.txt                         # Infographic generation prompt\n|-- scripts/\n|   |-- gen_story.py                      # Story generator script\n|   `-- gen_image.py                      # Image generator script\n# Sample outputs → see illustrations/q-infographics/ at repo root\n```\n\n**Example:**\n\n```\nCreate an infographic from my research paper on gamification in esports\n```\n\n**Sample Outputs:**\n\n![DIGITAL_ENTREPRENEURSHIP_INFO1](illustrations/q-infographics/DIGITAL_ENTREPRENEURSHIP_INFO1.jpg)\n\n![DIGITAL_ENTREPRENEURSHIP_INFO2](illustrations/q-infographics/DIGITAL_ENTREPRENEURSHIP_INFO2.jpg)\n\n---\n\n### q-presentations\n\nConvert content into branded slide decks with 16 visual style presets, layout-driven overlay safety, and automatic logo branding. Fork of [baoyu-slide-deck](https://github.com/JimLiu/baoyu-skills) with video-overlay-aware layout.\n\n**Triggers:**\n\n- \"Create a slide deck from this content...\"\n- \"Make a presentation about...\"\n- \"Generate slides for my talk...\"\n\n**Features:**\n\n- 16 style presets (blueprint, chalkboard, corporate, minimal, sketch-notes, watercolor, etc.)\n- Composable dimension system (texture + mood + typography + density)\n- Video-overlay-aware layout: internal layout-driven overlay-safe selection\n- Automatic Dr. Q logo branding with configurable placement and auto-invert for dark styles\n- Gemini 3.0 Pro image generation\n- PPTX and PDF export\n- Partial workflows (outline-only, prompts-only, regenerate specific slides)\n\n**Requirements:**\n\n- `pip install google-genai Pillow python-dotenv`\n- `GEMINI_API_KEY` environment variable\n- Bun available for PPTX/PDF merge scripts (`npx -y bun ...`)\n\n**Folder Structure:**\n\n```text\nq-presentations/\n|-- SKILL.md                              # Main skill file\n|-- requirements.txt                      # Python dependencies\n|-- assets/\n|   `-- Logo_Q.png                        # Brand logo, auto-overlaid on slides\n|-- references/\n|   |-- base-prompt.md                    # Image generation base prompt\n|   |-- design-guidelines.md              # Typography, colors, visual hierarchy\n|   |-- layouts.md                        # 28 layout types\n|   |-- outline-template.md               # Outline structure template\n|   |-- config/preferences-schema.md      # EXTEND.md user preferences\n|   |-- dimensions/                       # Composable style dimensions (5 files)\n|   `-- styles/                           # 22 style definitions\n`-- scripts/\n    |-- gen_slide.py                      # Gemini API image generation\n    |-- overlay_logo.py                   # Logo overlay with auto-invert\n    |-- merge-to-pptx.ts                  # PPTX merge (Bun/TS)\n    `-- merge-to-pdf.ts                   # PDF merge (Bun/TS)\n# Sample outputs → see illustrations/q-presentations/ at repo root\n```\n\n**Example:**\n\n```\nCreate a chalkboard-style slide deck from my research paper on AI agents\n```\n\n**Sample Outputs:**\n\n![01-slide-cover](illustrations/q-presentations/01-slide-cover.png)\n\n![02-slide-from-answers-to-outcomes](illustrations/q-presentations/02-slide-from-answers-to-outcomes.png)\n\n![03-slide-chatbot-vs-agent](illustrations/q-presentations/03-slide-chatbot-vs-agent.png)\n\n![04-slide-what-it-does-what-you-do](illustrations/q-presentations/04-slide-what-it-does-what-you-do.png)\n\n---\n\n### q-educator\n\nCourse content development skill for university teaching workflows. Produces interview-driven lecture outlines, demo plans, follow-up emails, assignment prompts, and per-group feedback.\n\n**Triggers:**\n\n- \"Help me design next week's lecture...\"\n- \"Draft an assignment prompt for this module...\"\n- \"Write feedback for each student group...\"\n\n**Features:**\n\n- Interview-first planning workflow before drafting\n- Projects-first teaching philosophy with domain-specific analogies\n- Structured deliverables for lecture, demo, email, assignment, and feedback\n- Iterative review checkpoints after each deliverable\n- Reference examples for assignments, lectures, emails, demos, and feedback\n\n**Folder Structure:**\n\n```text\nq-educator/\n|-- SKILL.md\n`-- references/\n    |-- assignment_example.md\n    |-- demo_example.md\n    |-- email_example.md\n    |-- feedback_example.md\n    `-- lecture_example.md\n```\n\n**Example:**\n\n```\nHelp me build a week 6 lecture + demo + assignment plan for a graduate analytics course\n```\n\n---\n## Acknowledgments\n\n- Inspired by [baoyu-skills](https://github.com/JimLiu/baoyu-skills) by Jim Liu\n- Built for use with Claude Code and compatible AI assistants\n\n## License\n\nMIT License - see [LICENSE](LICENSE) for details.\n\n## Contributing\n\nContributions welcome! Please submit issues or pull requests.\n\n"
      },
      "plugins": [
        {
          "name": "q-scholar",
          "description": "Academic manuscript writing suite (intro, methods, results, exploratory analysis)",
          "source": "./",
          "strict": false,
          "skills": [
            "./skills/q-scholar",
            "./skills/q-scholar/q-intro",
            "./skills/q-scholar/q-exploratory-analysis",
            "./skills/q-scholar/q-methods",
            "./skills/q-scholar/q-results"
          ],
          "categories": [],
          "install_commands": [
            "/plugin marketplace add TyrealQ/q-skills",
            "/plugin install q-scholar@q-skills"
          ]
        },
        {
          "name": "q-educator",
          "description": "Course content development for lectures, demos, assignments, and feedback",
          "source": "./",
          "strict": false,
          "skills": [
            "./skills/q-educator"
          ],
          "categories": [],
          "install_commands": [
            "/plugin marketplace add TyrealQ/q-skills",
            "/plugin install q-educator@q-skills"
          ]
        },
        {
          "name": "q-infographics",
          "description": "Convert documents into business stories and infographics",
          "source": "./",
          "strict": false,
          "skills": [
            "./skills/q-infographics"
          ],
          "categories": [],
          "install_commands": [
            "/plugin marketplace add TyrealQ/q-skills",
            "/plugin install q-infographics@q-skills"
          ]
        },
        {
          "name": "q-presentations",
          "description": "Convert content into branded slide decks with style presets",
          "source": "./",
          "strict": false,
          "skills": [
            "./skills/q-presentations"
          ],
          "categories": [],
          "install_commands": [
            "/plugin marketplace add TyrealQ/q-skills",
            "/plugin install q-presentations@q-skills"
          ]
        },
        {
          "name": "q-topic-finetuning",
          "description": "Consolidate topic modeling outputs into theory-driven frameworks",
          "source": "./",
          "strict": false,
          "skills": [
            "./skills/q-topic-finetuning"
          ],
          "categories": [],
          "install_commands": [
            "/plugin marketplace add TyrealQ/q-skills",
            "/plugin install q-topic-finetuning@q-skills"
          ]
        }
      ]
    }
  ]
}