{
  "author": {
    "id": "TzannetosGiannis",
    "display_name": "TzannetosGiannis",
    "avatar_url": "https://avatars.githubusercontent.com/u/32258946?v=4"
  },
  "marketplaces": [
    {
      "name": "x402-tools-claude",
      "version": null,
      "description": "Payment-gated AI tools using x402 micropayments on Base network",
      "repo_full_name": "TzannetosGiannis/x402-tools-claude",
      "repo_url": "https://github.com/TzannetosGiannis/x402-tools-claude",
      "repo_description": "Claude Code plugin for x402 payment-gated AI tools on Base network",
      "signals": {
        "stars": 0,
        "forks": 0,
        "pushed_at": "2026-01-28T15:01:36Z"
      },
      "files": {
        ".claude-plugin/marketplace.json": "{\n  \"name\": \"x402-tools-claude\",\n  \"owner\": {\n    \"name\": \"TzannetosGiannis\",\n    \"email\": \"george@402box.io\"\n  },\n  \"metadata\": {\n    \"description\": \"Payment-gated AI tools using x402 micropayments on Base network\"\n  },\n  \"plugins\": [\n    {\n      \"name\": \"x402-tools\",\n      \"source\": \"./\",\n      \"description\": \"X/Twitter search and OSINT research tools with x402 payments (skills-based)\",\n      \"version\": \"2.1.0\"\n    }\n  ]\n}\n",
        ".claude-plugin/plugin.json": "{\n  \"name\": \"x402-tools\",\n  \"description\": \"Payment-gated AI tools using x402 micropayments on Base network. Access X/Twitter search and OSINT research tools via skills.\",\n  \"version\": \"2.1.0\",\n  \"author\": {\n    \"name\": \"TzannetosGiannis\",\n    \"email\": \"george@402box.io\"\n  },\n  \"homepage\": \"https://github.com/TzannetosGiannis/x402-tools-claude\",\n  \"repository\": \"https://github.com/TzannetosGiannis/x402-tools-claude\",\n  \"license\": \"MIT\",\n  \"keywords\": [\n    \"x402\",\n    \"payments\",\n    \"micropayments\",\n    \"USDC\",\n    \"Base\",\n    \"AI\",\n    \"tools\",\n    \"OSINT\",\n    \"Twitter\",\n    \"search\"\n  ]\n}\n",
        "README.md": "# X402 Tools Plugin for Claude Code\n\nPayment-gated AI tools using x402 micropayments on Base network. Access powerful X/Twitter search and OSINT research tools directly from Claude Code via skills.\n\n## Features\n\n### X Search ($0.05 USDC/request)\nAI-powered X/Twitter search agent for:\n- Real-time trends and breaking news\n- Social media sentiment analysis\n- Viral content tracking\n- Public opinion research\n\n### Find People ($0.15 USDC/request)\nOpen Source Intelligence (OSINT) agent for:\n- Professional background research\n- Career timeline verification\n- Due diligence on potential hires/partners\n- Competitive intelligence on industry leaders\n- Investor research on startup founders\n\n### Alpha Finder ($0.03 USDC/request)\nMarket Oracle for prediction market intelligence:\n- Polymarket event research\n- Kalshi market analysis\n- Searches web, GitHub, Reddit, and X\n- Probability assessments and market sentiment\n- Arbitrage opportunity identification\n\n## Prerequisites\n\n- [Claude Code](https://docs.anthropic.com/en/docs/claude-code) v1.0.33+\n- Ethereum wallet with USDC on Base network\n- **NO gas needed** - x402 handles transaction costs\n\n## Installation\n\n### Option 1: Install via Claude Code (Recommended)\n\nInside Claude Code, run:\n\n```\n/plugin marketplace add TzannetosGiannis/x402-tools-claude\n/plugin install x402-tools@x402-tools-claude\n```\n\n### Option 2: Install from Source\n\n```bash\ngit clone https://github.com/TzannetosGiannis/x402-tools-claude.git\ncd x402-tools-claude\nnpm install\nnpm run build\n```\n\nThen load the plugin:\n\n```bash\nclaude --plugin-dir .\n```\n\n## Configuration\n\nYou need to provide your Ethereum private key to sign payment transactions. The plugin checks for the key in this order:\n\n### Option 1: Configuration File (Recommended)\n\nCreate `.claude/x402-tools.json` in your project directory:\n\n```json\n{\n  \"private_key\": \"your_private_key_here\"\n}\n```\n\n### Option 2: Environment Variable\n\nSet `X402_PRIVATE_KEY` in your `.env` file:\n\n```bash\nX402_PRIVATE_KEY=your_private_key_here\n```\n\n> **Security Warning**:\n> - Never commit your private key to version control\n> - Use a dedicated wallet with only the USDC you need for testing\n> - The `.claude/x402-tools.json` file is automatically gitignored\n\n## Usage\n\nOnce the plugin is installed, Claude will have access to two new skills that it can use automatically:\n\n### X Search\nJust ask Claude to search Twitter/X:\n```\n\"What are people saying about AI agents on Twitter?\"\n```\n\nClaude will use the `x-search` skill automatically.\n\n### Find People\nAsk Claude to research someone:\n```\n\"Find information about the founder of Ethereum\"\n```\n\nClaude will use the `find-people` skill automatically.\n\n## How It Works\n\n```\n┌─────────────┐     ┌─────────────┐     ┌─────────────┐     ┌─────────────┐\n│ Claude Code │────▶│   Skills    │────▶│ x402-axios  │────▶│ 402box.io   │\n│             │     │ (npx CLI)   │     │ (payment)   │     │ (AI agents) │\n└─────────────┘     └─────────────┘     └─────────────┘     └─────────────┘\n                           │\n                           ▼\n                    ┌─────────────┐\n                    │ Base Chain  │\n                    │ (USDC pay)  │\n                    └─────────────┘\n```\n\n1. You ask Claude to search Twitter or research a person\n2. Claude recognizes the task and uses the appropriate skill\n3. The skill runs the CLI via npx\n4. The x402-axios interceptor automatically signs a USDC payment\n5. The 402box.io API processes your request\n6. Results are returned to Claude\n\n## CLI Usage (Direct)\n\nYou can also use the CLI directly:\n\n```bash\n# X/Twitter search\nnpx @itzannetos/x402-tools-claude x-search \"AI trends 2024\"\n\n# Find people\nnpx @itzannetos/x402-tools-claude find-people \"Vitalik Buterin\"\n\n# Alpha finder (prediction markets)\nnpx @itzannetos/x402-tools-claude alpha-finder \"Bitcoin 100k prediction market odds\"\n```\n\n## Troubleshooting\n\n### \"X402 private key missing\"\nMake sure you've configured your private key in either `.claude/x402-tools.json` or the `X402_PRIVATE_KEY` environment variable.\n\n### \"Not enough USDC in your wallet\"\nYour wallet needs USDC on the Base network. You can:\n1. Bridge USDC from Ethereum mainnet to Base\n2. Buy USDC on Base through an exchange\n3. Use a faucet for testing (if available)\n\n### Skills not appearing\n1. Make sure you're using Claude Code v1.0.33 or later\n2. Check that the plugin is installed: `/plugin` → Installed tab\n3. Try reinstalling the plugin\n\n## Contributing\n\nContributions are welcome! Please open an issue or submit a pull request.\n\n## Support\n\n- GitHub Issues: [Report bugs](https://github.com/TzannetosGiannis/x402-tools-claude/issues)\n- Email: george@402box.io\n\n## License\n\nMIT License - see [LICENSE](LICENSE) for details.\n\n## Credits\n\nBuilt on top of the [x402 protocol](https://402box.io) for micropayments on Base network.\n"
      },
      "plugins": [
        {
          "name": "x402-tools",
          "source": "./",
          "description": "X/Twitter search and OSINT research tools with x402 payments (skills-based)",
          "version": "2.1.0",
          "categories": [],
          "install_commands": [
            "/plugin marketplace add TzannetosGiannis/x402-tools-claude",
            "/plugin install x402-tools@x402-tools-claude"
          ]
        }
      ]
    }
  ]
}