{
  "author": {
    "id": "unicorn-plugins",
    "display_name": "unicorn-plugins",
    "avatar_url": "https://avatars.githubusercontent.com/u/260866609?v=4"
  },
  "marketplaces": [
    {
      "name": "unicorn",
      "version": null,
      "description": null,
      "repo_full_name": "unicorn-plugins/dmap",
      "repo_url": "https://github.com/unicorn-plugins/dmap",
      "repo_description": "Declarative Multi-Agent Orchestration: Applying Clean Architecture Principles to LLM Agent Systems via Markdown and YAMLì„ ì–¸ì  ë°©ì‹ì˜ ë©€í‹° ì—ì´ì ¼íŠ¸ ì˜¤ì¼€ìŠ¤íŠ¸ë ˆì´ì…˜ í”ŒëŸ¬ê·¸ì¸ ê°œë°œê¸° ",
      "signals": {
        "stars": 2,
        "forks": 0,
        "pushed_at": "2026-02-11T20:17:54Z"
      },
      "files": {
        ".claude-plugin/marketplace.json": "{\n  \"$schema\": \"https://anthropic.com/claude-code/marketplace.schema.json\",\n  \"name\": \"unicorn\",\n  \"owner\": {\n    \"name\": \"Unicorn Inc.\"\n  },\n  \"plugins\": [\n    {\n      \"name\": \"dmap\",\n      \"source\": \"./\",\n      \"category\": \"development\"\n    }\n  ]\n}\n",
        ".claude-plugin/plugin.json": "{\n  \"name\": \"dmap\",\n  \"version\": \"1.0.5\",\n  \"description\": \"ì„ ì–¸í˜• ë©€í‹°ì—ì´ì „íŠ¸ í”ŒëŸ¬ê·¸ì¸(DMAP) ë¹Œë”\",\n  \"author\": {\n    \"name\": \"Unicorn Inc.\"\n  },\n  \"repository\": \"https://github.com/unicorn-plugins/dmap\",\n  \"homepage\": \"https://github.com/unicorn-plugins/dmap\",\n  \"license\": \"MIT\",\n  \"keywords\": [\"dmap\", \"plugin\", \"multi-agent\", \"builder\", \"declarative\"]\n}\n",
        "README.md": "ðŸ‡°ðŸ‡· [í•œêµ­ì–´](#dmap-ë¹Œë”) | ðŸ‡ºðŸ‡¸ [English](#dmap-builder)\n\n# DMAP ë¹Œë”\n\n> ì½”ë“œ ì—†ì´ ë©€í‹°ì—ì´ì „íŠ¸ í”ŒëŸ¬ê·¸ì¸ì„ ë§Œë“œëŠ” ì„ ì–¸í˜• í”„ë ˆìž„ì›Œí¬\n\n- [DMAP ë¹Œë”](#dmap-ë¹Œë”)\n  - [ê°œìš”](#ê°œìš”)\n    - [ë¬¸ì œ: ê¸°ì¡´ ë©€í‹°ì—ì´ì „íŠ¸ ê°œë°œì˜ ë¶ˆíŽ¸í•¨](#ë¬¸ì œ-ê¸°ì¡´-ë©€í‹°ì—ì´ì „íŠ¸-ê°œë°œì˜-ë¶ˆíŽ¸í•¨)\n    - [DMAPì˜ í•´ê²° ë°©ì‹](#dmapì˜-í•´ê²°-ë°©ì‹)\n    - [í•µì‹¬ ê°€ì¹˜](#í•µì‹¬-ê°€ì¹˜)\n    - [ê¸°ì¡´ í”„ë ˆìž„ì›Œí¬ vs DMAP](#ê¸°ì¡´-í”„ë ˆìž„ì›Œí¬-vs-dmap)\n  - [í•µì‹¬ ê°œë…](#í•µì‹¬-ê°œë…)\n    - [Skills = ë¶€ì„œìž¥](#skills--ë¶€ì„œìž¥)\n    - [Agents = ì „ë¬¸ê°€](#agents--ì „ë¬¸ê°€)\n    - [Gateway = í†µì—­ì‚¬](#gateway--í†µì—­ì‚¬)\n    - [ë¦¬ì†ŒìŠ¤ ë§ˆì¼“í”Œë ˆì´ìŠ¤ = ì‚¬ë‚´ ê³µìœ  ë“œë¼ì´ë¸Œ](#ë¦¬ì†ŒìŠ¤-ë§ˆì¼“í”Œë ˆì´ìŠ¤--ì‚¬ë‚´-ê³µìœ -ë“œë¼ì´ë¸Œ)\n    - [ì•„í‚¤í…ì²˜ (Clean Architecture)](#ì•„í‚¤í…ì²˜-clean-architecture)\n  - [ë™ìž‘ ì›ë¦¬](#ë™ìž‘-ì›ë¦¬)\n    - [í”„ë¡¬í”„íŠ¸ ì¡°ë¦½](#í”„ë¡¬í”„íŠ¸-ì¡°ë¦½)\n    - [4-Tier ëª¨ë¸ ë§¤í•‘](#4-tier-ëª¨ë¸-ë§¤í•‘)\n    - [ìŠ¤í‚¬ í™œì„±í™” ê²½ë¡œ](#ìŠ¤í‚¬-í™œì„±í™”-ê²½ë¡œ)\n  - [ì„ ì–¸í˜• A2A (í¬ë¡œìŠ¤-í”ŒëŸ¬ê·¸ì¸ ìœ„ìž„)](#ì„ ì–¸í˜•-a2a-í¬ë¡œìŠ¤-í”ŒëŸ¬ê·¸ì¸-ìœ„ìž„)\n    - [ê¸°ì¡´ A2A vs DMAP ì„ ì–¸í˜• A2A](#ê¸°ì¡´-a2a-vs-dmap-ì„ ì–¸í˜•-a2a)\n    - [ë™ìž‘ ë°©ì‹](#ë™ìž‘-ë°©ì‹)\n  - [DMAP ìƒíƒœê³„](#dmap-ìƒíƒœê³„)\n  - [ë¹ ë¥¸ ì‹œìž‘](#ë¹ ë¥¸-ì‹œìž‘)\n    - [ì‚¬ì „ ìš”êµ¬ì‚¬í•­](#ì‚¬ì „-ìš”êµ¬ì‚¬í•­)\n    - [DMAP ë¹Œë” ì„¤ì¹˜](#dmap-ë¹Œë”-ì„¤ì¹˜)\n    - [ì‚¬ìš©](#ì‚¬ìš©)\n  - [í”ŒëŸ¬ê·¸ì¸ ê°œë°œ ì›Œí¬í”Œë¡œìš°](#í”ŒëŸ¬ê·¸ì¸-ê°œë°œ-ì›Œí¬í”Œë¡œìš°)\n  - [í”„ë¡œì íŠ¸ êµ¬ì¡°](#í”„ë¡œì íŠ¸-êµ¬ì¡°)\n  - [í‘œì¤€ ë¬¸ì„œ](#í‘œì¤€-ë¬¸ì„œ)\n  - [ì‹¤ì „ ì˜ˆì œ](#ì‹¤ì „-ì˜ˆì œ)\n    - [ì—ì´ì „íŠ¸ êµ¬ì„± (5ëª…ì˜ ì „ë¬¸ê°€)](#ì—ì´ì „íŠ¸-êµ¬ì„±-5ëª…ì˜-ì „ë¬¸ê°€)\n    - [ìŠ¤í‚¬ êµ¬ì„± (9ê°œ ì›Œí¬í”Œë¡œìš°)](#ìŠ¤í‚¬-êµ¬ì„±-9ê°œ-ì›Œí¬í”Œë¡œìš°)\n  - [ë¡œë“œë§µ](#ë¡œë“œë§µ)\n  - [ë¼ì´ì„ ìŠ¤](#ë¼ì´ì„ ìŠ¤)\n- [DMAP Builder](#dmap-builder)\n  - [Overview](#overview)\n    - [Problem: Complexity of Traditional Multi-Agent Development](#problem-complexity-of-traditional-multi-agent-development)\n    - [How DMAP Solves It](#how-dmap-solves-it)\n    - [Core Values](#core-values)\n    - [Traditional Frameworks vs DMAP](#traditional-frameworks-vs-dmap)\n  - [Core Concepts](#core-concepts)\n    - [Skills = Department Heads](#skills--department-heads)\n    - [Agents = Specialists](#agents--specialists)\n    - [Gateway = Interpreter](#gateway--interpreter)\n    - [Resource Marketplace = Shared Drive](#resource-marketplace--shared-drive)\n    - [Architecture (Clean Architecture)](#architecture-clean-architecture)\n  - [How It Works](#how-it-works)\n    - [Prompt Assembly](#prompt-assembly)\n    - [4-Tier Model Mapping](#4-tier-model-mapping)\n    - [Skill Activation Paths](#skill-activation-paths)\n  - [Declarative A2A (Cross-Plugin Delegation)](#declarative-a2a-cross-plugin-delegation)\n    - [Traditional A2A vs DMAP Declarative A2A](#traditional-a2a-vs-dmap-declarative-a2a)\n    - [How Declarative A2A Works](#how-declarative-a2a-works)\n  - [Quick Start](#quick-start)\n    - [Prerequisites](#prerequisites)\n    - [DMAP Builder Installation](#dmap-builder-installation)\n    - [Usage](#usage)\n  - [Plugin Development Workflow](#plugin-development-workflow)\n  - [Project Structure](#project-structure)\n  - [Standards](#standards)\n  - [Practical Example](#practical-example)\n    - [Agent Composition (5 Specialists)](#agent-composition-5-specialists)\n    - [Skill Composition (9 Workflows)](#skill-composition-9-workflows)\n  - [Roadmap](#roadmap)\n  - [License](#license)\n\n---\n\n## ê°œìš”\n\n**DMAP (Declarative Multi-Agent Plugin)** ì€\nì½”ë“œ ì—†ì´ **Markdown(í”„ë¡¬í”„íŠ¸)ê³¼ YAML(ì„¤ì •)ë§Œìœ¼ë¡œ**\në©€í‹°ì—ì´ì „íŠ¸ ì‹œìŠ¤í…œì„ ì •ì˜í•˜ëŠ” ì„ ì–¸í˜• í”ŒëŸ¬ê·¸ì¸ ì•„í‚¤í…ì²˜ í‘œì¤€ìž„.\n\n### ë¬¸ì œ: ê¸°ì¡´ ë©€í‹°ì—ì´ì „íŠ¸ ê°œë°œì˜ ë¶ˆíŽ¸í•¨\n\nì—ì´ì „íŠ¸ 1ê°œëŠ” ê´œì°®ì§€ë§Œ, ì—¬ëŸ¬ ì—ì´ì „íŠ¸ê°€ í˜‘ì—…í•´ì•¼ í•˜ëŠ” ìˆœê°„\në³µìž¡ë„ê°€ í­ë°œì ìœ¼ë¡œ ì¦ê°€í•¨. ê¸°ì¡´ ë°©ì‹ì˜ í•œê³„ëŠ” ë‹¤ìŒê³¼ ê°™ìŒ:\n\n- **ë†’ì€ ì§„ìž…ìž¥ë²½** -- LangChain, CrewAI, AutoGen ë“± í”„ë ˆìž„ì›Œí¬ë³„ SDK í•™ìŠµ í•„ìš”\n- **ëŸ°íƒ€ìž„ ì¢…ì†** -- íŠ¹ì • í”„ë ˆìž„ì›Œí¬ì— ê°•ê²°í•©ë˜ì–´ ì´ì‹ì„±ì´ ë‚®ìŒ\n- **ìœ ì§€ë³´ìˆ˜ ì–´ë ¤ì›€** -- ì½”ë“œ ê¸°ë°˜ ì •ì˜ëŠ” ë³€ê²½ ì‹œ ì „ì²´ ìž¬ìž‘ì„± í•„ìš”\n\n> \"ì—ì´ì „íŠ¸ë¥¼ ì •ì˜í•˜ëŠ” ë° ê¼­ ì½”ë“œê°€ í•„ìš”í• ê¹Œ?\"\n\n### DMAPì˜ í•´ê²° ë°©ì‹\n\n\"ì–´ë–»ê²Œ(HOW)\" ëŒ€ì‹  \"ë¬´ì—‡ì„(WHAT)\"ë§Œ ì„ ì–¸í•˜ëŠ” ë°©ì‹ìž„.\níƒì‹œ ê¸°ì‚¬ì—ê²Œ ê²½ë¡œë¥¼ ì¼ì¼ì´ ì§€ì‹œí•˜ëŠ” ëŒ€ì‹  \"ê°•ë‚¨ì—­ì´ìš”\"ë¼ê³  ëª©ì ì§€ë§Œ ë§í•˜ëŠ” ê²ƒê³¼ ë™ì¼í•¨.\n\n### í•µì‹¬ ê°€ì¹˜\n\n| ê°€ì¹˜ | ì„¤ëª… |\n|------|------|\n| **ì„ ì–¸í˜• ëª…ì„¸** | ì½”ë“œ ëŒ€ì‹  Markdown + YAMLë¡œ ì—ì´ì „íŠ¸ ì •ì˜ |\n| **ëŸ°íƒ€ìž„ ì¤‘ë¦½** | Claude Code, Codex CLI ë“± ì–´ë–¤ ëŸ°íƒ€ìž„ì—ì„œë“  ë™ìž‘ |\n| **ê´€ì‹¬ì‚¬ ë¶„ë¦¬** | Skills(ë¼ìš°íŒ…) -> Agents(ì‹¤í–‰) -> Gateway(ë§¤í•‘) ë‹¨ë°©í–¥ ì˜ì¡´ |\n| **ë¹„ê°œë°œìž ì ‘ê·¼ì„±** | Markdown ìž‘ì„± ê°€ëŠ¥í•˜ë©´ ëˆ„êµ¬ë‚˜ í”ŒëŸ¬ê·¸ì¸ êµ¬ì¶• ê°€ëŠ¥ |\n| **ë„ë©”ì¸ ë²”ìš©** | ì½”ë“œ ìƒì„±, êµìœ¡, ë¬¸ì„œí™”, ë¹„ì¦ˆë‹ˆìŠ¤ ì›Œí¬í”Œë¡œìš° ë“± ì–´ë–¤ ë„ë©”ì¸ì—ë„ ì ìš© ê°€ëŠ¥ |\n\n> **í˜„ìž¬ ë²„ì „ ì•ˆë‚´ (2026.2ì›”)**:\n> í˜„ìž¬ DMAP ë¹Œë”ëŠ” **Claude Code ì „ìš©**ìœ¼ë¡œ ì œê³µë¨.\n> DMAP í‘œì¤€ ìžì²´ëŠ” ëŸ°íƒ€ìž„ ì¤‘ë¦½ì ìœ¼ë¡œ ì„¤ê³„ë˜ì—ˆìœ¼ë©°, í–¥í›„ Codex CLI, Gemini CLI ë“±\n> **ë©€í‹° ëŸ°íƒ€ìž„ ì§€ì›ìœ¼ë¡œ í™•ìž¥ ì˜ˆì •**ìž„.\n\n### ê¸°ì¡´ í”„ë ˆìž„ì›Œí¬ vs DMAP\n\n| ë¹„êµ í•­ëª© | ê¸°ì¡´ í”„ë ˆìž„ì›Œí¬ (LangChain, CrewAI ë“±) | DMAP |\n|-----------|:--------------------------------------:|:----:|\n| ì—ì´ì „íŠ¸ ì •ì˜ | Python/TypeScript SDK ì½”ë“œ | Markdown + YAML |\n| ì˜¤ì¼€ìŠ¤íŠ¸ë ˆì´ì…˜ | ê·¸ëž˜í”„/í•¨ìˆ˜ í˜¸ì¶œ ì²´ì¸ ì½”ë“œ | ìŠ¤í‚¬ í”„ë¡¬í”„íŠ¸(ìžì—°ì–´) |\n| ëŸ°íƒ€ìž„ ì¢…ì†ì„± | íŠ¹ì • SDKì— ê°•ê²°í•© | ëŸ°íƒ€ìž„ ì¤‘ë¦½ |\n| ë„êµ¬ ì—°ê²° | ì½”ë“œì—ì„œ ë„êµ¬ ê°ì²´ ìƒì„± | ì¶”ìƒ ì„ ì–¸ -> Gateway ë§¤í•‘ |\n| í‹°ì–´ ê´€ë¦¬ | ì—†ìŒ | 4-Tier ìžë™ ë§¤í•‘ |\n| ì´ì‹ì„± | ë‚®ìŒ (ì „ì²´ ìž¬ìž‘ì„±) | ë†’ìŒ (runtime-mapping.yamlë§Œ êµì²´) |\n\n```\nê¸°ì¡´:  Developer writes Python code  -> Framework executes agents\nDMAP:  Anyone writes Markdown/YAML   -> Any Runtime executes agents\n```\n\n[Top](#dmap-ë¹Œë”)\n\n---\n\n## í•µì‹¬ ê°œë…\n\nDMAPì˜ êµ¬ì¡°ë¥¼ íšŒì‚¬ ì¡°ì§ì— ë¹„ìœ í•˜ë©´ ì´í•´í•˜ê¸° ì‰¬ì›€.\n\n### Skills = ë¶€ì„œìž¥\n\nì¼ì„ ë°°ë¶„í•˜ëŠ” ë¶€ì„œìž¥ ì—­í• .\nì‚¬ìš©ìžì˜ ìš”ì²­ì„ ë°›ì•„ ì–´ë–¤ ì—ì´ì „íŠ¸ì—ê²Œ ì–´ë–¤ ì¼ì„ ì‹œí‚¬ì§€ ê²°ì •í•¨.\n`SKILL.md` íŒŒì¼ í•˜ë‚˜ë¡œ ì›Œí¬í”Œë¡œìš° ì „ì²´ë¥¼ ì„ ì–¸.\n\n| í•­ëª© | ë‚´ìš© |\n|------|------|\n| í•µì‹¬ íŒŒì¼ | `skills/{name}/SKILL.md` |\n| ì—­í•  | ë¼ìš°íŒ… + ì˜¤ì¼€ìŠ¤íŠ¸ë ˆì´ì…˜ |\n| ìœ í˜• | core, setup, orchestrator, planning |\n\n### Agents = ì „ë¬¸ê°€\n\nì‹¤ì œ ì¼ì„ ìˆ˜í–‰í•˜ëŠ” ì „ë¬¸ê°€.\nê° ì—ì´ì „íŠ¸ëŠ” 3ê°œ íŒŒì¼ë¡œ êµ¬ì„±ë¨.\n\n| íŒŒì¼ | ì—­í•  |\n|------|------|\n| `AGENT.md` | ì—­í•  ì •ì˜ (ëª©í‘œ, ì›Œí¬í”Œë¡œìš°, ì¶œë ¥ í˜•ì‹) |\n| `agentcard.yaml` | ë©”íƒ€ë°ì´í„° (ì´ë¦„, ë²„ì „, í‹°ì–´, ì œì•½) |\n| `tools.yaml` | ì‚¬ìš© ê°€ëŠ¥í•œ ë„êµ¬ ì¶”ìƒ ì„ ì–¸ |\n\n### Gateway = í†µì—­ì‚¬\n\nì¶”ìƒì ì¸ ì„ ì–¸ì„ êµ¬ì²´ì ì¸ ì‹¤í–‰ í™˜ê²½ìœ¼ë¡œ ë²ˆì—­í•˜ëŠ” í†µì—­ì‚¬.\nì—ì´ì „íŠ¸ê°€ \"íŒŒì¼ ê²€ìƒ‰ ë„êµ¬\"ë¼ê³  ì„ ì–¸í•˜ë©´,\nGatewayê°€ ì‹¤ì œ ëŸ°íƒ€ìž„ì—ì„œ ì–´ë–¤ ë„êµ¬ë¥¼ ì“¸ì§€ ë§¤í•‘í•¨.\n\n| íŒŒì¼ | ì—­í•  |\n|------|------|\n| `install.yaml` | MCP/LSP ì„œë²„, ì»¤ìŠ¤í…€ ë„êµ¬ ì„¤ì¹˜ ì„ ì–¸ |\n| `runtime-mapping.yaml` | í‹°ì–´ ë§¤í•‘, ë„êµ¬ ë§¤í•‘, ì•¡ì…˜ ë§¤í•‘ |\n\n### ë¦¬ì†ŒìŠ¤ ë§ˆì¼“í”Œë ˆì´ìŠ¤ = ì‚¬ë‚´ ê³µìœ  ë“œë¼ì´ë¸Œ\n\nê°€ì´ë“œ, í…œí”Œë¦¿, ìƒ˜í”Œ, ë„êµ¬ë¥¼ ëª¨ì•„ë‘” ê³µìœ  ì €ìž¥ì†Œ.\nì—¬ëŸ¬ í”ŒëŸ¬ê·¸ì¸ì´ í•¨ê»˜ ì‚¬ìš©í•  ìˆ˜ ìžˆëŠ” ê³µìš© ìžì› í’€.\n\n| ë¶„ë¥˜ | ê²½ë¡œ | ìš©ë„ |\n|------|------|------|\n| ê°€ì´ë“œ | `resources/guides/` | ê¸°ìˆ  ì°¸ì¡° ë¬¸ì„œ |\n| í…œí”Œë¦¿ | `resources/templates/` | ì‚°ì¶œë¬¼ ìƒì„± í…œí”Œë¦¿ |\n| ìƒ˜í”Œ | `resources/samples/` | êµ¬í˜„ ì°¸ê³  ìƒ˜í”Œ |\n| ë„êµ¬ | `resources/tools/` | ì»¤ìŠ¤í…€ ì•±/CLI ë„êµ¬ |\n\n### ì•„í‚¤í…ì²˜ (Clean Architecture)\n\nì´ ì»´í¬ë„ŒíŠ¸ë“¤ì€ Clean Architecture ì›ì¹™ì„ ë”°ë¦„.\nSkills -> Agents -> Gateway ìˆœì„œë¡œ ë‹¨ë°©í–¥ ì˜ì¡´í•˜ë¯€ë¡œ,\nê° ë¶€ë¶„ì„ ë…ë¦½ì ìœ¼ë¡œ ìˆ˜ì •í•˜ê±°ë‚˜ êµì²´ ê°€ëŠ¥í•¨.\n\n```\nìœ„ìž„í˜•:  Input -> Skills(Controller) -> Agents(Service) -> Gateway -> Runtime\nì§ê²°í˜•:  Input -> Skills(Controller) ----------------------> Gateway -> Runtime\n```\n\n[Top](#dmap-ë¹Œë”)\n\n---\n\n## ë™ìž‘ ì›ë¦¬\n\n### í”„ë¡¬í”„íŠ¸ ì¡°ë¦½\n\nDMAPì€ 3ë‹¨ê³„ ë ˆì´ì–´ë¡œ í”„ë¡¬í”„íŠ¸ë¥¼ ì¡°ë¦½í•¨.\n\n| ë‹¨ê³„ | ì†ŒìŠ¤ | ë‚´ìš© |\n|------|------|------|\n| 1. ê³µí†µ ì •ì  | Gateway `runtime-mapping.yaml` | ëŸ°íƒ€ìž„ ê³µí†µ ì„¤ì • (í‹°ì–´ ë§¤í•‘, ë„êµ¬ ë§¤í•‘) |\n| 2. ì—ì´ì „íŠ¸ë³„ ì •ì  | `AGENT.md` + `agentcard.yaml` + `tools.yaml` | ì—ì´ì „íŠ¸ ì—­í• , ë©”íƒ€ë°ì´í„°, ë„êµ¬ ì„ ì–¸ |\n| 3. ë™ì  | ìŠ¤í‚¬ì´ ì „ë‹¬í•˜ëŠ” ìž‘ì—… ì§€ì‹œ | ì‚¬ìš©ìž ìš”ì²­ ê¸°ë°˜ êµ¬ì²´ ìž‘ì—… ë‚´ìš© |\n\ní•´ì™¸ì—¬í–‰ ê°€ì´ë“œë¶ì— ë¹„ìœ í•˜ë©´:\nê¸°ë³¸ ì •ë³´(ê³µí†µ ê·œì¹™) + ëª©ì ì§€ë³„ ì •ë³´(ì—ì´ì „íŠ¸ ì—­í• ) + ì˜¤ëŠ˜ì˜ ì¼ì •(ìž‘ì—… ì§€ì‹œ) = ì™„ì„±ëœ ê°€ì´ë“œë¶.\n\n### 4-Tier ëª¨ë¸ ë§¤í•‘\n\nìž‘ì—…ì˜ ë³µìž¡ë„ì— ë”°ë¼ 4ë‹¨ê³„ë¡œ ë‚˜ëˆ„ê³ , ê° ë‹¨ê³„ì— ì í•©í•œ AI ëª¨ë¸ì„ ë°°ì •í•¨.\nê°„ë‹¨í•œ íŒŒì¼ ê²€ìƒ‰ì€ ê°€ë²¼ìš´ ëª¨ë¸ì´, ë³µìž¡í•œ ì•„í‚¤í…ì²˜ ì„¤ê³„ëŠ” ê°•ë ¥í•œ ëª¨ë¸ì´ ë‹´ë‹¹í•¨.\n\n| Tier | ìš©ë„ | Claude ë§¤í•‘ ì˜ˆì‹œ |\n|------|------|-----------------|\n| HEAVY | ê·¹ë„ë¡œ ë³µìž¡í•œ ì¶”ë¡ , ì „ëžµ ìˆ˜ë¦½ | Opus (max thinking) |\n| HIGH | ë³µìž¡í•œ ë¶„ì„, ì•„í‚¤í…ì²˜ ì„¤ê³„ | Opus |\n| MEDIUM | í‘œì¤€ êµ¬í˜„, ì¼ë°˜ ìž‘ì—… | Sonnet |\n| LOW | ë‹¨ìˆœ ì¡°íšŒ, íŒŒì¼ ê²€ìƒ‰ | Haiku |\n\nìž‘ì—… ì¤‘ ë‚œì´ë„ê°€ ì˜¬ë¼ê°€ë©´ ìžë™ìœ¼ë¡œ ìƒìœ„ ëª¨ë¸ë¡œ ì—ìŠ¤ì»¬ë ˆì´ì…˜ë¨.\n\n### ìŠ¤í‚¬ í™œì„±í™” ê²½ë¡œ\n\në‘ ê°€ì§€ ê²½ë¡œë¡œ ìŠ¤í‚¬ì´ í™œì„±í™”ë¨:\n\n1. **ì§ì ‘ í˜¸ì¶œ** -- ìŠ¬ëž˜ì‹œ ëª…ë ¹ì–´(`/dmap:develop-plugin`)ë¡œ ì •í™•ížˆ ì›í•˜ëŠ” ìŠ¤í‚¬ì„ í˜¸ì¶œ\n2. **Core ê²½ìœ ** -- ëª¨í˜¸í•œ ìš”ì²­ì´ ë“¤ì–´ì˜¤ë©´ Core ìŠ¤í‚¬ì´ ì˜ë„ë¥¼ ë¶„ì„í•˜ì—¬ ì ì ˆí•œ ìŠ¤í‚¬ë¡œ ë¼ìš°íŒ…\n\nëŸ°íƒ€ìž„ì€ `skills/` ë””ë ‰í† ë¦¬ë¥¼ ìžë™ ìŠ¤ìº”í•˜ì—¬ ì‚¬ìš© ê°€ëŠ¥í•œ ìŠ¤í‚¬ì„ ë°œê²¬í•¨.\n\n[Top](#dmap-ë¹Œë”)\n\n---\n\n## ì„ ì–¸í˜• A2A (í¬ë¡œìŠ¤-í”ŒëŸ¬ê·¸ì¸ ìœ„ìž„)\n\nDMAPì€ í”ŒëŸ¬ê·¸ì¸ ê°„ í˜‘ì—…ì„ **External ìŠ¤í‚¬(ext-{})** íŒ¨í„´ìœ¼ë¡œ í•´ê²°í•¨.\nê¸°ì¡´ A2A(Agent-to-Agent) í”„ë¡œí† ì½œì´ HTTP ì—”ë“œí¬ì¸íŠ¸, Agent Card, ë©”ì‹œì§€ ë²„ìŠ¤ ë“±\nì¸í”„ë¼ë¥¼ ìš”êµ¬í•˜ëŠ” ë°˜ë©´, DMAPì€ **ë§ˆí¬ë‹¤ìš´ í•œ ìž¥**ìœ¼ë¡œ í¬ë¡œìŠ¤-í”ŒëŸ¬ê·¸ì¸ ìœ„ìž„ì„ êµ¬í˜„í•¨.\n\n### ê¸°ì¡´ A2A vs DMAP ì„ ì–¸í˜• A2A\n\n| ë¹„êµ í•­ëª© | ê¸°ì¡´ A2A (Google A2A ë“±) | DMAP ì„ ì–¸í˜• A2A |\n|-----------|:----------------------:|:--------------:|\n| í†µì‹  ë°©ì‹ | HTTP/JSON-RPC ì—”ë“œí¬ì¸íŠ¸ | Skillâ†’Skill í˜¸ì¶œ (FQN) |\n| ì¸í„°íŽ˜ì´ìŠ¤ ì„ ì–¸ | Agent Card (JSON) | í”ŒëŸ¬ê·¸ì¸ ëª…ì„¸ì„œ (Markdown) |\n| ì¸í”„ë¼ ìš”êµ¬ì‚¬í•­ | ì„œë¹„ìŠ¤ ë””ìŠ¤ì»¤ë²„ë¦¬, ë©”ì‹œì§€ ë²„ìŠ¤ | ì—†ìŒ (Zero Infrastructure) |\n| ì—°ë™ ì½”ë“œ | SDK ê¸°ë°˜ í´ë¼ì´ì–¸íŠ¸ ì½”ë“œ | ext-{} ìŠ¤í‚¬ ìžë™ ìƒì„± |\n| ë¼ì´í”„ì‚¬ì´í´ ê´€ë¦¬ | ìˆ˜ë™ êµ¬í˜„ | add/remove-ext-skill ìœ í‹¸ë¦¬í‹° |\n\n### ë™ìž‘ ë°©ì‹\n\n1. **í”ŒëŸ¬ê·¸ì¸ ëª…ì„¸ì„œ ê³µê°œ** â€” ëŒ€ìƒ í”ŒëŸ¬ê·¸ì¸ì´ ë¦¬ì†ŒìŠ¤ ë§ˆì¼“í”Œë ˆì´ìŠ¤ì— ëª…ì„¸ì„œ(FQN, ARGS ìŠ¤í‚¤ë§ˆ, ì‹¤í–‰ ê²½ë¡œ)ë¥¼ ë“±ë¡\n2. **ext-{} ìŠ¤í‚¬ ìƒì„±** â€” `/add-ext-skill` ìœ í‹¸ë¦¬í‹°ë¡œ ëª…ì„¸ì„œ ê¸°ë°˜ External ìŠ¤í‚¬ ìžë™ ìƒì„±\n3. **Skillâ†’Skill ìœ„ìž„** â€” í˜¸ì¶œ ì¸¡ì´ ë„ë©”ì¸ ì»¨í…ìŠ¤íŠ¸ë¥¼ ìˆ˜ì§‘í•˜ì—¬ FQNìœ¼ë¡œ ëŒ€ìƒ ìŠ¤í‚¬ í˜¸ì¶œ\n4. **ë¼ì´í”„ì‚¬ì´í´ ê´€ë¦¬** â€” `/remove-ext-skill`ë¡œ ë” ì´ìƒ í•„ìš” ì—†ëŠ” ì—°ë™ì„ ê¹”ë”í•˜ê²Œ ì œê±°\n\n```\nTraditional A2A:  HTTP endpoints + Agent Card + Message Bus + SDK client\nDMAP A2A:         Markdown spec  + ext-{} skill + Skill tool call\n```\n\n> **í•µì‹¬ ì² í•™**: \"ê°€ìž¥ ì¢‹ì€ ì¸í”„ë¼ëŠ” ì—†ëŠ” ì¸í”„ë¼\" â€”\n> í”„ë¡œí† ì½œì´ ì•„ë‹Œ **ë¬¸ì„œ ê¸°ë°˜ ê³„ì•½(Contract)**ìœ¼ë¡œ í”ŒëŸ¬ê·¸ì¸ ê°„ í˜‘ì—…ì„ ì‹¤í˜„í•¨.\n\n[Top](#dmap-ë¹Œë”)\n\n---\n\n## DMAP ìƒíƒœê³„\n\nDMAP ìƒíƒœê³„ëŠ” **DMAP ë¹Œë” â†’ AIíŒ€(í”ŒëŸ¬ê·¸ì¸) â†’ ì™¸ë¶€ í”ŒëŸ¬ê·¸ì¸ â†’ AI ì„œë¹„ìŠ¤**ì˜ ê³„ì¸µìœ¼ë¡œ êµ¬ì„±ë¨.\nê° AIíŒ€ì€ í•„ìš”í•œ ì™¸ë¶€ í”ŒëŸ¬ê·¸ì¸ì„ ìžìœ ë¡­ê²Œ íƒˆì°©(Plug & Unplug)í•˜ì—¬ ì—­ëŸ‰ì„ í™•ìž¥í•¨.\n\n```\nâ”Œâ”€â”€â”€â”€â”€â”€â”€â”€â”€â”€â”€â”€â”€â”€â”€â”€â”€â”€â”€â”€â”€â”€â”€â”€â”€â”€â”€â”€â”€â”€â”€â”€â”€â”€â”€â”€â”€â”€â”€â”€â”€â”€â”€â”€â”€â”\nâ”‚              DMAP ë¹Œë”                       â”‚\nâ”‚         (ë©€í‹°ì—ì´ì „íŠ¸ í”ŒëŸ¬ê·¸ì¸ ìƒì„±ê¸°)          â”‚\nâ””â”€â”€â”€â”€â”€â”€â”€â”€â”€â”€â”€â”€â”€â”€â”€â”€â”€â”€â”¬â”€â”€â”€â”€â”€â”€â”€â”€â”€â”€â”€â”€â”€â”€â”€â”€â”€â”€â”€â”€â”€â”€â”€â”€â”€â”€â”˜\n                   â”‚ ìƒì„±\n        â”Œâ”€â”€â”€â”€â”€â”€â”€â”€â”€â”€â”¼â”€â”€â”€â”€â”€â”€â”€â”€â”€â”€â”\n        â–¼          â–¼          â–¼\n  â”Œâ”€â”€â”€â”€â”€â”€â”€â”€â”€â”€â” â”Œâ”€â”€â”€â”€â”€â”€â”€â”€â”€â”€â” â”Œâ”€â”€â”€â”€â”€â”€â”€â”€â”€â”€â”\n  â”‚blog-posterâ”‚ â”‚curriculumâ”‚ â”‚   ...    â”‚\n  â”‚  AIíŒ€    â”‚ â”‚  AIíŒ€    â”‚ â”‚  AIíŒ€    â”‚\n  â””â”€â”€â”€â”€â”¬â”€â”€â”€â”€â”€â”˜ â””â”€â”€â”€â”€â”¬â”€â”€â”€â”€â”€â”˜ â””â”€â”€â”€â”€â”¬â”€â”€â”€â”€â”€â”˜\n       â”‚  ext-{}    â”‚  ext-{}    â”‚  ext-{}\n       â”‚  íƒˆì°©      â”‚  íƒˆì°©      â”‚  íƒˆì°©\n       â–¼            â–¼            â–¼\n  â”Œâ”€â”€â”€â”€â”€â”€â”€â”€â”€â”€â”€â”€â”€â”€â”€â”€â”€â”€â”€â”€â”€â”€â”€â”€â”€â”€â”€â”€â”€â”€â”€â”€â”€â”€â”€â”€â”€â”€â”€â”€â”€â”\n  â”‚         ì™¸ë¶€ í”ŒëŸ¬ê·¸ì¸ í’€                  â”‚\n  â”‚  â”Œâ”€â”€â”€â”€â”€â”€â”€â” â”Œâ”€â”€â”€â”€â”€â”€â”€â”€â”€â”€â”€â”€â”€â”€â”€â”€â”€â”€â”€â”€â”       â”‚\n  â”‚  â”‚ Abra  â”‚ â”‚github-release-mgr  â”‚  ...  â”‚\n  â”‚  â”‚(ê°œë°œ) â”‚ â”‚(ë¦´ë¦¬ìŠ¤)            â”‚       â”‚\n  â”‚  â””â”€â”€â”€â”€â”€â”€â”€â”˜ â””â”€â”€â”€â”€â”€â”€â”€â”€â”€â”€â”€â”€â”€â”€â”€â”€â”€â”€â”€â”€â”˜       â”‚\n  â””â”€â”€â”€â”€â”€â”€â”€â”€â”€â”€â”€â”€â”€â”€â”€â”€â”€â”€â”€â”€â”€â”€â”€â”€â”€â”€â”€â”€â”€â”€â”€â”€â”€â”€â”€â”€â”€â”€â”€â”€â”€â”˜\n```\n\n| í˜„ì‹¤ ì„¸ê³„ ë¹„ìœ  | DMAP ìƒíƒœê³„ | ì—­í•  |\n|--------------|------------|------|\n| ì¸ë ¥íŒŒê²¬ íšŒì‚¬ | DMAP ë¹Œë” | ë©€í‹°ì—ì´ì „íŠ¸ í”ŒëŸ¬ê·¸ì¸ ìƒì„±ê¸° |\n| í”„ë¡œì íŠ¸ íˆ¬ìž… íŒ€ | ëª©ì ë³„ í”ŒëŸ¬ê·¸ì¸ | AIíŒ€ (ë„ë©”ì¸ ì „ë¬¸ê°€ ì§‘ë‹¨) |\n| íŒ€ì´ ì‚¬ìš©í•˜ëŠ” ì™¸ë¶€ ë„êµ¬ | ì™¸ë¶€ í”ŒëŸ¬ê·¸ì¸ (ext-{}) | í•„ìš”ì— ë”°ë¼ íƒˆì°©í•˜ëŠ” í™•ìž¥ ëª¨ë“ˆ |\n| íŒ€ì´ ë‚©í’ˆí•œ ì„œë¹„ìŠ¤ | AI ì„œë¹„ìŠ¤ | AIíŒ€ì´ ë§Œë“  ê²°ê³¼ë¬¼ |\n\n> ìƒì„¸ ë¬¸ì„œ: [DMAP ìƒíƒœê³„ êµ¬ì¡°](https://github.com/unicorn-plugins/dmap/blob/main/docs/idea/dmap-ecosystem.md)\n\n[Top](#dmap-ë¹Œë”)\n\n---\n\n## ë¹ ë¥¸ ì‹œìž‘\n\n### ì‚¬ì „ ìš”êµ¬ì‚¬í•­\n\n**1. ê¸°ë³¸ íˆ´ ì„¤ì¹˜**\n\n| ë„êµ¬ | ìµœì†Œ ë²„ì „ | ìš©ë„ |\n|------|-----------|------|\n| Git | 2.x | í”ŒëŸ¬ê·¸ì¸ ë§ˆì¼“í”Œë ˆì´ìŠ¤ (GitHub ì €ìž¥ì†Œ í´ë¡ ) |\n| Node.js | 18 ì´ìƒ | MCP ì„œë²„ ì‹¤í–‰ (`npx` ëª…ë ¹ ì‚¬ìš©) |\n| VS Code | ìµœì‹  | ì½”ë“œ íŽ¸ì§‘ê¸° (`code` ëª…ë ¹ ì‚¬ìš©) |\n\n**2. PATH ì„¤ì •**\n\n`~/.local/bin` ë””ë ‰í† ë¦¬ë¥¼ PATHì— ì¶”ê°€í•¨:\n\n```bash\n# Mac ì‚¬ìš©ìž\ncode ~/.zshrc\n\n# Linux/Windows ì‚¬ìš©ìž (WindowsëŠ” Git Bash í„°ë¯¸ë„ ì‚¬ìš©)\ncode ~/.bashrc\n```\n\nì•„ëž˜ ë‚´ìš©ì„ íŒŒì¼ ëì— ì¶”ê°€:\n\n```bash\nexport PATH=~/.local/bin:$PATH\n```\n\n> **(ì¤‘ìš”)** ê²½ë¡œ ì¶”ê°€ í›„ ë°˜ë“œì‹œ `source ~/.bashrc` ë˜ëŠ” `source ~/.zshrc` ì‹¤í–‰\n\n**3. Claude Code ì„¤ì¹˜**\n\n```bash\n# macOS/Linux\ncurl -fsSL https://claude.ai/install.sh | bash\n\n# Windows PowerShell\nirm https://claude.ai/install.ps1 | iex\n```\n\nì„¤ì¹˜ í›„ ì´ˆê¸° êµ¬ì„±:\n\n```bash\nclaude config\n```\n\n**4. Oh My ClaudeCode (OMC) ì„¤ì¹˜**\n\nClaude Code í”„ë¡¬í”„íŠ¸ì—ì„œ ìˆœì°¨ ìˆ˜í–‰:\n\n```\n/plugin marketplace add https://github.com/Yeachan-Heo/oh-my-claudecode\n/plugin install oh-my-claudecode\n```\n\nSetup ì‹œ MCPëŠ” context7ë§Œ ì„¤ì¹˜:\n\n```\n/oh-my-claudecode:omc-setup\n```\n\n> DMAP ë¹Œë”ëŠ” OMCì˜ ìŠ¤í‚¬ ë¶€ìŠ¤íŒ…(ralplan, ralph ë“±)ì„ í™œìš©í•˜ë¯€ë¡œ OMC ì„¤ì¹˜ê°€ í•„ìˆ˜ìž„.\n\n### DMAP ë¹Œë” ì„¤ì¹˜\n\n```bash\nclaude plugin marketplace add unicorn-plugins/dmap\nclaude plugin install dmap@unicorn\n```\n\n### ì‚¬ìš©\n\n| ëª…ë ¹ | ì„¤ëª… |\n|------|------|\n| `/dmap:develop-plugin` | 4-Phase ì›Œí¬í”Œë¡œìš°ë¡œ í”ŒëŸ¬ê·¸ì¸ ê°œë°œ |\n| `/dmap:requirement-writer` | ìš”êµ¬ì‚¬í•­ ì •ì˜ì„œ ìž‘ì„± ì§€ì› (AI ìžë™ ì™„ì„±) |\n| `/dmap:publish` | ê°œë°œ ì™„ë£Œëœ í”ŒëŸ¬ê·¸ì¸ì„ GitHubì— ë°°í¬ |\n| `/dmap:add-ext-skill` | ì™¸ë¶€í˜¸ì¶œ ìŠ¤í‚¬(ext-{ëŒ€ìƒí”ŒëŸ¬ê·¸ì¸}) ì¶”ê°€ |\n| `/dmap:remove-ext-skill` | ì™¸ë¶€í˜¸ì¶œ ìŠ¤í‚¬(ext-{ëŒ€ìƒí”ŒëŸ¬ê·¸ì¸}) ì œê±° |\n| `/dmap:setup` | ì„¤ì¹˜ ê²€ì¦ (í”ŒëŸ¬ê·¸ì¸ êµ¬ì¡° ë° í‘œì¤€ ë¬¸ì„œ í™•ì¸) |\n| `/dmap:help` | ì‚¬ìš© ì•ˆë‚´ |\n\nê¸°ë³¸ ì‚¬ìš© íë¦„:\n\n```\n1. /dmap:setup                -- ì„¤ì¹˜ ìƒíƒœ ê²€ì¦\n2. /dmap:requirement-writer   -- ìš”êµ¬ì‚¬í•­ ì •ì˜ì„œ ìž‘ì„± (AI ìžë™ ì™„ì„±)\n3. /dmap:develop-plugin       -- ìš”êµ¬ì‚¬í•­ -> ì„¤ê³„ -> ê°œë°œ -> ê²€ì¦ ìžë™ ìˆ˜í–‰\n4. /dmap:publish              -- GitHub ë°°í¬ (ì €ìž¥ì†Œ ìƒì„±, ì»¤ë°‹, í‘¸ì‹œ)\n```\n\n> **End-to-End ìžë™í™”**: ìš”êµ¬ì‚¬í•­ ì •ì˜ë¶€í„° GitHub ë°°í¬ê¹Œì§€ ì „ ê³¼ì •ì„ AIê°€ ìžë™ ìˆ˜í–‰í•¨.\n> ì‚¬ìš©ìžëŠ” ê° ë‹¨ê³„ì˜ ìŠ¹ì¸ë§Œ í•˜ë©´ ë¨.\n\n[Top](#dmap-ë¹Œë”)\n\n---\n\n## í”ŒëŸ¬ê·¸ì¸ ê°œë°œ ì›Œí¬í”Œë¡œìš°\n\nìš”êµ¬ì‚¬í•­ ì •ì˜ë¶€í„° GitHub ë°°í¬ê¹Œì§€ **End-to-End ìžë™í™”**ë¡œ ìˆ˜í–‰ë¨.\n`/dmap:requirement-writer`ë¡œ ìš”êµ¬ì‚¬í•­ ì •ì˜ì„œë¥¼ ë¨¼ì € ìž‘ì„±í•œ í›„,\n`/dmap:develop-plugin`ìœ¼ë¡œ 4-Phase ì›Œí¬í”Œë¡œìš°ë¥¼ ìžë™ ìˆ˜í–‰í•˜ê³ ,\n`/dmap:publish`ë¡œ GitHubì— ë°°í¬í•¨. ê° Phase ì™„ë£Œ ì‹œ ì‚¬ìš©ìž ìŠ¹ì¸ì„ ë°›ì•„ ë‹¤ìŒ ë‹¨ê³„ë¡œ ì§„í–‰í•¨.\n\n```\n/dmap:requirement-writer â†’ /dmap:develop-plugin (Phase 1~4) â†’ /dmap:publish\n```\n\n| Phase | ë‹¨ê³„ | ì£¼ìš” í™œë™ |\n|:-----:|------|----------|\n| 1 | ìš”êµ¬ì‚¬í•­ ìˆ˜ì§‘ | ìš”êµ¬ì‚¬í•­ ì •ì˜ì„œ ë¶„ì„, í”ŒëŸ¬ê·¸ì¸ ì í•©ì—¬ë¶€ íŒë‹¨, ëˆ„ë½ ì •ë³´ ìˆ˜ì§‘ ([ìƒ˜í”Œ](https://github.com/unicorn-plugins/abra/blob/main/output/requirement.md)) |\n| 2 | ì„¤ê³„ ë° ê³„íš | ê³µìœ  ìžì› ì„ íƒ, í”ŒëŸ¬ê·¸ì¸ êµ¬ì¡° ì„¤ê³„, ê°œë°œ ê³„íšì„œ ìž‘ì„± |\n| 3 | í”ŒëŸ¬ê·¸ì¸ ê°œë°œ | ìŠ¤ì¼ˆë ˆí†¤ ìƒì„±, Gateway/Agent/Skill/Command ê°œë°œ, README ìž‘ì„± |\n| 4 | ê²€ì¦ ë° ì™„ë£Œ | DMAP í‘œì¤€ ì¤€ìˆ˜ ê²€ì¦, ìµœì¢… ë³´ê³ , ê³µìœ ìžì› ë“±ë¡(ì„ íƒ) |\n\n**Phase 3 ê°œë°œ ìˆœì„œ:**\n\n1. í”ŒëŸ¬ê·¸ì¸ ìŠ¤ì¼ˆë ˆí†¤ ìƒì„± (`.claude-plugin/`, ë””ë ‰í† ë¦¬ êµ¬ì¡°)\n2. Gateway ì„¤ì • (`install.yaml`, `runtime-mapping.yaml`)\n3. ê³µìœ ìžì› ë³µì‚¬ (ë¦¬ì†ŒìŠ¤ ë§ˆì¼“í”Œë ˆì´ìŠ¤ -> í”ŒëŸ¬ê·¸ì¸ ë””ë ‰í† ë¦¬)\n4. ì—ì´ì „íŠ¸ ê°œë°œ (`AGENT.md`, `agentcard.yaml`, `tools.yaml`)\n5. ìŠ¤í‚¬ ê°œë°œ (setup í•„ìˆ˜, help ê¶Œìž¥, ê¸°ëŠ¥ ìŠ¤í‚¬)\n6. `commands/` ì§„ìž…ì  ìƒì„±\n7. ì»¤ìŠ¤í…€ ì•±/CLI ê°œë°œ (í•„ìš” ì‹œ)\n8. `README.md` ìž‘ì„±\n\n[Top](#dmap-ë¹Œë”)\n\n---\n\n## í”„ë¡œì íŠ¸ êµ¬ì¡°\n\n```\ndmap/\nâ”œâ”€â”€ .claude-plugin/          # í”ŒëŸ¬ê·¸ì¸ ë§¤ë‹ˆíŽ˜ìŠ¤íŠ¸\nâ”‚   â”œâ”€â”€ plugin.json          #   í”ŒëŸ¬ê·¸ì¸ ë©”íƒ€ë°ì´í„°\nâ”‚   â””â”€â”€ marketplace.json     #   ë§ˆì¼“í”Œë ˆì´ìŠ¤ ë“±ë¡ ì •ë³´\nâ”œâ”€â”€ standards/               # DMAP í‘œì¤€ ë¬¸ì„œ\nâ”‚   â”œâ”€â”€ plugin-standard.md          # ë©”ì¸ í‘œì¤€ (ì•„í‚¤í…ì²˜, ë””ë ‰í† ë¦¬, ë°°í¬)\nâ”‚   â”œâ”€â”€ plugin-standard-agent.md    # Agent íŒ¨í‚¤ì§€ í‘œì¤€\nâ”‚   â”œâ”€â”€ plugin-standard-skill.md    # Skill ìž‘ì„± í‘œì¤€\nâ”‚   â””â”€â”€ plugin-standard-gateway.md  # Gateway ì„¤ì • í‘œì¤€\nâ”œâ”€â”€ resources/               # ë¦¬ì†ŒìŠ¤ ë§ˆì¼“í”Œë ˆì´ìŠ¤ (ê³µìœ  ìžì› í’€)\nâ”‚   â”œâ”€â”€ plugin-resources.md  #   ë¦¬ì†ŒìŠ¤ ì¹´íƒˆë¡œê·¸\nâ”‚   â”œâ”€â”€ guides/              #   ê°€ì´ë“œ ë¬¸ì„œ\nâ”‚   â”œâ”€â”€ templates/           #   í…œí”Œë¦¿ íŒŒì¼\nâ”‚   â”œâ”€â”€ samples/             #   ìƒ˜í”Œ íŒŒì¼\nâ”‚   â””â”€â”€ tools/               #   ë„êµ¬ (ì»¤ìŠ¤í…€ ì•±/CLI)\nâ”œâ”€â”€ skills/                  # DMAP ë¹Œë” ìŠ¤í‚¬\nâ”‚   â”œâ”€â”€ develop-plugin/      #   í”ŒëŸ¬ê·¸ì¸ ê°œë°œ (4-Phase)\nâ”‚   â”œâ”€â”€ requirement-writer/  #   ìš”êµ¬ì‚¬í•­ ì •ì˜ì„œ ìž‘ì„± ì§€ì›\nâ”‚   â”œâ”€â”€ publish/             #   GitHub ë°°í¬\nâ”‚   â”œâ”€â”€ add-ext-skill/       #   ì™¸ë¶€í˜¸ì¶œ ìŠ¤í‚¬ ì¶”ê°€ ìœ í‹¸ë¦¬í‹°\nâ”‚   â”œâ”€â”€ remove-ext-skill/    #   ì™¸ë¶€í˜¸ì¶œ ìŠ¤í‚¬ ì œê±° ìœ í‹¸ë¦¬í‹°\nâ”‚   â”œâ”€â”€ ext-{plugin}/        #   ì™¸ë¶€ í”ŒëŸ¬ê·¸ì¸ ìœ„ìž„ (ì„ ì–¸í˜• A2A)\nâ”‚   â”œâ”€â”€ setup/               #   ì´ˆê¸° ì„¤ì •\nâ”‚   â””â”€â”€ help/                #   ì‚¬ìš© ì•ˆë‚´\nâ”œâ”€â”€ commands/                # ìŠ¬ëž˜ì‹œ ëª…ë ¹ ì§„ìž…ì \nâ”‚   â”œâ”€â”€ develop-plugin.md\nâ”‚   â”œâ”€â”€ requirement-writer.md\nâ”‚   â”œâ”€â”€ publish.md\nâ”‚   â”œâ”€â”€ add-ext-skill.md\nâ”‚   â”œâ”€â”€ remove-ext-skill.md\nâ”‚   â”œâ”€â”€ ext-{plugin}.md\nâ”‚   â”œâ”€â”€ setup.md\nâ”‚   â””â”€â”€ help.md\nâ”œâ”€â”€ references/              # ì°¸ì¡° ë¬¸ì„œ\nâ””â”€â”€ docs/                    # ë°œí‘œ/ë…¼ë¬¸ ìžë£Œ\n```\n\n[Top](#dmap-ë¹Œë”)\n\n---\n\n## í‘œì¤€ ë¬¸ì„œ\n\nDMAP í‘œì¤€ì€ 4ê°œì˜ í•µì‹¬ ë¬¸ì„œì™€ ë¦¬ì†ŒìŠ¤ ì¹´íƒˆë¡œê·¸ë¡œ êµ¬ì„±ë¨.\n\n| ë¬¸ì„œ | ê²½ë¡œ | ì„¤ëª… |\n|------|------|------|\n| ë©”ì¸ í‘œì¤€ | `standards/plugin-standard.md` | ì•„í‚¤í…ì²˜, ë””ë ‰í† ë¦¬ êµ¬ì¡°, ë„¤ìž„ìŠ¤íŽ˜ì´ìŠ¤, ë°°í¬ |\n| Agent í‘œì¤€ | `standards/plugin-standard-agent.md` | ì—ì´ì „íŠ¸ íŒ¨í‚¤ì§€ êµ¬ì„± (AGENT.md, agentcard.yaml, tools.yaml) |\n| Skill í‘œì¤€ | `standards/plugin-standard-skill.md` | ìŠ¤í‚¬ ìœ í˜•, ìž‘ì„± ê·œì¹™, ìœ í˜•ë³„ í…œí”Œë¦¿ |\n| Gateway í‘œì¤€ | `standards/plugin-standard-gateway.md` | install.yaml, runtime-mapping.yaml ìž‘ì„± ê·œì¹™ |\n| ë¦¬ì†ŒìŠ¤ ì¹´íƒˆë¡œê·¸ | `resources/plugin-resources.md` | ê³µìœ  ìžì› ëª©ë¡ (ê°€ì´ë“œ, í…œí”Œë¦¿, ìƒ˜í”Œ, ë„êµ¬) |\n| í”ŒëŸ¬ê·¸ì¸ ê°œë°œ ê°€ì´ë“œ | `resources/guides/plugin/plugin-dev-guide.md` | 4-Phase ì›Œí¬í”Œë¡œìš° ìƒì„¸ ê°€ì´ë“œ |\n\n[Top](#dmap-ë¹Œë”)\n\n---\n\n## ì‹¤ì „ ì˜ˆì œ\n\n**abra í”ŒëŸ¬ê·¸ì¸** -- Dify ì›Œí¬í”Œë¡œìš° DSL ìžë™í™” í”ŒëŸ¬ê·¸ì¸.\nDify í”Œëž«í¼ì˜ DSL(Domain Specific Language)ì„ ìžë™ ìƒì„±í•˜ê³ \ní”„ë¡œí† íƒ€ì´í•‘ê¹Œì§€ ìˆ˜í–‰í•˜ëŠ” í”ŒëŸ¬ê·¸ì¸ìž„.\n\nGit Repository: https://github.com/unicorn-plugins/abra.git\n\n### ì—ì´ì „íŠ¸ êµ¬ì„± (5ëª…ì˜ ì „ë¬¸ê°€)\n\n| ì—ì´ì „íŠ¸ | ì—­í•  |\n|----------|------|\n| scenario-analyst | ìš”êµ¬ì‚¬í•­ ë¶„ì„, ì‹œë‚˜ë¦¬ì˜¤ ìž‘ì„± |\n| dsl-architect | Dify DSL ì½”ë“œ ì„¤ê³„ |\n| plan-writer | ê°œë°œê³„íšì„œ ìž‘ì„± |\n| prototype-runner | Dify í”„ë¡œí† íƒ€ì´í•‘ ì‹¤í–‰ |\n| agent-developer | ìµœì¢… Agent ì½”ë“œ ê°œë°œ |\n\n### ìŠ¤í‚¬ êµ¬ì„± (9ê°œ ì›Œí¬í”Œë¡œìš°)\n\n| ìŠ¤í‚¬ | ìš©ë„ |\n|------|------|\n| setup | ì´ˆê¸° í™˜ê²½ ì„¤ì • |\n| core | ìžì—°ì–´ ë¼ìš°íŒ… |\n| help | ì‚¬ìš© ì•ˆë‚´ (ì¦‰ì‹œ ì¶œë ¥) |\n| dify-setup | Dify Docker í™˜ê²½ êµ¬ì¶• |\n| scenario | ìš”êµ¬ì‚¬í•­ ì‹œë‚˜ë¦¬ì˜¤ ìƒì„± |\n| dsl-generate | Dify DSL ìžë™ ìƒì„± |\n| prototype | Dify í”„ë¡œí† íƒ€ì´í•‘ ìžë™í™” |\n| dev-plan | ê°œë°œê³„íšì„œ ìž‘ì„± |\n| develop | AI Agent ê°œë°œ ë° ë°°í¬ |\n\nì‚¬ìš©ìž í”Œë¡œìš°: ì‹œë‚˜ë¦¬ì˜¤ ìƒì„± -> DSL ìƒì„± -> í”„ë¡œí† íƒ€ì´í•‘ -> ê°œë°œê³„íš -> Agent ê°œë°œ\n\n[Top](#dmap-ë¹Œë”)\n\n---\n\n## ë¡œë“œë§µ\n\n| ë‹¨ê³„ | ëª©í‘œ | ë‚´ìš© |\n|------|------|------|\n| **í˜„ìž¬** | Claude Code ê¸°ë°˜ ì•ˆì •í™” | Claude Code ëŸ°íƒ€ìž„ì—ì„œ DMAP í‘œì¤€ ê¸°ë°˜ í”ŒëŸ¬ê·¸ì¸ ê°œë°œ ë° ì‹¤í–‰ |\n| **ë‹¨ê¸°** | ë‹¤ì¤‘ ëŸ°íƒ€ìž„ ì§€ì› | Codex CLI, Gemini CLI ë“± ë‹¤ì–‘í•œ ì‹¤í–‰ í™˜ê²½ ì§€ì› |\n| **ì¤‘ê¸°** | ë§ˆì¼“í”Œë ˆì´ìŠ¤ / ì»¤ë®¤ë‹ˆí‹° | í”ŒëŸ¬ê·¸ì¸ ê³µìœ  ë§ˆì¼“í”Œë ˆì´ìŠ¤ êµ¬ì¶•, ì˜¤í”ˆì†ŒìŠ¤ ì»¤ë®¤ë‹ˆí‹° ìƒíƒœê³„ ì¡°ì„± |\n| **ìž¥ê¸°** | ë…¸ì½”ë“œ UI | ë¹„ê°œë°œìžìš© ì‹œê°ì  í”ŒëŸ¬ê·¸ì¸ ë¹Œë” (ë“œëž˜ê·¸ ì•¤ ë“œë¡­) |\n\n[Top](#dmap-ë¹Œë”)\n\n---\n\n## ë¼ì´ì„ ìŠ¤\n\nMIT License\n\nCopyright (c) 2026 Unicorn Inc.\nhttps://github.com/unicorn-plugins/dmap\n\n[Top](#dmap-ë¹Œë”)\n\n---\n---\n\nðŸ‡°ðŸ‡· [í•œêµ­ì–´](#dmap-ë¹Œë”) | ðŸ‡ºðŸ‡¸ [English](#dmap-builder)\n\n# DMAP Builder\n\n> A declarative framework for building multi-agent plugins without code\n\n- [DMAP Builder](#dmap-builder)\n  - [Overview](#overview)\n    - [Problem: Complexity of Traditional Multi-Agent Development](#problem-complexity-of-traditional-multi-agent-development)\n    - [How DMAP Solves It](#how-dmap-solves-it)\n    - [Core Values](#core-values)\n    - [Traditional Frameworks vs DMAP](#traditional-frameworks-vs-dmap)\n  - [Core Concepts](#core-concepts)\n    - [Skills = Department Heads](#skills--department-heads)\n    - [Agents = Specialists](#agents--specialists)\n    - [Gateway = Interpreter](#gateway--interpreter)\n    - [Resource Marketplace = Shared Drive](#resource-marketplace--shared-drive)\n    - [Architecture (Clean Architecture)](#architecture-clean-architecture)\n  - [How It Works](#how-it-works)\n    - [Prompt Assembly](#prompt-assembly)\n    - [4-Tier Model Mapping](#4-tier-model-mapping)\n    - [Skill Activation Paths](#skill-activation-paths)\n  - [Declarative A2A (Cross-Plugin Delegation)](#declarative-a2a-cross-plugin-delegation)\n    - [Traditional A2A vs DMAP Declarative A2A](#traditional-a2a-vs-dmap-declarative-a2a)\n    - [How Declarative A2A Works](#how-declarative-a2a-works)\n  - [DMAP Ecosystem](#dmap-ecosystem)\n  - [Quick Start](#quick-start)\n    - [Prerequisites](#prerequisites)\n    - [DMAP Builder Installation](#dmap-builder-installation)\n    - [Usage](#usage)\n  - [Plugin Development Workflow](#plugin-development-workflow)\n  - [Project Structure](#project-structure)\n  - [Standards](#standards)\n  - [Practical Example](#practical-example)\n    - [Agent Composition (5 Specialists)](#agent-composition-5-specialists)\n    - [Skill Composition (9 Workflows)](#skill-composition-9-workflows)\n  - [Roadmap](#roadmap)\n  - [License](#license)\n\n---\n\n## Overview\n\n**DMAP (Declarative Multi-Agent Plugin)** is\na declarative plugin architecture standard that defines\nmulti-agent systems using **only Markdown (prompts) and YAML (configuration)** -- no code required.\n\n### Problem: Complexity of Traditional Multi-Agent Development\n\nA single agent is manageable, but the moment multiple agents need to collaborate,\ncomplexity explodes. Limitations of conventional approaches:\n\n- **High entry barrier** -- Learning framework-specific SDKs such as LangChain, CrewAI, AutoGen required\n- **Runtime lock-in** -- Tightly coupled to a specific framework, resulting in low portability\n- **Difficult maintenance** -- Code-based definitions require full rewrites on change\n\n> \"Do we really need code just to define an agent?\"\n\n### How DMAP Solves It\n\nDeclare \"WHAT\" instead of \"HOW.\"\nLike telling a taxi driver \"Gangnam Station, please\" instead of dictating every turn -- just state the destination.\n\n### Core Values\n\n| Value | Description |\n|-------|-------------|\n| **Declarative Specification** | Define agents with Markdown + YAML instead of code |\n| **Runtime Neutral** | Runs on any runtime -- Claude Code, Codex CLI, etc. |\n| **Separation of Concerns** | Unidirectional dependency: Skills(routing) -> Agents(execution) -> Gateway(mapping) |\n| **Non-Developer Accessibility** | Anyone who can write Markdown can build a plugin |\n| **Domain Agnostic** | Applicable to any domain: code generation, education, documentation, business workflows |\n\n> **Current Version Notice (Feb 2026)**:\n> The DMAP Builder is currently available **for Claude Code only**.\n> The DMAP standard itself is designed to be runtime-neutral, with\n> **multi-runtime expansion planned** for Codex CLI, Gemini CLI, and others.\n\n### Traditional Frameworks vs DMAP\n\n| Comparison | Traditional Frameworks (LangChain, CrewAI, etc.) | DMAP |\n|------------|:------------------------------------------------:|:----:|\n| Agent Definition | Python/TypeScript SDK code | Markdown + YAML |\n| Orchestration | Graph/function call chain code | Skill prompts (natural language) |\n| Runtime Dependency | Tightly coupled to specific SDK | Runtime neutral |\n| Tool Connection | Create tool objects in code | Abstract declaration -> Gateway mapping |\n| Tier Management | None | 4-Tier automatic mapping |\n| Portability | Low (full rewrite) | High (replace runtime-mapping.yaml only) |\n\n```\nTraditional:  Developer writes Python code  -> Framework executes agents\nDMAP:         Anyone writes Markdown/YAML   -> Any Runtime executes agents\n```\n\n[Top](#dmap-builder)\n\n---\n\n## Core Concepts\n\nDMAP's structure is easy to understand when compared to a company organization.\n\n### Skills = Department Heads\n\nThe department head role that distributes work.\nReceives user requests and decides which agent gets which task.\nAn entire workflow declared in a single `SKILL.md` file.\n\n| Item | Content |\n|------|---------|\n| Core File | `skills/{name}/SKILL.md` |\n| Role | Routing + orchestration |\n| Types | core, setup, orchestrator, planning |\n\n### Agents = Specialists\n\nThe specialists who perform the actual work.\nEach agent consists of 3 files.\n\n| File | Role |\n|------|------|\n| `AGENT.md` | Role definition (goals, workflow, output format) |\n| `agentcard.yaml` | Metadata (name, version, tier, constraints) |\n| `tools.yaml` | Abstract tool declarations |\n\n### Gateway = Interpreter\n\nThe interpreter that translates abstract declarations into concrete execution environments.\nWhen an agent declares \"file search tool,\"\nthe Gateway maps it to the actual tool for the current runtime.\n\n| File | Role |\n|------|------|\n| `install.yaml` | MCP/LSP server and custom tool installation declarations |\n| `runtime-mapping.yaml` | Tier mapping, tool mapping, action mapping |\n\n### Resource Marketplace = Shared Drive\n\nA shared repository of guides, templates, samples, and tools.\nA common resource pool available to multiple plugins.\n\n| Category | Path | Purpose |\n|----------|------|---------|\n| Guides | `resources/guides/` | Technical reference documents |\n| Templates | `resources/templates/` | Deliverable generation templates |\n| Samples | `resources/samples/` | Implementation reference samples |\n| Tools | `resources/tools/` | Custom apps / CLI tools |\n\n### Architecture (Clean Architecture)\n\nThese components follow Clean Architecture principles.\nWith unidirectional dependency in the order Skills -> Agents -> Gateway,\neach part can be modified or replaced independently.\n\n```\nDelegated:  Input -> Skills(Controller) -> Agents(Service) -> Gateway -> Runtime\nDirect:     Input -> Skills(Controller) ----------------------> Gateway -> Runtime\n```\n\n[Top](#dmap-builder)\n\n---\n\n## How It Works\n\n### Prompt Assembly\n\nDMAP assembles prompts in a 3-layer process.\n\n| Layer | Source | Content |\n|-------|--------|---------|\n| 1. Common Static | Gateway `runtime-mapping.yaml` | Runtime-wide settings (tier mapping, tool mapping) |\n| 2. Per-Agent Static | `AGENT.md` + `agentcard.yaml` + `tools.yaml` | Agent role, metadata, tool declarations |\n| 3. Dynamic | Task instructions passed by the skill | Concrete task content based on user request |\n\nThink of it like a travel guidebook:\nBasic info (common rules) + destination-specific info (agent role) + today's itinerary (task instructions) = complete guidebook.\n\n### 4-Tier Model Mapping\n\nTasks are divided into 4 complexity levels, each assigned an appropriate AI model.\nSimple file searches go to a lightweight model; complex architecture design goes to a powerful model.\n\n| Tier | Purpose | Claude Mapping Example |\n|------|---------|----------------------|\n| HEAVY | Extremely complex reasoning, strategy formulation | Opus (max thinking) |\n| HIGH | Complex analysis, architecture design | Opus |\n| MEDIUM | Standard implementation, general tasks | Sonnet |\n| LOW | Simple lookups, file searches | Haiku |\n\nWhen task difficulty increases during execution, automatic escalation to a higher model occurs.\n\n### Skill Activation Paths\n\nSkills are activated via two paths:\n\n1. **Direct invocation** -- Call the exact skill with a slash command (`/dmap:develop-plugin`)\n2. **Via Core** -- When an ambiguous request arrives, the Core skill analyzes intent and routes to the appropriate skill\n\nThe runtime automatically scans the `skills/` directory to discover available skills.\n\n[Top](#dmap-builder)\n\n---\n\n## Declarative A2A (Cross-Plugin Delegation)\n\nDMAP solves cross-plugin collaboration through the **External Skill (ext-{})** pattern.\nWhile traditional A2A (Agent-to-Agent) protocols require HTTP endpoints, Agent Cards, and message buses,\nDMAP achieves cross-plugin delegation with **a single Markdown file**.\n\n### Traditional A2A vs DMAP Declarative A2A\n\n| Comparison | Traditional A2A (Google A2A, etc.) | DMAP Declarative A2A |\n|------------|:----------------------------------:|:--------------------:|\n| Communication | HTTP/JSON-RPC endpoints | Skillâ†’Skill call (FQN) |\n| Interface Declaration | Agent Card (JSON) | Plugin spec (Markdown) |\n| Infrastructure Required | Service discovery, message bus | None (Zero Infrastructure) |\n| Integration Code | SDK-based client code | ext-{} skill auto-generated |\n| Lifecycle Management | Manual implementation | add/remove-ext-skill utilities |\n\n### How Declarative A2A Works\n\n1. **Publish plugin spec** â€” Target plugin registers its spec (FQN, ARGS schema, execution paths) in the Resource Marketplace\n2. **Generate ext-{} skill** â€” `/add-ext-skill` utility auto-generates an External skill from the spec\n3. **Skillâ†’Skill delegation** â€” Caller collects domain context and invokes the target skill via FQN\n4. **Lifecycle management** â€” `/remove-ext-skill` cleanly removes integrations no longer needed\n\n```\nTraditional A2A:  HTTP endpoints + Agent Card + Message Bus + SDK client\nDMAP A2A:         Markdown spec  + ext-{} skill + Skill tool call\n```\n\n> **Core Philosophy**: \"The best infrastructure is no infrastructure\" â€”\n> Plugin collaboration through **document-based contracts**, not protocols.\n\n[Top](#dmap-builder)\n\n---\n\n## DMAP Ecosystem\n\nThe DMAP ecosystem is structured in layers: **DMAP Builder â†’ AI Teams (Plugins) â†’ External Plugins â†’ AI Services**.\nEach AI team freely attaches and detaches external plugins (Plug & Unplug) to extend its capabilities.\n\n```\nâ”Œâ”€â”€â”€â”€â”€â”€â”€â”€â”€â”€â”€â”€â”€â”€â”€â”€â”€â”€â”€â”€â”€â”€â”€â”€â”€â”€â”€â”€â”€â”€â”€â”€â”€â”€â”€â”€â”€â”€â”€â”€â”€â”€â”€â”€â”€â”\nâ”‚              DMAP Builder                    â”‚\nâ”‚       (Multi-Agent Plugin Generator)         â”‚\nâ””â”€â”€â”€â”€â”€â”€â”€â”€â”€â”€â”€â”€â”€â”€â”€â”€â”€â”€â”¬â”€â”€â”€â”€â”€â”€â”€â”€â”€â”€â”€â”€â”€â”€â”€â”€â”€â”€â”€â”€â”€â”€â”€â”€â”€â”€â”˜\n                   â”‚ generates\n        â”Œâ”€â”€â”€â”€â”€â”€â”€â”€â”€â”€â”¼â”€â”€â”€â”€â”€â”€â”€â”€â”€â”€â”\n        â–¼          â–¼          â–¼\n  â”Œâ”€â”€â”€â”€â”€â”€â”€â”€â”€â”€â” â”Œâ”€â”€â”€â”€â”€â”€â”€â”€â”€â”€â” â”Œâ”€â”€â”€â”€â”€â”€â”€â”€â”€â”€â”\n  â”‚blog-posterâ”‚ â”‚curriculumâ”‚ â”‚   ...    â”‚\n  â”‚  AI Team â”‚ â”‚  AI Team â”‚ â”‚  AI Team â”‚\n  â””â”€â”€â”€â”€â”¬â”€â”€â”€â”€â”€â”˜ â””â”€â”€â”€â”€â”¬â”€â”€â”€â”€â”€â”˜ â””â”€â”€â”€â”€â”¬â”€â”€â”€â”€â”€â”˜\n       â”‚  ext-{}    â”‚  ext-{}    â”‚  ext-{}\n       â”‚  plug      â”‚  plug      â”‚  plug\n       â–¼            â–¼            â–¼\n  â”Œâ”€â”€â”€â”€â”€â”€â”€â”€â”€â”€â”€â”€â”€â”€â”€â”€â”€â”€â”€â”€â”€â”€â”€â”€â”€â”€â”€â”€â”€â”€â”€â”€â”€â”€â”€â”€â”€â”€â”€â”€â”€â”\n  â”‚       External Plugin Pool               â”‚\n  â”‚  â”Œâ”€â”€â”€â”€â”€â”€â”€â” â”Œâ”€â”€â”€â”€â”€â”€â”€â”€â”€â”€â”€â”€â”€â”€â”€â”€â”€â”€â”€â”€â”       â”‚\n  â”‚  â”‚ Abra  â”‚ â”‚github-release-mgr  â”‚  ...  â”‚\n  â”‚  â”‚ (Dev) â”‚ â”‚(Release)           â”‚       â”‚\n  â”‚  â””â”€â”€â”€â”€â”€â”€â”€â”˜ â””â”€â”€â”€â”€â”€â”€â”€â”€â”€â”€â”€â”€â”€â”€â”€â”€â”€â”€â”€â”€â”˜       â”‚\n  â””â”€â”€â”€â”€â”€â”€â”€â”€â”€â”€â”€â”€â”€â”€â”€â”€â”€â”€â”€â”€â”€â”€â”€â”€â”€â”€â”€â”€â”€â”€â”€â”€â”€â”€â”€â”€â”€â”€â”€â”€â”€â”˜\n```\n\n| Real-World Analogy | DMAP Ecosystem | Role |\n|-------------------|----------------|------|\n| Staffing agency | DMAP Builder | Multi-agent plugin generator |\n| Project team | Purpose-specific plugin | AI Team (domain expert group) |\n| External tools used by team | External plugin (ext-{}) | Plug & Unplug extension modules |\n| Delivered service | AI Service | Output created by the AI team |\n\n> Detailed documentation: [DMAP Ecosystem Structure](https://github.com/unicorn-plugins/dmap/blob/main/docs/idea/dmap-ecosystem.md)\n\n[Top](#dmap-builder)\n\n---\n\n## Quick Start\n\n### Prerequisites\n\n**1. Basic Tool Installation**\n\n| Tool | Minimum Version | Purpose |\n|------|-----------------|---------|\n| Git | 2.x | Plugin marketplace (GitHub repository clone) |\n| Node.js | 18+ | MCP server execution (`npx` command) |\n| VS Code | Latest | Code editor (`code` command) |\n\n**2. PATH Setup**\n\nAdd the `~/.local/bin` directory to PATH:\n\n```bash\n# Mac users\ncode ~/.zshrc\n\n# Linux/Windows users (Windows: use Git Bash terminal)\ncode ~/.bashrc\n```\n\nAdd the following to the end of the file:\n\n```bash\nexport PATH=~/.local/bin:$PATH\n```\n\n> **(Important)** After adding the path, run `source ~/.bashrc` or `source ~/.zshrc`\n\n**3. Claude Code Installation**\n\n```bash\n# macOS/Linux\ncurl -fsSL https://claude.ai/install.sh | bash\n\n# Windows PowerShell\nirm https://claude.ai/install.ps1 | iex\n```\n\nInitial configuration after installation:\n\n```bash\nclaude config\n```\n\n**4. Oh My ClaudeCode (OMC) Installation**\n\nRun sequentially in the Claude Code prompt:\n\n```\n/plugin marketplace add https://github.com/Yeachan-Heo/oh-my-claudecode\n/plugin install oh-my-claudecode\n```\n\nInstall only context7 for MCP during setup:\n\n```\n/oh-my-claudecode:omc-setup\n```\n\n> The DMAP Builder leverages OMC's skill boosting (ralplan, ralph, etc.), so OMC installation is required.\n\n### DMAP Builder Installation\n\n```bash\nclaude plugin marketplace add unicorn-plugins/dmap\nclaude plugin install dmap@unicorn\n```\n\n### Usage\n\n| Command | Description |\n|---------|-------------|\n| `/dmap:develop-plugin` | Develop a plugin via 4-Phase workflow |\n| `/dmap:requirement-writer` | Requirements specification writing support (AI auto-completion) |\n| `/dmap:publish` | Deploy completed plugin to GitHub |\n| `/dmap:add-ext-skill` | Add external skill (ext-{target plugin}) |\n| `/dmap:remove-ext-skill` | Remove external skill (ext-{target plugin}) |\n| `/dmap:setup` | Installation verification (plugin structure and standards check) |\n| `/dmap:help` | Usage guide |\n\nBasic usage flow:\n\n```\n1. /dmap:setup                -- Verify installation status\n2. /dmap:requirement-writer   -- Write requirements specification (AI auto-completion)\n3. /dmap:develop-plugin       -- Automatically execute: requirements -> design -> development -> verification\n4. /dmap:publish              -- Deploy to GitHub (repo creation, commit, push)\n```\n\n> **End-to-End Automation**: AI handles the entire process from requirements definition to GitHub deployment.\n> Users only need to approve at each stage.\n\n[Top](#dmap-builder)\n\n---\n\n## Plugin Development Workflow\n\nThe entire pipeline from requirements to GitHub deployment is **End-to-End automated**.\nPlugin development starts with `/dmap:requirement-writer` to create the requirements specification,\nthen `/dmap:develop-plugin` automatically executes a 4-Phase workflow,\nand `/dmap:publish` deploys to GitHub. User approval is obtained at each stage.\n\n```\n/dmap:requirement-writer â†’ /dmap:develop-plugin (Phase 1~4) â†’ /dmap:publish\n```\n\n| Phase | Stage | Key Activities |\n|:-----:|-------|---------------|\n| 1 | Requirements Gathering | Analyze requirements specification, assess plugin suitability, collect missing information ([sample](https://github.com/unicorn-plugins/abra/blob/main/output/requirement.md)) |\n| 2 | Design and Planning | Select shared resources, design plugin structure, write development plan |\n| 3 | Plugin Development | Generate skeleton, develop Gateway/Agent/Skill/Command, write README |\n| 4 | Verification and Completion | Validate DMAP standard compliance, final report, register shared resources (optional) |\n\n**Phase 3 Development Order:**\n\n1. Generate plugin skeleton (`.claude-plugin/`, directory structure)\n2. Gateway configuration (`install.yaml`, `runtime-mapping.yaml`)\n3. Copy shared resources (Resource Marketplace -> plugin directory)\n4. Agent development (`AGENT.md`, `agentcard.yaml`, `tools.yaml`)\n5. Skill development (setup required, help recommended, feature skills)\n6. Create `commands/` entry points\n7. Custom app/CLI development (if needed)\n8. Write `README.md`\n\n[Top](#dmap-builder)\n\n---\n\n## Project Structure\n\n```\ndmap/\nâ”œâ”€â”€ .claude-plugin/          # Plugin manifest\nâ”‚   â”œâ”€â”€ plugin.json          #   Plugin metadata\nâ”‚   â””â”€â”€ marketplace.json     #   Marketplace registration info\nâ”œâ”€â”€ standards/               # DMAP standard documents\nâ”‚   â”œâ”€â”€ plugin-standard.md          # Main standard (architecture, directory, deployment)\nâ”‚   â”œâ”€â”€ plugin-standard-agent.md    # Agent package standard\nâ”‚   â”œâ”€â”€ plugin-standard-skill.md    # Skill authoring standard\nâ”‚   â””â”€â”€ plugin-standard-gateway.md  # Gateway configuration standard\nâ”œâ”€â”€ resources/               # Resource Marketplace (shared resource pool)\nâ”‚   â”œâ”€â”€ plugin-resources.md  #   Resource catalog\nâ”‚   â”œâ”€â”€ guides/              #   Guide documents\nâ”‚   â”œâ”€â”€ templates/           #   Template files\nâ”‚   â”œâ”€â”€ samples/             #   Sample files\nâ”‚   â””â”€â”€ tools/               #   Tools (custom apps/CLI)\nâ”œâ”€â”€ skills/                  # DMAP Builder skills\nâ”‚   â”œâ”€â”€ develop-plugin/      #   Plugin development (4-Phase)\nâ”‚   â”œâ”€â”€ requirement-writer/  #   Requirements specification writing support\nâ”‚   â”œâ”€â”€ publish/             #   GitHub deployment\nâ”‚   â”œâ”€â”€ add-ext-skill/       #   External skill add utility\nâ”‚   â”œâ”€â”€ remove-ext-skill/    #   External skill remove utility\nâ”‚   â”œâ”€â”€ ext-{plugin}/        #   External plugin delegation (Declarative A2A)\nâ”‚   â”œâ”€â”€ setup/               #   Initial setup\nâ”‚   â””â”€â”€ help/                #   Usage guide\nâ”œâ”€â”€ commands/                # Slash command entry points\nâ”‚   â”œâ”€â”€ develop-plugin.md\nâ”‚   â”œâ”€â”€ requirement-writer.md\nâ”‚   â”œâ”€â”€ publish.md\nâ”‚   â”œâ”€â”€ add-ext-skill.md\nâ”‚   â”œâ”€â”€ remove-ext-skill.md\nâ”‚   â”œâ”€â”€ ext-{plugin}.md\nâ”‚   â”œâ”€â”€ setup.md\nâ”‚   â””â”€â”€ help.md\nâ”œâ”€â”€ references/              # Reference documents\nâ””â”€â”€ docs/                    # Presentation / paper materials\n```\n\n[Top](#dmap-builder)\n\n---\n\n## Standards\n\nThe DMAP standard consists of 4 core documents and a resource catalog.\n\n| Document | Path | Description |\n|----------|------|-------------|\n| Main Standard | `standards/plugin-standard.md` | Architecture, directory structure, namespace, deployment |\n| Agent Standard | `standards/plugin-standard-agent.md` | Agent package composition (AGENT.md, agentcard.yaml, tools.yaml) |\n| Skill Standard | `standards/plugin-standard-skill.md` | Skill types, authoring rules, type-specific templates |\n| Gateway Standard | `standards/plugin-standard-gateway.md` | install.yaml, runtime-mapping.yaml authoring rules |\n| Resource Catalog | `resources/plugin-resources.md` | Shared resource list (guides, templates, samples, tools) |\n| Plugin Development Guide | `resources/guides/plugin/plugin-dev-guide.md` | 4-Phase workflow detailed guide |\n\n[Top](#dmap-builder)\n\n---\n\n## Practical Example\n\n**abra plugin** -- A Dify workflow DSL automation plugin.\nAutomatically generates DSL (Domain Specific Language) for the Dify platform\nand performs prototyping.\n\nGit Repository: https://github.com/unicorn-plugins/abra.git\n\n### Agent Composition (5 Specialists)\n\n| Agent | Role |\n|-------|------|\n| scenario-analyst | Requirements analysis, scenario authoring |\n| dsl-architect | Dify DSL code design |\n| plan-writer | Development plan authoring |\n| prototype-runner | Dify prototyping execution |\n| agent-developer | Final Agent code development |\n\n### Skill Composition (9 Workflows)\n\n| Skill | Purpose |\n|-------|---------|\n| setup | Initial environment setup |\n| core | Natural language routing |\n| help | Usage guide (immediate output) |\n| dify-setup | Dify Docker environment setup |\n| scenario | Requirements scenario generation |\n| dsl-generate | Dify DSL auto-generation |\n| prototype | Dify prototyping automation |\n| dev-plan | Development plan authoring |\n| develop | AI Agent development and deployment |\n\nUser flow: Scenario generation -> DSL generation -> Prototyping -> Development plan -> Agent development\n\n[Top](#dmap-builder)\n\n---\n\n## Roadmap\n\n| Stage | Goal | Description |\n|-------|------|-------------|\n| **Current** | Claude Code stabilization | Plugin development and execution based on DMAP standard on Claude Code runtime |\n| **Short-term** | Multi-runtime support | Support for various execution environments including Codex CLI, Gemini CLI |\n| **Mid-term** | Marketplace / Community | Build plugin sharing marketplace, foster open-source community ecosystem |\n| **Long-term** | No-code UI | Visual plugin builder for non-developers (drag and drop) |\n\n[Top](#dmap-builder)\n\n---\n\n## License\n\nMIT License\n\nCopyright (c) 2026 Unicorn Inc.\nhttps://github.com/unicorn-plugins/dmap\n\n[Top](#dmap-builder)\n\n"
      },
      "plugins": [
        {
          "name": "dmap",
          "source": "./",
          "category": "development",
          "description": null,
          "categories": [
            "development"
          ],
          "install_commands": [
            "/plugin marketplace add unicorn-plugins/dmap",
            "/plugin install dmap@unicorn"
          ]
        }
      ]
    }
  ]
}