{
  "author": {
    "id": "usmanali4073",
    "display_name": "usmanali4073",
    "avatar_url": "https://avatars.githubusercontent.com/u/36858540?v=4"
  },
  "marketplaces": [
    {
      "name": "stylemate-plugins",
      "version": null,
      "description": "Official StyleMate plugin marketplace with development agents, QA agents, testing skills, and automation for building microservices with Module Federation",
      "repo_full_name": "usmanali4073/stylemate-plugins",
      "repo_url": "https://github.com/usmanali4073/stylemate-plugins",
      "repo_description": "StyleMate Claude Code Plugin Marketplace - Complete development and QA workflow with 7 agents, 6 skills, automated testing",
      "signals": {
        "stars": 1,
        "forks": 0,
        "pushed_at": "2025-11-01T04:08:22Z"
      },
      "files": {
        ".claude-plugin/marketplace.json": "{\n  \"name\": \"stylemate-plugins\",\n  \"description\": \"Official StyleMate plugin marketplace with development agents, QA agents, testing skills, and automation for building microservices with Module Federation\",\n  \"owner\": {\n    \"name\": \"StyleMate Team\",\n    \"url\": \"https://github.com/stylemate\"\n  },\n  \"plugins\": [\n    {\n      \"name\": \"stylemate-architecture\",\n      \"source\": \"./stylemate-architecture\",\n      \"description\": \"Complete development and QA workflow for StyleMate microservices. Includes 7 specialized agents (planning, frontend/backend development, frontend/backend QA, context management), 6 skills (Module Federation, Clean Architecture, JWT, E2E testing, API testing, build verification), 2 commands, and automatic validation hooks.\",\n      \"version\": \"1.0.0\",\n      \"keywords\": [\n        \"microservices\",\n        \"module-federation\",\n        \"clean-architecture\",\n        \"dotnet\",\n        \"react\",\n        \"jwt\",\n        \"microfrontends\",\n        \"qa\",\n        \"testing\",\n        \"playwright\",\n        \"agents\",\n        \"skills\",\n        \"automation\"\n      ]\n    }\n  ]\n}\n",
        "README.md": "# StyleMate Plugin Marketplace\n\nOfficial Claude Code plugin marketplace for the StyleMate microservices platform. This marketplace provides specialized agents, skills, and commands for building production-ready microservices with Module Federation, Clean Architecture, and JWT authentication.\n\n## üì¶ Available Plugins\n\n### stylemate-architecture\n\nComplete development and QA workflow for StyleMate microservices with automated testing and validation.\n\n**Version**: 1.0.0\n**License**: MIT\n\n#### What's Included\n\n##### ü§ñ Development Agents (3)\n- **work-planner-agent**: Decomposes business requirements into actionable tasks for React microfrontends, .NET APIs, Module Federation integration, and Docker orchestration\n- **ui-engineer-agent**: Builds React 19 micro-frontends with Module Federation, Material-UI, and JWT authentication **(mandates QA validation)**\n- **dotnet-engineer-agent**: Creates ASP.NET Core 8 microservices with Clean Architecture, EF Core, and JWT **(mandates QA validation)**\n\n##### üß™ QA & Testing Agents (3)\n- **qa-frontend-engineer**: Validates React UIs with Playwright MCP - tests functionality, responsiveness, accessibility, CRUD operations, and Module Federation\n- **qa-backend-engineer**: Validates .NET APIs with curl - tests JWT auth, business isolation, CRUD endpoints, Clean Architecture compliance\n- **context-manager**: Manages conversation context, tracks project state, provides relevant information to specialized agents\n\n##### üéØ Architecture Skills (3)\n- **module-federation-setup**: Set up Vite Module Federation with proper shared dependencies and route exposure\n- **clean-architecture-validator**: Validate .NET API structure follows Clean Architecture with proper layer separation\n- **jwt-integration**: Implement JWT authentication for both .NET APIs and React microfrontends\n\n##### üî¨ Testing Skills (3)\n- **playwright-e2e-testing**: Execute end-to-end testing of React microfrontends using Playwright MCP\n- **api-integration-testing**: Test .NET API endpoints with curl to validate JWT, CRUD, and business isolation\n- **build-and-lint-verification**: Verify code quality by running build and lint commands for .NET and React\n\n##### ‚ö° Slash Commands (2)\n- `/new-microservice`: Scaffold a complete microservice with .NET API and React UI\n- `/validate-architecture`: Validate a microservice follows all StyleMate architectural standards\n\n##### üîî Automation Hooks\n- **PostToolUse hooks**: Notify when React/NET code modified, remind to run QA\n- **SubagentStop hooks**: Trigger QA validation after development agents finish\n- **UserPromptSubmit hooks**: Validate completion criteria before marking tasks done\n\n## üöÄ Installation\n\n### Prerequisites\n- Claude Code installed and running\n- Basic familiarity with the StyleMate platform architecture\n\n### Install the Marketplace\n\n#### Option 1: From Local Repository (Development)\n```bash\n# From your StyleMate project root\nclaude\n\n# In Claude Code\n/plugin marketplace add ./market-plugin\n```\n\n#### Option 2: From Git Repository (Production)\n```bash\n# In Claude Code\n/plugin marketplace add https://github.com/your-org/stylemate-plugins\n```\n\n### Install the Plugin\n\nAfter adding the marketplace:\n\n```bash\n# Interactive installation (recommended)\n/plugin\n\n# Select \"Browse Plugins\" ‚Üí \"stylemate-architecture\" ‚Üí \"Install\"\n\n# Or install directly\n/plugin install stylemate-architecture@stylemate-plugins\n```\n\n### Verify Installation\n\n```bash\n# Check available commands\n/help\n\n# Check available agents\n/agents\n\n# You should see:\n# - /new-microservice command\n# - /validate-architecture command\n# - work-planner-agent\n# - ui-engineer-agent\n# - dotnet-engineer-agent\n```\n\n## üìñ Usage Guide\n\n### Using Agents\n\nAgents can be invoked explicitly or Claude will use them automatically when appropriate.\n\n#### Explicit Invocation\n```\nUse the work-planner-agent to create a plan for a staff scheduling feature\n```\n\n#### Automatic Delegation\nClaude automatically delegates to agents based on task context:\n- Planning tasks ‚Üí work-planner-agent\n- React/UI development ‚Üí ui-engineer-agent\n- .NET API development ‚Üí dotnet-engineer-agent\n\n### Using Skills\n\nSkills are automatically invoked by Claude based on task context. You don't need to call them explicitly.\n\nExamples of when skills activate:\n- Setting up Module Federation ‚Üí module-federation-setup skill\n- Validating project structure ‚Üí clean-architecture-validator skill\n- Implementing JWT ‚Üí jwt-integration skill\n\n### Automated QA Workflow\n\n**CRITICAL**: All development agents automatically mandate QA validation. Work is NOT complete without QA approval.\n\n#### Frontend QA Flow\n```\n1. ui-engineer-agent builds React components\n2. Runs npm run lint\n3. Runs npm run build\n4. Automatically invokes qa-frontend-engineer\n5. QA agent uses Playwright MCP to test:\n   - Component functionality\n   - CRUD operations\n   - Mobile responsiveness\n   - Form validation\n   - Navigation\n   - Console errors\n6. QA reports pass/fail\n7. If fail, fixes applied and re-tested\n8. Only then is work marked complete\n```\n\n#### Backend QA Flow\n```\n1. dotnet-engineer-agent builds API endpoints\n2. Runs dotnet build\n3. Runs dotnet test\n4. Automatically invokes qa-backend-engineer\n5. QA agent uses curl to test:\n   - JWT authentication (401 without token)\n   - Authorization (403 for wrong role)\n   - Business isolation (404 for other business)\n   - CRUD operations\n   - Input validation\n   - Health checks\n6. QA reports pass/fail\n7. If fail, fixes applied and re-tested\n8. Only then is work marked complete\n```\n\n### Using Commands\n\n#### Create a New Microservice\n```\n/new-microservice\n\n# Claude will prompt for:\n# - Context name (e.g., \"scheduling\")\n# - API port (e.g., 8003)\n# - UI port (e.g., 3003)\n# - Domain entities\n# - User roles\n```\n\n#### Validate Architecture\n```\n/validate-architecture scheduling\n\n# Generates comprehensive report checking:\n# - Clean Architecture compliance\n# - JWT authentication setup\n# - Module Federation configuration\n# - Docker setup\n# - Integration with shell\n```\n\n## üèóÔ∏è Architecture Standards Enforced\n\n### .NET API Standards\n- **Clean Architecture** with Domain/Application/Infrastructure/Controllers layers\n- **ASP.NET Core 8** with EF Core and PostgreSQL\n- **JWT Authentication** with role-based authorization\n- **Async/await** on all I/O operations\n- **Business isolation** via JWT claims\n- **Health checks** and monitoring\n- **Docker** containerization\n\n### React UI Standards\n- **React 19** with TypeScript\n- **Vite** with Module Federation plugin\n- **Atomic Design** component structure (atoms ‚Üí molecules ‚Üí organisms ‚Üí pages)\n- **Material-UI (MUI)** for consistent design\n- **JWT integration** with Axios interceptors\n- **Responsive design** mobile-first approach\n- **Route guards** with authorization metadata\n- **Docker** containerization with Nginx\n\n### Infrastructure Standards\n- **Nginx** reverse proxy configuration\n- **Docker Compose** orchestration\n- **Health checks** for all services\n- **Security headers** (HSTS, CSP, X-Frame-Options)\n- **stylemate_net** network for service communication\n\n## üéì Examples\n\n### Example 1: Complete Development Flow with QA\n\n```\nStep 1: Plan the Feature\n--------\nUse the work-planner-agent to plan a staff scheduling feature where\nemployees can view and update their schedules.\n\nStep 2: Build the API\n--------\nUse the dotnet-engineer-agent to create the scheduling API with CRUD endpoints.\n\nResult: API code created, dotnet build passes, dotnet test passes\n\nStep 3: Mandatory QA - Backend\n--------\ndotnet-engineer-agent automatically invokes qa-backend-engineer agent.\n\nQA tests:\n‚úì dotnet build succeeds\n‚úì JWT authentication required (401 without token)\n‚úì Authorization enforced (403 for wrong role)\n‚úì Business isolation works\n‚úì CRUD endpoints return correct status codes\n‚úì Health check responds 200\n\nResult: All tests PASS - API approved\n\nStep 4: Build the UI\n--------\nUse the ui-engineer-agent to create the schedule calendar page.\n\nResult: React components created, npm run lint passes, npm run build succeeds\n\nStep 5: Mandatory QA - Frontend\n--------\nui-engineer-agent automatically invokes qa-frontend-engineer agent.\n\nQA tests with Playwright:\n‚úì Opens http://localhost:3003\n‚úì Schedule calendar renders\n‚úì Create schedule form works\n‚úì New schedule appears immediately\n‚úì Edit schedule saves changes\n‚úì Delete schedule removes item\n‚úì Mobile responsive (375px, 768px, 1200px)\n‚úì No console errors\n\nResult: All tests PASS - UI approved\n\nStep 6: Mark Complete\n--------\nWork is now complete with QA validation. Ready to commit and deploy.\n```\n\n### Example 2: Create Scheduling Microservice\n\n```bash\n/new-microservice\n\nContext name: scheduling\nAPI port: 8003\nUI port: 3003\nEntities: Schedule, Shift, TimeOff\nRoles: Owner, Admin, Manager, Staff\n\n# Result: Complete microservice created with:\n# - scheduling/scheduling-api (Clean Architecture .NET)\n# - scheduling/scheduling-ui (React + Module Federation)\n# - Docker configurations\n# - JWT authentication\n# - Nginx routing\n```\n\n### Example 2: Plan Feature with Work Planner\n\n```\nUse the work-planner-agent to plan a feature that allows staff members to view\nand update their availability for scheduling. They should be able to set recurring\navailability patterns and request time off.\n\n# Result: Detailed plan with:\n# - API tasks (endpoints, DTOs, database schema)\n# - UI tasks (components, routes, state management)\n# - Shell integration steps\n# - Docker and Nginx updates\n# - Security checklist\n# - QA requirements\n```\n\n### Example 3: Validate Existing Service\n\n```bash\n/validate-architecture scheduling\n\n# Result: Comprehensive report with:\n# ‚úì Clean Architecture compliance\n# ‚úó Missing [Authorize] on StaffController\n# ‚ö† Warning: No index on ScheduleDate\n# ‚úì Module Federation configured correctly\n# ‚úó Missing health check in API\n# + Recommended fixes\n```\n\n## üîß Configuration\n\n### Team Setup\n\nTo automatically install plugins for your team, add to `.claude/settings.json`:\n\n```json\n{\n  \"pluginMarketplaces\": [\n    {\n      \"name\": \"stylemate-plugins\",\n      \"source\": \"./market-plugin\"\n    }\n  ],\n  \"plugins\": {\n    \"stylemate-architecture\": {\n      \"enabled\": true,\n      \"autoInstall\": true\n    }\n  }\n}\n```\n\n### Customizing Agents\n\nYou can override plugin agents by creating project-level agents in `.claude/agents/` with the same name. Project-level agents take precedence.\n\n## üìù Best Practices\n\n### When to Use Each Agent\n\n**work-planner-agent**: Use for:\n- Breaking down new features into tasks\n- Planning microservice architecture\n- Creating comprehensive implementation plans\n- Security and QA planning\n\n**ui-engineer-agent**: Use for:\n- Building React components\n- Setting up Module Federation\n- Implementing responsive designs\n- JWT integration in frontend\n- Creating route configurations\n\n**dotnet-engineer-agent**: Use for:\n- Building .NET APIs\n- Implementing Clean Architecture\n- Setting up EF Core and migrations\n- Configuring JWT authentication\n- Creating authorization policies\n\n### Workflow Recommendations\n\n1. **Start with Planning**: Use `/new-microservice` or work-planner-agent\n2. **Build API First**: Let dotnet-engineer-agent create the backend\n3. **Then Build UI**: Let ui-engineer-agent create the frontend\n4. **Validate**: Run `/validate-architecture` before deployment\n5. **Integrate**: Update shell application to consume the new remote\n\n## üêõ Troubleshooting\n\n### Plugin Not Loading\n```bash\n# Check installed plugins\n/plugin\n\n# Reinstall if needed\n/plugin uninstall stylemate-architecture@stylemate-plugins\n/plugin install stylemate-architecture@stylemate-plugins\n```\n\n### Agents Not Appearing\n```bash\n# Verify agents are available\n/agents\n\n# If missing, check plugin installation\n/plugin\n```\n\n### Commands Not Working\n```bash\n# Verify commands are registered\n/help\n\n# Restart Claude Code if needed\nexit\nclaude\n```\n\n## üìö Additional Resources\n\n- [Claude Code Documentation](https://docs.claude.com/en/docs/claude-code)\n- [Module Federation Guide](https://module-federation.io/)\n- [Clean Architecture Principles](https://blog.cleancoder.com/uncle-bob/2012/08/13/the-clean-architecture.html)\n- [JWT Best Practices](https://tools.ietf.org/html/rfc8725)\n\n## ü§ù Contributing\n\nTo add new plugins to this marketplace:\n\n1. Create plugin directory under `market-plugin/`\n2. Add `.claude-plugin/plugin.json` manifest\n3. Create agents/ skills/ commands/ as needed\n4. Update `marketplace.json` with new plugin entry\n5. Test locally before deploying\n\n## üìÑ License\n\nMIT License - see individual plugin directories for specific licenses.\n\n## üîñ Version History\n\n### 1.0.0 (2025-01-19)\n- Initial release with complete development and QA workflow\n- **7 specialized agents**: 3 development + 3 QA + 1 context manager\n- **6 skills**: 3 architecture + 3 testing\n- **2 slash commands**: scaffolding and validation\n- **Automation hooks**: PostToolUse, SubagentStop, UserPromptSubmit\n- **Mandatory QA validation**: All dev agents must invoke QA before completion\n- **Playwright MCP integration**: Frontend E2E testing\n- **API testing with curl**: Backend integration testing\n- Full StyleMate microservices support\n- Module Federation and Clean Architecture enforcement\n- JWT authentication patterns\n\n---\n\n**Maintained by**: StyleMate Team\n**Support**: Create an issue in the repository\n**Documentation**: See individual plugin READMEs for detailed usage\n",
        "stylemate-architecture/README.md": "# StyleMate Architecture Plugin\n\nComprehensive Claude Code plugin for building production-ready microservices in the StyleMate platform. Provides specialized agents, reusable skills, and automation commands for React microfrontends with Module Federation and .NET APIs with Clean Architecture.\n\n## Features\n\n### ü§ñ Specialized Agents\n\n#### work-planner-agent\nDecomposes business requirements into executable plans across frontend, backend, and infrastructure layers.\n\n**Use for**:\n- Planning new microservices\n- Breaking down features into tasks\n- Creating architectural blueprints\n- Defining security and QA requirements\n\n**Capabilities**:\n- Epic decomposition with \"THINK HARDER\" methodology\n- Task generation for UI, API, Shell, and Infrastructure\n- Security and authorization planning\n- Docker and Nginx configuration\n- Definition of Done (DoD) creation\n\n**Example**:\n```\nUse the work-planner-agent to plan a staff scheduling system where employees\ncan view their schedules, set availability, and request time off.\n```\n\n#### ui-engineer-agent\nBuilds React 19 microfrontends with Module Federation, Material-UI, and JWT authentication.\n\n**Use for**:\n- Creating React components following atomic design\n- Setting up Module Federation\n- Implementing responsive mobile-first designs\n- Integrating JWT authentication in frontends\n- Building route configurations with authorization\n\n**Capabilities**:\n- Atomic design component creation (atoms ‚Üí molecules ‚Üí organisms ‚Üí pages)\n- Module Federation configuration\n- MUI theme integration\n- JWT Axios interceptor setup\n- Route guard implementation\n- Mobile-responsive layouts\n\n**Example**:\n```\nUse the ui-engineer-agent to build the scheduling calendar page with week/month\nviews, shift creation, and employee filtering. It should work on mobile and desktop.\n```\n\n#### dotnet-engineer-agent\nCreates ASP.NET Core 8 microservices with Clean Architecture, EF Core, and JWT.\n\n**Use for**:\n- Building .NET 8 APIs\n- Implementing Clean Architecture\n- Setting up EF Core with PostgreSQL\n- Configuring JWT authentication and authorization\n- Creating repository and service layers\n\n**Capabilities**:\n- Clean Architecture project structure (Domain/Application/Infrastructure/Controllers)\n- JWT authentication with role-based policies\n- EF Core configuration and migrations\n- Business data isolation via JWT claims\n- Health check implementation\n- Docker containerization\n\n**Example**:\n```\nUse the dotnet-engineer-agent to create the staff scheduling API with endpoints\nfor CRUD operations on schedules, shifts, and time-off requests.\n```\n\n### üéØ Agent Skills\n\nSkills are automatically invoked by Claude based on task context. You don't need to explicitly call them.\n\n#### module-federation-setup\nSets up Vite Module Federation for React microfrontends.\n\n**Automatically activates when**:\n- Creating new microfrontend projects\n- Configuring federation.config.ts\n- Setting up shared dependencies\n- Exposing routes to shell application\n\n**Provides**:\n- Complete federation.config.ts with proper shared dependencies\n- Vite configuration with proxy settings\n- Route export setup with metadata\n- Shell integration instructions\n\n#### clean-architecture-validator\nValidates .NET API projects follow Clean Architecture principles.\n\n**Automatically activates when**:\n- Reviewing .NET project structure\n- Checking for architectural violations\n- Validating layer dependencies\n- Ensuring proper separation of concerns\n\n**Validates**:\n- Domain layer has no dependencies\n- Application depends only on Domain\n- Infrastructure implements interfaces\n- Controllers orchestrate workflows\n- No circular dependencies\n\n#### jwt-integration\nImplements JWT authentication for both .NET and React.\n\n**Automatically activates when**:\n- Setting up authentication\n- Configuring authorization policies\n- Implementing token interceptors\n- Adding route guards\n\n**Provides**:\n- .NET JWT validation configuration\n- Authorization policy definitions\n- React Axios interceptor setup\n- Token refresh logic\n- Route guard implementation\n\n### ‚ö° Slash Commands\n\n#### /new-microservice\nScaffolds a complete new microservice with all required components.\n\n**Creates**:\n- .NET API with Clean Architecture\n- React UI with Module Federation\n- Docker configurations\n- Nginx routing\n- JWT authentication setup\n- Database migrations\n\n**Prompts for**:\n- Context name\n- API and UI ports\n- Domain entities\n- User roles\n\n**Example**:\n```\n/new-microservice\n\nContext: scheduling\nAPI Port: 8003\nUI Port: 3003\nEntities: Schedule, Shift, TimeOff\nRoles: Owner, Admin, Manager, Staff\n```\n\n#### /validate-architecture\nPerforms comprehensive architectural validation of a microservice.\n\n**Checks**:\n- Clean Architecture compliance\n- JWT authentication setup\n- Module Federation configuration\n- Docker and health checks\n- Business data isolation\n- Security headers\n- Integration with shell\n\n**Generates**:\n- Detailed validation report\n- Pass/fail/warning status for each check\n- Specific line numbers for issues\n- Recommended fixes\n\n**Example**:\n```\n/validate-architecture scheduling\n\n# Optional: Auto-fix common issues\n/validate-architecture scheduling --fix\n```\n\n## Installation\n\n### From StyleMate Project\n```bash\n# Start Claude Code\nclaude\n\n# Add marketplace\n/plugin marketplace add ./market-plugin\n\n# Install plugin\n/plugin install stylemate-architecture@stylemate-plugins\n```\n\n### Verify Installation\n```bash\n# Check agents\n/agents\n\n# Should show:\n# - work-planner-agent\n# - ui-engineer-agent\n# - dotnet-engineer-agent\n\n# Check commands\n/help\n\n# Should show:\n# - /new-microservice\n# - /validate-architecture\n```\n\n## Usage Examples\n\n### Example 1: Plan and Build New Feature\n\n```\nStep 1: Plan the feature\n--------\nUse the work-planner-agent to plan a feature where managers can create and assign\nshifts to employees. Employees should see their assigned shifts in a calendar view.\n\nStep 2: Build the API\n--------\nUse the dotnet-engineer-agent to implement the Shift entity and CRUD endpoints.\nOnly Managers and Admins should be able to create/edit shifts.\n\nStep 3: Build the UI\n--------\nUse the ui-engineer-agent to create the shift calendar component with week and\nmonth views. It should be responsive for mobile and desktop.\n\nStep 4: Validate\n--------\n/validate-architecture scheduling\n```\n\n### Example 2: Scaffold New Microservice\n\n```bash\n# Create complete microservice structure\n/new-microservice\n\n# Follow prompts to configure:\n# - Context name: inventory\n# - Entities: Product, Category, Supplier\n# - Roles: Owner, Admin, Manager\n# - Ports: API 8004, UI 3004\n\n# Result: Complete microservice ready for development\n```\n\n### Example 3: Validate Existing Service\n\n```bash\n# Run comprehensive validation\n/validate-architecture staff\n\n# Review report:\n# ‚úì Clean Architecture: Passed\n# ‚úó JWT Authorization: Failed (missing [Authorize] on line 42)\n# ‚ö† Module Federation: Warning (update react-router-dom to singleton)\n# ‚úì Docker: Passed\n\n# Apply auto-fixes\n/validate-architecture staff --fix\n```\n\n## Architecture Patterns Enforced\n\n### Clean Architecture (.NET)\n```\nDomain/          # Business entities and interfaces (no dependencies)\nApplication/     # Business logic and DTOs (depends on Domain)\nInfrastructure/  # Data access and external services (implements interfaces)\nControllers/     # API orchestration (depends on all layers)\n```\n\n### Atomic Design (React)\n```\natoms/        # Basic UI elements (Button, Input, Label)\nmolecules/    # Simple composites (SearchBox, FormField)\norganisms/    # Complex components (DataTable, Modal, Header)\npages/        # Complete pages (Dashboard, ScheduleView)\n```\n\n### Module Federation\n```typescript\n// Exposes routes for consumption by shell\nexposes: {\n  './routes': './src/app/routes.tsx'\n}\n\n// Shares dependencies as singletons\nshared: {\n  'react': { singleton: true },\n  'react-dom': { singleton: true },\n  '@mui/material': { singleton: true }\n}\n```\n\n### JWT Authentication\n```csharp\n// .NET Authorization Policies\n\"RequireOwnerOrAdmin\": roles = [\"Owner\", \"Admin\"]\n\"RequireManagerOrAbove\": roles = [\"Owner\", \"Admin\", \"Manager\"]\n\"RequireStaffAccess\": roles = [\"Owner\", \"Admin\", \"Manager\", \"Staff\"]\n\"RequireBusiness\": claim = \"business_id\"\n```\n\n```typescript\n// React Route Metadata\nmeta: {\n  label: \"Schedules\",\n  allowedRoles: [\"Owner\", \"Admin\", \"Manager\"],\n  requireEmailConfirmed: true,\n  requireBusiness: true\n}\n```\n\n## Configuration\n\n### Required Environment Variables\n```env\n# JWT Configuration\nJWT_ISSUER=stylemate-auth\nJWT_AUDIENCE=stylemate-services\nJWT_SECRET_KEY=your-secret-key-here\n\n# Database\nPOSTGRES_DB=stylemate\nPOSTGRES_USER=postgres\nPOSTGRES_PASSWORD=postgres123\n\n# Network\nDOCKER_NETWORK=stylemate_net\n```\n\n### Nginx Routing Pattern\n```nginx\n# UI Remote\nlocation /remotes/{context}-ui/ {\n    proxy_pass http://{context}_ui:80/;\n}\n\n# API Endpoints\nlocation /api/{context}/ {\n    proxy_pass http://{context}_api:80/api/{context}/;\n}\n```\n\n## Best Practices\n\n### Agent Selection\n- **Planning phase**: work-planner-agent\n- **React development**: ui-engineer-agent\n- **API development**: dotnet-engineer-agent\n\n### Development Workflow\n1. Plan with work-planner-agent\n2. Build API with dotnet-engineer-agent\n3. Build UI with ui-engineer-agent\n4. Validate with /validate-architecture\n5. Test with Docker Compose\n6. Integrate with shell application\n\n### Code Quality\n- Always run `npm run lint` after UI changes\n- Always run `dotnet build` after API changes\n- Use Playwright testing for UI validation\n- Write integration tests for APIs\n- Validate architecture before deployment\n\n## Troubleshooting\n\n### Agent Not Available\n```bash\n# Check installation\n/plugin\n\n# Reinstall if needed\n/plugin install stylemate-architecture@stylemate-plugins\n```\n\n### Skill Not Activating\nSkills activate automatically. If you think a skill should have activated but didn't:\n- Describe the task more explicitly\n- Mention the specific technology (e.g., \"Module Federation\", \"Clean Architecture\")\n\n### Command Not Found\n```bash\n# Verify commands are loaded\n/help\n\n# Restart Claude Code if needed\nexit\nclaude\n```\n\n## Version History\n\n### 1.0.0 (2025-01-19)\n- Initial release\n- 3 specialized agents (work-planner, ui-engineer, dotnet-engineer)\n- 3 skills (module-federation-setup, clean-architecture-validator, jwt-integration)\n- 2 commands (/new-microservice, /validate-architecture)\n\n## License\n\nMIT\n\n## Support\n\nFor issues and questions:\n- Review this documentation\n- Check the main marketplace README\n- Consult StyleMate platform documentation (CLAUDE.md)\n"
      },
      "plugins": [
        {
          "name": "stylemate-architecture",
          "source": "./stylemate-architecture",
          "description": "Complete development and QA workflow for StyleMate microservices. Includes 7 specialized agents (planning, frontend/backend development, frontend/backend QA, context management), 6 skills (Module Federation, Clean Architecture, JWT, E2E testing, API testing, build verification), 2 commands, and automatic validation hooks.",
          "version": "1.0.0",
          "keywords": [
            "microservices",
            "module-federation",
            "clean-architecture",
            "dotnet",
            "react",
            "jwt",
            "microfrontends",
            "qa",
            "testing",
            "playwright",
            "agents",
            "skills",
            "automation"
          ],
          "categories": [
            "agents",
            "automation",
            "clean-architecture",
            "dotnet",
            "jwt",
            "microfrontends",
            "microservices",
            "module-federation",
            "playwright",
            "qa",
            "react",
            "skills",
            "testing"
          ],
          "install_commands": [
            "/plugin marketplace add usmanali4073/stylemate-plugins",
            "/plugin install stylemate-architecture@stylemate-plugins"
          ]
        }
      ]
    }
  ]
}