{
  "author": {
    "id": "Venkateshvenki404224",
    "display_name": "Venkatesh",
    "avatar_url": "https://avatars.githubusercontent.com/u/75518037?u=c52635a32b04ef6e483a127fcd24c128fff1c366&v=4"
  },
  "marketplaces": [
    {
      "name": "frappe-marketplace",
      "version": null,
      "description": "Official marketplace for Frappe Framework development tools and plugins",
      "repo_full_name": "Venkateshvenki404224/frappe-apps-manager",
      "repo_url": "https://github.com/Venkateshvenki404224/frappe-apps-manager",
      "repo_description": "A comprehensive Claude Code plugin for Frappe Framework development, providing tools, commands, agents, and Skills to streamline your Frappe application development workflow.",
      "signals": {
        "stars": 6,
        "forks": 3,
        "pushed_at": "2025-12-15T15:40:13Z"
      },
      "files": {
        ".claude-plugin/marketplace.json": "{\n  \"name\": \"frappe-marketplace\",\n  \"owner\": {\n    \"name\": \"Frappe Development Community\"\n  },\n  \"description\": \"Official marketplace for Frappe Framework development tools and plugins\",\n  \"plugins\": [\n    {\n      \"name\": \"frappe-apps-manager\",\n      \"source\": \"./frappe-apps-manager\",\n      \"description\": \"Comprehensive Frappe Framework development platform with 95% SDLC coverage - 15 commands, 10 agents, 15 skills for complete Frappe/ERPNext development lifecycle\",\n      \"version\": \"2.0.0\",\n      \"tags\": [\"frappe\", \"erpnext\", \"development\", \"bench\", \"doctype\", \"testing\", \"deployment\", \"performance\", \"security\", \"devops\"]\n    }\n  ]\n}\n",
        "README.md": "# Frappe Apps Manager Plugin\n\nA comprehensive Claude Code plugin for Frappe Framework development with **95% SDLC coverage** - 15 commands, 10 agents, and 15 skills for complete Frappe/ERPNext development lifecycle.\n\n## Quick Start\n\nInstall in 2 commands:\n\n```bash\n/plugin marketplace add Venkateshvenki404224/frappe-apps-manager\n/plugin install frappe-apps-manager@Venkateshvenki404224\n```\n\nThen restart Claude Code and run `/help` to see all 15 Frappe commands!\n\n## Overview\n\nThe Frappe Apps Manager plugin extends Claude Code with specialized capabilities for building, deploying, and maintaining Frappe applications. Whether you're creating new apps, designing DocTypes, debugging issues, or deploying to production, this plugin provides expert assistance at every step.\n\n**What's New in v2.0.0:**\n- üÜï 8 new commands (site management, testing, debugging, operations)\n- üÜï 7 new agents (testing, security, devops, performance, integration, data, UI/UX)\n- üÜï 12 new skills (client scripts, tests, workflows, webhooks, migrations, and more)\n- üÜï Frappe conventional commit output style\n- üÜï Enhanced hooks with smart automation\n- ‚≠ê All components reference real ERPNext/Frappe core code\n- ‚≠ê 120+ core app references, 175+ working code examples\n\n## Features\n\n### 15 Commands - Complete Workflow Coverage\n\n**Site & Environment:**\n- **`/frappe-new-site`** üÜï - Create new Frappe site with database setup\n- **`/frappe-config`** üÜï - Manage site configuration and settings\n- **`/frappe-db-reset`** üÜï - Reset database for development\n\n**Development & Testing:**\n- **`/frappe-new-app`** - Create new Frappe application\n- **`/frappe-new-doctype`** - Create new DocType\n- **`/frappe-test`** üÜï - Run tests with coverage reports\n- **`/frappe-console`** üÜï - Interactive Python console\n\n**Operations & Debugging:**\n- **`/frappe-logs`** üÜï - View and analyze bench logs\n- **`/frappe-cache`** üÜï - Manage Redis cache\n- **`/frappe-role-manager`** üÜï - Manage roles and permissions\n- **`/frappe-backup`** - Backup site data\n- **`/frappe-migrate`** - Run database migrations\n\n**Deployment:**\n- **`/frappe-install-app`** - Install app to site\n- **`/frappe-bench-start`** - Start development server\n- **`/frappe-deploy`** - Deploy to production\n\n### 10 Specialized Agents\n\n**Strategic & Development:**\n- **frappe-architect** - System design and architecture\n- **frappe-developer** - Implementation and coding\n- **frappe-ui-ux** üÜï - Frontend and user experience\n\n**Quality & Security:**\n- **frappe-tester** üÜï - Testing strategies and QA\n- **frappe-security** üÜï - Security review and compliance\n- **frappe-performance** üÜï - Performance optimization\n\n**Operations & Integration:**\n- **frappe-devops** üÜï - CI/CD and deployment\n- **frappe-debugger** - Troubleshooting and diagnostics\n- **frappe-integration** üÜï - API and webhook integration\n- **frappe-data-engineer** üÜï - Data migration and management\n\n### 15 Autonomous Skills\n\n**Core Development:**\n- **frappe-doctype-builder** - Generate DocType JSON structures\n- **frappe-api-handler** - Create REST API endpoints\n- **frappe-client-script-generator** üÜï - JavaScript form scripts (10 patterns)\n- **frappe-report-generator** - Custom reports and analytics\n\n**Testing & Quality:**\n- **frappe-unit-test-generator** üÜï - Unit test generation\n- **frappe-integration-test-generator** üÜï - Integration test scenarios\n\n**Workflows & States:**\n- **frappe-workflow-generator** üÜï - Approval workflows\n- **frappe-state-machine-helper** üÜï - State transition logic\n\n**Integration & Data:**\n- **frappe-webhook-manager** üÜï - Webhook handlers\n- **frappe-external-api-connector** üÜï - External API clients\n- **frappe-data-migration-generator** üÜï - Data migration scripts\n- **frappe-fixture-creator** üÜï - Test and master data fixtures\n\n**Optimization & UX:**\n- **frappe-performance-optimizer** üÜï - Query and cache optimization\n- **frappe-web-form-builder** üÜï - Public web forms\n- **frappe-documentation-generator** üÜï - API documentation\n\n### Output Style\n\n- **frappe-commit** üÜï - Frappe conventional commit standard with semantic versioning\n\n### 7 Enhanced Hooks\n\nSmart automation for common tasks:\n\n- **frappe-context-detector** - Detects Frappe bench directory\n- **frappe-auto-migrate** - Reminds to run migrations after DocType changes\n- **frappe-bench-validator** - Validates bench setup\n- **frappe-test-file-validator** üÜï - Validates test file locations\n- **frappe-test-reminder** üÜï - Reminds to run tests after code changes\n- **frappe-cache-clear-reminder** üÜï - Suggests cache clear after JS changes\n- **frappe-site-check** üÜï - Verifies site exists for operations\n\n## Installation\n\n### Quick Install from GitHub\n\n```bash\n# 1. Add the marketplace\n/plugin marketplace add Venkateshvenki404224/frappe-apps-manager\n\n# 2. Install the plugin\n/plugin install frappe-apps-manager@Venkateshvenki404224\n\n# 3. Restart Claude Code\n\n# 4. Verify installation\n/help  # Should show all 15 Frappe commands\n\n# 5. Try it out!\n/frappe-new-site\n```\n\n### Alternative Installation Methods\n\n**Full GitHub URL:**\n```bash\n/plugin marketplace add https://github.com/Venkateshvenki404224/frappe-apps-manager\n/plugin install frappe-apps-manager@Venkateshvenki404224\n```\n\n**Local Development:**\n```bash\ngit clone https://github.com/Venkateshvenki404224/frappe-apps-manager.git\n/plugin marketplace add ./frappe-apps-manager\n/plugin install frappe-apps-manager@frappe-apps-manager\n```\n\n**Team Auto-Install:**\n\nAdd to your project's `.claude/settings.json`:\n```json\n{\n  \"pluginMarketplaces\": [{\n    \"name\": \"frappe-marketplace\",\n    \"source\": \"Venkateshvenki404224/frappe-apps-manager\"\n  }],\n  \"plugins\": [{\n    \"name\": \"frappe-apps-manager\",\n    \"marketplace\": \"frappe-marketplace\",\n    \"enabled\": true\n  }]\n}\n```\n\nTeam members who trust the repository will get the plugin automatically!\n\n### Prerequisites\n\n- Claude Code installed\n- Frappe Framework knowledge (basic to intermediate)\n- A Frappe bench for testing (recommended)\n\n## Usage Guide\n\n### Creating a New Frappe App\n\n```shell\n/frappe-new-app\n```\n\nClaude will guide you through:\n1. App naming and configuration\n2. Module setup\n3. Installation to a site\n4. Next steps for development\n\n### Building DocTypes\n\n```shell\n/frappe-new-doctype\n```\n\nOr simply ask Claude:\n> \"Create a Customer DocType with name, email, and phone fields\"\n\nClaude will automatically use the `frappe-doctype-builder` Skill to generate complete DocType JSON and controller files.\n\n### Creating API Endpoints\n\nAsk Claude to create APIs:\n> \"Create an API endpoint to get customer details by email\"\n\nClaude will use the `frappe-api-handler` Skill to generate secure, whitelisted methods with proper validation and error handling.\n\n### Generating Reports\n\nRequest custom reports:\n> \"Create a sales analysis report grouped by customer\"\n\nClaude will use the `frappe-report-generator` Skill to create query or script reports with filters, charts, and summaries.\n\n### Debugging Issues\n\nWhen you encounter errors:\n> \"I'm getting a permission error when submitting Sales Orders\"\n\nClaude can invoke the **Frappe Debugger** agent to analyze logs, check permissions, and provide solutions.\n\n### Deploying to Production\n\n```shell\n/frappe-deploy\n```\n\nClaude will guide you through:\n1. Pre-deployment checklist\n2. Backup creation\n3. Migration execution\n4. Service restart\n5. Post-deployment verification\n\n## Plugin Structure\n\n```\nfrappe-marketplace/\n‚îú‚îÄ‚îÄ .claude-plugin/\n‚îÇ   ‚îî‚îÄ‚îÄ marketplace.json\n‚îî‚îÄ‚îÄ frappe-apps-manager/\n    ‚îú‚îÄ‚îÄ .claude-plugin/\n    ‚îÇ   ‚îî‚îÄ‚îÄ plugin.json\n    ‚îú‚îÄ‚îÄ commands/               # 7 custom commands\n    ‚îÇ   ‚îú‚îÄ‚îÄ frappe-new-app.md\n    ‚îÇ   ‚îú‚îÄ‚îÄ frappe-install-app.md\n    ‚îÇ   ‚îú‚îÄ‚îÄ frappe-bench-start.md\n    ‚îÇ   ‚îú‚îÄ‚îÄ frappe-migrate.md\n    ‚îÇ   ‚îú‚îÄ‚îÄ frappe-backup.md\n    ‚îÇ   ‚îú‚îÄ‚îÄ frappe-new-doctype.md\n    ‚îÇ   ‚îî‚îÄ‚îÄ frappe-deploy.md\n    ‚îú‚îÄ‚îÄ agents/                 # 3 specialized agents\n    ‚îÇ   ‚îú‚îÄ‚îÄ frappe-developer.md\n    ‚îÇ   ‚îú‚îÄ‚îÄ frappe-debugger.md\n    ‚îÇ   ‚îî‚îÄ‚îÄ frappe-architect.md\n    ‚îú‚îÄ‚îÄ skills/                 # 3 agent Skills\n    ‚îÇ   ‚îú‚îÄ‚îÄ frappe-doctype-builder/\n    ‚îÇ   ‚îÇ   ‚îî‚îÄ‚îÄ SKILL.md\n    ‚îÇ   ‚îú‚îÄ‚îÄ frappe-api-handler/\n    ‚îÇ   ‚îÇ   ‚îî‚îÄ‚îÄ SKILL.md\n    ‚îÇ   ‚îî‚îÄ‚îÄ frappe-report-generator/\n    ‚îÇ       ‚îî‚îÄ‚îÄ SKILL.md\n    ‚îî‚îÄ‚îÄ hooks/                  # Automated workflows\n        ‚îî‚îÄ‚îÄ hooks.json\n```\n\n## Development Workflow\n\n### Typical Development Session\n\n1. **Navigate to your bench:**\n   ```bash\n   cd /path/to/frappe-bench\n   claude\n   ```\n\n2. **Create a new app:**\n   ```shell\n   /frappe-new-app\n   ```\n\n3. **Build your DocTypes:**\n   > \"Create a Project DocType with fields for project name, start date, end date, and status\"\n\n4. **Add business logic:**\n   > \"Add validation to ensure end date is after start date\"\n\n5. **Create APIs:**\n   > \"Create an API to get all active projects\"\n\n6. **Generate reports:**\n   > \"Create a report showing projects by status\"\n\n7. **Test and debug:**\n   > \"Why am I getting a validation error when saving projects?\"\n\n8. **Deploy:**\n   ```shell\n   /frappe-deploy\n   ```\n\n## Best Practices\n\n### When to Use Commands vs Agents\n\n**Use Commands when:**\n- You want guided, step-by-step workflows\n- You're performing standard operations (backup, migrate, deploy)\n- You want consistent, repeatable processes\n\n**Use Agents when:**\n- You need expert consultation on architecture\n- You're debugging complex issues\n- You want detailed code review or optimization suggestions\n\n### Leveraging Skills\n\nSkills are invoked automatically by Claude when appropriate. You don't need to explicitly call them. Just describe what you want:\n\n**DocType Building:**\n> \"I need a Customer DocType with contact details and credit limit\"\n\n**API Creation:**\n> \"Create an endpoint to update customer email addresses\"\n\n**Report Generation:**\n> \"Show me monthly sales trends by product category\"\n\n## Troubleshooting\n\n### Plugin Not Loading\n\n1. Verify installation:\n   ```shell\n   /plugin\n   ```\n   Check that `frappe-apps-manager` appears in the installed plugins list.\n\n2. Check marketplace:\n   ```shell\n   /plugin marketplace list\n   ```\n   Ensure `frappe-marketplace` is added.\n\n3. Restart Claude Code\n\n### Commands Not Appearing\n\nAfter installing the plugin, you may need to restart Claude Code for commands to appear in `/help`.\n\n### Hooks Not Triggering\n\nHooks run based on specific conditions. Check:\n- Are you in a Frappe bench directory?\n- Are you using the relevant tools (Bash, Write, Edit)?\n- Check hook configuration in `hooks/hooks.json`\n\n## Advanced Usage\n\n### Combining Multiple Features\n\nExample: Building a complete module\n\n1. **Plan the architecture:**\n   > \"I want to build a project management module. Help me design the DocTypes and their relationships.\"\n\n   (Claude invokes **Frappe Architect** agent)\n\n2. **Create the app:**\n   ```shell\n   /frappe-new-app\n   ```\n\n3. **Build DocTypes:**\n   > \"Create the DocTypes we discussed\"\n\n   (Claude uses **frappe-doctype-builder** Skill)\n\n4. **Add APIs:**\n   > \"Create APIs for project CRUD operations\"\n\n   (Claude uses **frappe-api-handler** Skill)\n\n5. **Build reports:**\n   > \"Create a project timeline report\"\n\n   (Claude uses **frappe-report-generator** Skill)\n\n6. **Test:**\n   ```shell\n   /frappe-bench-start\n   ```\n\n7. **Deploy:**\n   ```shell\n   /frappe-deploy\n   ```\n\n### Customizing the Plugin\n\nYou can extend this plugin by:\n\n1. **Adding more commands** - Create `.md` files in `commands/`\n2. **Creating new agents** - Add agent definitions in `agents/`\n3. **Building Skills** - Create new Skills in `skills/`\n4. **Configuring hooks** - Modify `hooks/hooks.json`\n\nSee [Claude Code Plugin Documentation](https://code.claude.com/docs/en/plugins) for details.\n\n## Contributing\n\nContributions are welcome! To contribute:\n\n1. Fork the repository\n2. Create a feature branch\n3. Add your enhancements\n4. Test thoroughly with a Frappe bench\n5. Submit a pull request\n\n### Development Setup\n\n```bash\n# Clone the marketplace\ngit clone <repository-url>\ncd frappe-marketplace\n\n# Make changes to the plugin\ncd frappe-apps-manager\n\n# Test locally\ncd ../..\nclaude\n/plugin marketplace add ./frappe-marketplace\n/plugin install frappe-apps-manager@frappe-marketplace\n```\n\n## Version History\n\n### v1.0.0 (Current)\n- Initial release\n- 7 custom commands\n- 3 specialized agents\n- 3 agent Skills\n- Automated hooks for common workflows\n\n## Support\n\n### Getting Help\n\n- **Documentation:** [Frappe Framework Docs](https://frappeframework.com/docs)\n- **Plugin Issues:** Create an issue in the repository\n- **Claude Code Help:** `/help` command or [Claude Code Docs](https://code.claude.com/docs)\n\n### Common Questions\n\n**Q: Do I need a running Frappe bench to use this plugin?**\nA: While many features work without a bench, having a test bench provides the best experience for testing commands and validating generated code.\n\n**Q: Can I use this with ERPNext?**\nA: Yes! ERPNext is built on Frappe Framework, so all these tools work seamlessly with ERPNext development.\n\n**Q: Will this work with Frappe Cloud?**\nA: Most development features work locally. For deployment, adjust the `/frappe-deploy` workflow for Frappe Cloud's deployment process.\n\n**Q: Can I use this for Frappe version X?**\nA: This plugin is designed to work with modern Frappe versions (v13+). Some features may need adjustments for older versions.\n\n## License\n\nMIT License - See LICENSE file for details\n\n## Acknowledgments\n\n- Frappe Framework team for the amazing framework\n- Anthropic for Claude and Claude Code\n- Frappe community for development best practices\n\n## Related Resources\n\n- [Frappe Framework Documentation](https://frappeframework.com/docs)\n- [Frappe GitHub](https://github.com/frappe/frappe)\n- [ERPNext](https://erpnext.com)\n- [Frappe School](https://frappe.school)\n- [Claude Code Documentation](https://code.claude.com/docs)\n\n---\n\n**Happy Frappe Development!** üöÄ\n\nBuilt with ‚ù§Ô∏è for the Frappe community\n"
      },
      "plugins": [
        {
          "name": "frappe-apps-manager",
          "source": "./frappe-apps-manager",
          "description": "Comprehensive Frappe Framework development platform with 95% SDLC coverage - 15 commands, 10 agents, 15 skills for complete Frappe/ERPNext development lifecycle",
          "version": "2.0.0",
          "tags": [
            "frappe",
            "erpnext",
            "development",
            "bench",
            "doctype",
            "testing",
            "deployment",
            "performance",
            "security",
            "devops"
          ],
          "categories": [
            "bench",
            "deployment",
            "development",
            "devops",
            "doctype",
            "erpnext",
            "frappe",
            "performance",
            "security",
            "testing"
          ],
          "install_commands": [
            "/plugin marketplace add Venkateshvenki404224/frappe-apps-manager",
            "/plugin install frappe-apps-manager@frappe-marketplace"
          ]
        }
      ]
    }
  ]
}