{
  "author": {
    "id": "vkkotha",
    "display_name": "vkkotha",
    "avatar_url": "https://avatars.githubusercontent.com/u/4230336?v=4"
  },
  "marketplaces": [
    {
      "name": "cdskit-marketplace",
      "version": null,
      "description": "Git worktree skill - Create isolated worktrees for PRs, branches, tags, or commits",
      "repo_full_name": "vkkotha/claude-skills",
      "repo_url": "https://github.com/vkkotha/claude-skills",
      "repo_description": "A collection of reusable skills for Claude Code",
      "signals": {
        "stars": 0,
        "forks": 0,
        "pushed_at": "2026-01-29T18:04:46Z"
      },
      "files": {
        ".claude-plugin/marketplace.json": "{\n  \"name\": \"cdskit-marketplace\",\n  \"owner\": {\n    \"name\": \"vkkotha\"\n  },\n  \"plugins\": [\n    {\n      \"name\": \"git-plugin\",\n      \"source\": \"./git-plugin/\",\n      \"description\": \"Git worktree skill - Create isolated worktrees for PRs, branches, tags, or commits\"\n    },\n    {\n      \"name\": \"bitbucket-plugin\",\n      \"source\": \"./bitbucket-plugin/\",\n      \"description\": \"Bitbucket Cloud PR operations - List, review, and manage pull requests on Bitbucket Cloud (bitbucket.org)\"\n    },\n    {\n      \"name\": \"bitbucket-datacenter-plugin\",\n      \"source\": \"./bitbucket-datacenter-plugin/\",\n      \"description\": \"Bitbucket Data Center PR operations - List, review, and manage pull requests on self-hosted Bitbucket Server/Data Center\"\n    },\n    {\n      \"name\": \"github-plugin\",\n      \"source\": \"./github-plugin/\",\n      \"description\": \"GitHub PR operations - List, review, and manage pull requests on GitHub\"\n    }\n  ]\n}\n",
        "README.md": "# Claude Developer Skills Kit\n\nA collection of developer productivity skills for Claude Code including GitHub, Bitbucket PR review and git worktree management.\n\n## Available Plugins\n\n| Plugin | Description |\n|--------|-------------|\n| [git-plugin](./git-plugin/) | Create isolated git worktrees for PRs, branches, tags, or commits |\n| [bitbucket-plugin](./bitbucket-plugin/) | PR operations for Bitbucket Cloud (bitbucket.org) |\n| [bitbucket-datacenter-plugin](./bitbucket-datacenter-plugin/) | PR operations for self-hosted Bitbucket Server/Data Center |\n| [github-plugin](./github-plugin/) | PR operations for GitHub |\n\n## Installation\n\n### Quick Install (Recommended)\n\n```bash\n# Add the marketplace\n/plugin marketplace add https://github.com/vkkotha/claude-skills\n\n# Install individual plugins\n/plugin install git-plugin@cdskit-marketplace\n/plugin install bitbucket-plugin@cdskit-marketplace\n/plugin install bitbucket-datacenter-plugin@cdskit-marketplace\n/plugin install github-plugin@cdskit-marketplace\n```\n\n### Development Mode\n\nFor testing or development, load a plugin directly without installing:\n\n```bash\n# Clone the repository\ngit clone https://github.com/vkkotha/claude-skills.git\n\n# Run Claude Code with a specific plugin\nclaude --plugin-dir ./claude-skills/git-plugin\nclaude --plugin-dir ./claude-skills/bitbucket-plugin\nclaude --plugin-dir ./claude-skills/bitbucket-datacenter-plugin\nclaude --plugin-dir ./claude-skills/github-plugin\n```\n\n## Plugins\n\n### git-plugin\n\nGit utility for creating isolated worktrees. Features:\n- Supports PRs, branches, tags, and commits\n- Cross-platform (macOS, Linux, Windows via Git Bash/WSL)\n- Auto-detects IDE context (VS Code, JetBrains, Claude Code CLI)\n- Bitbucket and GitHub PR refs support\n- Worktree auto-cleanup with confirmation\n\n**Prerequisites:** Git 2.5+ and Bash.\n\n**Usage:**\n```\n\"Create a worktree for PR 456\"\n\"Help me inspect branch feature/login\"\n```\n\n### bitbucket-plugin\n\nPull request operations for Bitbucket Cloud (bitbucket.org). Features:\n- List PRs in table format with status icons\n- Fetch PR details and diffs via MCP\n- AI-powered code review for bugs, security, performance issues\n- Post inline comments and suggestions\n- Approve, request changes, or merge PRs\n\n**Prerequisites:** Requires the Bitbucket Cloud MCP server.\n\n```bash\nexport BITBUCKET_USERNAME=\"your-username\"\nexport BITBUCKET_APP_PASSWORD=\"your-app-password\"\n```\n\n**Usage:**\n```\n\"Review PR 123\"\n\"List open PRs\"\n\"Approve PR 456\"\n```\n\n### bitbucket-datacenter-plugin\n\nPull request operations for self-hosted Bitbucket Server/Data Center. Features:\n- List PRs in table format with status icons\n- Fetch PR details and diffs via MCP\n- AI-powered code review for bugs, security, performance issues\n- Post inline comments and suggestions\n- Approve, request changes, or merge PRs\n\n**Prerequisites:** Requires the Bitbucket Data Center MCP server.\n\n```bash\nexport BITBUCKET_USERNAME=\"your.email@company.com\"\nexport BITBUCKET_TOKEN=\"your-http-access-token\"\nexport BITBUCKET_BASE_URL=\"https://bitbucket.yourcompany.com\"\n```\n\n**Usage:**\n```\n\"Review PR 123\"\n\"List open PRs\"\n\"Approve PR 456\"\n```\n\n### github-plugin\n\nPull request operations for GitHub. Features:\n- List PRs in table format with status icons\n- Fetch PR details and diffs via MCP\n- AI-powered code review for bugs, security, performance issues\n- Post inline comments and suggestions\n- Approve, request changes, or merge PRs\n\n**Prerequisites:** Requires the GitHub MCP server.\n\n```bash\nexport GITHUB_PERSONAL_ACCESS_TOKEN=\"your-token\"\n```\n\n**Creating a GitHub Personal Access Token:**\n1. Go to https://github.com/settings/tokens\n2. Click \"Generate new token\" (classic or fine-grained)\n3. For classic tokens, select scopes: `repo`, `read:org`, `read:user`\n4. For fine-grained tokens, grant access to the repositories you need\n5. Copy the generated token\n\n**Usage:**\n```\n\"Review PR 123\"\n\"List open PRs\"\n\"Approve PR 456\"\n```\n\n## Development\n\n### Testing a Plugin\n\n```bash\n# Load plugin for development/testing\nclaude --plugin-dir ./claude-skills/git-plugin\n\n# Load multiple plugins\nclaude --plugin-dir ./claude-skills/git-plugin --plugin-dir ./claude-skills/github-plugin\n```\n\n### Plugin Environment Variables\n\nIn hooks, MCP servers, and skill scripts, use `${CLAUDE_PLUGIN_ROOT}` to reference the plugin directory:\n\n```bash\n\"${CLAUDE_PLUGIN_ROOT}/skills/git-worktree/setup-worktree.sh\" --pr 558\n```\n\n## Contributing\n\nContributions are welcome! To add a new skill:\n\n1. Fork this repository\n2. Create a new folder named `<your-skill-name>`\n3. Add `.claude-plugin/plugin.json` with plugin metadata\n4. Add `skills/<skill-name>/SKILL.md` with YAML frontmatter and instructions\n5. Update `marketplace.json` with the new plugin\n6. Update `README.md` with skill documentation\n7. Submit a pull request\n\n### Skill Template\n\nCreate folder structure:\n```\nmy-skill/\n├── .claude-plugin/\n│   └── plugin.json\n└── skills/\n    └── my-skill/\n        └── SKILL.md\n```\n\n**plugin.json:**\n```json\n{\n  \"name\": \"my-skill\",\n  \"version\": \"1.0.0\",\n  \"description\": \"Short description of the skill\",\n  \"author\": { \"name\": \"your-name\" },\n  \"repository\": \"https://github.com/your-repo\",\n  \"license\": \"MIT\",\n  \"skills\": [\"./skills/\"]\n}\n```\n\n**SKILL.md:**\n```yaml\n---\nname: \"my-skill\"\ndescription: Short description for skill matching. Use when user wants to...\n---\n\n# My Skill\n\nDetailed instructions for the skill...\n\n## Prerequisites\n\nList any requirements...\n\n## Instructions\n\nStep-by-step instructions for Claude to follow...\n```\n\n## License\n\nMIT License - See [LICENSE](./LICENSE) for details.\n"
      },
      "plugins": [
        {
          "name": "git-plugin",
          "source": "./git-plugin/",
          "description": "Git worktree skill - Create isolated worktrees for PRs, branches, tags, or commits",
          "categories": [],
          "install_commands": [
            "/plugin marketplace add vkkotha/claude-skills",
            "/plugin install git-plugin@cdskit-marketplace"
          ]
        },
        {
          "name": "bitbucket-plugin",
          "source": "./bitbucket-plugin/",
          "description": "Bitbucket Cloud PR operations - List, review, and manage pull requests on Bitbucket Cloud (bitbucket.org)",
          "categories": [],
          "install_commands": [
            "/plugin marketplace add vkkotha/claude-skills",
            "/plugin install bitbucket-plugin@cdskit-marketplace"
          ]
        },
        {
          "name": "bitbucket-datacenter-plugin",
          "source": "./bitbucket-datacenter-plugin/",
          "description": "Bitbucket Data Center PR operations - List, review, and manage pull requests on self-hosted Bitbucket Server/Data Center",
          "categories": [],
          "install_commands": [
            "/plugin marketplace add vkkotha/claude-skills",
            "/plugin install bitbucket-datacenter-plugin@cdskit-marketplace"
          ]
        },
        {
          "name": "github-plugin",
          "source": "./github-plugin/",
          "description": "GitHub PR operations - List, review, and manage pull requests on GitHub",
          "categories": [],
          "install_commands": [
            "/plugin marketplace add vkkotha/claude-skills",
            "/plugin install github-plugin@cdskit-marketplace"
          ]
        }
      ]
    }
  ]
}