{
  "author": {
    "id": "vre",
    "display_name": "Ville Reijonen",
    "avatar_url": "https://avatars.githubusercontent.com/u/1233405?u=4bba894ea8c0460e7e3bd7ce3988ada3fc7d484e&v=4"
  },
  "marketplaces": [
    {
      "name": "flow-state",
      "version": null,
      "description": "Knowledge work, context management, and productivity tools/skills/etc. for Claude Code",
      "repo_full_name": "vre/flow-state",
      "repo_url": "https://github.com/vre/flow-state",
      "repo_description": "Flow State - a Claude Plugin Marketplace",
      "signals": {
        "stars": 6,
        "forks": 0,
        "pushed_at": "2026-02-15T01:04:27Z"
      },
      "files": {
        ".claude-plugin/marketplace.json": "{\n  \"name\": \"flow-state\",\n  \"owner\": {\n    \"name\": \"Ville Reijonen\",\n    \"email\": \"marketplace@vre.iki.fi\"\n  },\n  \"metadata\": {\n    \"description\": \"Knowledge work, context management, and productivity tools/skills/etc. for Claude Code\",\n    \"version\": \"20260126.2100\",\n    \"pluginRoot\": \"./\"\n  },\n  \"plugins\": [\n    {\n      \"name\": \"youtube-to-markdown\",\n      \"source\": \"./youtube-to-markdown\",\n      \"description\": \"Transform YouTube video to storagable knowledge. Choose from summary only, transcript only, comments only, or full extraction. Get tight summary, cleaned transcript, and curated comment insights cross-analyzed against video content. Modular architecture runs independent steps in parallel.\",\n      \"version\": \"2.3.4\",\n      \"category\": \"media-extraction\",\n      \"keywords\": [\"youtube\", \"transcript\", \"captions\", \"markdown\", \"summary\", \"chapters\", \"comments\"],\n      \"skills\": [\"./\"]\n    },\n    {\n      \"name\": \"imap-stream-mcp\",\n      \"source\": \"./imap-stream-mcp\",\n      \"description\": \"Lightweight IMAP email MCP server. ~500 tokens vs 15,000+. Read, search, draft, flag emails with markdown support.\",\n      \"version\": \"0.4.0\",\n      \"category\": \"productivity\",\n      \"keywords\": [\"email\", \"imap\", \"mcp\"]\n    }\n  ]\n}\n",
        "README.md": "# Flow State - a Claude Plugin Marketplace\n\n## **Youtube to Markdown Skill**\n\n> **Skip the Video - Extract the Knowledge.**\n> Transform streaming content into storagable knowledge as Markdown.\n> Drop into Obsidian, Notion, or any note-taking system.\n\n- ‚ú® **TL;DR + structured summary**: Core insights with four content specific summarization formats\n- üíé **Hidden Gems**: Collects insights that normal summarization loses\n- üéõÔ∏è **Modular**: Choose output from Everything to Summary only, Transcript only, or Comments only.\n- üßπ **Cleaned transcript**: Broken into chapters and paragraphs with topic headings into own file\n- üè∑Ô∏è **Timestamp links**: Jump back to specific moments in the original video from the transcript\n- üí¨ **Comment analysis**: Curates and cross-analyzes comments against the summary\n\n## **IMAP Stream MCP Server** \n\n> **Your Inbox, Minimal Context.**\n> Lightweight IMAP email client. No destructive operations.\n\n- ü™∂ **~500 tokens** vs typical 15,000+ MCP servers - single tool with action dispatcher\n- üìß **Read & search**: List, read, and search IMAP folders\n- ‚úçÔ∏è **Draft replies**: Markdown converted to HTML + plain text alternatives\n- üìé **Attachments**: Download for further processing\n- üîê **Secure**: Credentials in OS keychain (or env variables for Docker/CI)\n- üõ°Ô∏è **Content Safety**: Encapsulates email content to avoid context poisoning\n- üè¢ **Multi-account**: Multiple account support with named switching\n\n## Quick Start\n\n### Installation\n\nAdd the marketplace and install:\n```bash\n/plugin marketplace add vre/flow-state\n\n/plugin install youtube-to-markdown@flow-state\n/plugin install imap-stream-mcp@flow-state\n```\n\n### Usage\n\n**Youtube-to-Markdown:**\nIn your Claude Code:\n```\nextract https://www.youtube.com/watch?v=dQw4w9WgXcQ\n```\n('get', 'fetch', 'transcript', 'subtitles', 'captions', etc. works too)\n\n**IMAP-Stream-MCP:**\nIn your Claude Code:\n```\nwhat email accounts I have?\n```\nAs you don't have any configured yet, it will show you how to set up.\n\n## Documentation\n\n- [youtube-to-markdown](youtube-to-markdown/README.md) - Installation, usage, output options\n- [imap-stream-mcp](imap-stream-mcp/README.md) - Configuration, actions, multi-account setup\n\n## Examples of Youtube to Markdown Output\n\nAll examples are CC-licensed videos with full summary and comment analysis.\n\n| Type | Summary | Links |\n|------|---------|-------|\n| Tutorial | [Faro Shuffle Tutorial!](examples/youtube%20-%20Faro%20Shuffle%20Tutorial!%20(RXhNA0xLRgY).md) | [transcript](examples/youtube%20-%20Faro%20Shuffle%20Tutorial!%20-%20transcript%20(RXhNA0xLRgY).md) ¬∑ [video](https://www.youtube.com/watch?v=RXhNA0xLRgY) |\n| Educational | [Brain: Parts & functions](examples/youtube%20-%20Brain%20Parts%20%26%20functions%20(Fore,%20mid%20%26%20hind)%20Control%20%26%20(DtkRGbTp1s8).md) | [transcript](examples/youtube%20-%20Brain%20Parts%20%26%20functions%20(Fore,%20mid%20%26%20hind)%20Control%20%26%20-%20transcript%20(DtkRGbTp1s8).md) ¬∑ [video](https://www.youtube.com/watch?v=DtkRGbTp1s8) |\n| Educational | [Happiness is all in your mind](examples/youtube%20-%20Happiness%20is%20all%20in%20your%20mind%20Gen%20Kelsang%20Nyema%20at%20(xnLoToJVQH4).md) | [transcript](examples/youtube%20-%20Happiness%20is%20all%20in%20your%20mind%20Gen%20Kelsang%20Nyema%20at%20-%20transcript%20(xnLoToJVQH4).md) ¬∑ [video](https://www.youtube.com/watch?v=xnLoToJVQH4) |\n| Tips | [How to Become a Great Software Developer](examples/youtube%20-%20How%20to%20Become%20a%20Great%20Software%20Developer%20‚Äî%20Best%20Advice%20from%20(suATPK45sjk).md) | [transcript](examples/youtube%20-%20How%20to%20Become%20a%20Great%20Software%20Developer%20‚Äî%20Best%20Advice%20from%20-%20transcript%20(suATPK45sjk).md) ¬∑ [video](https://www.youtube.com/watch?v=suATPK45sjk) |\n| Tips | [Sourdough vs Normal Bread](examples/youtube%20-%20Sourdough%20vs%20Normal%20Bread%20-%20Whats%20the%20Difference%20(NieQHjCHnxg).md) | [transcript](examples/youtube%20-%20Sourdough%20vs%20Normal%20Bread%20-%20Whats%20the%20Difference%20-%20transcript%20(NieQHjCHnxg).md) ¬∑ [video](https://www.youtube.com/watch?v=NieQHjCHnxg) |\n| Interview | [Chris Rock on starting standup](examples/youtube%20-%20Chris%20Rock%20on%20starting%20standup%20How%20Neal%20Feel%20podcast%20(Ep%2077)%20(M6rBiCnntng).md) | [transcript](examples/youtube%20-%20Chris%20Rock%20on%20starting%20standup%20How%20Neal%20Feel%20podcast%20(Ep%2077)%20-%20transcript%20(M6rBiCnntng).md) ¬∑ [video](https://www.youtube.com/watch?v=M6rBiCnntng) |\n| Interview | [Interview with Senior JS Developer](examples/youtube%20-%20Interview%20with%20Senior%20JS%20Developer%20(Uo3cL4nrGOk).md) | [transcript](examples/youtube%20-%20Interview%20with%20Senior%20JS%20Developer%20-%20transcript%20(Uo3cL4nrGOk).md) ¬∑ [comments](examples/youtube%20-%20Interview%20with%20Senior%20JS%20Developer%20-%20comments%20(Uo3cL4nrGOk).md) ¬∑ [video](https://www.youtube.com/watch?v=Uo3cL4nrGOk) |\n\n## The Backstory\n\nI have been thinking a while to extract YouTube transcripts into Markdown format for my Obsidian vault. I knew of yt-dlp, but I wanted something more that would clean, format, summarize, analyze etc. LocalLlama was one option but never got the time.. Finally as checking out Claude Code skills in wild I thought that maybe there would be something already Done for Me. Well there was not, but I found one youtube skill to build upon. Four months later I added IMAP email access as well, as I wanted to have email reading and drafting capabilities in Claude Code in lightweight manner.\n\nMany ideas for the future - maybe knowledge work, context management, and productivity tools for Claude Code and beyond. Let's see where this goes and is there time for it..\n\n## Development\nSee [DEVELOPMENT.md](DEVELOPMENT.md).\n\n## License\n\nMIT, See [LICENSE](LICENSE) for more information.\n",
        "youtube-to-markdown/README.md": "# YouTube to Markdown\n\nTransform YouTube videos into storable knowledge as Markdown.\n\n- **TL;DR + structured summary** - Core insights with content-specific summarization\n- **Hidden Gems** - Insights that normal summarization loses\n- **Modular output** - Choose from summary, transcript, comments, or all\n\n## Features\n\n- **Summary** - TL;DR + structured summary with four content-specific formats (Tips, Interview, Educational, Tutorial)\n- **Transcript** - Cleaned and formatted with chapters, paragraphs, and topic headings\n- **Timestamp links** - Jump back to specific moments in the original video\n- **Comment analysis** - Curated comments cross-analyzed against video content\n- **Update mode** - Refresh existing extractions when video metadata changes\n\n## Security\n\nDefends against prompt injection in YouTube content. User-generated content (descriptions, comments, transcripts) is wrapped in `<untrusted_xxx_content>` XML tags with warnings, and injection patterns are escaped.\n\n## Installation for Claude Code\n\n### As a Plugin\n\n```bash\n/plugin marketplace add vre/flow-state\n/plugin install youtube-to-markdown@flow-state\n```\n\n### Dependencies\n\n- Python 3.10+\n- yt-dlp (`brew install yt-dlp` or `pip install yt-dlp`)\n\n## Usage\n\n```\nextract https://www.youtube.com/watch?v=VIDEO_ID\n```\n\nAlso works: `get`, `fetch`, `transcript`, `subtitles`, `captions`\n\n## Workflow: Extract Video\n\n1. **Provide YouTube URL** - paste the video link\n2. **Choose output** - Summary only, Transcript only, Comments only, Summary+Comments, or Full\n3. **Wait for extraction** - Claude processes video data and generates markdown\n4. **Get files** - Drop into Obsidian, Notion, or any note-taking system\n\n## Output Options\n\n| Option | Output |\n|--------|--------|\n| Summary only | Summary with TL;DR and key insights |\n| Transcript only | Cleaned, formatted full transcript |\n| Comments only | Curated top comments |\n| Summary + Comments | Summary with cross-analyzed comment insights |\n| Full | All: summary, transcript, comments |\n\n## Output Files\n\n- `youtube - {title} ({video_id}).md` - Summary with metadata\n- `youtube - {title} - transcript ({video_id}).md` - Cleaned transcript with timestamps\n- `youtube - {title} - comments ({video_id}).md` - Curated comments\n\n## Project Structure\n\n```\nscripts/             # CLI entry points (numbered by pipeline order)\n  10_extract_metadata.py\n  11_extract_transcript.py\n  13_extract_comments.py\n  20_check_existing.py\n  21_prepare_update.py\n  30_clean_vtt.py\n  31_format_transcript.py\n  32_filter_comments.py\n  40_backup.py\n  41_update_metadata.py\n  50_assemble.py\nlib/                 # Importable library modules\ntemplates/           # Markdown output templates\nsubskills/           # LLM instructions for Claude\nSKILL.md             # Main skill definition\n```\n\n## Attribution\n\nYoutube transcription skill is based on [tapestry-skills-for-claude-code](https://github.com/michalparkola/tapestry-skills-for-claude-code/blob/main/youtube-transcript/SKILL.md) youtube-transcript skill by Micha≈Ç Parko≈Ça.\n\n## License\n\nMIT, See [LICENSE](LICENSE) for more information.\n",
        "imap-stream-mcp/README.md": "# IMAP Stream MCP\n\nLightweight IMAP email client for Claude Desktop/Code/Cowork.\n\nInspired by [Jesse Vincent's MCP design philosophy](https://blog.fsck.com/2025/10/19/mcps-are-not-like-other-apis/):\n- **~500 tokens** vs typical 15,000+ token MCP servers\n- Single `use_mail` tool with action dispatcher\n- Self-documenting via `help` action\n- Credentials stored securely in OS keychain\n\n## Features\n\n- **list** - List messages in any folder\n- **read** - Read message content with attachments\n- **search** - Search by sender, subject, date, or text\n- **draft** - Create/modify draft replies (adding attachments to drafts not supported)\n- **flag** - Add/remove flags and labels (Seen, Flagged, Deleted, $label1, etc.)\n- **folders** - List available folders\n- **accounts** - List configured email accounts\n- **attachment** - Download attachments to temp directory (`{tempdir}/streammail/`)\n- **cleanup** - Remove downloaded attachments (auto-cleared on reboot on macOS/Linux, persists on Windows until user cleans)\n- **help** - Built-in documentation\n\n## Installation for Claude Code\n\n### As a Plugin\n\n```bash\n/plugin marketplace add vre/flow-state\n/plugin install imap-stream-mcp@flow-state\n```\n\nThen configure credentials (see below).\n\n### Manual Installation\n\n```bash\ngit clone https://github.com/vre/flow-state.git\ncd flow-state/imap-stream-mcp\nuv sync\nclaude mcp add imap-stream -- uv --directory $(pwd) run imap-stream\n```\n(you can define the [installation scope](https://code.claude.com/docs/en/mcp#mcp-installation-scopes) with \"claude mcp add --scope local|user|project ...\")\n\n## Configuration\n\n### Option 1: OS Keychain (Recommended)\n\n```bash\nuv run python setup.py                 # Interactive setup\nuv run python setup.py --add work      # Add named account\nuv run python setup.py --list          # Show accounts\nuv run python setup.py --default work  # Set default\nuv run python setup.py --remove work   # Remove account\n```\n\n### Option 2: Environment Variables (Automation/Docker)\n\nAdd to your MCP config:\n\n```json\n\"env\": {\n  \"IMAP_STREAM_SERVER\": \"imap.example.com\",\n  \"IMAP_STREAM_USERNAME\": \"you@example.com\",\n  \"IMAP_STREAM_PASSWORD\": \"app-password\"\n}\n```\n\n## Installation for Claude Desktop (Manual)\n\nAdd to `~/Library/Application Support/Claude/claude_desktop_config.json`:\n\n```json\n{\n  \"mcpServers\": {\n    \"imap-stream\": {\n      \"command\": \"uv\",\n      \"args\": [\"--directory\", \"/path/to/imap-stream-mcp\", \"run\", \"imap-stream\"]\n    }\n  }\n}\n```\n\n## Workflow: Reply to Email\n\n1. **List todays messages from INBOX** to find the email one you want\n2. **Read the message from XXX** to load the content into context\n3. **I would like to answer...** create reply with Claude's help\n4. **Send via email client** ‚Üí Drafts ‚Üí Review and send\n\n## Security\n\n- **No destructive operations** - No EXPUNGE, no permanent deletion. `\\Deleted` flag only marks messages (recoverable). Creates/modifies drafts in Drafts folder only.\n- **Content safety** - Email content encapsulated to prevent prompt injection / context poisoning\n- **Keychain storage** - Credentials in system keychain (macOS Keychain, Windows Credential Manager, Linux Secret Service)\n- **No credential leaks** - Password fetched by script only when IMAP connection opens, LLM never sees the password\n- **Encrypted connection** - SSL/TLS required\n\n## Project Structure\n\n```\nimap_stream_mcp.py   # MCP server entry point, action dispatcher\nimap_client.py       # IMAP operations (list, read, search, draft)\nmarkdown_utils.py    # Markdown ‚Üí HTML conversion for drafts\nsetup.py             # Credential configuration utility\ndebug_imap.py        # Connection troubleshooting utility\n.mcp.json            # MCP server configuration for plugin install\n```\n\n## MCP API - Usage\n\n```\n# List messages\n{action: \"list\", folder: \"INBOX\"}\n{action: \"list\", folder: \"INBOX\", limit: 50}\n\n# Read message\n{action: \"read\", folder: \"INBOX\", payload: \"12345\"}\n\n# Search\n{action: \"search\", folder: \"INBOX\", payload: \"from:boss@company.com\"}\n{action: \"search\", folder: \"INBOX\", payload: \"subject:urgent\"}\n{action: \"search\", folder: \"INBOX\", payload: \"since:2024-01-01\"}\n\n# Create draft\n{action: \"draft\", payload: '{\"to\":\"x@y.com\",\"subject\":\"Re: Hi\",\"body\":\"Thanks!\",\"in_reply_to\":\"<msgid>\"}'}\n\n# Flag messages\n{action: \"flag\", folder: \"INBOX\", payload: \"123:+Flagged\"}\n{action: \"flag\", folder: \"INBOX\", payload: \"123:-Seen\"}\n{action: \"flag\", folder: \"INBOX\", payload: \"123,124,125:+Deleted\"}\n{action: \"flag\", folder: \"INBOX\", payload: \"123:+$label1\"}\n\n# List folders\n{action: \"folders\"}\n\n# List accounts\n{action: \"accounts\"}\n\n# Download attachment (first attachment from message 1253)\n{action: \"attachment\", folder: \"INBOX\", payload: \"1253:0\"}\n\n# Clean up downloaded attachments\n{action: \"cleanup\"}\n\n# Help\n{action: \"help\"}\n{action: \"help\", payload: \"draft\"}\n```\n\n## MCP API - Multi-Account Usage\n\n```\n# Use default account\n{action: \"list\", folder: \"INBOX\"}\n\n# Use specific account\n{action: \"list\", folder: \"INBOX\", account: \"work\"}\n```\n\n## License\n\nMIT, See [LICENSE](LICENSE) for more information.\n"
      },
      "plugins": [
        {
          "name": "youtube-to-markdown",
          "source": "./youtube-to-markdown",
          "description": "Transform YouTube video to storagable knowledge. Choose from summary only, transcript only, comments only, or full extraction. Get tight summary, cleaned transcript, and curated comment insights cross-analyzed against video content. Modular architecture runs independent steps in parallel.",
          "version": "2.3.4",
          "category": "media-extraction",
          "keywords": [
            "youtube",
            "transcript",
            "captions",
            "markdown",
            "summary",
            "chapters",
            "comments"
          ],
          "skills": [
            "./"
          ],
          "categories": [
            "captions",
            "chapters",
            "comments",
            "markdown",
            "media-extraction",
            "summary",
            "transcript",
            "youtube"
          ],
          "install_commands": [
            "/plugin marketplace add vre/flow-state",
            "/plugin install youtube-to-markdown@flow-state"
          ]
        },
        {
          "name": "imap-stream-mcp",
          "source": "./imap-stream-mcp",
          "description": "Lightweight IMAP email MCP server. ~500 tokens vs 15,000+. Read, search, draft, flag emails with markdown support.",
          "version": "0.4.0",
          "category": "productivity",
          "keywords": [
            "email",
            "imap",
            "mcp"
          ],
          "categories": [
            "email",
            "imap",
            "mcp",
            "productivity"
          ],
          "install_commands": [
            "/plugin marketplace add vre/flow-state",
            "/plugin install imap-stream-mcp@flow-state"
          ]
        }
      ]
    }
  ]
}