{
  "author": {
    "id": "whatnextjamie",
    "display_name": "Jamie Thompson",
    "avatar_url": "https://avatars.githubusercontent.com/u/30541689?v=4"
  },
  "marketplaces": [
    {
      "name": "stripe-plugins",
      "version": "1.0.0",
      "description": "Claude Code plugins for Stripe developers - webhooks, payments, and API integrations",
      "repo_full_name": "whatnextjamie/stripe-claude-plugins",
      "repo_url": "https://github.com/whatnextjamie/stripe-claude-plugins",
      "repo_description": null,
      "signals": {
        "stars": 0,
        "forks": 0,
        "pushed_at": "2025-11-01T23:24:32Z"
      },
      "files": {
        ".claude-plugin/marketplace.json": "{\n  \"name\": \"stripe-plugins\",\n  \"owner\": {\n    \"name\": \"Jamie Thompson\",\n    \"url\": \"https://github.com/whatnextjamie\"\n  },\n  \"description\": \"Claude Code plugins for Stripe developers - webhooks, payments, and API integrations\",\n  \"version\": \"1.0.0\",\n  \"plugins\": [\n    {\n      \"name\": \"stripe-webhook-skills\",\n      \"description\": \"Expert Stripe webhook debugging and code generation skills for Claude Code\",\n      \"version\": \"1.0.1\",\n      \"author\": {\n        \"name\": \"Jamie Thompson\"\n      },\n      \"license\": \"MIT\",\n      \"repository\": \"https://github.com/whatnextjamie/stripe-webhook-skills\",\n      \"homepage\": \"https://github.com/whatnextjamie/stripe-webhook-skills\",\n      \"keywords\": [\n        \"stripe\",\n        \"webhooks\",\n        \"payments\",\n        \"debugging\",\n        \"code-generation\",\n        \"skills\"\n      ],\n      \"source\": {\n        \"source\": \"github\",\n        \"repo\": \"whatnextjamie/stripe-webhook-skills\"\n      }\n    }\n  ]\n}\n",
        "README.md": "# Stripe Claude Code Plugins\n\nA curated marketplace of Claude Code plugins for Stripe developers. Build, debug, and integrate Stripe payments faster with AI-powered developer tools.\n\n## ğŸ¯ Why This Marketplace?\n\nThis is a **focused collection** of plugins specifically for Stripe development:\n\n- ğŸ¯ **Stripe-specific expertise** - Deep knowledge of Stripe APIs, webhooks, and patterns\n- ğŸš€ **Faster development** - Generate production-ready code that follows Stripe best practices\n- ğŸ› **Better debugging** - Expert diagnosis of common Stripe integration issues\n- ğŸ“š **Best practices** - Security-first approach with proper signature verification\n- ğŸ”„ **Always up-to-date** - Maintained by developers actively working with Stripe\n\n## ğŸš€ Quick Start\n\n### Installing the Marketplace\n\nAdd this marketplace to your Claude Code:\n\n```\n/plugin marketplace add whatnextjamie/stripe-claude-plugins\n```\n\n### Installing Plugins\n\nBrowse available plugins:\n\n```\n/plugin\n```\n\nInstall a specific plugin:\n\n```\n/plugin install stripe-webhook-skills@stripe-plugins\n```\n\n## ğŸ“¦ Available Plugins\n\n### stripe-webhook-skills\n\nExpert Stripe webhook debugging and code generation capabilities.\n\n**Features:**\n- Debug webhook signature verification issues\n- Analyze webhook event payloads\n- Generate production-ready webhook handlers\n- Framework support: Next.js, Express, FastAPI, Django\n- Database integrations: Prisma, SQLAlchemy\n- Complete with tests and documentation\n\n**Install:**\n```\n/plugin install stripe-webhook-skills@stripe-plugins\n```\n\n**Repository:** [stripe-webhook-skills](https://github.com/whatnextjamie/stripe-webhook-skills)\n\n---\n\n## ğŸ¤ Contributing\n\nWant to add your Stripe-related plugin to this marketplace? We welcome contributions!\n\n**See [CONTRIBUTING.md](CONTRIBUTING.md) for:**\n- Plugin requirements and quality standards\n- Step-by-step submission process\n- Plugin structure examples\n- Ideas for new plugins\n\n**Quick summary:**\n1. Create a Stripe-related Claude Code plugin\n2. Fork this repo and add your plugin to `.claude-plugin/marketplace.json`\n3. Test installation from your fork\n4. Submit a PR with plugin details\n\nWe review and merge quality plugins within a few days.\n\n---\n\n## ğŸ“š Resources\n\n### Claude Code Documentation\n\n- [Plugin Documentation](https://docs.claude.com/en/docs/claude-code/plugins)\n- [Plugin Marketplaces](https://docs.claude.com/en/docs/claude-code/plugin-marketplaces)\n- [Skills Documentation](https://docs.claude.com/en/docs/claude-code/skills)\n- [Commands Documentation](https://docs.claude.com/en/docs/claude-code/commands)\n\n### Example Plugins\n\n- [stripe-webhook-skills](https://github.com/whatnextjamie/stripe-webhook-skills) - Skills-based plugin with comprehensive reference materials\n\n---\n\n## ğŸ” Marketplace Structure\n\n```\nstripe-claude-plugins/\nâ”œâ”€â”€ .claude-plugin/\nâ”‚   â””â”€â”€ marketplace.json    # Plugin catalog\nâ”œâ”€â”€ README.md               # This file\nâ”œâ”€â”€ CONTRIBUTING.md         # How to contribute\nâ””â”€â”€ LICENSE                 # MIT License\n```\n\n---\n\n## ğŸ—ºï¸ Roadmap\n\nFuture plugins planned for this marketplace:\n\n### Webhooks & Events\n- âœ… **stripe-webhook-skills** - Webhook debugging and code generation\n- ğŸ”œ **stripe-event-inspector** - Advanced event payload analysis and testing\n\n### API Integration\n- ğŸ”œ **stripe-api-skills** - Payment Intent, Customer, and Subscription API helpers\n- ğŸ”œ **stripe-connect-skills** - Stripe Connect platform integration\n\n### Billing & Subscriptions\n- ğŸ”œ **stripe-billing-skills** - Subscription lifecycle management\n- ğŸ”œ **stripe-pricing-calculator** - Pricing model design and testing\n\n### Testing & Security\n- ğŸ”œ **stripe-test-generator** - Generate comprehensive Stripe integration tests\n- ğŸ”œ **stripe-security-audit** - Security best practices checker\n\n---\n\n## ğŸ¤ Maintenance & Philosophy\n\nThis marketplace is actively maintained by [Jamie Thompson](https://github.com/whatnextjamie), a design engineer passionate about improving the Stripe development experience.\n\n**Design Philosophy:**\n- **Quality over quantity** - Only well-tested, production-ready plugins\n- **Stripe-specific focus** - Deep domain expertise, not generic tools\n- **Security first** - All plugins follow Stripe security best practices\n- **Actively maintained** - Regular updates as Stripe APIs evolve\n- **Community-driven** - Contributions welcome from Stripe developers\n\n**Maintenance includes:**\n- Keeping plugins updated with latest Stripe API versions\n- Reviewing and testing plugin submissions\n- Ensuring security and code quality standards\n- Removing deprecated or broken plugins\n- Responding to issues and feature requests\n\n---\n\n## âš ï¸ Disclaimer\n\nPlugins in this marketplace are third-party extensions. While we review submissions for quality and security, use plugins at your own discretion. Always review plugin code before installation, especially in production environments.\n\n---\n\n## ğŸ“ License\n\nThis marketplace repository is licensed under the MIT License. Individual plugins may have different licenses - check each plugin's repository for details.\n\n---\n\n## ğŸ’¬ Support\n\n- **Issues:** [GitHub Issues](https://github.com/whatnextjamie/stripe-claude-plugins/issues)\n- **Discussions:** [GitHub Discussions](https://github.com/whatnextjamie/stripe-claude-plugins/discussions)\n\n---\n\n**Built for the Claude Code community** ğŸš€\n"
      },
      "plugins": [
        {
          "name": "stripe-webhook-skills",
          "description": "Expert Stripe webhook debugging and code generation skills for Claude Code",
          "version": "1.0.1",
          "author": {
            "name": "Jamie Thompson"
          },
          "license": "MIT",
          "repository": "https://github.com/whatnextjamie/stripe-webhook-skills",
          "homepage": "https://github.com/whatnextjamie/stripe-webhook-skills",
          "keywords": [
            "stripe",
            "webhooks",
            "payments",
            "debugging",
            "code-generation",
            "skills"
          ],
          "source": {
            "source": "github",
            "repo": "whatnextjamie/stripe-webhook-skills"
          },
          "categories": [
            "code-generation",
            "debugging",
            "payments",
            "skills",
            "stripe",
            "webhooks"
          ],
          "install_commands": [
            "/plugin marketplace add whatnextjamie/stripe-claude-plugins",
            "/plugin install stripe-webhook-skills@stripe-plugins"
          ]
        }
      ]
    }
  ]
}