{
  "author": {
    "id": "wildcard",
    "display_name": "Kobi Kadosh",
    "avatar_url": "https://avatars.githubusercontent.com/u/2939405?u=7d7e38e6c6e5da163dccf011bacdef9be3e91e7c&v=4"
  },
  "marketplaces": [
    {
      "name": "wildcard",
      "version": null,
      "description": "Wildcard's Claude Code plugin marketplace",
      "repo_full_name": "wildcard/claude-marketplace",
      "repo_url": "https://github.com/wildcard/claude-marketplace",
      "repo_description": "Wildcard's Claude Code plugin marketplace",
      "signals": {
        "stars": 0,
        "forks": 0,
        "pushed_at": "2026-01-02T07:51:06Z"
      },
      "files": {
        ".claude-plugin/marketplace.json": "{\n  \"name\": \"wildcard\",\n  \"owner\": {\n    \"name\": \"wildcard\"\n  },\n  \"metadata\": {\n    \"description\": \"Wildcard's Claude Code plugin marketplace\"\n  },\n  \"plugins\": [\n    {\n      \"name\": \"shell-ergonomics-skills\",\n      \"source\": {\n        \"source\": \"github\",\n        \"repo\": \"wildcard/shell-ergonomics-skills\"\n      },\n      \"description\": \"Shell ergonomics plugin: AI-powered statusline, session tracking, summaries, and developer experience tools\",\n      \"version\": \"1.0.1\",\n      \"author\": {\n        \"name\": \"wildcard\"\n      },\n      \"license\": \"MIT\",\n      \"keywords\": [\"statusline\", \"starship\", \"ai-summary\", \"hooks\", \"shell\", \"ergonomics\"]\n    }\n  ]\n}\n",
        "README.md": "# Wildcard's Claude Code Plugin Marketplace\n\nOfficial marketplace for Wildcard's Claude Code plugins.\n\n## Available Plugins\n\n### shell-ergonomics-skills\n\nShell ergonomics plugin with AI-powered statusline, session tracking, intelligent summaries, and developer experience improvements.\n\n**Features:**\n- ✅ AI-Powered Statusline with 3-line display\n- ✅ Session Names auto-generated using Claude Haiku\n- ✅ AI Summaries based on actual work\n- ✅ Plan Tracking integrated with sessions\n- ✅ Tool Usage Display (top 3 tools per session)\n- ✅ Smart Caching with message-count invalidation\n- ✅ Intelligent Cleanup (threshold-based, 100MB)\n\n**Version:** 1.0.0\n**License:** MIT\n**Repository:** [wildcard/shell-ergonomics-skills](https://github.com/wildcard/shell-ergonomics-skills)\n\n## Installation\n\n### Step 1: Add the Marketplace\n\n```bash\n/plugin marketplace add wildcard/claude-marketplace\n```\n\nOr if you're using this from a different Git service:\n\n```bash\n/plugin marketplace add https://github.com/wildcard/claude-marketplace.git\n```\n\n### Step 2: Install Plugins\n\n```bash\n/plugin install shell-ergonomics-skills@wildcard\n```\n\n### Step 3: Configure Statusline (Optional)\n\nFor the shell-ergonomics-skills plugin, add to `~/.claude/settings.json`:\n\n```json\n{\n  \"statusLine\": {\n    \"type\": \"command\",\n    \"command\": \"bash ~/.claude/plugins/cache/shell-ergonomics-skills/skills/advanced-statusline/scripts/statusline-wrapper.sh\"\n  }\n}\n```\n\nThen restart Claude Code.\n\n## Requirements\n\nFor **shell-ergonomics-skills**:\n- [Starship](https://starship.rs/) - `brew install starship`\n- [jq](https://stedolan.github.io/jq/) - `brew install jq`\n- Claude Code CLI\n\n## Available Commands\n\nAfter installation:\n\n```bash\n# List all installed plugins\n/plugin list\n\n# Update a plugin\n/plugin update shell-ergonomics-skills@wildcard\n\n# Remove a plugin\n/plugin remove shell-ergonomics-skills@wildcard\n\n# List available marketplaces\n/plugin marketplace list\n```\n\n## Support\n\n- **Issues:** [GitHub Issues](https://github.com/wildcard/shell-ergonomics-skills/issues)\n- **Documentation:** [Plugin README](https://github.com/wildcard/shell-ergonomics-skills/blob/main/README.md)\n\n## License\n\nAll plugins in this marketplace are licensed under MIT unless otherwise specified.\n"
      },
      "plugins": [
        {
          "name": "shell-ergonomics-skills",
          "source": {
            "source": "github",
            "repo": "wildcard/shell-ergonomics-skills"
          },
          "description": "Shell ergonomics plugin: AI-powered statusline, session tracking, summaries, and developer experience tools",
          "version": "1.0.1",
          "author": {
            "name": "wildcard"
          },
          "license": "MIT",
          "keywords": [
            "statusline",
            "starship",
            "ai-summary",
            "hooks",
            "shell",
            "ergonomics"
          ],
          "categories": [
            "ai-summary",
            "ergonomics",
            "hooks",
            "shell",
            "starship",
            "statusline"
          ],
          "install_commands": [
            "/plugin marketplace add wildcard/claude-marketplace",
            "/plugin install shell-ergonomics-skills@wildcard"
          ]
        }
      ]
    }
  ]
}