{
  "author": {
    "id": "ygavrilov",
    "display_name": "Yevgeniy Gavrilov",
    "avatar_url": "https://avatars.githubusercontent.com/u/767658?u=940e0d78c0759e2cbc34f550915daea4d3eb997f&v=4"
  },
  "marketplaces": [
    {
      "name": "ygavrilov-marketplace",
      "version": null,
      "description": "A Claude Code plugin that adds the Skill Master skill — a guided assistant for creating and editing Claude Code skills with proper structure and frontmatter.",
      "repo_full_name": "ygavrilov/claude-code-marketplace",
      "repo_url": "https://github.com/ygavrilov/claude-code-marketplace",
      "repo_description": "Marketplace to distribute my plugins",
      "signals": {
        "stars": 0,
        "forks": 0,
        "pushed_at": "2026-02-10T07:55:04Z"
      },
      "files": {
        ".claude-plugin/marketplace.json": "{\n\t\"name\": \"ygavrilov-marketplace\",\n\t\"owner\": {\n\t\t\"name\": \"Yevgeniy Gavrilov\",\n\t\t\"email\": \"claude-code@gavrilov.kz\"\n\t},\n\t\"plugins\": [\n\t\t{\n\t\t\t\"name\": \"claude-code-skill-master-plugin\",\n\t\t\t\"source\": {\n\t\t\t\t\"source\": \"github\",\n\t\t\t\t\"repo\": \"ygavrilov/claude-code-skill-master-plugin\"\n\t\t\t},\n\t\t\t\"description\": \"A Claude Code plugin that adds the Skill Master skill — a guided assistant for creating and editing Claude Code skills with proper structure and frontmatter.\",\n\t\t\t\"version\": \"1.0.0\",\n\t\t\t\"author\": {\n\t\t\t\t\"name\": \"Yevgeniy Gavrilov\"\n\t\t\t}\n\t\t}\n\t]\n}\n",
        "README.md": "# Yevgeniy Gavrilov's Plugin Marketplace\n\nA Claude Code plugin marketplace featuring curated plugins for enhancing your Claude Code experience.\n\n## Available Plugins\n\n- **claude-code-skill-master-plugin** (v1.0.0) - A Claude Code plugin that adds the Skill Master skill — a guided assistant for creating and editing Claude Code skills with proper structure and frontmatter.\n\n## Installation\n\n### Step 1: Add the Marketplace\n\nAdd this marketplace to your Claude Code configuration:\n\n```\n/plugin marketplace add git@github.com:ygavrilov/claude-code-marketplace.git\n```\n\n### Step 2: Install a Plugin\n\nOnce the marketplace is added, install plugins from it:\n\n```\n/plugin install claude-code-skill-master-plugin@ygavrilov-marketplace\n```\n\n## Updates\n\n### What Happens When Skill Files Are Updated?\n\nWhen skill files in a plugin are updated in the repository, users need to update their installed plugins to get the latest changes.\n\n### How to Update Plugins\n\nUsers can update plugins in two ways:\n\n**Manual Update:**\n\n```\n/plugin update plugin-name@marketplace-name\n```\n\n**Interactive Update:**\n\n1. Run `/plugin`\n2. Go to the **Installed** tab\n3. Manage plugin updates from there\n\n### Auto-Updates\n\nThis marketplace has auto-update **disabled by default** for third-party marketplaces. Users can enable it manually:\n\n1. Run `/plugin`\n2. Go to the **Marketplaces** tab\n3. Select this marketplace\n4. Choose **Enable auto-update**\n\nWhen auto-update is enabled, Claude Code automatically:\n\n- Refreshes the marketplace at startup\n- Updates installed plugins from this marketplace automatically\n- Shows a notification to restart Claude Code if plugins were updated\n\n## About the Marketplace\n\nThis marketplace is powered by Claude Code's plugin distribution system. For more information about creating and distributing plugin marketplaces, see the [Create and distribute a plugin marketplace](https://github.com/claude-ai/claude-code-docs) documentation.\n\n## Author\n\nYevgeniy Gavrilov  \nEmail: claude-code@gavrilov.kz\n"
      },
      "plugins": [
        {
          "name": "claude-code-skill-master-plugin",
          "source": {
            "source": "github",
            "repo": "ygavrilov/claude-code-skill-master-plugin"
          },
          "description": "A Claude Code plugin that adds the Skill Master skill — a guided assistant for creating and editing Claude Code skills with proper structure and frontmatter.",
          "version": "1.0.0",
          "author": {
            "name": "Yevgeniy Gavrilov"
          },
          "categories": [],
          "install_commands": [
            "/plugin marketplace add ygavrilov/claude-code-marketplace",
            "/plugin install claude-code-skill-master-plugin@ygavrilov-marketplace"
          ]
        }
      ]
    }
  ]
}