{
  "author": {
    "id": "yudduy",
    "display_name": "duy",
    "avatar_url": "https://avatars.githubusercontent.com/u/69051948?v=4"
  },
  "marketplaces": [
    {
      "name": "duy-workflow",
      "version": null,
      "description": "Interview-driven spec generation and Ralph-powered autonomous execution",
      "repo_full_name": "yudduy/duy-workflow",
      "repo_url": "https://github.com/yudduy/duy-workflow",
      "repo_description": "personal cc skills",
      "signals": {
        "stars": 0,
        "forks": 0,
        "pushed_at": "2026-01-30T09:55:01Z"
      },
      "files": {
        ".claude-plugin/marketplace.json": "{\n  \"name\": \"duy-workflow\",\n  \"description\": \"Interview-driven spec generation and Ralph-powered autonomous execution\",\n  \"owner\": {\n    \"name\": \"yudduy\"\n  },\n  \"plugins\": [\n    {\n      \"name\": \"duy-workflow\",\n      \"description\": \"Interview-driven spec generation and Ralph-powered autonomous execution\",\n      \"version\": \"1.0.0\",\n      \"source\": \"./\"\n    }\n  ]\n}\n",
        ".claude-plugin/plugin.json": "{\n  \"name\": \"duy-workflow\",\n  \"version\": \"1.0.0\",\n  \"description\": \"Interview-driven spec generation and Ralph-powered autonomous execution. Two commands: /interview (deep questioning → SPEC.md) and /execute (Ralph loop → implementation).\",\n  \"author\": {\n    \"name\": \"yudduy\"\n  },\n  \"repository\": \"https://github.com/yudduy/duy-workflow\"\n}\n",
        "README.md": "# duy-workflow\n\nInterview-driven spec generation and Ralph-powered autonomous execution for Claude Code.\n\n## Installation\n\n### One-liner (Recommended)\n\n```bash\ngit clone https://github.com/yudduy/duy-workflow.git /tmp/duy-workflow && /tmp/duy-workflow/install.sh && rm -rf /tmp/duy-workflow\n```\n\nThen restart Claude.\n\n### Via Marketplace (may fail on some systems)\n\n```bash\n/plugin marketplace add yudduy/duy-workflow\n/plugin install duy-workflow@duy-workflow\n```\n\nNote: May fail with EXDEV error if `/home` and `/tmp` are on different filesystems. Use the one-liner above if this happens.\n\n### Development Mode\n\n```bash\nclaude --plugin-dir /path/to/duy-workflow\n```\n\n---\n\n## Commands\n\n| Command | Description |\n|---------|-------------|\n| `/duy-workflow:research` | Deep research with optional `--map` for mind map generation |\n| `/duy-workflow:interview` | Deep exploration + structured interview -> SPEC.md |\n| `/duy-workflow:execute` | Ralph-powered TDD implementation |\n| `/duy-workflow:commit-push-pr` | Quick commit, push, and PR creation |\n| `/duy-workflow:ralph-loop` | Raw Ralph loop (advanced) |\n| `/duy-workflow:cancel-ralph` | Cancel active loop |\n\n---\n\n## Quick Start\n\n### For research:\n\n```bash\n# Deep research on a topic\n/duy-workflow:research \"transformer architectures\"\n\n# Research with auto-generated mind map\n/duy-workflow:research \"transformer architectures\" --map\n```\n\n### For feature implementation:\n\n```bash\n# Step 1: Interview - explores codebase, asks structured questions, outputs SPEC.md\n/duy-workflow:interview\n\n# Step 2: Execute - Ralph loop implements the spec with TDD\n/duy-workflow:execute\n/duy-workflow:execute --max-iterations 50\n```\n\n### Quick commit workflow:\n\n```bash\n# Commit, push, and create PR in one command\n/duy-workflow:commit-push-pr\n/duy-workflow:commit-push-pr \"Add user authentication\"\n```\n\n---\n\n## The Workflow\n\n```\n┌─────────────────────────────────────────────────────────────────────┐\n│                                                                     │\n│   /research           →     /interview      →      /execute         │\n│   ──────────                ──────────            ─────────         │\n│   • Parallel agents         • Explore codebase    • Ralph loop      │\n│   • Web search              • AskUserQuestion     • Reads SPEC.md   │\n│   • KNOWLEDGE.md            • Web search          • TDD enforced    │\n│   • --map for MINDMAP.md    • Output: SPEC.md     • PROGRESS.md     │\n│                                                                     │\n└─────────────────────────────────────────────────────────────────────┘\n```\n\n## Multi-Agent Execution\n\n```bash\n# Set up isolated worktrees\n/duy-workflow:execute --agent-id 1\n/duy-workflow:execute --agent-id 2\n\n# Run in separate terminals\ncd .worktrees/agent-1 && claude  # then: /duy-workflow:execute\ncd .worktrees/agent-2 && claude  # then: /duy-workflow:execute\n```\n\n## Based On\n\n- **Ralph Wiggum technique** by Geoffrey Huntley - autonomous iteration via stop hooks\n- **Thariq's interview method** - deep spec generation via AskUserQuestionTool\n- **TDD enforcement** - no code without failing test\n\n## Learn More\n\n- [Ralph Wiggum](https://ghuntley.com/ralph/)\n- [Claude Code Plugins](https://code.claude.com/docs/en/plugins)\n"
      },
      "plugins": [
        {
          "name": "duy-workflow",
          "description": "Interview-driven spec generation and Ralph-powered autonomous execution",
          "version": "1.0.0",
          "source": "./",
          "categories": [],
          "install_commands": [
            "/plugin marketplace add yudduy/duy-workflow",
            "/plugin install duy-workflow@duy-workflow"
          ]
        }
      ]
    }
  ]
}