{
  "author": {
    "id": "yzlin",
    "display_name": "Ethan Lin",
    "avatar_url": "https://avatars.githubusercontent.com/u/82482?u=8a6c57b23a194a8802f2d51ef925b54b207c13c6&v=4"
  },
  "marketplaces": [
    {
      "name": "supaviber-marketplace",
      "version": null,
      "description": "SupaViber - Personal vibe coding toolkit with custom skills, agents, and commands for an optimized development environment",
      "repo_full_name": "yzlin/supaviber",
      "repo_url": "https://github.com/yzlin/supaviber",
      "repo_description": "SupaViber - Personal vibe coding toolkit with custom skills, agents, and commands for an optimized development environment",
      "signals": {
        "stars": 0,
        "forks": 0,
        "pushed_at": "2026-01-19T09:29:05Z"
      },
      "files": {
        ".claude-plugin/marketplace.json": "{\n  \"name\": \"supaviber-marketplace\",\n  \"owner\": {\n    \"name\": \"Ethan Lin\",\n    \"email\": \"yzlin1985@gmail.com\"\n  },\n  \"metadata\": {\n    \"description\": \"SupaViber - Personal vibe coding toolkit with custom skills, agents, and commands for an optimized development environment\",\n    \"version\": \"0.3.0\"\n  },\n  \"plugins\": [\n    {\n      \"name\": \"supaviber\",\n      \"source\": \"./\",\n      \"description\": \"Personal vibe coding toolkit - custom skills, agents, and commands for an optimized development environment\",\n      \"version\": \"0.3.0\",\n      \"author\": {\n        \"name\": \"Ethan Lin\",\n        \"url\": \"https://github.com/yzlin\"\n      },\n      \"homepage\": \"https://github.com/yzlin/supaviber\",\n      \"repository\": \"https://github.com/yzlin/supaviber\",\n      \"license\": \"MIT\",\n      \"keywords\": [\"productivity\", \"workflow\", \"automation\", \"vibe\"],\n      \"category\": \"productivity\"\n    }\n  ]\n}\n",
        ".claude-plugin/plugin.json": "{\n  \"name\": \"supaviber\",\n  \"version\": \"0.3.0\",\n  \"description\": \"Personal vibe coding toolkit - custom skills, agents, and commands for an optimized development environment\",\n  \"author\": {\n    \"name\": \"Ethan Lin\",\n    \"url\": \"https://github.com/yzlin\"\n  },\n  \"repository\": \"https://github.com/yzlin/supaviber\",\n  \"license\": \"MIT\",\n  \"keywords\": [\"productivity\", \"workflow\", \"automation\", \"vibe\"]\n}\n",
        "README.md": "# SupaViber\n\n> Your personal vibe coding toolkit - custom skills, agents, and commands for an optimized development environment\n\nSupaViber is a [Claude Code](https://claude.com/claude-code) plugin that helps you manage and share your custom development workflows, automation, and AI-powered tools. Build your ideal coding environment with reusable components.\n\n## What is SupaViber?\n\nSupaViber provides a structured way to organize and share:\n\n- **Skills** - AI workflows that Claude automatically uses based on context\n- **Agents** - Specialized subagents for specific tasks\n- **Commands** - User-invoked slash commands for common operations\n- **Hooks** - Event-driven automation that runs automatically\n\nWhether you're setting up a new machine or sharing your workflows with a team, SupaViber makes it easy to package and deploy your development environment.\n\n## Dual Compatibility: Claude Code + OpenAI Codex\n\nSupaViber skills follow the [Agent Skills open standard](https://agentskills.io), making them **fully compatible** with both:\n\n- **Claude Code** - Anthropic's AI coding assistant\n- **OpenAI Codex** - OpenAI's developer CLI\n\nWrite skills once, use them everywhere. All SupaViber skills are validated against the agent skills specification to ensure cross-platform compatibility.\n\n### Using SupaViber with Codex\n\nIn OpenAI Codex, skills can be:\n- **User-scoped**: `~/.codex/skills/` (available globally)\n- **Repo-scoped**: `.codex/skills/` (project-specific)\n\n**Install all skills for Codex:**\n\n```bash\n# Link skills (recommended - stays in sync)\nmkdir -p ~/.codex/skills\nfor skill in /path/to/supaviber/skills/*/; do\n  skill_name=$(basename \"$skill\")\n  if [ -f \"$skill/SKILL.md\" ]; then\n    ln -s \"$skill\" ~/.codex/skills/\"$skill_name\"\n  fi\ndone\n\n# Or copy skills\ncp -r /path/to/supaviber/skills/* ~/.codex/skills/\n```\n\nCodex will automatically discover and use these skills based on context.\n\n## Included Skills\n\nSupaViber comes with built-in skills ready to use:\n\n### Git Safety\n**`git-safety`** - Comprehensive git safety protocols for collaborative environments\n\nâœ“ Compatible with Claude Code and OpenAI Codex\n\n- ðŸ›¡ï¸ Prevents destructive operations (hard resets, force pushes) without explicit approval\n- ðŸš« Protects environment files (.env) from accidental modification\n- âš ï¸ Enforces safe commit practices with verification checklists\n- ðŸ¤ Coordinates file deletions and changes in team environments\n- âœ… Ensures explicit file paths and atomic commits\n\nClaude automatically applies these safety protocols when working with git commands and file operations.\n\n### Coding Standards\n**`coding-standards`** - Guide for writing clean, maintainable code following industry best practices\n\nâœ“ Compatible with Claude Code and OpenAI Codex\n\n- ðŸŽ¯ Applies SOLID principles and design patterns (DRY, composition over inheritance)\n- ðŸ“ Enforces single responsibility and clear function boundaries\n- ðŸ—ï¸ Promotes testable, extensible code architecture\n- ðŸ“ Ensures meaningful naming conventions and documentation\n- âœ¨ Includes self-review checklist and refactoring guidance\n- ðŸŒ Language-specific best practices for Python, TypeScript, Java, Go, Rust\n\nClaude uses this skill when writing or reviewing code to ensure consistency, readability, and long-term maintainability.\n\n## Installation\n\n### Install from Marketplace (Recommended)\n\nAdd the SupaViber marketplace and install the plugin:\n\n```bash\n/plugin marketplace add yzlin/supaviber\n/plugin install supaviber@supaviber-marketplace\n```\n\n### Install from GitHub\n\nDirect installation without marketplace:\n\n```bash\nclaude plugin install https://github.com/yzlin/supaviber\n```\n\n### Install Locally\n\nClone this repository and load it as a local plugin:\n\n```bash\ngit clone https://github.com/yzlin/supaviber.git\nclaude --plugin-dir ./supaviber\n```\n\n### Verify Installation\n\nCheck that the plugin is loaded:\n\n```bash\nclaude plugin list\n```\n\nYou should see `supaviber` in the list of active plugins.\n\n## Quick Start\n\n### 1. Add Your First Skill\n\nCreate a new skill directory with a `SKILL.md` file:\n\n```bash\nmkdir -p skills/my-workflow\n```\n\nCreate `skills/my-workflow/SKILL.md`:\n\n```markdown\n---\nname: my-workflow\ndescription: Describe when Claude should use this skill\n---\n\nYour skill instructions here...\n```\n\n### 2. Create a Slash Command\n\nAdd a command file to `commands/`:\n\n```bash\necho \"---\ndescription: Example command\n---\n\nDo something useful!\" > commands/example.md\n```\n\nUse it with: `/supaviber:example`\n\n### 3. Define a Custom Agent\n\nCreate `agents/my-agent.md`:\n\n```markdown\n---\ndescription: Specialized agent for X\ncapabilities: [\"capability1\", \"capability2\"]\n---\n\n# My Agent\n\nThis agent specializes in...\n```\n\n## Components\n\n### Skills (`skills/`)\n\nAgent Skills that Claude automatically invokes based on task context. Each skill is a subdirectory containing a `SKILL.md` file.\n\n**Structure:**\n```\nskills/\nâ””â”€â”€ skill-name/\n    â”œâ”€â”€ SKILL.md       # Required: skill definition\n    â””â”€â”€ reference.md   # Optional: additional context\n```\n\nSee [skills/README.md](skills/README.md) for detailed documentation.\n\n### Agents (`agents/`)\n\nCustom subagents with specialized capabilities. Each agent is defined in a markdown file.\n\n**Structure:**\n```\nagents/\nâ””â”€â”€ agent-name.md\n```\n\nSee [agents/README.md](agents/README.md) for detailed documentation.\n\n### Commands (`commands/`)\n\nUser-invoked slash commands. Filename becomes the command name (prefixed with `supaviber:`).\n\n**Structure:**\n```\ncommands/\nâ””â”€â”€ command-name.md    # Creates /supaviber:command-name\n```\n\nSee [commands/README.md](commands/README.md) for detailed documentation.\n\n### Hooks (`hooks/`)\n\nEvent-driven automation that triggers on Claude Code events like file changes, session start, etc.\n\n**Structure:**\n```\nhooks/\nâ””â”€â”€ hooks.json         # Hook configuration\n```\n\nSee [hooks/README.md](hooks/README.md) for detailed documentation.\n\n## Development\n\n### Adding Components\n\n1. **Skills**: Create a directory in `skills/` with a `SKILL.md` file\n2. **Agents**: Add a `.md` file to `agents/`\n3. **Commands**: Add a `.md` file to `commands/`\n4. **Hooks**: Edit `hooks/hooks.json` or create individual hook files\n\n### Testing Locally\n\nLoad the plugin in development mode:\n\n```bash\ncd supaviber\nclaude --plugin-dir .\n```\n\n### Validating Skills\n\nEnsure skills comply with the agent skills specification:\n\n```bash\n# Install dependencies (one-time)\nuv sync\n\n# Validate all skills\n./scripts/validate-skills.sh\n\n# Validate a specific skill\nuv run skills-ref validate ./skills/git-safety\n```\n\nAll skills are automatically validated against the [Agent Skills specification](https://agentskills.io/specification) to ensure cross-platform compatibility.\n\n### Project Structure\n\n```\nsupaviber/\nâ”œâ”€â”€ .claude-plugin/\nâ”‚   â””â”€â”€ plugin.json          # Plugin manifest\nâ”œâ”€â”€ skills/                   # Agent Skills\nâ”œâ”€â”€ agents/                   # Custom subagents\nâ”œâ”€â”€ commands/                 # Slash commands\nâ”œâ”€â”€ hooks/                    # Event automation\nâ”œâ”€â”€ scripts/                  # Utility scripts\nâ”œâ”€â”€ README.md                 # This file\nâ”œâ”€â”€ CHANGELOG.md              # Version history\nâ”œâ”€â”€ LICENSE                   # MIT license\nâ””â”€â”€ .gitignore               # Git ignore rules\n```\n\n## Contributing\n\nContributions are welcome! Here's how you can help:\n\n1. **Fork** this repository\n2. **Create** a feature branch: `git checkout -b feat/my-skill`\n3. **Add** your skill, agent, or command\n4. **Test** it works: `claude --plugin-dir .`\n5. **Commit** your changes: `git commit -m \"feat: add my awesome skill\"`\n6. **Push** to your fork: `git push origin feat/my-skill`\n7. **Submit** a pull request\n\n### Commit Convention\n\nWe use [Conventional Commits](https://www.conventionalcommits.org/):\n\n- `feat:` - New skills, agents, or commands\n- `fix:` - Bug fixes in existing components\n- `docs:` - Documentation updates\n- `chore:` - Maintenance tasks\n\n## Examples\n\n### Example: Code Review Skill\n\n```markdown\n# skills/code-review/SKILL.md\n---\nname: code-review\ndescription: Review code for best practices and potential issues\n---\n\nWhen reviewing code, check for:\n1. Code organization and structure\n2. Error handling\n3. Security concerns\n4. Test coverage\n5. Performance optimizations\n\nProvide specific feedback with line numbers.\n```\n\n### Example: Deploy Command\n\n```markdown\n# commands/deploy.md\n---\ndescription: Deploy the current project\n---\n\nCheck the deployment status and run the deployment process.\nProvide clear feedback on success or failure.\n```\n\n## License\n\nMIT License - see [LICENSE](LICENSE) file for details.\n\n## Links\n\n- [Claude Code Documentation](https://code.claude.com/docs)\n- [Plugin Development Guide](https://code.claude.com/docs/en/plugins.md)\n- [Report Issues](https://github.com/yzlin/supaviber/issues)\n\n---\n\n**Built with vibe** âœ¨\n"
      },
      "plugins": [
        {
          "name": "supaviber",
          "source": "./",
          "description": "Personal vibe coding toolkit - custom skills, agents, and commands for an optimized development environment",
          "version": "0.3.0",
          "author": {
            "name": "Ethan Lin",
            "url": "https://github.com/yzlin"
          },
          "homepage": "https://github.com/yzlin/supaviber",
          "repository": "https://github.com/yzlin/supaviber",
          "license": "MIT",
          "keywords": [
            "productivity",
            "workflow",
            "automation",
            "vibe"
          ],
          "category": "productivity",
          "categories": [
            "automation",
            "productivity",
            "vibe",
            "workflow"
          ],
          "install_commands": [
            "/plugin marketplace add yzlin/supaviber",
            "/plugin install supaviber@supaviber-marketplace"
          ]
        }
      ]
    }
  ]
}