{
  "author": {
    "id": "zeabur",
    "display_name": "Zeabur",
    "avatar_url": "https://avatars.githubusercontent.com/u/107748533?v=4"
  },
  "marketplaces": [
    {
      "name": "zeabur",
      "version": null,
      "description": "Zeabur CLI skills for deployment, template management, and troubleshooting",
      "repo_full_name": "zeabur/zeabur-claude-plugin",
      "repo_url": "https://github.com/zeabur/zeabur-claude-plugin",
      "repo_description": "Claude Code plugin for Zeabur CLI operations, deployment, and troubleshooting.",
      "signals": {
        "stars": 7,
        "forks": 1,
        "pushed_at": "2026-02-21T03:09:59Z"
      },
      "files": {
        ".claude-plugin/marketplace.json": "{\n  \"name\": \"zeabur\",\n  \"owner\": {\n    \"name\": \"Zeabur\"\n  },\n  \"metadata\": {\n    \"description\": \"Zeabur CLI skills for deployment, template management, and troubleshooting\"\n  },\n  \"plugins\": [\n    {\n      \"name\": \"zeabur\",\n      \"source\": \"./\",\n      \"description\": \"Zeabur CLI skills for deployment, template management, and troubleshooting\"\n    }\n  ]\n}\n",
        ".claude-plugin/plugin.json": "{\n  \"name\": \"zeabur\",\n  \"description\": \"Zeabur CLI skills for deployment, template management, and troubleshooting\",\n  \"version\": \"1.0.0\",\n  \"author\": {\n    \"name\": \"Can\"\n  },\n  \"repository\": \"https://github.com/zeabur/zeabur-claude-plugin\",\n  \"license\": \"MIT\",\n  \"keywords\": [\"zeabur\", \"deployment\", \"cli\", \"templates\", \"troubleshooting\"]\n}\n",
        "README.md": "# Zeabur Claude Plugin\n\nClaude Code plugin for Zeabur CLI operations, deployment, and troubleshooting.\n\n## Installation\n\nIn Claude Code, run:\n\n```\n/plugin marketplace add zeabur/zeabur-claude-plugin\n/plugin install zeabur@zeabur\n```\n\nOr test locally:\n\n```bash\nclaude --plugin-dir /path/to/zeabur-claude-plugin\n```\n\n## Skills\n\n| Skill | Description | Use When |\n|-------|-------------|----------|\n| `zeabur-context` | Configure Zeabur CLI project context | Commands return wrong project's services or context errors |\n| `zeabur-deployment-logs` | View and filter service logs | Checking logs or seeing env-id required errors |\n| `zeabur-domain-url` | Handle service domain and URL configuration | Services need public URLs or trailing slash issues |\n| `zeabur-migration` | Resolve database migration blocking issues | Service stuck \"Waiting for migrations\" |\n| `zeabur-port-mismatch` | Fix proxy connection issues from port mismatches | Proxy shows dial tcp timeout or connection refused |\n| `zeabur-project-create` | Create new Zeabur projects | Creating a new project or deploying templates |\n| `zeabur-restart` | Restart individual services | Restarting services or --env-id required error |\n| `zeabur-service-list` | List all services and get service IDs | Needing service IDs or checking existing services |\n| `zeabur-startup-order` | Fix connection errors from startup order | Service fails with connection refused to database/redis |\n| `zeabur-template` | Template knowledge base for creating, validating, and troubleshooting | Creating or editing Zeabur template YAML, converting docker-compose |\n| `zeabur-template-backup` | Backup templates to git repository | Saving a template locally with standardized format |\n| `zeabur-template-deploy` | Deploy templates via CLI | Automating template deployments |\n| `zeabur-update-service` | Update service config without full redeploy | Modifying env vars or updating single service |\n| `zeabur-variables` | Manage environment variables via CLI | Managing env vars or handling empty variable issues |\n\n## License\n\nMIT\n"
      },
      "plugins": [
        {
          "name": "zeabur",
          "source": "./",
          "description": "Zeabur CLI skills for deployment, template management, and troubleshooting",
          "categories": [],
          "install_commands": [
            "/plugin marketplace add zeabur/zeabur-claude-plugin",
            "/plugin install zeabur@zeabur"
          ]
        }
      ]
    }
  ]
}